id,created_utc,title,selftext,full_link,score,comments
7iadrv,1512687812,"BTC up ETH down, time to buy ETH? I’m thinking so!",<not selftext available>,https://www.reddit.com/r/ethereum/comments/7iadrv/btc_up_eth_down_time_to_buy_eth_im_thinking_so/,1,1
7iae36,1512687892,Stuck in pending,Accidentally tried to move some tokens with my normal fee and they’re stuck now for ~12 hours. Never had this happen before so will they eventually bounce back to MEW? Or must they stay pending until they get picked up?\n\n,https://www.reddit.com/r/ethereum/comments/7iae36/stuck_in_pending/,0,4
7iae5t,1512687912,Made a transaction fee a while ago and still cant locate tx hash?,I send some eth from cex to bitfinex afew hours ago and when I click on the hash it says unable to locate it? should I be worried?,https://www.reddit.com/r/ethereum/comments/7iae5t/made_a_transaction_fee_a_while_ago_and_still_cant/,0,3
7iaeqm,1512688049,One of the Largest Stock Exchanges in the World to Integrate Blockchain,,https://www.reddit.com/r/ethereum/comments/7iaeqm/one_of_the_largest_stock_exchanges_in_the_world/,2,0
7iahd2,1512688697,Best place to buy?,[removed],https://www.reddit.com/r/ethereum/comments/7iahd2/best_place_to_buy/,1,1
7iaho5,1512688769,"For people who live in CANADA 🇨🇦 or using CAD to buy coins,, Are you using Coinbase, Kraken or somthing else??",<not selftext available>,https://www.reddit.com/r/ethereum/comments/7iaho5/for_people_who_live_in_canada_or_using_cad_to_buy/,1,0
7iajc6,1512689190,Gems Modules: Open-Source Reusable Interfaces,,https://www.reddit.com/r/ethereum/comments/7iajc6/gems_modules_opensource_reusable_interfaces/,5,5
7iamow,1512690062,Nick Szabo's Global Financial Access has arrived!,[removed],https://www.reddit.com/r/ethereum/comments/7iamow/nick_szabos_global_financial_access_has_arrived/,1,0
7iann4,1512690317,Can someone please help me get this Wallet to Sync?,[removed],https://www.reddit.com/r/ethereum/comments/7iann4/can_someone_please_help_me_get_this_wallet_to_sync/,1,0
7iaofc,1512690517,A Decentralised Embeddable Video Player,,https://www.reddit.com/r/ethereum/comments/7iaofc/a_decentralised_embeddable_video_player/,1,0
7iapap,1512690743,Can someone tell me if my transaction went through ?,I know the blockchain is clogged atm. I just want to know if my funds will move or not.\n\nI've sent my ETH to my exchange and I haven't received it. It's been a few hours (8 hours +). When I look at my wallet: https://etherscan.io/address/0xa87dbd0d7f883d37a37432e1912ef5208c42c88f\nI still have the whole balance. And I can't seem to see the sent transaction. \nIs there a way that the OUT tx to the exchange never got accepted? If so how can I know what my balance is?,https://www.reddit.com/r/ethereum/comments/7iapap/can_someone_tell_me_if_my_transaction_went_through/,0,0
7iapyg,1512690925,Petition to keep ethereum at 420$,[deleted],https://www.reddit.com/r/ethereum/comments/7iapyg/petition_to_keep_ethereum_at_420/,0,0
7iaqfm,1512691050,What big companies are using Ethereum?,"I know that there is something called the Enterprise Ethereum Alliance, which is a partnership of big corporations; however, I wasn't able to find anything that suggested these corporations have actually used the blockchain network yet. ",https://www.reddit.com/r/ethereum/comments/7iaqfm/what_big_companies_are_using_ethereum/,0,3
7iasak,1512691539,Build Your First Smart Contract: For Beginners,,https://www.reddit.com/r/ethereum/comments/7iasak/build_your_first_smart_contract_for_beginners/,47,8
7iatb5,1512691810,Has Vitalik/community decided upon the distribution rate or final amount of ether in total to be issued?,[removed],https://www.reddit.com/r/ethereum/comments/7iatb5/has_vitalikcommunity_decided_upon_the/,1,0
7iau6l,1512692007,Blockmason: learn about our vision and mission in this post.,,https://www.reddit.com/r/ethereum/comments/7iau6l/blockmason_learn_about_our_vision_and_mission_in/,0,3
7iau8t,1512692024,"We are all going to be in the money, once Siri knows how to recognize the word Ethereum",,https://www.reddit.com/r/ethereum/comments/7iau8t/we_are_all_going_to_be_in_the_money_once_siri/,1,0
7iayki,1512693169,Transaction not confirming,<not selftext available>,https://www.reddit.com/r/ethereum/comments/7iayki/transaction_not_confirming/,1,0
7iazlh,1512693445,Eth Classic's Biggest Marketer Just Ragequit,,https://www.reddit.com/r/ethereum/comments/7iazlh/eth_classics_biggest_marketer_just_ragequit/,199,91
7ib3ct,1512694437,I have a question regarding proof of stake in Ethereum and thought the ETH brainiacs could resolve my question,[deleted],https://www.reddit.com/r/ethereum/comments/7ib3ct/i_have_a_question_regarding_proof_of_stake_in/,0,3
7ib50r,1512694906,"Newb, Just a bit lost","So, I started with Nanopool and coinbase this past weekend, but just recently found  (https://www.reddit.com/r/EtherMining/wiki/wallets/typesofwallets).\nAm I wrong for using coinbase and I should start over and use ethereum wallet? Right now it is downloading some blocks.\nHalp\nThanks",https://www.reddit.com/r/ethereum/comments/7ib50r/newb_just_a_bit_lost/,0,9
7ib59k,1512694964,ETC is NOT Coming ... it's failing and its dangerous,,https://www.reddit.com/r/ethereum/comments/7ib59k/etc_is_not_coming_its_failing_and_its_dangerous/,67,20
7ib5sc,1512695113,Why can't I broadcast a transaction no matter what I set as the transaction fee?,[deleted],https://www.reddit.com/r/ethereum/comments/7ib5sc/why_cant_i_broadcast_a_transaction_no_matter_what/,0,1
7ib83p,1512695722,Running an Ethereum node for development?,<not selftext available>,https://www.reddit.com/r/ethereum/comments/7ib83p/running_an_ethereum_node_for_development/,1,0
7ib9pc,1512696166,"Sent a transaction with a low fee using JAXX, and it's still spending after 20 hours. What can I do?",[deleted],https://www.reddit.com/r/ethereum/comments/7ib9pc/sent_a_transaction_with_a_low_fee_using_jaxx_and/,0,3
7ibakr,1512696416,Running an Ethereum node for development?,I'm a developer looking to run a full Ethereum node. I want to be able to check balances and verify/send transactions and other fun stuff. \n\nWhat's the best way of doing this using either Python or Javascript/Node.js?\n\nThe closest thing I could find while googling is [pyethapp](https://github.com/ethereum/pyethapp). However its development is lagging behind by a couple of years and others elsewhere have recommended not to use it in production.\n\nNote: I'm not just looking to create smart contracts. What I want to do is more akin to replicating the backend of a site such as etherscan.io,https://www.reddit.com/r/ethereum/comments/7ibakr/running_an_ethereum_node_for_development/,6,4
7ibarf,1512696468,"Beginners Guide to Bitcoin, Ethereum, and Bitcoin Cash",,https://www.reddit.com/r/ethereum/comments/7ibarf/beginners_guide_to_bitcoin_ethereum_and_bitcoin/,0,2
7ibb1r,1512696544,Having a problem with MEW,"My MEW has all my coins showing and have .5 eth in there. Everytime I try to do a transaction I put in the ID# at the bottom of the screen and check and says TXID cannot be found on block chain. I tried to move some stuff on etherdelta the other day and it gave me these question marks for orders in the tab. Also, etherdelta give me a warning about not enough etherium in my wallet, when I have .5 eth. Everytime I look at etherscan it looks like I have a pending transaction from just recently like 10 mins ago, everytime I look. Could I have a problem here?",https://www.reddit.com/r/ethereum/comments/7ibb1r/having_a_problem_with_mew/,0,3
7ibbax,1512696617,have a laugh during this bloodbath :-),[deleted],https://www.reddit.com/r/ethereum/comments/7ibbax/have_a_laugh_during_this_bloodbath/,1,0
7ibdsn,1512697294,cheers me up during this bloodbath. the bitcoin bubble song :-),[deleted],https://www.reddit.com/r/ethereum/comments/7ibdsn/cheers_me_up_during_this_bloodbath_the_bitcoin/,1,0
7ibhrn,1512698391,"Lunyr Dev Update — December 7, 2017 — LUN are now useable on the Lunyr platform! The next steps…",,https://www.reddit.com/r/ethereum/comments/7ibhrn/lunyr_dev_update_december_7_2017_lun_are_now/,0,1
7ibilg,1512698600,ETH Gas Station Adaptive Gas Price Oracle is now open source- please help improve it and get people better gas prices,,https://www.reddit.com/r/ethereum/comments/7ibilg/eth_gas_station_adaptive_gas_price_oracle_is_now/,136,25
7ibjzz,1512698981,Why is Ethereum roughly $15 less on Bittrex than it is on GDAX?,<not selftext available>,https://www.reddit.com/r/ethereum/comments/7ibjzz/why_is_ethereum_roughly_15_less_on_bittrex_than/,0,3
7ibm72,1512699595,HELP,I started mining with claymore and using a ethermine.org pool and when i start mining my GPU is capped out at 16 percent load and i get very few shares is there a fix for this? I'm mining with a 580,https://www.reddit.com/r/ethereum/comments/7ibm72/help/,0,1
7ibodu,1512700211,Due to Ethereum network overload the DES tokens and ETH related transactions are executed with delay,,https://www.reddit.com/r/ethereum/comments/7ibodu/due_to_ethereum_network_overload_the_des_tokens/,1,0
7ibpon,1512700558,ELI5: Why higher hashrates won't speed up the network &amp; raising gas limit will.,"With the network being tested over these last few days due to the abundance of these FREAKIN CATS, It raises some questions in my (admittedly only acceptable) understanding of the network.\n\n1. Why won't higher hashrates speed up the network? Would more hashes mean more authentications and thus more transactions?\n\n2. Raising the gas limit would mean miners could get a higher payout for each mined block, but it's not like miners are just sitting there waiting to get paid more... are they? So how would raising the gas limit help?",https://www.reddit.com/r/ethereum/comments/7ibpon/eli5_why_higher_hashrates_wont_speed_up_the/,8,2
7ibr19,1512700940,[Help] I lost my wallet when upgrading from mist to Ethereum wallet,"I still have the wallet file from the keystore but I can't get it to import into the new Ethereum Wallet, any tips -- or is it gone forever?",https://www.reddit.com/r/ethereum/comments/7ibr19/help_i_lost_my_wallet_when_upgrading_from_mist_to/,8,2
7ibvp2,1512702246,I made a new ETH bottle opener the hodls bottle caps. What do you think?,[deleted],https://www.reddit.com/r/ethereum/comments/7ibvp2/i_made_a_new_eth_bottle_opener_the_hodls_bottle/,1,1
7ibxnv,1512702820,any thoughts on why the price of ether isn't moving with bitcoin,[removed],https://www.reddit.com/r/ethereum/comments/7ibxnv/any_thoughts_on_why_the_price_of_ether_isnt/,0,9
7ibyp3,1512703119,I screwed up and sent $2600 in ETH to an ETC address on Bittrex. Bittrex will not help for a transaction less than $5000 in value. Can anyone provide more welcome information about recovering these funds?,[removed],https://www.reddit.com/r/ethereum/comments/7ibyp3/i_screwed_up_and_sent_2600_in_eth_to_an_etc/,1,0
7ibyva,1512703165,Upvote this picture of Ethereum so it shows up when people search for Bitcoin,,https://www.reddit.com/r/ethereum/comments/7ibyva/upvote_this_picture_of_ethereum_so_it_shows_up/,1,0
7ibzgi,1512703336,Sending ETH to Bittrex,"Hello, I've send 1.3 ETH to my Bittrex wallet, but it's not arriving. I'm waiting since 20 min. I've used a lot of gas ( 0.001115703 Ether ($0.46) ) and I'm already having 85 confirmations.\n\nWhat happened? ",https://www.reddit.com/r/ethereum/comments/7ibzgi/sending_eth_to_bittrex/,0,7
7ic5h2,1512704945,My wife made me a Christmas tree. Believe in Ether's future. Hodl for a Christmas miracle!,[deleted],https://www.reddit.com/r/ethereum/comments/7ic5h2/my_wife_made_me_a_christmas_tree_believe_in/,1,1
7ic5pl,1512704991,What is being done to help Eth scale,"If cats can do this, how will mass adoption and %insert next craze on the Eth network% work? There needs to be a solution implemented.",https://www.reddit.com/r/ethereum/comments/7ic5pl/what_is_being_done_to_help_eth_scale/,0,6
7ic5yc,1512705049,Out of gas no roll back more than 2 days red negative balance in my Ledger nano S,<not selftext available>,https://www.reddit.com/r/ethereum/comments/7ic5yc/out_of_gas_no_roll_back_more_than_2_days_red/,1,0
7ic7i0,1512705383,Problems sending ethereum from cex.io to binance,[removed],https://www.reddit.com/r/ethereum/comments/7ic7i0/problems_sending_ethereum_from_cexio_to_binance/,1,0
7ic8su,1512705662,See Ether and other on - A Guide to the Top 25 Cryptocurrencies,[deleted],https://www.reddit.com/r/ethereum/comments/7ic8su/see_ether_and_other_on_a_guide_to_the_top_25/,1,0
7icbtq,1512706321,See Ether and others on - A Guide to the Top 25 Cryptocurrencies,,https://www.reddit.com/r/ethereum/comments/7icbtq/see_ether_and_others_on_a_guide_to_the_top_25/,0,0
7icbxv,1512706346,How much gas does it take to buy a crypto kitty?! (out of gas error),I keep setting it what I believe it's telling me to right?:\n\ngas limit: 22000\n\ngas price: 40\n\nIs this not enough because its costing me around $3 every time I try to buy and it keeps saying out of gas.\n\nhttps://etherscan.io/tx/0x4b5500ed16cc36cf96121c26be4466d648ad64f4ea7398a0c2b99ab5e67c47f2\n,https://www.reddit.com/r/ethereum/comments/7icbxv/how_much_gas_does_it_take_to_buy_a_crypto_kitty/,0,2
7icfic,1512707212,Transaction failed - not enough gas?,"I tried sending some Kybers to the exchanges, but my transactions keep failing. My friend sent some of his Waltons for a lot less. What's the issue here?\n\nGas Limit: 42000 \nGas Used By Txn: 42000 \nGas Price: 0.00000005 Ether (50 Gwei)\n",https://www.reddit.com/r/ethereum/comments/7icfic/transaction_failed_not_enough_gas/,0,2
