id,created_utc,title,selftext,full_link,score,comments
7in10k,1512830174,When I'm mining none of my stats are at 100%. Is this normal?,,https://www.reddit.com/r/ethereum/comments/7in10k/when_im_mining_none_of_my_stats_are_at_100_is/,1,1
7in1fe,1512830329,Official ethereum wallet tutorial request,[removed],https://www.reddit.com/r/ethereum/comments/7in1fe/official_ethereum_wallet_tutorial_request/,1,0
7in3m1,1512831036,Blockchain charity fundraising?,"I'm having a little trouble organizing my thoughts ATM, but my TL;DR is basically:  can a noob set up a trustless charity smart contract?\n\nDetailed version.  A coworker/friend of mine was killed on the job last night.  His wife and 3-year-old son are emotionally devastated, I'm sure, but financially as well.  I am not well situated to console his wife, but I could perhaps organize financial support.\n\nJust yesterday, on my way home from work, I heard another warning on the radio about false charities and untrustworthy donation takers.  It confronts me with the question:  how can I offer trust and transparency to those who must choose between donating to this cause over another?  I've been reading a lot about Ethereum lately, and a smart contract on the blockchain sounded like a perfect solution.\n\nI just deleted a whole paragraph that basically said:  I don't know what I'm doing, and I'm no programmer.  I've searched this sub a bit and found a reference to giveth.io, but it doesn't appear they're ready to start campaigns yet.  Am I wrong on that?  Are there any other prebaked blockchain services ready?  Any other thoughts I should entertain?",https://www.reddit.com/r/ethereum/comments/7in3m1/blockchain_charity_fundraising/,2,5
7in40n,1512831177,Buying Eth as an Iranian,[removed],https://www.reddit.com/r/ethereum/comments/7in40n/buying_eth_as_an_iranian/,1,0
7in45u,1512831227,Trying to understand Ethereum and the economics of the 24th century world in Star Trek.,,https://www.reddit.com/r/ethereum/comments/7in45u/trying_to_understand_ethereum_and_the_economics/,33,5
7in4dg,1512831306,Wtf is gas and why do I keeping seeing it everywhere?,I've heard about ethereal for a while and yesterday started trying to learn about it. As far as I can tell there are few comprehensive resources for learning.,https://www.reddit.com/r/ethereum/comments/7in4dg/wtf_is_gas_and_why_do_i_keeping_seeing_it/,1,13
7in4qj,1512831427,Q re how smart contracts works,[removed],https://www.reddit.com/r/ethereum/comments/7in4qj/q_re_how_smart_contracts_works/,1,0
7in4yv,1512831507,Send ETH from MEW -&gt; Binance,[removed],https://www.reddit.com/r/ethereum/comments/7in4yv/send_eth_from_mew_binance/,1,0
7in7ps,1512832351,The biggest problem i see with Bitcoin/Cryptocurrencies. I forgot to mention Bitcoin Futures - who will be the next George Soros of Bitcoin?,,https://www.reddit.com/r/ethereum/comments/7in7ps/the_biggest_problem_i_see_with/,4,14
7in7sb,1512832381,Is Ethereum dying ?,<not selftext available>,https://www.reddit.com/r/ethereum/comments/7in7sb/is_ethereum_dying/,1,0
7in9hv,1512832912,Can Ethereum make more of itself or is there a limited supply like Bitcoin?,Been in the crypto game for a short time and I was curious about this. Couldn't find the answer on google so I thought you fine people might be of some help. Also if it isn't why not? ,https://www.reddit.com/r/ethereum/comments/7in9hv/can_ethereum_make_more_of_itself_or_is_there_a/,16,20
7ineam,1512834011,How could this address be stealing and hacking tokens everyday and no one has stopped him yet? *hacker*,https://ethplorer.io/address/0x645092d78e90cedf54129b348f1b53c4a1eea5d5\n\nthis is the address. as you can seee he is stealing and hacking everyday and no one stops him. he stole 130 bitquence from me 1 month ago and he is still doing buisnsess..incredible. Anyone here has contact with cyber police or something? I will pay 25% of my stolen tokens if anyone is able to bring them back,https://www.reddit.com/r/ethereum/comments/7ineam/how_could_this_address_be_stealing_and_hacking/,0,13
7infug,1512834451,What is a good gas limit?,I'm putting a little bit ETH from MEW to bittrex and since im sorta new I'm wondering what would be a good gas limit to set for transaction to be fast\nthanks,https://www.reddit.com/r/ethereum/comments/7infug/what_is_a_good_gas_limit/,3,3
7inioe,1512835278,"Noob question: I have been using Mist for several months, can I switch my same wallet over to Exodus?",[deleted],https://www.reddit.com/r/ethereum/comments/7inioe/noob_question_i_have_been_using_mist_for_several/,1,0
7iniqb,1512835296,"Indorse Dev Update - Dec 9, 2017 📰 - Bighcain setup on a multi-node environment - Profile timeline visualization - Integration of Airbitz as a signup and login mechanism on Indorse - Creating a model for prevention of Sybil attacks",[deleted],https://www.reddit.com/r/ethereum/comments/7iniqb/indorse_dev_update_dec_9_2017_bighcain_setup_on_a/,1,0
7inj60,1512835408,MEW ERROR HOW TO FIX? trying to send erc20 token ..thanks in advance!,<not selftext available>,https://www.reddit.com/r/ethereum/comments/7inj60/mew_error_how_to_fix_trying_to_send_erc20_token/,1,0
7ink8a,1512835707,Korea as an indicator for US prices of ETH,[removed],https://www.reddit.com/r/ethereum/comments/7ink8a/korea_as_an_indicator_for_us_prices_of_eth/,1,1
7inq0u,1512837349,Why store offline if Coinbase insures your holdings?,"I personally don't trust myself, so why not trust Coinbase whose insured?",https://www.reddit.com/r/ethereum/comments/7inq0u/why_store_offline_if_coinbase_insures_your/,56,85
7inv77,1512838739,Moscow’s Ethereum Voting System *LAUNCHES* !,,https://www.reddit.com/r/ethereum/comments/7inv77/moscows_ethereum_voting_system_launches/,1,0
7inw97,1512839010,What industries will ETH revolutionize?,So I was having a discussion with my father and I was struggling to find examples of industries that ether can revolutionize in the next 2-4 years.\n\nSo all I know is that ETH is the perfect solution for anything that will requiere a TRANSACTION and an AUTOMIZED PROCESS (aka runable code) . \n\nThe only example I can come up with for now is that it will provide the needed transparency and legitimacy to the online casino businesses.\n\nCould you guys help me with some other real-world uses for ether? ,https://www.reddit.com/r/ethereum/comments/7inw97/what_industries_will_eth_revolutionize/,9,10
7inyj0,1512839604,"Ethereum Smart Contract - Transactions with a CANCELLED status ""Value transfer did not complete most likely as a result of a REVRT opcode""",[removed],https://www.reddit.com/r/ethereum/comments/7inyj0/ethereum_smart_contract_transactions_with_a/,1,0
7inz51,1512839766,Ether stuck in Etherdelta address,"Hey! I wanted to buy some REQ yesterday, like 20h ago. I made a new wallet address on Etherdelta site and transferred some funds there. This was alright. But then I was not able to transfer those funds from the wallet to the Etherdelta address that is meant for trading. Tried depositing a few times but kept getting different errors - one saying that I must not have enough Ether for gas or just there is nothing to transfer. The other showed that the transaction will happen but nothing actually happened. I thought that this system should fuck itself and logged on MEW with the address I had created on Etherdelta in order to transfer the funds back to my personal wallet. No, could not do it. Out of the 20 times I have tried it, it has once appeared on Etherscan as a transaction in progress but has since just disappeared. I hate this shitty kittycoin so very much!\n\nAny ideas? Yes, I have been looking around and seen similar problems but no solutions so far. Also, nothing identical to mine.",https://www.reddit.com/r/ethereum/comments/7inz51/ether_stuck_in_etherdelta_address/,2,3
7inzi3,1512839861,Just browsed r/coinbase and am feeling sick to my stomach. Is there a better exchange where I can get out fiat?,,https://www.reddit.com/r/ethereum/comments/7inzi3/just_browsed_rcoinbase_and_am_feeling_sick_to_my/,1,15
7inzyt,1512839992,Coinbase Sprints Past All Other Apps and Becomes Most Downloaded App on Apple's App Store,,https://www.reddit.com/r/ethereum/comments/7inzyt/coinbase_sprints_past_all_other_apps_and_becomes/,1,0
7io3gp,1512840939,"The District Weekly - December 9th, 2017 – district0x",,https://www.reddit.com/r/ethereum/comments/7io3gp/the_district_weekly_december_9th_2017_district0x/,42,1
7io3zd,1512841086,"Hello Ethereum Community, We are a London based start-up working on a compelling new crypto currency project. Please click the link and fill in our online form. Much appreciated, YM!",,https://www.reddit.com/r/ethereum/comments/7io3zd/hello_ethereum_community_we_are_a_london_based/,1,0
7io40b,1512841092,Is infura having issues right now?,"Their status page says their servers are fine, but I'm frequently getting empty responses when I try to call getBlockNumber.\n\nhttps://api.infura.io/v1/jsonrpc/mainnet/eth_blockNumber",https://www.reddit.com/r/ethereum/comments/7io40b/is_infura_having_issues_right_now/,11,1
7io5cm,1512841445,"User friendly gas pricing: in multiples of a ""standard transfer""","This thread is a good reminder of how difficult gas pricing is for beginners:\nhttps://www.reddit.com/r/ethereum/comments/7ikkwj/comment/dqzm3w5\n\nWhat if we change common interfaces to quote gas prices in mEth per standard transfer (21k gas).\n\nSo a UI might display a cost of 0.21 mEth per transfer (aka 10 Gwei). Simple transfers require no gas mechanics to understand, it will only cost 0.00021 eth. For transactions that invoke long contract code, the gas estimate might say: ""This is expected to cost as much as roughly 11 transfers.""  (aka 231000 gas, or 2.31 mEth)\n\nThis gives people a tangible anchor for gas costs, versus the abstract idea of 1 gas unit, plus the need to comprehend that 10 Gwei = 10 nanoeth, and its ramifications.",https://www.reddit.com/r/ethereum/comments/7io5cm/user_friendly_gas_pricing_in_multiples_of_a/,5,3
7ioala,1512842800,What is/how does it work: gas and gwei?,[removed],https://www.reddit.com/r/ethereum/comments/7ioala/what_ishow_does_it_work_gas_and_gwei/,1,0
7ioanu,1512842820,So I have to pay gas to have a miner put my transaction in the block?,[removed],https://www.reddit.com/r/ethereum/comments/7ioanu/so_i_have_to_pay_gas_to_have_a_miner_put_my/,1,0
7iob2y,1512842929,Why Bitcoin Futures is terrible for the Future of Bitcoin,,https://www.reddit.com/r/ethereum/comments/7iob2y/why_bitcoin_futures_is_terrible_for_the_future_of/,0,20
7ioc0s,1512843197,Will Ethereum have the same energy consumption problem that Bitcoin is having?,,https://www.reddit.com/r/ethereum/comments/7ioc0s/will_ethereum_have_the_same_energy_consumption/,1,0
7iocwp,1512843434,ELI5 - PRICE CORRECTIONS,Could someone please explain to me what price corrections are? How is it done? ,https://www.reddit.com/r/ethereum/comments/7iocwp/eli5_price_corrections/,0,3
7iod7e,1512843517,ERC721 Fungibility,Can any individual ERC721 token have its metadata altered by the smart contract with information from an oracle?,https://www.reddit.com/r/ethereum/comments/7iod7e/erc721_fungibility/,3,1
7ioffi,1512844112,Block metrics &amp; Evaluation optimization,\nAre there metrics published regarding how long it takes to prepare a block?  I am guessing it is in the range of 2-4 seconds given the uncle rates and tiny block sizes.\n\nAre there ongoing efforts to parallelize and reduce per-block preparation times?\n\nAre there any efforts underway to understand how well the actual op-code gas costs map to real world evaluation costs?\n\nThanks!\n,https://www.reddit.com/r/ethereum/comments/7ioffi/block_metrics_evaluation_optimization/,2,0
7iog76,1512844329,What's your favorite illustrative smart contract example?,"A lot of us have probably been in the position of explaining how Ethereum is different than Bitcoin. Giving an example of a smart contract is helpful for people to wrap their mind around the function and benefit. Ideally, the example is brief, relatable, and economically rational. Anyone have a good example?\n\nOne I've used before is: ""Imagine you want to bet on the weather tomorrow. You could write a contract that receives 1 ETH from both you and your friend, waits until tomorrow to check the weather via some API, and then sends you the 2 ETH if it's sunny and sends your friend the 2 ETH if it's cloudy.""\n\nI'm sure you cats and kittens can do better!\n",https://www.reddit.com/r/ethereum/comments/7iog76/whats_your_favorite_illustrative_smart_contract/,18,13
7iogqx,1512844472,help please with cryptokitties (beginner),[removed],https://www.reddit.com/r/ethereum/comments/7iogqx/help_please_with_cryptokitties_beginner/,1,0
7iohxt,1512844796,Will there be a way to put my will on a smart contract and have funds automatically distributed to my families wallets? Are there any projects working on this in particular?,[removed],https://www.reddit.com/r/ethereum/comments/7iohxt/will_there_be_a_way_to_put_my_will_on_a_smart/,1,0
7ioizz,1512845099,"Need a #smartcontract for an auction - 10 highest bids win the thing - losing bids get 99% refunded, 1% goes to a charity of something?",,https://www.reddit.com/r/ethereum/comments/7ioizz/need_a_smartcontract_for_an_auction_10_highest/,0,2
7ioken,1512845482,"Werstern Union/ Moneygam/ Bank &amp; PayPal Transfers worldwide, Since 2011 (http://www.money-easy.tk) )!!!",[removed],https://www.reddit.com/r/ethereum/comments/7ioken/werstern_union_moneygam_bank_paypal_transfers/,1,0
7ion0t,1512846209,Cryptokitties Dead Already?,Just had 1 block confirmation in less than a minute for $0.53. Those kitties don't have 9 lives huh?,https://www.reddit.com/r/ethereum/comments/7ion0t/cryptokitties_dead_already/,5,14
7iongv,1512846326,Restoring a wallet contract,[deleted],https://www.reddit.com/r/ethereum/comments/7iongv/restoring_a_wallet_contract/,1,0
7iopw8,1512846987,"I spent the last few months of my free time creating Mooney: a simple, sleek Ethereum / ERC-20 Token lightwallet app. Now looking for beta testers.",<not selftext available>,https://www.reddit.com/r/ethereum/comments/7iopw8/i_spent_the_last_few_months_of_my_free_time/,1,0
7iorxx,1512847532,Skychain: Blockchain-Based Data Marketplace and AI Marketplace,,https://www.reddit.com/r/ethereum/comments/7iorxx/skychain_blockchainbased_data_marketplace_and_ai/,1,0
7iostp,1512847770,Introducing the New Whitepaper for the Dai Stablecoin System,[deleted],https://www.reddit.com/r/ethereum/comments/7iostp/introducing_the_new_whitepaper_for_the_dai/,1,0
7iou1n,1512848085,"What is ""Cryptokitties Auction"" and how is it different from Cryptokitties? I see both on the ETH Gas Station now.","https://ethgasstation.info/gasguzzlers.php\n\nThe top two are Cryptokitties and then also ""Cryptokitties Auction"", totaling to around 19% of the network. I used to only see Cryptokitties on that list anywhere from 8-12% over the last couple weeks. Any idea what the Auction one is?",https://www.reddit.com/r/ethereum/comments/7iou1n/what_is_cryptokitties_auction_and_how_is_it/,3,2
7iouxw,1512848332,Introducing the New Whitepaper for the Dai Stablecoin System,,https://www.reddit.com/r/ethereum/comments/7iouxw/introducing_the_new_whitepaper_for_the_dai/,460,156
7ioxs7,1512849053,"Not good Mister Satoshi, not good at all.",,https://www.reddit.com/r/ethereum/comments/7ioxs7/not_good_mister_satoshi_not_good_at_all/,1,0
7ioz70,1512849435,"Watch videos get paid in Ethereum, Bitcoin or any altcoin of your choice. Also make sure to look at the apps like InboxDollars you can download to earn BIG amounts of points. Make sure to check out the Peanut Labs surveys!",,https://www.reddit.com/r/ethereum/comments/7ioz70/watch_videos_get_paid_in_ethereum_bitcoin_or_any/,1,0
7ip09v,1512849725,PLEASE HELP: sent 3 ether from my ledger nano s to my gdax account. It has been pending for many days now even though my ledger keeps updating the sent time.,"Here is the transaction info:\nhttps://etherscan.io/tx/0x92ea86ec68159857af0a9ab0f0c0bbab3f8863cc80524db9cef03bfe55c0e2f7\n\nHow can I stop this transaction or when will it be confirmed. Even though the time keeps updating, this has been going on for days. I was not using my ether wallet. Any information is helpful thank you",https://www.reddit.com/r/ethereum/comments/7ip09v/please_help_sent_3_ether_from_my_ledger_nano_s_to/,1,11
