id,created_utc,title,selftext,full_link,score,comments
7jfp9u,1513128417,Hail Ethereum,[deleted],https://www.reddit.com/r/ethereum/comments/7jfp9u/hail_ethereum/,1,0
7jfrac,1513128978,How long before a failed transaction finalizes?,I sent some coin earlier that has been appearing and disappearing on etherscan.io as pending - is there a cut-off time when pending transactions are removed or how long can this go on?,https://www.reddit.com/r/ethereum/comments/7jfrac/how_long_before_a_failed_transaction_finalizes/,1,1
7jfrbv,1513128988,Unable to deposit to Bitfinex wallet?,[removed],https://www.reddit.com/r/ethereum/comments/7jfrbv/unable_to_deposit_to_bitfinex_wallet/,1,2
7jfrdm,1513129002,Is there a way to mine on dual gpu's but one is only 2gb?,[deleted],https://www.reddit.com/r/ethereum/comments/7jfrdm/is_there_a_way_to_mine_on_dual_gpus_but_one_is/,1,2
7jfrhe,1513129032,Hail Satan Ethereum 🤘🏻,,https://www.reddit.com/r/ethereum/comments/7jfrhe/hail_satan_ethereum/,1,0
7jfs5r,1513129219,Ether for weed,[removed],https://www.reddit.com/r/ethereum/comments/7jfs5r/ether_for_weed/,1,0
7jfsbk,1513129268,"How does ETH face scalability and fee? IOTA, Raiblock, byteball all (almost) feeless and unlimited scalability",[removed],https://www.reddit.com/r/ethereum/comments/7jfsbk/how_does_eth_face_scalability_and_fee_iota/,1,0
7jft1d,1513129478,Hopped on the ETH bandwagoon today!,[removed],https://www.reddit.com/r/ethereum/comments/7jft1d/hopped_on_the_eth_bandwagoon_today/,1,0
7jftan,1513129551,Smart Contracts for the average person,"So I want to make a smart contract with a friend (hypothetically). Neither of us know how to program. Shit.\n\n\nI want to use a service and pay with ETH. I must pray that their smart contract has no provisions or secret code that will rob me blind, correct?\n\n\nHow will smart contracts work for regular people? Will we just need to trust the company that makes them? How hard are they to read? ",https://www.reddit.com/r/ethereum/comments/7jftan/smart_contracts_for_the_average_person/,14,7
7jfuds,1513129856,75 percent of ICO projects fail to collect soft cap,,https://www.reddit.com/r/ethereum/comments/7jfuds/75_percent_of_ico_projects_fail_to_collect_soft/,1,0
7jfxub,1513130809,Where to buy Ethereum in New Zealand?,<not selftext available>,https://www.reddit.com/r/ethereum/comments/7jfxub/where_to_buy_ethereum_in_new_zealand/,1,0
7jfyo4,1513131040,Is there a way to get rid of ERC20 tokens on my ETH address?,I'd like to know if this is possible. I participated in a few airdrops that ended up being shitty. So i'd like to get rid of those tokens. ,https://www.reddit.com/r/ethereum/comments/7jfyo4/is_there_a_way_to_get_rid_of_erc20_tokens_on_my/,1,3
7jfyrh,1513131066,Gifting Ethereum,"This holiday season I'm thinking about gifting a few family members some Ethereum, none of them are particularly into Cyrptocurrancy but because they are younger (late teens/early 20's) it might be worth it for them to just hang onto and see what happens in a few years. \n\nMy question is what is the best way to gift someone Ethereum. Since I don't think any of the recipients will be actively trading or using it a hardware wallet seems a little over the top. I'm assuming I can just generate a wallet with MEW and hand over the relevant pass/key combo and that would be enough right? \n\nI'll admit I probably don't know as much about this as I should but I think it would make for a fun and interesting gift so I'd appreciate any advice. ",https://www.reddit.com/r/ethereum/comments/7jfyrh/gifting_ethereum/,11,9
7jfytg,1513131080,Krypto Kiosk - ATM Booths Australia,,https://www.reddit.com/r/ethereum/comments/7jfytg/krypto_kiosk_atm_booths_australia/,1,1
7jfyyf,1513131117,CryptoWedding?,,https://www.reddit.com/r/ethereum/comments/7jfyyf/cryptowedding/,1,0
7jfzxm,1513131374,How do I get started with no money?,<not selftext available>,https://www.reddit.com/r/ethereum/comments/7jfzxm/how_do_i_get_started_with_no_money/,1,4
7jg0jh,1513131540,Sharing some good bitcoin mining news,[deleted],https://www.reddit.com/r/ethereum/comments/7jg0jh/sharing_some_good_bitcoin_mining_news/,1,1
7jg20q,1513131973,Transaction confirmation took so much time to be done,[removed],https://www.reddit.com/r/ethereum/comments/7jg20q/transaction_confirmation_took_so_much_time_to_be/,1,0
7jg3l2,1513132411,Visual Representation of the Store of Value Debate,,https://www.reddit.com/r/ethereum/comments/7jg3l2/visual_representation_of_the_store_of_value_debate/,1,0
7jg444,1513132581,Is ethereum dead? I hear a lot of people saying that paying gas for everything is stupid. Can Facebook work on ethereum? What will ethereum be useful for other than cute digital kittens? Please help me understand.,,https://www.reddit.com/r/ethereum/comments/7jg444/is_ethereum_dead_i_hear_a_lot_of_people_saying/,0,18
7jg5p0,1513133035,"New to the crypto scene , looking to start a mining rig of 6 CPUs",<not selftext available>,https://www.reddit.com/r/ethereum/comments/7jg5p0/new_to_the_crypto_scene_looking_to_start_a_mining/,1,1
7jg6ac,1513133203,Worth it?,[removed],https://www.reddit.com/r/ethereum/comments/7jg6ac/worth_it/,1,0
7jg8cl,1513133772,On Crowdsales and Their Deception – Liquidaeon – Medium,,https://www.reddit.com/r/ethereum/comments/7jg8cl/on_crowdsales_and_their_deception_liquidaeon/,6,0
7jg8j5,1513133829,iFin Expansion ▲ Skills Matrix ▲ Blockchain Agnostic ▲ What’s Next after NXT? ▲ Google+ ▲ New Marketing Director,[removed],https://www.reddit.com/r/ethereum/comments/7jg8j5/ifin_expansion_skills_matrix_blockchain_agnostic/,1,1
7jg8qw,1513133894,Coinbase Ethereum Wallet Issue,<not selftext available>,https://www.reddit.com/r/ethereum/comments/7jg8qw/coinbase_ethereum_wallet_issue/,1,1
7jg9j0,1513134110,I bought just a little bit of ethereum @ $686.44 per ETH an hour ago... am i fucked?,,https://www.reddit.com/r/ethereum/comments/7jg9j0/i_bought_just_a_little_bit_of_ethereum_68644_per/,0,20
7jgbh9,1513134668,EthFinex ICO platform,,https://www.reddit.com/r/ethereum/comments/7jgbh9/ethfinex_ico_platform/,1,1
7jgcoz,1513135024,Website real or fake?,<not selftext available>,https://www.reddit.com/r/ethereum/comments/7jgcoz/website_real_or_fake/,1,0
7jge9n,1513135460,Wikipedia founder embraces the blockchain,,https://www.reddit.com/r/ethereum/comments/7jge9n/wikipedia_founder_embraces_the_blockchain/,1,1
7jgfgj,1513135785,Measuring Decentralization,I recall Balaji Srinivasan had offered to fund the development of a decentralization dashboard. (possibly using an approach similar to his gini/nakamoto coefficient models).\n\nDoes anybody know if this is in progress or has happened? Thanks!,https://www.reddit.com/r/ethereum/comments/7jgfgj/measuring_decentralization/,20,7
7jgfz1,1513135900,Ethereum going parabolic - Hope you guys get around it,,https://www.reddit.com/r/ethereum/comments/7jgfz1/ethereum_going_parabolic_hope_you_guys_get_around/,0,2
7jgi1j,1513136412,"There are lots of scammy crypto Airbnb ICOs out there, I've built the only one with actual users and listings - no shitcoin required",[deleted],https://www.reddit.com/r/ethereum/comments/7jgi1j/there_are_lots_of_scammy_crypto_airbnb_icos_out/,2,0
7jgi6x,1513136447,"Out of gas Missing 64bucks , never roll back",[removed],https://www.reddit.com/r/ethereum/comments/7jgi6x/out_of_gas_missing_64bucks_never_roll_back/,1,0
7jgiez,1513136509,Cryptocurrency Portfolio Tracker Excel Sheet,[removed],https://www.reddit.com/r/ethereum/comments/7jgiez/cryptocurrency_portfolio_tracker_excel_sheet/,1,0
7jgjko,1513136812,I CAN'T TAKE OUT MONEY CUZ I AM NOT 18?,[removed],https://www.reddit.com/r/ethereum/comments/7jgjko/i_cant_take_out_money_cuz_i_am_not_18/,0,7
7jgk14,1513136937,Quickest way to buy ETH,[removed],https://www.reddit.com/r/ethereum/comments/7jgk14/quickest_way_to_buy_eth/,1,1
7jglml,1513137367,Is Ethereum any different than Bitcoin or other crypto-currencies?,I’ve heard Ethereum has a different  purpose than bitcoin and the digital currency itself has some differences compared to bitcoin and other crypto currencies. ,https://www.reddit.com/r/ethereum/comments/7jglml/is_ethereum_any_different_than_bitcoin_or_other/,3,8
7jglzx,1513137463,Ethereum and ETH20 Concern,[removed],https://www.reddit.com/r/ethereum/comments/7jglzx/ethereum_and_eth20_concern/,1,1
7jgmu5,1513137685,Quickest place to buy ETH without a waiting for verification,[removed],https://www.reddit.com/r/ethereum/comments/7jgmu5/quickest_place_to_buy_eth_without_a_waiting_for/,1,1
7jgq6o,1513138591,Opinions on LMC?,[removed],https://www.reddit.com/r/ethereum/comments/7jgq6o/opinions_on_lmc/,0,1
7jgqgd,1513138681,"You would make roughly $700,000 more if you put $1,000 into Ethereum rather than Bitcoin two years ago...",,https://www.reddit.com/r/ethereum/comments/7jgqgd/you_would_make_roughly_700000_more_if_you_put/,1,0
7jgqon,1513138748,Keystore files from previous version not working anymore.,"So due to some stupidity on my part I deleted the blockchain folder permanently off my harddrive.  I then restored my keystore files with Testdisk.  However, where I'm at right now is with the new Ethereum Wallet, it won't read them.  Neither will myetherwallet.  myetherwallet gives me an error along with it.  It says, ""This is not a valid wallet file.""  Anyone have any ideas? Can I repair the keystore somehow?  I'm confused. ",https://www.reddit.com/r/ethereum/comments/7jgqon/keystore_files_from_previous_version_not_working/,9,9
7jgrzg,1513139150,"SEC statement on ICO, ETH reaches all time high",,https://www.reddit.com/r/ethereum/comments/7jgrzg/sec_statement_on_ico_eth_reaches_all_time_high/,1,0
7jgu9v,1513139813,GTX 980 getting 0mh/s with driver 347.52 on claymore,[removed],https://www.reddit.com/r/ethereum/comments/7jgu9v/gtx_980_getting_0mhs_with_driver_34752_on_claymore/,1,0
7jguhx,1513139882,Anyone else having trouble with the blockchain on mist?,I’ve been using solo test network and now I’m trying to move the contracts to Rinkeby and its having trouble even finding peers.,https://www.reddit.com/r/ethereum/comments/7jguhx/anyone_else_having_trouble_with_the_blockchain_on/,3,4
7jgvgl,1513140186,Just bought in at an ath,[removed],https://www.reddit.com/r/ethereum/comments/7jgvgl/just_bought_in_at_an_ath/,0,8
7jgvjy,1513140213,Ethereum mining via AWS -- is the process in this article still valid? Any good resources for mining via AWS?,,https://www.reddit.com/r/ethereum/comments/7jgvjy/ethereum_mining_via_aws_is_the_process_in_this/,1,0
7jgvqi,1513140268,philosophical question (probably been asked). Who has the right to rollback a block if execution has a provably harmful outcome?,,https://www.reddit.com/r/ethereum/comments/7jgvqi/philosophical_question_probably_been_asked_who/,5,8
7jgwi2,1513140521,Tracing a transaction.,Is there a way to track a coinbase transaction back to the original coinbase wallet that it was sent from. \n\nI know that coinbase groups all transactions together before sending it out right?\n\nAny information is appreciated. Thanks!\n,https://www.reddit.com/r/ethereum/comments/7jgwi2/tracing_a_transaction/,2,3
7jgyl5,1513141182,"There are lots of scammy crypto Airbnb ICOs out there recently, so far I've built the only one with an actual community and listings - no shitcoin required",[deleted],https://www.reddit.com/r/ethereum/comments/7jgyl5/there_are_lots_of_scammy_crypto_airbnb_icos_out/,1,0
