id,created_utc,title,selftext,full_link,score,comments
7k0w7w,1513356546,Change default path for chain in Ethereum wallet,[removed],https://www.reddit.com/r/ethereum/comments/7k0w7w/change_default_path_for_chain_in_ethereum_wallet/,1,0
7k0xtd,1513356934,"Ripple, Litecoin and Ethereum are surging after their addition to Bloomberg's Terminal.",,https://www.reddit.com/r/ethereum/comments/7k0xtd/ripple_litecoin_and_ethereum_are_surging_after/,1,0
7k0y61,1513357026,STAY AWAY FROM GATEHUB!! SCAMMERS! Many people losing coins!,"I deposited ETH there yesterday. It confirmed and has gone to their hot wallet. It hasn't gone through almost 24hrs later. Others out there have not seen their ETH in 3 DAYS and some longer. There are reports of others losing fiat to this site. The same is happening with BTC. Not only do they have all kinds of bizarre ""trustline"" requirements, but either you can't fulfill them or even if you do it doesn't fucking help you get your coins. Their support is NON-FUCKING-EXISTENT.\n\nSTAY AWAY FROM THESE FUCKING THIEVES WHO REFUSE TO ACKNOWLEDGE THESE ISSUES ON TWITTER, THEY ARE PROMPTING PEOPLE TO CONTINUE USING THEIR SITE AS IF THERE ARE NO ISSUES.\n\n[FUCK GATEHUB MAN, FUCKING SCAMMERS](https://twitter.com/search?f=tweets&amp;vertical=default&amp;q=gatehub&amp;src=tyah)\n\n\nNot to mention they are trying to charge people 0.005BTC or 0.05 BTC to try and move their BTC out of wallet after its there. WHAT THE FUCK? It is literally impossible for some people to get their BTC off the wallet because the fee is considerably more expensive than the amount of BTC they even fucking own.",https://www.reddit.com/r/ethereum/comments/7k0y61/stay_away_from_gatehub_scammers_many_people/,18,20
7k11np,1513357827,Transactions price is 30x higher the last few days !!,[removed],https://www.reddit.com/r/ethereum/comments/7k11np/transactions_price_is_30x_higher_the_last_few_days/,1,0
7k11rt,1513357855,"Worker at Bitfinex removed warrant canaries from Twitter, and has been silent for 10 days after daily tweets for months",,https://www.reddit.com/r/ethereum/comments/7k11rt/worker_at_bitfinex_removed_warrant_canaries_from/,119,27
7k12qe,1513358098,Noob question- will a paper wallet (like Bitaddress) work with Ethereum?,Title says it all. I feel like the BTC price is so high at this point that I've kinda missed the party. Looking at Eth and LTC as alternatives.,https://www.reddit.com/r/ethereum/comments/7k12qe/noob_question_will_a_paper_wallet_like_bitaddress/,2,4
7k132b,1513358183,My EtherWallet was Hacked..,[removed],https://www.reddit.com/r/ethereum/comments/7k132b/my_etherwallet_was_hacked/,1,0
7k14xn,1513358632,"Invitation to the Politics, Arts and Culture subreddit for the Ethereum Community • r/EthAgora",,https://www.reddit.com/r/ethereum/comments/7k14xn/invitation_to_the_politics_arts_and_culture/,2,1
7k15n5,1513358809,Problems w/claymore dual miner.,"I'm mining ether only using claymore's dual miner. The problem is that it will run good for a few hours then say ""socket closed remotely by pool"" and go into hibernate. I've added more eth pools but the problem still persists. Does anyone have a solution to this?",https://www.reddit.com/r/ethereum/comments/7k15n5/problems_wclaymore_dual_miner/,2,1
7k16r1,1513359075,Transactions price is 30x higher the last few days !!,"Posted for @AltcoinsTalks (his got deleted)\n\nBefore being accused of being a cheap person, let me explain: 1- We have a crypto forum where we share with our members the tokens we collect from promoting ICOs on the site &gt; http://www.altcoinstalks.com/ 2- That means we are expected to do thousands of transactions per month. 3- That's why we obviously till recently used 0.1 gwei for sending tokens, and it worked.\n\nUntil few days ago, where it no longer did, and even with ethereum price almost doubling, the amount of gas needed per transaction is much much higher.\n\nI think this is a problem, because the etherum network powers thousands of tokens. Unlike Ethereum, most of these tokens are priced at few cents. Thus there should be a way for tokens to be traded cheap and not having transactions cost more than the tokens value.\n",https://www.reddit.com/r/ethereum/comments/7k16r1/transactions_price_is_30x_higher_the_last_few_days/,2,5
7k18wp,1513359594,Etherdelta ICO coming soon,[deleted],https://www.reddit.com/r/ethereum/comments/7k18wp/etherdelta_ico_coming_soon/,1,0
7k199p,1513359680,Accidentally deleted and then resurrected json key file,"Accidentaly deleted and then resurrected json key file. It has the same name as before, the same weight (in bytes) but when I open it with text editor, it is a mess inside. Can I fix it? Can somebody help or this key file is forever lost? \n\nThanks for help",https://www.reddit.com/r/ethereum/comments/7k199p/accidentally_deleted_and_then_resurrected_json/,3,7
7k19j9,1513359744,"I wrote a post about creating a local private Ethereum blockchain, along with deploying and interacting with smart contracts.",,https://www.reddit.com/r/ethereum/comments/7k19j9/i_wrote_a_post_about_creating_a_local_private/,1,0
7k1any,1513360012,SEC stopped another illegal ICO,,https://www.reddit.com/r/ethereum/comments/7k1any/sec_stopped_another_illegal_ico/,1,0
7k1dgo,1513360689,Haven't received etherium,[removed],https://www.reddit.com/r/ethereum/comments/7k1dgo/havent_received_etherium/,1,0
7k1ehl,1513360925,Is a high Ether valuation bad for apps and contracts?,"Even if scaling options improve efficiency, is it not a bad thing for Ether to have a high value and thus increase the cost of using gas for more interesting things?",https://www.reddit.com/r/ethereum/comments/7k1ehl/is_a_high_ether_valuation_bad_for_apps_and/,2,1
7k1ep5,1513360975,Democratized AI - Blockchain Use Case,[deleted],https://www.reddit.com/r/ethereum/comments/7k1ep5/democratized_ai_blockchain_use_case/,1,0
7k1hon,1513361707,Foundations of the Keep Network: Threshold Signatures,,https://www.reddit.com/r/ethereum/comments/7k1hon/foundations_of_the_keep_network_threshold/,4,0
7k1j6r,1513362085,Ethereum Chinese Art,,https://www.reddit.com/r/ethereum/comments/7k1j6r/ethereum_chinese_art/,276,14
7k1ka9,1513362371,Crypto Ethereum T-Shirt,[deleted],https://www.reddit.com/r/ethereum/comments/7k1ka9/crypto_ethereum_tshirt/,1,0
7k1kyc,1513362543,Why Ethereum?,Can I get a short version of why Ethereum is a crypto to get involved with? All I hear about is the kitties thing and how terrible its been for the market. Thanks /r/Ethereum,https://www.reddit.com/r/ethereum/comments/7k1kyc/why_ethereum/,12,8
7k1n7d,1513363089,For people who live in CANADA 🇨🇦/using CAD to buy coins!,[removed],https://www.reddit.com/r/ethereum/comments/7k1n7d/for_people_who_live_in_canada_using_cad_to_buy/,1,0
7k1net,1513363141,"CryptoKitties was the beginning, what is next? Crypto Collectables?",,https://www.reddit.com/r/ethereum/comments/7k1net/cryptokitties_was_the_beginning_what_is_next/,15,25
7k1o6n,1513363325,2018 year in preview (aka I took the tweetstorm and made it into a Medium post.),,https://www.reddit.com/r/ethereum/comments/7k1o6n/2018_year_in_preview_aka_i_took_the_tweetstorm/,6,0
7k1p4t,1513363554,"Grid+: New scaling developments, hardware wallet progress, software development, hiring, and more from the first major ConsenSys spin out!",,https://www.reddit.com/r/ethereum/comments/7k1p4t/grid_new_scaling_developments_hardware_wallet/,57,3
7k1p6k,1513363568,Crypto Collectables? Ethereum's Next Killer App Is on Its Way,[deleted],https://www.reddit.com/r/ethereum/comments/7k1p6k/crypto_collectables_ethereums_next_killer_app_is/,1,1
7k1q50,1513363805,Question on crypto Mergers &amp; Acquisitions,"I apologise for my probably naive for devs question, but still... In the far far future, crypto future (say, a couple of years from now), will it be possible that one Ethereum based token mergers with another one? I mean is it possible/feasible technically at all, e.g. Augur and Gnosis? Or one of them is doomed to give a way and die with all the negative consequences for holders?",https://www.reddit.com/r/ethereum/comments/7k1q50/question_on_crypto_mergers_acquisitions/,3,0
7k1q9d,1513363830,dont be mad im only showing you what i found,,https://www.reddit.com/r/ethereum/comments/7k1q9d/dont_be_mad_im_only_showing_you_what_i_found/,1,0
7k1rgz,1513364136,ICO PUMPER - Telegram,,https://www.reddit.com/r/ethereum/comments/7k1rgz/ico_pumper_telegram/,1,0
7k1rh1,1513364137,"Alex Winter's Upcoming Crypto Documentary featured on BNN! Says ""Blockchain is all that matters""",,https://www.reddit.com/r/ethereum/comments/7k1rh1/alex_winters_upcoming_crypto_documentary_featured/,13,0
7k1sb8,1513364344,"Pop out windows!?! Have you tried them yet? If not, head to ADAE.IO",,https://www.reddit.com/r/ethereum/comments/7k1sb8/pop_out_windows_have_you_tried_them_yet_if_not/,0,0
7k1w7w,1513365321,I Need help!!,"Hello guys,\n\nI send some Ethereum to my Wallet. Somehow the receiver adresse changed. Now i can’t find the transaction hash. It shows unable to find transaction hash. \nWill the transaction cancel after some Time and can i get my money back? Thats wird. Never saw this before.",https://www.reddit.com/r/ethereum/comments/7k1w7w/i_need_help/,4,1
7k1ypz,1513365956,"I just want to say that i am glad to see the ethereum community standing together and pushing forward on tech innovation, much unlike the bitcoin community which is in a clear mess.",,https://www.reddit.com/r/ethereum/comments/7k1ypz/i_just_want_to_say_that_i_am_glad_to_see_the/,34,16
7k1yv7,1513365991,[Feedback Request] Auctus - Presentation,,https://www.reddit.com/r/ethereum/comments/7k1yv7/feedback_request_auctus_presentation/,2,0
7k1z37,1513366049,Smart Contract Signing,"The concept of smart contracts is fascinating. Allowing developers to code dynamic contracts with real world input has some clear value, however a concern came to mind and I have yet to find a proposed solution.\n\nThe concern is about 'bad' code/contracts either through unintentional errors in the code, or code un-optimized in a way that adds additional strain to the network where it's not needed. A thought that I had in mind was similar to driver signing in Windows. The Ethereum foundation may have a compliance department that reviews and 'signs' code for dapps, assuring that the code is not only functioning properly, but is created by a trustworthy publisher, passing value onto users who can rest assured that they are using a verified dapp. Unverified dapps would still exist, but would allow users to proceed with an added layer of caution.\n\nOn a side note, is there a central marketplace/repository for dapps?",https://www.reddit.com/r/ethereum/comments/7k1z37/smart_contract_signing/,3,3
7k1zpp,1513366207,Learn Ethereum Solidity Programming Now with Free Site CryptoZombies | BTCMANAGER,,https://www.reddit.com/r/ethereum/comments/7k1zpp/learn_ethereum_solidity_programming_now_with_free/,1,0
7k20li,1513366427,Ethereum to the moon in 2018?,,https://www.reddit.com/r/ethereum/comments/7k20li/ethereum_to_the_moon_in_2018/,1,0
7k20lr,1513366429,Coinbase degrades is verification is ridiculous!!,[deleted],https://www.reddit.com/r/ethereum/comments/7k20lr/coinbase_degrades_is_verification_is_ridiculous/,1,0
7k2107,1513366537,Did the correction occur?,[deleted],https://www.reddit.com/r/ethereum/comments/7k2107/did_the_correction_occur/,0,1
7k23wp,1513367280,Explain state channels,"Hey guys, just wanna make sure I understand state channels correctly:\n\nIs it basically doing communication such as messages, transactions off the block chain, in a private channel between the two parties? And it does it because there is no need to do this on the block chain, we only need the blockchain to validate the message / transaction?",https://www.reddit.com/r/ethereum/comments/7k23wp/explain_state_channels/,3,2
7k267b,1513367865,Alert ! Ethereum Mist browser affected by Chromium vulnerability,,https://www.reddit.com/r/ethereum/comments/7k267b/alert_ethereum_mist_browser_affected_by_chromium/,2,1
7k26wi,1513368041,Have cryptoassets created $0.5 trillion in social value? (Marginal Revolution argues it could be),,https://www.reddit.com/r/ethereum/comments/7k26wi/have_cryptoassets_created_05_trillion_in_social/,6,1
7k28da,1513368412,Snipbin - A text bin on the Ethereum blockchain!,,https://www.reddit.com/r/ethereum/comments/7k28da/snipbin_a_text_bin_on_the_ethereum_blockchain/,5,1
7k28ts,1513368536,Bittrex email scam. Plz help spread the word.,,https://www.reddit.com/r/ethereum/comments/7k28ts/bittrex_email_scam_plz_help_spread_the_word/,1,0
7k2acr,1513368911,"r/litecoin shadowbanned this song, can you tell me why? :)",[deleted],https://www.reddit.com/r/ethereum/comments/7k2acr/rlitecoin_shadowbanned_this_song_can_you_tell_me/,0,0
7k2ap2,1513368995,Is it legal to make mining office in US?,[removed],https://www.reddit.com/r/ethereum/comments/7k2ap2/is_it_legal_to_make_mining_office_in_us/,1,1
7k2bv0,1513369302,How long does transaction take?,"I made a transaction from coinbase to bittrex. 6 Months ago, it would've shown up as pending after 1-3 minutes but now it hasn't shown up for a while. Is this normal?",https://www.reddit.com/r/ethereum/comments/7k2bv0/how_long_does_transaction_take/,1,3
7k2fml,1513370271,Questions regarding Vitalik's post: Casper The Friendly Finality Gadget,[removed],https://www.reddit.com/r/ethereum/comments/7k2fml/questions_regarding_vitaliks_post_casper_the/,1,0
7k2i4o,1513370886,Ethereum Co-Founder on Bitcoin and Blockchain Tech,,https://www.reddit.com/r/ethereum/comments/7k2i4o/ethereum_cofounder_on_bitcoin_and_blockchain_tech/,135,21
7k2iti,1513371069,Introducing the Gnosis Dutch Exchange – Gnosis,,https://www.reddit.com/r/ethereum/comments/7k2iti/introducing_the_gnosis_dutch_exchange_gnosis/,1,0
