id,created_utc,title,selftext,full_link,score,comments
7kfkgb,1513536862,Hello 😄!! What kind of portfolio (paper wallet) do you recommend to keep ethereum? I saw www.myetherwallet.com but idk if it is safe. Thanks!!,[removed],https://www.reddit.com/r/ethereum/comments/7kfkgb/hello_what_kind_of_portfolio_paper_wallet_do_you/,1,0
7kfkyc,1513536987,"New Episode of #ByteSizeBlockchain - Not Your Keys, Not Your Bitcoin",,https://www.reddit.com/r/ethereum/comments/7kfkyc/new_episode_of_bytesizeblockchain_not_your_keys/,0,6
7kfm6s,1513537322,Is it a good time to buy ETH or should i wait and buy in a dip?,[removed],https://www.reddit.com/r/ethereum/comments/7kfm6s/is_it_a_good_time_to_buy_eth_or_should_i_wait_and/,1,1
7kfnq8,1513537729,Am I able to download Ethereum wallet on a Raspberry Pi running Ubuntu?,"Title. I just wanna make sure that I am able too before I start my project. If I am able too, would there be any problems doing so? If not, how can I work around the problem?\n\nEdit: Would like to download the regular wallet on the Ethereum website or Jaxx",https://www.reddit.com/r/ethereum/comments/7kfnq8/am_i_able_to_download_ethereum_wallet_on_a/,10,3
7kfoe2,1513537901,Cryptokitties + VR,,https://www.reddit.com/r/ethereum/comments/7kfoe2/cryptokitties_vr/,1,0
7kfsf7,1513539011,The CFTC’s Physical Delivery of a Virtual Currency Definition- a must know for the cryptocurrency community,,https://www.reddit.com/r/ethereum/comments/7kfsf7/the_cftcs_physical_delivery_of_a_virtual_currency/,20,2
7kfvpn,1513539892,JSON data get ETH price,[removed],https://www.reddit.com/r/ethereum/comments/7kfvpn/json_data_get_eth_price/,1,0
7kfvq9,1513539897,How do I set up Nanopool email notifications for crashed miner?,[removed],https://www.reddit.com/r/ethereum/comments/7kfvq9/how_do_i_set_up_nanopool_email_notifications_for/,1,0
7kfxt4,1513540460,Federated Byzantine Agreement (e.g. Stellar) vs. Plasma-PoS chains (e.g. OMG),"I wanted to get feedback from the ETH community on some of the architectural and scaling differences between BFA style consensus algorithms like SCA and Plasma based PoS chains.\n\nStellar for instance promises essentially free transaction fees but requires more hardware of ""servers"" using the network.  The ""roll your own trust tolerance"" approach seems like a reputational mechanism to converge into centralization. \n\nOMG is permissionless and requires no servers, running on ordinary laptops, but charges an as yet undetermined fee. \n\nWhat are the fundamental differences of these constructions? What makes one more or less preferable for different implementations?",https://www.reddit.com/r/ethereum/comments/7kfxt4/federated_byzantine_agreement_eg_stellar_vs/,15,3
7kfy99,1513540579,11 tokens can now be converted on Bancor!,,https://www.reddit.com/r/ethereum/comments/7kfy99/11_tokens_can_now_be_converted_on_bancor/,1,0
7kfz2v,1513540810,Please Help :( Problem with Mist wallet/ether not showing up,"I installed the Mist wallet, sync'd up, and transferred a non-significant amount of Ether from an exchange to the address the was generated by my wallet. The transfer is marked as successful on the network, but it doesn't show up in my wallet. I verified that I'm sync'd past the block height that my transaction was part of.\n\nIn mist, it just shows my balance as 0 ether in my main account. \n\nPlease help :( I might not be immediately at my keyboard, but i'll keep an eye on this post and DMs. I'll forward a token of appreciation to anyone that helps resolve this, assuming I can actually access my coins :(",https://www.reddit.com/r/ethereum/comments/7kfz2v/please_help_problem_with_mist_walletether_not/,1,0
7kg0f8,1513541150,MiTio ICO Launch,,https://www.reddit.com/r/ethereum/comments/7kg0f8/mitio_ico_launch/,1,0
7kg4zn,1513542346,Kik throwing shade on Ether,"There have already been a few posts about this but I have some questions. It sounds to me like kik is attempting to process every kin transaction on the main chain, am I mistaken? If this is the case, why do they even have their own damn token?..\n\nhttps://www.coindesk.com/goodbye-ethereum-kik-plans-move-ico-tokens-stellar/",https://www.reddit.com/r/ethereum/comments/7kg4zn/kik_throwing_shade_on_ether/,2,3
7kg5lj,1513542511,"Zamfir's Triangle - Reasonably low latency to finality, reasonably large number of validators, and reasonably low overhead.",,https://www.reddit.com/r/ethereum/comments/7kg5lj/zamfirs_triangle_reasonably_low_latency_to/,36,3
7kg6tl,1513542849,Question about PoS yields,[removed],https://www.reddit.com/r/ethereum/comments/7kg6tl/question_about_pos_yields/,1,1
7kgbu3,1513544172,"Total beginner question; if mist install stays at this screen for hours, should I just wait or close and try again or what?",,https://www.reddit.com/r/ethereum/comments/7kgbu3/total_beginner_question_if_mist_install_stays_at/,3,6
7kgd43,1513544505,ethereumfork,[removed],https://www.reddit.com/r/ethereum/comments/7kgd43/ethereumfork/,1,0
7kgebl,1513544816,To all cryptoheads out there who want to pimp their TREZORS. Silicone Protective Cases in 5 colors with Free Worldwide Shipping,,https://www.reddit.com/r/ethereum/comments/7kgebl/to_all_cryptoheads_out_there_who_want_to_pimp/,1,0
7kgf8y,1513545052,Paper Wallet created with myetherwallet.com - Is it safe to transfer only a part of the wallet using the Send Offline Transaction or do I have to flush it and create a new wallet?,I want to transfer a tiny amount of ether to another address using the Offline Transaction from MEW. I would like to keep the rest at my old paper wallet. Is my old paper wallet still safe?,https://www.reddit.com/r/ethereum/comments/7kgf8y/paper_wallet_created_with_myetherwalletcom_is_it/,0,2
7kgily,1513545958,EOS to expand market share in the coming months,[removed],https://www.reddit.com/r/ethereum/comments/7kgily/eos_to_expand_market_share_in_the_coming_months/,1,1
7kgir6,1513545992,"Bloomberg Adds Ethereum, Litecoin and Ripple to Its Terminal",,https://www.reddit.com/r/ethereum/comments/7kgir6/bloomberg_adds_ethereum_litecoin_and_ripple_to/,1,0
7kgk2x,1513546352,I dream of a career in ethereum blockchain development. Any advice?,[removed],https://www.reddit.com/r/ethereum/comments/7kgk2x/i_dream_of_a_career_in_ethereum_blockchain/,1,0
7kgk5i,1513546369,My son was born today. His name is Vitaly,,https://www.reddit.com/r/ethereum/comments/7kgk5i/my_son_was_born_today_his_name_is_vitaly/,0,0
7kgllm,1513546760,"MetaMask ""loose"" account label - any cause for concern?",[removed],https://www.reddit.com/r/ethereum/comments/7kgllm/metamask_loose_account_label_any_cause_for_concern/,1,0
7kgnpq,1513547307,How can I give ETH to people for Christmas?,"I feel like ETH would be a cool gift to give to people, especially because 2018 looks very promising. How would I go about giving ETH to people who don't have wallets or are signed up on an exchange? I posted a similar question in /r/litecoin and ETH would work just as well, given the similar hopes I have for ETH in 2018.",https://www.reddit.com/r/ethereum/comments/7kgnpq/how_can_i_give_eth_to_people_for_christmas/,2,13
7kgsjd,1513548581,Presenting: CryptCard. The perfect way to introduce people to cryptocurrency!,[removed],https://www.reddit.com/r/ethereum/comments/7kgsjd/presenting_cryptcard_the_perfect_way_to_introduce/,2,1
7kgsls,1513548600,I feel like I have never had a successful Ethereum wallet sync since I first downloaded it,It always stops at some random % and I never get fully synced with the network. I just want to look at my ethereum on my desktop T_T\n\nanyone having a similar issue? ,https://www.reddit.com/r/ethereum/comments/7kgsls/i_feel_like_i_have_never_had_a_successful/,0,4
7kgvck,1513549358,Cryptocurrency/Fiat Exchange Discord Hybrid,[removed],https://www.reddit.com/r/ethereum/comments/7kgvck/cryptocurrencyfiat_exchange_discord_hybrid/,1,0
7kgvf4,1513549379,How to send ether from GETH wallet?,Hello friends. I 've been mining in to my local geth wallet and now time came to cash out. I am writing to ask if anybody know the sure method of sending ether from GETH to the exchanger. I spent half a day googling the issue and never found a clear direction. Any help is greatly appreciated!\n\nHappy Holidays,https://www.reddit.com/r/ethereum/comments/7kgvf4/how_to_send_ether_from_geth_wallet/,0,7
7kgx12,1513549825,(ADA) Cardano,[removed],https://www.reddit.com/r/ethereum/comments/7kgx12/ada_cardano/,1,0
7kh4k5,1513551931,Bitcoin is far less superior to Ethereum am I right?,[removed],https://www.reddit.com/r/ethereum/comments/7kh4k5/bitcoin_is_far_less_superior_to_ethereum_am_i/,1,1
7kh4kz,1513551937,"Contact Razerzone, ask them to support Ethereum","Here is the link: https://support.razerzone.com/contact-us/\n\nWe should consider contacting more retailers and asking them to support ethereum for transactions, touting it's viability, value, low transaction fees, high transaction speeds. \n\nSimilar to calling your congressional representative, we should be having this conversation with the support staffs of various retailers.",https://www.reddit.com/r/ethereum/comments/7kh4kz/contact_razerzone_ask_them_to_support_ethereum/,5,0
7kh7ez,1513552724,Bitcoin is far less superior to Ethereum am I right?,[removed],https://www.reddit.com/r/ethereum/comments/7kh7ez/bitcoin_is_far_less_superior_to_ethereum_am_i/,1,1
7kh8y2,1513553146,Metamask lost my ETH,[removed],https://www.reddit.com/r/ethereum/comments/7kh8y2/metamask_lost_my_eth/,1,0
7kh9k7,1513553325,Bitcoin is far less superior to Ethereum am I right?,"So since I've got bitcoin I've been heavily researching what I really have here. Although it has been doing good I do feel that once all the rest of these people start researching they will find out that bitcoin can only process a few TPS, where ETH improves on. Additionally, ETH has a lot lower transaction fees and people who get ETH seems to look at it more of everyday use than gold as people who get bitcoin. Does anyone feel me on this or am I the only one? What other reasons do you think bitcoin is far less superior to ETH on? Also, what do you think ETH should be improving on? Thanks, guys love yall",https://www.reddit.com/r/ethereum/comments/7kh9k7/bitcoin_is_far_less_superior_to_ethereum_am_i/,1,16
7khb6f,1513553776,Ethereum creeping up on Dash like..,,https://www.reddit.com/r/ethereum/comments/7khb6f/ethereum_creeping_up_on_dash_like/,1,0
7khhqt,1513555711,Hey guys bought some Ether but I’m nervous.,So I bought some Ether today and I went to go send it into my wallet and this is the wallet you get off of the official Ethereum website. Anyway This is where I think I messed up so I made a wallet got everything set up then I sent my Ether to my wallet just before it was done syncing and nothing has showed up yet. Now the wallet is taking an extremely long time to download 221 blocks. Did I lose my ether?\n\nTLDR: Sent Ether to the official ethereum wallet before it was done syncing and nothing has shown up in the wallet.,https://www.reddit.com/r/ethereum/comments/7khhqt/hey_guys_bought_some_ether_but_im_nervous/,9,16
7khhwy,1513555763,Register eInc using this link and get $25 off,,https://www.reddit.com/r/ethereum/comments/7khhwy/register_einc_using_this_link_and_get_25_off/,1,0
7khkfb,1513556431,Holiday Gift: Give a piece of the moon!,,https://www.reddit.com/r/ethereum/comments/7khkfb/holiday_gift_give_a_piece_of_the_moon/,1,0
7khkzv,1513556593,Blockchain Holiday Gifts: Moon Land,,https://www.reddit.com/r/ethereum/comments/7khkzv/blockchain_holiday_gifts_moon_land/,13,2
7khmbt,1513556971,Is there any update from OpenLaw or any other project integrating text legal docs into smart-contract?,"I'm looking for a project that is developing tooling for creating text legal docs on smart-contracts. I checked open law, but cannot seem to find anything like a github, etc. If anyone knows some other options let me know.",https://www.reddit.com/r/ethereum/comments/7khmbt/is_there_any_update_from_openlaw_or_any_other/,0,5
7khpae,1513557823,"[request for help] reinstalled windows. Reinstalled ether wallet. Used backed up keystore folder before reinstalling windows. After syncing the blocks with 70 blocks left, ether in my account is still 0.",[removed],https://www.reddit.com/r/ethereum/comments/7khpae/request_for_help_reinstalled_windows_reinstalled/,1,0
7khptk,1513557972,"In honor of Vitalik Buterin helping me pay off my student loans today, I made this tribute. I hope you enjoy.",,https://www.reddit.com/r/ethereum/comments/7khptk/in_honor_of_vitalik_buterin_helping_me_pay_off_my/,1,0
