id,created_utc,title,selftext,full_link,score,comments
7ljpt5,1513971479,Blockchain Company Finom Adds Ether to its Stock Capital,,https://www.reddit.com/r/ethereum/comments/7ljpt5/blockchain_company_finom_adds_ether_to_its_stock/,1,0
7ljrbt,1513971878,The new EthereumICO Wordpress plugin is released,"Use [Wordpress Ethereum ICO ERC20 token plugin](https://ethereumico.io) to sell your Ethereum ERC20 ICO tokens from your Wordpress site.\n\nFeatures:\n\n* uses Metamask to safely perform the ERC20 token sell operation\n* show user a link to the Metamask site if the user doesn’t have the Metamask installed\n* uses a well known https://etherscan.io API to provide your client an automatic rate calculations\n* supports a bounty program, if your ERC20 crowdsale contract supports it.",https://www.reddit.com/r/ethereum/comments/7ljrbt/the_new_ethereumico_wordpress_plugin_is_released/,9,5
7ljs4z,1513972100,Ethereum coins visible in etherscan.io but not showing in my wallet,[removed],https://www.reddit.com/r/ethereum/comments/7ljs4z/ethereum_coins_visible_in_etherscanio_but_not/,1,0
7ljtjp,1513972463,Welcome To the CRYPTO GHETTO! (Everything Is a MF STEAL!) ( AND IM HOLDING!),,https://www.reddit.com/r/ethereum/comments/7ljtjp/welcome_to_the_crypto_ghetto_everything_is_a_mf/,1,0
7ljuk9,1513972734,Help! What's the fix?,,https://www.reddit.com/r/ethereum/comments/7ljuk9/help_whats_the_fix/,1,0
7ljy6c,1513973652,My first ever investment at 22 years old. 100% in on crypto 😂 a staggering $50 investment,[deleted],https://www.reddit.com/r/ethereum/comments/7ljy6c/my_first_ever_investment_at_22_years_old_100_in/,1,1
7lk2bp,1513974767,A Day in the Life of the Blockmason Founders.,,https://www.reddit.com/r/ethereum/comments/7lk2bp/a_day_in_the_life_of_the_blockmason_founders/,1,0
7lk3rx,1513975150,LTC &gt; Ether,[removed],https://www.reddit.com/r/ethereum/comments/7lk3rx/ltc_ether/,1,0
7lk3zn,1513975208,RX 570 Underclock/undervolt hashrate,[removed],https://www.reddit.com/r/ethereum/comments/7lk3zn/rx_570_underclockundervolt_hashrate/,1,1
7lk4ty,1513975426,Why Bitcoin Cash Is A Scam,,https://www.reddit.com/r/ethereum/comments/7lk4ty/why_bitcoin_cash_is_a_scam/,1,0
7lk60d,1513975733,AUC Token Model: How it works – Auctus,,https://www.reddit.com/r/ethereum/comments/7lk60d/auc_token_model_how_it_works_auctus/,5,1
7lk6cv,1513975834,Bitcoin vs Litecoin vs Ethereum - A breakdown for the flood of Coinbase users who don't know what they're buying,[deleted],https://www.reddit.com/r/ethereum/comments/7lk6cv/bitcoin_vs_litecoin_vs_ethereum_a_breakdown_for/,6,1
7lkc9e,1513977440,Whats going on?,,https://www.reddit.com/r/ethereum/comments/7lkc9e/whats_going_on/,1,0
7lkcyu,1513977633,Status Development Update for the 15th to the 21st of December,,https://www.reddit.com/r/ethereum/comments/7lkcyu/status_development_update_for_the_15th_to_the/,5,0
7lkerr,1513978132,Anybody know where I can still buy ETH from the EU?,[removed],https://www.reddit.com/r/ethereum/comments/7lkerr/anybody_know_where_i_can_still_buy_eth_from_the_eu/,1,0
7lkff3,1513978310,How to prove identity with ethereum?,"Hello guys, I was wondering as to how would one go about to prove their identity on the blockchain or if they wanted to be sure of someone else's identity, without relying on a third party such as a birth certificate or an ID card?\n\nBetter, would it be possible to create incentives for someone to reveal their real identity and disincentives for them to lie or conceal their actual identity?\n\n",https://www.reddit.com/r/ethereum/comments/7lkff3/how_to_prove_identity_with_ethereum/,0,2
7lkfs4,1513978405,50 spins,[removed],https://www.reddit.com/r/ethereum/comments/7lkfs4/50_spins/,1,0
7lkgf4,1513978593,Newbie question - My ether wallet - myetherwallet,[removed],https://www.reddit.com/r/ethereum/comments/7lkgf4/newbie_question_my_ether_wallet_myetherwallet/,1,0
7lkgo8,1513978673,Wtf !,,https://www.reddit.com/r/ethereum/comments/7lkgo8/wtf/,1,3
7lkh86,1513978818,"Tale of a quick, painful lesson and Security tips for new crypto investors",,https://www.reddit.com/r/ethereum/comments/7lkh86/tale_of_a_quick_painful_lesson_and_security_tips/,1,1
7lkj4z,1513979353,ETH scalability and competitors?,"What are some of the issues with Ethereum and why are its competitors like EOS, Cardano booming now? Is it the scalability issue? Is Plasma becomes a reality and process millions of transactions / second, what is the need for other platforms?",https://www.reddit.com/r/ethereum/comments/7lkj4z/eth_scalability_and_competitors/,1,3
7lkjof,1513979491,"Tale of a quick, painful lesson and Security tips for new crypto investors",[removed],https://www.reddit.com/r/ethereum/comments/7lkjof/tale_of_a_quick_painful_lesson_and_security_tips/,1,1
7lkkai,1513979665,Just wanted to put this out there for when Ethereum drops again; suicide is a permanent solution to a temporary problem.,,https://www.reddit.com/r/ethereum/comments/7lkkai/just_wanted_to_put_this_out_there_for_when/,1,0
7lkld7,1513979963,Five Issues Preventing Blockchain From Going Mainstream- The Insanely Popular Crypto Game Etheremon Is One Of Them,,https://www.reddit.com/r/ethereum/comments/7lkld7/five_issues_preventing_blockchain_from_going/,1,0
7lklgt,1513979987,Bitcoin Cryptocurrency Prices Falling: Why and What To Do Now,,https://www.reddit.com/r/ethereum/comments/7lklgt/bitcoin_cryptocurrency_prices_falling_why_and/,1,0
7lklsa,1513980069,Need help with instalment of wallet (x-post ethtrader),,https://www.reddit.com/r/ethereum/comments/7lklsa/need_help_with_instalment_of_wallet_xpost/,1,0
7lkmeh,1513980234,SwissBorg Contest – Prize Pool 100’000 CHSB Tokens to win ! Value $10’000 USD,,https://www.reddit.com/r/ethereum/comments/7lkmeh/swissborg_contest_prize_pool_100000_chsb_tokens/,1,0
7lkmzd,1513980400,New to this.. should I buy alt coins with ETH OR BTC at this point?,[removed],https://www.reddit.com/r/ethereum/comments/7lkmzd/new_to_this_should_i_buy_alt_coins_with_eth_or/,1,0
7lko6n,1513980734,I fucking love ETH,I don't care if I get downvoted for this. Tiny ass fees. Fast ass confirmations. Awesome community. Amazing tech. What's not to love? ,https://www.reddit.com/r/ethereum/comments/7lko6n/i_fucking_love_eth/,290,138
7lkpdu,1513981084,DAO hacker finally revealed?,,https://www.reddit.com/r/ethereum/comments/7lkpdu/dao_hacker_finally_revealed/,17,15
7lkq0a,1513981271,A stranger's ethereum saved my puppy- Christmas Miracle,[removed],https://www.reddit.com/r/ethereum/comments/7lkq0a/a_strangers_ethereum_saved_my_puppy_christmas/,1,0
7lkrbj,1513981632,"Front-running, Griefing and the Perils of Virtual Settlement (Part 1) - 0x",[deleted],https://www.reddit.com/r/ethereum/comments/7lkrbj/frontrunning_griefing_and_the_perils_of_virtual/,1,0
7lks2n,1513981854,Ridiculous Transfer Fees?,"Trying to transfer over $50 of ETH from Mist to Bittrex for a pump 'n dump into another coin, and it's trying to charge me .05ETH at MINIMUM for a transfer fee. That's something like $40, and it wants to charge me 2ETH for a ""fast"" transfer. Anybody have any idea what the fuck is going on with transfer fees? This seems criminal",https://www.reddit.com/r/ethereum/comments/7lks2n/ridiculous_transfer_fees/,1,4
7lks7r,1513981891,A Stranger's Ethereum Saved Our Puppy- A Christmas Miracle,[removed],https://www.reddit.com/r/ethereum/comments/7lks7r/a_strangers_ethereum_saved_our_puppy_a_christmas/,0,19
7lks9h,1513981900,Etherium stands as #1 held crypto in /r/cryptocurrency post (x-post from /r/cryptocurrency),,https://www.reddit.com/r/ethereum/comments/7lks9h/etherium_stands_as_1_held_crypto_in/,16,7
7lksbr,1513981916,Unable to restore multisig contract,"I was using a wallet on my Macbook and decided to back up my accounts earlier this year.  It turns out this was a very slow platform to load blocks and sync with the network, so I created a VM elsewhere.  I'm trying to re-import my accounts and wallet contracts, but no matter what I do I'm unable to restore the multisig contract I created.\n\nI can view the address on etherscan and I see the ether is in the account.  I can also still see the contract on my old Macbook wallet with the ether in it, so it appears that I didn't completely lose everything.\n\nI've tried to import the contract, but when I do it simply tells me ""This address has no wallet contract"".  I've tried to add it as a watched contract, but the value remains at 0 ether.  Both of my multisig accounts imported back to the new Ethereum wallet just fine, so I'm confused why this isn't showing up properly.\n\nMy old Macbook was using a 0.8.x wallet and the new one I have on the VM is 0.9.3.  I'm tempted to try to withdraw everything from the Macbook contract back to my normal account, then just create a brand new contract on the VM.  Will that work, or is there another way to import/restore my multisig contract that I've not tried yet?",https://www.reddit.com/r/ethereum/comments/7lksbr/unable_to_restore_multisig_contract/,1,0
7lkt5c,1513982138,ETHLend adding some interesting functionality to their smart contract,[deleted],https://www.reddit.com/r/ethereum/comments/7lkt5c/ethlend_adding_some_interesting_functionality_to/,1,0
7lkttu,1513982323,"Need help, simple prob about addresses on ETH","Hello all, my question:\n\nERC-20 Wallet address what is it? Are all ethereum addresses compitable for ERC-20 , can I simply generate new paper wallet and receive tokens instantly or I have to activate my ERC-20 address somehow. \n\npls help!\n\nThanks in advance love you all brothers.",https://www.reddit.com/r/ethereum/comments/7lkttu/need_help_simple_prob_about_addresses_on_eth/,1,9
7lkuqy,1513982588,how to make money with Ethereum.. A must read..,,https://www.reddit.com/r/ethereum/comments/7lkuqy/how_to_make_money_with_ethereum_a_must_read/,1,0
7lkuwi,1513982634,Custom 8-GPU mining frame build,,https://www.reddit.com/r/ethereum/comments/7lkuwi/custom_8gpu_mining_frame_build/,1,1
7lkv4a,1513982697,"Saw it at 1094 transactions the day it broke a million and I saw it broke 1,1 earlier today, kinda neat.",https://bitinfocharts.com/ethereum/,https://www.reddit.com/r/ethereum/comments/7lkv4a/saw_it_at_1094_transactions_the_day_it_broke_a/,1,0
7lkvif,1513982802,9 of the 10 Top Underrated Coins Are ERC20 Tokens,[deleted],https://www.reddit.com/r/ethereum/comments/7lkvif/9_of_the_10_top_underrated_coins_are_erc20_tokens/,1,1
7ll456,1513985309,Binance stole my 0.5eth,[removed],https://www.reddit.com/r/ethereum/comments/7ll456/binance_stole_my_05eth/,1,0
7ll4rs,1513985507,Anyone as excited as I am for this?,[deleted],https://www.reddit.com/r/ethereum/comments/7ll4rs/anyone_as_excited_as_i_am_for_this/,1,0
7ll4yn,1513985569,For anyone freaking out about BITTREX transfers,"I have seen a lot of posts regarding concerns about ETH transfers into bittrex. Before you worry or post asking if your ETH is evaporated, wait at least 2-3 hours. I have sent 2 transactions in the past 24 hours and it has been slower than usual, but can confirm it is working and every post i've read about stuck transfers have just ended up being slow.",https://www.reddit.com/r/ethereum/comments/7ll4yn/for_anyone_freaking_out_about_bittrex_transfers/,2,2
7ll5sj,1513985815,External Price Feeds in a DAPP using Oraclize - How ETHLend Does It,,https://www.reddit.com/r/ethereum/comments/7ll5sj/external_price_feeds_in_a_dapp_using_oraclize_how/,11,7
7ll8xn,1513986762,Is there any Reason not to try 9.000.000 gas? (or even 10.000.000),"The actual uncle rate, at 8 mil. gas with full blocks is about 27%, less than 33% when the gas was about 6.7 milion with full blocks.\n\nSo I don't see any reason not to try a little bump at 9.000.000 gas.\n\nAm I wrong?",https://www.reddit.com/r/ethereum/comments/7ll8xn/is_there_any_reason_not_to_try_9000000_gas_or/,17,5
7ll9kn,1513986955,Atiwinflash file missing error,[removed],https://www.reddit.com/r/ethereum/comments/7ll9kn/atiwinflash_file_missing_error/,1,0
7llatt,1513987366,Join our community and collect some of the 10.000 cryptopunks living on the blockchain!,,https://www.reddit.com/r/ethereum/comments/7llatt/join_our_community_and_collect_some_of_the_10000/,2,0
7llbwi,1513987719,With a hardware wallet in the trunk with some ETH,,https://www.reddit.com/r/ethereum/comments/7llbwi/with_a_hardware_wallet_in_the_trunk_with_some_eth/,3,0
