id,created_utc,title,selftext,full_link,score,comments
7bl216,1510144829,Ethereum Creator Wonders Whether His Currency Should Be Scarcer,,https://www.reddit.com/r/ethereum/comments/7bl216/ethereum_creator_wonders_whether_his_currency/,54,23
7bl374,1510145221,zksnarks at Devcon3,Will there be videos online regarding the topic zksnarks at Devcon3 ??\nhttps://ethereumfoundation.org/devcon3/zk-snarks/\n,https://www.reddit.com/r/ethereum/comments/7bl374/zksnarks_at_devcon3/,10,7
7bl3x8,1510145490,Stagnant ETH,[removed],https://www.reddit.com/r/ethereum/comments/7bl3x8/stagnant_eth/,1,0
7bl5mx,1510146052,These are the lines of code that killed the Parity contract and why you really shouldn't blindly copy paste code. Bonus: why I think devops199 is evil.,[removed],https://www.reddit.com/r/ethereum/comments/7bl5mx/these_are_the_lines_of_code_that_killed_the/,7,2
7bl6da,1510146297,MegaThread: Parity Multi-Signature Library Self-Destruct,"Use this for all questions, answers, proposals, opposals, discussions, etc.\n\nDetails can be found [here](https://paritytech.io/blog/security-alert.html).\n\nWallets affected are the ones deployed since july with Parity.\n\nAs per the sub rules: **Keep price discussion and market talk, memes &amp; exchanges to subreddits such as** /r/ethtrader\n\nThe equivalent thread For price disccusion can be found [here](https://www.reddit.com/r/ethtrader/comments/7blsvu/megathread_parity_multisignature_library/)",https://www.reddit.com/r/ethereum/comments/7bl6da/megathread_parity_multisignature_library/,98,435
7bl6rl,1510146424,Can’t transfer Ether and tokens from MyEtherWallet,[removed],https://www.reddit.com/r/ethereum/comments/7bl6rl/cant_transfer_ether_and_tokens_from_myetherwallet/,1,0
7bl6rm,1510146424,Can’t transfer Ether and tokens from MyEtherWallet,"Hello everyone,\n\nI tried to transfer my ether and tokens to the exchange yesterday but it did not go through. I am wondering what happened? And is there any parallels with this recent hack that occurred yesterday? I thought etherwallet was not hurt by that. \nDoes anyone know what is going on? ",https://www.reddit.com/r/ethereum/comments/7bl6rm/cant_transfer_ether_and_tokens_from_myetherwallet/,0,11
7bl70o,1510146496,A Potential Process for Code Review and Verification,<not selftext available>,https://www.reddit.com/r/ethereum/comments/7bl70o/a_potential_process_for_code_review_and/,1,0
7bl7l9,1510146677,Why proof of stake needs more thought,[removed],https://www.reddit.com/r/ethereum/comments/7bl7l9/why_proof_of_stake_needs_more_thought/,1,0
7bl9qf,1510147390,"Ethereum Metropolis - Cryptocurrency Blog for Ethereum News, ICO plans.",,https://www.reddit.com/r/ethereum/comments/7bl9qf/ethereum_metropolis_cryptocurrency_blog_for/,1,0
7blbc9,1510147918,It's like saying the internet is broken because Yahoo was hacked.,<not selftext available>,https://www.reddit.com/r/ethereum/comments/7blbc9/its_like_saying_the_internet_is_broken_because/,0,2
7blbrd,1510148051,Begginer looking for wallet recomendations,[removed],https://www.reddit.com/r/ethereum/comments/7blbrd/begginer_looking_for_wallet_recomendations/,1,1
7blbtx,1510148070,'Accidentally Killed It': Parity Grapples With $280 Mln Locked ETH,,https://www.reddit.com/r/ethereum/comments/7blbtx/accidentally_killed_it_parity_grapples_with_280/,1,1
7ble5f,1510148813,$300 of Ether has been mistakenly destroyed by a developer...,,https://www.reddit.com/r/ethereum/comments/7ble5f/300_of_ether_has_been_mistakenly_destroyed_by_a/,1,0
7bleso,1510149031,Opinion on what Parity should have done in July (and still can do now),<not selftext available>,https://www.reddit.com/r/ethereum/comments/7bleso/opinion_on_what_parity_should_have_done_in_july/,1,1
7blgd2,1510149467,Ethereum wallet issue - are any of the exchanges affected?,[removed],https://www.reddit.com/r/ethereum/comments/7blgd2/ethereum_wallet_issue_are_any_of_the_exchanges/,1,1
7blid2,1510149991,Parity Wallet Hack 2: Electric Boogaloo; A Technical Postmortem,,https://www.reddit.com/r/ethereum/comments/7blid2/parity_wallet_hack_2_electric_boogaloo_a/,1,1
7blk4u,1510150513,"Canonical WETH - a shared wrapped ether contract for Augur, district0x, Gnosis, Maker, Melonport, Paradex, Radar Relay and The 0cean",,https://www.reddit.com/r/ethereum/comments/7blk4u/canonical_weth_a_shared_wrapped_ether_contract/,96,6
7blkgd,1510150598,Ethereum used in implementation of Authenticated Identity with Trusted Key and Auth0,,https://www.reddit.com/r/ethereum/comments/7blkgd/ethereum_used_in_implementation_of_authenticated/,4,4
7blkn4,1510150654,Predictions for 2018,[removed],https://www.reddit.com/r/ethereum/comments/7blkn4/predictions_for_2018/,1,0
7blmpz,1510151248,Dear Eth newbie....,,https://www.reddit.com/r/ethereum/comments/7blmpz/dear_eth_newbie/,1,0
7bln7d,1510151401,A protocol level “fix” for all smart contracts stuck with this [the parity] kind of situation seems a proportionate and mature way of handling the situation.,[removed],https://www.reddit.com/r/ethereum/comments/7bln7d/a_protocol_level_fix_for_all_smart_contracts/,1,1
7blprp,1510152119,Why did people even use parity in the first place?! Seems like its the wallet holders fault for trusting these guys...,[removed],https://www.reddit.com/r/ethereum/comments/7blprp/why_did_people_even_use_parity_in_the_first_place/,1,1
7blqip,1510152331,What's a fair analogy to compare the recent Parity hack with?,[removed],https://www.reddit.com/r/ethereum/comments/7blqip/whats_a_fair_analogy_to_compare_the_recent_parity/,1,1
7blrz9,1510152724,Code mistake freezes up to $280 million in digital currency,,https://www.reddit.com/r/ethereum/comments/7blrz9/code_mistake_freezes_up_to_280_million_in_digital/,0,1
7blt1n,1510153026,Boycott Parity!,<not selftext available>,https://www.reddit.com/r/ethereum/comments/7blt1n/boycott_parity/,1,1
7bluxe,1510153475,ETH ICO need help,[removed],https://www.reddit.com/r/ethereum/comments/7bluxe/eth_ico_need_help/,1,1
7blvou,1510153661,A Potential Process for Code Review and Verification,[removed],https://www.reddit.com/r/ethereum/comments/7blvou/a_potential_process_for_code_review_and/,1,1
7blwng,1510153916,Sports Betting On Ethereum,"Anyone know of a place to that offers peer to peer sports betting that runs on ETH? Not looking for a sports book that accepts ETH as payment, but one that actually uses smart contracts as a way to distribute payouts. ",https://www.reddit.com/r/ethereum/comments/7blwng/sports_betting_on_ethereum/,3,9
7blytw,1510154504,ConsenSys named one of the 100 largest tech companies in NYC!,,https://www.reddit.com/r/ethereum/comments/7blytw/consensys_named_one_of_the_100_largest_tech/,113,6
7bm0r0,1510155019,"MyEtherWallet Will Implement Swarm City's ""Gas Station"".",,https://www.reddit.com/r/ethereum/comments/7bm0r0/myetherwallet_will_implement_swarm_citys_gas/,37,2
7bm0ye,1510155070,"Interesting transactions, in my opinion devops099 tried to steal it all to himself but failed.",[removed],https://www.reddit.com/r/ethereum/comments/7bm0ye/interesting_transactions_in_my_opinion_devops099/,1,0
7bm132,1510155102,Cofound.it Playoffs: An extraordinary event to celebrate your favorite Seed teams,,https://www.reddit.com/r/ethereum/comments/7bm132/cofoundit_playoffs_an_extraordinary_event_to/,3,0
7bm1pu,1510155270,Upbit Enables Korean Won Trading Market for Ethereum,,https://www.reddit.com/r/ethereum/comments/7bm1pu/upbit_enables_korean_won_trading_market_for/,1,0
7bm1s0,1510155287,Before I create a token again.,Used This : http://tokenfactory.surge.sh/#/factory\n\nCan someone explain decimal places to me ? I just spent some ETH and used 8 decimal places ended up with 11.11111111 instead of 1111111111 tokens created .... When creating tokens and I decede to use 8 dec should I do 111111111100000000 ?? \n\nI assumed the decimal place was for how divisble iit was ???\n\n------------------------------\n\nAlso Curious. If I go about and create duplicate orders to a T .. Would my balace double or would there be two seperate tokens created with different contract addresses ?? \n\nI'm assuming the later \n,https://www.reddit.com/r/ethereum/comments/7bm1s0/before_i_create_a_token_again/,1,3
7bm1s7,1510155288,"I want to invest my time in Ethereum, how can I do this most efficiently?",[removed],https://www.reddit.com/r/ethereum/comments/7bm1s7/i_want_to_invest_my_time_in_ethereum_how_can_i_do/,1,1
7bm4fo,1510155961,Where Can I Find Projects to Alpha Test on?,[removed],https://www.reddit.com/r/ethereum/comments/7bm4fo/where_can_i_find_projects_to_alpha_test_on/,1,0
7bm5c7,1510156174,China is coming back.,,https://www.reddit.com/r/ethereum/comments/7bm5c7/china_is_coming_back/,1,0
7bm7kw,1510156742,"The Parity multi-sig attack is different from The DAO. Parity multi-sig is a lot of money owned by a small amount of community members. The DAO was a lot of money owned by a lot of community members. One threatens to make a few people unhappy, the other threatened to make a lot of people unhappy.",[removed],https://www.reddit.com/r/ethereum/comments/7bm7kw/the_parity_multisig_attack_is_different_from_the/,1,1
7bm7wi,1510156819,"Pragmatism: Unfreezing assets is VERY different than DAO and recovering theft. Stupidity should have a cost associated, need some governance. This makes me sick but does not break immutability of ETH like DAO case.",[removed],https://www.reddit.com/r/ethereum/comments/7bm7wi/pragmatism_unfreezing_assets_is_very_different/,1,1
7bmbb5,1510157605,How to Rebalance or Close a PRISM using ETHEREUM WALLET when you can't send 0 ZERO transaction??,"Hi Group - I recently created a PRISM (prism.exchang) and now i'd like to rebalance, and it asks to send a 0 ZERO eth transaction to the prism/contract address but when trying to do so on the official ETHEREUM Wallet, it won't allow.  \n\nanyone on Prism beta and can assist?",https://www.reddit.com/r/ethereum/comments/7bmbb5/how_to_rebalance_or_close_a_prism_using_ethereum/,1,3
7bmbku,1510157673,"The Hydra Project - Ethereum Smart Contract Framework for Decentralized Security and Bug Bounties, Rigorous Cryptoeconomic Security Guarantees, Mitigating Programmer and Compiler Error",,https://www.reddit.com/r/ethereum/comments/7bmbku/the_hydra_project_ethereum_smart_contract/,24,11
7bmbry,1510157722,Where Can I Find Projects to Alpha Test on?,Is there a place that connects projects to alpha testers?\n\nShould there be?,https://www.reddit.com/r/ethereum/comments/7bmbry/where_can_i_find_projects_to_alpha_test_on/,0,0
7bmckk,1510157916,Maybe a stupid question?,[removed],https://www.reddit.com/r/ethereum/comments/7bmckk/maybe_a_stupid_question/,1,0
7bmdkt,1510158157,"GRMTK Token Launch will be Live Streamed Tomorrow, Nov 9th at 9:00pm (CET)/ 3:00pm (EST)",,https://www.reddit.com/r/ethereum/comments/7bmdkt/grmtk_token_launch_will_be_live_streamed_tomorrow/,18,6
7bmei3,1510158386,Our first Dapp: Hash Heroes,,https://www.reddit.com/r/ethereum/comments/7bmei3/our_first_dapp_hash_heroes/,8,9
7bmfah,1510158576,PROBLEMS LOGGING IN WITH KRAKEN,[removed],https://www.reddit.com/r/ethereum/comments/7bmfah/problems_logging_in_with_kraken/,1,0
7bmfe9,1510158606,parity's reality,,https://www.reddit.com/r/ethereum/comments/7bmfe9/paritys_reality/,1,1
7bmhxe,1510159239,Insights into a Modern World,[deleted],https://www.reddit.com/r/ethereum/comments/7bmhxe/insights_into_a_modern_world/,1,0
7bmih3,1510159372,SpankChain Token Sale Video w/ Kayden Kross,,https://www.reddit.com/r/ethereum/comments/7bmih3/spankchain_token_sale_video_w_kayden_kross/,64,57
