id,created_utc,title,selftext,full_link,score,comments
7ome5i,1515276899,"New layout for MetalPay released, the coin which gives you 5% back when converting fiat to crypto",[deleted],https://www.reddit.com/r/ethereum/comments/7ome5i/new_layout_for_metalpay_released_the_coin_which/,1,0
7omets,1515277082,Brazilian Government Plans to Process Petitions and Write Laws on Ethereum (CoinTelegraph),,https://www.reddit.com/r/ethereum/comments/7omets/brazilian_government_plans_to_process_petitions/,1,0
7omf0a,1515277129,How To Earn Ethereum (ETH) Online Fast And Free,,https://www.reddit.com/r/ethereum/comments/7omf0a/how_to_earn_ethereum_eth_online_fast_and_free/,1,0
7omjh9,1515278304,eth-button: A simple way to accept donations with Ethereum,,https://www.reddit.com/r/ethereum/comments/7omjh9/ethbutton_a_simple_way_to_accept_donations_with/,1,1
7omk7w,1515278499,China clamping down on mining,With China clamping down on mining what does this mean for blockchain technologies that rely on miners for tx validation?\n\nDoes this mean tangle based technologies like IOTA will take off instead? Or maybe ripples centralised block chain technology?\n\nhttps://www.gizmodo.com.au/2018/01/chinas-crackdown-on-crypto-mining-threatens-bitcoins-future/\n\n,https://www.reddit.com/r/ethereum/comments/7omk7w/china_clamping_down_on_mining/,3,2
7oml6y,1515278774,best app for view cryptocurrency stats,,https://www.reddit.com/r/ethereum/comments/7oml6y/best_app_for_view_cryptocurrency_stats/,1,0
7omlyp,1515278994,Broken keystore file,[removed],https://www.reddit.com/r/ethereum/comments/7omlyp/broken_keystore_file/,1,0
7omqt3,1515280306,Good price to buy in at?,[deleted],https://www.reddit.com/r/ethereum/comments/7omqt3/good_price_to_buy_in_at/,1,6
7omr2k,1515280382,You can still register a new account with a referral invite,,https://www.reddit.com/r/ethereum/comments/7omr2k/you_can_still_register_a_new_account_with_a/,1,0
7omsgy,1515280769,What would you say a complete beginner to programming should start learning before Solidity to get a full grasp on it and programming apps on Ether ?,<not selftext available>,https://www.reddit.com/r/ethereum/comments/7omsgy/what_would_you_say_a_complete_beginner_to/,1,0
7omsiy,1515280784,"Would a coin split, similar to a stock split, be practical or even possible with Ethereum?",<not selftext available>,https://www.reddit.com/r/ethereum/comments/7omsiy/would_a_coin_split_similar_to_a_stock_split_be/,1,0
7omugu,1515281278,I think someone is sending out ethereum in random amounts to random people,[removed],https://www.reddit.com/r/ethereum/comments/7omugu/i_think_someone_is_sending_out_ethereum_in_random/,1,0
7omvdv,1515281522,MedCredits releases Alpha of first ever decentralized healthcare platform,,https://www.reddit.com/r/ethereum/comments/7omvdv/medcredits_releases_alpha_of_first_ever/,1,0
7omy0t,1515282252,Is mining still worth it?,[removed],https://www.reddit.com/r/ethereum/comments/7omy0t/is_mining_still_worth_it/,1,0
7on0z3,1515283060,MedCredits advances healthcare with the first Decentralized Token Registry of Doctors,,https://www.reddit.com/r/ethereum/comments/7on0z3/medcredits_advances_healthcare_with_the_first/,1,0
7on1rr,1515283279,"Kind of ""hack"" to register on binance for those who missed the chance (The link is my refferal I hope it will help people)",,https://www.reddit.com/r/ethereum/comments/7on1rr/kind_of_hack_to_register_on_binance_for_those_who/,1,0
7on268,1515283391,MedCredits advances healthcare with the first decentralized registry of doctors,,https://www.reddit.com/r/ethereum/comments/7on268/medcredits_advances_healthcare_with_the_first/,1,0
7on2km,1515283515,ETH just broke $1k and no top post?,[deleted],https://www.reddit.com/r/ethereum/comments/7on2km/eth_just_broke_1k_and_no_top_post/,1,1
7on2mx,1515283532,MedCredits advances healthcare with the first decentralized registry of doctors,,https://www.reddit.com/r/ethereum/comments/7on2mx/medcredits_advances_healthcare_with_the_first/,36,15
7on3pz,1515283822,"EtherZero - A Revolutionary Ethereum Hard Fork, Forking on 19th Jan 2018",,https://www.reddit.com/r/ethereum/comments/7on3pz/etherzero_a_revolutionary_ethereum_hard_fork/,1,1
7on56t,1515284205,"Ethereum Wallet - 2 Accounts - Can't Send From Second Account, Please Help!",<not selftext available>,https://www.reddit.com/r/ethereum/comments/7on56t/ethereum_wallet_2_accounts_cant_send_from_second/,1,0
7on7g7,1515284847,"Interview with Vignesh Sundaresan, Lendroid: Margin Trading on 0x and Basic Income as a CryptoPledge",,https://www.reddit.com/r/ethereum/comments/7on7g7/interview_with_vignesh_sundaresan_lendroid_margin/,1,0
7on9h9,1515285410,We launched an avatar collecting game,Here's the link: http://ethbabes.com/\n\nThis is an extension of our NSFW version and leverages the same smart contract.  We got an awesome start already and a lot of members of the community interacting with the website.\n\nFeel free to ask us questions or comment. Here's a link to the contract to verify: https://etherscan.io/address/0xef2742e5af727bd7d615d9e3d0e4f6efb1176447#code\n\nOur discord: https://discord.gg/EjPKAPh,https://www.reddit.com/r/ethereum/comments/7on9h9/we_launched_an_avatar_collecting_game/,3,3
7ondiv,1515286532,An Ethereum (ETH) Based World,,https://www.reddit.com/r/ethereum/comments/7ondiv/an_ethereum_eth_based_world/,1,0
7onehb,1515286791,Question about EC20 Wallet compatibility,Hello!\n\nI've participated in a ICO token sale for Crypterium. I need to input my ETH wallet address that is ERC-20 compatible as indicated here: https://tokenmarket.net/what-is/ethereum-token-wallets/\n\nI use Mist at the moment but also have a Ledger Nano.\n\nI'm not sure what is the correct way of setting this up... Is the Ledger Nano Eth Wallet ERC-20 compatible? Do I need to change any config files for my Mist wallet to accept these ERC-20 tokens?\n\nAny help would be appreciated!\n\n,https://www.reddit.com/r/ethereum/comments/7onehb/question_about_ec20_wallet_compatibility/,1,2
7onfk8,1515287091,Will fees get substantially lowered?,"I've given up Bitcoin as a result of their high fees. I'm wondering if Ethereum fees are going to be substantially lowered and if so, by how much?",https://www.reddit.com/r/ethereum/comments/7onfk8/will_fees_get_substantially_lowered/,3,18
7oni89,1515287864,Ether wallet most like electrum for bitcoin,[removed],https://www.reddit.com/r/ethereum/comments/7oni89/ether_wallet_most_like_electrum_for_bitcoin/,1,0
7oninv,1515287994,Does the ethereum wallet found on ethereum.org support receiving and sending tokens?,,https://www.reddit.com/r/ethereum/comments/7oninv/does_the_ethereum_wallet_found_on_ethereumorg/,5,1
7onnhu,1515289471,DApp developers /engineers: why is building in the etherium blockchain better than others? Pls ELI5,[removed],https://www.reddit.com/r/ethereum/comments/7onnhu/dapp_developers_engineers_why_is_building_in_the/,1,0
7onpwx,1515290176,"50,000 pending transactions as of a minute ago",Holy shit ,https://www.reddit.com/r/ethereum/comments/7onpwx/50000_pending_transactions_as_of_a_minute_ago/,11,29
7onq34,1515290228,"Can decentralized Ethereum-based service provide a lower cost infrasctructure than a centralized one? If so, where?",I have heard that decentralization is expensive and that it can be more expensive than a centralized infrastructure.  Where can Ethereum lower costs compared to a centralized infrastructure?  Is it possible?\n\nI read that decentralization benefits in the following areas:\n\n1. Centralized point of failure.\n2.  Centralizad point of trust,https://www.reddit.com/r/ethereum/comments/7onq34/can_decentralized_ethereumbased_service_provide_a/,2,7
7onrx0,1515290733,Me and many other Mist users unable to Sync,[removed],https://www.reddit.com/r/ethereum/comments/7onrx0/me_and_many_other_mist_users_unable_to_sync/,1,0
7onwyf,1515292195,Are people using EtherDelta exchange?,How good is it in user experience? Support? Other stuff?,https://www.reddit.com/r/ethereum/comments/7onwyf/are_people_using_etherdelta_exchange/,1,4
7onxll,1515292387,Good airdrop projects?,[removed],https://www.reddit.com/r/ethereum/comments/7onxll/good_airdrop_projects/,127,45
7ony77,1515292566,EtherDelta slow deposits,"Hey guys, anyone else here experiencing slowness with depositing into smart contracts? I’m doing 4gwei,  it’s been maybe 1 hour and the transaction is not even showing on my ledger, yet my balance is ties up. What is a reasonable gas price?\n\nThanks!!",https://www.reddit.com/r/ethereum/comments/7ony77/etherdelta_slow_deposits/,6,14
7onyuy,1515292775,If every country accept Crypto then which coin accepted on the worldwide?,[removed],https://www.reddit.com/r/ethereum/comments/7onyuy/if_every_country_accept_crypto_then_which_coin/,1,0
7oo0vg,1515293417,Live on the Ropsten Testnet: Connect Four,[removed],https://www.reddit.com/r/ethereum/comments/7oo0vg/live_on_the_ropsten_testnet_connect_four/,1,0
7oo2ub,1515294029,Live on Ropsten: Connect Four,"Over the past month or so, I developed a Connect Four dApp. The smart contract (located at [0x602F8bb9C210Ba311B7e6C8C18e6F5Ef6680d980](https://ropsten.etherscan.io/address/0x602f8bb9c210ba311b7e6c8c18e6f5ef6680d980)) manages games, enforces the rules of connect four, and pays out the winner of a game. \n\nSource on [GitHub](https://github.com/dmelcer9/connect-four-dapp).\n\nYou can find the app here: http://www.danielmelcer.net/connect-four-dapp/ ",https://www.reddit.com/r/ethereum/comments/7oo2ub/live_on_ropsten_connect_four/,25,7
7oo5in,1515294871,CryptoMilli - Check whether you're crypto millionaire,,https://www.reddit.com/r/ethereum/comments/7oo5in/cryptomilli_check_whether_youre_crypto_millionaire/,1,0
7oo7cp,1515295475,Intrinsic Gas too low,[removed],https://www.reddit.com/r/ethereum/comments/7oo7cp/intrinsic_gas_too_low/,1,0
7oo9l5,1515296191,What can you use to track your portfolio value if you move your coins to a hardware wallet?,[removed],https://www.reddit.com/r/ethereum/comments/7oo9l5/what_can_you_use_to_track_your_portfolio_value_if/,8,14
7oo9y5,1515296307,Smart contracts,Can someone give me some examples where smart contracts where executed and enforced using Ethereum’s platform? ,https://www.reddit.com/r/ethereum/comments/7oo9y5/smart_contracts/,23,13
7oobf4,1515296800,I don’t think Ethereum is ever going to fall under 1k!,[removed],https://www.reddit.com/r/ethereum/comments/7oobf4/i_dont_think_ethereum_is_ever_going_to_fall_under/,1,0
7ooe07,1515297676,How will implementation of ZKSnarks hold up against services like chainalysis that track transaction history?,,https://www.reddit.com/r/ethereum/comments/7ooe07/how_will_implementation_of_zksnarks_hold_up/,28,10
7oof2d,1515298039,"MakerDAO and the promise of ""programmable money""",[removed],https://www.reddit.com/r/ethereum/comments/7oof2d/makerdao_and_the_promise_of_programmable_money/,1,0
7oofqn,1515298266,Ethereum Lyte (Elyte)2nd social media Bounty,,https://www.reddit.com/r/ethereum/comments/7oofqn/ethereum_lyte_elyte2nd_social_media_bounty/,1,0
7oolwt,1515300327,"I want to learn how make smart contracts or be part of the future innovators of the blockchain. I don't know anything yet, where do I start ?",[removed],https://www.reddit.com/r/ethereum/comments/7oolwt/i_want_to_learn_how_make_smart_contracts_or_be/,1,0
7oomc5,1515300462,Introducing Essentia: The Framework for your Decentralized Digital Life,,https://www.reddit.com/r/ethereum/comments/7oomc5/introducing_essentia_the_framework_for_your/,1,0
7oon42,1515300729,This sub is sane.,[removed],https://www.reddit.com/r/ethereum/comments/7oon42/this_sub_is_sane/,1,1
7ooqwx,1515301982,Urgent!!!,[removed],https://www.reddit.com/r/ethereum/comments/7ooqwx/urgent/,1,0
