id,created_utc,title,selftext,full_link,score,comments
7qy7d0,1516160268,"Bitcoin and ethereum suffered massive drops, but many cryptocurrencies are faring even worse",,https://www.reddit.com/r/ethereum/comments/7qy7d0/bitcoin_and_ethereum_suffered_massive_drops_but/,0,1
7qy7sf,1516160385,Best thing I've read on crypto this past year,,https://www.reddit.com/r/ethereum/comments/7qy7sf/best_thing_ive_read_on_crypto_this_past_year/,1,0
7qy8xa,1516160692,Something to do instead of eating my fingernails whole HODLing,,https://www.reddit.com/r/ethereum/comments/7qy8xa/something_to_do_instead_of_eating_my_fingernails/,1,1
7qyf4g,1516162485,Want to stop the next bitconnect? consider joining our community.,"What happened with bitconnect was bad. We started ConcourseQ to make it harder to launch scams. ConcourseQ is an open, collaborative token due diligence community, and we try to organize the community around finding scams. We had an active warning on the bitconnect ico: https://concourseq.io/Q/BitconnectX\n\nIf you visit the main page, you can see other tokens that also have active warnings: https://concourseq.io\n\nif you want to help out contributing to the research,we'd love to have you!",https://www.reddit.com/r/ethereum/comments/7qyf4g/want_to_stop_the_next_bitconnect_consider_joining/,87,42
7qygix,1516162891,Etherchain 'call' transaction?,"So I recently received some Ether in my wallet, but the transaction type on Etherchain says 'Call' while an earlier transaction says 'Tx'. What does this mean? And what is the difference?",https://www.reddit.com/r/ethereum/comments/7qygix/etherchain_call_transaction/,0,2
7qyh9b,1516163104,For everyone that can't set a buy order on coinbase mobile,<not selftext available>,https://www.reddit.com/r/ethereum/comments/7qyh9b/for_everyone_that_cant_set_a_buy_order_on/,1,0
7qyjik,1516163762,"I stupidly sent ETC to a ETH account on Coinjar, The say I have lost my money",[removed],https://www.reddit.com/r/ethereum/comments/7qyjik/i_stupidly_sent_etc_to_a_eth_account_on_coinjar/,1,0
7qynqn,1516165042,Understanding Crypto-Currency Coins creation,[removed],https://www.reddit.com/r/ethereum/comments/7qynqn/understanding_cryptocurrency_coins_creation/,1,2
7qys9u,1516166391,I made a community where people motivate each other to build good habits! You check-in once a day! I thought r/Ethereum would like it!!,[removed],https://www.reddit.com/r/ethereum/comments/7qys9u/i_made_a_community_where_people_motivate_each/,1,1
7qyu3r,1516166954,Current officially announces upcoming token sale. ☺️🚀Public pre-sale goes live February 7th and goes until February 21st!!,,https://www.reddit.com/r/ethereum/comments/7qyu3r/current_officially_announces_upcoming_token_sale/,0,1
7qyue1,1516167053,Decentralized RPG Ethercraft launches on Ethereum,,https://www.reddit.com/r/ethereum/comments/7qyue1/decentralized_rpg_ethercraft_launches_on_ethereum/,1,0
7qyxw5,1516168219,Poloniex question,[deleted],https://www.reddit.com/r/ethereum/comments/7qyxw5/poloniex_question/,2,2
7qz08f,1516169006,"We're going to make our way out of a structured economy and monetary system, says Ethereum's founding team member and ConsenSys founder Joseph Lubin",,https://www.reddit.com/r/ethereum/comments/7qz08f/were_going_to_make_our_way_out_of_a_structured/,1,1
7qz0ix,1516169101,Why is sharding so difficult to implement? Is my design impossible?,"Hi,\n\nI was thinking about scaling/sharding and thought of a rudimentary design. Keep in mind I am a complete blockchain noob.\n\nI know much smarter and experienced people have been working on this for years so I assume there must be drawbacks and difficulties that I can't grasp. I am trying to get a better understanding of this matter.\n\nWhat are the major difficulties in implementing a sharding algorithm for scaling? Is my design theoretically impossible/insecure? Or technically impossible to implement?\n\nThe way I see it, the design could work like this:\n\n##I. Basic Design##\n\n1. There is one main ethereum network that keeps track of all the Eth in the world: Let's call it the International eth network.\n\n2. Anyone can join this network like in today's implementation.\n\n3. Anyone can create a bridge contract to a new Etheremum blockchain (subblockchain): Let's call two of these USA, and France. \n\n5. This bridge contract is mirrored on both blockchains using the interblockchain transaction process described below and includes technical details on joining the new blockchain.\n\n6. Although the subblockchains are controlled by whoever joins them and are as such untrusted, the International blockchain only keeps track of a the total amount of eth available to that subblockchain. As such, it does not need to worry about the amount of eth each user of the subblockchain controls.\n\n7. Most miners/stakers on the subblockchain only validate local transactions (e.g USA-&gt;USA) and only need to keep a copy of the subblockchain.\n\n8. A specific type of miners/stakers can validate interblockchain transactions. To become an interblockchain miner/staker, they must do as follow:\n\n	A. Keep a copy of both the subblockchain (e.g USA) and the parent blockchain (e.g International);\n\n	B. Stake an amount of Eth (e.g 1000 eth minum) in the bridge contract, these stake being tied to their addresses on both blockchains (could be the same) by the contract.\n	\n##II. Blockchain-&gt;Subblockchain Transactions##\n\n1. Bob, a user of the International blockchain wants to transfer Eth to Alice, in the France subblockchain.\n\n2. Bob issues a parent blockchain transaction to the bridge contract with Alices's subblockchain address as metadata and transaction fees for both the international and local transactions. \n\n3. For convenience, the Ethereum protocol may now support addresses in a format such as [BridgeAddress].[AliceAddess] or with ENS (Ethereum Name Service) INTERNATIONAL.FRANCE.ALICE.\n\n4. From the perspective of the International blockchain the transaction amount is stored in the bridge contract (that will thus store all eth on the subblockchain). \n\n5. When the transaction to the bridge contract is validated in the parent blockchain, an interblockchain miner/staker is selected (e.g randomly depending on block hash or a process similar to PoS). The selected interblockchain miner/staker can only validate transactions of a ratio of his stake (e.g 1/1000).\n\n6. The selected miner/staker can issue a transaction on the subblockchain to Alice by triggering a function on the subblockchain copy of the bridge contract.\n\n7. From the perspective of the subblockchain miners/stakers, this amount appears from the bridge contract with no proof but they can trust it for the followoing reasons:\n	\n	A. The bridge contract validates that the miner/staker's stake is sufficient to create the transaction;\n\n	B. The parent blockchain transaction ID is included in the metadata for other interblockchain miner/staker to verify it;\n\n	C. If it is fraudulent transaction, interblockchain miner/stakers can activate a function of the bridge contract to eliminate the malicious miner/staker from both chains;\n\n	D. If more than 51% of them activate this feature, the malicious actor looses his stake and bridging privileges;\n\n	E. Because the staker can only validate 1/x of his stake, eth from his stake can be used to compensate/perform the malicious transaction. The rest of the eth can be distributed to all subblockchain users or burnt.\n	\n8. When operations on the bridge contract are made on the parent blockchain (e.g new interblockchain staker), they are reproduced on the subblockchain using a similar process except that interblockchain stakers capitalizing more than 51% of the total stakes must validate it on the subblockchain by calling a function in the bridge contract.\n\n##III. Subblockchain-&gt;Blockchain Transactions##\n\n1. Alice, a user of the France blockchain wants to tranfer Eth to Bob in the International blockchain.\n\n2. Alice issues a subblockchain transaction to the bridge contract with Bob's address in the parent blockchain as metadata (or with ENS International.BOB);\n\n3. From the perspective of the subblockchain, the transaction amount is destroyed.\n\n4. When the transaction to the bridge contract is validated in the subblockchain, an interblockchain miner/staker is selected (e.g randomly depending on block hash or a process similar to PoS). The selected interblockchain miner/staker can only validate transactions of a ratio of his stake (e.g 1/1000).\n\n5. The selected miner/staker can issue a transaction on the parent blockchain to Bob by triggering a function on the parent blockchain copy of the bridge contract.\n\n6. From the perspective of the International miners/stakers, this amount is taken from the bridge contract with no proof but they can trust it for the following reasons:\n	\n	A. The bridge contract validates that the miner/staker's stake is sufficient to create the transaction;\n\n	B. The subblockchain transaction ID is included in the metadata for other interblockchain miner/stakers to verify it;\n\n	C. If it is fraudulent transaction, interblockchain miner/stakers can activate a function of the bridge contract to eliminate the malicious miner/staker from both chains;\n\n	D. If more than 51% of them activate this feature, the malicious actor looses his stake and bridging privileges;\n\n	E. Because the staker can only validate 1/x of his stake, Eth from his stake can be used to compensate or recreate the malicious transaction. The rest of the eth can be distributed to all subblockchain users or burnt;\n\n	F. If the transaction is fraudulent and is still validated, it does not matter from a parent blockchain's perspective as the Eth is taken from the bridge contract.\n	\n##IV. Subblockchain -&gt; Subblockchain transactions##\n\n1. Let's assume the USA subblockchain now has a subblockchain called NYC.\n\n2. Alice, a user of the France blockchain wants to tranfer Eth to Kevin in the NYC blockchain.\n\n3. Alice will issue a transaction on the France subblockchain to the bridge contract with the routing information in the metadata:\n	\n	A. Kevin's address such as (with ENS) INTERNATIONAL.USA.NYC.KEVIN;\n\n	B. A transaction fee for each of the transactions involved in each of the blockchains: France, Interational, USA and NYC. \n\n4. Each bridge contract will relay the transaction according to the routing information.\n\n5. If the transaction fee is not sufficient at any of the subsequent transaction, Alice may loose her Eth, although a verification at the wallet and local bridge level may be performed.\n\n##V. Other considerations##\n\n1. If a user does not trust a subblockchain, he should not send any eth to that subblockchain's bridge, it is his own responsibility.\n\n2. The main blockchain does not need to hold any trust in any of the subblockchains.\n\n3. A 51% attack can be performed on any of the subblockchains if attackers gather sufficient stake. \n\n4. Trust in a subblockchain can be measured in the amount of stake in the bridging contract.\n\n5. When a bridging contract is created, it should be frozen until sufficient stakes have been gathered to prevent the first stakers from 51%ing each others.\n\n6. Only the main blockchain can create new Eth.",https://www.reddit.com/r/ethereum/comments/7qz0ix/why_is_sharding_so_difficult_to_implement_is_my/,92,20
7qz0y1,1516169268,Not just the Crypto Market was stormy...Crypto Valley too! Must be correlated somehow,,https://www.reddit.com/r/ethereum/comments/7qz0y1/not_just_the_crypto_market_was_stormycrypto/,1,0
7qz1nb,1516169465,"Bitconnect, which has been accused of running a Ponzi scheme, shuts down",[deleted],https://www.reddit.com/r/ethereum/comments/7qz1nb/bitconnect_which_has_been_accused_of_running_a/,1,0
7qz2c6,1516169690,Selecting Hardware To Start Ethereum Mining,,https://www.reddit.com/r/ethereum/comments/7qz2c6/selecting_hardware_to_start_ethereum_mining/,1,0
7qz872,1516171784,Can deposits and monthly rent be made simpler and more transparent with smart contracts? We think it can help ease the life for nomad travelers and looking for ways to implement it #ETHEREUM #TRX #TRON,,https://www.reddit.com/r/ethereum/comments/7qz872/can_deposits_and_monthly_rent_be_made_simpler_and/,1,0
7qz9c3,1516172212,How large is the ethereum chain structure? I am syncing at 32 million and counting,[removed],https://www.reddit.com/r/ethereum/comments/7qz9c3/how_large_is_the_ethereum_chain_structure_i_am/,1,0
7qzbrz,1516173105,Is it still possible to still use the official ethereumwallet with Parity?,"About a year ago, it was possible to use the official ethereumwallet client with Parity, but when I tried to do it last night, upon starting ethereumwallet I saw messages like ""Geth error: fatal: error starting protocol stack: listen udp :30303: bind: address already in use"".\nI started parity with these flags set:\n--ui-interface all\n--jsonrpc-interface all\n--geth\n\nAccording to `parity --help` the --geth flag is a 'legacy' option - is it still meant to work, and if so how?\n",https://www.reddit.com/r/ethereum/comments/7qzbrz/is_it_still_possible_to_still_use_the_official/,4,1
7qzcnx,1516173439,Bitcoin to double in 2018. Ethereum and Ripple investors can relax too.,[deleted],https://www.reddit.com/r/ethereum/comments/7qzcnx/bitcoin_to_double_in_2018_ethereum_and_ripple/,1,1
7qzdxa,1516173924,Dallas Mavericks to Accept Cryptocurrency For Tickets,,https://www.reddit.com/r/ethereum/comments/7qzdxa/dallas_mavericks_to_accept_cryptocurrency_for/,1,0
7qzfpn,1516174699,SELFKEY lost? Don´t see any on myetherwallet.,[removed],https://www.reddit.com/r/ethereum/comments/7qzfpn/selfkey_lost_dont_see_any_on_myetherwallet/,1,0
7qzfqo,1516174712,Bug smart contract ETH,<not selftext available>,https://www.reddit.com/r/ethereum/comments/7qzfqo/bug_smart_contract_eth/,1,0
7qzhkf,1516175466,Bug smart contract ETH,<not selftext available>,https://www.reddit.com/r/ethereum/comments/7qzhkf/bug_smart_contract_eth/,1,0
7qzi3h,1516175687,TAKE PHOTO — MAKE MONEY with Selfllery social platform,,https://www.reddit.com/r/ethereum/comments/7qzi3h/take_photo_make_money_with_selfllery_social/,1,1
7qzisx,1516175977,Reason why the price of Ethereum is going up.,[deleted],https://www.reddit.com/r/ethereum/comments/7qzisx/reason_why_the_price_of_ethereum_is_going_up/,1,0
7qzj2x,1516176084,Everybody who is seriously considering Lamborghinis...,[removed],https://www.reddit.com/r/ethereum/comments/7qzj2x/everybody_who_is_seriously_considering/,1,0
7qzj58,1516176106,Bug smart contract ETH,<not selftext available>,https://www.reddit.com/r/ethereum/comments/7qzj58/bug_smart_contract_eth/,1,0
7qzl9r,1516176950,Question from long time ETH holder,[deleted],https://www.reddit.com/r/ethereum/comments/7qzl9r/question_from_long_time_eth_holder/,1,2
7qzlpe,1516177126,"Got tired of trading, so I built an Ethereum Lottery",<not selftext available>,https://www.reddit.com/r/ethereum/comments/7qzlpe/got_tired_of_trading_so_i_built_an_ethereum/,1,0
7qzm8k,1516177385,TBX Token (Tokenbox.io) now LIVE in the Bancor Network. There are already 23 convertible token and counting...,[deleted],https://www.reddit.com/r/ethereum/comments/7qzm8k/tbx_token_tokenboxio_now_live_in_the_bancor/,1,0
7qzmxs,1516177678,"Problem, cant see NAGA Coins ?",,https://www.reddit.com/r/ethereum/comments/7qzmxs/problem_cant_see_naga_coins/,1,0
7qzn4t,1516177766,A smart contract that functions as a lottery...,"So a friend and colleague of mine were jokingly talking about the future of smart contracts and the differences between what Bitcoin and Ethereum can offer the world. Of course, we ended up in a small discussion on what weird things could be done as well and we jokingly talked about a lottery using Ethereum smart contracts. \n\nSo, we decided to do a little experiment. He wrote a smart contract that actually functions as an automatic lottery. You signup by sending an X amount of ETH, and when the lottery hits 1 ETH total or a 100 participants, 95% is instantly send to a random participant. \n\nWe thought it was pretty funny, but we actually want to give it a shot.\n\nSo here is a chance to win some Ethereum for those that are done trying to make a little bit of cash by trading all day. \nIt works as follows:\n\n1. Transfer some ETH to the address 0xE9D6db9563E1FFe38c4B2feC5Cd28C71ae44894f\n2. You are entered into the lottery with a 1/100 chance of winning the pot\n3. When the pot reaches 1 ETH, or the 100th person transfers ETH, the Lottery selects one of the participants and transfers 95% of the pot to the winner\n4. The pot and participants are reset and the lottery starts again, so your entry will never be lost, it will simply start the next lottery\n5. You can participate as many times as you like. If you are the only one to transfer ETH a 100 times in a single Lottery, you are guaranteed to win!\n\nHow would you game this system? (Or, how do you game this system? It's live...)\n\n*Edit*: Code to the Contract can be found at https://gist.github.com/anonymous/337a7cbb356ae4d898e891b206c1dc27",https://www.reddit.com/r/ethereum/comments/7qzn4t/a_smart_contract_that_functions_as_a_lottery/,11,51
7qznd2,1516177865,"TBX Token (Tokenbox.io) now LIVE in the Bancor Network for continuous, decentralized and automated liquidity.",[deleted],https://www.reddit.com/r/ethereum/comments/7qznd2/tbx_token_tokenboxio_now_live_in_the_bancor/,1,0
7qzouo,1516178506,Cant find Naga Coins in my wallet ?,[removed],https://www.reddit.com/r/ethereum/comments/7qzouo/cant_find_naga_coins_in_my_wallet/,1,0
7qzow2,1516178526,trancation fail pls solve the problum,[removed],https://www.reddit.com/r/ethereum/comments/7qzow2/trancation_fail_pls_solve_the_problum/,1,0
7qzs6t,1516179940,How to Secure Your Smart Contracts: 6 Solidity Vulnerabilities and how to avoid them (Part 2),,https://www.reddit.com/r/ethereum/comments/7qzs6t/how_to_secure_your_smart_contracts_6_solidity/,48,5
7qzt02,1516180263,Apollo,,https://www.reddit.com/r/ethereum/comments/7qzt02/apollo/,1,0
7qzyi9,1516182593,"I have opened an account on MyEtherWallet. Now, how do I buy ETH or transfer ETH to my account, in order to pay to an ICO crowdsale?",[removed],https://www.reddit.com/r/ethereum/comments/7qzyi9/i_have_opened_an_account_on_myetherwallet_now_how/,1,1
7qzypb,1516182663,MEW and MetaMask,"I was looking for Ethereum wallets and came across MEW. I set it up and it said that it's dangerous to use your private key, keystore amd JSON file to access it. So I downloaded MetaMask. But what's the point of MEW if you have to open it via MetaMask/Mist or hardwallets?  \nIsn't it easier to use MetaMask directly without MEW? Thing is so confusing.",https://www.reddit.com/r/ethereum/comments/7qzypb/mew_and_metamask/,2,11
7qzz1h,1516182818,How do we get privacy on Ethereum in 2018?,[removed],https://www.reddit.com/r/ethereum/comments/7qzz1h/how_do_we_get_privacy_on_ethereum_in_2018/,1,0
7r00a8,1516183342,Cornell Professor Claims Ethereum is More Distributed and Decentralized Than Bitcoin,,https://www.reddit.com/r/ethereum/comments/7r00a8/cornell_professor_claims_ethereum_is_more/,772,80
7r049t,1516184929,Every time I open Blockfolio...,,https://www.reddit.com/r/ethereum/comments/7r049t/every_time_i_open_blockfolio/,1,0
7r04y1,1516185202,Account management APIs via RPC,"Does anyone have compelling use-cases for them? I am not talking about listing accounts and signing with them (I can see use-cases for this) - I am talking about newAccount,importRawKey and such.\n\nHas anyone seen (real world) Dapps using this?",https://www.reddit.com/r/ethereum/comments/7r04y1/account_management_apis_via_rpc/,6,1
7r0bhx,1516187862,ETH transfer at a low fee. Missing or not?,,https://www.reddit.com/r/ethereum/comments/7r0bhx/eth_transfer_at_a_low_fee_missing_or_not/,1,0
7r0dvp,1516188797,VariabL Development Update (Q4'2017) — From Alpha to Production,[deleted],https://www.reddit.com/r/ethereum/comments/7r0dvp/variabl_development_update_q42017_from_alpha_to/,1,0
7r0e9k,1516188961,"To Counter the Bubble Narrative, the Longstanding DApp projects should stop being perfectionist and release whatever they have",[removed],https://www.reddit.com/r/ethereum/comments/7r0e9k/to_counter_the_bubble_narrative_the_longstanding/,1,1
7r0ezv,1516189243,"To Counter the Bubble Narrative, the Longstanding DApp projects should stop being perfectionist and release whatever they have",[removed],https://www.reddit.com/r/ethereum/comments/7r0ezv/to_counter_the_bubble_narrative_the_longstanding/,1,1
7r0gv8,1516189945,How will the ethereumWallet ever sync 100% if 4-5 blocks keep adding every minute,"Newbie Question, \nI have been syncing since past 3 days.\nwith geth fast cache 8192, it took around 16 hrs to come a full sync, but since then, it keeps syncing as new blocks keep adding up. \nI check the geth attach eth.syncing regularly, and as soon as i reach the highest block, there is a new highest block..\n\nSo how does this work ?\nShould I send my ethers to my account and assume that it will show up once I sync the blocks that confirm that transaction?\n\nOr would it be better to use a ledger or any other wallet?\n\nAny thoughts on if parity is better ?\n\n\n",https://www.reddit.com/r/ethereum/comments/7r0gv8/how_will_the_ethereumwallet_ever_sync_100_if_45/,13,20
