id,created_utc,title,selftext,full_link,score,comments
7sepx3,1516717611,How to turn our smartphones into everyday hardware wallets by Zipper CTO Carsten Munk,[deleted],https://www.reddit.com/r/ethereum/comments/7sepx3/how_to_turn_our_smartphones_into_everyday/,2,1
7ser83,1516717955,Ethereum blockchain taking forever (1 month now) to download. WTH?,[removed],https://www.reddit.com/r/ethereum/comments/7ser83/ethereum_blockchain_taking_forever_1_month_now_to/,1,0
7serq8,1516718103,Polymath are hosting a conference in the Bahamas: Feb 28th - March 3rd,,https://www.reddit.com/r/ethereum/comments/7serq8/polymath_are_hosting_a_conference_in_the_bahamas/,1,0
7sesfs,1516718288,Polymath to hold conference in the Bahamas,,https://www.reddit.com/r/ethereum/comments/7sesfs/polymath_to_hold_conference_in_the_bahamas/,12,13
7setpy,1516718603,"Ethereum, Not Bitcoin, Deserves to Be the World's Most Valuable Cryptocurrency -- Here's Why",,https://www.reddit.com/r/ethereum/comments/7setpy/ethereum_not_bitcoin_deserves_to_be_the_worlds/,15,1
7setyn,1516718659,"Since there are so many altcoins, I made a tool which lets you gather all the tokens in a nicely formatted list",,https://www.reddit.com/r/ethereum/comments/7setyn/since_there_are_so_many_altcoins_i_made_a_tool/,1,0
7sezbq,1516719998,"This Video list will help you to go from ""What is eitarium?"" to ""Ethereum is gonna change the world"" ETH enthusiastic",,https://www.reddit.com/r/ethereum/comments/7sezbq/this_video_list_will_help_you_to_go_from_what_is/,5,1
7sf06b,1516720204,Move all eth and tokens to new wallet in 1 transaction?,[removed],https://www.reddit.com/r/ethereum/comments/7sf06b/move_all_eth_and_tokens_to_new_wallet_in_1/,1,0
7sf0cl,1516720241,Looking for help writing an Intro To Crypto course,[removed],https://www.reddit.com/r/ethereum/comments/7sf0cl/looking_for_help_writing_an_intro_to_crypto_course/,1,0
7sf1zr,1516720634,New Dapp Blocklord - Prelaunch on Product Hunt,,https://www.reddit.com/r/ethereum/comments/7sf1zr/new_dapp_blocklord_prelaunch_on_product_hunt/,1,0
7sf227,1516720651,Why recreational dApps matter and how they can push Ethereum forward,"*I am the developer of a dApp named [KryptoWar](https://kryptowar.com), it's a war game based entirely on the Ethereum Blockchain. I wanted to share with you a blog post to talk about recreational decentralized apps and why they matter.*\n\n---\n\n*This article was originally published [here](https://kryptowar.com/blog/recreational-decentralized-applications/).*\n\n---\nJust a couple of years ago, if you had told me that dApps were going to scale to a massive degree and generate millions of dollars in sales I would have called you crazy. However, 2017 certainly proved the potential of dApps. But how exactly? \n\nThroughout 2017, both blockchain technology’s reputation managed to rapidly grow, as well as a variety of blockchain currencies. With an enhanced reputation, massive user-growth became inevitable. Today, dApps represent (in my opinion) one of the Blockchain's most promising use case.\n\nOverview\n--------\n\nBefore diving in, I think I should clarify what dApps actually are. For starters, the term is short for decentralized application. If you’re already involved in the blockchain industry, the definition is self-explanatory and you can just skip to the next section. If you’re new, a typical app has a central authority, which is typically the creator of the app. Central authorities can play a negative influence on user-experience and privacy, whether through accessing your information used on the platform, censoring the content you put, and so on. A dApp takes away this central authority and often rewards users for contributing toward the success of the dApp.\n\nHow do dApps work?\n------------------\n\nDecentralized apps have been growing on par with Ethereum’s success as a result of Ethereum’s [innate compatibility](https://www.coindesk.com/7-cool-decentralized-apps-built-ethereum/) with developing apps. But the processes aren’t particularly intuitive. Just to clarify, this section is a vast over simplification of the overall process of dApps. To discuss how dApps truly work would require loads of more information and would distract the ultimate focus of this post—the importance of four recreational dApps. To deploy a dApp, it needs to have some sort of connection to the blockchain. Often times, to maintain distance from the main blockchain network—whether it’s for security purposes, performance, etc.—developers use sidechains, a form of decentralized blockchains, for dApps. One major tool used for browsing decentralized apps is known as [web3js](https://github.com/ethereum/web3.js/). The JavaScript API allows people to use dApps with tools like [MetaMask](https://metamask.io/) or the [Cipher Browser](https://www.cipherbrowser.com/). Combined with a UI like the [Ethereum test RPC](https://www.youtube.com/watch?v=hcTPjpPvas8) (note: this requires nodeJS), you can use web3js to easily exchange smart contracts. Without further ado, let’s get into the importance of four specific recreational apps, starting with CryptoKitties.\n\n### CryptoKitties\n\nThis app is very likely the most known recreational dApp. Attracting headlines like “the [Beanie Babies of blockchain](http://www.businessinsider.com/ethereum-cryptokitties-collectible-2018-1)” and “How one CryptoKitty was flipped for [$60,000 in four days](https://qz.com/1148553/cryptokitties-how-one-digital-cat-was-flipped-for-60000-over-four-days/),” it is needless to say that CryptoKitties has garned quite a lot of traffic. I’m sure many of you already know about [Cryptokitties](https://www.cryptokitties.co/) but for those that don’t, it is an app where you can collect different digital cats. The cats themselves have different “genetic” makeups and so on, which makes each one distinct. The nuances of the game are cool, but the implications of its growth and the increased attention brought about one major “pro” of dApps and one major “con.” First: the good. CryptoKitties traffic is extremely high. In fact, in just a few days of being online, according to TechCrunch, the app already had handled over [$1,000,000 in purchases](https://techcrunch.com/2017/12/03/people-have-spent-over-1m-buying-virtual-cats-on-the-ethereum-blockchain/). But that part isn’t as impressive as the next statistic—in the same period of time, nearly [15 percent of all Ethereum traffic](https://techcrunch.com/2017/12/03/people-have-spent-over-1m-buying-virtual-cats-on-the-ethereum-blockchain/) was driven toward the game. The growth has proven that blockchain apps have the potential to become adopted at a mainstream degree, as well as become a part of popular culture. Now comes the bad. While Cryptokitties’ growth rate was shocking, the quick attention also brought scrutiny. With its success, it became increasingly clear that the app was not truly decentralized. In fact, in a [_Medium_ blog post](https://medium.com/@CryptoKitties/is-cryptokitties-decentralized-9823b5f168af), the CryptoKitties team explained how their app wouldn’t have been as user-friendly if it were completely decentralized. Specifically, the UI and gene algorithms were centralized. _""Completely decentralizing CryptoKitties would have resulted in a game that wasn't as fun, and we would have crippled our efforts to bringing blockchain to the masses.""_ Regardless, as cute of a game as it is, CryptoKitties has serious implications regarding the blockchain—and they are for the best. To best summarize the positive impact of the dApp, [Buterin tweeted](https://twitter.com/vitalikbuterin/status/937633758781497344?lang=en): “Agree it's not close to fully decentralized in its current form. But I think people see that it can be.” The game isn’t a complete decentralized success story but it’s a giant leap in the right direction.\n\n### Smart Billions\n\nRecreational games, of course, include gambling—and, specifically, participating in a blockchain lottery. [Smart Billions](https://smartbillions.com/) launched as one of the first decentralized lotteries and made a strong mark in potentially altering a global industry. With smart contracts, the blockchain lottery was able to [increase its transparency](https://cointelegraph.com/press-releases/the-most-fair-lottery-or-how-smartbillions-is-destroying-centuries-old-superstitions) and decrease the risk of fraud (since there’s no central authority who can skew the outcomes). The platform runs off of Ethereum and seems to show a lot of potential for dApps to be completely decentralized. However, right before launching, they had a big issue: they were hacked. In October, the smart lottery founding team offered a prize of $450,000 in Ether (1,500ETH at the time) to anyone who can [hack the system](https://medium.com/@SmartBillions/smartbillions-hackathon-offically-started-deac083316f8) and withdraw funds. It took two days for [a couple of hackers](https://calvinayre.com/2017/10/13/bitcoin/500k-hack-challenge-backfires-blockchain-lottery-smartbillions/) to withdraw 400ETH or $120,000 then and win the hackathon. While the contest was for the improvement of Smart Billions, the successful hacking—in my eyes—deterred a lot from being as excited about the launch and instead being more cautious. The overall implication of this is that decentralized apps are a relatively new concept and, like most new concepts, they are susceptible. However, Smart Billion’s quick fix and subsequent launch proves that even when there are technical issues, the blockchain community will just quickly fix them and continue to grow—unlike most new industries, which lose consumer confidence from issues in their early stages.\n\n### KryptoWar\n\nAs the founder of KryptoWar, I had to talk about our work. Our game started as simple war game but is growing into something more complex where [players can purchase factories and schools](https://kryptowar.com/factories-schools/) to sell weapons and certifications to other armies. Our goal with [KryptoWar](https://kryptowar.com/) is to build a game completely decentralized so it felt like a great evolution to let players sell weapons to each other instead of getting them to purchase weapons from our smart contract. \n\nAt KryptoWar, we don’t use any side chain component. **All of the data that runs the game is stored on the Ethereum blockchain**. It’s great way to test the Blockchain and to create a completely decentralized experience.\n\nClosing Remarks\n---------------\n\nAs the world is becoming more aware and focused on Ethereum, we can expect the number of developers working on decentralized applications to continue grow rapidly. Even more, developing dApps themselves is also becoming easier with the release of tools like [CryptoZombies](https://cryptozombies.io/), which have been largely successful in teaching developers to use Solidity and Web3js. Each of these apps represents a leap in the right direction for the building decentralized apps on the Ethereum blockchain. But it’s important to realize that this is just the beginning—and everyday, dApps are becoming increasingly more advanced. Soon, we will see larger-scale apps that have achieved complete decentralization.\n\n---\n\nI would love to hear your feedback about this article and your feeling toward recreational decentralized applications. Do you trust them? Have you joined any?",https://www.reddit.com/r/ethereum/comments/7sf227/why_recreational_dapps_matter_and_how_they_can/,6,1
7sf3bp,1516720949,What’s the deal with ETZ?,[removed],https://www.reddit.com/r/ethereum/comments/7sf3bp/whats_the_deal_with_etz/,1,0
7sf3e2,1516720966,Introduction to Proof of Location – the case for decentralized location systems - FOAM,,https://www.reddit.com/r/ethereum/comments/7sf3e2/introduction_to_proof_of_location_the_case_for/,38,11
7sf3tb,1516721061,How to turn our smartphones into everyday hardware wallets by Zipper CEO Carsten Munk,,https://www.reddit.com/r/ethereum/comments/7sf3tb/how_to_turn_our_smartphones_into_everyday/,21,14
7sf4dx,1516721197,Why 2018 is Ethereum’s Year [Infographic],[deleted],https://www.reddit.com/r/ethereum/comments/7sf4dx/why_2018_is_ethereums_year_infographic/,1,0
7sf4sk,1516721295,If someone could help,[removed],https://www.reddit.com/r/ethereum/comments/7sf4sk/if_someone_could_help/,1,0
7sf7yb,1516722061,Coming soon to a cinema near you...,,https://www.reddit.com/r/ethereum/comments/7sf7yb/coming_soon_to_a_cinema_near_you/,1,1
7sf9np,1516722464,BITTREX ACCOUNT FOR SELL,,https://www.reddit.com/r/ethereum/comments/7sf9np/bittrex_account_for_sell/,1,0
7sf9s3,1516722493,"ING, Société Générale Transact First Blockchain-Based Agric Commodity Trade Via Ethereum",,https://www.reddit.com/r/ethereum/comments/7sf9s3/ing_société_générale_transact_first/,9,0
7sfbg5,1516722869,Researchers at Cornell Release Paper on Cryptocurrencies,,https://www.reddit.com/r/ethereum/comments/7sfbg5/researchers_at_cornell_release_paper_on/,7,1
7sfbtt,1516722958,Why 2018 is Ethereum’s Year [Infographic],"The details about Ethereum displayed was provided courtesy of the redditor, [barthib](https://www.reddit.com/r/ethtrader/comments/7m75u4/updated_fact_list_why_ethereum_will_be_the_most/). I came across the post and figured the post deserved a facelift to get the attention it deserves. I hope you guys enjoy it and are able to digest the information well on the infographic.\n\n**[Why 2018 is Ethereum’s Year [Infographic]](https://fangalbert.com/2018/01/23/why-2018-is-ethereums-year-infographic/)**\n\nOriginal Thread/Source:\nhttps://www.reddit.com/r/ethtrader/comments/7m75u4/updated_fact_list_why_ethereum_will_be_the_most/?st=jcsbapzh&amp;sh=eba39e36\n\nDisclaimer: I only made the infographic to make the datapoints in this thread more visual!",https://www.reddit.com/r/ethereum/comments/7sfbtt/why_2018_is_ethereums_year_infographic/,16,9
7sfc70,1516723040,"Giveth is developing an innovative testnet approach, pegging the GivETH Rinkeby Token to mainnet ETH to tackle scalability issues.",,https://www.reddit.com/r/ethereum/comments/7sfc70/giveth_is_developing_an_innovative_testnet/,36,15
7sfen5,1516723574,TODAY’S TOPIC #1: BLOCKCHAIN MARKET TRENDS FOR 2018,,https://www.reddit.com/r/ethereum/comments/7sfen5/todays_topic_1_blockchain_market_trends_for_2018/,1,0
7sfeyj,1516723640,At a keynote about smart contract disassembly and security by MATT SUICHE,,https://www.reddit.com/r/ethereum/comments/7sfeyj/at_a_keynote_about_smart_contract_disassembly_and/,1,1
7sfglc,1516724006,Pump with more :),,https://www.reddit.com/r/ethereum/comments/7sfglc/pump_with_more/,1,0
7sfjn6,1516724690,Jobstoday goes global: Your Global Job Platform,,https://www.reddit.com/r/ethereum/comments/7sfjn6/jobstoday_goes_global_your_global_job_platform/,1,0
7sfkjf,1516724896,Decentralized platform based on Ethereum Smart Contracts,,https://www.reddit.com/r/ethereum/comments/7sfkjf/decentralized_platform_based_on_ethereum_smart/,1,0
7sfkvy,1516724978,Move over BTC! Even with lightning coming I still think this article is correct.,,https://www.reddit.com/r/ethereum/comments/7sfkvy/move_over_btc_even_with_lightning_coming_i_still/,1,0
7sflme,1516725153,New Hardware Wallet,[removed],https://www.reddit.com/r/ethereum/comments/7sflme/new_hardware_wallet/,1,0
7sflu4,1516725199,Getting Traction for an Ethereum Smart Contract,[removed],https://www.reddit.com/r/ethereum/comments/7sflu4/getting_traction_for_an_ethereum_smart_contract/,1,0
7sfm1f,1516725242,Ants Reloaded Project,Ants Reloaded is the first fully decentralized and transparent payment system for gaming consoles managed by an Ethereum smart contract.\nLets See our Website http://www.antsreloaded.com/  \n\n#ANTS #ANTSReloaded #ICO #ETH #BTC #Blockchain,https://www.reddit.com/r/ethereum/comments/7sfm1f/ants_reloaded_project/,2,1
7sfo48,1516725715,Ripple &amp; these coins are going to make you rich in 2018,,https://www.reddit.com/r/ethereum/comments/7sfo48/ripple_these_coins_are_going_to_make_you_rich_in/,1,0
7sfoty,1516725875,GYM Rewards - EXERCISE REWARDS CRYPTOCURRENCY,[removed],https://www.reddit.com/r/ethereum/comments/7sfoty/gym_rewards_exercise_rewards_cryptocurrency/,1,0
7sfsap,1516726654,"BCS Token (BC Shop) now LIVE in the Bancor Network for continuous, decentralized and automated liquidity. Check out the Web App to convert BCS, BNT, ETH and other tokens directly from your Web3 wallet",,https://www.reddit.com/r/ethereum/comments/7sfsap/bcs_token_bc_shop_now_live_in_the_bancor_network/,4,0
7sfsfh,1516726683,Investing in Ethereum vs Ethereum Tokens,<not selftext available>,https://www.reddit.com/r/ethereum/comments/7sfsfh/investing_in_ethereum_vs_ethereum_tokens/,1,1
7sfswy,1516726799,"New Working Wallet DAPP: Protects you from losing your keys, from hackers and allows your family to claim your funds if you become incapacitated","**TLDR**: Here’s a [link](https://rexetblell.github.io/TrustWallet/wallet.html?wallet_address=0xdd91fa3b84b1080f3b618cbc47e06c57def689b9) to a sample wallet that is deployed on Mainnet. You need MetaMask in your browser to be able to view it. This wallet has some real Ether in it.\n\nI talked about this idea [here](https://www.reddit.com/r/ethereum/comments/6dz1zs/a_new_type_of_multisig_wallet_for_safer_storage/) and [here](https://www.reddit.com/r/ethereum/comments/7ipfmc/is_it_possible_to_put_someones_will_on_a_smart/dr0gq5l/) and it seems to have been well received.\n\nThe wallet should have several users, just like a multisig. The key idea is when a user initiates a transaction, she has to wait for some period of time before being able to actually execute it. This delay can be different for different users. A transaction can be canceled while it is pending (after it was initiated, but before it was executed).\n\nHere’s how to use the wallet practically. Add a key of your friend with a delay of 1 year. Add a key of some family member with a delay of 6 months. Add your hot wallet key (such as Metamask or Parity) with a delay of 2 months. Add your hardware wallet key (such as Ledger Nano S) with a delay of 2 weeks. Add your most secure key, such as a paper wallet and set the delay to 0. The idea is that the lower the security of the key, the higher the delay should be.\n\nIf one of the keys gets hacked, you can always cancel its transactions (and remove the key), using a key with with a lower delay (which means it has more privileges). You should keep an eye on the wallet from time to time to make sure there are no unexpected pending transactions in it.\n\nIf you forget some of your keys, you can still access your funds using your other keys. Even if you lose all of your keys, your friends/family can help recover your funds after a few months of waiting. If you become incapacitated, your family/friends can still access your funds.\n\nIt currently works on Both Ropsten and Mainnet. To create a wallet, select Ropsten or Mainnet in MetaMask and go to [this page](https://rexetblell.github.io/TrustWallet/), and click “Create New Wallet”. This will deploy a new contract. To test it out for free, switch to Ropsten in MetaMask. The gas fee to create a new wallet on Mainnet is around 1 USD if you set the gas price to 1 GWEI. [Here](https://rexetblell.github.io/TrustWallet/wallet.html?wallet_address=0xb78d3f1d81991f7ca3d45ec8051817469b6fb0c0) is a sample wallet that I deployed on Ropsten.\n\n[Here’s a wallet](https://rexetblell.github.io/TrustWallet/wallet.html?wallet_address=0xdd91fa3b84b1080f3b618cbc47e06c57def689b9) I created on MainNet. As you can see, the wallet has several active users. Each user has a different waiting time. Some users were removed. There are 3 executed transactions, 1 canceled transaction and 1 pending transaction. The pending transaction can be executed in about 8 months from now. [Here’s](https://etherscan.io/address/0xdd91fa3b84b1080f3b618cbc47e06c57def689b9) a link to it on Etherscan. The wallet has some real Ether in it. Please try to steal it :) I am also offering a bug bounty. If you report a critical vulnerability in the contract, I’ll send you 0.5 ETH (this offer stands until June 1, 2018).\n\nThe source code for the factory contract (contract that deploys wallet contracts when users click “Create New Wallet”) is verified on Etherscan on both [Ropsten](https://ropsten.etherscan.io/address/0x8948075ce42e656a83f76b9a3d0b53e8dc5c7a66#code) and [Mainnet](https://etherscan.io/address/0x903db1bf91cc22964cccfbe1a1875eb3b989f32a#code)",https://www.reddit.com/r/ethereum/comments/7sfswy/new_working_wallet_dapp_protects_you_from_losing/,23,15
7sfvqx,1516727395,"district0x Dev Update - January 23rd, 2018 – district0x",,https://www.reddit.com/r/ethereum/comments/7sfvqx/district0x_dev_update_january_23rd_2018_district0x/,0,0
7sfw4s,1516727473,"district0x Dev Update - January 23rd, 2018",,https://www.reddit.com/r/ethereum/comments/7sfw4s/district0x_dev_update_january_23rd_2018/,43,1
7sfwas,1516727508,Flyp.me First Payout Instruction,,https://www.reddit.com/r/ethereum/comments/7sfwas/flypme_first_payout_instruction/,2,0
7sfzal,1516728157,"What is the usual delay in buying and selling Ethereum? From fiat to ETH, and vice versa.","Does the Exchange make a difference? I am considering Coinbase, and a few other US and Canadian exchanges. Advice and experiences welcome!",https://www.reddit.com/r/ethereum/comments/7sfzal/what_is_the_usual_delay_in_buying_and_selling/,1,7
7sg03b,1516728322,Lets calculate! Cost of Education in your Country or state,"Ethereum is going to be the main crypto currency used for almost all crypto currency transactions in the future, so we can start calculating the price of things in ETH now as it is what we will use in the future to pay our fees.\nIn Nigeria, the average cost of school fees for secondary education( equivalent to US middle and high school) annually for good Private schools is 0.45 ETH.\nFor good Government Schools it is 0.20 ETH.\n\nFor an Undergraduate in a private university, annual tuition fees is 2.05 ETH\nAnd for a Government University is 0.3 ETH.\n\nFor a Graduate programme, the annual tuition for a Private University is 3.0 ETH\nFor a Government University the tuition is 0.52 ETH for Nigerians and 0.86 ETH for foreigners.\n\nBut for elementary education in a Government school, annual school fees is 0.08 ETH\nAnd for a private school is 0.25 ETH.\nComment the cost of EDUCATION in your countries or states.",https://www.reddit.com/r/ethereum/comments/7sg03b/lets_calculate_cost_of_education_in_your_country/,0,0
7sg0oe,1516728451,Blockchain and cryptocurrency may soon underpin cloud storage,,https://www.reddit.com/r/ethereum/comments/7sg0oe/blockchain_and_cryptocurrency_may_soon_underpin/,16,0
7sg0zy,1516728527,Can Ethereum be used in a Goldfinger-style attack to reduce the utility of Bitcoin?,,https://www.reddit.com/r/ethereum/comments/7sg0zy/can_ethereum_be_used_in_a_goldfingerstyle_attack/,1,0
