id,created_utc,title,selftext,full_link,score,comments
7sg15h,1516728558,What did I find out after researching 610 coins/tokens from EtherDelta: the overview,"It was like looking for a needle in a haystack, searching for a hidden gem. Taking part in an expedition to the interior of the Earth. \nWell, frankly speaking it was not; I and my team just researched more than 600 coins/tokens listed officially on EtherDelta.\n\n**What did we found out?** \n\nThat every second project was “the FIRST”, some of them where even “the FIRST AND ONLY”. After reading about 50 of them, I just thought that it’s funny. After reading 100 of them, I thought that maybe it’s because it’s a very small community with a low amount of projects (in comparison to all internet projects) and they are so focused on themselves that they don’t read about others. After reading 150 of “the first and only” I just had one question in my head: “who is this one vocabulary teacher who taught all people involved in cryptocurrency?” Don’t get me wrong - it was also my mistake when I joined a blockchain-based startup, I thought that everything we do were “the first and only” (and some of the things we did probably as the first; like first tokenized real object, an ikea rat, 1st of August 2017) but who really care if we did it as the first? \n\nOur excel sheets contained those fields: smart contract address, decimals, symbol, website, general token information, e-mail contact, medium, blog, Reddit, Twitter, whitepaper, GitHub, SlideShare, Facebook, telegram, video, linkedin, bitcointalk, Vkontakte, Instagram, discord, glitter, CrunchBase, chat, slack and others.\n\nAnd what are our conclusions? \n\n**a) Description of the project**\n\nI already know why Twitter was created: it’s the only way for startups to fit into 140 characters to explain their project. Sometimes it was really hard to understand what those projects are about, so if the claim didn’t say anything, we were searching for it in the whitepaper, twitter, sometimes Facebook or on Reddit. \n\n**b) Hello, it's me:  e-mail addresses**\n\nOnly 282 from 610 projects gave an e-mail address on their website. I don’t know that to think about that. I like to have an option; I like to know that there is a real person behind a project who will help me when I have a problem with a product. Don’t you?\n\n**d) Whitepapers**\n\nOnly 321 projects had whitepapers (or light papers). Is it okay or not? It was harder for me to to understand do I want to buy their tokens. But still: 321 from 610 is 52,6 % - so let’s say it’s a half of projects who resigned from informing their communities about their next steps, the vision, the background and so on. Well, we’re at the moment where anything can happen with crypto, so why not - there is no The 10 Commandments about crypto, no “official” standards, so everyone are choosing what is best for them, \n\n**e) social media:**\n\n* Medium 231\n* blog 58\n* own subreddit 238\n* twitter 452 (!!)\n* github 215 \n* slideshare 5\n* facebook 321\n* telegram 299\n* video/yt 185\n* linkedin 147\n* bitcointalk 298\n* instagram 20\n* discord 29\n* chat 11\n* others 63 \n* slack 81 \n\nall those above are per 610.\n\nThose data were really interesting for me! Look how many of those projects own a Twitter account: 452 of them! And only 215 of them have a github. I’m amazed how many of them (29) are using discord - it’s getting more and more popular concerning blockchain community - and not all of them were connected to gaming industry!\n\n**Why did we research those tokens?** \n\nWe were collecting a useful content for our (beta)platform for crypto-investors trivial.co where users can get information about different coins/tokens, you can check it here: \n\n**TOKENS**: If you would like to check for example ZRX- 0x tokens you can do that here: https://trivial.co/t/0xe41d2489571d322189246dafa5ebde1f4699f498 (the number in the link is just a smart contract number of ZRX - you can check it with any different token on Ethereum blockchain).\n\n**ACCOUNTS**: If you would like to check the balance or tokens of any address - you can do that here: https://trivial.co/profile/XXX - where XXX is any account number. So basically it’s working like etherscan - we don’t collect any data, it’s always on users’ site.\n\nWe had to research each of them listed on EtherDelta manually, which means reading everything about those projects one by one, so we could get as much knowledge as possible on every token and team behind it. \n\nI don’t know if any token creator will update their projects’ websites with a good description, I know that researching those websites helped me a lot to find few tokens which I bought and will keep it for a longer time (I don't buy for trading, I decided to have less tokens but well researched and ""safe""). Take care!\n",https://www.reddit.com/r/ethereum/comments/7sg15h/what_did_i_find_out_after_researching_610/,40,6
7sg2hy,1516728840,The World Economic Forum In Davos Draws Cryptocurrency Enthusiasts The World Over,,https://www.reddit.com/r/ethereum/comments/7sg2hy/the_world_economic_forum_in_davos_draws/,5,0
7sg3q7,1516729115,We have a new Ethereum painting in the L4 Ventures office in Toronto,,https://www.reddit.com/r/ethereum/comments/7sg3q7/we_have_a_new_ethereum_painting_in_the_l4/,37,9
7sgb97,1516730743,Ethminer 0.13rc9 is giving me a win64/coinminer.fl threat,[removed],https://www.reddit.com/r/ethereum/comments/7sgb97/ethminer_013rc9_is_giving_me_a_win64coinminerfl/,1,1
7sgcvb,1516731074,Let's celebrate our Launch ==&gt; Reddit Fighter Giveaway!,,https://www.reddit.com/r/ethereum/comments/7sgcvb/lets_celebrate_our_launch_reddit_fighter_giveaway/,2,0
7sgd2n,1516731118,Introducing Vaulty,,https://www.reddit.com/r/ethereum/comments/7sgd2n/introducing_vaulty/,2,1
7sgf8t,1516731589,The future of media is in the hands of humans and machines,,https://www.reddit.com/r/ethereum/comments/7sgf8t/the_future_of_media_is_in_the_hands_of_humans_and/,8,0
