id,created_utc,title,selftext,full_link,score,comments
7snr7r,1516807156,Question on smart contract events,"Edit: does no one know the answer to this or is it being downvoted for another reason? Would love if someone could just point me in the right direction.\n\nThis may be an easy question that has been asked and answered many times, but I wasn't sure what terminology to search to find out the answer. \n\nMy question is, in the case of smart contracts where the goal is to remove third parties, how do the contracts observe or know about external events that trigger execution of the contract?\n\nAn example might be a will. I want money to go from person A to person B when person A dies. But how does the contract know about person A's death? It would clearly be up to person B to notify the contract about the happening, but person B could trigger that event if they wanted to while A was alive. \n\nJust curious how this works. Thanks for your help. ",https://www.reddit.com/r/ethereum/comments/7snr7r/question_on_smart_contract_events/,0,4
7snrbi,1516807188,"Ethereum rated ""B"" by Weiss Ratings - Highest rating of all cryptocurrencies",,https://www.reddit.com/r/ethereum/comments/7snrbi/ethereum_rated_b_by_weiss_ratings_highest_rating/,368,78
7snu10,1516807830,UN Creates Blockchain Coalition to Tackle Climate Change,,https://www.reddit.com/r/ethereum/comments/7snu10/un_creates_blockchain_coalition_to_tackle_climate/,10,2
7snulz,1516807962,Firefly Source Released (https://firefly.city),"Hey all!\n\nThe initial developer release of the Firefly source code is [now available](https://github.com/firefly/wallet) and [Ethers Wallet](https://itunes.apple.com/us/app/ethers-wallet/id1186052971?mt=8) has been updated with Firefly support.\n\nFeatures:\n\n- **Cheap** - build one for around $5 in [parts](https://firefly.city#build)\n- **Securely air-gapped** - uses BLE to receive transactions and QR codes to send signed data\n- **Mobile-friendly** - No cables or adapters required, just scan the QR code\n- **Open source** - schematics, [breadboard prototype](https://github.com/firefly/wallet/blob/master/diagrams/breadboard.png), Arduino sketch and libraries\n\nPlease note this is the version 0 (v0) protocol, which communicates over an encrypted channel using a symmetric key shared during pairing and the private key is placed onto the Arduino at compile time, and stored unencrypted.\n\nThe version 1 (v1) protocol will use ECDH during pairing and the private key will be stored encrypted on the Firefly for a much more secure experience.\n\nWe just wanted to get this out into the world so people can start experimenting with it and get some feedback. We will be posting some YouTube videos over the next few days to help you get up to speed building and using the Firefly.\n\nThanks! Let us know what you think.\n\nP.S. If you are the developer of a mobile wallet (especially looking for Android) and would like to add support, we’d love to chat.",https://www.reddit.com/r/ethereum/comments/7snulz/firefly_source_released_httpsfireflycity/,22,11
7snvta,1516808268,"Did anyone else notice that Facebook was one of the sponsors for the decentralization report from IC3 (Emin Gun Sirer, et al)?","IC3 released a big study on decentralization in Bitcoin and Ethereum on Jan 11. You can find it here: https://arxiv.org/abs/1801.03998 \n\n(It raised some serious concerns about decentralization in both, especially about mining centralization, but did conclude that Ethereum's nodes are more distributed.) In any event, look on pg 15, in the acknowledgements - Facebook provided some of the funding.\n\nAny thoughts?",https://www.reddit.com/r/ethereum/comments/7snvta/did_anyone_else_notice_that_facebook_was_one_of/,1,2
7snxsz,1516808740,Ethereum,"Guys i wanted to do some videos about ethereum, first about whats going to happen with ethereum (switchting to proof of stake)\nand a video about ethereum vs neo.\nSo what would be the main points to touch on both themes, and could you provide some good resources for me to research about those 2 themes. Would be appreciated!",https://www.reddit.com/r/ethereum/comments/7snxsz/ethereum/,1,3
7so0vx,1516809440,"My ETH transaction failed, what happens next?","Hi Guys,\n\nThis might be a noobie question but I was trying to get in on the blockport.io ico and I had sent about £500 worth of eth into the address. 5 minutes later the ethscan page says the transaction has failed. \n\nhttps://etherscan.io/tx/0x9642f3652dbdb01956611e67811183c635c7e2cb9311822240f5bfafc5a36135\n\nWhat happens next? Do my coins get returned to me or are they lost for good?\n\nThanks. Mike",https://www.reddit.com/r/ethereum/comments/7so0vx/my_eth_transaction_failed_what_happens_next/,8,10
7so0ym,1516809457,Different Approaches to Ethereum Identity Standards,,https://www.reddit.com/r/ethereum/comments/7so0ym/different_approaches_to_ethereum_identity/,33,6
7so18y,1516809525,"Upcoming Event: Ethereum-(ETH)-Weiss-Crypto-Ratings - January 24, 2018 12:00 AM - 11:59 PM",,https://www.reddit.com/r/ethereum/comments/7so18y/upcoming_event_ethereumethweisscryptoratings/,0,1
7so1qa,1516809644,Launch of Aragon Nest grants program for Ethereum projects,,https://www.reddit.com/r/ethereum/comments/7so1qa/launch_of_aragon_nest_grants_program_for_ethereum/,18,12
7so32w,1516809958,"Event Live Stream and Discussion Thread: Decentralized Exchange Meetup in Berlin. OmiseGo, AirSwap, 0x Project, Gnosis, Radar Relay and Kyber Network hosted by The Web3 Foundation!",It's a big day in Berlin! The Web3 Foundation has brought a number of teams together for an event that will be livestreamed here: \n\nLink 1. https://www.facebook.com/FactoryBrln/\n\nLink 2. http://www.pressnplay.co/streaming/dexmeetupberlin\n\nEvent Time: 7PM Local (Two hours from post time)\n\nLet's discuss here as these teams look to continue to build some of the finest projects on the Ethereum platform.,https://www.reddit.com/r/ethereum/comments/7so32w/event_live_stream_and_discussion_thread/,13,0
7so3gy,1516810039,The CFTC Sues Three Cryptocurrency-Based Companies,,https://www.reddit.com/r/ethereum/comments/7so3gy/the_cftc_sues_three_cryptocurrencybased_companies/,11,2
