id,created_utc,title,selftext,full_link,score,comments
7w0j6w,1518046889,if your not happy with where were at look at Feb 2016 and 2017,[deleted],https://www.reddit.com/r/ethereum/comments/7w0j6w/if_your_not_happy_with_where_were_at_look_at_feb/,1,1
7w0lci,1518047400,ECB says regulating cryptocurrencies is ‘not exactly very high on our to-do list’,,https://www.reddit.com/r/ethereum/comments/7w0lci/ecb_says_regulating_cryptocurrencies_is_not/,84,12
7w0p1i,1518048387,SALT is hiring! Come see us in Denver!,[removed],https://www.reddit.com/r/ethereum/comments/7w0p1i/salt_is_hiring_come_see_us_in_denver/,0,0
7w0phj,1518048505,New game! Collect unique digital cards on ethereum blockchain!,,https://www.reddit.com/r/ethereum/comments/7w0phj/new_game_collect_unique_digital_cards_on_ethereum/,1,0
7w0sm5,1518049282,Information on etherscan,"Hello everyone,\nI have an Ethereum address which is used as a receiving payment address my ERC20 token. Everything has been going well until i noticed one address was receiving ETH to their address and then trying to purchase one of my ERC20 tokens multiple times but kept getting rejected because they were not using gas. But only after this address received ETH. Is this some kind of spam attack or maybe they are trying to glitch my address somehow?  Any insight will help thank you kindly. ",https://www.reddit.com/r/ethereum/comments/7w0sm5/information_on_etherscan/,4,4
7w0uzo,1518049855,Is a Potentially Fraudulent Crypto Company Behind the Bitcoin Rebound?,,https://www.reddit.com/r/ethereum/comments/7w0uzo/is_a_potentially_fraudulent_crypto_company_behind/,0,7
7w0vdk,1518049949,Orchid Protocol - An Open and Unrestricted Internet for Everyone - CryptoLingo,,https://www.reddit.com/r/ethereum/comments/7w0vdk/orchid_protocol_an_open_and_unrestricted_internet/,0,0
7w0wrn,1518050308,Whitepaper and Demo: UX for ERC20 Payments with Verified Digital Signatures,,https://www.reddit.com/r/ethereum/comments/7w0wrn/whitepaper_and_demo_ux_for_erc20_payments_with/,1,0
7w1179,1518051464,EtherDoggos: Not Just a CryptoKitties clone,[deleted],https://www.reddit.com/r/ethereum/comments/7w1179/etherdoggos_not_just_a_cryptokitties_clone/,1,0
7w127j,1518051717,Grayscale launches a crypto fund with Ethereum included!,,https://www.reddit.com/r/ethereum/comments/7w127j/grayscale_launches_a_crypto_fund_with_ethereum/,1,0
7w13h7,1518052053,EtherDoggos: Not Just a CryptoKitties clone,,https://www.reddit.com/r/ethereum/comments/7w13h7/etherdoggos_not_just_a_cryptokitties_clone/,2,3
7w141y,1518052202,Could be the first one for B2B market?,,https://www.reddit.com/r/ethereum/comments/7w141y/could_be_the_first_one_for_b2b_market/,0,0
7w18rl,1518053450,"Can't withdraw ethereum from GDAX -- ""not a valid address""","When I try to withdraw ethereum to my wallet, GDAX tries to tell me that it's not a valid address. I've gone over it a half dozen times to make sure it's correct. I've tried it with the 0X prefix and without. I don't see what I could be doing wrong.\n\nThe wallet was never synced with the network, but that's only because it's literally impossible to sync it on anything but an SSD. It never fucking catches up with the blockchain otherwise. Is that what's holding me up? I was just going to put the ethereum in cold storage so I didn't think it would matter.\n",https://www.reddit.com/r/ethereum/comments/7w18rl/cant_withdraw_ethereum_from_gdax_not_a_valid/,5,2
7w1fou,1518055266,I make cryptocurrency pop sockets!,[deleted],https://www.reddit.com/r/ethereum/comments/7w1fou/i_make_cryptocurrency_pop_sockets/,1,1
7w1i0j,1518055907,Wells Fargo strategist: Bitcoin and the market are correlated,,https://www.reddit.com/r/ethereum/comments/7w1i0j/wells_fargo_strategist_bitcoin_and_the_market_are/,2,2
7w1ozg,1518057799,[Thoughts] Central banks attack crypto?,,https://www.reddit.com/r/ethereum/comments/7w1ozg/thoughts_central_banks_attack_crypto/,1,0
7w1raz,1518058428,"In memory of the latest Falcon Heavy launch, I see Ethereum heading in the same trajectory. Helmets on, gentlemen.",,https://www.reddit.com/r/ethereum/comments/7w1raz/in_memory_of_the_latest_falcon_heavy_launch_i_see/,1,4
7w1tj2,1518059032,Seeking Tokenomics/blockchain experts,"Hey guys!\n\nI'm putting together a small group of blockchain wonks for compensated (yes, we have money) advisory roles with high-potential, early stage blockchain companies in roles helping designing the token ecosystems with a focus on decentralized token platforms/protocols incorporating a governance model. I want to work with a few people outside my direct network in the space to bring in new perspectives. (Open to tech focus or business/economic focus). \n\nPlease DM me if interested yourself, or if you have someone to nominate. Only pre-requisites are that you've already played a role in working on a token before and that you're a good person interested in ushering in a social/economic/cultural revolution through blockchain and not just making money.  ",https://www.reddit.com/r/ethereum/comments/7w1tj2/seeking_tokenomicsblockchain_experts/,1,0
7w1ujm,1518059317,Is there a way to connect to remote daemon node from Ethereum wallet on mac?,"I am new to Ether and I've used Monero and ETN previously. There, I've set up a daemon node running on my private server and connected to it as I can't download the whole blockchain. I used GUI for XMR and CLI for ETN. Is there a way to do that in ETH and BTC?\n\nI've searched online but couldn't find any relevant threads.",https://www.reddit.com/r/ethereum/comments/7w1ujm/is_there_a_way_to_connect_to_remote_daemon_node/,7,0
7w1ur2,1518059371,What is the current best solution to centralized web hosting? I feel it's still a big hole in the decentralized Web3 vision.,[removed],https://www.reddit.com/r/ethereum/comments/7w1ur2/what_is_the_current_best_solution_to_centralized/,1,0
7w1wnr,1518059913,"Call, Contact Coinbase phone number 1 800 605 8381 Coinbase toll free number Coinbase transactions help desk Coinbase unconfirmed transactions Support Phone Number coinbase transaction still pending customer helpline coinbase transaction not showing up Support phone number",,https://www.reddit.com/r/ethereum/comments/7w1wnr/call_contact_coinbase_phone_number_1_800_605_8381/,1,1
7w1xr0,1518060221,Save us Vitalek! Take us with you to the moon...,,https://www.reddit.com/r/ethereum/comments/7w1xr0/save_us_vitalek_take_us_with_you_to_the_moon/,1,0
7w1zr8,1518060797,SEC Office to Step Up Crypto Disclosure Policing,,https://www.reddit.com/r/ethereum/comments/7w1zr8/sec_office_to_step_up_crypto_disclosure_policing/,1,0
7w21yw,1518061445,🔥🔥🔥The 2nd round —-BitUP New Year candy big delivery 🍭🍭🍭,[removed],https://www.reddit.com/r/ethereum/comments/7w21yw/the_2nd_round_bitup_new_year_candy_big_delivery/,1,1
7w23mh,1518061897,Can Sharding and Casper scale if there are no hardware and bandwidth requirements?,"I like Proof of Stake in principal because it prevents powerful/expensive hardware from gaining an unfair competitive advantage and lockout willing stakers from participating in the system. However, wouldn't this potentially create a bottleneck on the platform? \n\nA staker with 1000 ETH can earn more nominal returns than a smaller staker with 1 ETH while providing the exact same amount of resources to keep the system running.  \n\nIs the idea that running more nodes will increase the chances of someone being chosen as a validator which means that the person with a lot of ETH is incentivized to run as many nodes as it can to maximize returns while contributing more power to the system? \n\nAdditionally with hardware getting faster and cheaper each year, wouldn't it prevent the system from scaling by not having a minimum requirement on hardware which gradually increase with time?\n\n",https://www.reddit.com/r/ethereum/comments/7w23mh/can_sharding_and_casper_scale_if_there_are_no/,6,6
7w25qa,1518062500,Looks like Parity sync restarted after closing UI and re-opening,<not selftext available>,https://www.reddit.com/r/ethereum/comments/7w25qa/looks_like_parity_sync_restarted_after_closing_ui/,1,0
7w28up,1518063409,Why is ethereum almost always 1/10 of bitcoin?,[removed],https://www.reddit.com/r/ethereum/comments/7w28up/why_is_ethereum_almost_always_110_of_bitcoin/,1,0
7w2am3,1518063936,Scaling Ethereum for Global Adoption – Medium,,https://www.reddit.com/r/ethereum/comments/7w2am3/scaling_ethereum_for_global_adoption_medium/,1,0
7w2d26,1518064675,If you wanna learn how robinhood can change how your buy Ethereum check out our video!,,https://www.reddit.com/r/ethereum/comments/7w2d26/if_you_wanna_learn_how_robinhood_can_change_how/,1,0
7w2dv7,1518064927,Thanks to the recent dip I now own one whole ethereum,[removed],https://www.reddit.com/r/ethereum/comments/7w2dv7/thanks_to_the_recent_dip_i_now_own_one_whole/,1,0
7w2f3k,1518065330,NetLeaders Webcast Guests Brian Semkiw(CEO Carta Worldwide) Terry O'Hear...,,https://www.reddit.com/r/ethereum/comments/7w2f3k/netleaders_webcast_guests_brian_semkiwceo_carta/,1,0
7w2izs,1518066564,"CRYPTO EXCHANGE BINANCE GOES DARK – 12 HOUR OUTAGE FOR MAINTENANCE, SYSTEM UPGRADES",,https://www.reddit.com/r/ethereum/comments/7w2izs/crypto_exchange_binance_goes_dark_12_hour_outage/,0,2
7w2l2j,1518067215,Nvidia Vs AMD: The Crypto Mining Difference.,,https://www.reddit.com/r/ethereum/comments/7w2l2j/nvidia_vs_amd_the_crypto_mining_difference/,3,2
7w2lxy,1518067488,When Casper?,,https://www.reddit.com/r/ethereum/comments/7w2lxy/when_casper/,56,15
7w2nmk,1518068027,DAI CDP user stories,,https://www.reddit.com/r/ethereum/comments/7w2nmk/dai_cdp_user_stories/,9,1
7w2qhz,1518069027,CryptoCelebrities.co Major Update: High Ranks will now be paid interest while Bagholding!,,https://www.reddit.com/r/ethereum/comments/7w2qhz/cryptocelebritiesco_major_update_high_ranks_will/,6,2
7w2sy8,1518069852,"Endor is Inventing the ""Google"" for Predictive Analytics",,https://www.reddit.com/r/ethereum/comments/7w2sy8/endor_is_inventing_the_google_for_predictive/,2,2
7w2uxm,1518070563,Any tutorials or medium posts on how to set up Casper testnet?,I wanted to play around with some test eth and try to stake my coins so I would know what to do when it launches live. Any guides for someone who isn't too computer savvy? ,https://www.reddit.com/r/ethereum/comments/7w2uxm/any_tutorials_or_medium_posts_on_how_to_set_up/,1,0
7w30y2,1518072673,Cryptocurrency Ico token Sale,[deleted],https://www.reddit.com/r/ethereum/comments/7w30y2/cryptocurrency_ico_token_sale/,1,0
7w362d,1518074627,(Bounty0x) Bounty for a Bounty — Decentralized News Network,,https://www.reddit.com/r/ethereum/comments/7w362d/bounty0x_bounty_for_a_bounty_decentralized_news/,1,0
7w363j,1518074641,"Digital Marketing Specialist (cryptocurrency) job - CryptoConnect - Toronto, ON",,https://www.reddit.com/r/ethereum/comments/7w363j/digital_marketing_specialist_cryptocurrency_job/,1,0
7w36s7,1518074902,"Eth ""Dick Measuring"" Game",[removed],https://www.reddit.com/r/ethereum/comments/7w36s7/eth_dick_measuring_game/,1,0
7w37f6,1518075152,Fantastic use case for ETH: How passively mining can benefit charities and volunteer initiatives,,https://www.reddit.com/r/ethereum/comments/7w37f6/fantastic_use_case_for_eth_how_passively_mining/,1,0
7w38mo,1518075646,What are the different private key formats?,"Hey all.\n\nI'm posting this to r/ethereum because I thought you all would be more helpful than those over at r/cryptocurrency.\n\nI'm wondering about private key formatting. How many different types are there? I know ethereum uses HEX 64 and Iota has its own thing at 81 characters with (A-Z, 9), but are there any other common ones I should know about? (I don't want to have to try to make wallets for all crypto types)\n\nI'm asking for a small project I'm developing. ",https://www.reddit.com/r/ethereum/comments/7w38mo/what_are_the_different_private_key_formats/,2,6
7w3e4x,1518077917,Crypto’s Price Correction Isn’t Killing the Industry High,,https://www.reddit.com/r/ethereum/comments/7w3e4x/cryptos_price_correction_isnt_killing_the/,0,1
7w3f5d,1518078327,New ICO Review: YourBlock,,https://www.reddit.com/r/ethereum/comments/7w3f5d/new_ico_review_yourblock/,1,0
7w3g9s,1518078780,WorldWide Signals - Discord group - Free and paid signals from famous telegram groups !,,https://www.reddit.com/r/ethereum/comments/7w3g9s/worldwide_signals_discord_group_free_and_paid/,1,0
7w3hzn,1518079528,Is Etherzero scam or real ?,<not selftext available>,https://www.reddit.com/r/ethereum/comments/7w3hzn/is_etherzero_scam_or_real/,1,0
7w3pdg,1518082619,Movers and Shakers of the Crypto World - Marketbazaronline,,https://www.reddit.com/r/ethereum/comments/7w3pdg/movers_and_shakers_of_the_crypto_world/,1,0
7w3q8s,1518082988,Can't figure out how to access old wallet.,[removed],https://www.reddit.com/r/ethereum/comments/7w3q8s/cant_figure_out_how_to_access_old_wallet/,1,0
