id,created_utc,title,selftext,full_link,score,comments
7wg8a7,1518207118,Testing and Releasing Stable Ethereum Applications – AirSwap Blog,,https://www.reddit.com/r/ethereum/comments/7wg8a7/testing_and_releasing_stable_ethereum/,1,0
7wg8gj,1518207155,Ethereum Wallet or Mist?,With the MyEtherWallet / MyCrypto drama going on I want another way of accessing and keeping my ETH.\n\nEthereum Wallet or Mist. Which one would you recommend? (I run Win 10 Pro 64 bit).\n\nThanks.,https://www.reddit.com/r/ethereum/comments/7wg8gj/ethereum_wallet_or_mist/,2,9
7wg8ms,1518207200,Crypto Miners for Sale - 6 GPU Rigs - Top Quality Construction,,https://www.reddit.com/r/ethereum/comments/7wg8ms/crypto_miners_for_sale_6_gpu_rigs_top_quality/,1,1
7wg8ol,1518207215,Ethereum creator is now working on the fountain of youth - seriously,,https://www.reddit.com/r/ethereum/comments/7wg8ol/ethereum_creator_is_now_working_on_the_fountain/,1,0
7wg9w6,1518207491,"We just added support for and started accepting Ethereum at our Bitcoin Casino, come show us some of Cupid's Love!",,https://www.reddit.com/r/ethereum/comments/7wg9w6/we_just_added_support_for_and_started_accepting/,2,0
7wgbwm,1518207968,Nexo Airdrop is LIVE — Join Today! Claim your share of 1 MILLION Tokens from Nexo - The World’s First Instant Crypto Overdraft,,https://www.reddit.com/r/ethereum/comments/7wgbwm/nexo_airdrop_is_live_join_today_claim_your_share/,1,0
7wgca3,1518208056,Has anyone else noticed the first two digits of both Bitcoin and Ethereum have been staying in sync? Kinda funny 😆,,https://www.reddit.com/r/ethereum/comments/7wgca3/has_anyone_else_noticed_the_first_two_digits_of/,1,0
7wgcgd,1518208093,Ethereum sportsbook and casino Betcoin releases new homepage and no deposit casino chips giveaway!,,https://www.reddit.com/r/ethereum/comments/7wgcgd/ethereum_sportsbook_and_casino_betcoin_releases/,1,2
7wge4c,1518208475,Web Comic - Krypto Bar &amp; Grill #1 - First ever!,[deleted],https://www.reddit.com/r/ethereum/comments/7wge4c/web_comic_krypto_bar_grill_1_first_ever/,1,0
7wggby,1518208986,Is the ethereum network always so slow or am I doing something wrong?,,https://www.reddit.com/r/ethereum/comments/7wggby/is_the_ethereum_network_always_so_slow_or_am_i/,1,0
7wggr1,1518209084,Hi fellow crypto fans! I created a web comic completely based on crypto with original characters. This is my introduction to the main character based on Ethereum.,[deleted],https://www.reddit.com/r/ethereum/comments/7wggr1/hi_fellow_crypto_fans_i_created_a_web_comic/,1,0
7wgj12,1518209624,Censorship-free twitter Dapp: your post on the blockchain forever!,,https://www.reddit.com/r/ethereum/comments/7wgj12/censorshipfree_twitter_dapp_your_post_on_the/,6,0
7wgl5x,1518210099,Keep on Different Chains?,,https://www.reddit.com/r/ethereum/comments/7wgl5x/keep_on_different_chains/,1,0
7wgmo4,1518210456,Are ICOs Hurting Ethereum?,<not selftext available>,https://www.reddit.com/r/ethereum/comments/7wgmo4/are_icos_hurting_ethereum/,1,0
7wgnds,1518210615,Official MyEtherWallet Statement,"Official Statement Regarding yesterdays' events and status of [MyEtherWallet](https://www.myetherwallet.com)\n\nHello Everyone,\n\nBy now, you may have already read the article at [medium](https://medium.com/mycrypto/mycrypto-launch-6a066bf41093). For those of you who do not know me, I founded MyEtherWallet (“MEW”), and I believe that I owe our Ethereum community, and the crypto community at large, an explanation of yesterday’s events.\n\n\nBefore I do, a brief history about me: I’ve been intrigued by Ethereum ever since the release of their yellow paper back in 2014. Upon reading it, I realized that Vitalik was a true visionary and became infatuated with the technology behind Ethereum. Specifically, I understood all the transformative possibilities that this type of technology presented now and in the future. When the Ethereum Foundation released the “Mainnet,” however, I recognized that many users were struggling. With no graphical user interface, many early adopters were having difficulty accessing and transferring their Ether. I saw an opportunity to contribute to this new, emerging community, and seized it. \n\n \n\nI began working on a user interface to be used in conjunction with, and in support of, Ethereum wallet functionality that any new crypto adopter could feel comfortable using. I released my initial version, and published it on [Reddit](https://www.reddit.com/r/ethereum/comments/3gkknd/ether_wallet_generator_for_now/) on August 11, 2015 (MEW’s birthday!). I designed it to be open source so that others like me could make modifications to my existing codebase, and continue improving user-friendliness and functionality over time.\n\n\n\nHowever, as a core developer and programmer, business development/designing were, admittedly, not my strength. I needed someone to take the lead on that front if I wanted MEW to grow its userbase. I brought my friend, Taylor M., on board knowing that she was up to the task. Let’s just say that she did not disappoint, and MEW took off much faster than either of us could have anticipated. I will always be appreciative of her efforts in helping MEW achieve the success it did.\n\n\n\nAlas, for reasons I cannot delve into here, our partnership had to end. During the transition yesterday, however, MEW’s Twitter account was switched from @myetherwallet to @mycrypto, and tens of thousands of MEW followers were left scratching their heads. Indeed, the change was unexpected, and I’m still in the process of determining the justification behind the switch, and how this issue will be resolved. I don’t know what the fall out from this will be ultimately, but I will not be on the offensive or defensive discussing the circumstances surrounding our decision to separate beyond my statement here.\n\n\n\nInstead, my focus will be (as it’s always been) on how best to improve MEW for existing and prospective users. Security is paramount these days, and me and my new team will remain vigilant in ensuring that the MEW website, your accounts, and more importantly, your ether and tokens, are safe. Rest-assured that MEW is the same product that you trusted yesterday, and the MEW team will work tirelessly to make sure it is the product you still trust tomorrow. The Ethereum community inspired me to create MyEtherWallet, and it still inspires me today. I am not going anywhere. Furthermore, for those of you wondering where I’ve been or what I’ve been working on the past several months, I’ve been busy doing what I do best—so get ready for some new and exciting products/services in the pipeline. Stay tuned!\n\n\n\nIn any event, I must admit that competition is a good thing because it serves as a driving force behind innovation. Look at the world around us. Complacency simply means one will get left behind. That being said, I sincerely wish Taylor M. and MyCrypto the very best. Your presence in the crypto space will undoubtedly motivate me to continue raising the bar.\n\n\n\nThank you all for your support over the last few years, and hopefully, in the years to come. MEW’s team remains committed to you, and is available to answer any and all questions or concerns you may have. \n\n\n\nTruly yours,  \nKosala H.  \nkvhnuke",https://www.reddit.com/r/ethereum/comments/7wgnds/official_myetherwallet_statement/,1453,840
7wgoyk,1518211008,Web Comic - Krypto Bar &amp; Grill #1 - First ever!,[deleted],https://www.reddit.com/r/ethereum/comments/7wgoyk/web_comic_krypto_bar_grill_1_first_ever/,1,0
7wgppo,1518211189,How Ethereum is Changing the World,,https://www.reddit.com/r/ethereum/comments/7wgppo/how_ethereum_is_changing_the_world/,1,0
7wgrky,1518211626,How Blockchain Can Improve Healthcare Administration,,https://www.reddit.com/r/ethereum/comments/7wgrky/how_blockchain_can_improve_healthcare/,1,0
7wgrn7,1518211641,"For those of us who use MEW via Trezor to store our tokens and eth, are we at risk of losing anything if MEW ever went dark for good?",<not selftext available>,https://www.reddit.com/r/ethereum/comments/7wgrn7/for_those_of_us_who_use_mew_via_trezor_to_store/,1,0
7wgs3o,1518211759,Rare Bits (Beta Launch) - A zero fee marketplace for crypto assets,<not selftext available>,https://www.reddit.com/r/ethereum/comments/7wgs3o/rare_bits_beta_launch_a_zero_fee_marketplace_for/,1,0
7wgxup,1518213181,Codex Protocol Recognized At The World Crypto Economic Forum Held in San Francisco,,https://www.reddit.com/r/ethereum/comments/7wgxup/codex_protocol_recognized_at_the_world_crypto/,1,0
7wgzep,1518213561,looking for a lightweight ETH desktop wallet (windows),"The official one is not lightweight and downloads the entire blockchain which I do not want. tried Exodus, but apparently there dont seem to be passwords and I also cannot use it on different computers. I want something with private keys &amp; passphrases.\n\nAny suggestions?",https://www.reddit.com/r/ethereum/comments/7wgzep/looking_for_a_lightweight_eth_desktop_wallet/,2,8
7wh01l,1518213708,Petition for MyCrypto to return the Verified MyEtherWallet Twitter account,[deleted],https://www.reddit.com/r/ethereum/comments/7wh01l/petition_for_mycrypto_to_return_the_verified/,0,0
7wh0a5,1518213765,Status Named One of World’s Most Innovative Projects at Netexplo Innovation Forum,,https://www.reddit.com/r/ethereum/comments/7wh0a5/status_named_one_of_worlds_most_innovative/,1,0
7wh1uo,1518214156,Proof of Stake security questions,[removed],https://www.reddit.com/r/ethereum/comments/7wh1uo/proof_of_stake_security_questions/,1,0
7wh2nk,1518214369,Can I be the first to thank /u/insomniasexx and MyCrypto,[removed],https://www.reddit.com/r/ethereum/comments/7wh2nk/can_i_be_the_first_to_thank_uinsomniasexx_and/,0,4
7wh94f,1518216013,LL Bean considers sewing sensors into clothing that will report data via Ethereum blockchain,,https://www.reddit.com/r/ethereum/comments/7wh94f/ll_bean_considers_sewing_sensors_into_clothing/,1,0
7wh97z,1518216038,MyEtherWallet changing deposit address when sending TX?,[deleted],https://www.reddit.com/r/ethereum/comments/7wh97z/myetherwallet_changing_deposit_address_when/,1,1
7whbfe,1518216601,Ethereum hodlers during the next bull run!,,https://www.reddit.com/r/ethereum/comments/7whbfe/ethereum_hodlers_during_the_next_bull_run/,1,1
7whcaz,1518216820,"Kvhnuke, the founder of MyEtherWaller took Legal Action against Taylor (of MyCrypto) in Dec 2017, read the Filing here!",[deleted],https://www.reddit.com/r/ethereum/comments/7whcaz/kvhnuke_the_founder_of_myetherwaller_took_legal/,1,0
7whd1k,1518217006,Hi fellow Ethereum fans! I created a comic based on cryptocurrency with Ethereum's character being the star. This is the first edition ever!,[deleted],https://www.reddit.com/r/ethereum/comments/7whd1k/hi_fellow_ethereum_fans_i_created_a_comic_based/,1,1
7whj2x,1518218477,Rare Bits (Beta Launch) - A zero fee marketplace for crypto assets,[removed],https://www.reddit.com/r/ethereum/comments/7whj2x/rare_bits_beta_launch_a_zero_fee_marketplace_for/,1,1
7whjlf,1518218623,What is the legality of using smart contracts for a platform that allows bets?,[removed],https://www.reddit.com/r/ethereum/comments/7whjlf/what_is_the_legality_of_using_smart_contracts_for/,1,0
7whn6b,1518219566,"Kvhnuke, the founder of MyEtherWaller took Legal Action against Taylor (of MyCrypto) in Dec 2017, read the Filing here",<not selftext available>,https://www.reddit.com/r/ethereum/comments/7whn6b/kvhnuke_the_founder_of_myetherwaller_took_legal/,1,0
7whnxo,1518219765,"A lawsuit was filed on December 14, 2017 by the creator of MEW against Taylor Monahan for withholding financial and other records.",,https://www.reddit.com/r/ethereum/comments/7whnxo/a_lawsuit_was_filed_on_december_14_2017_by_the/,263,139
7whobs,1518219863,Trying to explain cryptocurrency to people,[deleted],https://www.reddit.com/r/ethereum/comments/7whobs/trying_to_explain_cryptocurrency_to_people/,1,0
7whq5f,1518220348,Roman Mandeleil attended BIP001 recently? (ether.camp / HackerGold Updates),"Usually i'm not the one to try and dig up old mysteries in the crypto space, but ether.camp and Roman Mandeleil's sudden disappearance have come to question once again.\n\nI remember reading that he has/had some serious health problems and that was the reason for the sudden silence, which would be totally understandable and I have accepted that.. until now.\n\n[Roman popped up on my Facebook feed](https://imgur.com/a/9JuKq) (after not posting since March 2017), with a photo of him speaking at the BIP001 conference in Ukraine. The fact that there has been such silence from him / ether.camp within the Ethereum community and yet he is attending and speaking at crypto-related conferences brings to question - What the hell actually happened and how is he still active in the broader crypto space whilst remaining totally silent within the Ethereum community?\n\nI first met Roman at Devcon1 and left with a pretty decent opinion of him. I just find it so strange that such a person can continue radio silence for so long and yet still be physically involved in the crypto space. As you may have guessed, I do have contact with him via Facebook but I am hesitant to attempt to open communication, since he does not appear to want to communicate.\n\nHave any other developments regarding ether.camp or Roman been revealed that I have somehow missed?",https://www.reddit.com/r/ethereum/comments/7whq5f/roman_mandeleil_attended_bip001_recently/,9,4
7whu4o,1518221413,ETH that was stuck on Bitgrail,I unfortunately got some ETH caught up in the bitgrail lockdown and have been waiting for my account to be verified for a few weeks now. \n\nObviously now there has been a huge “hack” and all the xrb has essentially gone. The statement about it says that other currencies are “fine”...\n\nWhat are my chances of getting my ETH back? Is there anything I can do?\n\nThanks in advance...,https://www.reddit.com/r/ethereum/comments/7whu4o/eth_that_was_stuck_on_bitgrail/,2,1
7whwr0,1518222076,Introducing CryptoTitties,,https://www.reddit.com/r/ethereum/comments/7whwr0/introducing_cryptotitties/,0,5
7wi10z,1518223247,Poll: Should MyCrypto return Twitter account to MyEtherWallet?,,https://www.reddit.com/r/ethereum/comments/7wi10z/poll_should_mycrypto_return_twitter_account_to/,0,0
7wi4s5,1518224269,Is there a tip bot for Ethereum?,<not selftext available>,https://www.reddit.com/r/ethereum/comments/7wi4s5/is_there_a_tip_bot_for_ethereum/,1,0
7wib3v,1518226021,📺 Here are my thoughts on the Binance outage and why I trust CZ and Binance more than I did before this happened!!! (Even though I couldn't access my 💰💰💰) This is my first YouTube video what do you think???,,https://www.reddit.com/r/ethereum/comments/7wib3v/here_are_my_thoughts_on_the_binance_outage_and/,1,0
7wibqd,1518226199,it will be able to be better than Alibaba.com??,,https://www.reddit.com/r/ethereum/comments/7wibqd/it_will_be_able_to_be_better_than_alibabacom/,0,0
7wid8m,1518226608,Let's find out what the deal is behind this court case between MEW devs...,[removed],https://www.reddit.com/r/ethereum/comments/7wid8m/lets_find_out_what_the_deal_is_behind_this_court/,0,0
7widte,1518226746,Has the latest version of MEW been audited?,[removed],https://www.reddit.com/r/ethereum/comments/7widte/has_the_latest_version_of_mew_been_audited/,1,0
7wihaz,1518227773,Is there a tipbot for ethereum?,,https://www.reddit.com/r/ethereum/comments/7wihaz/is_there_a_tipbot_for_ethereum/,14,10
7wijq1,1518228464,Looking for help,I tried to trade some of my Ether for Bitcoin late last year and the swap has still not completed properly. It has swapped out Ether but I have not yet received the Bitcoin into my Bitcoin Wallet.\n\nI have attached some screenshots from etherscan.io below;\nhttps://imgur.com/a/Yfx5w\n\nI need help from those who know more than me how to get this resolved please. \n\nThis was the first swap that failed between MEW and my Bitcoin Wallet. I don't know what has happened to it.\n\nThanks in advance.,https://www.reddit.com/r/ethereum/comments/7wijq1/looking_for_help/,0,0
7wimlb,1518229299,Blockchain - KYC - A.I. - Compliance,,https://www.reddit.com/r/ethereum/comments/7wimlb/blockchain_kyc_ai_compliance/,1,0
7wirre,1518230799,DATBOI Airdrop,,https://www.reddit.com/r/ethereum/comments/7wirre/datboi_airdrop/,1,1
7wiv09,1518231765,Creating an Erc20 Token.,<not selftext available>,https://www.reddit.com/r/ethereum/comments/7wiv09/creating_an_erc20_token/,1,0
