id,created_utc,title,selftext,full_link,score,comments
7d2ear,1510729233,Applications for Cofound.it community evaluators are now open!,,https://www.reddit.com/r/ethereum/comments/7d2ear/applications_for_cofoundit_community_evaluators/,0,1
7d2eif,1510729310,"uRaiden, Raiden, Plasma... Confused!","Hi all, \n\nI am really confused by these different things. I've tried reading up, but I must admit that everything is very technical and confusing for me.\n\nSo far this is what I've got:\n\nuRaiden - unidirectional off-chain payment channel that is trustless, instant and free transfers between 2 parties, or many-to-one\n\n\nRaiden - bidirectional off-chain payment channel that is trustless, instant, low fees (payable in RDN... if not running a full node?) for many-to-many transactions.\n\n\nPlasma - a super type of Raiden with multiple layers branching out from the main ETH chain ????\n\n\nMy brain is dead trying to figure out what does what, but especially to figure out the different use cases for them all.\n\nPlease help, thanks.",https://www.reddit.com/r/ethereum/comments/7d2eif/uraiden_raiden_plasma_confused/,43,12
7d2jtu,1510731324,How to vet a ethereum blockchain developer?,[removed],https://www.reddit.com/r/ethereum/comments/7d2jtu/how_to_vet_a_ethereum_blockchain_developer/,1,0
7d2llm,1510732065,What do ESMA warnings mean for ICOs?,,https://www.reddit.com/r/ethereum/comments/7d2llm/what_do_esma_warnings_mean_for_icos/,1,0
7d2mb2,1510732377,ETH vs BTC,[removed],https://www.reddit.com/r/ethereum/comments/7d2mb2/eth_vs_btc/,1,1
7d2onr,1510733357,Created an address storage app for myself (like contacts) and thought all of you might benefit.,"I needed an app on my phone that allowed me to store my crypto addresses as well as friends' addresses and when I couldn't find one I decided to make my own. I hope it's useful to some of you, it's completely free and the addresses are stored locally on your phone. As this is my first published app, any feedback is greatly appreciated!\n\n&amp;nbsp;\n   \nPricing data is pulled from CryptoCompare.\n(full disclosure, I put in banner ads)\n\n&amp;nbsp;\n\n\nCurrently Android only:\nhttps://play.google.com/store/apps/details?id=com.alignmentapps.cryptocontacts",https://www.reddit.com/r/ethereum/comments/7d2onr/created_an_address_storage_app_for_myself_like/,9,8
7d2v3v,1510736160,RocketICO - Interview with expert Michael Gord,,https://www.reddit.com/r/ethereum/comments/7d2v3v/rocketico_interview_with_expert_michael_gord/,0,0
7d2yuz,1510737759,Stunning Ethereum Wallpapers - 4k and 21:9 Options!,[deleted],https://www.reddit.com/r/ethereum/comments/7d2yuz/stunning_ethereum_wallpapers_4k_and_219_options/,1,3
7d2zd1,1510737967,⭐ World's Biggest Publicly Traded Hedge Fund Strongly Considering Bitcoin Futures,,https://www.reddit.com/r/ethereum/comments/7d2zd1/worlds_biggest_publicly_traded_hedge_fund/,1,0
7d30kp,1510738513,VITALIK'S exclusion of GAB (free speech platform) is deeply troubling,[removed],https://www.reddit.com/r/ethereum/comments/7d30kp/vitaliks_exclusion_of_gab_free_speech_platform_is/,1,0
7d31nb,1510738985,Introducing Melon Mail - a secure messaging service between Melon Managers and Investors using Melon protocol hosted on IPFS! Big thanks to the Decenter team on this 🙏🙏 https://medium.com/melonport-blog/introducing-melon-mail-a-secure-messaging-service-between-managers-investors-6e410e22a353,[deleted],https://www.reddit.com/r/ethereum/comments/7d31nb/introducing_melon_mail_a_secure_messaging_service/,5,2
7d32g9,1510739352,A report by Mangrove Capital on the implications of ICOs on VCs,[deleted],https://www.reddit.com/r/ethereum/comments/7d32g9/a_report_by_mangrove_capital_on_the_implications/,1,0
7d32zb,1510739563,"FLYING CARPET: P2P Decentralised Autonomous Transportation Network powered by Ethereum, state channels, VR and AI.",,https://www.reddit.com/r/ethereum/comments/7d32zb/flying_carpet_p2p_decentralised_autonomous/,14,5
7d33iy,1510739820,How to send a token to multiple adresses?,[removed],https://www.reddit.com/r/ethereum/comments/7d33iy/how_to_send_a_token_to_multiple_adresses/,1,0
7d36v9,1510741036,Introducing Melon Mail — A secure messaging service between Melon Managers &amp; Investors on Melon protocol hosted on IPFS! Big thanks to the Decenter team for helping make this happen.,,https://www.reddit.com/r/ethereum/comments/7d36v9/introducing_melon_mail_a_secure_messaging_service/,55,6
7d37jx,1510741298,"Folks from across the Ethereum community rally in support of Vinay Gupta, currently under targeted abuse storm by nazi white supremacists for believing in equality",,https://www.reddit.com/r/ethereum/comments/7d37jx/folks_from_across_the_ethereum_community_rally_in/,1,0
7d37mp,1510741331,Learn what benefits you can get using Smart Contracts,,https://www.reddit.com/r/ethereum/comments/7d37mp/learn_what_benefits_you_can_get_using_smart/,1,0
7d3bn9,1510742964,"The capital of the swiss crypto valley, the city of Zug, today presented Zug Digital ID which uses uPort ID",,https://www.reddit.com/r/ethereum/comments/7d3bn9/the_capital_of_the_swiss_crypto_valley_the_city/,1,0
7d3bv2,1510743053,"Let’s leave UTRUST behind, this is what we all NEED! Way more interesting for self-employed people owning businesses! NO FEES! Get your tokens now!",,https://www.reddit.com/r/ethereum/comments/7d3bv2/lets_leave_utrust_behind_this_is_what_we_all_need/,1,0
7d3d7l,1510743605,Is it true that Vitalik Tweeted what they say he Tweeted?,And he has since deleted those tweets.,https://www.reddit.com/r/ethereum/comments/7d3d7l/is_it_true_that_vitalik_tweeted_what_they_say_he/,0,5
7d3dvt,1510743843,Triforce TOKENS &gt; Read the whitepaper here!,,https://www.reddit.com/r/ethereum/comments/7d3dvt/triforce_tokens_read_the_whitepaper_here/,1,0
7d3e8o,1510743969,#Blockchain4Humanity Competition: Use blockchain technology to help combat child trafficking in Moldova.,,https://www.reddit.com/r/ethereum/comments/7d3e8o/blockchain4humanity_competition_use_blockchain/,3,0
7d3fdj,1510744401,Why would you pick FUNFAIR ?,[removed],https://www.reddit.com/r/ethereum/comments/7d3fdj/why_would_you_pick_funfair/,3,4
7d3hii,1510745225,"Yes, this kid really just deleted $300 MILLION by messing around with Ethereum’s smart contracts.",[deleted],https://www.reddit.com/r/ethereum/comments/7d3hii/yes_this_kid_really_just_deleted_300_million_by/,0,0
7d3j11,1510745796,"Don't miss today's Live Chat with Yuen Wong, CEO and founder of GES UTC 12:00",,https://www.reddit.com/r/ethereum/comments/7d3j11/dont_miss_todays_live_chat_with_yuen_wong_ceo_and/,2,0
7d3jmz,1510746030,"It appears many people aren’t aware that low fees, deflation and high PoS returns can’t all happen at the same time","The PoS returns will effectively be transaction costs plus any redistribution via inflation from non stakers to stakers (if there is any inflation)\n\nIf there is no inflation, the only PoS returns will be from transaction costs to executive contracts.\n\nIf the goal is to have super low fees over time then PoS returns will fall over time, unless there is issuance of new tokens (so inflation)\n\nAm I wrong in thinking low fees, deflation and high PoS returns can’t all happen at the same time?",https://www.reddit.com/r/ethereum/comments/7d3jmz/it_appears_many_people_arent_aware_that_low_fees/,18,12
7d3n1p,1510747297,ETH in a Nutshell,[deleted],https://www.reddit.com/r/ethereum/comments/7d3n1p/eth_in_a_nutshell/,1,0
7d3ndk,1510747405,Vitalik Buterin already works on countering quantum computer hacks threat,,https://www.reddit.com/r/ethereum/comments/7d3ndk/vitalik_buterin_already_works_on_countering/,1,0
7d3njc,1510747460,Made NEW 4k Ethereum Wallpapers,"Hi guys,\n\nAfter some feedback from my post yesterday, I have decided to make some more wallpapers! This time I've made them in 4k and Ultrawide, with 3 different logo variants for each. I'm no graphic designer (just a kid with Photoshop that LOVES Ethereum) but I think they're kinda cool. \n\nWallpaper previews (compressed, don't use these!): https://imgur.com/a/hokW3\n\nFull sized wallpapers: https://drive.google.com/drive/folders/1bzPN59lqafO06ecNgvW4K6_TXVbjOCyF?usp=sharing\n\nPlease remember that these wallpapers are intended for personal use only. If you think they're cool or have any suggestions/feedback please let me know 🙂",https://www.reddit.com/r/ethereum/comments/7d3njc/made_new_4k_ethereum_wallpapers/,35,12
7d3t7q,1510749461,Question Regarding ENS Domain Registration Fees,[removed],https://www.reddit.com/r/ethereum/comments/7d3t7q/question_regarding_ens_domain_registration_fees/,1,0
7d3vl7,1510750285,Blackmoon Monthly Digest for November: Solid signings and platform development updates.,[deleted],https://www.reddit.com/r/ethereum/comments/7d3vl7/blackmoon_monthly_digest_for_november_solid/,1,0
7d3w4s,1510750449,A Postmortem on the Parity Multi-Sig Library Self-Destruct,,https://www.reddit.com/r/ethereum/comments/7d3w4s/a_postmortem_on_the_parity_multisig_library/,135,118
7d3wj8,1510750589,We are working on the @ParityTech post-mortem and will publish shortly.,,https://www.reddit.com/r/ethereum/comments/7d3wj8/we_are_working_on_the_paritytech_postmortem_and/,1,1
7d3xld,1510750911,Ether Address icon doesnt match Etherchain,,https://www.reddit.com/r/ethereum/comments/7d3xld/ether_address_icon_doesnt_match_etherchain/,1,0
7d3z55,1510751398,Parity Ponders Hard Fork Fix for 160 Million in Frozen Ether - Bitcoin News,,https://www.reddit.com/r/ethereum/comments/7d3z55/parity_ponders_hard_fork_fix_for_160_million_in/,1,0
7d3zvw,1510751641,Advertising powerhouse launches media agency that'll use smart contacts on the public blockchain,,https://www.reddit.com/r/ethereum/comments/7d3zvw/advertising_powerhouse_launches_media_agency/,1,0
7d402u,1510751694,Technical and Social Analyzes for Top Performing Cryptocurrencies,,https://www.reddit.com/r/ethereum/comments/7d402u/technical_and_social_analyzes_for_top_performing/,1,0
7d42zx,1510752537,"Blackmoon Monthly Digest - updates, news and more!",[deleted],https://www.reddit.com/r/ethereum/comments/7d42zx/blackmoon_monthly_digest_updates_news_and_more/,1,0
7d4440,1510752872,"Fresh from $30M ICO, Blackmoon Crypto Aligns with Allen &amp;amp; Overy |Â Crowdfund Insider",[deleted],https://www.reddit.com/r/ethereum/comments/7d4440/fresh_from_30m_ico_blackmoon_crypto_aligns_with/,1,0
7d44v5,1510753110,"Harbour Updates - November 15, 2017",[deleted],https://www.reddit.com/r/ethereum/comments/7d44v5/harbour_updates_november_15_2017/,2,0
7d453u,1510753185,Blackmoon aligns with Allen &amp; Overy for building legal structure of platform,[deleted],https://www.reddit.com/r/ethereum/comments/7d453u/blackmoon_aligns_with_allen_overy_for_building/,1,0
7d4ahe,1510754766,Whats the best video to watch to explain the blockchain and the different platforms ?,[removed],https://www.reddit.com/r/ethereum/comments/7d4ahe/whats_the_best_video_to_watch_to_explain_the/,1,0
7d4bm2,1510755073,"First Enterprise Ethereum Alliance in Mainland Europe: tomorrow (thursday 16 nov) in Amsterdam, The Netherleands",,https://www.reddit.com/r/ethereum/comments/7d4bm2/first_enterprise_ethereum_alliance_in_mainland/,197,28
7d4bue,1510755137,Can you tip on r/ethereum,I was just wondering if it was possible to tip someone in ethereum.\n\nI know you can do it in BCH and used to be able to do it in Bitcoin.\n\nI just don't see many getting tipped in ETH. Is there a reason for this?,https://www.reddit.com/r/ethereum/comments/7d4bue/can_you_tip_on_rethereum/,7,11
7d4dbl,1510755527,Streamr DEVCON3 roundup,,https://www.reddit.com/r/ethereum/comments/7d4dbl/streamr_devcon3_roundup/,28,1
7d4e4c,1510755754,How former Police Officer made millions of Cryptos,,https://www.reddit.com/r/ethereum/comments/7d4e4c/how_former_police_officer_made_millions_of_cryptos/,2,0
7d4f89,1510756068,EthConnect is Back Up and running smooth. Thoughts? $50 opening price?,[removed],https://www.reddit.com/r/ethereum/comments/7d4f89/ethconnect_is_back_up_and_running_smooth_thoughts/,0,13
7d4g3b,1510756295,Requirements to mine 1 ethereum a month.,[removed],https://www.reddit.com/r/ethereum/comments/7d4g3b/requirements_to_mine_1_ethereum_a_month/,0,1
7d4hyu,1510756786,SAFE TRADE/PROTECT YOUR WALLETS - A VICTIM FOR LOST BTCs,[removed],https://www.reddit.com/r/ethereum/comments/7d4hyu/safe_tradeprotect_your_wallets_a_victim_for_lost/,1,0
7d4i4k,1510756829,TrueBit whitepaper addendum,,https://www.reddit.com/r/ethereum/comments/7d4i4k/truebit_whitepaper_addendum/,4,0
