id,created_utc,title,selftext,full_link,score,comments
7g1k3j,1511844086,Ethereum Breaches 600k Transactions,,https://www.reddit.com/r/ethereum/comments/7g1k3j/ethereum_breaches_600k_transactions/,1121,158
7g1my4,1511844880,"I was talking on another page about moving some crypto to ETH - they started telling me that PoW is way better than PoS. I am only 6 weeks into crypto investing and have over 50% of my holdings in ETH. Can someone help me understand in a simple way, the merits of PoS over PoW? Please and thanks!",[removed],https://www.reddit.com/r/ethereum/comments/7g1my4/i_was_talking_on_another_page_about_moving_some/,1,2
7g1rtu,1511846259,"Has anyone used Exodus wallet software? If so, what are your thoughts? Legit or let go?",,https://www.reddit.com/r/ethereum/comments/7g1rtu/has_anyone_used_exodus_wallet_software_if_so_what/,1,0
7g1up0,1511847095,Starting a newsletter with interesting blockchain and crypto articles I find. Subscribe here.,,https://www.reddit.com/r/ethereum/comments/7g1up0/starting_a_newsletter_with_interesting_blockchain/,8,0
7g21vr,1511849256,When your bank takes too long to transfer money to your crypto exhange,,https://www.reddit.com/r/ethereum/comments/7g21vr/when_your_bank_takes_too_long_to_transfer_money/,1,0
7g25lf,1511850337,How to setup an ethereum exchange site,,https://www.reddit.com/r/ethereum/comments/7g25lf/how_to_setup_an_ethereum_exchange_site/,1,0
7g26tr,1511850734,WisePlat Token: Have 0.01 WYSE in my account but can't move it out,"For this token, Contract address is at https://etherscan.io/address/0xe769d988ceda1559aee07963e59e62bd730dbba6\n\nLooking at the list of transactions, i see lots of people get transaction failures trying to move this token out.  I like to sweep worthless tokens out of my account so it doesn't get cluttered but I can't seem to remove this one for some reason.\n\nI can't find any information about this token.  Anyone have any idea what this is?\n\nThank you\n",https://www.reddit.com/r/ethereum/comments/7g26tr/wiseplat_token_have_001_wyse_in_my_account_but/,4,2
7g2gpp,1511854107,This is perhaps the best ICO I have come across thus far! Check out the website.,,https://www.reddit.com/r/ethereum/comments/7g2gpp/this_is_perhaps_the_best_ico_i_have_come_across/,1,0
7g2k4y,1511855316,TIL something about front running on decentralized exchanges,"""Since a transaction is in the mempool for a short while, one can know what actions will occur, before it is included in a block. This can be troublesome for things like decentralized markets, where a transaction to buy some tokens can be seen, and a market order implemented before the other transaction gets included.""\n\nsource: https://consensys.github.io/smart-contract-best-practices/known_attacks/#transaction-ordering-dependence-tod-front-running",https://www.reddit.com/r/ethereum/comments/7g2k4y/til_something_about_front_running_on/,16,7
7g2nad,1511856473,Is there a calender with important events about Ethereum ? Where a user can see everything at one glance ?,[deleted],https://www.reddit.com/r/ethereum/comments/7g2nad/is_there_a_calender_with_important_events_about/,1,3
7g2qdo,1511857627,Abstract painting Ethereum Price 350 USD,,https://www.reddit.com/r/ethereum/comments/7g2qdo/abstract_painting_ethereum_price_350_usd/,1,0
7g2qex,1511857642,Sent 2500 euros worht of ethereum to ethos adress,[removed],https://www.reddit.com/r/ethereum/comments/7g2qex/sent_2500_euros_worht_of_ethereum_to_ethos_adress/,1,0
7g2rkb,1511858115,Best crypto right now?[poll],,https://www.reddit.com/r/ethereum/comments/7g2rkb/best_crypto_right_nowpoll/,0,3
7g2u63,1511859115,Interview partner needed,[removed],https://www.reddit.com/r/ethereum/comments/7g2u63/interview_partner_needed/,1,0
7g2usd,1511859366,How is someone sending transactions from the 0x00000000000000 address? Do they control the private keys? $3 Million in Eth and $37 Million burned there.,,https://www.reddit.com/r/ethereum/comments/7g2usd/how_is_someone_sending_transactions_from_the/,1,0
7g2w38,1511859878,Number of Ethereum graph makers,,https://www.reddit.com/r/ethereum/comments/7g2w38/number_of_ethereum_graph_makers/,13,3
7g30vg,1511861706,How small project transferred to trend leader?,,https://www.reddit.com/r/ethereum/comments/7g30vg/how_small_project_transferred_to_trend_leader/,31,10
7g3211,1511862176,Any help would be greatly appreciated!,[removed],https://www.reddit.com/r/ethereum/comments/7g3211/any_help_would_be_greatly_appreciated/,1,1
7g37y1,1511864489,Casper testnet is on its way!,,https://www.reddit.com/r/ethereum/comments/7g37y1/casper_testnet_is_on_its_way/,1,0
7g3801,1511864514,What is the point of utility coins (like privacy)?,"I am wondering what the use case is for privacy coins such as Monero, Zcoin, Zcash etc. in the future with Ethereum's existing roadmap?\n\nWouldn't privacy be a feature on demand on the ETH network? It is going to be very interesting to see if the ecosystem can evolve into becoming a standard platform for all the use cases that require specific tokens today.",https://www.reddit.com/r/ethereum/comments/7g3801/what_is_the_point_of_utility_coins_like_privacy/,2,2
7g3cet,1511866222,Soon there will be a coin pumped! Which coin? Join the group!,,https://www.reddit.com/r/ethereum/comments/7g3cet/soon_there_will_be_a_coin_pumped_which_coin_join/,1,0
7g3cix,1511866270,"Foam - Ryan King, CEO and Co-Founder - Open-Source Proof of Location Protocol for the Ethereum Blockchain - Future Tech Podcast",,https://www.reddit.com/r/ethereum/comments/7g3cix/foam_ryan_king_ceo_and_cofounder_opensource_proof/,1,0
7g3cko,1511866287,Dev Update #1 – Polkadot Network,,https://www.reddit.com/r/ethereum/comments/7g3cko/dev_update_1_polkadot_network/,21,0
7g3cyx,1511866450,Party has just started.,[removed],https://www.reddit.com/r/ethereum/comments/7g3cyx/party_has_just_started/,1,0
7g3elt,1511867051,A properly labeled chart,,https://www.reddit.com/r/ethereum/comments/7g3elt/a_properly_labeled_chart/,0,1
7g3h5l,1511867961,Soon you will be able to use Ethereum to pay for drinks at Singapore-based night club Skyline,,https://www.reddit.com/r/ethereum/comments/7g3h5l/soon_you_will_be_able_to_use_ethereum_to_pay_for/,1,0
7g3hs6,1511868193,New big news for modem!,,https://www.reddit.com/r/ethereum/comments/7g3hs6/new_big_news_for_modem/,1,0
7g3i9d,1511868362,Account verification on CB is stuck,[removed],https://www.reddit.com/r/ethereum/comments/7g3i9d/account_verification_on_cb_is_stuck/,1,1
7g3iyc,1511868619,Юридический ликбез для криптоинвесторов,,https://www.reddit.com/r/ethereum/comments/7g3iyc/юридический_ликбез_для_криптоинвесторов/,1,0
7g3l2f,1511869379,Live Stream - Vitalik Buterin,[removed],https://www.reddit.com/r/ethereum/comments/7g3l2f/live_stream_vitalik_buterin/,1,0
7g3mni,1511869924,Question - How to reclaim a failed Ether transaction?,[removed],https://www.reddit.com/r/ethereum/comments/7g3mni/question_how_to_reclaim_a_failed_ether_transaction/,1,0
7g3mtg,1511869979,Evangelizing Aragon,,https://www.reddit.com/r/ethereum/comments/7g3mtg/evangelizing_aragon/,16,0
7g3nvl,1511870344,want to start mine eth,[removed],https://www.reddit.com/r/ethereum/comments/7g3nvl/want_to_start_mine_eth/,1,0
7g3o6z,1511870451,Biostar posts guide on how to mine Ethereum with BIOSTAR TB250-BTC PRO &amp; ethOS,,https://www.reddit.com/r/ethereum/comments/7g3o6z/biostar_posts_guide_on_how_to_mine_ethereum_with/,1,1
7g3pm5,1511870925,ICO (Initial Coin Offering) BANKEX,,https://www.reddit.com/r/ethereum/comments/7g3pm5/ico_initial_coin_offering_bankex/,1,0
7g3qzr,1511871403,Proof-of-HODLers have made $30k by locking up their ether 'till 2020 in a smart contract made of just 18 lines of code.,,https://www.reddit.com/r/ethereum/comments/7g3qzr/proofofhodlers_have_made_30k_by_locking_up_their/,1,1
7g3sjh,1511871935,ICO (Initial Coin Offering) Crypterium,,https://www.reddit.com/r/ethereum/comments/7g3sjh/ico_initial_coin_offering_crypterium/,1,0
7g3uic,1511872609,ICO (Initial Coin Offering) CrowdWiz,,https://www.reddit.com/r/ethereum/comments/7g3uic/ico_initial_coin_offering_crowdwiz/,1,0
7g3v5s,1511872815,A fundamental rethink of what a Business IS and how it works?!,[deleted],https://www.reddit.com/r/ethereum/comments/7g3v5s/a_fundamental_rethink_of_what_a_business_is_and/,1,0
7g3xbi,1511873493,Ethereum ATMs around the world,,https://www.reddit.com/r/ethereum/comments/7g3xbi/ethereum_atms_around_the_world/,1,0
7g3xnu,1511873603,proofofhodlers have made 30k by locking up their,[removed],https://www.reddit.com/r/ethereum/comments/7g3xnu/proofofhodlers_have_made_30k_by_locking_up_their/,1,1
7g3y4h,1511873764,"As Bitcoin hits $10,000, WSJ Business frontpage graph shows how, this year, Bitcoin has risen...545% percent LESS than Ethereum has risen.",,https://www.reddit.com/r/ethereum/comments/7g3y4h/as_bitcoin_hits_10000_wsj_business_frontpage/,2,0
7g3z0d,1511874048,ICO (Initial Coin Offering) Aigang,,https://www.reddit.com/r/ethereum/comments/7g3z0d/ico_initial_coin_offering_aigang/,1,0
7g3zjy,1511874201,proofofhodlers have made 30k by locking up their,,https://www.reddit.com/r/ethereum/comments/7g3zjy/proofofhodlers_have_made_30k_by_locking_up_their/,1,1
7g426t,1511875028,"""...managed to capture a full Ethereum robbery""",,https://www.reddit.com/r/ethereum/comments/7g426t/managed_to_capture_a_full_ethereum_robbery/,1,0
7g427x,1511875034,"As someone who works in the music industry, this is exciting!",,https://www.reddit.com/r/ethereum/comments/7g427x/as_someone_who_works_in_the_music_industry_this/,34,6
7g44ws,1511875841,For an ETH based non-profit: What kind of things can smart contracts rely on?,"I'm a tech guy, but I'm not experienced with Etherium, so I hope you guys can point me in the right direction. \n\nI'm working on a non-profit app to help fundraise of charity. As I understand it, smart contracts can be used to check some criteria before a transaction occurs - almost like an escrow service. \n\nMy question is, what kind of criteria are available to smart contracts? Can a smart contract be written to check that a bank account has a certain balance? \n\nCould I create a smart contract that allows a donor to donate Eth if (and only if) a charity is honestly reporting their expenditure based on public accounts?\n\nLooking forward to your thoughts and furthering the discussion.\n",https://www.reddit.com/r/ethereum/comments/7g44ws/for_an_eth_based_nonprofit_what_kind_of_things/,1,4
7g45dg,1511875975,BUY. I think now is a great time to buy 0.046700 BTC,[removed],https://www.reddit.com/r/ethereum/comments/7g45dg/buy_i_think_now_is_a_great_time_to_buy_0046700_btc/,1,1
7g466k,1511876194,[RLC] First Use Cases for the Decentralized Cloud Marketplace by iExec,,https://www.reddit.com/r/ethereum/comments/7g466k/rlc_first_use_cases_for_the_decentralized_cloud/,18,0
7g4670,1511876198,"""Transactions, block sizes, hash rates, new addresses and trades also saw all-time records, with Ethereum hitting a new record high for transactions on a blockchain over a 24-hour period"" - [Coindesk Q3 State of Blockchain]",,https://www.reddit.com/r/ethereum/comments/7g4670/transactions_block_sizes_hash_rates_new_addresses/,1,0
