id,created_utc,title,selftext,full_link,score,comments
7ggcyf,1511987023,Ethereum is up 8960% on bitcoin since its crowdsale. First ETH were priced at 2000ETH/BTC. Today's price = .0448ETH/BTC.,,https://www.reddit.com/r/ethereum/comments/7ggcyf/ethereum_is_up_8960_on_bitcoin_since_its/,1,0
7ggebm,1511987316,What kind of joke is this wallet??,,https://www.reddit.com/r/ethereum/comments/7ggebm/what_kind_of_joke_is_this_wallet/,1,1
7gghlo,1511988037,We got work to do still...,,https://www.reddit.com/r/ethereum/comments/7gghlo/we_got_work_to_do_still/,1,0
7ggl6o,1511988821,Question about Ethereum Wallet.,[removed],https://www.reddit.com/r/ethereum/comments/7ggl6o/question_about_ethereum_wallet/,1,7
7ggl7x,1511988828,Price down? Buy and HODDLLLLL,,https://www.reddit.com/r/ethereum/comments/7ggl7x/price_down_buy_and_hoddlllll/,0,20
7ggm1g,1511989017,"We built a cryptocurrency price tracking site, with real-time updates, a mobile friendly version and some advanced features. Feedback?",,https://www.reddit.com/r/ethereum/comments/7ggm1g/we_built_a_cryptocurrency_price_tracking_site/,1,0
7ggr1s,1511990101,EthConnect goes live in a few days! Earn 1 ECH when you use the referral!,[removed],https://www.reddit.com/r/ethereum/comments/7ggr1s/ethconnect_goes_live_in_a_few_days_earn_1_ech/,1,0
7ggvfq,1511991047,Join my new Discord for people who want to learn/teach about Crypto. Almost 250 members &lt;3,<not selftext available>,https://www.reddit.com/r/ethereum/comments/7ggvfq/join_my_new_discord_for_people_who_want_to/,0,0
7ggwfp,1511991260,"Anyone have any speculation on why Coinbase, Kraken and other’s sites are down?",[removed],https://www.reddit.com/r/ethereum/comments/7ggwfp/anyone_have_any_speculation_on_why_coinbase/,1,0
7ggzf1,1511991900,Are you optimistic that Ethereum smart contracts will get secure in the long term?,"Or are new DAOs going to continue haunting us, slowly killing Ethereum?\n\nIf you are optimistic, why are you optimistic? Has any feature rich computer system designed by humans ever proven itself resilient to hacking?\n\nI'm not very knowledgeable about Ethereum, so it's okay with a bit condescension if you think the question is stupid.",https://www.reddit.com/r/ethereum/comments/7ggzf1/are_you_optimistic_that_ethereum_smart_contracts/,3,15
7gh10o,1511992239,What do you think are the best hardware wallets?,,https://www.reddit.com/r/ethereum/comments/7gh10o/what_do_you_think_are_the_best_hardware_wallets/,10,15
7gh1wc,1511992437,Best place to buy ethereum?,[removed],https://www.reddit.com/r/ethereum/comments/7gh1wc/best_place_to_buy_ethereum/,1,1
7gh2rf,1511992619,How do I get on the Ethereum train 🤓,[removed],https://www.reddit.com/r/ethereum/comments/7gh2rf/how_do_i_get_on_the_ethereum_train/,1,0
7gh5yi,1511993302,A Canadian that has invested in Ethereum using coinbase,[removed],https://www.reddit.com/r/ethereum/comments/7gh5yi/a_canadian_that_has_invested_in_ethereum_using/,1,1
7gh6fg,1511993397,Newbie looking for some advice,<not selftext available>,https://www.reddit.com/r/ethereum/comments/7gh6fg/newbie_looking_for_some_advice/,1,1
7gh99u,1511994041,Oooops,,https://www.reddit.com/r/ethereum/comments/7gh99u/oooops/,1,0
7ghbgf,1511994575,The difference between Bitcoin and Ethereum,,https://www.reddit.com/r/ethereum/comments/7ghbgf/the_difference_between_bitcoin_and_ethereum/,68,49
7ghcb3,1511994772,Bob Summerwill - Conflict of Interests Statement,,https://www.reddit.com/r/ethereum/comments/7ghcb3/bob_summerwill_conflict_of_interests_statement/,25,11
7ghj9w,1511996340,Whats next?,"Whats the end game with ethereum, is it to compete with bitcoin or to be a friendly competitor? \nThanks for the input",https://www.reddit.com/r/ethereum/comments/7ghj9w/whats_next/,4,11
7ghjq3,1511996435,"Ethereum mining app, android",[removed],https://www.reddit.com/r/ethereum/comments/7ghjq3/ethereum_mining_app_android/,1,0
7ghku0,1511996697,Introducing 0x Connect,,https://www.reddit.com/r/ethereum/comments/7ghku0/introducing_0x_connect/,59,0
7ghku8,1511996699,"Ethereum mining, Android",[removed],https://www.reddit.com/r/ethereum/comments/7ghku8/ethereum_mining_android/,1,0
7ghowj,1511997630,BANKEX Joins The Enterprise Ethereum Alliance – BANKEX — Proof-of-Asset Protocol,,https://www.reddit.com/r/ethereum/comments/7ghowj/bankex_joins_the_enterprise_ethereum_alliance/,1,0
7ghr1a,1511998148,Very short survey for a website/platform I'm working on,,https://www.reddit.com/r/ethereum/comments/7ghr1a/very_short_survey_for_a_websiteplatform_im/,1,0
7ghrgx,1511998247,Fucked up,"So I accidently sent some eth to the wrong address from coinbase just learned not to try multitasking when sending eth, I had copied and pasted the address from what I thought was my wallet on my ether wallet but it wasn't however the wallet I sent it to had no transactions before I sent the eth to it is there any way I can try to get my funds back or do I have to kiss £500 goodbye.",https://www.reddit.com/r/ethereum/comments/7ghrgx/fucked_up/,1,35
7ghw0w,1511999309,Good time to get in now?,[removed],https://www.reddit.com/r/ethereum/comments/7ghw0w/good_time_to_get_in_now/,1,0
7ghywn,1512000012,I'm starting Ethereum/Blockchain society at my university!,"I have realized that there is a big educational gap when it comes down to blockchain technology which has a  big potential and I simply want to raise awareness and create an educational group, where people can have an open discussion!\n\nI would appreciate any advice or comments! \n\n",https://www.reddit.com/r/ethereum/comments/7ghywn/im_starting_ethereumblockchain_society_at_my/,88,10
7gi0nn,1512000480,Coinbase outage??,[removed],https://www.reddit.com/r/ethereum/comments/7gi0nn/coinbase_outage/,0,4
7gi3ch,1512001087,"Bought 7 ETH 11/16, sold 7 ETH yesterday. Time to buy back is right now!",[deleted],https://www.reddit.com/r/ethereum/comments/7gi3ch/bought_7_eth_1116_sold_7_eth_yesterday_time_to/,1,1
7gi5la,1512001626,500 is here,,https://www.reddit.com/r/ethereum/comments/7gi5la/500_is_here/,1,0
7gi869,1512002271,"Follow me on youtube doing analysis on forex and cryptos BTC,LTC,ETH",,https://www.reddit.com/r/ethereum/comments/7gi869/follow_me_on_youtube_doing_analysis_on_forex_and/,1,0
7gibiw,1512003112,Coinbase Loses Bid to Block IRS Probe of Bitcoin Gains,[deleted],https://www.reddit.com/r/ethereum/comments/7gibiw/coinbase_loses_bid_to_block_irs_probe_of_bitcoin/,1,0
7gicqn,1512003427,TOP youtuber Philip Defranco Covers BITCOIN/ETHEREUM in his daily video.,,https://www.reddit.com/r/ethereum/comments/7gicqn/top_youtuber_philip_defranco_covers/,2,1
7gifhs,1512004082,"Judge Orders Coinbase to Hand Over Details of 14,355 US Users to the IRS",,https://www.reddit.com/r/ethereum/comments/7gifhs/judge_orders_coinbase_to_hand_over_details_of/,1,0
7gimgx,1512005923,Thank you Vitalik - you've changed my life.,[removed],https://www.reddit.com/r/ethereum/comments/7gimgx/thank_you_vitalik_youve_changed_my_life/,182,33
7ginoe,1512006212,CryptoKitties missed a golden opportunity,They could have pushed an ico - “initial cat offering”.,https://www.reddit.com/r/ethereum/comments/7ginoe/cryptokitties_missed_a_golden_opportunity/,6,1
7gipls,1512006696,VectorCrypto,,https://www.reddit.com/r/ethereum/comments/7gipls/vectorcrypto/,1,0
7gitt6,1512007761,"Anyone know of any good powerpoints out there that explain the fundamentals and structure of Ethereum? Also, a nice addition would be Ethereums benefits and potential to impact society.",,https://www.reddit.com/r/ethereum/comments/7gitt6/anyone_know_of_any_good_powerpoints_out_there/,18,4
7gitxq,1512007795,VVtoken pre-sale sold out,,https://www.reddit.com/r/ethereum/comments/7gitxq/vvtoken_presale_sold_out/,1,0
7gja3q,1512011918,Vector Exchange Whitepaper,[removed],https://www.reddit.com/r/ethereum/comments/7gja3q/vector_exchange_whitepaper/,1,0
7gjii6,1512014234,ethereum-beta,[removed],https://www.reddit.com/r/ethereum/comments/7gjii6/ethereumbeta/,1,1
7gjo0l,1512015781,What sucks about Etherium?,[deleted],https://www.reddit.com/r/ethereum/comments/7gjo0l/what_sucks_about_etherium/,1,0
7gjor6,1512015988,"Indorse Keynote - Nov 28 2017, at SGInnovate - Full Version",,https://www.reddit.com/r/ethereum/comments/7gjor6/indorse_keynote_nov_28_2017_at_sginnovate_full/,7,0
7gjq8f,1512016406,Trouble transferring from Coinbase to Jaxx,[deleted],https://www.reddit.com/r/ethereum/comments/7gjq8f/trouble_transferring_from_coinbase_to_jaxx/,1,0
7gjrxf,1512016898,"The Russian version of Ardor vs. the Competition, Pt. 8: Ethereum (Blockchain Bloat)",,https://www.reddit.com/r/ethereum/comments/7gjrxf/the_russian_version_of_ardor_vs_the_competition/,1,0
7gjw8o,1512018179,A much needed collaboration in blockchain industry,,https://www.reddit.com/r/ethereum/comments/7gjw8o/a_much_needed_collaboration_in_blockchain_industry/,1,0
7gjwms,1512018300,Is Ethereum a better investment then bitcoins?,[removed],https://www.reddit.com/r/ethereum/comments/7gjwms/is_ethereum_a_better_investment_then_bitcoins/,1,1
7gjx98,1512018484,End State Considerations - Central Banks Issuing in Ether/Bitcoin/Others?,[removed],https://www.reddit.com/r/ethereum/comments/7gjx98/end_state_considerations_central_banks_issuing_in/,1,0
7gjy42,1512018725,Could you have an ICO where contributing to a database 'mines' coins for you?,Wondering if its possible to set up a database where users could contribute datapoints in exchange for cryptocurrency.  As the database grows its value grows and the value of the currency increases.\n\nAnyone seen any articles or publications around this?,https://www.reddit.com/r/ethereum/comments/7gjy42/could_you_have_an_ico_where_contributing_to_a/,0,9
7gjzqk,1512019215,Sweetbridge source code is now public,,https://www.reddit.com/r/ethereum/comments/7gjzqk/sweetbridge_source_code_is_now_public/,5,5
