id,created_utc,title,selftext,full_link,score,comments
i7c75i,1597089251,"Okay r/Ethereum Help Me Out: I'm 50/50 in ETH &amp; ADA, Please Convince Me to Drop the Hedge",[removed],https://www.reddit.com/r/ethereum/comments/i7c75i/okay_rethereum_help_me_out_im_5050_in_eth_ada/,1,1
i7ek6a,1597096393,Nano s ledger(model s),[removed],https://www.reddit.com/r/ethereum/comments/i7ek6a/nano_s_ledgermodel_s/,1,0
i7ekfh,1597096410,Wrapped Token wXGM On #Ethereum and Uniswap listing,,https://www.reddit.com/r/ethereum/comments/i7ekfh/wrapped_token_wxgm_on_ethereum_and_uniswap_listing/,1,0
i7f3z7,1597098094,🎙️ YFI: Farming the Farmers | Andre Cronje,,https://www.reddit.com/r/ethereum/comments/i7f3z7/yfi_farming_the_farmers_andre_cronje/,1,1
i7fymx,1597100868,Introduction to backrunning - webinar series - Thursday 4pm PT - OpenZeppelin &amp; IDEO,"OpenZeppelin are thrilled to be launching a new webinar series together with IDEO to share practical code reviews exploring the latest blockchain security research. We are kicking it off this Thursday with Austin Williams and Dan Elitzer on Ethereum Backrunning.\n\nBackrunning is the strategy of getting a transaction to be next in line after a transaction that would benefit you, such as a liquidation immediately following an oracle price update. \n\nJoin us online this Thursday at 4pm PT - register below to attend:  \n[https://zoom.us/webinar/register/3015970849687/WN\_ysl1Bv5YS3OIaa0jklj7XA](https://zoom.us/webinar/register/3015970849687/WN_ysl1Bv5YS3OIaa0jklj7XA)\n\nhttps://preview.redd.it/hfdww63ta9g51.png?width=1280&amp;format=png&amp;auto=webp&amp;s=d5b1d2aa09dbce47c2f6c517c8e97c615502c265",https://www.reddit.com/r/ethereum/comments/i7fymx/introduction_to_backrunning_webinar_series/,1,2
i7g0q6,1597101057,"Emotional Players, Emotional Markets - Market Monday LITE (08/10)",,https://www.reddit.com/r/ethereum/comments/i7g0q6/emotional_players_emotional_markets_market_monday/,1,0
i7gsi9,1597103704,Story of My Bitcoin Journey. I cant afford 32 ETH to Stake Ethereum 2.0,[removed],https://www.reddit.com/r/ethereum/comments/i7gsi9/story_of_my_bitcoin_journey_i_cant_afford_32_eth/,1,0
i7h22q,1597104620,"Recovery guide for situations where you accidentally send Eth to an address on a different chain (Things like VET, Theta, etc...)",,https://www.reddit.com/r/ethereum/comments/i7h22q/recovery_guide_for_situations_where_you/,1,2
i7h28l,1597104635,The Story of My Bitcoin Journey . I can't even afford 32ETH to Stake Ethereum 2.0,"I've got a story.\nThe Story I kept for 6 years now.\nThe story makes me ask myself: How to ask for Help'\nI try to hold my tears as I type my story. \n....It was late 2008 I started collecting bitcoins..later bought added to my collection.  That time security was weak, bitcoin was vulnerable really. I managed to keep  my coins until mtgox.com dumped magic exchange gateway  and Justcoin.com were doing well. Mtgox held 70% of all bitcoin in circulation then. And the devil struck. Mtgox got hacked..I LOST ALL MY 4900 BITCOINS and the small kept in my justcoin trading platform,  due to justcoin closure ,I moved them to swisscex.com and my remaining 1100 got lost .\nIs someone here can help me get my claim certificate from mtgox? I am homeless now....at least I could get a decent home with roof over my head today if I still have a 1/3  of my coins I got. \nIf YOU come across my story and you want extend helping hands to me...please do so to: btc bc1q8gvt5x5ax6wx6wvx84ckkfwp4262c5kkneu0xa\nEth:0xb123bcAdc3a74D219fA4a8C31c7518152fcc8D24",https://www.reddit.com/r/ethereum/comments/i7h28l/the_story_of_my_bitcoin_journey_i_cant_even/,1,7
i7hcf5,1597105657,What are all the ethereum dapps you use?,,https://www.reddit.com/r/ethereum/comments/i7hcf5/what_are_all_the_ethereum_dapps_you_use/,1,30
i7hq1l,1597107005,YIELDTO SMART CONTRACT,[removed],https://www.reddit.com/r/ethereum/comments/i7hq1l/yieldto_smart_contract/,1,0
i7ic37,1597109259,"DeFi Tokens BAND, LINK, Outpace Bitcoin Price by Gaining 100% in 10 Days",,https://www.reddit.com/r/ethereum/comments/i7ic37/defi_tokens_band_link_outpace_bitcoin_price_by/,1,0
i7ifyf,1597109668,~$500B Locked in DeFi protocols By ~2024,,https://www.reddit.com/r/ethereum/comments/i7ifyf/500b_locked_in_defi_protocols_by_2024/,1,0
i7kwp9,1597119212,Bitcoin Breaks $12k Overhead Resistance but Overwhelm by Selling Pressure,,https://www.reddit.com/r/ethereum/comments/i7kwp9/bitcoin_breaks_12k_overhead_resistance_but/,1,0
i7laph,1597120886,LiquidApps responds to the Ethereum scalability challenge,,https://www.reddit.com/r/ethereum/comments/i7laph/liquidapps_responds_to_the_ethereum_scalability/,1,0
i7lcex,1597121088,ECOCHAIN SMART CONTRACT — Steemit,[removed],https://www.reddit.com/r/ethereum/comments/i7lcex/ecochain_smart_contract_steemit/,1,0
i7lggp,1597121602,Is there a wallet I can download and use my own private key ?,[removed],https://www.reddit.com/r/ethereum/comments/i7lggp/is_there_a_wallet_i_can_download_and_use_my_own/,1,0
i7lq88,1597122816,GigaBet - Crypto Gambling Casino,,https://www.reddit.com/r/ethereum/comments/i7lq88/gigabet_crypto_gambling_casino/,1,1
i7lufx,1597123351,Grayscale Bitcoin Tv Commercial Review,,https://www.reddit.com/r/ethereum/comments/i7lufx/grayscale_bitcoin_tv_commercial_review/,1,0
i7lvip,1597123493,How to send an Ethereum transaction?,[removed],https://www.reddit.com/r/ethereum/comments/i7lvip/how_to_send_an_ethereum_transaction/,1,0
