id,created_utc,title,selftext,full_link,score,comments
i73vtg,1597062429,"As Ethereum DeFi craze continues, Uniswap is processing over 100,000 transactions a day",,https://www.reddit.com/r/ethereum/comments/i73vtg/as_ethereum_defi_craze_continues_uniswap_is/,1,0
i743tc,1597063326,Failed Transaction due to contract being out of gas,[removed],https://www.reddit.com/r/ethereum/comments/i743tc/failed_transaction_due_to_contract_being_out_of/,1,0
i74837,1597063789,Great video on Ethereum's basics by Andreas Antonopoulos,,https://www.reddit.com/r/ethereum/comments/i74837/great_video_on_ethereums_basics_by_andreas/,1,0
i74erv,1597064530,Marketexchange.io - Easy Way to buy cryptocurrency,,https://www.reddit.com/r/ethereum/comments/i74erv/marketexchangeio_easy_way_to_buy_cryptocurrency/,1,0
i74k5d,1597065106,Are you eager to know about forsage smart contract mlm?,[removed],https://www.reddit.com/r/ethereum/comments/i74k5d/are_you_eager_to_know_about_forsage_smart/,1,0
i74mf8,1597065358,Everstake has signed the first block in the ETH 2.0 testnet ☄️,,https://www.reddit.com/r/ethereum/comments/i74mf8/everstake_has_signed_the_first_block_in_the_eth/,1,46
i74s55,1597065956,The Privacy Coin Guide Part 1,"*As interest picks up in crypto again, I want to share this post I made on privacy coins again to just give the basics of their evolution. This is only part 1, and parts 2 and 3 are not available in this format, but this part is informative and basic.*\n\nIf you’re looking for a quick and easy way to assess what the best privacy coin in the current space is, which has the best features, or which is most likely to give high returns, then this is not that guide. My goal is to give you the power to make your own decisions, to clearly state my biases, and educate. I really wanted to understand this niche of the crypto-space due to my background and current loyalties[\[1\]](https://cryptoramble.com/), and grasp the nuances of the features, origins and timelines of technologies used in privacy coins, while not being anything close to a developer myself. This is going to be a 3-part series, starting with an overview and basic review of the technology, then looking at its implications, and ending with why I like a specific project. It might be mildly interesting or delightfully educational. Cryptocurrencies are young and existing privacy coins are deploying technology that is a work in progress. This series assumes a basic understanding of how blockchains work, specifically as used in cryptocurrencies. If you don’t have that understanding, might I suggest that you get it? [\[2\]](https://www.cryptoramble.com/articles/2018/5/9/what-is-blockchain-and-how-does-it-work-7dzbm),[\[3\]](https://www.youtube.com/watch?v=Lx9zgZCMqXE),[\[4\]](http://www.michaelnielsen.org/ddi/how-the-bitcoin-protocol-actually-works/) Because cryptocurrencies have a long way to go before reaching their end-game: when the world relies on the technology without understanding it. So, shall we do a deep dive into the privacy coin space?\n\n# FIRST THERE WAS BITCOIN\n\nCryptocurrencies allow you to tokenize value and track its exchange between hands over time, with transaction information verified by a distributed network of users. The most famous version of a cryptocurrency in use is Bitcoin, defined as peer-to-peer electronic cash. [\[5\]](https://bitcoin.org/bitcoin.pdf) Posted anonymously in 2008, the whitepaper seemed to be in direct response to the global financial meltdown and public distrust of the conventional banking and financing systems. Although cryptographic techniques are used in Bitcoin to ensure that (i) only the owner of a specific wallet has the authority to spend funds from that wallet, (ii) the public address is linked but cannot be traced by a third party to the private address (iii) the information is stored via cryptographic hashing in a merkle tree structure to ensure data integrity, the actual transaction information is publicly visible on the blockchain and can be traced back to the individual through chain analysis.[\[6\]](http://anonymity-in-bitcoin.blogspot.com/2011/07/bitcoin-is-not-anonymous.html) This has raised fears of possible financial censorship or the metaphorical tainting of money due to its origination point, as demonstrated in the Silk Road marketplace disaster.[\[7\]](https://arstechnica.com/tech-policy/2013/10/how-the-feds-took-down-the-dread-pirate-roberts/) This can happen because fiat money is usually exchanged for cryptocurrency at some point, as crypto-enthusiasts are born in the real world and inevitably cash out. There are already chain analysis firms and software that are increasingly efficient at tracking transactions on the Bitcoin blockchain.[\[8\]](https://www.chainalysis.com/) This lack of privacy is one of the limitations of Bitcoin that has resulted in the creation of altcoins that experiment with the different features a cryptocurrency can have. Privacy coins are figuring out how to introduce privacy in addition to the payment network. The goal is to make the cryptocurrency fungible, each unit able to be exchanged for equal value without knowledge of its transaction history – like cash, while being publicly verifiable on a decentralized network. In other words, anyone can add the math up without being able to see the full details. Some privacy solutions and protocols have popped up as a result:\n\n# CRYPTONOTE – RING SIGNATURES AND STEALTH ADDRESSES\n\n*Used in: Monero and Particl as its successor RING-CT, Bytecoin*\n\nIn December 2012, CryptoNote introduced the use of ring signatures and stealth addresses (along with other notable features such as its own codebase) to improve cryptocurrency privacy.[\[9\]](https://cryptonote.org/whitepaper_v1.pdf) An updated CryptoNote version 2 came in October 2013 [\[10\]](https://cryptonote.org/whitepaper.pdf)(though there is some dispute over this timeline [\[11\]](https://bitcointalk.org/index.php?topic=740112.msg8361633#msg8361633)), also authored under the name Nicolas van Saberhagen. Ring signatures hide sender information by having the sender sign a transaction using a signature that could belong to multiple users. This makes a transaction untraceable. Stealth addresses allow a receiver to give a single address which generates a different public address for funds to be received at each time funds are sent to it. That makes a transaction unlinkable. In terms of privacy, CryptoNote gave us a protocol for untraceable and unlinkable transactions. The first implementation of CryptoNote technology was Bytecoin in March 2014 (timeline disputed [\[12\]](https://bitcointalk.org/index.php?topic=740112.msg8361633#msg8361633)), which spawned many children (forks) in subsequent years, a notable example being Monero, based on CryptoNote v2 in April 2014.\n\nRING SIGNATURES and STEALTH ADDRESSES\n\n### PROS\n\n– Provides sender and receiver privacy\n\n– Privacy can be default\n\n– Mature technology\n\n– Greater scalability with bulletproofs\n\n– Does not require any third-party\n\n### CONS\n\n– Privacy not very effective without high volume\n\n\-Does not hide transaction information if not combined with another protocol.\n\n# COINJOIN\n\n  *Used in: Dash*\n\nBitcoin developer Gregory Maxwell proposed a set of solutions to bring privacy to Bitcoin and cryptocurrencies, the first being CoinJoin (January 28 – Aug 22, 2013).[\[13\]](https://bitcointalk.org/index.php?topic=139581.0),[\[14\]](https://bitcointalk.org/index.php?topic=279249) CoinJoin (sometimes called CoinSwap) allows multiple users to combine their transactions into a single transaction, by receiving inputs from multiple users, and then sending their outputs to the multiple users, irrespective of who in the group the inputs came from. So, the receiver will get whatever output amount they were supposed to, but it cannot be directly traced to its origination input. Similar proposals include Coinshuffle in 2014 and Tumblebit in 2016, building on CoinJoin but not terribly popular [\[15\]](https://www.petsymposium.org/2014/papers/Ruffing.pdf),[\[16\]](https://eprint.iacr.org/2016/575.pdf). They fixed the need for a trusted third party to ‘mix’ the transactions. There are CoinJoin implementations that are being actively worked on but are not the most popular privacy solutions of today. A notable coin that uses CoinJoin technology is Dash, launched in January 2014, with masternodes in place of a trusted party.\n\nCOINJOIN\n\n### PROS\n\n– Provides sender and receiver privacy\n\n– Easy to implement on any cryptocurrency\n\n– Lightweight\n\n– Greater scalability with bulletproofs\n\n– Mature technology\n\n### CONS\n\n– Least anonymous privacy solution. Transaction amounts can be calculated\n\n– Even without third-party mixer, depends on wealth centralization of masternodes\n\n# ZEROCOIN\n\n*Used in: Zcoin, PIVX*\n\nIn May 2013, the Zerocoin protocol was introduced by John Hopkins University professor Matthew D. Green and his graduate students Ian Miers and Christina Garman.[\[17\]](http://spar.isi.jhu.edu/~mgreen/ZerocoinOakland.pdf) In response to the need for use of a third party to do CoinJoin, the Zerocoin proposal allowed for a coin to be destroyed and remade in order to erase its history whenever it is spent. Zero-knowledge cryptography and zero-knowledge proofs are used to prove that the new coins for spending are being appropriately made. A zero-knowledge proof allows one party to prove to another that they know specific information, without revealing any information about it, other than the fact that they know it. Zerocoin was not accepted by the Bitcoin community as an implementation to be added to Bitcoin, so a new cryptocurrency had to be formed. Zcoin was the first cryptocurrency to implement the Zerocoin protocol in 2016. [\[18\]](https://zcoin.io/understanding-how-zerocoin-in-zcoin-works-and-how-it-compares-to-other-anonymity-solutions-part-1/)\n\nZEROCOIN\n\n### PROS\n\n– Provides sender and receiver privacy\n\n– Supply can be audited\n\n– Relatively mature technology\n\n– Does not require a third-party\n\n### CONS\n\n– Requires trusted setup (May not be required with Sigma protocol)\n\n– Large proof sizes (not lightweight)\n\n– Does not provide full privacy for transaction amounts\n\n# ZEROCASH\n\n*Used in:  Zcash, Horizen, Komodo, Zclassic, Bitcoin Private*\n\nIn May 2014, the current successor to the Zerocoin protocol, Zerocash, was created, also by Matthew Green and others (Eli Ben-Sasson, Alessandro Chiesa, Christina Garman, Matthew Green, Ian Miers, Eran Tromer, Madars Virza).[\[19\] ](http://zerocash-project.org/media/pdf/zerocash-extended-20140518.pdf)It improved upon the Zerocoin concept by taking advantage of zero-knowledge proofs called zk-snarks (zero knowledge succinct non-interactive arguments of knowledge). Unlike Zerocoin, which hid coin origins and payment history, Zerocash was faster, with smaller transaction sizes, and hides transaction information on the sender, receiver and amount. Zcash is the first cryptocurrency to implement the Zerocash protocol in 2016. [\[20\]](https://z.cash/technology/)\n\nZEROCASH\n\n### PROS\n\n– Provides full anonymity. Sender, receiver and amount hidden.\n\n– Privacy can be default?\n\n– Fast due to small proof sizes.\n\n– Payment amount can be optionally disclosed for auditing\n\n– Does not require any third-party\n\n### CONS\n\n– Requires trusted setup. (May be improved with zt-starks technology)\n\n– Supply cannot be audited. And coins can potentially be forged without proper implementation.\n\n– Private transactions computationally intensive (improved with Sapling upgrade)\n\n# CONFIDENTIAL TRANSACTIONS\n\n*Used in:  Monero and Particl with Ring Signatures as RING-CT*\n\nThe next proposal from Maxwell was that of confidential transactions, proposed in June 2015 as part of the Sidechain Elements project from Blockstream, where Maxwell was Chief Technical Officer.[\[21\]](https://people.xiph.org/~greg/confidential_values.txt),[\[22\]](https://elementsproject.org/) It proposed to hide the transaction amount and asset type (e.g. deposits, currencies, shares), so that only the sender and receiver are aware of the amount, unless they choose to make the amount public. It uses homomorphic encryption[\[23\]](https://en.wikipedia.org/wiki/Homomorphic_encryption) to encrypt the inputs and outputs by using blinding factors and a kind of ring signature in a commitment scheme, so the amount can be ‘committed’ to, without the amount actually being known. I’m terribly sorry if you now have the urge to go and research exactly what that means. The takeaway is that the transaction amount can be hidden from outsiders while being verifiable.\n\nCONFIDENTIAL TRANSACTIONS\n\n### PROS\n\n– Hides transaction amounts\n\n– Privacy can be default\n\n– Mature technology\n\n– Does not require any third-party\n\n### CONS\n\n– Only provides transaction amount privacy when used alone\n\n# RING-CT\n\n*Used in: Monero, Particl*\n\nThen came Ring Confidential transactions, proposed by Shen-Noether of Monero Research Labs in October 2015.[\[24\]](https://eprint.iacr.org/2015/1098.pdf) RingCT combines the use of ring signatures for hiding sender information, with the use of confidential transactions (which also uses ring signatures) for hiding amounts. The proposal described a new type of ring signature, A Multi-layered Linkable Spontaneous Anonymous Group signature which “allows for hidden amounts, origins and destinations of transactions with reasonable efficiency and verifiable, trustless coin generation”.[\[25\]](https://lab.getmonero.org/pubs/MRL-0005.pdf) RingCT was implemented in Monero in January 2017 and made mandatory after September 2017.\n\nRING -CONFIDENTIAL TRANSACTIONS\n\n### PROS\n\n– Provides full anonymity. Hides transaction amounts and receiver privacy\n\n– Privacy can be default\n\n– Mature technology\n\n– Greater scalability with bulletproofs\n\n– Does not require any third-party\n\n### CONS\n\n– Privacy not very effective without high volume\n\n# MIMBLEWIMBLE\n\n*Used in: Grin*\n\nMimblewimble was proposed in July 2016 by pseudonymous contributor Tom Elvis Jedusorand further developed in October 2016 by Andrew Poelstra.[\[26\]](https://download.wpsoftware.net/bitcoin/wizardry/mimblewimble.txt),[\[27\]](https://download.wpsoftware.net/bitcoin/wizardry/mimblewimble.pdf) Mimblewimble is a “privacy and fungibility focused cryptocoin transaction structure proposal”.[\[28\]](https://mimblewimble.cash/) The key words are transaction structure proposal, so the way the blockchain is built is different, in order to accommodate privacy and fungibility features. Mimblewimble uses the concept of Confidential transactions to keep amounts hidden, looks at private keys and transaction information to prove ownership of funds rather than using addresses, and bundles transactions together instead of listing them separately on the blockchain. It also introduces a novel method of pruning the blockchain. Grin is a cryptocurrency in development that is applying Mimblewimble. Mimblewimble is early in development and you can understand it more here [\[29\]](https://blockonomi.com/grin-mimblewimble/).\n\nMIMBLEWIMBLE\n\n### PROS\n\n– Hides transaction amounts and receiver privacy\n\n– Privacy is on by default\n\n– Lightweight\n\n– No public addresses?\n\n### CONS\n\n– Privacy not very effective without high volume\n\n– Sender and receiver must both be online\n\n– Relatively new technology\n\n# ZEXE\n\nFresh off the minds of brilliant cryptographers (Sean Bowe, Alessandro Chiesa, Matthew Green, Ian Miers, Pratyush Mishra, Howard Wu), in October 2018 Zexe proposed a new cryptographic primitive called ‘decentralized private computation.[\[30\]](https://eprint.iacr.org/2018/962.pdf) It allows users of a decentralized ledger to “execute offline computations that result in transactions”[\[31\]](https://eprint.iacr.org/2018/962.pdf), but also keeps transaction amounts hidden and allows transaction validation to happen at any time regardless of computations being done online. This can have far reaching implications for privacy coins in the future. Consider cases where transactions need to be automatic *and private*, without both parties being present.\n\n# NETWORK PRIVACY\n\nPrivacy technologies that look at network privacy as nodes communicate with each other on the network are important considerations, rather than just looking at privacy on the blockchain itself. Anonymous layers encrypt and/or reroute data as it moves among peers, so it is not obvious who they originate from on the network. They are used to protect against surveillance or censorship from ISPs and governments. The Invisible Internet Project (I2P) is an anonymous network layer that uses end to end encryption for peers on a network to communicate with each other.\[32\] Its history dates back to 2003. Kovri is a Monero created implementation of I2P.[\[33\]](https://kovri.io/) The Onion Router (Tor) is another anonymity layer [\[34\]](https://en.wikipedia.org/wiki/Tor_(anonymity_network)) that Verge is a privacy cryptocurrency that uses. But its historical link to the US government may be is concerning to some[\[35\]](https://www.theguardian.com/technology/2014/jul/29/us-government-funding-tor-18m-onion-router). Dandelion transaction relay is also an upcoming Bitcoin improvement proposal (BIP) that scrambles IP data that will provide network privacy for Bitcoin as transaction and other information is transmitted.[\[36\]](https://github.com/bitcoin/bitcoin/pull/13947),[\[37\]](https://particl.community/t/what-is-dandelion/78),[\[38\]](https://blockonomi.com/dandelion-protocol/)\n\n# UPCOMING\n\nMonero completed bulletproofs protocol updates that reduce RINGCT transaction sizes and thus transaction fee costs. (Bulletproofs are a replacement for range proofs used in confidential transactions that aid in encrypting inputs and outputs by making sure they add to zero).\n\nSigma Protocol – being actively researched by Zcoin team as of 2018 to replace Zerocoin protocol so that a trusted setup is not required.[\[39\]](https://eprint.iacr.org/2014/764.pdf) There is a possible replacement for zk-snarks, called zk-starks, another form of zero-knowledge proof technology, that may make a trusted set-up unnecessary for zero-knowledege proof coins.[\[40\]](https://medium.com/applicature/zk-snarks-vs-zt-starks-the-next-level-of-privacy-93964d7d4e86)\n\n&amp;#x200B;\n\n# PART 1 CONCLUSION OF THE PRIVACY COIN GUIDE ON THE TECHNOLOGY BEHIND PRIVACY COINS\n\nAlthough Bitcoin is still a groundbreaking technology that gives us a trust-less transaction system, it has failed to live up to its expectations of privacy. Over time, new privacy technologies have arrived and are arriving with innovative and exciting solutions for Bitcoin’s lack of fungibility. It is important to note that these technologies are built on prior research and application, but we are considering their use in cryptocurrencies. Protocols are proposed based on cryptographic concepts that show how they would work, and then developers actually implement them. Please note that I did not include the possibility of improper implementation as a disadvantage, and the advantages assume that the technical development is well done. A very important point is that coins can also adapt new privacy technologies as their merits become obvious, even as they start with a specific privacy protocol. Furthermore, I am, unfortunately, positive that this is not an exhaustive overview and I am only covering publicized solutions. Next, we’ll talk more about the pros and cons and give an idea of how the coins can be compared.\n\n&amp;#x200B;\n\nThere's a video version that can be watched, and you can find out how to get the second two parts if you want on my website (video link on the page): [https://cryptoramble.com/guide-on-privacy-coins/](https://cryptoramble.com/guide-on-privacy-coins/)",https://www.reddit.com/r/ethereum/comments/i74s55/the_privacy_coin_guide_part_1/,1,0
i74s6c,1597065959,How hard is it to run ETH node?,[removed],https://www.reddit.com/r/ethereum/comments/i74s6c/how_hard_is_it_to_run_eth_node/,1,1
i74t4o,1597066060,Gas price pain,[removed],https://www.reddit.com/r/ethereum/comments/i74t4o/gas_price_pain/,1,0
i74xe4,1597066503,"Watch out for searching on ""uniswap"" on search engines like google",[removed],https://www.reddit.com/r/ethereum/comments/i74xe4/watch_out_for_searching_on_uniswap_on_search/,1,0
i74xq3,1597066538,"Coming next week! The first phase of #Chrysalis (IOTA 1.5) on our #mainnet with significant performance, usability, and reliability upgrades. With over 1k TPS and 10 second confirmation times, this upgrade will bring an entirely new experience to using the current #IOTA network👏👏👏👏👏👏",,https://www.reddit.com/r/ethereum/comments/i74xq3/coming_next_week_the_first_phase_of_chrysalis/,1,0
i75awb,1597067906,Decentralized Applications (Dapps): What’s the Deal?,,https://www.reddit.com/r/ethereum/comments/i75awb/decentralized_applications_dapps_whats_the_deal/,1,0
i75err,1597068280,Problem with XIO TOKEN and ledger nano s,[removed],https://www.reddit.com/r/ethereum/comments/i75err/problem_with_xio_token_and_ledger_nano_s/,1,0
i75yx7,1597070212,Vitalik Buterin to Bitcoin Maximalists: Ethereum (ETH) Present Supply Is Clearly Known,,https://www.reddit.com/r/ethereum/comments/i75yx7/vitalik_buterin_to_bitcoin_maximalists_ethereum/,1,0
i76gsk,1597071819,"Opyn hacked, ETH 2.0 testnet, #supplygate - Another Crazy Week in Crypto",,https://www.reddit.com/r/ethereum/comments/i76gsk/opyn_hacked_eth_20_testnet_supplygate_another/,1,0
i76m09,1597072258,2 Ethereum 2 questions,[removed],https://www.reddit.com/r/ethereum/comments/i76m09/2_ethereum_2_questions/,1,3
i76z8r,1597073454,DeFi Prime Interviews a DXdao member on Omen Prediction Markets,,https://www.reddit.com/r/ethereum/comments/i76z8r/defi_prime_interviews_a_dxdao_member_on_omen/,1,0
i77507,1597073945,ETH Price Could Rally to $440 as DeFi Interest Surges,,https://www.reddit.com/r/ethereum/comments/i77507/eth_price_could_rally_to_440_as_defi_interest/,1,0
i7753a,1597073954,"ETH Fans, Want to Learn More About Ambiguity and Blockchains?"," Join us for a presentation of ""Crystals and Mud on the Blockchain"" by James Grimmelmann hosted by the Initiative for CryptoCurrencies and Contracts (IC3).  \n\n\nAbstract: Blockchains seem to replace the muddiness of human institutions with the crystalline mathematical perfection of code. But some of this shift is an illusion: the mud always finds a way to seep back in. I will give a lawyer's perspective on why ambiguity and discretion are so hard to get rid of, even on blockchains.  \n\n\nBio: James Grimmelmann is the Tessler Family Professor of Digital and Information Law at Cornell Tech and Cornell Law School. He studies how laws regulating software affect freedom, wealth, and power. He tries to help lawyers and technologists understand each other by writing about digital copyright, search engines, privacy on social networks, online governance, and other topics in computer and Internet law.  \n\n\nAbout IC3:  \nThe initiative for Cryptocurrencies &amp; Contracts (IC3) is an initiative of faculty members at Carnegie Mellon University, Cornell University, Cornell Tech, EPFL, ETH Zurich, UC Berkeley, University College London, UIUC and the Technion. Learn more about IC3 blockchain research at initc3.org. \n\n&amp;#x200B;\n\nRegister for the event: [https://cornell.zoom.us/webinar/register/WN\_NNDV3zbNRkSZE6R4a6Rl9g](https://cornell.zoom.us/webinar/register/WN_NNDV3zbNRkSZE6R4a6Rl9g)",https://www.reddit.com/r/ethereum/comments/i7753a/eth_fans_want_to_learn_more_about_ambiguity_and/,1,0
i77n04,1597075513,Who decides the maximum supply of eth?,[removed],https://www.reddit.com/r/ethereum/comments/i77n04/who_decides_the_maximum_supply_of_eth/,1,0
i784rf,1597077061,Ethereum price prediction: could ETH outperform BTC in 2020?,,https://www.reddit.com/r/ethereum/comments/i784rf/ethereum_price_prediction_could_eth_outperform/,1,1
i78cko,1597077731,DeFi — an ecosystem made for “whales”?!,,https://www.reddit.com/r/ethereum/comments/i78cko/defi_an_ecosystem_made_for_whales/,1,0
i79prr,1597081859,ETH sent as Internal Transaction does not appear in Trust Wallet,[removed],https://www.reddit.com/r/ethereum/comments/i79prr/eth_sent_as_internal_transaction_does_not_appear/,1,0
i79vze,1597082372,Trying to restore what I thought was my wallet. Geth issues and UTC dat file. Help!,[removed],https://www.reddit.com/r/ethereum/comments/i79vze/trying_to_restore_what_i_thought_was_my_wallet/,1,1
i7a8e9,1597083377,Ethereum Cat Herders Update #27,,https://www.reddit.com/r/ethereum/comments/i7a8e9/ethereum_cat_herders_update_27/,1,0
i7aa4i,1597083523,"Antonopoulos: ETH Supply Debate ""No Better Than Schiff and Roubini"" Bitcoin Rants",,https://www.reddit.com/r/ethereum/comments/i7aa4i/antonopoulos_eth_supply_debate_no_better_than/,1,1
i7ap27,1597084764,Methodology determines the answer of ETH supply,,https://www.reddit.com/r/ethereum/comments/i7ap27/methodology_determines_the_answer_of_eth_supply/,1,0
i7awym,1597085419,DEP is on Uniswap,,https://www.reddit.com/r/ethereum/comments/i7awym/dep_is_on_uniswap/,1,0
i7b9qf,1597086484,"Trying to create NFT images on Ethereum, migth use some help.",[removed],https://www.reddit.com/r/ethereum/comments/i7b9qf/trying_to_create_nft_images_on_ethereum_migth_use/,1,8
i7bz9q,1597088591,I’m starting an Telegram channel to share news about DeFi and Ethereum only. Join the conversation!,,https://www.reddit.com/r/ethereum/comments/i7bz9q/im_starting_an_telegram_channel_to_share_news/,1,0
