id,created_utc,title,selftext,full_link,score,comments
ikonhj,1598981178,"Ethereum Layer-2 Scaling Strategies, the Progress So Far",,https://www.reddit.com/r/ethereum/comments/ikonhj/ethereum_layer2_scaling_strategies_the_progress/,1,0
ikonvh,1598981217,"Bitcoin, Ethereum traded on Vienna Stock Exchange for first time - Verdict",,https://www.reddit.com/r/ethereum/comments/ikonvh/bitcoin_ethereum_traded_on_vienna_stock_exchange/,1,0
ikovrq,1598981899,This Signal Says Ethereum Could Lead Alts Off A Cliff,,https://www.reddit.com/r/ethereum/comments/ikovrq/this_signal_says_ethereum_could_lead_alts_off_a/,1,0
ikpabh,1598983172,Building bridges: How DeFi could grow from Ethereum to other networks - The Block,,https://www.reddit.com/r/ethereum/comments/ikpabh/building_bridges_how_defi_could_grow_from/,1,0
ikpl5e,1598984080,Ethereum Software Company Consensys on Rebranding Of the Enterprise Ethereum Offerings,,https://www.reddit.com/r/ethereum/comments/ikpl5e/ethereum_software_company_consensys_on_rebranding/,1,0
ikpqhd,1598984532,Sushiswap update - Audit (!!) &amp; Strategy,,https://www.reddit.com/r/ethereum/comments/ikpqhd/sushiswap_update_audit_strategy/,1,0
ikpt1b,1598984741,"district0x Dev Update - September 1st, 2020",,https://www.reddit.com/r/ethereum/comments/ikpt1b/district0x_dev_update_september_1st_2020/,1,0
ikpt9t,1598984760,"Research: Bots May Be ""Front Running"" Traders on Ethereum",,https://www.reddit.com/r/ethereum/comments/ikpt9t/research_bots_may_be_front_running_traders_on/,1,0
ikq1c3,1598985440,Now that's a lot of damage!,,https://www.reddit.com/r/ethereum/comments/ikq1c3/now_thats_a_lot_of_damage/,1,136
ikqc67,1598986353,"Explosion des frais de Transaction sur Ethereum (ETH), Une solution en test sur Filecoin",,https://www.reddit.com/r/ethereum/comments/ikqc67/explosion_des_frais_de_transaction_sur_ethereum/,1,0
ikqit6,1598986932,"Dive into the why, what and who of Rollups. Explore ZK Rollups and Optimistic Rollups and some of the leading implementations.",,https://www.reddit.com/r/ethereum/comments/ikqit6/dive_into_the_why_what_and_who_of_rollups_explore/,1,0
ikqj6x,1598986968,"Ethereum 2.0 Testnet Medalla Running Smoothly with 39,000 Active Validators &amp; More in Queue",,https://www.reddit.com/r/ethereum/comments/ikqj6x/ethereum_20_testnet_medalla_running_smoothly_with/,1,0
ikr3jw,1598988758,With single DeFi transactions costing hundreds of dollars. Ethereum is now an unscalable blockchain for the rich only. Miners should increase the gas limit to 16M.,[removed],https://www.reddit.com/r/ethereum/comments/ikr3jw/with_single_defi_transactions_costing_hundreds_of/,1,3
ikrbzk,1598989485,Exploring Ethereum L2 Scaling with Hash Commitments,,https://www.reddit.com/r/ethereum/comments/ikrbzk/exploring_ethereum_l2_scaling_with_hash/,1,0
ikrkzi,1598990295,NEO vs ETHER,[removed],https://www.reddit.com/r/ethereum/comments/ikrkzi/neo_vs_ether/,1,0
ikrliw,1598990342,UniSwap Token Lists Update,,https://www.reddit.com/r/ethereum/comments/ikrliw/uniswap_token_lists_update/,1,0
ikrsco,1598990912,this is great,[removed],https://www.reddit.com/r/ethereum/comments/ikrsco/this_is_great/,1,0
iksijg,1598993179,I'm spending hundreds of dollars per day on ETH transaction costs for DEFI. Can I run my own node and process my own transactions?,[removed],https://www.reddit.com/r/ethereum/comments/iksijg/im_spending_hundreds_of_dollars_per_day_on_eth/,1,9
iksn3q,1598993553,Hung up Transactions,[removed],https://www.reddit.com/r/ethereum/comments/iksn3q/hung_up_transactions/,1,1
iksnh2,1598993586,Question on the participation rate in Medalla Testnet ETH2,"I'm just questioning myself about the participation rate, will the percent be always under 80% or it should reach 95-99, or even 100% ? Thanks.",https://www.reddit.com/r/ethereum/comments/iksnh2/question_on_the_participation_rate_in_medalla/,1,4
ikt97q,1598995432,Ethereum breaks $ 400 and indicators point to high,,https://www.reddit.com/r/ethereum/comments/ikt97q/ethereum_breaks_400_and_indicators_point_to_high/,1,0
iktes4,1598995908,"I can't believe $sushi is generating 2,000% APYs, HOW is this even possible?","I get it, they reward you sushi for staking it as liquidity providers and their token is given 10x times more for the initial 2 weeks but that's not even possible, that money has to come from somewhere or am I missing something?\n\nIt seems like they are printing their own money and people are buying into it. Don't get me wrong, I love those massive APYs but it's unstable and won't go for long or the un-audited contracts will be hacked sooner than later.\n\nWhat do you guys think? Is sushi for real?",https://www.reddit.com/r/ethereum/comments/iktes4/i_cant_believe_sushi_is_generating_2000_apys_how/,1,40
iktyie,1598997642,Ethereum DeFi yield farming private tools? Keep your Ethereum transaction private.,,https://www.reddit.com/r/ethereum/comments/iktyie/ethereum_defi_yield_farming_private_tools_keep/,1,0
iktzjs,1598997741,This is fine,,https://www.reddit.com/r/ethereum/comments/iktzjs/this_is_fine/,1,0
iku42a,1598998125,Sushi token explained,,https://www.reddit.com/r/ethereum/comments/iku42a/sushi_token_explained/,1,12
iku9nr,1598998641,"EthHub Weekly #129: SushiSwap, FTX Acquires Blockfolio, Aave gets a money license, yearn.finance delegated funding vaults, Uniswap token lists and Ethereum is a dark forest",,https://www.reddit.com/r/ethereum/comments/iku9nr/ethhub_weekly_129_sushiswap_ftx_acquires/,1,0
ikud1e,1598998961,Scaling DeFi: Layer One — A visual tour of Ethereum’s scaling challenge,,https://www.reddit.com/r/ethereum/comments/ikud1e/scaling_defi_layer_one_a_visual_tour_of_ethereums/,1,0
ikvb1j,1599002218,"Exorbant fees, Eth 2.0, Cosmos Ethermint and Polkadot and other (d)PoS multichains ELI5 request",[removed],https://www.reddit.com/r/ethereum/comments/ikvb1j/exorbant_fees_eth_20_cosmos_ethermint_and/,1,1
ikvnxb,1599003456,Dont deal with RogerCS. Time waster,[removed],https://www.reddit.com/r/ethereum/comments/ikvnxb/dont_deal_with_rogercs_time_waster/,1,0
ikw013,1599004672,All the News! Heavy news day led by Eth / DeFi,,https://www.reddit.com/r/ethereum/comments/ikw013/all_the_news_heavy_news_day_led_by_eth_defi/,1,0
ikwf9q,1599006244,Scaling DeFi - New 0x blog post series,,https://www.reddit.com/r/ethereum/comments/ikwf9q/scaling_defi_new_0x_blog_post_series/,1,0
ikwody,1599007214,ETH GAS 51% ............. ( now 30% ),[removed],https://www.reddit.com/r/ethereum/comments/ikwody/eth_gas_51_now_30/,1,0
ikx651,1599009103,How to trade DeFi tokens when Ethereum gas prices spike | Matcha offers free limit orders!,,https://www.reddit.com/r/ethereum/comments/ikx651/how_to_trade_defi_tokens_when_ethereum_gas_prices/,1,0
ikxh36,1599010258,“Failed” transaction?? Did I lose my funds?,"I sent some Eth to a metamask address, and I got a failed transaction message.. it’s not showing up in my original wallet. Did I lose my funds?",https://www.reddit.com/r/ethereum/comments/ikxh36/failed_transaction_did_i_lose_my_funds/,1,1
ikygmy,1599014049,Is there an way to buy gas?,With the defi craze going on I think Gas prices will continue to rise. Is there an exchange that has a gas derivitive or something?,https://www.reddit.com/r/ethereum/comments/ikygmy/is_there_an_way_to_buy_gas/,1,2
ikyos8,1599014911,Why aren’t gas prices lowering?,[removed],https://www.reddit.com/r/ethereum/comments/ikyos8/why_arent_gas_prices_lowering/,1,0
ikytvm,1599015490,How to deposit yETH in yearn?,[removed],https://www.reddit.com/r/ethereum/comments/ikytvm/how_to_deposit_yeth_in_yearn/,1,0
ikz0f8,1599016195,I knew it!,,https://www.reddit.com/r/ethereum/comments/ikz0f8/i_knew_it/,1,0
ikze29,1599017751,I lost some ETH through Mooniswap,[removed],https://www.reddit.com/r/ethereum/comments/ikze29/i_lost_some_eth_through_mooniswap/,1,0
ikzozs,1599019017,Noob question regarding fees.,[removed],https://www.reddit.com/r/ethereum/comments/ikzozs/noob_question_regarding_fees/,1,6
ikztev,1599019539,666 gwei 💀,,https://www.reddit.com/r/ethereum/comments/ikztev/666_gwei/,1,0
ikzwap,1599019863,I Need An Explanation Of What Ethereum Is As If I was 15 Years Old,[removed],https://www.reddit.com/r/ethereum/comments/ikzwap/i_need_an_explanation_of_what_ethereum_is_as_if_i/,1,6
il00bf,1599020334,Ethereum Research Survey from Florida International University's Blockchain Research group.,[removed],https://www.reddit.com/r/ethereum/comments/il00bf/ethereum_research_survey_from_florida/,1,0
il09rg,1599021498,Something we can agree on. #fullcircle,,https://www.reddit.com/r/ethereum/comments/il09rg/something_we_can_agree_on_fullcircle/,1,37
il0d8e,1599021910,Trying to covert Ether into Bcap but don’t understand how ? Help !,[removed],https://www.reddit.com/r/ethereum/comments/il0d8e/trying_to_covert_ether_into_bcap_but_dont/,1,0
il0p2p,1599023392,Mining rewards doubters since last week?,[removed],https://www.reddit.com/r/ethereum/comments/il0p2p/mining_rewards_doubters_since_last_week/,1,0
il0qeq,1599023565,Using the update Pi 4b 8GB as a node,[removed],https://www.reddit.com/r/ethereum/comments/il0qeq/using_the_update_pi_4b_8gb_as_a_node/,1,0
il1mdc,1599027855,How to invest on the regular indexes?,"Okay so lets say I want to buy something linked to the performance of ether/ethereum on the equities market.\n\nWhat stocks/companies are on the major indexes working on this area for those of us that don't want to transfer money to crypto exchanges, figure out wallets, and all that stuff.",https://www.reddit.com/r/ethereum/comments/il1mdc/how_to_invest_on_the_regular_indexes/,1,2
il1qkl,1599028465,The rock CryptoKitties by Muse are here - The Cryptonomist,,https://www.reddit.com/r/ethereum/comments/il1qkl/the_rock_cryptokitties_by_muse_are_here_the/,1,0
il1x1j,1599029421,#ETH #BTC,[removed],https://www.reddit.com/r/ethereum/comments/il1x1j/eth_btc/,1,0
