id,created_utc,title,selftext,full_link,score,comments
iynubl,1600912173,Markaccy Announcement: Changing of Wallet Address No Longer Available,,https://www.reddit.com/r/ethereum/comments/iynubl/markaccy_announcement_changing_of_wallet_address/,1,0
iynyg5,1600912574,Another Scam,[removed],https://www.reddit.com/r/ethereum/comments/iynyg5/another_scam/,1,0
iysgpl,1600931380,Imagine Yield Farming Multiple Farming Pools NO Fees,,https://www.reddit.com/r/ethereum/comments/iysgpl/imagine_yield_farming_multiple_farming_pools_no/,1,1
iysy4d,1600933907,Are Decentralized Finance (DeFi) Enthusiasts...too Enthusiastic?,,https://www.reddit.com/r/ethereum/comments/iysy4d/are_decentralized_finance_defi_enthusiaststoo/,1,0
iyt2sw,1600934590,"Amid BTC Pullback, Top ETH-Based Coins Plunge - Whaleagent",,https://www.reddit.com/r/ethereum/comments/iyt2sw/amid_btc_pullback_top_ethbased_coins_plunge/,1,0
iyu82y,1600940826,"Protecting yourself from DeFi Risk: Options, NFT Insurance and More",,https://www.reddit.com/r/ethereum/comments/iyu82y/protecting_yourself_from_defi_risk_options_nft/,1,0
iyulnm,1600942803,Rinkeby Faucet Not Working,[removed],https://www.reddit.com/r/ethereum/comments/iyulnm/rinkeby_faucet_not_working/,1,3
iyv9xq,1600946103,The Vending Machine Is the Primordial Granddaddy of All Smart Contracts (2-minute audio clip from Nick Szabo &amp; Naval Ravikant),,https://www.reddit.com/r/ethereum/comments/iyv9xq/the_vending_machine_is_the_primordial_granddaddy/,1,0
iyveb1,1600946678,"Keys4Coins now accepts Ethereum! Buy pc games with Ether. Connect and purchase with a few clicks by connecting to MetaMask, WalletConnect, Torus, and Fortmatic, or by scanning the QR code from any wallet.",,https://www.reddit.com/r/ethereum/comments/iyveb1/keys4coins_now_accepts_ethereum_buy_pc_games_with/,1,0
iyvkhj,1600947468,"Rotki, the portfolio tracker that protects your privacy, releases v1.8.0 with compound finance and yearn vaults historical accounting",,https://www.reddit.com/r/ethereum/comments/iyvkhj/rotki_the_portfolio_tracker_that_protects_your/,1,10
iyvv80,1600948745,IT'S ON FIRE! What is Vitalik saying? Where does OCEAN rank? Augur V2? D...,,https://www.reddit.com/r/ethereum/comments/iyvv80/its_on_fire_what_is_vitalik_saying_where_does/,1,0
iyvzga,1600949196,"Hey I just did one of my first crypto purchases today, a brave t-shirt, gonna love it",check it out\n\nhttps://preview.redd.it/x8xsbuxd63p51.png?width=1518&amp;format=png&amp;auto=webp&amp;s=77fa5e8b8dd7d23f2b98944b71f5f8e47a84ec14,https://www.reddit.com/r/ethereum/comments/iyvzga/hey_i_just_did_one_of_my_first_crypto_purchases/,1,8
iyw2xw,1600949592,"Ethereum 2.0: User Outlines Why He Would Not Stake ETH at Launch, Danny Ryan Weighs In",,https://www.reddit.com/r/ethereum/comments/iyw2xw/ethereum_20_user_outlines_why_he_would_not_stake/,1,0
iywhdz,1600951205,launchnodes,,https://www.reddit.com/r/ethereum/comments/iywhdz/launchnodes/,1,0
iywyed,1600952959,How Blockchain Can Improve New Media,"&amp;#x200B;\n\nhttps://preview.redd.it/qn5df41jh3p51.png?width=1200&amp;format=png&amp;auto=webp&amp;s=646c39783691374ad34acd325d2ac2b0a5ec0153\n\n*By David Orman and Adam Simmons, Co-founders at* [*Verasity*](https://verasity.io/)\n\nThe media has made much ado about [how blockchain stands to revolutionize financial services and technology](https://www.forbes.com/sites/bernardmarr/2018/07/16/here-are-10-industries-blockchain-is-likely-to-disrupt/#2db488ecb5a2) as we know them. However, fewer column inches have been devoted to how distributed ledger technology and data decentralization stands to transform media itself; by bringing transparency, accountability and global digital transaction capability.\n\nYou’ll find projects like [po.et](http://po.et/) who are preventing plagiarism and piracy online. Decentralized systems can benefit individual content creators as equally as bigger, more established players.\n\nHere’s how it works: Without quality data about the origin of the media clip in question, a system cannot automate the detection and deletion of pirated content. With blockchain technology, a public ledger can be an immutable reference as to when the content was originally uploaded and details on ownership. This is not only a powerful tool to prevent piracy, but also to prevent the false copyright strikes or takedown requests that plague many major media platforms today.\n\nWhere [blockchain stands to make the greatest impact in media is in digital advertising.](https://www.wsj.com/articles/whats-an-online-ad-worth-blockchain-might-help-with-that-1529326800) Digital ledger technology stands to provide superior ad targeting and efficiency. Yet the $[192 billion digital advertising side of media](https://digitaglobal.com/state-us192-billion-digital-advertising-industry/) faces its own Internet-age travails. The world’s largest advertisers have voiced concerns about the rampant fraud and inefficiency of buying digital and social media.\n\nConsumer products giant [Procter &amp; Gamble cut its digital ad spend in 2017 by $200](https://www.adweek.com/brand-marketing/when-procter-gamble-cut-200-million-in-digital-ad-spend-its-marketing-became-10-more-effective/) million in part over concerns about shadowy content views. Competitor Unilever has voiced similar misgivings. Bots generating bogus page views can render platform algorithms inaccurate and inflate the perceived value of sponsorships and brand partnerships with content creators, making for ineffective digital ad spend on the part of the advertiser — and ultimately, disrupted ad flow for the media outlet.\n\n[Next-generation video platform Verasity](https://verasity.io/) has developed a new system of media accountability and analytics called [Proof-of-View](https://verasity.io/documents/verasity_whitepaper_eng.pdf) — a patent-pending technology that uses 14 different methods to ensure each view recorded on the platform is a view from a genuine user. The data is captured and published in the public domain on the blockchain whilst ensuring personal information remains anonymized.\n\n**Clearly the market is ripe for the kinds of services that companies like Verasity are promising**. In less than two years since its founding, Verasity has already struck several partnerships with blockchain media agencies such as XCHNG and TRUTH Agency to provide brands with a new end-to-end media buying process and auditable way to ensure media efficiency. Individual video content providers can avail of VERA, Verasity’s forthcoming cryptocurrency that integrates a digital wallet functionality into the online player.\n\nPlatform users earn currency by watching content and can earn additional funds by opting in to watch ads. Users received immediate payment in reward for engaging with the brand, rather than having to wait some two or three months, as is the case on other similar platforms. The user can then choose to use earned VERA currency to pay content owners directly through the wallet. **The minimal transactional fees involved mean using a cryptocurrency for payments also effectively enables microtransactions on content that would not be commercially viable with fiat money.**\n\nConsidering that some of the largest video platforms like YouTube are known to take as much as 45% of advertising revenue, blockchain-based payment systems such as Verasity make financial sense for large-scale content providers as well.\n\nIn its roughly 20 years of existence, digital media has endured its share of growing pains as it seeks to maintain its authenticity and viability as a money-generating business. While faces of this technology are in its most nascent stages, blockchain-based systems may very well be the next step in taking the media industry into its next phase — or at least be what powers digital media into its third decade.\n\n#### If you enjoyed this post, please subscribe and click the clap 👏 button below to show your support! ⬇⬇\n\nWebsite: [https://verasity.io](https://verasity.io/)  \nTelegram: [http://t.me/verasitychat](http://t.me/verasitychat)  \nTwitter: [https://twitter.com/verasitytech](https://twitter.com/verasitytech)  \nFacebook: [https://facebook.com/verasitytech](https://facebook.com/verasitytech)  \nLinkedIn: [https://www.linkedin.com/company/verasity](https://www.linkedin.com/company/verasity)  \nReddit: [https://www.reddit.com/r/verasity](https://www.reddit.com/r/verasity)",https://www.reddit.com/r/ethereum/comments/iywyed/how_blockchain_can_improve_new_media/,1,0
iyxrgq,1600955948,Aavegotchi game mechanics make full use of Chainlink VRF,,https://www.reddit.com/r/ethereum/comments/iyxrgq/aavegotchi_game_mechanics_make_full_use_of/,1,0
iyy08i,1600956787,Nyan.finance: The Digital Hedge Fund," A quick TL;DR breakdown of the project:\n\nName: Nyan $NYAN ​ \n\nSupply: 33,000 ​ \n\nStaked: 29,000+ ​ \n\nSummary: Aims to be the first decentralized digital hedge fund. Its tokenomic structure allows individual users to invest pooled staking rewards collectively to build and increase the funds size like a traditionally managed private fund. This is accomplished using a governance voting system embedded in the contracts code. ​ \n\nWebsite: [Nyan.finance](https://Nyan.finance)\n\n&amp;#x200B;\n\nDeFi is creating a blockchain environment like never before. New tokens are deployed everyday on the Ethereum chain, most of which aim for a quick 30x or more with gimmicky concepts, get-rich-quick schemes and downright copy/pasting past successful ideas. This has caused record breaking transactions on the Ethereum network, which are also due in part to the recent UNI airdrop. With that being said, not all of these new tokens are a waste of time. Innovation always finds its way, this time in the form of [*Nyan.Finance*](https://Nyan.Finance).\n\n&amp;#x200B;\n\nhttps://preview.redd.it/njkgne7ss3p51.png?width=305&amp;format=png&amp;auto=webp&amp;s=83e46269b6ee52adedd7ef00b95711cfe737f03e\n\n*Nyan.finance* ***(NYAN)*** is a new ERC20 token which bills itself as ""*a DeFi governance token that turns individual traders into a collective whale.* ***NYAN*** *holders can stake their* ***NYAN*** *and receive a secondary token known as Catnip. When a user claims their accumulated rewards, they will only receive 80% of the reward. The other 20% is sent to be stored by the* ***NYAN*** *address in order to be used as part of the pumping mechanism.* ***NYAN*** *holders will be able to bid on a Uniswap token that they want to purchase with the funds in one, or a series of, large buys.*""\n\n&amp;#x200B;\n\n***NYAN*** has a total of 33,000 tokens for a total supply. The token can be broken down to 18 decimals. **It did not have a private or presale**, so tokens were made readily available for distribution after contract launch. 1,000 ***NYAN*** were distributed to the development team, with 2,000 also released as giveaway rewards. Liquidity is also locked for holders to trade on *Uniswap*. Currently, ***1 NYAN = $204.54 (0.595424 Eth)*** at the time of this writing, with a fully diluted market cap of ***$6,749,820***. As mentioned above, *Catnip* is also part of the ***NYAN*** tokenomic system, along with a third token named **DarkNyan**. All three tokens work hand in hand, and each asset will be outlined in full detail to explain how each attributes itself to the growth of the overall ***NYAN*** ecosystem.\n\n&amp;#x200B;\n\nEssentially, ***NYAN*** aims to provide a decentralized, community governed hedge fund, giving the holders of ***NYAN*** token the rights to decide collectively what they will invest in and for how long. Being decentralized, this gives community members an awesome responsibility, one that most other private hedge-funds or other iterations of a hedge-fund fail to offer. As mentioned earlier, a user who owns ***NYAN*** has the option to stake their ***NYAN*** to receive the secondary token *Catnip (NIP) (Contract Address: 0xD2B93f66FD68c5572BFB8EBf45E2Bd7968B38113)*. *NIP* currently has 28,440 tokens in circulation, with the supply growing as more *NIP* are minted via the staking of ***NYAN***. ***The current staking reward is: Blocks x NYAN staked / 100,000.***\n\n&amp;#x200B;\n\nhttps://preview.redd.it/28zbpi0ys3p51.jpg?width=1079&amp;format=pjpg&amp;auto=webp&amp;s=1356fabb8ed527025e0f1006da47aae225d298ca\n\n*NIP* is the token given to holders who stake ***NYAN***. When a holder wants to claim their NIP staking rewards, users only receive 80% of that reward, with 20% of it being sent to the ***NYAN*** contract. The 20% of the ***NYAN*** staking rewards, which are now *NIP* held by the ***NYAN*** contract, are then pooled together and invested by the community via a voting system. In other words, voters create *NIP* via staking, the staking reward is then partially contributed to the decentralized ecosystem to create a hedge-fund made up of the combined contribution from stakers, with full control assessed to the community. *NIP* does have further utility, which will be explained below.\n\n&amp;#x200B;\n\nAlong with ***NYAN*** and *NIP*, there a third asset which plays a large part in this ecosystem called **Dark Nyan (DNYAN)** *(Contract Address: 0x23b7f3a35bda036e3b59a945e441e041e6b11101)*. **DNYAN** is attained joining the *NIP/ETH* liquidity pool on Uniswap. **DNYAN** currently has a supply of 554.14 tokens, and has its own major impact in regards to tokenomics. ***The current staking reward is:*** ***NIP/ETH*** ***LP (UNI-V2) Token x 6500/ 3,600,000 = DNYAN per day***. (*It is recommended to claim mined* ***DNYAN*** *as often as possible as difficulty increases*)\n\nhttps://preview.redd.it/5a11t2fvs3p51.jpg?width=1060&amp;format=pjpg&amp;auto=webp&amp;s=a367f269396b180d1b52acb47e3fa5e66991a35a\n\n&amp;#x200B;\n\nOnce you have joined this pool and you receive the LP tokens, you navigate back to ***Nyan.finance*** to stake the LP token. Staking effectively allows the user to mine the **DNYAN** token, which has its own utility as well. The **DNYAN** token will allow ***NYAN*** voters, via an upcoming integration with *Polkadot*, to acquire non ERC20 assets. This effectively ensures that ***NYAN*** voters will have access to a vast collection of available cryptocurrency assets (while *Polkadot* does not support *ALL* cryptocurrency assets at this time, it is its goal and mission to support the vast majority of projects, which will effectively allow the ***NYAN*** token ecosystem full access to hedge against the assets there).\n\n&amp;#x200B;\n\n**To break down how the voting system will work, along with other questions the development team wanted to address if they ever arose, here is a bit of detail straight from the projects website:**\n\n&amp;#x200B;\n\n***Welcome to the steering wheel of a multi-million dollar machine***\n\n*In this system, Nyan holders will be able to freely govern the protocol as they wish. The voting and function calls operate on a bidding system, in which the bid with the most votes at the end of a round will be executed. A bid can be a call to a contract, or a combination of calls to one or multiple contracts, all within the same transaction.*\n\n&amp;#x200B;\n\n***What are Bids?***\n\n*Glad you asked! Bids are a set of instructions that relay what functions to call with the Voting Connector contract. A bid is composed of the Bidder's address, a unique bidId, and a series of arrays with types including Integers, Strings, and Bytes. With these data fields, anyone will be able to construct a bid with its own set of parameters for the function to be called.*\n\n*Additionally, bids can be chained. No, this isn't street fighter. An additional bid can be chained to an initial bid. This additional bid is known as a chain bid. A chain bid requires an initial bid in order to be created. With chains, much more complex transactions can be created. It's a Pandora's box to be honest.*\n\n&amp;#x200B;\n\n***How does voting occur?***\n\n*Voting for bids occurs within periods known as voting rounds. Before each round begins, Nyan holders can construct a bid and propose it in order to have it ready for voting. Other Nyan holders will vote using Nyan as a proof of collateral and Catnip as a fee. These fees will vary based on the amount of votes an individual is attempting to place in any one round. The more votes, the higher the Catnip cost. With this route, the cost of voting should be negligible for smaller holder. The current minimum Nyan needed to vote is 1 Nyan. However, this can be changed by voters.*\n\n&amp;#x200B;\n\n***How does the machine maintain value?***\n\n*An reasonable thought that any onlooker would immediately have is: Is the protocol dependent on turning a profit? Fortunately, the answer is no. The Nyan machine will never have to turn a single profit in order to maintain value for Nyan holders. Here's why. All the funds held by the funding contract were generated by Nyan holders that have either staked their Nyan or Catnip Liquidity tokens. This means that those funds can be considered as speculated into existence. Now in order to make sure that value will always outpace minting and speculation, the goal of the Nyan protocol is continuously burn Catnip used as a fee for voting. Half of this Catnip will also be swapped for dNyan in order to provide rewards for individuals that provide liquidity to Nyan.*\n\n&amp;#x200B;\n\n***How do distributions work?***\n\n*Voters decide when and what to distribute, with certain limitations. Distributions can be called once every 2 days maximum. The distribution can be for any token held by the funding address. Catnip and dNyan distributions are limited to 10% of their available amount in any one transaction. Distributions of other assets can use all of the available asset. In order to claim their proportion of the distributed asset, claimers must stake their Nyan or Catnip Liquidity tokens. The tokens will only be released when the distribution period has ended. This is to prevent users from unfairly claiming twice*\n\n&amp;#x200B;\n\n***Is the voting contract fool-proof?***\n\n*No contract is fool-proof. The Nyan voting contracts, however are built with modularity in mind. Each contract can be upgraded, replaced and reconnected. Voters will only have to vote for a bid that reconnects the contract to the rest of the ecosystem. Built this way, Nyan can continuously be updated by it's community without the need for a central developer. The voters can also vote for a transfer that pays an external auditor to look over any code in the ecosystem. To get a better technical look at the upcoming voting contracts, visit the* *Nyan Github* *and look over the voting contract files. The files in the github are not the most current version, please do not fork them into production. There are several bugs and mistakes that have been done in the unpushed version.*\n\n&amp;#x200B;\n\nI find the decentralized aspect of ***NYAN*** very appealing. It is a way for users to take control as a collective whale and make decisions with their vote. I have not seen any sort of ecosystem like this in the cryptocurrency space, and I am curious to see it explored and expanded, as the environment surrounding ***NYAN*** allows for contract upgrades and new integrations based on the voting system. With DeFi continuing to be a driving force in the recent surge in crypto related assets, can ***NYAN*** become a mainstay and solidify itself as the first truly decentralized hedge-fund? The playing field is set for it to do just that.\n\n&amp;#x200B;\n\n​ Here are some things to expect in the near future along with other important facts:\n\n&amp;#x200B;\n\n* Contract audit incoming\n* Investment voting launching this week\n* Liquidity locked\n* Dev has 1000 tokens, all of which are staked\n* 89% of tokens are staked\n* 200 tokens were each given to 5 people to encourage liquidity early on\n* 10 tokens were each given to the first 100 people to join telegram\n* Community-driven logo contest: [https://t.me/nyanpoll](https://t.me/nyanpoll)\n* Website upgrade this week, driven by a volunteer dev\n* Learnnnyan, a learning portal being created by the community\n* Beware clones that are being created, such as Kush\n* NYAN staking this week\n* Polkadot integration scheduled for end of month\n* v2 and secret contracts to prevent frontrunning planned\n* Both NYAN stakers and NIP liquidity providers get a share of profits\n* Likely looking to invest in safer platforms like Yearn and Curve initially\n\n&amp;#x200B;\n\n*(I write articles and reviews for legitimate, interesting, up and coming cryptocurrency projects. Feel free to PM me to review your project. Thank you!)*\n\n&amp;#x200B;\n\n***Disclaimer: This is not financial advice. The sole purpose of this post/article is to provide and create and informative and educated discussion regarding the project in question. Invest at your own risk.***\n\n&amp;#x200B;\n\n\---------------------------------------------------------------------------------------------------------\n\nnyan.finance Links:\n\n\- Website: nyan.finance\n\n\- Github: github.com/geass-zero/nyan.finance\n\n\- Medium: [https://medium.com/@nyanfinance](https://medium.com/@nyanfinance)\n\n\- Telegram: [https://t.me/nyanfinance](https://t.me/nyanfinance)\n\n\- Telegram (news): [https://t.me/nyanfinancenews](https://t.me/nyanfinancenews)\n\n\- Trello Roadmap: [https://trello.com/b/neXGkfpP/nyanfinance-roadmap](https://trello.com/b/neXGkfpP/nyanfinance-roadmap)\n\n\- ***LIQUIDITY LOCKED***:  \nhttps://www.unicrypt.network/uniswap-browser/pair/0x544cd63c9a3363daB66733Bf8073Cb981Db58cBA  \n\n\n\- Learn about the nyan ecosystem: https://t.me/nyanfinance/24323  \n(Learn nyan (full web portal coming soon, see trello for details): https://mobile.twitter.com/LearnNyan)",https://www.reddit.com/r/ethereum/comments/iyy08i/nyanfinance_the_digital_hedge_fund/,1,1
iyy1c8,1600956891,"Re-introducing Status Desktop – Beta v0.1.0. Private messaging is now available on Windows, Mac, and Linux, with seamless syncing to your mobile device.",,https://www.reddit.com/r/ethereum/comments/iyy1c8/reintroducing_status_desktop_beta_v010_private/,1,6
iyy8wn,1600957639,Cardano Dev Portal Sign-Up,,https://www.reddit.com/r/ethereum/comments/iyy8wn/cardano_dev_portal_signup/,1,0
iyyl5p,1600958793,Zerion DeFi SDK makes life easy for developers,,https://www.reddit.com/r/ethereum/comments/iyyl5p/zerion_defi_sdk_makes_life_easy_for_developers/,1,0
iyyuru,1600959690,Quick questions about fees,If I do a transaction with a too small  gwei price (say 65) will it confirm later when gwei prices fall?,https://www.reddit.com/r/ethereum/comments/iyyuru/quick_questions_about_fees/,1,1
iyz50s,1600960639,👋 Dear Chinese and Spanish ETH 'n' ERD lovers!,🤗 We`ve prepared an interesting article on your languages! \n\nSo you can read about the difference and technical aspects of ElrondNetwork and Ethereum :\n\n🇨🇳 https://stake.is/5F/\n\n🇪🇸 https://stake.is/5d/\n\nEnjoy!,https://www.reddit.com/r/ethereum/comments/iyz50s/dear_chinese_and_spanish_eth_n_erd_lovers/,1,0
iyzj4k,1600961914,Tron Strategic Partnership With BitGo: Brings Wrapped BTC &amp; ETH,,https://www.reddit.com/r/ethereum/comments/iyzj4k/tron_strategic_partnership_with_bitgo_brings/,1,0
iyzqk3,1600962580,trade or wait,[removed],https://www.reddit.com/r/ethereum/comments/iyzqk3/trade_or_wait/,1,0
iz03vj,1600963743,Are Decentralized Finance (DeFi) Enthusiasts...too Enthusiastic?,,https://www.reddit.com/r/ethereum/comments/iz03vj/are_decentralized_finance_defi_enthusiaststoo/,1,0
iz07l8,1600964065,Ethereum or ERC20-Tokens?,[removed],https://www.reddit.com/r/ethereum/comments/iz07l8/ethereum_or_erc20tokens/,1,0
iz07lv,1600964067,"If the option was given and all things supported it, would you want to live entirely off cryptocurrency alone?",[removed],https://www.reddit.com/r/ethereum/comments/iz07lv/if_the_option_was_given_and_all_things_supported/,1,3
iz13ab,1600966801,"Introducing Voting as a Service, an API to access a decentralized Governance Layer",[removed],https://www.reddit.com/r/ethereum/comments/iz13ab/introducing_voting_as_a_service_an_api_to_access/,1,0
iz5br5,1600979975,Escaping the Dark Forest — samczsun,,https://www.reddit.com/r/ethereum/comments/iz5br5/escaping_the_dark_forest_samczsun/,1,11
iz6xuz,1600985130,Banking without a Bank,,https://www.reddit.com/r/ethereum/comments/iz6xuz/banking_without_a_bank/,1,0
iz7207,1600985500,Living on Crypto in Colombia,,https://www.reddit.com/r/ethereum/comments/iz7207/living_on_crypto_in_colombia/,1,0
iz76dp,1600985923,"Rails: an Ethereum layer 2 scaling solution for instant, gasless transactions.",,https://www.reddit.com/r/ethereum/comments/iz76dp/rails_an_ethereum_layer_2_scaling_solution_for/,1,1
iz7hab,1600986972,Easy Way to Buy Ethereum With MasterCard/Visa Gift Card and Send $20 of it Without Using Phone or ID?,[removed],https://www.reddit.com/r/ethereum/comments/iz7hab/easy_way_to_buy_ethereum_with_mastercardvisa_gift/,1,0
iz7kmn,1600987292,Fictional art NFT’s,[removed],https://www.reddit.com/r/ethereum/comments/iz7kmn/fictional_art_nfts/,1,0
izgf3d,1601025859,When will ETH2.0 be shipped anyway?,[removed],https://www.reddit.com/r/ethereum/comments/izgf3d/when_will_eth20_be_shipped_anyway/,1,2
izgjl4,1601026588,EIP 1559 Development Moves Forward With Help from Consensys - TCR,,https://www.reddit.com/r/ethereum/comments/izgjl4/eip_1559_development_moves_forward_with_help_from/,1,0
izhbws,1601031109,Light at the end of the tunnel. Optimism TestNet RollOut plan,,https://www.reddit.com/r/ethereum/comments/izhbws/light_at_the_end_of_the_tunnel_optimism_testnet/,1,5
