id,created_utc,title,selftext,full_link,score,comments
izhcml,1601031215,"LOOM / Zombie Battleground Dev updates Kickstarter page to explain the death of project: ""the lack of transparency and deliberate misdirection exhibited by Loom (and encouraged by Former CEO Matthew Campbell)""",,https://www.reddit.com/r/ethereum/comments/izhcml/loom_zombie_battleground_dev_updates_kickstarter/,1,29
izihlo,1601036727,Ethereum rivals and layer 2 solutions are active,,https://www.reddit.com/r/ethereum/comments/izihlo/ethereum_rivals_and_layer_2_solutions_are_active/,1,0
izja9t,1601040011,Our Pre-Sale is LIVE! Go to www.candelacoin.com,,https://www.reddit.com/r/ethereum/comments/izja9t/our_presale_is_live_go_to_wwwcandelacoincom/,1,0
izjaeq,1601040023,Ethereum studio ConsenSys wins Hong Kong central bank digital currency study project,,https://www.reddit.com/r/ethereum/comments/izjaeq/ethereum_studio_consensys_wins_hong_kong_central/,1,1
izjn3i,1601041366,I built a pay-what-you-feel crytpocurrency (ETHER) donation store for my new album ($0 or more to download). It's part of my PhD research into blockchain for music - so please go and donate if you can (however small or enter $0 &amp; download) and let me know what you think.,,https://www.reddit.com/r/ethereum/comments/izjn3i/i_built_a_paywhatyoufeel_crytpocurrency_ether/,1,0
izjt2l,1601041979,zkSwap rebranding to ZeroSwap. a layer-2 AMM token swap protocol based on zero-knowledge proof. Test net coming soon.,,https://www.reddit.com/r/ethereum/comments/izjt2l/zkswap_rebranding_to_zeroswap_a_layer2_amm_token/,1,0
izk6kd,1601043297,TrustToken giving away up to $1M in liquidity to new DeFi projects,,https://www.reddit.com/r/ethereum/comments/izk6kd/trusttoken_giving_away_up_to_1m_in_liquidity_to/,1,5
izkb9y,1601043743,Developing Ethereum smart contracts with the Truffle Suite including Web3,,https://www.reddit.com/r/ethereum/comments/izkb9y/developing_ethereum_smart_contracts_with_the/,1,1
izkkmb,1601044620,ETH Bounces From $300 But Fails To Confirm Upward Trend (TA - 25th September),,https://www.reddit.com/r/ethereum/comments/izkkmb/eth_bounces_from_300_but_fails_to_confirm_upward/,1,0
izksy1,1601045378,Release candidate 3.1RC OpenEthereum (ex-Parity client),"We have released OpenEthereum 3.1RC1. We need your support for testing it, so if you want to install a full node, this is a good opportunity.\n\n[https://github.com/openethereum/backport-3.1/tree/v3.1.0-rc.1](https://github.com/openethereum/backport-3.1/tree/v3.1.0-rc.1)\n\nFor more context please check our medium post explaining the vision for OpenEthereum: [https://medium.com/openethereum/vision-for-openethereum-ex-parity-client-eb7b11f6eef8](https://medium.com/openethereum/vision-for-openethereum-ex-parity-client-eb7b11f6eef8)\n\nThank you!",https://www.reddit.com/r/ethereum/comments/izksy1/release_candidate_31rc_openethereum_exparity/,1,0
izlemw,1601047307,Ethereum's Significant and Undeniable Achievement,,https://www.reddit.com/r/ethereum/comments/izlemw/ethereums_significant_and_undeniable_achievement/,1,12
izlhaw,1601047533,Non Fungible Tokens for securing digital products?,[removed],https://www.reddit.com/r/ethereum/comments/izlhaw/non_fungible_tokens_for_securing_digital_products/,1,0
izlmqu,1601048014,How to Choose a Mining Pool?,"So you’re still not mining and don't know where to start? Or you’re already mining but want more? Choose the best mining pool! We’ll tell you what to look for.\n\n**Reward System**\n\nIt’s better to look at how lucky the pool is (if we are talking about PPLNS) or at the logic of the reward calculation (if it is PPS+, as that’s exactly how this “+” is calculated).\n\n**Hashrate, Uncles, Rejects**\n\nAll these values ​​matter if you mine on PPLNS or PPS+, where the reward is calculated based on the block found by the pool. Each pool has its own statistics and its own reward calculation system. At CoinFly Pool, we calculate the reward according to the average daily value, thereby removing the risks associated with the pool's success from the users.\n\n&amp;#x200B;\n\nhttps://preview.redd.it/9mf5zyz7cbp51.png?width=999&amp;format=png&amp;auto=webp&amp;s=dfc8a46034f8be251831e50fd86a7b2eb53e56c8\n\n**Where the Servers Are Located**\n\nIn theory, the same equipment, launched at the same time on different pools, will mine a different amount, also because the server was closer to one of the pools. Therefore, it is ideal if the servers are located on the same continent as you.\n\n**Commission Fees**\n\nIt doesn’t seem bad if this value is 0. But it also happens that the pool makes such a good profit that there is enough for the 3% commission and for decent payouts to its miners.\n\n**Coins**\n\nIf it's not ETH or Ethereum Classic, then you can choose something specific. But you need to properly calculate whether you have enough power to mine that sh\*\*coin and also be quick to sell it at a good price. As one never knows what will happen to its rate tomorrow.\n\n**Dual mining**\n\nIt seems like an awesome idea: mine a few coins, collect them in both pockets. But then let’s take the Ezil.me pool for example. It offers dual mining with a 10% profit. We’ve been watching it for a while and here’s the thing: even the +10% calculations on its calculator were less than ours on the [CoinFly pool](https://ethpool.coinfly.cc/?utm_source=medium&amp;utm_medium=article&amp;utm_content=medium).\n\nAuto-switching\n\nThe pool automatically switches your mining to a coin which is more profitable to mine at the moment. However, this is typically carried out without taking into account the specifics of the equipment, which is not good. Again, the profit of the Whalesburg pool, which offers auto-switching, is lower in comparison to CoinFly.\n\n**The place of the pool on Miningpoolstats**\n\nSometimes you can earn more on a small pool than on such giants as Ethermine. One of the crypto bloggers made a comparison on YouTube, where for example, Ethermine distributed 5% less than a small pool.\n\nAnd the bottom line: you have to try and compare. The pool that has transferred more coins to your wallet is surely the good one. And it doesn't matter what hashrate it has or with what type of magic their admin is practicing.",https://www.reddit.com/r/ethereum/comments/izlmqu/how_to_choose_a_mining_pool/,1,2
