id,created_utc,title,selftext,full_link,score,comments
jifx7e,1603723871,Essentially my problem with PoS,,https://www.reddit.com/r/ethereum/comments/jifx7e/essentially_my_problem_with_pos/,1,0
jig0ta,1603724201,Aavegotchi Farmer Explains GHST Staking,,https://www.reddit.com/r/ethereum/comments/jig0ta/aavegotchi_farmer_explains_ghst_staking/,1,17
jig7lj,1603724827,CEL withdrawal help?,[removed],https://www.reddit.com/r/ethereum/comments/jig7lj/cel_withdrawal_help/,1,0
jig98y,1603724978,"Pi4 4GB is overloaded running eth1, beacon and eth2 medalla stake.",,https://www.reddit.com/r/ethereum/comments/jig98y/pi4_4gb_is_overloaded_running_eth1_beacon_and/,1,8
jig9nm,1603725011,Ethereum 2.0 Is Almost Ready For Launch,,https://www.reddit.com/r/ethereum/comments/jig9nm/ethereum_20_is_almost_ready_for_launch/,1,0
jigd55,1603725333,A diamond provides a systematic way to isolate different smart contract functionality and connect them together and share data between them as needed in a gas-efficient way.,,https://www.reddit.com/r/ethereum/comments/jigd55/a_diamond_provides_a_systematic_way_to_isolate/,1,4
jiggem,1603725646,NFT Shower thought,[removed],https://www.reddit.com/r/ethereum/comments/jiggem/nft_shower_thought/,1,0
jigpls,1603726506,Ethereum vs Polkadot: A Comparison,,https://www.reddit.com/r/ethereum/comments/jigpls/ethereum_vs_polkadot_a_comparison/,1,0
jih43k,1603727814,Ask the Solidity Team Anything! #1 (AMA in r/ethdev!),,https://www.reddit.com/r/ethereum/comments/jih43k/ask_the_solidity_team_anything_1_ama_in_rethdev/,1,1
jih85u,1603728179,@psycheusd,[removed],https://www.reddit.com/r/ethereum/comments/jih85u/psycheusd/,1,0
jihgz8,1603728964,University student final year project,[removed],https://www.reddit.com/r/ethereum/comments/jihgz8/university_student_final_year_project/,1,0
jihuhn,1603730143,Introducing the new ethereum.org developer portal,,https://www.reddit.com/r/ethereum/comments/jihuhn/introducing_the_new_ethereumorg_developer_portal/,1,4
jihyu9,1603730532,Ethereum hit a $46b valuation with 1 value accrual mechanism. Wait until there are three,,https://www.reddit.com/r/ethereum/comments/jihyu9/ethereum_hit_a_46b_valuation_with_1_value_accrual/,1,0
jii12x,1603730712,University student final year project,[removed],https://www.reddit.com/r/ethereum/comments/jii12x/university_student_final_year_project/,1,0
jii1jm,1603730751,Ethereum On Pace to Settle Over $1 Trillion in Transactions in 2020,,https://www.reddit.com/r/ethereum/comments/jii1jm/ethereum_on_pace_to_settle_over_1_trillion_in/,1,0
jii9za,1603731458,Harvest.finance arbitrage exploit,,https://www.reddit.com/r/ethereum/comments/jii9za/harvestfinance_arbitrage_exploit/,1,0
jiirtu,1603732938,LLL Documentation/Resources,[removed],https://www.reddit.com/r/ethereum/comments/jiirtu/lll_documentationresources/,1,1
jijlci,1603735365,"Ethereum 2.0 “Nearly Ready” for Launch, Says Auditor",,https://www.reddit.com/r/ethereum/comments/jijlci/ethereum_20_nearly_ready_for_launch_says_auditor/,1,0
jike13,1603737750,Ethereum has provided a blueprint for developing a DeFi ecosystem.,,https://www.reddit.com/r/ethereum/comments/jike13/ethereum_has_provided_a_blueprint_for_developing/,1,0
jikirn,1603738145,The DeFi Blockspace Cycle | Nic Carter,,https://www.reddit.com/r/ethereum/comments/jikirn/the_defi_blockspace_cycle_nic_carter/,1,0
jikjom,1603738222,Harvest finance arbitrage attack,,https://www.reddit.com/r/ethereum/comments/jikjom/harvest_finance_arbitrage_attack/,1,0
jikzju,1603739532,Submit your questions for an AMA about the recently announced Elastos/Filecoin alliance FilDA.,,https://www.reddit.com/r/ethereum/comments/jikzju/submit_your_questions_for_an_ama_about_the/,1,1
jil0xe,1603739645,Introducing Vocdoni Bridge: a universally verifiable and hybrid (offchain/onchain) voting protocol for token-based governance,[removed],https://www.reddit.com/r/ethereum/comments/jil0xe/introducing_vocdoni_bridge_a_universally/,1,0
jil4jn,1603739980,⟠ Latest Week in ETH News is out,,https://www.reddit.com/r/ethereum/comments/jil4jn/latest_week_in_eth_news_is_out/,1,5
jimol5,1603744586,Mamba: The Hardest Capture the Flag for Web 3.0 (Cicada 3301 for Web 3.0),,https://www.reddit.com/r/ethereum/comments/jimol5/mamba_the_hardest_capture_the_flag_for_web_30/,1,0
jimyd1,1603745397,Psyche The Future of DEFI,[removed],https://www.reddit.com/r/ethereum/comments/jimyd1/psyche_the_future_of_defi/,1,0
jindc8,1603746617,Creating multiple addresses on a smart contract.,[removed],https://www.reddit.com/r/ethereum/comments/jindc8/creating_multiple_addresses_on_a_smart_contract/,1,0
jinosu,1603747572,"""What a Horrible Mining Pool!"" Coinfly telling the stories of relations with its customers.",,https://www.reddit.com/r/ethereum/comments/jinosu/what_a_horrible_mining_pool_coinfly_telling_the/,1,1
jinq2m,1603747679,Smart Contract Question,[removed],https://www.reddit.com/r/ethereum/comments/jinq2m/smart_contract_question/,1,0
jio2oe,1603748728,Where are the first-party oracles?,,https://www.reddit.com/r/ethereum/comments/jio2oe/where_are_the_firstparty_oracles/,1,0
jio51v,1603748939,"Blockchain VIPs - Career Planning, Training &amp; Certification",,https://www.reddit.com/r/ethereum/comments/jio51v/blockchain_vips_career_planning_training/,1,0
jio8dg,1603749233,Are we trustless yet? - Market Monday,,https://www.reddit.com/r/ethereum/comments/jio8dg/are_we_trustless_yet_market_monday/,1,0
jiphrg,1603753399,Don't expect another 2017-style altseason as Ethereum continues slump vs. Bitcoin,,https://www.reddit.com/r/ethereum/comments/jiphrg/dont_expect_another_2017style_altseason_as/,1,0
jipqjr,1603754228,"Ethereum EIP 1559 - The Key to $10,000+ ETH?",,https://www.reddit.com/r/ethereum/comments/jipqjr/ethereum_eip_1559_the_key_to_10000_eth/,1,0
jipu3w,1603754578,Where can I get a paper wallet for ethereum?,[removed],https://www.reddit.com/r/ethereum/comments/jipu3w/where_can_i_get_a_paper_wallet_for_ethereum/,1,0
jiq1h8,1603755277,Where can I get an ethereum paper wallet?,[removed],https://www.reddit.com/r/ethereum/comments/jiq1h8/where_can_i_get_an_ethereum_paper_wallet/,1,3
jiqy2v,1603758476,Prysm Beta Released! -- Prysmatic Labs,,https://www.reddit.com/r/ethereum/comments/jiqy2v/prysm_beta_released_prysmatic_labs/,1,1
jisypd,1603765965,Dev Update 2 - How the progress of building a next gen NFT marketplace happens,,https://www.reddit.com/r/ethereum/comments/jisypd/dev_update_2_how_the_progress_of_building_a_next/,1,0
jit9ju,1603767140,Dev Update 2 - The building of next gen NFT ecosystems,,https://www.reddit.com/r/ethereum/comments/jit9ju/dev_update_2_the_building_of_next_gen_nft/,1,1
jitxt9,1603769874,ETH gas fee - transfer from Metamask to IDEX,[removed],https://www.reddit.com/r/ethereum/comments/jitxt9/eth_gas_fee_transfer_from_metamask_to_idex/,1,0
jitye4,1603769941,Harvest Flashloan Economic Attack Post-Mortem,,https://www.reddit.com/r/ethereum/comments/jitye4/harvest_flashloan_economic_attack_postmortem/,1,8
jiujmu,1603772536,"Widespread understanding of L2 scaling tradeoffs is critical, here's an ELI5.",[removed],https://www.reddit.com/r/ethereum/comments/jiujmu/widespread_understanding_of_l2_scaling_tradeoffs/,1,8
jivipn,1603777193,"Ethereum 2.0 and Vitalik Buterin are about to take the market by storm! Couldn’t be more excited for the end of 2020! $ETH, all eyes on you.",,https://www.reddit.com/r/ethereum/comments/jivipn/ethereum_20_and_vitalik_buterin_are_about_to_take/,1,0
jivn2r,1603777829,Psyche.Cash | The Future of DeFi,[removed],https://www.reddit.com/r/ethereum/comments/jivn2r/psychecash_the_future_of_defi/,1,0
jiw07q,1603779800,Free BTC as I requested,,https://www.reddit.com/r/ethereum/comments/jiw07q/free_btc_as_i_requested/,1,0
jiwh1c,1603782374,The Role of the TRON Blockchain in Powering the Success of the JSB Foundation,,https://www.reddit.com/r/ethereum/comments/jiwh1c/the_role_of_the_tron_blockchain_in_powering_the/,1,0
jix4gt,1603786099,A VC values Maker DAO's MKR token and expected return,,https://www.reddit.com/r/ethereum/comments/jix4gt/a_vc_values_maker_daos_mkr_token_and_expected/,1,0
jixfwz,1603787955,Ways when I lose Eth for gas.,[removed],https://www.reddit.com/r/ethereum/comments/jixfwz/ways_when_i_lose_eth_for_gas/,1,0
jixg1g,1603787970,Ocean V3 Brings Wave of Data Monetization Tools to Ethereum,,https://www.reddit.com/r/ethereum/comments/jixg1g/ocean_v3_brings_wave_of_data_monetization_tools/,1,2
jiybdu,1603792893,What do you think about this project and decentraland? The Sandbox Game Review | Good Investment or SCAM?,,https://www.reddit.com/r/ethereum/comments/jiybdu/what_do_you_think_about_this_project_and/,1,0
