id,created_utc,title,selftext,full_link,score,comments
jm3meq,1604242899,"DTMF.io - Use Ethereum to buy phone numbers, send and receive SMS, and make and receive calls",,https://www.reddit.com/r/ethereum/comments/jm3meq/dtmfio_use_ethereum_to_buy_phone_numbers_send_and/,1,3
jm4b2f,1604245404,Comparing Eth2 Clients on the Medalla Network,[removed],https://www.reddit.com/r/ethereum/comments/jm4b2f/comparing_eth2_clients_on_the_medalla_network/,1,1
jm58vx,1604248702,Privacy Tips on Storing and Transacting Ether (ETH) in 2020,,https://www.reddit.com/r/ethereum/comments/jm58vx/privacy_tips_on_storing_and_transacting_ether_eth/,1,0
jm59bw,1604248749,Poker smart contracts Without Rake legal,[removed],https://www.reddit.com/r/ethereum/comments/jm59bw/poker_smart_contracts_without_rake_legal/,1,4
jm70ce,1604254635,"ETH2, shards and data - where will it be stored?","Once phase 2 happens, we will have 64 shards, each with its own execution environment.  And each shard will have its own state and history.  My question is where will this data be stored and is it expected that the validators will store this data as part of their normal operations being incentivized through staking?",https://www.reddit.com/r/ethereum/comments/jm70ce/eth2_shards_and_data_where_will_it_be_stored/,1,5
jm8pjt,1604260262,"Buffett once said crypto is trash, do you think he's wrong?",,https://www.reddit.com/r/ethereum/comments/jm8pjt/buffett_once_said_crypto_is_trash_do_you_think/,1,12
jm9bkj,1604262272,How to deploy Ethereum Smart Contract via remix IDE to the live network.,[removed],https://www.reddit.com/r/ethereum/comments/jm9bkj/how_to_deploy_ethereum_smart_contract_via_remix/,1,0
jm9rsw,1604263798,Read contract state at specific block?,[removed],https://www.reddit.com/r/ethereum/comments/jm9rsw/read_contract_state_at_specific_block/,1,2
jma7vu,1604265303,"Is there a chance Ethereum's Wrapped Bitcoin (WBTC) could one day enter the Top 3 MC, overtaking XRP and Tether?",[removed],https://www.reddit.com/r/ethereum/comments/jma7vu/is_there_a_chance_ethereums_wrapped_bitcoin_wbtc/,1,6
jmbn7u,1604270204,New Defi Token BiDao. What do you guys think?,[removed]\n\n[View Poll](https://www.reddit.com/poll/jmbn7u),https://www.reddit.com/r/ethereum/comments/jmbn7u/new_defi_token_bidao_what_do_you_guys_think/,1,0
jmc7o9,1604272231,New Ethereum based MMORPG uses erc20 mineable as in game currency,,https://www.reddit.com/r/ethereum/comments/jmc7o9/new_ethereum_based_mmorpg_uses_erc20_mineable_as/,1,56
jmcfq4,1604273053,Who to contact about Mist browser?,[removed],https://www.reddit.com/r/ethereum/comments/jmcfq4/who_to_contact_about_mist_browser/,1,2
jmdg6w,1604276834,Use Ethereum to buy coffee beans from plenty of local roasters. Use Coinbase at checkout.,,https://www.reddit.com/r/ethereum/comments/jmdg6w/use_ethereum_to_buy_coffee_beans_from_plenty_of/,1,0
jmdobl,1604277717,Brownie vs Truffle vs Hardhat,[removed],https://www.reddit.com/r/ethereum/comments/jmdobl/brownie_vs_truffle_vs_hardhat/,1,1
jmesod,1604282052,best ethereum gambling site? Or bitcoin?,[removed],https://www.reddit.com/r/ethereum/comments/jmesod/best_ethereum_gambling_site_or_bitcoin/,1,0
jmetam,1604282121,Ethereum's ConsenSys adds another CBDC project partnership w/ National Australia Bank,,https://www.reddit.com/r/ethereum/comments/jmetam/ethereums_consensys_adds_another_cbdc_project/,1,11
jmfbn5,1604284184,"Harvest Finance 25M Hack Explained, Step By Step",,https://www.reddit.com/r/ethereum/comments/jmfbn5/harvest_finance_25m_hack_explained_step_by_step/,1,2
jmg5j5,1604287514,"PSA: Ledger owners beware, the leaked buyer information from Ledger's DB has been utilised in a mass phishing attack.",[removed],https://www.reddit.com/r/ethereum/comments/jmg5j5/psa_ledger_owners_beware_the_leaked_buyer/,1,0
jmgy05,1604290885,MNE,,https://www.reddit.com/r/ethereum/comments/jmgy05/mne/,1,0
jmhr08,1604294541,Mine and play,[removed],https://www.reddit.com/r/ethereum/comments/jmhr08/mine_and_play/,1,0
jmiz2q,1604300704,I made this website for the crypto family and i would really love if i can get some opinions on it http://cryptofamily.tk/,[removed],https://www.reddit.com/r/ethereum/comments/jmiz2q/i_made_this_website_for_the_crypto_family_and_i/,1,0
jmj3ff,1604301395,Addressing Josselin Feist's Concern's of EIP-2535 Diamond Standard,,https://www.reddit.com/r/ethereum/comments/jmj3ff/addressing_josselin_feists_concerns_of_eip2535/,1,0
jmjd8b,1604302925,Question about risk supplying a stablecoin on Compound.Finance,[removed],https://www.reddit.com/r/ethereum/comments/jmjd8b/question_about_risk_supplying_a_stablecoin_on/,1,0
jmjfay,1604303247,Crypto Trends 2 November 2020 🆕 OpenZeppelin Defender 🏦 Central Bank Digital Currencies 🐋 Maker governance and flash loans + 🎙️ Evan Van Ness and Taylor Monahan talking DeFi on Crypto News Podcast,,https://www.reddit.com/r/ethereum/comments/jmjfay/crypto_trends_2_november_2020_openzeppelin/,1,0
jmjub5,1604305558,Ethereum Blockchain Chosen for Issuing CBDC by Reserve Bank of Australia,,https://www.reddit.com/r/ethereum/comments/jmjub5/ethereum_blockchain_chosen_for_issuing_cbdc_by/,1,0
jmk2kp,1604306886,Research shows Bitcoin rally negatively impacted DeFi market,,https://www.reddit.com/r/ethereum/comments/jmk2kp/research_shows_bitcoin_rally_negatively_impacted/,1,0
jmkqyw,1604310878,"I think an ""eth"" killer is a fallacy be it ada, dot etc. if anything they will only complement eth even in 2.0 full phase. what do you think?",[removed],https://www.reddit.com/r/ethereum/comments/jmkqyw/i_think_an_eth_killer_is_a_fallacy_be_it_ada_dot/,1,0
jmkwxo,1604311805,How a DAO can be ran by NFTs completely - a new type of DAO,,https://www.reddit.com/r/ethereum/comments/jmkwxo/how_a_dao_can_be_ran_by_nfts_completely_a_new/,1,24
jmm209,1604317877,My ETH price problem.,[removed],https://www.reddit.com/r/ethereum/comments/jmm209/my_eth_price_problem/,1,0
jmm5kp,1604318380,Reserve Bank of Australia Plans to Launch Digital Currency on Ethereum,,https://www.reddit.com/r/ethereum/comments/jmm5kp/reserve_bank_of_australia_plans_to_launch_digital/,1,0
jmm8pp,1604318767,"Just started mining eth, how much will I make in a month with one GPU.",[removed],https://www.reddit.com/r/ethereum/comments/jmm8pp/just_started_mining_eth_how_much_will_i_make_in_a/,1,0
jmmu5g,1604321467,A Dive into Ethereum Transaction Details,,https://www.reddit.com/r/ethereum/comments/jmmu5g/a_dive_into_ethereum_transaction_details/,1,0
jmn038,1604322151,"Gitcoin is proud to announce another awesome hackathon sponsored by Conflux with over $12K in prizes. You will learn how to build the future of commerce which is more collaborative, equitable and decentralized. There will also be bounties from co-sponsors such as AAVE and Chainlink. Come join us!",,https://www.reddit.com/r/ethereum/comments/jmn038/gitcoin_is_proud_to_announce_another_awesome/,1,0
jmn9t9,1604323272,How to efficiently trade with Ethereum,,https://www.reddit.com/r/ethereum/comments/jmn9t9/how_to_efficiently_trade_with_ethereum/,1,0
jmoamw,1604327099,Living on crypto in Nigeria: An interview with Jerry Okai,,https://www.reddit.com/r/ethereum/comments/jmoamw/living_on_crypto_in_nigeria_an_interview_with/,1,0
jmoe4k,1604327421,"Interview with Andre Cronje — DeFi Architect, and Creator of Yearn Finance",,https://www.reddit.com/r/ethereum/comments/jmoe4k/interview_with_andre_cronje_defi_architect_and/,1,1
jmog3m,1604327606,Which are the best websites to learn about ethereum 2.0 and things like Defi?,[removed],https://www.reddit.com/r/ethereum/comments/jmog3m/which_are_the_best_websites_to_learn_about/,1,1
jmp0p9,1604329463,ETH missing in Trezor/coinbase transaction - Beware of this scam,[removed],https://www.reddit.com/r/ethereum/comments/jmp0p9/eth_missing_in_trezorcoinbase_transaction_beware/,1,0
jmpfx8,1604330807,When CRO holders find out about Plutus,,https://www.reddit.com/r/ethereum/comments/jmpfx8/when_cro_holders_find_out_about_plutus/,1,1
jmq89x,1604333155,Where can I find info on the status of ETH2 phases?,[removed],https://www.reddit.com/r/ethereum/comments/jmq89x/where_can_i_find_info_on_the_status_of_eth2_phases/,1,3
jmqk45,1604334138,⟠ Latest Week in Ethereum News,,https://www.reddit.com/r/ethereum/comments/jmqk45/latest_week_in_ethereum_news/,1,3
jmqn1x,1604334385,"What is The Graph, what is the role of Curators and why do we need them?",,https://www.reddit.com/r/ethereum/comments/jmqn1x/what_is_the_graph_what_is_the_role_of_curators/,1,0
jmr0tl,1604335525,Crypto Mining Enthusiast? This is your chance to buy Crypto Mining Equipment at the best price over the internet! 35% REDUCED PRICES!,,https://www.reddit.com/r/ethereum/comments/jmr0tl/crypto_mining_enthusiast_this_is_your_chance_to/,1,0
jmr2mf,1604335680,How much internet does mining use,[removed],https://www.reddit.com/r/ethereum/comments/jmr2mf/how_much_internet_does_mining_use/,1,9
jmr4hi,1604335829,🎙️How Crypto is Empowering with Grayscale's Director of Research Phil Bonello,,https://www.reddit.com/r/ethereum/comments/jmr4hi/how_crypto_is_empowering_with_grayscales_director/,1,0
jmrnl3,1604337378,EmiSwap AMM Exchange to Perfect The DeFi Market,,https://www.reddit.com/r/ethereum/comments/jmrnl3/emiswap_amm_exchange_to_perfect_the_defi_market/,1,8
jmrqcw,1604337613,VS Code extension to monitor the current gas price,[removed],https://www.reddit.com/r/ethereum/comments/jmrqcw/vs_code_extension_to_monitor_the_current_gas_price/,1,0
jms8p6,1604339113,Quickly create Ethereum Wallet and extract mnemonic seed words in a spreadsheet ?,[removed],https://www.reddit.com/r/ethereum/comments/jms8p6/quickly_create_ethereum_wallet_and_extract/,1,2
jmt92g,1604342008,Play games to earn Bitcoin/ETH/DOGE!,[removed],https://www.reddit.com/r/ethereum/comments/jmt92g/play_games_to_earn_bitcoinethdoge/,1,0
jmta3g,1604342091,The Ethereum Superhero Project,[removed],https://www.reddit.com/r/ethereum/comments/jmta3g/the_ethereum_superhero_project/,1,0
