id,created_utc,title,selftext,full_link,score,comments
js6ybc,1605096310,Ethereum launchpad site opens as blank page,,https://www.reddit.com/r/ethereum/comments/js6ybc/ethereum_launchpad_site_opens_as_blank_page/,1,1
js7d8l,1605098217,Technical details on today’s Ethereum chain split that caused many services to stop working,,https://www.reddit.com/r/ethereum/comments/js7d8l/technical_details_on_todays_ethereum_chain_split/,1,5
js7nbu,1605099436,"Binance donates $100,000 to support Ethereum projects",,https://www.reddit.com/r/ethereum/comments/js7nbu/binance_donates_100000_to_support_ethereum/,1,0
js7rb3,1605099864,Ethereum: split on Vitalik Buterin's blockchain - The Cryptonomist,,https://www.reddit.com/r/ethereum/comments/js7rb3/ethereum_split_on_vitalik_buterins_blockchain_the/,1,0
js80xr,1605100953,Vitalik Buterin Says Staking Rewards and Penalties Policy of Ethereum 2.0 Have Been Reconsidered,,https://www.reddit.com/r/ethereum/comments/js80xr/vitalik_buterin_says_staking_rewards_and/,1,0
js89iy,1605101911,The Greatest Opportunity Of Our Lifetimes - Mike Novogratz of Galaxy Digital,,https://www.reddit.com/r/ethereum/comments/js89iy/the_greatest_opportunity_of_our_lifetimes_mike/,1,1
js8acz,1605102002,"Ethereum Service Providers Report Issues, Blockchain Allegedly Faced Chain Split",,https://www.reddit.com/r/ethereum/comments/js8acz/ethereum_service_providers_report_issues/,1,0
js8fx4,1605102594,[Question] Is there anywhere i can stake by using a safe third party? Coinbase etc.,"The title says it all. I have enough ETH to run a validator, but im not tech savy at all, and do not want to risk losing it due to inability. Hence i would like to stake through a serious firm, and help ETH do the Phase 0 asap. Am i too early? Or does a good option exsist.\n\nI know coinbase do not have such an option yet sadly.",https://www.reddit.com/r/ethereum/comments/js8fx4/question_is_there_anywhere_i_can_stake_by_using_a/,1,18
js8g5x,1605102620,We need more stakers!,,https://www.reddit.com/r/ethereum/comments/js8g5x/we_need_more_stakers/,1,1
js8p69,1605103561,What's the point of connecting hardware wallet to MEW - Ethereum Wallet,Scrolling through MEW website saw option to connect hardware wallets to the MEW wallet. Can someone explain me what's the point of doing that and does it gives any adventages? I'm in possession of ledgar nano s wallet.,https://www.reddit.com/r/ethereum/comments/js8p69/whats_the_point_of_connecting_hardware_wallet_to/,1,9
js8yll,1605104520,"Setting NFT trends in 2021 with Aavegochi, Matic, Opensea, Terra Virtua, Zed Run 🎉",,https://www.reddit.com/r/ethereum/comments/js8yll/setting_nft_trends_in_2021_with_aavegochi_matic/,1,0
js95hf,1605105210,CoinDCX prepares to introduce User-Friendly Staking on ETH 2.0,,https://www.reddit.com/r/ethereum/comments/js95hf/coindcx_prepares_to_introduce_userfriendly/,1,0
js994s,1605105568,"After today's Infura outage, I created ethereumnodes.com to track all public Ethereum RPC endpoints",,https://www.reddit.com/r/ethereum/comments/js994s/after_todays_infura_outage_i_created/,1,33
js9pj2,1605107159,How Ethereum is moving from PoW to PoS,,https://www.reddit.com/r/ethereum/comments/js9pj2/how_ethereum_is_moving_from_pow_to_pos/,1,0
jsa44b,1605108531,TrustToken Introduces Proof of Reserve for TUSD Stablecoin in Collaboration With Chainlink and…,,https://www.reddit.com/r/ethereum/comments/jsa44b/trusttoken_introduces_proof_of_reserve_for_tusd/,1,0
jsa5se,1605108678,Compilation of useful Crypto Trading / Economic news Telegram channels. Maybe that will help you,[removed],https://www.reddit.com/r/ethereum/comments/jsa5se/compilation_of_useful_crypto_trading_economic/,1,0
jsa94a,1605108978,looking for advice on staking,[removed],https://www.reddit.com/r/ethereum/comments/jsa94a/looking_for_advice_on_staking/,1,0
jsav7u,1605110944,DARMA Capital will allocate $50M in ETH to ETH2 staking,,https://www.reddit.com/r/ethereum/comments/jsav7u/darma_capital_will_allocate_50m_in_eth_to_eth2/,1,0
jsb12t,1605111446,The $50M Question: How to Stake Ethereum 2.0 and Stay Liquid,,https://www.reddit.com/r/ethereum/comments/jsb12t/the_50m_question_how_to_stake_ethereum_20_and/,1,0
jsbg7r,1605112779,Ethereum 2.0 Launch Timeline According To Vitalik Buterin Interview (Co-Creator of Ethereum),,https://www.reddit.com/r/ethereum/comments/jsbg7r/ethereum_20_launch_timeline_according_to_vitalik/,1,0
jsc30z,1605114678,Living on crypto in Vietnam: An interview with Quynh Nguyen,,https://www.reddit.com/r/ethereum/comments/jsc30z/living_on_crypto_in_vietnam_an_interview_with/,1,0
jsc4zr,1605114850,I want some advice/ideas about staking,[removed],https://www.reddit.com/r/ethereum/comments/jsc4zr/i_want_some_adviceideas_about_staking/,1,0
jsc6mu,1605114984,Running fault-tolerant Ethereum API,"In light today's fork, I want to mention the Dshackle project. It's an open source *load balancer* for building *fault-tolerant access* to nodes. It provides unified access to multiple nodes, i.e., you can run your own nodes and also Infura behind it, but if some of the nodes go off-sync, it *dispatches the calls to the active ones* (i.e., with most mining difficulty).\n\nThe code is at [https://github.com/emeraldpay/dshackle](https://github.com/emeraldpay/dshackle)",https://www.reddit.com/r/ethereum/comments/jsc6mu/running_faulttolerant_ethereum_api/,1,0
jsc8wh,1605115178,"Just made a video about ETH 2.0, you are welcome to have a look and give me your thoughts ;)",[removed],https://www.reddit.com/r/ethereum/comments/jsc8wh/just_made_a_video_about_eth_20_you_are_welcome_to/,1,0
jscei8,1605115639,Vitalik Buterin Denies the Fork of Ethereum Network; Stresses the Cause of Infura Service Outage,,https://www.reddit.com/r/ethereum/comments/jscei8/vitalik_buterin_denies_the_fork_of_ethereum/,1,0
jscwuk,1605117161,"This year's Streamr Network analysis revealed that it is on par with the top centralized services when it comes to latency – a stumbling block for many P2P networks – while its scalability is superior, thanks to decentralization. Read the whitepaper!",,https://www.reddit.com/r/ethereum/comments/jscwuk/this_years_streamr_network_analysis_revealed_that/,1,1
jsduua,1605120006,I'm extremely hesitant to stake my Ethereum,"Can someone convince me this is a good idea? I know that there will be staking rewards, and that rewards will be better the earlier that you stake. However, I can't justify staking ETH toward the beginning of a bull run that will likely be very profitable to sell and then buy back after the correction. Is there a way to do a flexable stake, or participate in an ETH stakepool that I could withdraw from if I needed to sell SOONER than 2 years from now?",https://www.reddit.com/r/ethereum/comments/jsduua/im_extremely_hesitant_to_stake_my_ethereum/,1,176
jsdv0i,1605120020,Create an ERC20 Token in less than a minute,[removed],https://www.reddit.com/r/ethereum/comments/jsdv0i/create_an_erc20_token_in_less_than_a_minute/,1,0
jsep8g,1605122530,9 Best Crypto Wallets (Software and Hardware) in 2020,,https://www.reddit.com/r/ethereum/comments/jsep8g/9_best_crypto_wallets_software_and_hardware_in/,1,0
jsertm,1605122744,Archive Nodes vs Full Nodes,[removed],https://www.reddit.com/r/ethereum/comments/jsertm/archive_nodes_vs_full_nodes/,1,11
jsezjb,1605123386,Infura/Downtime and How Alchemy Remained Up,,https://www.reddit.com/r/ethereum/comments/jsezjb/infuradowntime_and_how_alchemy_remained_up/,1,1
jsfs5f,1605125672,Blockchain Futurist Conference,The 3rd Annual Blockchain Futurist Conference on now.\n\nFuturist Conference YouTube live:\nOn now - - &gt; https://youtu.be/dgc4iwT4KEg\n\nhttps://virtual.futuristconference.com/virtualfuturist/,https://www.reddit.com/r/ethereum/comments/jsfs5f/blockchain_futurist_conference/,1,1
jsftxi,1605125813,LiquidStake set to unlock liquidity for Ethereum 2.0 Phase 0 stakers,,https://www.reddit.com/r/ethereum/comments/jsftxi/liquidstake_set_to_unlock_liquidity_for_ethereum/,1,1
jsg5g9,1605126759,Complete Ethereum &amp; Solidity Developer Masterclass,[removed],https://www.reddit.com/r/ethereum/comments/jsg5g9/complete_ethereum_solidity_developer_masterclass/,1,0
jsh3ud,1605130891,"Today I realised that I could make an ETH 2.0 Deposit Contract minimum genesis status tracker by making a few small adjustments to a tool that I built for myself to track my portfolio, here it is in case anyone finds it useful.",,https://www.reddit.com/r/ethereum/comments/jsh3ud/today_i_realised_that_i_could_make_an_eth_20/,1,13
jsh7v0,1605131217,Update to Freewallet scam. Everyone PLEASE READ!,,https://www.reddit.com/r/ethereum/comments/jsh7v0/update_to_freewallet_scam_everyone_please_read/,1,0
jsiegc,1605134853,Idea for early Ethereum Stakers to receive special collectibles? Vitalik signed ERC-721s? Similar to this:,,https://www.reddit.com/r/ethereum/comments/jsiegc/idea_for_early_ethereum_stakers_to_receive/,1,0
jsigbh,1605135018,The Best DeFi Indices for Your Crypto Portfolio,,https://www.reddit.com/r/ethereum/comments/jsigbh/the_best_defi_indices_for_your_crypto_portfolio/,1,0
jsijtd,1605135319,Idea for early Ethereum Stakers to receive special collectibles? Vitalik signed ERC-721s?,[removed],https://www.reddit.com/r/ethereum/comments/jsijtd/idea_for_early_ethereum_stakers_to_receive/,1,0
jsinyp,1605135672,It may be worth considering a decentralized infrastructure for DeFi,"For anyone interested in monetizing an Ethereum Node, they should look at [Pocket](https://www.pokt.network/). Apps and services using Pocket as their infrastructure didn't have any down time like the rest of the ecosystem. Pocket is a decentralized infrastructure that as simple as Infura, but has perks like resiliency and client-side verification. When nodes all over Ethereum were forking, the apps on Pocket can verify the correct chain.  \n\n\nMore ETH nodes are needed with the influx of apps interested in a decentralized solution. If you run Ethereum nodes, and want to add a source of revenue, [join Pocket](https://pokt.me/).",https://www.reddit.com/r/ethereum/comments/jsinyp/it_may_be_worth_considering_a_decentralized/,1,1
jsiwih,1605136416,https://election-madness.herokuapp.com,[removed],https://www.reddit.com/r/ethereum/comments/jsiwih/httpselectionmadnessherokuappcom/,1,0
jsix5a,1605136475,Are Ethereum 2.0 staking rewards paid in ETH or USD/fiat?,[removed],https://www.reddit.com/r/ethereum/comments/jsix5a/are_ethereum_20_staking_rewards_paid_in_eth_or/,1,3
jsj7j2,1605137419,Can my laptop run staking?,I got a laptop with 8 gb ram and ssd. I'm wondering will staking be computer intensive and internet intensive?,https://www.reddit.com/r/ethereum/comments/jsj7j2/can_my_laptop_run_staking/,1,11
jsjmci,1605138800,Ethereum 2.0 meme,,https://www.reddit.com/r/ethereum/comments/jsjmci/ethereum_20_meme/,1,0
jsk08p,1605140064,This Ethereum Whale Owns the ‘Most Expensive NFT of 2019,,https://www.reddit.com/r/ethereum/comments/jsk08p/this_ethereum_whale_owns_the_most_expensive_nft/,1,0
jsm5tt,1605147624,How long does eth take to send to another wallet,[removed],https://www.reddit.com/r/ethereum/comments/jsm5tt/how_long_does_eth_take_to_send_to_another_wallet/,1,0
jsoh7n,1605156639,Wrapped Filecoin pool goes live on Uniswap,,https://www.reddit.com/r/ethereum/comments/jsoh7n/wrapped_filecoin_pool_goes_live_on_uniswap/,1,0
jsotlv,1605158123,How does staking validate without using a lot of processing power?,where can i read about this? thank you,https://www.reddit.com/r/ethereum/comments/jsotlv/how_does_staking_validate_without_using_a_lot_of/,1,3
jspg4e,1605160958,Best prediction markets?,[removed],https://www.reddit.com/r/ethereum/comments/jspg4e/best_prediction_markets/,1,4
jspo3d,1605161992,32 Etherium and a few good investors,[removed],https://www.reddit.com/r/ethereum/comments/jspo3d/32_etherium_and_a_few_good_investors/,1,0
