id,created_utc,title,selftext,full_link,score,comments
jwjrws,1605719636,How to stake 32 ETH? — The best practices (ETH2 staking),,https://www.reddit.com/r/ethereum/comments/jwjrws/how_to_stake_32_eth_the_best_practices_eth2/,1,0
jwjxfh,1605720100,Bitcoin Suisse expects to offer Ethereum staking before Christmas,,https://www.reddit.com/r/ethereum/comments/jwjxfh/bitcoin_suisse_expects_to_offer_ethereum_staking/,1,1
jwk2nd,1605720542,PS5 for the crypto lovers,[deleted],https://www.reddit.com/r/ethereum/comments/jwk2nd/ps5_for_the_crypto_lovers/,5,30
jwk2zm,1605720570,CrystalDefi #Blockchain great growth and will have a bright future,[removed],https://www.reddit.com/r/ethereum/comments/jwk2zm/crystaldefi_blockchain_great_growth_and_will_have/,1,0
jwk6v5,1605720891,CRSTL will oversee the DAO-Stakeholders,[removed],https://www.reddit.com/r/ethereum/comments/jwk6v5/crstl_will_oversee_the_daostakeholders/,1,0
jwkdat,1605721439,Michael Bloomberg story and how he built a fortune off the financial information you use everyday,,https://www.reddit.com/r/ethereum/comments/jwkdat/michael_bloomberg_story_and_how_he_built_a/,1,0
jwldke,1605724408,Certified Solidity Developer (CSD),[removed],https://www.reddit.com/r/ethereum/comments/jwldke/certified_solidity_developer_csd/,1,0
jwm2l3,1605726483,Ethereum booster 3x ( 10 eth required to participate ),,https://www.reddit.com/r/ethereum/comments/jwm2l3/ethereum_booster_3x_10_eth_required_to_participate/,1,0
jwmmrk,1605728101,DYMMAX liquidity pools and how do they function,,https://www.reddit.com/r/ethereum/comments/jwmmrk/dymmax_liquidity_pools_and_how_do_they_function/,1,0
jwmst3,1605728602,You can now trade 1000+ tokens on Matcha!,,https://www.reddit.com/r/ethereum/comments/jwmst3/you_can_now_trade_1000_tokens_on_matcha/,6,0
jwmxnv,1605729010,Is ETH forking to create ETH2?,[removed],https://www.reddit.com/r/ethereum/comments/jwmxnv/is_eth_forking_to_create_eth2/,1,4
jwnf01,1605730468,Best IPO browser,[removed],https://www.reddit.com/r/ethereum/comments/jwnf01/best_ipo_browser/,1,0
jwnh9q,1605730661,"Looking for a guide to tokenize goods (real estate, cars, luxury items, etc...)",Is there a guide on how to do it please ? Thanks in advance !,https://www.reddit.com/r/ethereum/comments/jwnh9q/looking_for_a_guide_to_tokenize_goods_real_estate/,0,5
jwnk6h,1605730923,Which Graphic Cards show the best perfomance/price result in 2020/2021,,https://www.reddit.com/r/ethereum/comments/jwnk6h/which_graphic_cards_show_the_best_perfomanceprice/,17,4
jwnma4,1605731086,Easy setup of an ETH 2.0 staking node,"There are probably already some solutions to facilitate the setup of a staking node from scratch, so here is another one. Hopefully it helps to onboard more stakers during the testing phase.\n\nFor those who want to get a feeling for how it is to operate a staking node in a testnet right now, if you are a bit familiar with ansible, feel free to use and abuse this ansible role:\n\n* [ethereum_validator on ansible-galaxy](https://galaxy.ansible.com/maximilianmeister/ethereum_validator)\n* [source code on GitHub](https://github.com/MaximilianMeister/ethereum-validator)\n\nYou can see it as an installer that automates manual steps to provision a server.\n\nFor the default scenario it is enough to have docker and molecule installed to run your node locally in a containerized environment.\n\nThe role can of course also be used to target a remote node for provisioning.\n\nThanks to /u/SomerEsat for the [great guide](https://www.reddit.com/r/ethereum/comments/ju4rq4/psa_my_ethereum_20_staking_guides_medalla_testnet/) on how to set things up, and also thanks to all the others involved in making staking on the testnet such a good experience.",https://www.reddit.com/r/ethereum/comments/jwnma4/easy_setup_of_an_eth_20_staking_node/,2,1
jwnnrp,1605731219,"""The original vision of early Bitcoin adopters was that cryptocurrency would replace the legacy financial system. Instead, the cryptocurrency ecosystem is being absorbed into it.""",[deleted],https://www.reddit.com/r/ethereum/comments/jwnnrp/the_original_vision_of_early_bitcoin_adopters_was/,1,0
jwo57y,1605732655,ETH end of year prediction,[removed],https://www.reddit.com/r/ethereum/comments/jwo57y/eth_end_of_year_prediction/,1,2
jwo84v,1605732897,Reloaded Finance needs a front lead - join as cofounder - massive potential AMM,[removed],https://www.reddit.com/r/ethereum/comments/jwo84v/reloaded_finance_needs_a_front_lead_join_as/,1,0
jwoaq6,1605733127,Question about contract addresses,"**Question:** If ERC-20 tokens are sent to a different ERC-20 token contract address, are the managers of that contract address able to return the tokens?   \n**For example:** If I send REN to the OM contract address by accident when trying to exchange REN for OM, is the Mantra DAO team technically able to send the REN back to my address or is it stuck at the contract address forever? Asking for a friend who was told by the DAO team that they tried really hard to send it back, but it just wasn't possible.",https://www.reddit.com/r/ethereum/comments/jwoaq6/question_about_contract_addresses/,3,1
jwp14l,1605735396,Universal IDE to query blockchain data,"Hey Guys, we are building the Bitquery Editor to help developers to provide a universal IDE to query blockchain data easily.\n\nIDE is open source, and to support the project, we have created a Gitcoin grant, check it out and support us.\n\n[https://gitcoin.co/grants/1568/graphql-ide-for-blockchain-data-exploration](https://gitcoin.co/grants/1568/graphql-ide-for-blockchain-data-exploration)",https://www.reddit.com/r/ethereum/comments/jwp14l/universal_ide_to_query_blockchain_data/,1,0
jwp8ds,1605736059,Bonding Together,,https://www.reddit.com/r/ethereum/comments/jwp8ds/bonding_together/,1,0
jwpe6x,1605736564,Shedding light on the Ethereum Network Upgrade Process,The new Ethereum network upgrade process explained.\n\n[https://medium.com/ethereum-cat-herders/shedding-light-on-the-ethereum-network-upgrade-process-4c6186ed442c](https://medium.com/ethereum-cat-herders/shedding-light-on-the-ethereum-network-upgrade-process-4c6186ed442c),https://www.reddit.com/r/ethereum/comments/jwpe6x/shedding_light_on_the_ethereum_network_upgrade/,1,0
jwpgqq,1605736788,"Lil Yachty, Grammy Nominated Rapper, to Launch Ethereum Token",,https://www.reddit.com/r/ethereum/comments/jwpgqq/lil_yachty_grammy_nominated_rapper_to_launch/,1,8
jwpjbn,1605737008,New to crypto,[removed],https://www.reddit.com/r/ethereum/comments/jwpjbn/new_to_crypto/,1,0
jwpt37,1605737881,Updated Guide for Ubuntu/Prysm/Pyrmont,,https://www.reddit.com/r/ethereum/comments/jwpt37/updated_guide_for_ubuntuprysmpyrmont/,2,2
jwq2op,1605738738,"On Emiswap, Ethereum-based DeFi, users can use collectible NFT-cards used to multiplex personal revenue in Liquidity Pools",,https://www.reddit.com/r/ethereum/comments/jwq2op/on_emiswap_ethereumbased_defi_users_can_use/,16,4
jwq8fw,1605739258,Vitalik Buterin: Ethereum 2.0 Benefits Such As 100k TPS Will Come Faster Than People Expect,,https://www.reddit.com/r/ethereum/comments/jwq8fw/vitalik_buterin_ethereum_20_benefits_such_as_100k/,1,0
jwq9a9,1605739335,Polkadot DeFi Environment Moonbeam Releases Ethereum-Compatible Version,,https://www.reddit.com/r/ethereum/comments/jwq9a9/polkadot_defi_environment_moonbeam_releases/,1,0
jwspsw,1605747609,Etheruem 2.0: A few things to clarify,"1. This will facilitate faster transactions and result in cheaper fees for transactions? from 15 a second to what?\n\n2. Will all erc-20 tokens benefit from these faster speeds? If so what happens to projects like omisego that was supposed to make ethereum transactions faster and cheaper.\n\n3. DeFi has boomed under Ethereum. Will it expand or contract with Etheruem 2.0.\n\n4. Will ethereum 2.0 allow for stable coins to make payments instantly at checkout lines or will the delay still be awkward? Could it allow for companies to step up and create payment hardware to compete with Visa/Mastercard?\n\n5.  What happens to POW. Do they continue, but receive less rewards or are they expecting to migrate to other POW projects. Whats the consensus?\n\nThanks",https://www.reddit.com/r/ethereum/comments/jwspsw/etheruem_20_a_few_things_to_clarify/,2,12
jwssyx,1605747902,4 Reasons Ethereum Could Go To It's ALL TIME HIGH in 2021 | ETH 2.0,,https://www.reddit.com/r/ethereum/comments/jwssyx/4_reasons_ethereum_could_go_to_its_all_time_high/,1,0
jwti54,1605750451,Why does USDT often offer higher interest rates than other stable coins?,"For example, Aave offers 6.75% for USDT and 2.77% for USDC. What justifies this spread? Shouldn't they functionally be the same thing?\n\nYou could argue USDT is less secure so fewer people lend it, but then why would the borrowers want to borrow a more expensive, less secure currency?",https://www.reddit.com/r/ethereum/comments/jwti54/why_does_usdt_often_offer_higher_interest_rates/,2,14
jwu730,1605753010,Selling ALL My NIO Stock To BUY This Investment Instead 😱 (ETH),,https://www.reddit.com/r/ethereum/comments/jwu730/selling_all_my_nio_stock_to_buy_this_investment/,1,0
jwv1vp,1605756256,Best recommended token by BPOP of yesterday: LTC Recommended KOL：山寨币爆破手,,https://www.reddit.com/r/ethereum/comments/jwv1vp/best_recommended_token_by_bpop_of_yesterday_ltc/,1,0
jwv79i,1605756833,Happy fifth birthday ERC20 🎂🧁🍰🥮🥞,,https://www.reddit.com/r/ethereum/comments/jwv79i/happy_fifth_birthday_erc20/,7,20
jwvgue,1605757867,Concerned about Polkadot being an Ethereum killer,<not selftext available>,https://www.reddit.com/r/ethereum/comments/jwvgue/concerned_about_polkadot_being_an_ethereum_killer/,1,0
jwvui0,1605759343,"Private sale is on. You can buy with the $25 only. Get your tokens TODAY, before the price increases! https://psyche.cash/private-sale/",,https://www.reddit.com/r/ethereum/comments/jwvui0/private_sale_is_on_you_can_buy_with_the_25_only/,1,0
jwyrc3,1605772819,"Ethereum 2.0 Serenity Update - 104k ETH deposited, 5 days remaining to reach 524k ETH",,https://www.reddit.com/r/ethereum/comments/jwyrc3/ethereum_20_serenity_update_104k_eth_deposited_5/,1,6
jwzhxz,1605776813,Polkadot DeFi Environment Moonbeam Releases Ethereum-Compatible Version,,https://www.reddit.com/r/ethereum/comments/jwzhxz/polkadot_defi_environment_moonbeam_releases/,1,0
jwzixi,1605776967,ETH 2.0 : Vitalik Outlines 2 year Transformation plan for ETH 2.0,,https://www.reddit.com/r/ethereum/comments/jwzixi/eth_20_vitalik_outlines_2_year_transformation/,1,0
jwzwo2,1605779109,So you think you can stake,,https://www.reddit.com/r/ethereum/comments/jwzwo2/so_you_think_you_can_stake/,1,0
jx09hc,1605781051,Need an Ethereum Transaction Crawler app,"Hey guys, I have an assignment to do for my course, but I do not know how to do it. Does anyone know a good tutorial or lesson that would help me do this? Here is the assignment: \n\nCreate an application that will collect data from the Ethereum blockchain about transactions associated with a specific wallet address that the user inputs. The app should get information on the wallets (addresses) and amounts of ETH associated with transactions made to and from a certain given wallet and either store them in a database of choice or show them in a simple human-readable way (ideally, through a web page). Collect transaction data starting from a given block (do not crawl the entire blockchain).\n\n**Example**: If a user requests to view transactions associated with the address *0xaa7a9ca87d3694b5755f213b5d04094b8d0f0a6f* from block *9000000* to the current block it should be able to crawl and visualize all transaction data (addresses that sent to and received tokens from address *0xaa7a9ca87d3694b5755f213b5d04094b8d0f0a6f* , and how much ETH was used for a given transaction) in that period of time.  \n\n\nthank you!",https://www.reddit.com/r/ethereum/comments/jx09hc/need_an_ethereum_transaction_crawler_app/,3,4
jx0ra6,1605783690,new DeFi project ERC20 standard tokens,[removed],https://www.reddit.com/r/ethereum/comments/jx0ra6/new_defi_project_erc20_standard_tokens/,1,0
jx0s7p,1605783824,Releasing some really old ENS addresses,[removed],https://www.reddit.com/r/ethereum/comments/jx0s7p/releasing_some_really_old_ens_addresses/,1,17
jx11nq,1605785193,Ethereum May Be the Amazon of the Future Vitalik on Having a Vision and Believing In it,,https://www.reddit.com/r/ethereum/comments/jx11nq/ethereum_may_be_the_amazon_of_the_future_vitalik/,1,0
jx16c6,1605785854,Remaining Decentralized in a Centralized World,,https://www.reddit.com/r/ethereum/comments/jx16c6/remaining_decentralized_in_a_centralized_world/,2,0
jx1i2t,1605787456,Did 0xPoland just post the first clue?,,https://www.reddit.com/r/ethereum/comments/jx1i2t/did_0xpoland_just_post_the_first_clue/,4,21
jx24vs,1605790344,"CertusOne, ChorusOne, P2PValidator, stakefish &amp; StakingFacilities join Lido as validators for liquid Ethereum staking",,https://www.reddit.com/r/ethereum/comments/jx24vs/certusone_chorusone_p2pvalidator_stakefish/,1,0
jx2rwp,1605792915,Erc.Money- The Unregulated Tokens Marketplace,[removed]\n\n[View Poll](https://www.reddit.com/poll/jx2rwp),https://www.reddit.com/r/ethereum/comments/jx2rwp/ercmoney_the_unregulated_tokens_marketplace/,1,0
jx396m,1605794726,Matic Network Launches Live Chainlink Price Feeds to Support its Growing DeFi Ecosystem,,https://www.reddit.com/r/ethereum/comments/jx396m/matic_network_launches_live_chainlink_price_feeds/,1,0
jx3a3i,1605794825,How to store signed and encrypted data on IPFS,,https://www.reddit.com/r/ethereum/comments/jx3a3i/how_to_store_signed_and_encrypted_data_on_ipfs/,1,2
