id,created_utc,title,selftext,full_link,score,comments
jx3hyb,1605795623,Matic becomes the first outside Ethereum to launch native Chainlink feeds,,https://www.reddit.com/r/ethereum/comments/jx3hyb/matic_becomes_the_first_outside_ethereum_to/,1,0
jx3pjr,1605796372,"🧇 Waffle weekly downloads crossed 30% mark vs Truffle and is used by over 1,1k",,https://www.reddit.com/r/ethereum/comments/jx3pjr/waffle_weekly_downloads_crossed_30_mark_vs/,1,2
jx3x94,1605797108,ETH 2.0 Deposit Contract Reaches 20%!,,https://www.reddit.com/r/ethereum/comments/jx3x94/eth_20_deposit_contract_reaches_20/,1,85
jx40pd,1605797442,This screams scam,,https://www.reddit.com/r/ethereum/comments/jx40pd/this_screams_scam/,1,0
jx47x4,1605798113,DFinance release the mainnet version of the Dfinance blockchain!,,https://www.reddit.com/r/ethereum/comments/jx47x4/dfinance_release_the_mainnet_version_of_the/,1,0
jx48yn,1605798208,This is the video Binance keeps trying to downvte and hide. Please save it to re-share.,,https://www.reddit.com/r/ethereum/comments/jx48yn/this_is_the_video_binance_keeps_trying_to_downvte/,1,0
jx48yq,1605798209,How to search an ethereum address,[removed],https://www.reddit.com/r/ethereum/comments/jx48yq/how_to_search_an_ethereum_address/,1,3
jx4etf,1605798745,GNT to GLM Migration,,https://www.reddit.com/r/ethereum/comments/jx4etf/gnt_to_glm_migration/,1,0
jx4o7d,1605799609,"What is Uniswap | New Post Explains Protocol, UNI token &amp; Governance",,https://www.reddit.com/r/ethereum/comments/jx4o7d/what_is_uniswap_new_post_explains_protocol_uni/,1,0
jx4pyp,1605799768,The Basics of The Uniswap Token and Its Platform,,https://www.reddit.com/r/ethereum/comments/jx4pyp/the_basics_of_the_uniswap_token_and_its_platform/,1,0
jx5gh4,1605802141,(WORKING) BITCOIN GENERATOR || EARN 0.2 BTC PER DAY || 100% LEGIT BITCOIN MONEY ADD + PROOF ✔️,,https://www.reddit.com/r/ethereum/comments/jx5gh4/working_bitcoin_generator_earn_02_btc_per_day_100/,1,0
jx5id4,1605802308,"The Ternio Story, How This Small FinTech Is Revolutionizing Payments With Digital Currency | TechBullion",,https://www.reddit.com/r/ethereum/comments/jx5id4/the_ternio_story_how_this_small_fintech_is/,1,0
jx5n69,1605802730,Why is Ethereum's price lagging behind Bitcoin and Litecoin's recent jump in price?,[removed],https://www.reddit.com/r/ethereum/comments/jx5n69/why_is_ethereums_price_lagging_behind_bitcoin_and/,1,0
jx5pb6,1605802919,Account Abstraction (EIP-2938): Why &amp; What,,https://www.reddit.com/r/ethereum/comments/jx5pb6/account_abstraction_eip2938_why_what/,1,1
jx5sig,1605803186,Free coins? 👀,[removed],https://www.reddit.com/r/ethereum/comments/jx5sig/free_coins/,1,0
jx5wsw,1605803546,"Ankr's STKR going toe to toe in the success of ETH 2.0, ETH is gonna change the whole scenario of crypto!",<not selftext available>,https://www.reddit.com/r/ethereum/comments/jx5wsw/ankrs_stkr_going_toe_to_toe_in_the_success_of_eth/,1,0
jx5xyk,1605803640,"Ankr's STKR going toe to toe in the success of ETH 2.0, ETH is gonna change the whole scenario of crypto!",<not selftext available>,https://www.reddit.com/r/ethereum/comments/jx5xyk/ankrs_stkr_going_toe_to_toe_in_the_success_of_eth/,1,0
jx5yhx,1605803683,"Ankr's STKR going toe to toe in the success of ETH 2.0, ETH is gonna change the whole scenario of crypto!",<not selftext available>,https://www.reddit.com/r/ethereum/comments/jx5yhx/ankrs_stkr_going_toe_to_toe_in_the_success_of_eth/,1,0
jx668z,1605804348,Ankr STKR really did a fab job!!! ETH 2.0 staking is easy now with STKR Micropools!!!!!,"Unique &amp; bulletproof ETH2 staking solutions 👀👀\n\n&amp;#x200B;\n\n✅ Live mainnet deposit contract\n\n&amp;#x200B;\n\n✅ Zero slashing risk\n\n&amp;#x200B;\n\n✅ No hardware required\n\n&amp;#x200B;\n\n✅ &gt;1,300 ETH deposited",https://www.reddit.com/r/ethereum/comments/jx668z/ankr_stkr_really_did_a_fab_job_eth_20_staking_is/,1,3
jx6adv,1605804710,Updated Guide for Ubuntu/Lighthouse/Pyrmont,"I have updated my end-to-end guide for staking on *Ubuntu &amp; Lighthouse* to support the *Pyrmont testnet*. Still working on the other clients - next is Teku. No changes required for existing users who are already setup against Pyrmont. Changes include dropping ntpd (in favor of the launchpad default timedatectl), an updated deposit-cli section, and of course Pyrmont support throughout.\n\nNOTE: This is an interim step towards mainnet. Planning a bigger overhaul to the guide for that.\n\n[Link to the guide](https://someresat.medium.com/guide-to-staking-on-ethereum-2-0-ubuntu-pyrmont-lighthouse-a634d3b87393?sk=459494148fdab0b03c675ea0864d7486)",https://www.reddit.com/r/ethereum/comments/jx6adv/updated_guide_for_ubuntulighthousepyrmont/,1,1
jx6gcs,1605805225,Eth2 Launchpad Deposit Contract Walkthrough,,https://www.reddit.com/r/ethereum/comments/jx6gcs/eth2_launchpad_deposit_contract_walkthrough/,1,0
jx6rsk,1605806191,Account Abstraction Community Call,"Join authors of EIP-2938: Account Abstraction with moderator Hudson Jameson, organizers Ethereum Cat Herders &amp; Fellowship of Ethereum Magician for the first community call on Account Abstraction!\n\n**November 20th @ Noon ET // 17:00 UTC** \n\nDetails: [https://medium.com/ethereum-cat-herders/account-abstraction-community-call-4744ff0f56d9](https://medium.com/ethereum-cat-herders/account-abstraction-community-call-4744ff0f56d9)  \n\nLivestream link: [https://www.youtube.com/watch?v=0hAIjLFe38Y](https://www.youtube.com/watch?v=0hAIjLFe38Y)  \n\nFeel free to share your questions with us.",https://www.reddit.com/r/ethereum/comments/jx6rsk/account_abstraction_community_call/,1,0
jx6ziv,1605806867,Ethereum 2.0 Staking Tutorial | Setup Guide for running Validator on Pyrmont Testnet + Mainnet,,https://www.reddit.com/r/ethereum/comments/jx6ziv/ethereum_20_staking_tutorial_setup_guide_for/,1,0
jx7be3,1605807883,PrimeDAO || A knowledgeable and assisted construction community,[removed],https://www.reddit.com/r/ethereum/comments/jx7be3/primedao_a_knowledgeable_and_assisted/,1,0
jx7u8y,1605809406,How to calculate the return from your Curve Boost,,https://www.reddit.com/r/ethereum/comments/jx7u8y/how_to_calculate_the_return_from_your_curve_boost/,1,0
jx8frd,1605811178,GLT: Tokenized dual physical-digital crypto collectibles,[removed],https://www.reddit.com/r/ethereum/comments/jx8frd/glt_tokenized_dual_physicaldigital_crypto/,1,0
jx8hgu,1605811328,Ethereum 2.0 phase 0 countdown dashboard 📈,,https://www.reddit.com/r/ethereum/comments/jx8hgu/ethereum_20_phase_0_countdown_dashboard/,2,4
jx95nv,1605813330,Should i stake ETH?,[removed],https://www.reddit.com/r/ethereum/comments/jx95nv/should_i_stake_eth/,1,19
jxb8ao,1605819803,Running an ETH Validator for the Barely Motivated,,https://www.reddit.com/r/ethereum/comments/jxb8ao/running_an_eth_validator_for_the_barely_motivated/,1,2
jxbapv,1605820021,Earn Interest with Ledger Live &amp; Compound Finance,,https://www.reddit.com/r/ethereum/comments/jxbapv/earn_interest_with_ledger_live_compound_finance/,1,0
jxbo9o,1605821201,HOTTEST GIRL EVER to unbox her Crypto.com Debit Card! $250 Bitcoin BTC Giveaway! Guess her fav food!,[deleted],https://www.reddit.com/r/ethereum/comments/jxbo9o/hottest_girl_ever_to_unbox_her_cryptocom_debit/,0,2
jxbs5r,1605821542,What non-custodial staking options exist?,"I have 32 ETH that I would like to stake with ETH2.0, but I don't have the time or desire to run my own validator node. Could someone here recommend a good third-party non-custodial staking solution? Any info about trustworthiness and fees would be greatly appreciated!",https://www.reddit.com/r/ethereum/comments/jxbs5r/what_noncustodial_staking_options_exist/,1,14
jxbspa,1605821591,Why 32 Eth?,[removed],https://www.reddit.com/r/ethereum/comments/jxbspa/why_32_eth/,1,9
jxc46z,1605822619,Introducing the new Idle Governance Model,,https://www.reddit.com/r/ethereum/comments/jxc46z/introducing_the_new_idle_governance_model/,1,0
jxc8mw,1605823019,Is staking ETH a taxable event?,[removed],https://www.reddit.com/r/ethereum/comments/jxc8mw/is_staking_eth_a_taxable_event/,1,6
jxcbxf,1605823300,"The government wants to see your crypto transactions. FINCEN and the Federal Reserve just proposed a new rule that would allow for more warrantless surveillance and that could make it more expensive and difficult to use crypto. They are taking comments now until the 27th, so make your voice heard.",,https://www.reddit.com/r/ethereum/comments/jxcbxf/the_government_wants_to_see_your_crypto/,1,4
jxcemf,1605823536,It's not that bad: Open letter to MIT Digital Currency Initiative on anonymous voting,,https://www.reddit.com/r/ethereum/comments/jxcemf/its_not_that_bad_open_letter_to_mit_digital/,1,0
jxcl11,1605824114,Nearly 1% of Bitcoin’s Circulating Supply Now Tokenized on Ethereum,,https://www.reddit.com/r/ethereum/comments/jxcl11/nearly_1_of_bitcoins_circulating_supply_now/,2,41
jxcwnh,1605825196,Ethereum Behavior Analysis Update - Santiment Insights,,https://www.reddit.com/r/ethereum/comments/jxcwnh/ethereum_behavior_analysis_update_santiment/,1,2
jxdcud,1605826744,Ethereum-based Origin Puts $1 Million Bounty on OUSD Hacker,,https://www.reddit.com/r/ethereum/comments/jxdcud/ethereumbased_origin_puts_1_million_bounty_on/,1,0
jxdyec,1605828854,Organize contracts so they share the same contract storage and Ethereum address.,,https://www.reddit.com/r/ethereum/comments/jxdyec/organize_contracts_so_they_share_the_same/,1,0
jxey29,1605832427,"As DeFi Grows, Investors Look to Polkadot to Be the Next Ethereum",[deleted],https://www.reddit.com/r/ethereum/comments/jxey29/as_defi_grows_investors_look_to_polkadot_to_be/,1,0
jxez5q,1605832540,WEF Lists Blockchain Internet Creator Elastos in Global Innovators Community,[deleted],https://www.reddit.com/r/ethereum/comments/jxez5q/wef_lists_blockchain_internet_creator_elastos_in/,1,0
jxezq9,1605832598,WEF Lists Blockchain Internet Creator Elastos in Global Innovators Community,[deleted],https://www.reddit.com/r/ethereum/comments/jxezq9/wef_lists_blockchain_internet_creator_elastos_in/,1,0
jxgd4s,1605837778,MyCrypto will now inform you if ANY of your wallets have tokens that need to be migrated or if you have UNI to claim.,,https://www.reddit.com/r/ethereum/comments/jxgd4s/mycrypto_will_now_inform_you_if_any_of_your/,1,5
jxgp6m,1605839072,Dmitry Buterin on Twitter: All i want for Christmas is ETH (2.0 beacon chain to be up and running),,https://www.reddit.com/r/ethereum/comments/jxgp6m/dmitry_buterin_on_twitter_all_i_want_for/,1,0
jxh7pu,1605841131,Red Vs Blue: Gameplay Video - Early Alpha,[removed],https://www.reddit.com/r/ethereum/comments/jxh7pu/red_vs_blue_gameplay_video_early_alpha/,1,0
jxhp37,1605843086,Why do I feel like I am paying WAY too much for gas using MetaMask?,[removed],https://www.reddit.com/r/ethereum/comments/jxhp37/why_do_i_feel_like_i_am_paying_way_too_much_for/,1,12
jxhqzc,1605843296,This is being posted because I understand!!!,[removed],https://www.reddit.com/r/ethereum/comments/jxhqzc/this_is_being_posted_because_i_understand/,1,0
jxhz0q,1605844238,Ethereum Flowing Out of Exchanges and Into Smart Contracts,,https://www.reddit.com/r/ethereum/comments/jxhz0q/ethereum_flowing_out_of_exchanges_and_into_smart/,1,0
