id,created_utc,title,selftext,full_link,score,comments
jywjhj,1606055552,Looking for help!,"Looking for help! My devil spawn last night purchased a token on UNI (a scam coin) which we are unable to swap back on UNI. It seems however that a handful of wallets have the ability to sell- possibly interacting directly with the contract? If anyone has the knowledge and would be so kind to walk us through getting this token swapped back, we'll throw you a $100 in eth! \n\nWallet to wallet error we get when attempt to send:\n\n Warning! Error encountered during contract execution \[Reverted\] ERC-20 Token Transfer Error (Unable to locate corresponding Transfer Event Logs), Check with Sender. \n\n&amp;#x200B;\n\nThanks!\n\n[https://etherscan.io/token/0x158103a14d8076c350b330139446d621ea864555](https://etherscan.io/token/0x158103a14d8076c350b330139446d621ea864555)\n\nThat's the token",https://www.reddit.com/r/ethereum/comments/jywjhj/looking_for_help/,1,1
jywmne,1606055908,Rebalancing $DPI,,https://www.reddit.com/r/ethereum/comments/jywmne/rebalancing_dpi/,1,0
jywxts,1606057173,Rebalancing $DPI,,https://www.reddit.com/r/ethereum/comments/jywxts/rebalancing_dpi/,1,0
jyxbag,1606058556,No Fee Trading,,https://www.reddit.com/r/ethereum/comments/jyxbag/no_fee_trading/,1,0
jyxczq,1606058719,Infinity Wallet ERC-20 Token Free Listing Nomination,,https://www.reddit.com/r/ethereum/comments/jyxczq/infinity_wallet_erc20_token_free_listing/,1,1
jyxgdr,1606059072,Ethereum 1,[removed],https://www.reddit.com/r/ethereum/comments/jyxgdr/ethereum_1/,1,0
jyxx52,1606060782,"With Increasing Social Activity, Ethereum is Coin of the Day on LunarCRUSH",,https://www.reddit.com/r/ethereum/comments/jyxx52/with_increasing_social_activity_ethereum_is_coin/,1,0
jyxyac,1606060882,Is coinfabrik legit?,[removed],https://www.reddit.com/r/ethereum/comments/jyxyac/is_coinfabrik_legit/,1,0
jyyiow,1606062835,#CobaltLend #Blockchain #cryptocurrency and #CBLT,[removed],https://www.reddit.com/r/ethereum/comments/jyyiow/cobaltlend_blockchain_cryptocurrency_and_cblt/,1,0
jyzmax,1606066463,"My $25,000 Cryptocurrency Investment Portfolio REVEALED - (Must Watch)",,https://www.reddit.com/r/ethereum/comments/jyzmax/my_25000_cryptocurrency_investment_portfolio/,1,0
jyzr2r,1606066882,"""Ethereum"" in domain name",[removed],https://www.reddit.com/r/ethereum/comments/jyzr2r/ethereum_in_domain_name/,1,4
jyzts4,1606067112,Earn up to $159 with Coinbase Earn,[removed],https://www.reddit.com/r/ethereum/comments/jyzts4/earn_up_to_159_with_coinbase_earn/,1,0
jz018l,1606067806,"5 gwei in gas, how long will this take?",[removed],https://www.reddit.com/r/ethereum/comments/jz018l/5_gwei_in_gas_how_long_will_this_take/,1,2
jz04r7,1606068104,Emporium Finance,[removed],https://www.reddit.com/r/ethereum/comments/jz04r7/emporium_finance/,1,0
jz098q,1606068515,ETH2 Deposit Contract Reaches 50%!!,,https://www.reddit.com/r/ethereum/comments/jz098q/eth2_deposit_contract_reaches_50/,1,114
jz0a5q,1606068592,50% of the minimum required stake for Ethereum 2.0 (Serenity) Phase 0 to launch has been achieved!,,https://www.reddit.com/r/ethereum/comments/jz0a5q/50_of_the_minimum_required_stake_for_ethereum_20/,1,42
jz0fi6,1606069081,"For those who dont stake, what happens to their ETH on Dec 1?",[removed],https://www.reddit.com/r/ethereum/comments/jz0fi6/for_those_who_dont_stake_what_happens_to_their/,1,3
jz0kkl,1606069548,Reputable crypto lottery?,[removed],https://www.reddit.com/r/ethereum/comments/jz0kkl/reputable_crypto_lottery/,1,2
jz0kkm,1606069548,Reputable crypto lottery?,Is there a reputable decentralised lottery? I can find a few but I don't know anything about their popularity and reputation,https://www.reddit.com/r/ethereum/comments/jz0kkm/reputable_crypto_lottery/,1,9
jz0mnr,1606069748,Thai music festival to use its own token for a cashless event,,https://www.reddit.com/r/ethereum/comments/jz0mnr/thai_music_festival_to_use_its_own_token_for_a/,1,19
jz0ozv,1606069959,Newb here. Will ethereum drop below $500 again ?,[removed],https://www.reddit.com/r/ethereum/comments/jz0ozv/newb_here_will_ethereum_drop_below_500_again/,1,0
jz0p6j,1606069975,Hope it helps!,,https://www.reddit.com/r/ethereum/comments/jz0p6j/hope_it_helps/,1,1
jz0rgj,1606070181,set() function in my smart contract...Why doesn't it work?,[removed],https://www.reddit.com/r/ethereum/comments/jz0rgj/set_function_in_my_smart_contractwhy_doesnt_it/,1,0
jz123o,1606071154,Ethereum Lambo,,https://www.reddit.com/r/ethereum/comments/jz123o/ethereum_lambo/,1,0
jz1egl,1606072259,Origintrail Data Marketplaces Explained: Food Data Marketplace / December 1st Launch / Privacy By Design / Origintrail Ready For Takeoff / Built On Ethereum?,[deleted],https://www.reddit.com/r/ethereum/comments/jz1egl/origintrail_data_marketplaces_explained_food_data/,1,0
jz1fwj,1606072391,Origintrail Data Marketplaces Explained: Food Data Marketplace / December 1st Launch / Privacy By Design / Origintrail Ready For Takeoff? / Built On Ethereum,,https://www.reddit.com/r/ethereum/comments/jz1fwj/origintrail_data_marketplaces_explained_food_data/,1,0
jz1gxw,1606072487,Ethereum's Non-Whales (Outside the Top 10 Largest Addresses) Hold the Highest Percent of ETH's Total Supply in 11 Months,,https://www.reddit.com/r/ethereum/comments/jz1gxw/ethereums_nonwhales_outside_the_top_10_largest/,1,1
jz1u3y,1606073694,Preordered two PS5’s,[removed],https://www.reddit.com/r/ethereum/comments/jz1u3y/preordered_two_ps5s/,1,0
jz28c5,1606074978,Updated Guide for Ubuntu/Pyrmont/Teku,"I have updated my end-to-end guide for staking on Ubuntu &amp; Teku to support the Pyrmont testnet. Still working on the final client - Nimbus. No changes required for existing users who are already setup against Pyrmont. Changes include dropping ntpd (in favor of the launchpad default timedatectl), an updated deposit-cli section, updated key/pass section, permissions, updated grafana dashboard, and of course Pyrmont support throughout.\n\nNOTE: This is an interim step towards mainnet. Planning a bigger overhaul to the guide for that.\n\n[Link to the guide](https://someresat.medium.com/3da74372910?source=friends_link&amp;sk=835747c0fab93ccf85b4866ffae74b25)",https://www.reddit.com/r/ethereum/comments/jz28c5/updated_guide_for_ubuntupyrmontteku/,1,0
jz2cud,1606075360,"Announcing DARBE, a Layer 2 Token for DAI",[removed],https://www.reddit.com/r/ethereum/comments/jz2cud/announcing_darbe_a_layer_2_token_for_dai/,1,0
jz2f8g,1606075569,Where to buy low amounts of eth?,[removed],https://www.reddit.com/r/ethereum/comments/jz2f8g/where_to_buy_low_amounts_of_eth/,1,0
jz2j3q,1606075920,£€$10 free from coinbase earn,[removed],https://www.reddit.com/r/ethereum/comments/jz2j3q/10_free_from_coinbase_earn/,1,0
jz2utj,1606076971,So is ETH 2.0 going to create inflation or a massive increase in ETH supply come phase 2?,"I am confused about how the PoS ETH 2.0 rewards impact the economy. If I understand everything I have read correctly so far, ETH 1.0 PoW will continue to run parallel until Phase 2. \n\nSo miners will continue to receive the same ETH 1.0 rewards until PoW is deactivated in Phase 2. While at the same time Stakers are receiving ETH 2.0 rewards between phases 0 &amp; 2. Doesn't this mean when Phase 2.0 hits there is going to be a massive flood of extra ETH in the ecosystem and potentially a price drop? Or are mining rewards being reduced to compensate for the ETH 2.0 PoS rewards?",https://www.reddit.com/r/ethereum/comments/jz2utj/so_is_eth_20_going_to_create_inflation_or_a/,1,11
jz3k1w,1606079274,Newb here. Will ethereum drop below $500 again?,[removed],https://www.reddit.com/r/ethereum/comments/jz3k1w/newb_here_will_ethereum_drop_below_500_again/,1,3
jz43km,1606081006,[JOKE] Can I use the Ethereum blockchain to send a message back in time?,[removed],https://www.reddit.com/r/ethereum/comments/jz43km/joke_can_i_use_the_ethereum_blockchain_to_send_a/,1,0
jz45bb,1606081161,"10 days ago, ETH 2 deposit contract was at 59800 ETH. Today we are at 277 248 ETH. At currents rates, we will reach the needed amount in less than 12 days !",[removed],https://www.reddit.com/r/ethereum/comments/jz45bb/10_days_ago_eth_2_deposit_contract_was_at_59800/,1,13
jz4lc8,1606082587,BlockApps launches Ethereum-based Agritech network in collaboration with Bayer,,https://www.reddit.com/r/ethereum/comments/jz4lc8/blockapps_launches_ethereumbased_agritech_network/,1,0
jz4pwd,1606083013,Latest Week in Ethereum News. Who is ready for stake? 🥩🥩🥩,,https://www.reddit.com/r/ethereum/comments/jz4pwd/latest_week_in_ethereum_news_who_is_ready_for/,1,5
jz50uj,1606084070,Transaction out of gas and address/wallet very low on ETH. What to do?,"Hi folks,\n\nSo I tried transferring some ERC-20 tokens (ZRX) from an address that had very little ETH on it, and I must have messed up the gas limit+price ( 31'000 limit with 29 gwei) because my transaction ran out of gas and now that address doesn't have enough ETH to do anything. ( 0**.**00002031 ETH left)\n\nWhat is my best course of action here?\n\nCould I mine enough for this one transaction in a day? I do have an RTX 3080 I can put to work.\n\nShould I just buy ETH on an exchange and send it over? Seems like it would cost too much in exchange/withdrawal fees for just sending a tiny bit of ETH for gas..",https://www.reddit.com/r/ethereum/comments/jz50uj/transaction_out_of_gas_and_addresswallet_very_low/,1,3
jz532l,1606084278,Real-world applications drive NULS usage.,,https://www.reddit.com/r/ethereum/comments/jz532l/realworld_applications_drive_nuls_usage/,1,0
jz5qfx,1606086570,Minimum number of validators necessary,[removed],https://www.reddit.com/r/ethereum/comments/jz5qfx/minimum_number_of_validators_necessary/,1,3
jz5vcs,1606087046,Sending to ETH2 deposit address manually?,[removed],https://www.reddit.com/r/ethereum/comments/jz5vcs/sending_to_eth2_deposit_address_manually/,1,0
jz5wap,1606087135,[Q] Quick question about Ethereum 2.0,[removed],https://www.reddit.com/r/ethereum/comments/jz5wap/q_quick_question_about_ethereum_20/,1,0
jz6b6f,1606088580,What is Ethereum (Ξ) Ether (ETH) ? - For Beginners,,https://www.reddit.com/r/ethereum/comments/jz6b6f/what_is_ethereum_ξ_ether_eth_for_beginners/,1,0
jz7asy,1606092119,New wave,"New wave\n\nI’ve adopted the buy and hold strategy for the past few years with Btc and eth. I’ve been recently seeing and reading about defi and staking, I have no idea what this is and how to do that, does the buy and hold strategy still exist in crypto. Or do I now have to Start staking. If so can someone point me to the direction on how to do that.",https://www.reddit.com/r/ethereum/comments/jz7asy/new_wave/,1,3
jz7biz,1606092189,What's your favorite instructions for staking in Eth 2.0?,[removed],https://www.reddit.com/r/ethereum/comments/jz7biz/whats_your_favorite_instructions_for_staking_in/,1,0
jz801x,1606094669,Eth 2.0 Staking Guide,[removed],https://www.reddit.com/r/ethereum/comments/jz801x/eth_20_staking_guide/,1,1
jz8k6p,1606096808,I just fell for a scam puzzle and I just don't know why,[removed],https://www.reddit.com/r/ethereum/comments/jz8k6p/i_just_fell_for_a_scam_puzzle_and_i_just_dont/,1,0
jz8kbl,1606096817,"Vitalik is playing chess with Alexandra Botez, live on Twitch! twitch.tv/BotezLive",,https://www.reddit.com/r/ethereum/comments/jz8kbl/vitalik_is_playing_chess_with_alexandra_botez/,1,29
jz8r3m,1606097509,Oracle for prices?,Is there a way to use an oracle in a smart contact to know exchange rates for all erc20 tokens to ethereum?,https://www.reddit.com/r/ethereum/comments/jz8r3m/oracle_for_prices/,1,6
