id,created_utc,title,selftext,full_link,score,comments
kh72oa,1608514182,I want to get a view on this throughout the different communities - pardon my cross post,,https://www.reddit.com/r/ethereum/comments/kh72oa/i_want_to_get_a_view_on_this_throughout_the/,1,2
kh8nn7,1608519802,options for staking &lt; 32 ETH,"for those that have tried options for this, what route did you use, and how did it turn out?",https://www.reddit.com/r/ethereum/comments/kh8nn7/options_for_staking_32_eth/,1,125
kh9gpf,1608522766,ETHWeekly: Inside the New Hack That Has Crypto Users Spooked - The Cryptowriter Podcast #17,,https://www.reddit.com/r/ethereum/comments/kh9gpf/ethweekly_inside_the_new_hack_that_has_crypto/,1,0
kha3dq,1608525108,Stimulus Checks Officially Passed! Bitcoin Pump Incoming?,,https://www.reddit.com/r/ethereum/comments/kha3dq/stimulus_checks_officially_passed_bitcoin_pump/,1,0
khaj86,1608526823,Is Ethereum similar to Open Source Apps? How would this work with a currency?,"I can download open source apps for my phone and my computer. Something I've realized is that many of my favorite apps are usually open source and free.\n\nWhich makes me think about a future in which we have a currency (or at least access to) that is decentralized and open source. \n\nJust wondering if it's the same/similar. Is this the future of the internet and in 5-10 years people will look back and know it's true, and if so how would a currency (ETH) work with all of this?\n\nWhy would there need to be a currency (like ETH) in the first place or is the entire argument about having a currency that is decentralized and that's it?\n\nI'm really interested in investing in ETH, but I'm not fully convinced yet. I want to be certain that is the future and is better than what we currently have on several fronts.\n\nThanks",https://www.reddit.com/r/ethereum/comments/khaj86/is_ethereum_similar_to_open_source_apps_how_would/,1,3
khatm3,1608527974,Best way to send dozens or hundreds of addresses to ETH simultaneously?,[removed],https://www.reddit.com/r/ethereum/comments/khatm3/best_way_to_send_dozens_or_hundreds_of_addresses/,1,0
khau6c,1608528036,Best way to send dozens or hundreds of addresses to ETH simultaneously?,[removed],https://www.reddit.com/r/ethereum/comments/khau6c/best_way_to_send_dozens_or_hundreds_of_addresses/,1,0
khcnmi,1608536245,serenity energy token's trading is ongoing on sistemkoin exchange.,[removed],https://www.reddit.com/r/ethereum/comments/khcnmi/serenity_energy_tokens_trading_is_ongoing_on/,1,0
khdnls,1608541212,Best exchange for purchasing ETH in Australia?,[removed],https://www.reddit.com/r/ethereum/comments/khdnls/best_exchange_for_purchasing_eth_in_australia/,1,0
khdtjt,1608541988,Middle East Crypto Exchange Review: Where to Buy Bitcoin in MENA,,https://www.reddit.com/r/ethereum/comments/khdtjt/middle_east_crypto_exchange_review_where_to_buy/,1,0
khdxh0,1608542521,Base Protocol — The Next Generation of Rebasing,,https://www.reddit.com/r/ethereum/comments/khdxh0/base_protocol_the_next_generation_of_rebasing/,1,0
kheden,1608544696,Cross chains NFT?,[removed],https://www.reddit.com/r/ethereum/comments/kheden/cross_chains_nft/,1,0
khesbi,1608546641,A MUST READ Article about #CleverDeFi! Money-mouth face https://bitcoinist.com/clever-clva-crypto-tokens-unique-zero-supply-approach/ #Clever #CLVA #cleverToken #DEFI #Crypto #cryptocurrency #blockchain,,https://www.reddit.com/r/ethereum/comments/khesbi/a_must_read_article_about_cleverdefi_moneymouth/,1,0
khf2kt,1608547914,xTRX AMA Recap,,https://www.reddit.com/r/ethereum/comments/khf2kt/xtrx_ama_recap/,1,0
khfd0a,1608549074,"Bitcoin will be the first and most adopted one, like diesel cars.","However, Ethereum (2.0) will be the future, just like electric cars.\n\nAgree or Believe?",https://www.reddit.com/r/ethereum/comments/khfd0a/bitcoin_will_be_the_first_and_most_adopted_one/,1,20
khg4du,1608552269,DeFi Recap: Derivatives,,https://www.reddit.com/r/ethereum/comments/khg4du/defi_recap_derivatives/,1,1
khg5q7,1608552427,"Start earning free BTC, LTC, and ETH with Duckdice! Hourly faucets, daily bonuses, live user chat, and no deposit required - payouts up to 9999x! Refer your friends and start earning today!",,https://www.reddit.com/r/ethereum/comments/khg5q7/start_earning_free_btc_ltc_and_eth_with_duckdice/,1,1
khg8vp,1608552785,Flaming Farmers! We would like share our Litepaper with you https://cutt.ly/ohVD7Dv This will give you a clear understanding of our vision for Flaming Farm along with Flaming Swap brief introduction FireDon't forget Presale will end after 24 hoursFire,,https://www.reddit.com/r/ethereum/comments/khg8vp/flaming_farmers_we_would_like_share_our_litepaper/,1,0
khh8gr,1608556700,Eth2 update - a conversation with Ben Edgington - thanks Ben for agreeing to this!,,https://www.reddit.com/r/ethereum/comments/khh8gr/eth2_update_a_conversation_with_ben_edgington/,1,0
khhdmj,1608557234,Ethereum Weekly Setup Sees Price Near $980 by May 2021,,https://www.reddit.com/r/ethereum/comments/khhdmj/ethereum_weekly_setup_sees_price_near_980_by_may/,1,0
khhtv6,1608558860,Easiest way to go from cash to eth to paper wallet?,[removed],https://www.reddit.com/r/ethereum/comments/khhtv6/easiest_way_to_go_from_cash_to_eth_to_paper_wallet/,1,1
khhuan,1608558901,I bought eth at $640. am I stupid?,[removed],https://www.reddit.com/r/ethereum/comments/khhuan/i_bought_eth_at_640_am_i_stupid/,1,0
khhuzy,1608558965,Ethereum Payments - Your Opinion?,[removed],https://www.reddit.com/r/ethereum/comments/khhuzy/ethereum_payments_your_opinion/,1,0
khhxw5,1608559240,WARNING: DO NOT BUY LEDGER CRYPTOCURRENCY WALLET. COMPANY LEAKED PRIVATE DATA OF 270k CUSTOMERS,[removed],https://www.reddit.com/r/ethereum/comments/khhxw5/warning_do_not_buy_ledger_cryptocurrency_wallet/,1,0
khi80a,1608560179,EIP-1559 explained by Tim Beiko,[removed],https://www.reddit.com/r/ethereum/comments/khi80a/eip1559_explained_by_tim_beiko/,1,2
khii2f,1608561149,The increased usage of dapps resulted in multiple exploits and hacks that amounted to more than $120 million.,,https://www.reddit.com/r/ethereum/comments/khii2f/the_increased_usage_of_dapps_resulted_in_multiple/,1,1
khit15,1608562177,FV Bank will provide Ethereum custody to investors.,"FV Banks is a global digital bank servicing domestic and international businesses focused on providing fintech solutions. Now FV users can open accounts with fiat or digital asset balances to take advantage of the custodial storage of crypto assets and exchange them for fiat. FV Net will also be compatible with the custodial service. Nitin Agarwal, FV Bank’s Chief Revenue Officer said:\n\n""These products are proving to be very attractive to our international business, institutional investors, and retail customers. I anticipate the convergence of these products will drive growth in the bank for years to come.""\n\nSource: [Todayq News](https://news.todayq.com/news/blockchain-use-in-bank-guarantees-to-bitcoin-could-make-me-a-billionaire/)",https://www.reddit.com/r/ethereum/comments/khit15/fv_bank_will_provide_ethereum_custody_to_investors/,1,0
khjaav,1608563747,ITS Q4 2020 AND YOU ALL ARE STILL COMPLAINING ABOUT FEES. THATS ON YOU.," ITS Q4 2020 AND PEOPLE ARE STILL COMPLAINING ABOUT FEES\n\nThere are WORKING solutions already. Hnyswap, perp protocol, etc etc.\nMore to come. As a community, decide on one l2 platform and add liquidity. Only way of doing this.\n\nAnd ofc, all l2’s have advantages and disadvantages, but its quite apparent that xdai is the only real battle tested one, and all of you seem to have SOMEWHAT of an understanding on how it works, etc. if not, educate yourselves.\n\nIts not that difficult to use, and if we choose one l2 platform as a community, liquidity wont be a problem.",https://www.reddit.com/r/ethereum/comments/khjaav/its_q4_2020_and_you_all_are_still_complaining/,1,5
khjfy0,1608564254,"Ethereum Developer: ""We Are Going to Burn a Lot of ETH""",,https://www.reddit.com/r/ethereum/comments/khjfy0/ethereum_developer_we_are_going_to_burn_a_lot_of/,1,4
khjly8,1608564779,Synthetix withdraw L2 to L1,[removed],https://www.reddit.com/r/ethereum/comments/khjly8/synthetix_withdraw_l2_to_l1/,1,0
khjn05,1608564875,"Cross-Chain Milestone: NerveNetwork Connects ETH, BSC, and NULS",,https://www.reddit.com/r/ethereum/comments/khjn05/crosschain_milestone_nervenetwork_connects_eth/,1,0
khjyf6,1608565875,Ethereum Core Developer: EIP-1559 will Be Implemented,,https://www.reddit.com/r/ethereum/comments/khjyf6/ethereum_core_developer_eip1559_will_be/,1,0
khjzfs,1608565960,Is it worth staking 1-2 ETH into the staking pools?,Quite new to the cryptocurrency world so please be kind if this is a silly question. \n\nI happen to have a few ETH in my Binance account and just found out that Binance is supporting ETH staking pools. Is it worth to stake too little amounts? What would I be getting in return realistically? Can I increase my staking amount later? Also is Binance a wrong place to do staking? Although I have no idea how to transfer my wallet to a different platform so probably won't be bothered to do that.,https://www.reddit.com/r/ethereum/comments/khjzfs/is_it_worth_staking_12_eth_into_the_staking_pools/,1,82
khk39u,1608566312,"Ethereum Faces Rejection at $670, Resumes Downward Move",,https://www.reddit.com/r/ethereum/comments/khk39u/ethereum_faces_rejection_at_670_resumes_downward/,1,0
khksad,1608568462,ETH Price Prediction Chat! 💬 #join,,https://www.reddit.com/r/ethereum/comments/khksad/eth_price_prediction_chat_join/,1,2
khl7bq,1608569786,Input Output on Twitter - Inviting all Solidity Developers,,https://www.reddit.com/r/ethereum/comments/khl7bq/input_output_on_twitter_inviting_all_solidity/,1,0
khlo7v,1608571211,I am creating a platform (ethereum based) where you can lock your wBTC or ethereum and hodl until a certain pricepoint or time. Any name suggestions? looking for a good domain.,[removed],https://www.reddit.com/r/ethereum/comments/khlo7v/i_am_creating_a_platform_ethereum_based_where_you/,1,10
khlooh,1608571251,Just learned about Ethereum! I’m curious about verification!,[removed],https://www.reddit.com/r/ethereum/comments/khlooh/just_learned_about_ethereum_im_curious_about/,1,0
khlrk7,1608571507,Guide to Deploying Applications to Akash DeCloud,,https://www.reddit.com/r/ethereum/comments/khlrk7/guide_to_deploying_applications_to_akash_decloud/,1,0
khm1ad,1608572378,What are some Ethereum projects to avoid in 2021 because they’re most likely scams looking to unload tokens,[removed],https://www.reddit.com/r/ethereum/comments/khm1ad/what_are_some_ethereum_projects_to_avoid_in_2021/,1,4
khmm66,1608574142,Every year Ternio does a video 'Year In Review' and I highly recommend watching the 2020 version which just came out.,,https://www.reddit.com/r/ethereum/comments/khmm66/every_year_ternio_does_a_video_year_in_review_and/,1,0
khmyio,1608575146,Weekly Wrap: This Week In Chainlink December 14 - December 20,,https://www.reddit.com/r/ethereum/comments/khmyio/weekly_wrap_this_week_in_chainlink_december_14/,1,0
khn0xu,1608575349,Swapping USDC for ETH without having ETH for gas.,Is it currently possible to do so? Is there some DEX which supports Meta transaction (e.g. through OpenGSN). I don't want to decrease the address anonymity by sending ETH from other accounts. Thank you,https://www.reddit.com/r/ethereum/comments/khn0xu/swapping_usdc_for_eth_without_having_eth_for_gas/,1,4
khnh5k,1608576652,"Why the transaction fee is so high, how to pay less?",[removed],https://www.reddit.com/r/ethereum/comments/khnh5k/why_the_transaction_fee_is_so_high_how_to_pay_less/,1,5
khnum0,1608577709,Let it rip Vitalik 🚀🔥 #Defi #eth2,,https://www.reddit.com/r/ethereum/comments/khnum0/let_it_rip_vitalik_defi_eth2/,1,0
kho42m,1608578467,Story from Tech Uniswap Is the Number One Gas Guzzler on Ethereum,,https://www.reddit.com/r/ethereum/comments/kho42m/story_from_tech_uniswap_is_the_number_one_gas/,1,0
kho724,1608578702,"Ethereum Developer: ""We Are Going to Burn a Lot of ETH""",,https://www.reddit.com/r/ethereum/comments/kho724/ethereum_developer_we_are_going_to_burn_a_lot_of/,1,0
khopjd,1608580203,Throw back post to when Ethereum was under 1$,,https://www.reddit.com/r/ethereum/comments/khopjd/throw_back_post_to_when_ethereum_was_under_1/,1,1
khoqtj,1608580314,Throw back post to when Ethereum was under $1,,https://www.reddit.com/r/ethereum/comments/khoqtj/throw_back_post_to_when_ethereum_was_under_1/,1,10
khoqxx,1608580323,Digital Fashion: The Fabricant Launches Atari-Inspired Collection as Enjin NFTs,,https://www.reddit.com/r/ethereum/comments/khoqxx/digital_fashion_the_fabricant_launches/,1,0
