id,created_utc,title,selftext,full_link,score,comments
ktlcyf,1610172442,Support research around OSS,[removed],https://www.reddit.com/r/ethereum/comments/ktlcyf/support_research_around_oss/,1,0
ktlde7,1610172490,Flashback - Hodl Gang,,https://www.reddit.com/r/ethereum/comments/ktlde7/flashback_hodl_gang/,1,0
ktlqqs,1610174078,9 Reasons Why You Need SEO Company to Boost Your Online Business visibility,,https://www.reddit.com/r/ethereum/comments/ktlqqs/9_reasons_why_you_need_seo_company_to_boost_your/,1,0
ktlt64,1610174375,ETH DOGE Bridge,[removed],https://www.reddit.com/r/ethereum/comments/ktlt64/eth_doge_bridge/,1,0
ktlx6y,1610174879,"Ethereum will be worth $20,000 says former Goldman Sachs employee",,https://www.reddit.com/r/ethereum/comments/ktlx6y/ethereum_will_be_worth_20000_says_former_goldman/,1,0
ktm54o,1610175858,Best place to buy ETH in the US for a beginner?,[removed],https://www.reddit.com/r/ethereum/comments/ktm54o/best_place_to_buy_eth_in_the_us_for_a_beginner/,1,12
ktmz3f,1610179947,Top Five Cryptocurrency Market Data APIs in 2021,The integration of APIs into your trading strategy can shake things up. These powerful tools expand on the functionality of platforms by allowing you to utilize third-party applications seamlessly. [Check out this guide](https://cryptoadventure.org/top-five-cryptocurrency-market-data-apis-in-2021/).,https://www.reddit.com/r/ethereum/comments/ktmz3f/top_five_cryptocurrency_market_data_apis_in_2021/,1,0
ktmzm8,1610180019,What Is Ethereum 2.0 and Why Does It Matter?,,https://www.reddit.com/r/ethereum/comments/ktmzm8/what_is_ethereum_20_and_why_does_it_matter/,1,0
ktnlib,1610183141,Can someone give a better description on how to use this password recovery tool?,"Downloaded this: https://github.com/brutebrothers/mist-password-recovery\n\nbut I can't understand instructions for shit, do I need some kind of programming program to run it or what?\n\nLuckily &lt;1 eth locked up but im curious of transaction history.\n\nThanks for help.",https://www.reddit.com/r/ethereum/comments/ktnlib/can_someone_give_a_better_description_on_how_to/,1,0
ktnrbl,1610183975,Arrano Network Thi Bigest Defi Project,[removed],https://www.reddit.com/r/ethereum/comments/ktnrbl/arrano_network_thi_bigest_defi_project/,1,1
kto0ms,1610185330,Where would you keep your ETH in exchange or in own wallet.,[removed],https://www.reddit.com/r/ethereum/comments/kto0ms/where_would_you_keep_your_eth_in_exchange_or_in/,1,0
kto4c6,1610185880,Daily charts analysis - tradingcook new charts,,https://www.reddit.com/r/ethereum/comments/kto4c6/daily_charts_analysis_tradingcook_new_charts/,1,0
ktokfh,1610188196,What caused ETH to spike on the 1st week of January?,,https://www.reddit.com/r/ethereum/comments/ktokfh/what_caused_eth_to_spike_on_the_1st_week_of/,1,22
ktosyh,1610189440,What did go wrong?,[removed],https://www.reddit.com/r/ethereum/comments/ktosyh/what_did_go_wrong/,1,0
ktp127,1610190552,New stimulus.,https://www.ft.com/content/b69a5de3-e334-48db-8d74-c52068476bb8?fbclid=IwAR1l9lAwV0_-6L7cWYgouwDgNxDw8LelDRC_erAqSE0fxd1NPfmR4XHzg9k\n\nThoughts?,https://www.reddit.com/r/ethereum/comments/ktp127/new_stimulus/,1,4
ktpb17,1610191779,Non custodial decentralized solution,[removed],https://www.reddit.com/r/ethereum/comments/ktpb17/non_custodial_decentralized_solution/,1,0
ktplz3,1610193219,ERC20 Coin currently in Private Sale before ICO,[removed],https://www.reddit.com/r/ethereum/comments/ktplz3/erc20_coin_currently_in_private_sale_before_ico/,1,0
ktppnq,1610193642,Ethereum's Price Movement: A History - BeInCrypto,,https://www.reddit.com/r/ethereum/comments/ktppnq/ethereums_price_movement_a_history_beincrypto/,1,2
ktptuf,1610194156,AnySale - SALE token PRE-SALE launch,[removed],https://www.reddit.com/r/ethereum/comments/ktptuf/anysale_sale_token_presale_launch/,1,0
ktpzgx,1610194832,I went all in,"Hi all,\n\nThis is the gamble of my life. Around 2 months ago I sold my house. I got myself a cheap place to stay and was wondering: what to buy? How can I make life changing money?\n\nI went all in on ETH $1000. Now its already above $1200. 🙏🏻 \n\nI know this is bet with huge risk, but its paying off right now. I wish everyone of you good times! 🚀👊🏼",https://www.reddit.com/r/ethereum/comments/ktpzgx/i_went_all_in/,1,51
ktqlda,1610197504,Every 6 hours 0.0002000 ETH,[removed],https://www.reddit.com/r/ethereum/comments/ktqlda/every_6_hours_00002000_eth/,1,0
ktqq23,1610198078,ESSS: elliptic Shamir Shared Secret for safe shares transfer between trusted public keys (Node.js implementation),,https://www.reddit.com/r/ethereum/comments/ktqq23/esss_elliptic_shamir_shared_secret_for_safe/,1,2
ktqvsp,1610198787,Ethereum and XRP,"Hey guys, \n\nI was recently intrigued with the rapid increase in Bitcoin and cypto currently and assumed that if Bitcoin keeps increasing it will become unaffordable for most people. \n\nWould this then lead people to purchase more etheruem and XRP and also do u guys think that both of these currencies are safe and likely going to increase in the coming years. \n\nCheers.",https://www.reddit.com/r/ethereum/comments/ktqvsp/ethereum_and_xrp/,1,8
ktqxye,1610199055,Gas Fees,[removed],https://www.reddit.com/r/ethereum/comments/ktqxye/gas_fees/,1,0
ktqyjj,1610199126,Could someone ELI5 yield farming and interest on my coins?,"I have some ETH, but I hear about earning like 8% interest on my crypto? Where does that money come from? Do I just stake my ETH in some contract with no risk? Or do I transfer my ETH on some site and lose control of it?",https://www.reddit.com/r/ethereum/comments/ktqyjj/could_someone_eli5_yield_farming_and_interest_on/,1,39
ktrn0v,1610201744,"Some of you stake, some of you trade, some of us make a censor resistant page for sea otters.",,https://www.reddit.com/r/ethereum/comments/ktrn0v/some_of_you_stake_some_of_you_trade_some_of_us/,1,0
ktrocy,1610201870,Where to buy Ethereum in Canada?,[removed],https://www.reddit.com/r/ethereum/comments/ktrocy/where_to_buy_ethereum_in_canada/,1,0
ktrpiu,1610202001,Which wallet with offline tx creation option do you recommend?,,https://www.reddit.com/r/ethereum/comments/ktrpiu/which_wallet_with_offline_tx_creation_option_do/,1,1
ktrrbp,1610202199,Register &amp; host one page website on ethereum,[removed],https://www.reddit.com/r/ethereum/comments/ktrrbp/register_host_one_page_website_on_ethereum/,1,5
ktrs8c,1610202306,What are your thoughts on decentralized prediction protocol?,,https://www.reddit.com/r/ethereum/comments/ktrs8c/what_are_your_thoughts_on_decentralized/,1,0
ktrwpp,1610202776,ELI5: Why will the Ether be highly demanded in the future?,"I am new to understanding this cryptos/Ethereum and I can comprehend the potential of the blockchain technology/ethereum blockchain in general. \n\nBut why will you need Ether? I may have some gaps in my understanding.  \n\n\nIs Ether necessary for DeFi transactions? I see that there are currently DeFi Dapps that are in essence a bank which allows you to exchange different types of cryptos, lend for interest income or borrow. Can these cryptos/stablecoins be used on Ethereum blockchain in the future?  \nIs the application and usage of ether only for other potentially useful Dapps in the future?",https://www.reddit.com/r/ethereum/comments/ktrwpp/eli5_why_will_the_ether_be_highly_demanded_in_the/,1,187
kts1il,1610203236,Is there a way to engage in DeFi earning yield without losing the access to a coin(s) rise in price?,[removed],https://www.reddit.com/r/ethereum/comments/kts1il/is_there_a_way_to_engage_in_defi_earning_yield/,1,0
ktsdw8,1610204527,What is the best way to buy ETH in the UK with deposit times that means i can buy on the same day (today)?,"I currently have a verified bitstamp account but i think if i deposit money there it will take atleast 2-3 days, I also have bittylicious but are the fees bad? Was also considereing CEX which do you guys think is best?",https://www.reddit.com/r/ethereum/comments/ktsdw8/what_is_the_best_way_to_buy_eth_in_the_uk_with/,1,4
ktsi3z,1610204941,The Domain Startups Building an Uncensorable Internet on Top of Ethereum,,https://www.reddit.com/r/ethereum/comments/ktsi3z/the_domain_startups_building_an_uncensorable/,1,10
ktspwg,1610205697,Ethereum grow out of bitcoin,Can ethereum eventually grow out of bitcoin in terms of price action? What is the rationale to invest in eth rather than Btc?,https://www.reddit.com/r/ethereum/comments/ktspwg/ethereum_grow_out_of_bitcoin/,1,5
ktsrhb,1610205855,Jimmy Ragosa @JimmyRagosa · Jan 7 I just bought $ETH and this is happening to my dog. WTF?,,https://www.reddit.com/r/ethereum/comments/ktsrhb/jimmy_ragosa_jimmyragosa_jan_7_i_just_bought_eth/,1,0
ktssko,1610205970,"When Eth 2.0 comes out, what's going to happen to the Eth we have now?",[removed],https://www.reddit.com/r/ethereum/comments/ktssko/when_eth_20_comes_out_whats_going_to_happen_to/,1,0
ktsu6n,1610206118,Etherscan issue with tokens,[removed],https://www.reddit.com/r/ethereum/comments/ktsu6n/etherscan_issue_with_tokens/,1,0
ktt083,1610206706,"Private and traceless transactions, right on Ethereum with smart-contract",,https://www.reddit.com/r/ethereum/comments/ktt083/private_and_traceless_transactions_right_on/,1,2
ktu5rp,1610210381,Why hasn't the ETH/BTC ratio been the same or even close to the levels when BTC hit its previous cycle high?,Appreciate any answers. Thanks.,https://www.reddit.com/r/ethereum/comments/ktu5rp/why_hasnt_the_ethbtc_ratio_been_the_same_or_even/,1,3
ktucur,1610211016,December was a record volume month for Ethereum options,,https://www.reddit.com/r/ethereum/comments/ktucur/december_was_a_record_volume_month_for_ethereum/,1,0
ktuu1b,1610212424,Arguments against PoS?,I noticed the creator of bittorrent tweeting that Etherums PoS was terrible. Does know where I can find actual technical arguments against Ethereums PoS?,https://www.reddit.com/r/ethereum/comments/ktuu1b/arguments_against_pos/,2,72
ktv2yt,1610213132,Vaccination certificates on Ethereum,,https://www.reddit.com/r/ethereum/comments/ktv2yt/vaccination_certificates_on_ethereum/,1,0
ktv627,1610213392,"Doing my bachelors degree in graphic design on rarible, i will make collectible nft toys to see and discover how graphic design can create value on a new market. I have huge plans for this concept and i hope you guys find interest in it. This is the first one in the collection. Link in comments.",,https://www.reddit.com/r/ethereum/comments/ktv627/doing_my_bachelors_degree_in_graphic_design_on/,1,0
ktw1jr,1610215968,Ethereum vs BitCoinCash,Been seeing a few predictions that once BitCoin gets priced out that investors and the financial companies will look for a cheaper alternative and many are saying Ethereum will be the next best thing. But Is it possible that bitcoin cash potentially be the one that blows up just because of the name. Lots of new investors and indivuduals are getting into crypto and may invest in the name rather than data,https://www.reddit.com/r/ethereum/comments/ktw1jr/ethereum_vs_bitcoincash/,0,8
ktwlw7,1610217638,What is ethereum long term play?,[removed]\n\n[View Poll](https://www.reddit.com/poll/ktwlw7),https://www.reddit.com/r/ethereum/comments/ktwlw7/what_is_ethereum_long_term_play/,1,0
ktwrur,1610218149,My first experiment in NFT storytelling!,,https://www.reddit.com/r/ethereum/comments/ktwrur/my_first_experiment_in_nft_storytelling/,1,0
ktwu81,1610218352,Vitalik Dancing! - Founder of Ethereum! Now I get why ETH is good.,,https://www.reddit.com/r/ethereum/comments/ktwu81/vitalik_dancing_founder_of_ethereum_now_i_get_why/,1,0
ktxeeq,1610220058,Utilising The Ethereum Network for Real Estate,[removed],https://www.reddit.com/r/ethereum/comments/ktxeeq/utilising_the_ethereum_network_for_real_estate/,1,0
ktxgbi,1610220221,What are your opinions and suggestions about my portfolio? I know it is not much and that I do not own any BTC or ETH but I am surely into ETH .. Thank you and good luck in 2021 crypto year!,,https://www.reddit.com/r/ethereum/comments/ktxgbi/what_are_your_opinions_and_suggestions_about_my/,1,0
