id,created_utc,title,selftext,full_link,score,comments
lclk2t,1612461347,Should I sell My ETH?,[removed],https://www.reddit.com/r/ethereum/comments/lclk2t/should_i_sell_my_eth/,1,0
lclpdi,1612461708,Check out UMA,[removed],https://www.reddit.com/r/ethereum/comments/lclpdi/check_out_uma/,1,0
lclsnc,1612461926,Is there a list showing what are the biggest Ethereum futures platforms are?,[removed],https://www.reddit.com/r/ethereum/comments/lclsnc/is_there_a_list_showing_what_are_the_biggest/,1,0
lclsvd,1612461942,Best ethereum wallet for android??,"Am from india, looking for low cost transaction fee wallets.",https://www.reddit.com/r/ethereum/comments/lclsvd/best_ethereum_wallet_for_android/,2,3
lclzd5,1612462403,Just HODL and don't worry!,[removed],https://www.reddit.com/r/ethereum/comments/lclzd5/just_hodl_and_dont_worry/,1,0
lcm0ab,1612462468,AAVE🚀🚀🚀🚀🚀🚀,[removed],https://www.reddit.com/r/ethereum/comments/lcm0ab/aave/,1,0
lcm9sd,1612463160,Is it a good moment to but eth?,[removed],https://www.reddit.com/r/ethereum/comments/lcm9sd/is_it_a_good_moment_to_but_eth/,1,0
lcmadh,1612463203,I invested all my savings on ETH and DOGE. Imma hold all my coins until I’m just as rich as a hedge fund manager 🚀,,https://www.reddit.com/r/ethereum/comments/lcmadh/i_invested_all_my_savings_on_eth_and_doge_imma/,1,0
lcmcig,1612463361,How many smart contracts can be written per ETH?,[removed],https://www.reddit.com/r/ethereum/comments/lcmcig/how_many_smart_contracts_can_be_written_per_eth/,1,0
lcmgv2,1612463676,"Over 75 Ethereum 2.0 Validators Lose $30,000 for Double Voting",,https://www.reddit.com/r/ethereum/comments/lcmgv2/over_75_ethereum_20_validators_lose_30000_for/,1,0
lcmkyi,1612463969,Where do I start? How do I buy?,[removed],https://www.reddit.com/r/ethereum/comments/lcmkyi/where_do_i_start_how_do_i_buy/,1,0
lcmt21,1612464535,"Gas Fees are getting All-Time High, Lets Embrace Existing Layer 1 &amp; Layer 2 solutions",,https://www.reddit.com/r/ethereum/comments/lcmt21/gas_fees_are_getting_alltime_high_lets_embrace/,1,0
lcmuiz,1612464641,ETH transfer cost,[removed],https://www.reddit.com/r/ethereum/comments/lcmuiz/eth_transfer_cost/,1,0
lcn1zz,1612465154,Recurring buy question,[removed],https://www.reddit.com/r/ethereum/comments/lcn1zz/recurring_buy_question/,2,8
lcnm6z,1612466502,my 1st cryptocurrency ever!,"hey everyone!\n\nJust wanted to say thank you for all the great advice I've seen here! It really helped push me over the edge and I finally purchased my first ETH! Everyone's advice has been great altho i bought at the ATH i followed the DCA rule, I invested some and left some fiat aside for when/if a dip occurs so that I can purchase more! If not at least i got in before another ATH!\n\nI remember in 2014/2015 I waned to buy BTC and i said no way too high! I'm definitely not letting this chance slip by me again!\n\nI've also learnt so much abt DeFi and dapps etc very excited to continue to hodl! and learn.\n\nI recommend The Infinite Machine: How an Army of Crypto-hackers Is Building the Next Internet with Ethereum by Camila Russo to anyone interested in Ethereum it was a great joy to read with some really insightful information!",https://www.reddit.com/r/ethereum/comments/lcnm6z/my_1st_cryptocurrency_ever/,50,15
lcno8r,1612466650,Best exchange/wallet supported by BofA?,<not selftext available>,https://www.reddit.com/r/ethereum/comments/lcno8r/best_exchangewallet_supported_by_bofa/,1,0
lcnowy,1612466700,ETH&gt;ChainLink,[removed],https://www.reddit.com/r/ethereum/comments/lcnowy/ethchainlink/,1,0
lconpl,1612469095,I laughed out loud. Like literally.,,https://www.reddit.com/r/ethereum/comments/lconpl/i_laughed_out_loud_like_literally/,1,0
lcoqt0,1612469305,HOW TO MAKE MONEY WITH ETHEREUM,[removed],https://www.reddit.com/r/ethereum/comments/lcoqt0/how_to_make_money_with_ethereum/,1,0
lcoqta,1612469306,First time,[deleted],https://www.reddit.com/r/ethereum/comments/lcoqta/first_time/,1,0
lcorga,1612469352,It's been 2 years... Tell me more!,[removed],https://www.reddit.com/r/ethereum/comments/lcorga/its_been_2_years_tell_me_more/,7,2
lcorva,1612469382,First time!,[removed],https://www.reddit.com/r/ethereum/comments/lcorva/first_time/,0,10
lcosh4,1612469418,Trying to understand crypto lending services (like BlockFi). Are they a good alternative to staking Ethereum? Do a lot of people use them?,[deleted],https://www.reddit.com/r/ethereum/comments/lcosh4/trying_to_understand_crypto_lending_services_like/,17,9
lcovck,1612469605,Welcome all OEC (One ETH Coiners),[removed],https://www.reddit.com/r/ethereum/comments/lcovck/welcome_all_oec_one_eth_coiners/,18,4
lcp3su,1612470203,Any good ethereum games out there?,[removed],https://www.reddit.com/r/ethereum/comments/lcp3su/any_good_ethereum_games_out_there/,1,0
lcp7u0,1612470498,Which is the next 🚀 Ladies and Gents Place your bets for💰💰,[removed]\n\n[View Poll](https://www.reddit.com/poll/lcp7u0),https://www.reddit.com/r/ethereum/comments/lcp7u0/which_is_the_next_ladies_and_gents_place_your/,1,0
lcp7zw,1612470510,"I just bought 1 ETH, holding to the moon",[removed],https://www.reddit.com/r/ethereum/comments/lcp7zw/i_just_bought_1_eth_holding_to_the_moon/,3,0
lcpxig,1612472237,Have public key. Have 12 word seed. How best to xchange,,https://www.reddit.com/r/ethereum/comments/lcpxig/have_public_key_have_12_word_seed_how_best_to/,1,1
lcpyvr,1612472340,Goin all in on eth.,[removed],https://www.reddit.com/r/ethereum/comments/lcpyvr/goin_all_in_on_eth/,1,0
lcq1t7,1612472520,Thinking about liquidating other assets and investing all in on crypto.,[removed],https://www.reddit.com/r/ethereum/comments/lcq1t7/thinking_about_liquidating_other_assets_and/,1,0
lcq786,1612472871,Is there a decent Desktop wallet or do you recommend a hardware wallet?,"Pretty much every wallet seems to be geared towards Android or IOS apps, which I don't like because of security and I usually have all my crypto stuff on my Laptop. I also don't like web stuff either because of trust and security and all. \n\nI tried MyCrypto which works but is kind of annoying. I can't use multiple incoming Addresses and it logs me off whenever I switch menu, also logging in is like importing a new Wallet every time...\n\nDo you use any desktop wallets? Preferably a secure, open-source, linux compatibility, that kind of stuff. What about Hardware wallets? How would one be used?",https://www.reddit.com/r/ethereum/comments/lcq786/is_there_a_decent_desktop_wallet_or_do_you/,1,12
lcq7w8,1612472917,NFT introduction article I did - A good introduction guide for anyone who doesn't know the basics :),,https://www.reddit.com/r/ethereum/comments/lcq7w8/nft_introduction_article_i_did_a_good/,1,0
lcqm8a,1612473940,Where do you personally see Ethereum in a years time?,,https://www.reddit.com/r/ethereum/comments/lcqm8a/where_do_you_personally_see_ethereum_in_a_years/,13,25
lcqpcp,1612474180,Excited for Layer2 to hopefully solve this but it’s fun poking the bear while we’re all in the green but not able move it without a steep fee,[deleted],https://www.reddit.com/r/ethereum/comments/lcqpcp/excited_for_layer2_to_hopefully_solve_this_but/,1,0
lcqq16,1612474224,NuCypher,,https://www.reddit.com/r/ethereum/comments/lcqq16/nucypher/,0,1
lcqqkn,1612474256,It isn't all crypto with high fees. LTC only costs a few cents. ETH developers should be ashamed,<not selftext available>,https://www.reddit.com/r/ethereum/comments/lcqqkn/it_isnt_all_crypto_with_high_fees_ltc_only_costs/,1,0
lcqszk,1612474429,Our Discord Chat!,[removed],https://www.reddit.com/r/ethereum/comments/lcqszk/our_discord_chat/,1,0
lcqtk1,1612474468,What exchanges support DEXtools?,[removed],https://www.reddit.com/r/ethereum/comments/lcqtk1/what_exchanges_support_dextools/,1,0
lcqxtv,1612474768,"Relatively new to Ethereum, why are transaction fees so high?","Been mining ethereum for about a week now, and finally got my first payout! I’m planning on holding it in my wallet anyways, but I noticed that my wallet’s minimum transaction fee was almost 30%! Are these fees normal? If I ever want to actually spend my crypto is that what I have to expect? Does it scale differently for larger amounts and I just have to save up?",https://www.reddit.com/r/ethereum/comments/lcqxtv/relatively_new_to_ethereum_why_are_transaction/,11,9
lcqzec,1612474887,Thoughts on this chart? Thanks in advance😉,[deleted],https://www.reddit.com/r/ethereum/comments/lcqzec/thoughts_on_this_chart_thanks_in_advance/,1,0
lcr55c,1612475321,Guys we could be seeing huge price spikes on the next few weeks,[removed],https://www.reddit.com/r/ethereum/comments/lcr55c/guys_we_could_be_seeing_huge_price_spikes_on_the/,0,3
lcr9yv,1612475660,Exchanges &amp; wallets supported by Bank of America?,Having a hard time finding one. TIA,https://www.reddit.com/r/ethereum/comments/lcr9yv/exchanges_wallets_supported_by_bank_of_america/,4,3
lcrcou,1612475841,"Wow ! just opening my wallet to $37,240 almost $38k we move !!! Bitcoin is that only trusted coin! Let's do some trades. Trading Ethereum next 📈💯",,https://www.reddit.com/r/ethereum/comments/lcrcou/wow_just_opening_my_wallet_to_37240_almost_38k_we/,1,0
lcrcwi,1612475858,Why do we focus on market cap?,[removed],https://www.reddit.com/r/ethereum/comments/lcrcwi/why_do_we_focus_on_market_cap/,1,0
lcreei,1612475975,The first Gig economy for your professional experience,[removed],https://www.reddit.com/r/ethereum/comments/lcreei/the_first_gig_economy_for_your_professional/,1,0
lcrjly,1612476341,Invest?,[removed],https://www.reddit.com/r/ethereum/comments/lcrjly/invest/,1,0
lcrmyk,1612476591,Wear the coin📈🚀,,https://www.reddit.com/r/ethereum/comments/lcrmyk/wear_the_coin/,1,0
lcrxx2,1612477364,will Ethereum 2.0 solve the high fee problem?,Just wondering,https://www.reddit.com/r/ethereum/comments/lcrxx2/will_ethereum_20_solve_the_high_fee_problem/,10,18
lcs18z,1612477618,Anyone else having long waits on Ethereum on coinbase trying to deposit to Pro?,[removed],https://www.reddit.com/r/ethereum/comments/lcs18z/anyone_else_having_long_waits_on_ethereum_on/,1,0
lcs8z8,1612478195,MINING WITH 3080,[removed],https://www.reddit.com/r/ethereum/comments/lcs8z8/mining_with_3080/,1,0
