id,created_utc,title,selftext,full_link,score,comments
lg2leh,1612874714,Why Ethereum beats Cardano &amp; Polkadot?,,https://www.reddit.com/r/ethereum/comments/lg2leh/why_ethereum_beats_cardano_polkadot/,1,1
lg2nev,1612874931,Lost wallet problem,[removed],https://www.reddit.com/r/ethereum/comments/lg2nev/lost_wallet_problem/,1,0
lg2x58,1612875894,A research paper on DeFi is published on St. Louis Fed and talks about a potential paradigm shift.,,https://www.reddit.com/r/ethereum/comments/lg2x58/a_research_paper_on_defi_is_published_on_st_louis/,1,0
lg2ygl,1612876030,OKEx integrates .crypto domain-based payments from Unstoppable Domains,,https://www.reddit.com/r/ethereum/comments/lg2ygl/okex_integrates_crypto_domainbased_payments_from/,1,1
lg32z4,1612876460,The Bifrost 2nd vETH Mint Drop is ongoing,[removed],https://www.reddit.com/r/ethereum/comments/lg32z4/the_bifrost_2nd_veth_mint_drop_is_ongoing/,1,1
lg33xi,1612876557,NFT Land Estate Sells for 1.5 M USD!,,https://www.reddit.com/r/ethereum/comments/lg33xi/nft_land_estate_sells_for_15_m_usd/,1,0
lg372l,1612876862,Am I doing the right choice to invest in ETH?,"Hi, I recently started investing in crypto with DOGE and decided that I want to invest in crypto for the long run and obviously doge isnt the right choice. As someone that knows barely nothing about crypto I've seen that ETH is the most talked about crypto without mentioning Bitcoin. Is ETH the competition of Bitcoin? Will ETH increase its value like bitcoin did? Will I regret investing in ETH if I do so?\n\n Thank you",https://www.reddit.com/r/ethereum/comments/lg372l/am_i_doing_the_right_choice_to_invest_in_eth/,1,4
lg399i,1612877062,Bittrex charging extremely high fee for eth withdrawal,[removed],https://www.reddit.com/r/ethereum/comments/lg399i/bittrex_charging_extremely_high_fee_for_eth/,1,0
lg3aa8,1612877165,Having this error while trying to send some DAI.,[removed],https://www.reddit.com/r/ethereum/comments/lg3aa8/having_this_error_while_trying_to_send_some_dai/,1,2
lg3aai,1612877166,Bittrex High eth with-draw fee,[removed],https://www.reddit.com/r/ethereum/comments/lg3aai/bittrex_high_eth_withdraw_fee/,1,0
lg3chh,1612877389,What is crypto lending?,"Hi! My name is Diana and I am a junior marketing specialist, who learns to write educational articles. Could you please check the new one? It's about ETH lending!   \n\n\n[https://coinrabbit.io/blog/what-is-crypto-lending](https://coinrabbit.io/blog/what-is-crypto-lending)",https://www.reddit.com/r/ethereum/comments/lg3chh/what_is_crypto_lending/,1,0
lg3eh8,1612877584,Plz help!!!How to undo my BIOS Mod in my Rx 580.,[removed],https://www.reddit.com/r/ethereum/comments/lg3eh8/plz_helphow_to_undo_my_bios_mod_in_my_rx_580/,1,0
lg3fn3,1612877697,How to undo my bios mod.,[removed],https://www.reddit.com/r/ethereum/comments/lg3fn3/how_to_undo_my_bios_mod/,1,0
lg3g00,1612877731,How to undo my bios mod in RX 580,[removed],https://www.reddit.com/r/ethereum/comments/lg3g00/how_to_undo_my_bios_mod_in_rx_580/,1,0
lg3h3v,1612877837,"I believe in the future of eth, i thinks its going to be as big or bigger than btc eventually. I want to start accepting eth as payment for my business. I curently run a succesful store on wix uskng square merchant services. Can someone walk me through how to begin this process?",[removed],https://www.reddit.com/r/ethereum/comments/lg3h3v/i_believe_in_the_future_of_eth_i_thinks_its_going/,1,15
lg3q6y,1612878698,Decentralized Finance: On Blockchain- and Smart Contract-Based Financial Markets | US Federal Reserve | St.Louis District | Research,,https://www.reddit.com/r/ethereum/comments/lg3q6y/decentralized_finance_on_blockchain_and_smart/,1,0
lg3sqj,1612878928,I... I think we are a cult now... 🤣🤣🤣🤣🤣🤣🤣🤣,,https://www.reddit.com/r/ethereum/comments/lg3sqj/i_i_think_we_are_a_cult_now/,1,0
lg3tm2,1612879006,Ethereum treshold has been increased ...,,https://www.reddit.com/r/ethereum/comments/lg3tm2/ethereum_treshold_has_been_increased/,1,0
lg42jj,1612879759,https://www.diariobitcoin.com/mercados/analisis/ethereum-bitcoin-9-de-febrero/?utm_medium=notificacion,[removed],https://www.reddit.com/r/ethereum/comments/lg42jj/httpswwwdiariobitcoincommercadosanalisisethereumbi/,1,0
lg45h3,1612880008,Ethereum 1559 community call,"Ethereum Cat Herders are inviting the community especially [\#miners](https://twitter.com/hashtag/miners?src=hashtag_click) to address concerns with the EIP-1559. If you've questions, join the call on Feb 26 at 1400 UTC. Details in the [announcement blog](https://medium.com/ethereum-cat-herders/ethereum-1559-community-call-d43d5f0bf909).  \n\n[https://medium.com/ethereum-cat-herders/ethereum-1559-community-call-d43d5f0bf909](https://medium.com/ethereum-cat-herders/ethereum-1559-community-call-d43d5f0bf909)",https://www.reddit.com/r/ethereum/comments/lg45h3/ethereum_1559_community_call/,1,221
lg4851,1612880232,Future of ETH,[removed],https://www.reddit.com/r/ethereum/comments/lg4851/future_of_eth/,1,0
lg4aej,1612880423,do ethereum fees rise lineair with the price?,[removed],https://www.reddit.com/r/ethereum/comments/lg4aej/do_ethereum_fees_rise_lineair_with_the_price/,1,0
lg4bi9,1612880517,Ethereum Daily Analysis 9 February 2021,,https://www.reddit.com/r/ethereum/comments/lg4bi9/ethereum_daily_analysis_9_february_2021/,1,0
lg4ca6,1612880582,"Not sure if this is okay to post, but can someone tell me why my transaction is taking forever? Wallet to Wallet exchange",,https://www.reddit.com/r/ethereum/comments/lg4ca6/not_sure_if_this_is_okay_to_post_but_can_someone/,1,0
lg4cmx,1612880616,To all the people complaining about gas fees,[removed],https://www.reddit.com/r/ethereum/comments/lg4cmx/to_all_the_people_complaining_about_gas_fees/,1,26
lg4e52,1612880746,ETH - Ethereum Daily Analysis 9 February 2021,[deleted],https://www.reddit.com/r/ethereum/comments/lg4e52/eth_ethereum_daily_analysis_9_february_2021/,1,0
lg4frf,1612880887,Future of ETH,Obviously BTC is set to be a great store of value and I believe in other coins like ADA to content with ETH in the long run\n\nHow do you realistically see ETH holding up in the long run (5-10 years) and do you see it eventually reaching levels of BTC?,https://www.reddit.com/r/ethereum/comments/lg4frf/future_of_eth/,1,1
lg4gj3,1612880955,Average speed (30s): 0.00 mh/s - Please help,[removed],https://www.reddit.com/r/ethereum/comments/lg4gj3/average_speed_30s_000_mhs_please_help/,1,0
lg4hpq,1612881047,lolMiner - Average speed (30s): 0.00 mh/s,[removed],https://www.reddit.com/r/ethereum/comments/lg4hpq/lolminer_average_speed_30s_000_mhs/,1,0
lg4mq4,1612881468,This sub has become a cesspool of coindweebs,"At this point this is probably a lost cause but please, for god's sake, take your moon memes and Jordan Belfort cosplay to a different sub. \n\nNo one is begrudging your desire to make money but this isn't the sub for discussing it. There are millions of places both on Reddit and elsewhere to do that. \n\nThe rules in the sidebar are clear, this is a technology sub, not a trading sub.\n\nAre mods going to enforce sub rules? If not, I'd like to know where people are having frank and intellectual discussions about the tech, because it certainly isn't here.",https://www.reddit.com/r/ethereum/comments/lg4mq4/this_sub_has_become_a_cesspool_of_coindweebs/,1,122
lg4pgz,1612881703,Recovering ether from DAO contract address?,I have a DAO contract address that according to etherscan still contains [ethereum.](https://ethereum.Is) Is there anyway for me to recover this?,https://www.reddit.com/r/ethereum/comments/lg4pgz/recovering_ether_from_dao_contract_address/,1,0
lg4q30,1612881752,Let's play a game of chess in Ethereum,"Hi, I created a contract for playing chess in Ethereum. Each move is stored to the blockchain and only valid moves should be possible.\nIt's in Ropsten Network, so gas costs should not be an issue.\n\nSo let's play a game :) more info about how to start a game:\nhttps://eth-chess.netlify.app/",https://www.reddit.com/r/ethereum/comments/lg4q30/lets_play_a_game_of_chess_in_ethereum/,1,18
lg4r46,1612881838,Just put in $1050 in Ethereum,[removed],https://www.reddit.com/r/ethereum/comments/lg4r46/just_put_in_1050_in_ethereum/,1,0
lg4uag,1612882105,Ethereum Becomes a ‘Pain in the Gas’ as Layer 2 Demand Surges,"Paying $10 to send $50 is lunacy, but that is the current state of the Ethereum network.\n\nOH BROTHER!",https://www.reddit.com/r/ethereum/comments/lg4uag/ethereum_becomes_a_pain_in_the_gas_as_layer_2/,1,3
lg4x6e,1612882345,Inflationary price drop after ETH 2.0 hits?,"Just trying to check my logic, here. To my understanding, large supplies of ETH are presently getting tied up in staking and thus removed from the market until such a time as ETH 2.0 comes fully into effect. \n\nSurely, once that happens, the massive flood of coins back into the market and people seeking to capitalize on their staking rewards will cause a huge collapse in price? Or am I missing something?",https://www.reddit.com/r/ethereum/comments/lg4x6e/inflationary_price_drop_after_eth_20_hits/,1,3
lg4xgi,1612882362,Matic Network is now Polygon as Platform Targets Ethereum’s L2 Woes,,https://www.reddit.com/r/ethereum/comments/lg4xgi/matic_network_is_now_polygon_as_platform_targets/,1,1
lg502p,1612882580,Waiting 2 weeks daaaa 0.05 to date a girl,,https://www.reddit.com/r/ethereum/comments/lg502p/waiting_2_weeks_daaaa_005_to_date_a_girl/,1,0
lg52jf,1612882781,Coinmonks Newsletter of the Week,,https://www.reddit.com/r/ethereum/comments/lg52jf/coinmonks_newsletter_of_the_week/,1,0
lg52mo,1612882788,Just got my first full ether!!,[removed],https://www.reddit.com/r/ethereum/comments/lg52mo/just_got_my_first_full_ether/,1,0
lg55ro,1612882999,"Trying my luck at Microcenter! Can't feel my feet, let's hope this was worth it.",,https://www.reddit.com/r/ethereum/comments/lg55ro/trying_my_luck_at_microcenter_cant_feel_my_feet/,1,0
lg5dhn,1612883588,Is it too late?,[removed],https://www.reddit.com/r/ethereum/comments/lg5dhn/is_it_too_late/,1,0
lg5dy9,1612883625,"Yo Elon, where my love at?",,https://www.reddit.com/r/ethereum/comments/lg5dy9/yo_elon_where_my_love_at/,1,0
lg5eiy,1612883668,Is this a good time?,[removed],https://www.reddit.com/r/ethereum/comments/lg5eiy/is_this_a_good_time/,1,0
lg5fhf,1612883746,ETH mining - free ETH,,https://www.reddit.com/r/ethereum/comments/lg5fhf/eth_mining_free_eth/,1,0
lg5i0n,1612883944,BNB/BinanceSmarChain is exploding because of the failure of Ethereum dapps to integrate layer 2.,Users and liquidity are migrating faster than ever to Ethereum alternatives. Why? Because developers on Ethereum optimized for profit generating rather than scaling and long term growth.,https://www.reddit.com/r/ethereum/comments/lg5i0n/bnbbinancesmarchain_is_exploding_because_of_the/,1,3
lg5jaz,1612884046,EF Staking Community Grantee Announcement,,https://www.reddit.com/r/ethereum/comments/lg5jaz/ef_staking_community_grantee_announcement/,1,0
lg5k4e,1612884104,EF ESP: Staking Community Grantee Announcement,,https://www.reddit.com/r/ethereum/comments/lg5k4e/ef_esp_staking_community_grantee_announcement/,1,3
lg5kle,1612884142,Complete newbie trying to figure out how to print a paper wallet from Github,[removed],https://www.reddit.com/r/ethereum/comments/lg5kle/complete_newbie_trying_to_figure_out_how_to_print/,1,0
lg5l3b,1612884182,check out the new addition of CNBC,[removed],https://www.reddit.com/r/ethereum/comments/lg5l3b/check_out_the_new_addition_of_cnbc/,1,0
lg5l9s,1612884196,"Ethereum Breaks $1,800 for the First Time Ever",,https://www.reddit.com/r/ethereum/comments/lg5l9s/ethereum_breaks_1800_for_the_first_time_ever/,1,0
