id,created_utc,title,selftext,full_link,score,comments
h8tqgk,1592140907,EOS or Ethereum Dominating Smart Contracts; Bitcoin Passes JP Morgan Test; Bitcoin Market is REAL,,https://www.reddit.com/r/ethereum/comments/h8tqgk/eos_or_ethereum_dominating_smart_contracts/,1,0
h8tu73,1592141299,"No impermanent loss, single token exposure, Bancor V2 is coming!!!",,https://www.reddit.com/r/ethereum/comments/h8tu73/no_impermanent_loss_single_token_exposure_bancor/,1,0
h8ud01,1592143326,Code is Law? Smart Contracts Explained,,https://www.reddit.com/r/ethereum/comments/h8ud01/code_is_law_smart_contracts_explained/,1,0
h8uij5,1592143878,Airdrop,[removed],https://www.reddit.com/r/ethereum/comments/h8uij5/airdrop/,1,0
h8uni0,1592144413,How is the remote blockchain developers job market right now?,[removed],https://www.reddit.com/r/ethereum/comments/h8uni0/how_is_the_remote_blockchain_developers_job/,1,0
h8uvzu,1592145279,"Stuck with your Cryptos , Sell it on future1exchange",[removed],https://www.reddit.com/r/ethereum/comments/h8uvzu/stuck_with_your_cryptos_sell_it_on_future1exchange/,1,0
h8v61l,1592146263,The Pineapple Fund is raising funds,,https://www.reddit.com/r/ethereum/comments/h8v61l/the_pineapple_fund_is_raising_funds/,1,0
h8w35y,1592149376,Should the community lower the block reward before ETH 2 staking adds more inflation?,[removed],https://www.reddit.com/r/ethereum/comments/h8w35y/should_the_community_lower_the_block_reward/,1,23
h8wh5f,1592150716,Analysis of EIP 1559,[removed],https://www.reddit.com/r/ethereum/comments/h8wh5f/analysis_of_eip_1559/,1,0
h8xdww,1592153960,Any dapp for DeFi implemented Renbtc?,[removed],https://www.reddit.com/r/ethereum/comments/h8xdww/any_dapp_for_defi_implemented_renbtc/,1,0
h8y30k,1592156389,"WMA: Bitcoin price drops after failing to conquer the $10k barrier for the 4th time in a row, while Ethereum decreased by 2.5%, but looking to surge again",,https://www.reddit.com/r/ethereum/comments/h8y30k/wma_bitcoin_price_drops_after_failing_to_conquer/,1,0
h8y78o,1592156793,What would make ETH worth more?,[removed],https://www.reddit.com/r/ethereum/comments/h8y78o/what_would_make_eth_worth_more/,1,0
h8yzve,1592159474,"ETH Multi-Million Dollar Transfer Root Cause, Blackmail?",,https://www.reddit.com/r/ethereum/comments/h8yzve/eth_multimillion_dollar_transfer_root_cause/,2,8
h8znu1,1592161709,Let's trade ETH Volatility!,[removed],https://www.reddit.com/r/ethereum/comments/h8znu1/lets_trade_eth_volatility/,1,0
h91kxh,1592168193,ETH 2.0 potential issues,[removed],https://www.reddit.com/r/ethereum/comments/h91kxh/eth_20_potential_issues/,1,0
h91moq,1592168361,Looking For Speakers,[removed],https://www.reddit.com/r/ethereum/comments/h91moq/looking_for_speakers/,1,0
h9386d,1592173703,Ethereum smart contract,[removed],https://www.reddit.com/r/ethereum/comments/h9386d/ethereum_smart_contract/,1,0
h93kmv,1592174878,DeFi MarketCap Doubles | Defi will lead us out of the bear market,,https://www.reddit.com/r/ethereum/comments/h93kmv/defi_marketcap_doubles_defi_will_lead_us_out_of/,1,0
h93w6b,1592175977,etherchain.org is down?,,https://www.reddit.com/r/ethereum/comments/h93w6b/etherchainorg_is_down/,2,2
h946jb,1592176972,United Zones and how Ethereum can help the CHAZ in Seattle and other zones with decentralized governance,[removed],https://www.reddit.com/r/ethereum/comments/h946jb/united_zones_and_how_ethereum_can_help_the_chaz/,1,0
h94brt,1592177483,How To Build a Verifiably Random Lottery Smart Contract on Ethereum,,https://www.reddit.com/r/ethereum/comments/h94brt/how_to_build_a_verifiably_random_lottery_smart/,1,0
h94rvq,1592179102,Should the community lower the block reward before ETH2 staking adds more inflation?,,https://www.reddit.com/r/ethereum/comments/h94rvq/should_the_community_lower_the_block_reward/,1,3
h957e1,1592180618,"Latest Week in Ethereum News - a concise summary of all things ETH, now with job listings!",,https://www.reddit.com/r/ethereum/comments/h957e1/latest_week_in_ethereum_news_a_concise_summary_of/,16,2
h962g1,1592183852,How dead is PoW on Ethereum?,[removed],https://www.reddit.com/r/ethereum/comments/h962g1/how_dead_is_pow_on_ethereum/,1,0
h96ve7,1592186868,Thought on Ethereum having no hard cap?,[removed],https://www.reddit.com/r/ethereum/comments/h96ve7/thought_on_ethereum_having_no_hard_cap/,1,0
h97jqx,1592189428,Craig Wright Claims To Own Stolen Mt Gox Bitcoin,,https://www.reddit.com/r/ethereum/comments/h97jqx/craig_wright_claims_to_own_stolen_mt_gox_bitcoin/,1,0
h98u9g,1592194953,Is anyone working on Mesh Networks with the Loopring protocol?,,https://www.reddit.com/r/ethereum/comments/h98u9g/is_anyone_working_on_mesh_networks_with_the/,1,0
h99dce,1592197246,Ethereum (ETH) Proof of Stake Scalability and Greater Ideals in its Making,,https://www.reddit.com/r/ethereum/comments/h99dce/ethereum_eth_proof_of_stake_scalability_and/,1,0
h9axi0,1592204153,I need detailed solution to these questions any buddy here can help me please. ive to submit my assignment :(,,https://www.reddit.com/r/ethereum/comments/h9axi0/i_need_detailed_solution_to_these_questions_any/,1,0
h9azod,1592204437,Understanding SEC’s Classification of Crypto-assets: Securities or Commodities?,,https://www.reddit.com/r/ethereum/comments/h9azod/understanding_secs_classification_of_cryptoassets/,1,0
h9b0x1,1592204592,How to make sure that transaction will not fail?,Trying to transfer 0.1 eth and already have 10 failed transactions and list over 5$ on fees..I tried different gwei prices nd gas limits but nothing works,https://www.reddit.com/r/ethereum/comments/h9b0x1/how_to_make_sure_that_transaction_will_not_fail/,1,0
h9btv1,1592208378,L2 Solutions and PoS - Disaster inc.?,[removed],https://www.reddit.com/r/ethereum/comments/h9btv1/l2_solutions_and_pos_disaster_inc/,1,1
h9c6o6,1592210075,Ethermine is distributing the fees!,,https://www.reddit.com/r/ethereum/comments/h9c6o6/ethermine_is_distributing_the_fees/,1,0
h9cbx5,1592210777,Ether stuck in Wallet bc unconfirmed txn (lower account nonce),[removed],https://www.reddit.com/r/ethereum/comments/h9cbx5/ether_stuck_in_wallet_bc_unconfirmed_txn_lower/,1,0
h9cdcr,1592210972,Sorting in Solidity without comparison,,https://www.reddit.com/r/ethereum/comments/h9cdcr/sorting_in_solidity_without_comparison/,1,0
h9cdkw,1592211004,Is there a simple smart contract for bets where the cash is held in escrow until the bet is settled?,[removed],https://www.reddit.com/r/ethereum/comments/h9cdkw/is_there_a_simple_smart_contract_for_bets_where/,1,0
h9cgsg,1592211440,Less than 48 hrs until Live Webinar: The Beginner's Guide to Game Monetisation with Blockchain,,https://www.reddit.com/r/ethereum/comments/h9cgsg/less_than_48_hrs_until_live_webinar_the_beginners/,1,1
h9ciua,1592211709,Vitalik Buterin Said That He Disagrees With Bitcoin Stock-To-Flow,[removed],https://www.reddit.com/r/ethereum/comments/h9ciua/vitalik_buterin_said_that_he_disagrees_with/,1,0
h9cptd,1592212597,Ethereum Miners Will Have Limited Choice With The Release Of Ethereum 2.0,,https://www.reddit.com/r/ethereum/comments/h9cptd/ethereum_miners_will_have_limited_choice_with_the/,1,0
h9d80i,1592214927,Ethereum Options Open Interest Soars 315% — Are Institutions Bullish?,,https://www.reddit.com/r/ethereum/comments/h9d80i/ethereum_options_open_interest_soars_315_are/,1,0
h9dbtn,1592215405,Ethereum 2.0: The Choice Between One’s Own Node and a Staking Service,,https://www.reddit.com/r/ethereum/comments/h9dbtn/ethereum_20_the_choice_between_ones_own_node_and/,1,2
h9dqtx,1592217268,Buterin: Mysterious Ethereum transactions might be blackmailing,,https://www.reddit.com/r/ethereum/comments/h9dqtx/buterin_mysterious_ethereum_transactions_might_be/,1,0
h9dw6s,1592217946,Report Says IPFS and Ethereum Leading the World in Decentralized Web as ETH 2.0 Launch Nears,,https://www.reddit.com/r/ethereum/comments/h9dw6s/report_says_ipfs_and_ethereum_leading_the_world/,1,1
h9dx5b,1592218069,"Facebook's Libra Stablecoin Project, Ethereum (ETH), Near, Bitcoin Cash are Currently Most Active Development Projects: Report",,https://www.reddit.com/r/ethereum/comments/h9dx5b/facebooks_libra_stablecoin_project_ethereum_eth/,1,0
h9dy9l,1592218215,Crypto Trends 15 June 2020 ⚖️ Layer 2 Comparison Framework by Matter Labs 🔦 Baseline Protocol explained by LimeChain 💰 10K ETH Transaction Fees 🚘 Network Congestion + Cost of sending money internationally by Built for Mars,,https://www.reddit.com/r/ethereum/comments/h9dy9l/crypto_trends_15_june_2020_layer_2_comparison/,1,0
h9e4js,1592218992,"Don't Call Me Ethereum's Co-Founder Anymore, Says Cardano's Charles Hoskinson",,https://www.reddit.com/r/ethereum/comments/h9e4js/dont_call_me_ethereums_cofounder_anymore_says/,1,0
h9e7u7,1592219401,Ethereum-dominated crypto market in store this year,,https://www.reddit.com/r/ethereum/comments/h9e7u7/ethereumdominated_crypto_market_in_store_this_year/,1,0
h9eaq0,1592219756,ETH Miners Will Have Little Choice Once Ethereum 2.0 Launches With PoS,,https://www.reddit.com/r/ethereum/comments/h9eaq0/eth_miners_will_have_little_choice_once_ethereum/,1,0
h9eec9,1592220179,"Most traded coins on the top 3 exchanges: Uniswap, Kyber and IDEX.","Currently, Unsiwap is holding a leadership position with a 31.29% market share. It is interesting to take a closer look at the most traded tokens on Uniswap at the moment that generated $144M of the total trading volume.\n\n\#1 - HEX with 40%.\n\n\#2 - USDC with 18%.\n\n\#3 - DAI with 13%.\n\n&amp;#x200B;\n\n![img](5rb9bzu842551)\n\nEven though IDEX lost its position to Uniswap in 2020 it’s growing steadily when compared to January 2020. [Seeing increased trading volume in May. ](https://dappradar.com/blog/the-most-traded-pairs-on-idex-right-now)During the last 30 days, the most traded tokens on IDEX are: \n\n\#1 - UBT with 29%.\n\n\#2 - ESH with 19%.\n\n\#3 - QNT with 7%. \n\nThe total trading volume in the last 30 days on IDEX is $104M.\n\n&amp;#x200B;\n\n![img](6c1ho50n42551)\n\nDuring 2019 and early 2020 [Kyber](https://dappradar.com/app/266/kyber) has been developing and has made its way from 15.36% to a 23.18% market share. Currently holding a 2nd position in the DEX world.\n\nIn the last 30 days, Kyber has generated a trading volume of 66M with the top 3 trading coins on Kyber being:\n\n&amp;#x200B;\n\n![img](zrze41oi62551)\n\n\#1 - USDC with 20%.\n\n\#2 - USDT with 19%.\n\n\#3 - DAI with 17%.\n\nData source: [DappRadar OpenData](https://opendata.dappradar.com/dex-statistics.html)\n\nArticle: [DEX Trading volume exceeds $2.5 Billion](https://dappradar.com/blog/dex-trading-volume-exceeds-2-5-billion)",https://www.reddit.com/r/ethereum/comments/h9eec9/most_traded_coins_on_the_top_3_exchanges_uniswap/,1,0
h9eis0,1592220693,How Gavin Wood and Polkadot are Revolutionizing Blockchain… Again |,,https://www.reddit.com/r/ethereum/comments/h9eis0/how_gavin_wood_and_polkadot_are_revolutionizing/,1,0
