id,created_utc,title,selftext,full_link,score,comments
h9f5fh,1592223276,What’s the Incentive for being validator at genesis block?,[removed],https://www.reddit.com/r/ethereum/comments/h9f5fh/whats_the_incentive_for_being_validator_at/,1,1
h9g2dw,1592226661,"WhaleAlert! 40,000 #ETH (8,958,931 USD) transferred from unknown wallet to #Bithumb",,https://www.reddit.com/r/ethereum/comments/h9g2dw/whalealert_40000_eth_8958931_usd_transferred_from/,1,0
h9gcl4,1592227698,Improve at smart contract security?,[removed],https://www.reddit.com/r/ethereum/comments/h9gcl4/improve_at_smart_contract_security/,1,1
h9gjwt,1592228428,"Ethereum Records $500,000+ in Single-Day Network Fees, Overtaking Bitcoin",,https://www.reddit.com/r/ethereum/comments/h9gjwt/ethereum_records_500000_in_singleday_network_fees/,1,88
h9gwgn,1592229641,Two popular websites to track and monitor the DEFI space,,https://www.reddit.com/r/ethereum/comments/h9gwgn/two_popular_websites_to_track_and_monitor_the/,1,0
h9gyzi,1592229855,Why do people invest in etherum if the supply is unlimited?,[removed],https://www.reddit.com/r/ethereum/comments/h9gyzi/why_do_people_invest_in_etherum_if_the_supply_is/,1,0
h9hegd,1592231257,Fixing the lottery - Play the world's first decentralised non-loss lottery (PoolTogether) and cash out your jackpot using an Ethereum native payment solution (Monolith) - no unnecessary intermediaries needed,,https://www.reddit.com/r/ethereum/comments/h9hegd/fixing_the_lottery_play_the_worlds_first/,1,2
h9hluo,1592231913,What's New in Eth2 - 12 June 2020,,https://www.reddit.com/r/ethereum/comments/h9hluo/whats_new_in_eth2_12_june_2020/,4,0
h9hs04,1592232471,For the ones who haven't seen it: My first Reversible ICO has launched :),,https://www.reddit.com/r/ethereum/comments/h9hs04/for_the_ones_who_havent_seen_it_my_first/,2,8
h9i1op,1592233354,DeepTradeBot Review 2020 – Why Should You Use AI Trading Tools?,,https://www.reddit.com/r/ethereum/comments/h9i1op/deeptradebot_review_2020_why_should_you_use_ai/,1,0
h9ikmg,1592235102,Ethereum Cat Herders Update #23,,https://www.reddit.com/r/ethereum/comments/h9ikmg/ethereum_cat_herders_update_23/,1,1
h9ilis,1592235192,League of Kingdoms: The Future of Blockchain Strategy Games (ETH),,https://www.reddit.com/r/ethereum/comments/h9ilis/league_of_kingdoms_the_future_of_blockchain/,1,0
h9j5yv,1592237091,"Ethermine just distributed the 10,000ETH fee from the block 102419999",[deleted],https://www.reddit.com/r/ethereum/comments/h9j5yv/ethermine_just_distributed_the_10000eth_fee_from/,1,5
h9jnnb,1592238661,"Ethermine just distributed the 10,000ETH fee from the block 10241999",,https://www.reddit.com/r/ethereum/comments/h9jnnb/ethermine_just_distributed_the_10000eth_fee_from/,0,24
h9jwej,1592239450,ICO Token Sale Platform,,https://www.reddit.com/r/ethereum/comments/h9jwej/ico_token_sale_platform/,1,0
h9k0ny,1592239824,Ethereum Mining Revenue Increases by 46% - Blockchain Research,,https://www.reddit.com/r/ethereum/comments/h9k0ny/ethereum_mining_revenue_increases_by_46/,2,3
h9k1ur,1592239929,🎰DeFi777🎰 Roadmap 🛣,,https://www.reddit.com/r/ethereum/comments/h9k1ur/defi777_roadmap/,1,0
h9kb7t,1592240760,Found in the wild,,https://www.reddit.com/r/ethereum/comments/h9kb7t/found_in_the_wild/,1,0
h9klsp,1592241696,Crypto Michaël on the looming Global Financial Crisis and the Future of Bitcoin and Cryptocurrencies,,https://www.reddit.com/r/ethereum/comments/h9klsp/crypto_michaël_on_the_looming_global_financial/,1,0
h9kmmh,1592241765,Transaction confirmations,[removed],https://www.reddit.com/r/ethereum/comments/h9kmmh/transaction_confirmations/,1,0
h9kmof,1592241770,What materials/resources would you recommend for learning cryptoeconomics in-depth?,[removed],https://www.reddit.com/r/ethereum/comments/h9kmof/what_materialsresources_would_you_recommend_for/,1,1
h9lvts,1592245705,EthHub.io is now available in Chinese 白皮書,,https://www.reddit.com/r/ethereum/comments/h9lvts/ethhubio_is_now_available_in_chinese_白皮書/,2,0
h9m74j,1592246702,Wtf is GasToken?,,https://www.reddit.com/r/ethereum/comments/h9m74j/wtf_is_gastoken/,1,2
h9mex4,1592247371,These 5 mistakes will RUIN your Flashloan...,,https://www.reddit.com/r/ethereum/comments/h9mex4/these_5_mistakes_will_ruin_your_flashloan/,1,1
h9n6te,1592249749,🎙️ A Bankless Nation (Part 1),,https://www.reddit.com/r/ethereum/comments/h9n6te/a_bankless_nation_part_1/,1,2
h9nmcw,1592251115,SKALE Mainnet launching June 30th,,https://www.reddit.com/r/ethereum/comments/h9nmcw/skale_mainnet_launching_june_30th/,1,0
h9nn0i,1592251178,Trezor one or Ledger Nano s,[removed],https://www.reddit.com/r/ethereum/comments/h9nn0i/trezor_one_or_ledger_nano_s/,1,0
h9nqc3,1592251458,ARGENT WALLET -DeFi made easy! How to enter a Free Lottery w/ PoolTogether,,https://www.reddit.com/r/ethereum/comments/h9nqc3/argent_wallet_defi_made_easy_how_to_enter_a_free/,1,0
h9oi90,1592253897,"Trying to cancel a stuck transaction (low gas) by sending a higher gas price with the same nonce, but the transaction doesnt show up in etherscan",[removed],https://www.reddit.com/r/ethereum/comments/h9oi90/trying_to_cancel_a_stuck_transaction_low_gas_by/,1,0
h9okau,1592254084,Why do people go crazy for Bitcoin?,,https://www.reddit.com/r/ethereum/comments/h9okau/why_do_people_go_crazy_for_bitcoin/,2,7
h9oo5y,1592254427,Online Workshop: Learn Smart Contract Programming in 1 Hour,[removed],https://www.reddit.com/r/ethereum/comments/h9oo5y/online_workshop_learn_smart_contract_programming/,1,0
h9orzm,1592254766,The Economics of Eth2,,https://www.reddit.com/r/ethereum/comments/h9orzm/the_economics_of_eth2/,1,10
h9qb0k,1592259832,Fed says that it is going to start buying individual corporate bonds,,https://www.reddit.com/r/ethereum/comments/h9qb0k/fed_says_that_it_is_going_to_start_buying/,1,0
h9qc5f,1592259934,Why Bidao will rule Defi?!,[removed],https://www.reddit.com/r/ethereum/comments/h9qc5f/why_bidao_will_rule_defi/,1,0
h9qcnn,1592259978,The Fed says it is going to start buying individual corporate bonds,,https://www.reddit.com/r/ethereum/comments/h9qcnn/the_fed_says_it_is_going_to_start_buying/,1,0
h9qexi,1592260185,Uniswap V2 now has more Liquidity than V1! Go Uniswap!,,https://www.reddit.com/r/ethereum/comments/h9qexi/uniswap_v2_now_has_more_liquidity_than_v1_go/,1,30
h9qic7,1592260481,"Stocks drunk, DeFi sober - Market Monday",,https://www.reddit.com/r/ethereum/comments/h9qic7/stocks_drunk_defi_sober_market_monday/,1,0
h9qzhl,1592261997,"Sold all my BTC for Ethereum, Vitalik you better not mess this up for me bb",,https://www.reddit.com/r/ethereum/comments/h9qzhl/sold_all_my_btc_for_ethereum_vitalik_you_better/,1,0
h9s8s5,1592266144,my transaction is pending because of low gas fee - help,[removed],https://www.reddit.com/r/ethereum/comments/h9s8s5/my_transaction_is_pending_because_of_low_gas_fee/,1,3
h9u8te,1592273088,Host an ethereum 1.0 node question,[removed],https://www.reddit.com/r/ethereum/comments/h9u8te/host_an_ethereum_10_node_question/,1,3
h9uoot,1592274673,Ethereum or Theta?,[removed],https://www.reddit.com/r/ethereum/comments/h9uoot/ethereum_or_theta/,1,0
h9v154,1592275916,A new standard?,[removed],https://www.reddit.com/r/ethereum/comments/h9v154/a_new_standard/,1,0
h9vmfz,1592278018,"EOS Suffering A Drought of Developers, Dapps, And Coding.",,https://www.reddit.com/r/ethereum/comments/h9vmfz/eos_suffering_a_drought_of_developers_dapps_and/,1,1
h9wb63,1592280644,Examining the Status of Stablecoin Minting and Burning Activities,,https://www.reddit.com/r/ethereum/comments/h9wb63/examining_the_status_of_stablecoin_minting_and/,1,0
h9wkgf,1592281696,Innosilicon A10 Pro 500MH/S Ethash Miner,[removed],https://www.reddit.com/r/ethereum/comments/h9wkgf/innosilicon_a10_pro_500mhs_ethash_miner/,1,0
h9xhq5,1592285475,One of the best bitcoin investment platforms in the world,,https://www.reddit.com/r/ethereum/comments/h9xhq5/one_of_the_best_bitcoin_investment_platforms_in/,1,0
h9zdvu,1592294003,SecuX V20/W20 unboxing - Initial Setup &amp; Cross-Platform Hardware Wallet Transaction for ETH,,https://www.reddit.com/r/ethereum/comments/h9zdvu/secux_v20w20_unboxing_initial_setup_crossplatform/,1,0
h9zgrh,1592294355,Deploying with Libraries on Remix-IDE,,https://www.reddit.com/r/ethereum/comments/h9zgrh/deploying_with_libraries_on_remixide/,1,1
h9zkln,1592294789,"90+ Solidity Resource List: A curated list of awesome Solidity resources, libraries, tools, plugins, tutorials, books, and, examples.",,https://www.reddit.com/r/ethereum/comments/h9zkln/90_solidity_resource_list_a_curated_list_of/,1,0
ha0p4e,1592299975,Prysmatic Labs Launches New Test Network Onyx For Ethereum 2.0,,https://www.reddit.com/r/ethereum/comments/ha0p4e/prysmatic_labs_launches_new_test_network_onyx_for/,1,0
