id,created_utc,title,selftext,full_link,score,comments
lj2g6v,1613229801,"Ethereum 2.0 Simple Explanation - How To Stake ETH, Beacon Chain, Sharding and More",,https://www.reddit.com/r/ethereum/comments/lj2g6v/ethereum_20_simple_explanation_how_to_stake_eth/,1,0
lj2pkf,1613230665,Kitchendo.co is now accepting Ethereum🎁,Fun kitchen gadgets webshop is now accepting $eth as payment method. \n\nGood thing of this webshop is all taxes incl. and world wide shipping free.\n\n[Fun Kitchen Gadgets](http://kitchendo.co),https://www.reddit.com/r/ethereum/comments/lj2pkf/kitchendoco_is_now_accepting_ethereum/,1,2
lj2s54,1613230900,Can I have help poking metamask to add this to their browser?,,https://www.reddit.com/r/ethereum/comments/lj2s54/can_i_have_help_poking_metamask_to_add_this_to/,1,0
lj2ugb,1613231109,Best place to buy ETH? Best option for storing it? (I know this has been asked a lot sorry),"Getting back in the crypto game, and going heavy on ETH. I know these questions are asked all the time but the answers change frequently and I can't seem to find a good recent post about it, so:\n\n* Where is the best place to buy Ethereum? I will probably start with Coinbase, but I'm wondering what the latest potential options for ""decentralized"" purchasing are? And let's say I was to buy a large sum at once, is there somewhere that might have lower fees than Coinbase? And/or is there somewhere I can buy it that isn't going to sell/provide my PII to the government or other regulatory authorities?\n* Assuming I do use Coinbase, what's the best storage method for when I decide to pull my coins off the exchange? Probably going to get a hardware wallet. I had stored a small amount on Metamask before but I'm reading really mixed things about that now.\n\nThank you all for your patience :)",https://www.reddit.com/r/ethereum/comments/lj2ugb/best_place_to_buy_eth_best_option_for_storing_it/,1,10
lj3240,1613231784,where can i buy one a the best price and dont get scam !!!!!!!,,https://www.reddit.com/r/ethereum/comments/lj3240/where_can_i_buy_one_a_the_best_price_and_dont_get/,1,0
lj32vv,1613231854,Buy Crypto Currency quick and easy,[removed],https://www.reddit.com/r/ethereum/comments/lj32vv/buy_crypto_currency_quick_and_easy/,1,0
lj35qg,1613232085,Grayscale Investment Holdings 👀👇🤑,,https://www.reddit.com/r/ethereum/comments/lj35qg/grayscale_investment_holdings/,1,0
lj39cj,1613232382,Dapp Token (contract) Transfer to hardware wallets,"Hey everybody, I've got some liquidity tied up in various on-chain wallets. I got a ledger which I want for anything I plan on hodl or not touch. I'd like to transfer contract tokens say for aave and compound, to the hardware wallet. Is this possible via a simple send transaction? or do I need to withdraw and deposit.",https://www.reddit.com/r/ethereum/comments/lj39cj/dapp_token_contract_transfer_to_hardware_wallets/,1,2
lj39ze,1613232439,Mad about Gas Fees?,"Full disclosure, I own ETH, BTC, XMR and about 2 dozen other coins.  Until recently, I had most of my portfolio in ETH and BTC; however, after reading a ton of negative posts about gas fees, and the switch from proof of work to proof of stake in this sub and countless others, I did some more research on the topic. \n\nDuring that research, I stumbled upon a really good video called Sound Money Safe Mode. For anyone not familiar with it, I highly recommend you check out the slides on Scarcity (26:06) and Unwanted Scarcity (34:36). These slides cover asymptotic zero annualized inflation and silicon economies of scale. In short, they show the major shortfalls in design for ETH and BTC as compared to XMR.\n\nNow, before you all downvote me and say I’m just here to push another coin, please read my opening statement again. As an investor, I believe in diversification, and I hope you’ll check this out and keep an open mind.\n\nhttps://www.youtube.com/watch?v=aC9Uu5BUxII",https://www.reddit.com/r/ethereum/comments/lj39ze/mad_about_gas_fees/,1,32
lj3l5z,1613233401,"New to crypto/eth. If I were to buy $500 of ETH on pro.coinbase, would I lose a lot of my eth by transferring it to another wallet (trezor)",[removed],https://www.reddit.com/r/ethereum/comments/lj3l5z/new_to_cryptoeth_if_i_were_to_buy_500_of_eth_on/,1,0
lj40fi,1613234718,BTT + TRX + BinanceChain = 🚀 ?,[removed],https://www.reddit.com/r/ethereum/comments/lj40fi/btt_trx_binancechain/,1,0
lj429x,1613234878,Essential Ethereum Tools &amp; Apps you want to check out,,https://www.reddit.com/r/ethereum/comments/lj429x/essential_ethereum_tools_apps_you_want_to_check/,1,0
lj44yy,1613235114,Is mining ethereum still profitable in 2021?,"I’m new to mining and have been reading that it has been getting more difficult to mine eth. \n\nIf i were to build a 6 gpu rig, can I still expect to be profitable?",https://www.reddit.com/r/ethereum/comments/lj44yy/is_mining_ethereum_still_profitable_in_2021/,1,9
lj4d6c,1613235788,What is ethereum? And what is it’s purpose?,[removed],https://www.reddit.com/r/ethereum/comments/lj4d6c/what_is_ethereum_and_what_is_its_purpose/,1,0
lj4e5r,1613235860,Are the gas fees killing ETH ? That and where ETH is heading live on stream today,,https://www.reddit.com/r/ethereum/comments/lj4e5r/are_the_gas_fees_killing_eth_that_and_where_eth/,1,0
lj4fd6,1613235958,"""ETH, of Course"" -- Norm Macdonald","When asked which he prefers between ETH, DOT, and ADA.  :)\n\nThey are beginning to understand...\n\n[https://twitter.com/normmacdonald?lang=en](https://twitter.com/normmacdonald?lang=en)",https://www.reddit.com/r/ethereum/comments/lj4fd6/eth_of_course_norm_macdonald/,1,34
lj4kzw,1613236435,Gene Simmon's of rock group Kiss tweets about ETH today,[removed],https://www.reddit.com/r/ethereum/comments/lj4kzw/gene_simmons_of_rock_group_kiss_tweets_about_eth/,1,0
lj4p3o,1613236792,Need NFTs,[removed],https://www.reddit.com/r/ethereum/comments/lj4p3o/need_nfts/,1,0
lj4zvu,1613237683,Decentralize business opportunity,"Lately i’ve been brainstorming ideas for a new business, I have a Entrepreneurial Competition coming up at my University (any college student can compete DM me if interested). \nAnyways, i have found a lot of flaws with current business models, and think a lot of them could be solved by moving to a decentralized platform, obviously this isn’t a fix all, and would only work in certain industries RN, and perhaps specific markets. What kind of advice can you offer? and is anyone else considering using crypto beyond the exchanges, and NFTs?",https://www.reddit.com/r/ethereum/comments/lj4zvu/decentralize_business_opportunity/,1,1
lj53sb,1613238023,Max Value for Ether,[removed],https://www.reddit.com/r/ethereum/comments/lj53sb/max_value_for_ether/,1,0
lj5436,1613238050,Smart contracts and blockchain,[removed],https://www.reddit.com/r/ethereum/comments/lj5436/smart_contracts_and_blockchain/,1,0
lj55rv,1613238194,Uniswap insane fees,[removed],https://www.reddit.com/r/ethereum/comments/lj55rv/uniswap_insane_fees/,1,0
lj58xz,1613238460,Noob whose looking to invest for the long haul needs any help you’re kind enough to offer.,[removed],https://www.reddit.com/r/ethereum/comments/lj58xz/noob_whose_looking_to_invest_for_the_long_haul/,1,1
lj5dbw,1613238816,To the moon,[removed],https://www.reddit.com/r/ethereum/comments/lj5dbw/to_the_moon/,1,0
lj5eq8,1613238935,What are the best Youtube videos to send my friends about DeFi?,[removed],https://www.reddit.com/r/ethereum/comments/lj5eq8/what_are_the_best_youtube_videos_to_send_my/,1,1
lj5g08,1613239047,What happens if I use a low Gas price?,[removed],https://www.reddit.com/r/ethereum/comments/lj5g08/what_happens_if_i_use_a_low_gas_price/,1,0
lj5irv,1613239256,Proposal to End Eternal Pending Transactions?,[removed],https://www.reddit.com/r/ethereum/comments/lj5irv/proposal_to_end_eternal_pending_transactions/,1,0
lj5k25,1613239353,Pending Transactions?,[removed],https://www.reddit.com/r/ethereum/comments/lj5k25/pending_transactions/,1,0
lj5nei,1613239612,How to retire on Ethereum with ETH price prediction,[removed],https://www.reddit.com/r/ethereum/comments/lj5nei/how_to_retire_on_ethereum_with_eth_price/,1,0
lj5rg2,1613239940,Proof-of-Stake Motivation questions,[removed],https://www.reddit.com/r/ethereum/comments/lj5rg2/proofofstake_motivation_questions/,1,0
lj5xpc,1613240465,How do you minimize gas fees when trying to do anything on the Ethereum network?,"Hi wonder if anyone has advice. I’m trying to stake/do defi things using meta mask (or trust wallet), but gas fees are like $150-200 minimum per transaction.  How are people getting around this? \n\nAre there off-chain solutions to this problem? Are only those doing biz in large amounts ie. $50k+ actually able to participate right now bc of the high fees.  \n\nOddly enough, when I try transferring between different wallets, the fee is much less only $5. Are these different transaction types that come w it’s own gas fees? \n\nAny help would be appreciated!",https://www.reddit.com/r/ethereum/comments/lj5xpc/how_do_you_minimize_gas_fees_when_trying_to_do/,1,23
lj5ycq,1613240514,"Join the WallStreetBets CSGO 1v1 Tournament with 25,000$ in rewards",,https://www.reddit.com/r/ethereum/comments/lj5ycq/join_the_wallstreetbets_csgo_1v1_tournament_with/,1,0
lj60uw,1613240724,Update - Ethereum Daily Forecast 14 February 2021 - ETH,,https://www.reddit.com/r/ethereum/comments/lj60uw/update_ethereum_daily_forecast_14_february_2021/,1,0
lj69ip,1613241443,Air-gapped multi currency cold wallet?,[removed],https://www.reddit.com/r/ethereum/comments/lj69ip/airgapped_multi_currency_cold_wallet/,1,0
lj69yb,1613241479,Keeper Dao helps with gas fees?,[removed],https://www.reddit.com/r/ethereum/comments/lj69yb/keeper_dao_helps_with_gas_fees/,1,0
lj6a66,1613241497,What to do with random ERC-20 token,[removed],https://www.reddit.com/r/ethereum/comments/lj6a66/what_to_do_with_random_erc20_token/,1,0
lj6gld,1613242028,Join the WallStreetBets Crypto Pumps - Investing! Discord Server!,,https://www.reddit.com/r/ethereum/comments/lj6gld/join_the_wallstreetbets_crypto_pumps_investing/,1,0
lj737r,1613243930,#SupportEIP1559 - Protect Ethereum’s transaction user experience from attack by a cartel of miners. Educational resource and unfortunately necessary counterpoint to detrimental #StopEIP1559 initiate being led by Flexpool.,,https://www.reddit.com/r/ethereum/comments/lj737r/supporteip1559_protect_ethereums_transaction_user/,1,0
lj73rz,1613243978,#SupportEIP1559 - Protect Ethereum’s transaction user experience from attack by a cartel of miners. Educational resource and unfortunately necessary counterpoint to the detrimental #StopEIP1559 initiative being led by Flexpool.,,https://www.reddit.com/r/ethereum/comments/lj73rz/supporteip1559_protect_ethereums_transaction_user/,1,505
lj7796,1613244262,Eth mining rig with one GPU?,"I just upgraded my pc’s GPU and now have a spare 1080ti that I’d like to use to build a rig. Every build guide that I’ve found, however, requires like 6-12 gpus. Is it possible to build a rig with only 1 card? \n\nI also don’t have to pay for electricity and have all the other parts I’d need laying around from other projects, so my starting and operational costs will be $0. Profitability isn’t really my concern, just want to know if I can build a rig with the stuff I have available and become more familiar with the technology!",https://www.reddit.com/r/ethereum/comments/lj7796/eth_mining_rig_with_one_gpu/,1,18
lj7vx1,1613246305,Mobile read/watch only wallet for ETH?,I’m able to find quite a few of watch only wallets for Bitcoin but I can seem to find ANY for ETH.\n\nCan have other features but the only want I’m concerned about is mobile and watch/read only\n\nThanks,https://www.reddit.com/r/ethereum/comments/lj7vx1/mobile_readwatch_only_wallet_for_eth/,1,7
lj828r,1613246803,Best on/off ramps for crypto in the US,[removed],https://www.reddit.com/r/ethereum/comments/lj828r/best_onoff_ramps_for_crypto_in_the_us/,1,0
lj8akr,1613247480,Possible nother break north on classic here. Sorry no sub for,,https://www.reddit.com/r/ethereum/comments/lj8akr/possible_nother_break_north_on_classic_here_sorry/,1,0
lj8fae,1613247876,Classic das go bananas! Holy shit,,https://www.reddit.com/r/ethereum/comments/lj8fae/classic_das_go_bananas_holy_shit/,1,2
lj8gim,1613247975,ETC AND ETH,[removed],https://www.reddit.com/r/ethereum/comments/lj8gim/etc_and_eth/,1,0
lj8gvy,1613248007,Gonna blow!!!,,https://www.reddit.com/r/ethereum/comments/lj8gvy/gonna_blow/,1,4
lj8iwk,1613248178,Ethereum poker chips 🚀,,https://www.reddit.com/r/ethereum/comments/lj8iwk/ethereum_poker_chips/,1,0
lj8st5,1613248999,“V” rare,,https://www.reddit.com/r/ethereum/comments/lj8st5/v_rare/,1,0
lj9c5e,1613250554,I want to reinstall Windows on my pc (clean / from scratch) do i need to back up my ETH in MetaMask ? Or is it on the server and i only need to login to it after ?,see title,https://www.reddit.com/r/ethereum/comments/lj9c5e/i_want_to_reinstall_windows_on_my_pc_clean_from/,1,3
lj9cl6,1613250589,Are gas fees ever going to decrease again before ETH2?,[removed],https://www.reddit.com/r/ethereum/comments/lj9cl6/are_gas_fees_ever_going_to_decrease_again_before/,1,0
