id,created_utc,title,selftext,full_link,score,comments
lkhc81,1613407190,Satoshi Street Bets (SSB) - needs our help! ETH &gt; BSC,[removed],https://www.reddit.com/r/ethereum/comments/lkhc81/satoshi_street_bets_ssb_needs_our_help_eth_bsc/,1,0
lkhck1,1613407215,First NFT Up!,,https://www.reddit.com/r/ethereum/comments/lkhck1/first_nft_up/,1,0
lkhe5t,1613407341,What is Ethereum ? To beginners and not quite,"Hello redditors,\n\nWe’ve just published a new article dedicated to Ethereum on D.Center – I paste it here hoping it could be useful to beginners interested in the asset, and maybe even to some crypto amateurs who could discover new things 😊\n\n***The blockchain aiming at “decentralizing everything”, Ethereum brings its benefits to numerous domains by enabling complex smart contracts and Dapps.***\n\nDiverse use cases and the absence of an easily customizable blockchain helped formulate a need for a multi-purpose blockchain, on which a wide array of applications could be built. The first to come with a solution was a Russian-Canadian developer Vitalik Buterin, who submitted the Ethereum concept to the crypto community in late 2013. After a successful crowdfunding in 2014 the platform went live by July 2015.\n\nThe major innovation of Ethereum that distinguished it from Bitcoin was a wide range of possible **smart contracts** that could be coded on its blockchain. A smart contract is basically a computer program registered on a blockchain that is executed by the EVM (Ethereum Virtual Machine) when a transaction is sent to its address; the results of a program execution are themselves being stored on a blockchain. The **DApps** (decentralized applications) using these smart contracts enjoy all security and independence benefits of a blockchain: program execution is entrusted to a decentralized network instead of a single third party.\n\n## Ethereum consensus and fees\n\nIn order to incentivize Ethereum nodes to run smart contracts, fees are paid for every transaction. **These fees are paid in a special unit called gas and depend on the amount of computations to be done**. Gas can be bought with Ethereum native currency Ether (ETH), the price being decided by the market according to the supply/demand ratio. \n\nEthereum uses a Proof-of-Work consensus, like Bitcoin, although it has some specificities of its own: hashing function is Ethash and a block is added every 15 seconds. Ethers are generated as a miner’s reward for adding a block, however there’s no hard cap on their total emission. Current yearly network issuance is approximately 4.5%, and will be reduced with ETH 2.0\n\n## Ethereum tokens\n\nEthereum is also a very convenient platform for the creation of tokens - digital units circulating on a blockchain and representing a certain value assigned to them by their creator. Its **ERC20** (fungible) and **ERC721** (non-fungible) tokens have become the standards in the industry and are being used extensively.\n\n## DAO\n\nEthereum can be used to build Decentralized Autonomous Organizations (DAO). A **DAO is an organization with governance defined by smart contracts registered on a blockchain**. A DAO allows a group of persons to interact using an open source protocol with auto-executing qualities; this protocol and the associated smart contracts formalize the organisation’s operation rules. Once deployed, a DAO is independent from its creator and isn’t controlled by an entity, but rather by a consensus between its participants, according to its blockchain-registered code. The owners of tokens associated with a DAO are assigned voting rights and are often rewarded for their participation in the DAO’s governance.\n\nThe transparency and immutability of the blockchain make such organizations difficult to corrupt, proposing an alternative model to centralized organizations. There are lots of DAO in the DeFi (Decentralized Finance), the most famous being Maker DAO - a lending platform managing the dollar-pegged stablecoin DAI.\n\n## ETH 2.0 and Casper \n\nEthereum relying on a PoW consensus, it has its standard disadvantages: the blockchain is rather slow, costly and energy consuming. To overcome these drawbacks an important update has been planned since Ethereum conception: initially called Serenity and now mostly referred to as **ETH 2.0**, this update has been released in December 2020. It has been deployed on a parallel chain first, in order to conduct all the necessary tests before becoming the main Ethereum chain.\n\nETH 2.0 relies on a consensus called **Casper**, which is a version of the PoS consensus: validator nodes stake a minimum amount of 32 ETH to be able to propose a block or to validate it. The new consensus would also improve the blockchain’s scalability, allowing a blocktime of just a couple of seconds.\n\nETH 2.0 will also affect the annual Ether emission rate, which will be significantly decreased, or even become negative.\n\n## Ethereum today\n\nEthereum is the most popular blockchain for DApps development, with over 5000 DApps built on it. It is a major blockchain for the Decentralized Finance, or DeFi, with an important new metrics - TVL (Total Value Locked), representing the collateral locked in different types of DeFi applications - exceeding $50 BN worth of crypotoassets. \n\nETH 2.0 is a major ambition for Vitalik Buterin. According to the Ethereum creator, the 4 major problems that need to be solved to push Ethereum to the next level are privacy, consensus safety, smart contract safety, and  scalability. Some would add a governance issue to the list, for its role in blockchain’s life is crucial. \n\nThe original post is available at [https://d.center/en/explore/ethereum](https://d.center/en/explore/ethereum)",https://www.reddit.com/r/ethereum/comments/lkhe5t/what_is_ethereum_to_beginners_and_not_quite/,1,73
lkhkhw,1613407841,"Please turn off your rigs if you live in Texas, Oregon or any state hit with power outages due to snow storms.",I am asking all my mining brothers and sisters to shutdown their rigs if you live in a state with power outages due to snow storm. \n\nWe will be able to mine another day. Save the power for those who need it and will freeze to death.\n\nThanks for listening.,https://www.reddit.com/r/ethereum/comments/lkhkhw/please_turn_off_your_rigs_if_you_live_in_texas/,1,58
lkhnz1,1613408108,Why a lot of hardcore Bitcoiners really hate ETH?,Some people over at r/Bitcoin seem to really hate ETH. They think it's a sham and will soon become worthless.\n\nWhat do you think?,https://www.reddit.com/r/ethereum/comments/lkhnz1/why_a_lot_of_hardcore_bitcoiners_really_hate_eth/,1,59
lkhrfi,1613408387,Lost Eth?,I moved a large amount of Eth from my Coinbase to my new blockfi account. It’s been about 20 minutes and nothing has shown up- I did double check the address though. Is it lost forever or am I just paranoid?,https://www.reddit.com/r/ethereum/comments/lkhrfi/lost_eth/,1,12
lkhudy,1613408591,Is CryptoKitties still a thing?,CryptoKitties was once the driving force of ETH transactions and what is going on with them now?,https://www.reddit.com/r/ethereum/comments/lkhudy/is_cryptokitties_still_a_thing/,1,10
lkhurs,1613408619,What are this 8893 transactions associated with the genesis block of ethereum?,,https://www.reddit.com/r/ethereum/comments/lkhurs/what_are_this_8893_transactions_associated_with/,1,2
lkhvrr,1613408690,My First NFT,,https://www.reddit.com/r/ethereum/comments/lkhvrr/my_first_nft/,1,0
lkhxqs,1613408839,Investing in Etherium,[removed],https://www.reddit.com/r/ethereum/comments/lkhxqs/investing_in_etherium/,1,0
lki17o,1613409111,Celer cBridge: Fast and Low-cost Value Transfer Network for an Interconnected Layer2 and Layer1 Future," We are thrilled to introduce Celer cBridge, a multi-chain network that enables instant, low-cost and ANY-to-ANY value transfers within and across Ethereum’s layer-2 chains, Ethereum main chain and in the future, other layer-1s, and layer-2 on top of those other layer-1 chains.\n\nA summary of some immediate use cases of Celer cBridge are：\n\n\- Instant and low-cost multi-hop value transfer between multiple different layer-2 networks on Ethereum, including Optimistic Rollups, such as Optimism, Arbitrum and Celer Rollups, and PoS Sidechains such as Matic and SKALE, without going through the underlying layer-1 blockchain. \n\n\- Instant entering and existing layer2 from/to Ethereum layer-1 without long delay. \n\n\- Two-way bridging between layer-2 on one blockchain and completely different layer-1 blockchains without going through the corresponding root layer-1 at all. \n\n\- Seamless connection to Celer State Channel Network in any single chain with full cross-chain routing support.\n\nRead More here: [https://blog.celer.network/2021/02/15/celer-cbridge-fast-and-low-cost-value-transfer-network-for-an-interconnected-layer2-and-layer1-future/](https://blog.celer.network/2021/02/15/celer-cbridge-fast-and-low-cost-value-transfer-network-for-an-interconnected-layer2-and-layer1-future/)",https://www.reddit.com/r/ethereum/comments/lki17o/celer_cbridge_fast_and_lowcost_value_transfer/,1,0
lki2ch,1613409194,n00b gas question,[removed],https://www.reddit.com/r/ethereum/comments/lki2ch/n00b_gas_question/,1,0
lki36o,1613409262,⟠ Latest Week in Ethereum News,,https://www.reddit.com/r/ethereum/comments/lki36o/latest_week_in_ethereum_news/,1,0
lki7ti,1613409627,Made my first NFT,[removed],https://www.reddit.com/r/ethereum/comments/lki7ti/made_my_first_nft/,1,0
lkibv6,1613409944,Question/Concern surround Proof of Stake.,"So I may have some misunderstandings here and that's why I'm posting to hopefully get some things cleared up.   \n\n\nFrom my understanding becoming a validator through staking is prohibitively expensive, it costs 32ETH where as most cheaper mining rigs can be built for 2-3ETH, which in turn raises the barrier for entry for your average Joe to become a validator which in turn can cause the network to become more centralized.   \n\n\nA few people have stated that PoS pools will form which will allow people to stake as little as 1USD in ETH and not have those people require the upfront 32ETH. What I'm struggling with I suppose is the fact that PoS pools have a much greater risk profile when compared to mining pools. While a mining pool uses your hash to mine and then pays you a share when they achieve a block, if a mining pool acts maliciously and chooses not to pay you your share you can pull your hash rate and either mine solo or find a different pool. Since most pools pay out every 0.05 ETH or 0.1 ETH the losses from joining a bad acting pool are minimal, the pool also doesn't get your hardware so you can also always resell the mining hardware if desired.  \n\n\nWhen it comes to a staking pool you are trusting your currency with an unknown entity, in order to earn the 0.05 ETH I used as an example for the mining pool you would have to risk 0.625 ETH for the duration of a year to earn the 8% interest and earn the 0.05ETH. At any point during that year the staking pool could decide to go dark or run off with the ETH being held without much recourse. How do I stop staking pools from behaving badly and how do I trust them? \n\nUltimately I want a trustless system, but if in order for the system to be trustless I have to stake myself isn't the 32ETH requirement prohibitively expensive?",https://www.reddit.com/r/ethereum/comments/lkibv6/questionconcern_surround_proof_of_stake/,1,12
lkicnq,1613410008,"Ethereum Genesis: This artwork is mathematically linked to Ethereum's genesis block, turning one of the most important blocks in crypto history into a uniquely colorful NFT.",,https://www.reddit.com/r/ethereum/comments/lkicnq/ethereum_genesis_this_artwork_is_mathematically/,1,0
lkivyt,1613411501,(Almost) Everything you need to know about Optimistic Rollup,,https://www.reddit.com/r/ethereum/comments/lkivyt/almost_everything_you_need_to_know_about/,1,3
lkj23a,1613411977,$3.1MN NFTX Transaction for NFT Index Fund,,https://www.reddit.com/r/ethereum/comments/lkj23a/31mn_nftx_transaction_for_nft_index_fund/,1,0
lkj55t,1613412182,"Is it safe to send with ""Gas price extremely low""?",[removed],https://www.reddit.com/r/ethereum/comments/lkj55t/is_it_safe_to_send_with_gas_price_extremely_low/,1,2
lkj8g8,1613412433,Ethereum Daily Forecast 16 February 2021 - ETH,,https://www.reddit.com/r/ethereum/comments/lkj8g8/ethereum_daily_forecast_16_february_2021_eth/,1,0
lkjeoz,1613412891,"Grayscale Ethereum Trust Recently Bought Over 50,000 ETH in One Day",,https://www.reddit.com/r/ethereum/comments/lkjeoz/grayscale_ethereum_trust_recently_bought_over/,1,0
lkjo0t,1613413614,"Zero balance after restoring my Keepkey, derivation path?",[removed],https://www.reddit.com/r/ethereum/comments/lkjo0t/zero_balance_after_restoring_my_keepkey/,1,0
lkjqr7,1613413817,Competitors in the tokenization field,[removed],https://www.reddit.com/r/ethereum/comments/lkjqr7/competitors_in_the_tokenization_field/,1,0
lkjuw9,1613414135,First NFT Project: Crypto-Cards History of Cryptocurrency (on Opensea),[removed],https://www.reddit.com/r/ethereum/comments/lkjuw9/first_nft_project_cryptocards_history_of/,1,1
lkjw7m,1613414240,Why are L2-chains not deployed on the Beacon Chain?,[removed],https://www.reddit.com/r/ethereum/comments/lkjw7m/why_are_l2chains_not_deployed_on_the_beacon_chain/,1,0
lkkb7u,1613415405,RTX 3060 12GB Graphics Card Discussions/Questions,"Hi everyone. What is your take on the new RTX 3060 set to be released February 25th 6AM PST for mining ETH? I missed out on all of the other RTX 30 series batches and want to make sure I don't miss this one.   \n\n\nI am fairly new to the mining scene and I don't know how to predict the RTX 3060 performances compared to the other ones. I read that ''when **choosing** the **best GPU** for **mining** you should consider core clock, memory, memory clock, power connector, power draw and outputs''. Does boost clock memory count or only base clock? I am thinking that this 3060 will match or surpass a RTX 3070 having a higher memory? See specs in picture.   \n\n\nI didn't take time to compare with AMD equivalent but here's what I found. Is this true according to you? Where would you place the new RTX 3060? : \n\n \n\n* Best Overall. NVIDIA GeForce RTX 3060 Ti. See at Best Buy.\n* Best Value. **AMD Radeon RX** 5700 XT. $544 at Amazon.\n* Best Performance. NVIDIA GeForce RTX 3090. See at Amazon.\n* Best Budget. NVIDIA GeForce GTX 1660 SUPER. $312 at Dell.  \n\n\nAlso, having missed out on the other releases, from your own experiences with other RTX models, do you know at what time stores like Newegg and BestBuy make purchases available? Is it before the launch time? Exactly at launch time? Or shortly after the launch time?",https://www.reddit.com/r/ethereum/comments/lkkb7u/rtx_3060_12gb_graphics_card_discussionsquestions/,1,7
lkkc4z,1613415474,Pi Network; The First Digital Currency You Can Mine On Your Phone.,[removed],https://www.reddit.com/r/ethereum/comments/lkkc4z/pi_network_the_first_digital_currency_you_can/,1,1
lkkf6j,1613415690,"Teddy Killerz Art Collection Marketplace on OpenSea: Buy, sell, and explore digital assets",,https://www.reddit.com/r/ethereum/comments/lkkf6j/teddy_killerz_art_collection_marketplace_on/,1,0
lkkl51,1613416115,Glaring Issue with ETH2.0,The staking rewards for ETH2.0 do not come in the form of ETH but rather the ETH2.0 token which is a completely different asset. The ETH2.0 rewards token doesn't necessarily have the proper infrastructure built around it for us (Investors) to be able to sell on the market. \n\nDo this not raise any concerns for people?,https://www.reddit.com/r/ethereum/comments/lkkl51/glaring_issue_with_eth20/,1,10
lkkm7b,1613416197,I moved .057 ETH from CoinBase to Kraken. Only .04263 showed up in Kraken. What happened to the ETH? The gas price wasn't nearly that high.,[removed],https://www.reddit.com/r/ethereum/comments/lkkm7b/i_moved_057_eth_from_coinbase_to_kraken_only/,1,0
lkkqqk,1613416537,"This is great news! Last week, 80% of inflows, or about $175 million, went into Ethereum investment products and we have never seen institutional interest like that before.”",,https://www.reddit.com/r/ethereum/comments/lkkqqk/this_is_great_news_last_week_80_of_inflows_or/,1,0
lkksid,1613416678,I want to build a casino game on Ethereum and issue an ERC20 token for it. Where should I begin to learn to build that? Thanks!,,https://www.reddit.com/r/ethereum/comments/lkksid/i_want_to_build_a_casino_game_on_ethereum_and/,1,2
lkkvsk,1613416928,Fee's,[removed],https://www.reddit.com/r/ethereum/comments/lkkvsk/fees/,1,0
lkkxlh,1613417067,Join the Giga Chad's Coin Pump n' Dump Fraternity Discord Server!,,https://www.reddit.com/r/ethereum/comments/lkkxlh/join_the_giga_chads_coin_pump_n_dump_fraternity/,1,1
lkl2up,1613417470,Impact to ethereum if.....,What would the impact to ethereum if vitalik buterin passed away?,https://www.reddit.com/r/ethereum/comments/lkl2up/impact_to_ethereum_if/,1,3
lkl6xh,1613417788,Stream pending transactions with ethers.js -- a step-by-step guide,,https://www.reddit.com/r/ethereum/comments/lkl6xh/stream_pending_transactions_with_ethersjs_a/,1,0
lkl7oj,1613417843,Clever DeFi Founder Bryan Legend Explains Insider Details About CLVA Token,,https://www.reddit.com/r/ethereum/comments/lkl7oj/clever_defi_founder_bryan_legend_explains_insider/,1,0
lkloq8,1613419146,Should tx fees stop me adding ethereum to my portfolio?,Seeing a lot about high fees to move ethereum around. It seems to be a problem I’ve seen cropping up recently in discussions around ethereum.\n\nI understand this will get some biased responses but I’d like to hear your take.,https://www.reddit.com/r/ethereum/comments/lkloq8/should_tx_fees_stop_me_adding_ethereum_to_my/,1,14
lklqhm,1613419266,I am brand new to crypto currency,[removed],https://www.reddit.com/r/ethereum/comments/lklqhm/i_am_brand_new_to_crypto_currency/,1,0
lkm04u,1613419976,I wanted to make something very special for my first NFT...,[removed],https://www.reddit.com/r/ethereum/comments/lkm04u/i_wanted_to_make_something_very_special_for_my/,1,0
lkm453,1613420283,Crypto punks for Sale ~$14k Floor,,https://www.reddit.com/r/ethereum/comments/lkm453/crypto_punks_for_sale_14k_floor/,1,6
lkm494,1613420292,Coinbase - Pending Ethereum Transaction,Not completely new to crypto but not sure what’s going on with my transfer from coinbase to crypto.com wallet. It is showing pending and 0 confirmations (last 2 hours with no change). I’m assuming it’s due to how busy things are?? I don’t normally move crypto out of one wallet and to another so I’m curious as to what the issue is. I transferred the same as in the past but this time I’m getting pending with 0 confirmations. Can anyone shed some light on the issue? TIA,https://www.reddit.com/r/ethereum/comments/lkm494/coinbase_pending_ethereum_transaction/,1,4
lkm6m8,1613420467,True example of EIP1559 and its effect on the average user Bob.,[removed],https://www.reddit.com/r/ethereum/comments/lkm6m8/true_example_of_eip1559_and_its_effect_on_the/,1,0
lkmeqd,1613421085,ETH transaction troubles,[removed],https://www.reddit.com/r/ethereum/comments/lkmeqd/eth_transaction_troubles/,1,0
lkmpq6,1613421940,n00b question,[removed],https://www.reddit.com/r/ethereum/comments/lkmpq6/n00b_question/,1,0
lkmtwh,1613422258,Coin Bureau : Litentry Hidden Coin To Put on Your Radar 💎,,https://www.reddit.com/r/ethereum/comments/lkmtwh/coin_bureau_litentry_hidden_coin_to_put_on_your/,1,5
lkmvd5,1613422373,Bitbat crypto coin airdrop,,https://www.reddit.com/r/ethereum/comments/lkmvd5/bitbat_crypto_coin_airdrop/,1,0
lkn1f2,1613422833,We are discussing this one CryptoExchange.chat,,https://www.reddit.com/r/ethereum/comments/lkn1f2/we_are_discussing_this_one_cryptoexchangechat/,1,0
lkn6oh,1613423214,"Individual cryptokitties have sold for more than $300,000 a piece, some say.",,https://www.reddit.com/r/ethereum/comments/lkn6oh/individual_cryptokitties_have_sold_for_more_than/,1,0
lknhb7,1613424028,Gpu mining,[removed],https://www.reddit.com/r/ethereum/comments/lknhb7/gpu_mining/,1,0
