id,created_utc,title,selftext,full_link,score,comments
lmah5u,1613612253,2k is looking is the next step!! ✨,,https://www.reddit.com/r/ethereum/comments/lmah5u/2k_is_looking_is_the_next_step/,1,2
lmah9m,1613612261,Coinbase staking invite,[removed],https://www.reddit.com/r/ethereum/comments/lmah9m/coinbase_staking_invite/,1,0
lmajl6,1613612462,Tokamak welcomes Talken as a new staking operator,,https://www.reddit.com/r/ethereum/comments/lmajl6/tokamak_welcomes_talken_as_a_new_staking_operator/,1,1
lmajss,1613612480,Turn me up,[removed],https://www.reddit.com/r/ethereum/comments/lmajss/turn_me_up/,1,0
lmak6n,1613612514,There's no way this isn't coming back down tomorrow,,https://www.reddit.com/r/ethereum/comments/lmak6n/theres_no_way_this_isnt_coming_back_down_tomorrow/,1,20
lmap09,1613612942,Ethereum B lining to $2000 👀,[removed],https://www.reddit.com/r/ethereum/comments/lmap09/ethereum_b_lining_to_2000/,1,0
lmaru6,1613613185,STAKING ETH ON KRAKEN,[removed],https://www.reddit.com/r/ethereum/comments/lmaru6/staking_eth_on_kraken/,1,0
lmaygp,1613613737,Ethereum’s Favorite Lossless Lottery Drops POOL token,,https://www.reddit.com/r/ethereum/comments/lmaygp/ethereums_favorite_lossless_lottery_drops_pool/,1,0
lmb4e4,1613614236,Need advice for selling ETH for USD via US Bank,[removed],https://www.reddit.com/r/ethereum/comments/lmb4e4/need_advice_for_selling_eth_for_usd_via_us_bank/,1,5
lmb6aw,1613614403,How can I help the ETH 2.0 network without staking?,"It feels like this should be an easy thing to answer but, maybe I’m vastly misunderstanding things. Is there a way to “help” in ETH 2.0 outside of PoS work that maybe doesn’t generate much/any ETH but reduces network congestion?\n\nIf I pool with others it seems like I’m not able to run a node on my own to help add to the network’s bandwidth, and I just kinda wanted to contribute to the de-centralization and health of Ethereum, because the more I learn about Ethereum the more I like it. But it seems like there is a big financial barrier to entry to “support” it. For ETH 1.0 I could run a node that might make a few cents a month and end up costing me money, which would be fine by me but it seems like ETH 1.0 will go away once phase 2 is hit...\n\nWill there be some other no “cost” method to help the 2.0 network out or did I essentially miss the bus?\n\nThanks, in advance. I’m still quite new to crypto so if there is an obviously and clearly spelled out answer to this somewhere, my apologies (sorry for the ramble)!",https://www.reddit.com/r/ethereum/comments/lmb6aw/how_can_i_help_the_eth_20_network_without_staking/,1,10
lmb8w8,1613614637,Moving Ethereum out of robinhood,[removed],https://www.reddit.com/r/ethereum/comments/lmb8w8/moving_ethereum_out_of_robinhood/,1,0
lmb9go,1613614686,Push Boys!,,https://www.reddit.com/r/ethereum/comments/lmb9go/push_boys/,1,0
lmba7a,1613614753,They are suppressing ETH,Everyone knows ETH should've skyrocketed but didn't.  What's holding ETH back?\n\n[https://www.youtube.com/watch?v=UmDT19dNkI0](https://www.youtube.com/watch?v=UmDT19dNkI0)\n\n&amp;#x200B;\n\nFight the power; support EIP-1159 for future of ETH 2.0.\n\n\#EIP-1159,https://www.reddit.com/r/ethereum/comments/lmba7a/they_are_suppressing_eth/,1,3
lmbdao,1613615026,Ethereum’s Favorite Lossless Lottery PoolTogether Drops Token,,https://www.reddit.com/r/ethereum/comments/lmbdao/ethereums_favorite_lossless_lottery_pooltogether/,1,6
lmbdra,1613615068,Anyone got a penny?,,https://www.reddit.com/r/ethereum/comments/lmbdra/anyone_got_a_penny/,1,12
