id,created_utc,title,selftext,full_link,score,comments
lmbhlu,1613615417,Ethereum Demand HIGHEST Ever (#1 Reason Price Isn't BUDGING),,https://www.reddit.com/r/ethereum/comments/lmbhlu/ethereum_demand_highest_ever_1_reason_price_isnt/,1,1
lmbhmw,1613615419,"Ethereum Crosses Above $1,900 for First Time After Number of Whale Addresses Hit Their Own All-Time High",,https://www.reddit.com/r/ethereum/comments/lmbhmw/ethereum_crosses_above_1900_for_first_time_after/,1,0
lmbi1n,1613615456,Continuation of Bull Case for Ethereum...,[removed],https://www.reddit.com/r/ethereum/comments/lmbi1n/continuation_of_bull_case_for_ethereum/,1,0
lmbin4,1613615506,Can I buy Qeth instead of going through and getting Ethereum?,,https://www.reddit.com/r/ethereum/comments/lmbin4/can_i_buy_qeth_instead_of_going_through_and/,1,1
lmbkoz,1613615681,Bezerker🦧🍿,,https://www.reddit.com/r/ethereum/comments/lmbkoz/bezerker/,1,0
lmblzs,1613615796,This is my kind of bedtime story!,,https://www.reddit.com/r/ethereum/comments/lmblzs/this_is_my_kind_of_bedtime_story/,1,0
lmbqz1,1613616229,ETH to where?,[removed],https://www.reddit.com/r/ethereum/comments/lmbqz1/eth_to_where/,1,0
lmbyol,1613616907,"I used palpal for the first time to buy crypto, but now its not available in my region?",,https://www.reddit.com/r/ethereum/comments/lmbyol/i_used_palpal_for_the_first_time_to_buy_crypto/,1,9
lmbzgj,1613616981,parity seed phrase not working in metamask?,[removed],https://www.reddit.com/r/ethereum/comments/lmbzgj/parity_seed_phrase_not_working_in_metamask/,1,0
lmc93d,1613617814,"What does an actual ETH coin look like? I see either all gold, all silver or a mix of both. Which one is it?",,https://www.reddit.com/r/ethereum/comments/lmc93d/what_does_an_actual_eth_coin_look_like_i_see/,1,0
lmcf3f,1613618351,Does anyone else think ETH will hit 2000 tonight 👀?,[removed],https://www.reddit.com/r/ethereum/comments/lmcf3f/does_anyone_else_think_eth_will_hit_2000_tonight/,1,0
lmcg2n,1613618442,"Cryptocurrency: Complete Bitcoin, Ethereum, Altcoins! (8 HR)",,https://www.reddit.com/r/ethereum/comments/lmcg2n/cryptocurrency_complete_bitcoin_ethereum_altcoins/,1,0
lmcncb,1613619092,IS Every Crypto art is NFT but every NFT is not crypto art?,,https://www.reddit.com/r/ethereum/comments/lmcncb/is_every_crypto_art_is_nft_but_every_nft_is_not/,1,0
lmcpiq,1613619286,Sent ETH from Binance to Coinsquare and now it's Gone!,[removed],https://www.reddit.com/r/ethereum/comments/lmcpiq/sent_eth_from_binance_to_coinsquare_and_now_its/,1,0
lmcq6z,1613619347,Will excessive GAS prices hinder ethereum as a platform? Why or why not?,[removed],https://www.reddit.com/r/ethereum/comments/lmcq6z/will_excessive_gas_prices_hinder_ethereum_as_a/,1,0
lmcsjl,1613619565,"Is it too late to buy more ETH ? I ducked up, yesterday it was perfect to buy",:(,https://www.reddit.com/r/ethereum/comments/lmcsjl/is_it_too_late_to_buy_more_eth_i_ducked_up/,1,10
lmd3mw,1613620583,Mining while DRIVING and CHARGING!?,Imagine driving a Tesla and earning money for yourself but ALSO ELON. ITS a small compact processor that can be installed and it will run 24/7 due to the fact that it will run and mine coins while you drive and while it's plugged in charging at home. I'm telling you it's CRAZY. HE IS SMART AS FUCK.,https://www.reddit.com/r/ethereum/comments/lmd3mw/mining_while_driving_and_charging/,1,4
lmdbq5,1613621300,Will it ever hit 10k?,[removed],https://www.reddit.com/r/ethereum/comments/lmdbq5/will_it_ever_hit_10k/,1,0
lmddh4,1613621459,ETH Gas Fee swallowing Life Savings,[removed],https://www.reddit.com/r/ethereum/comments/lmddh4/eth_gas_fee_swallowing_life_savings/,1,0
lmdfbl,1613621628,OUR COMMUNITY,[removed],https://www.reddit.com/r/ethereum/comments/lmdfbl/our_community/,1,0
lmdndo,1613622378,If I put some ETH on Celsius or BlockFi and Ethereum forks do I loose my ETH 2?,"Would like to earn a little interest before moving over and staking on ETH 2 with a validator node, but if there is a fork would you be out your coins?",https://www.reddit.com/r/ethereum/comments/lmdndo/if_i_put_some_eth_on_celsius_or_blockfi_and/,1,3
lmdrhk,1613622752,Rocket Pool — ETH2 Staking Protocol Part 2,,https://www.reddit.com/r/ethereum/comments/lmdrhk/rocket_pool_eth2_staking_protocol_part_2/,1,7
lme7uk,1613624318,Seeking Yield in the Crypto Market,,https://www.reddit.com/r/ethereum/comments/lme7uk/seeking_yield_in_the_crypto_market/,1,0
lmeeei,1613624904,"Forget Bitcoin, DeFi Is The Next Game In Town (Cryptocurrency:BTC-USD)",,https://www.reddit.com/r/ethereum/comments/lmeeei/forget_bitcoin_defi_is_the_next_game_in_town/,1,0
lmejwm,1613625417,When Eth 2.0 launches does that mean there will be a new coin?,[removed],https://www.reddit.com/r/ethereum/comments/lmejwm/when_eth_20_launches_does_that_mean_there_will_be/,1,0
lmem5i,1613625634,Will it hit 10k?,[removed],https://www.reddit.com/r/ethereum/comments/lmem5i/will_it_hit_10k/,1,0
lmetz3,1613626398,Is this smart contract possible?,[removed],https://www.reddit.com/r/ethereum/comments/lmetz3/is_this_smart_contract_possible/,1,2
lmeva7,1613626521,MicroStrategy Will Now Buy $1 Billion In Additional Bitcoin,,https://www.reddit.com/r/ethereum/comments/lmeva7/microstrategy_will_now_buy_1_billion_in/,1,0
lmey7z,1613626806,Should I buy ETH???,"I’m new, I’m wondering if I should be. I keep thinking about how I could have bought in at $900 but I didn’t lol. I am having bad FOMo with Bitcoin as well. Thoughts ??",https://www.reddit.com/r/ethereum/comments/lmey7z/should_i_buy_eth/,1,25
lmf578,1613627405,I'm holding,,https://www.reddit.com/r/ethereum/comments/lmf578/im_holding/,1,0
lmfh5d,1613628507,Just got my first coin!,[removed],https://www.reddit.com/r/ethereum/comments/lmfh5d/just_got_my_first_coin/,1,0
lmfmld,1613629005,"Can someone explain what ""friction free banking"" means?",[removed],https://www.reddit.com/r/ethereum/comments/lmfmld/can_someone_explain_what_friction_free_banking/,1,0
lmfruh,1613629477,What’s the best mining software?,"I’ve heard and tested NiceHash.\n\nBut also read everywhere that Ethermine is more lucrative.\n\nAnd honestly with BTC value being so high already I would much rather earn myself some ETH instead of BTC.\nI get that it’s never too late to buy BTC but it only takes basic probability maths to bet on ETH right now.\n\nMoreover, I will simply never have enough money to buy 1 BTC.\n\nAnyway — do you guys have any recommendation?",https://www.reddit.com/r/ethereum/comments/lmfruh/whats_the_best_mining_software/,1,4
lmfwpd,1613629980,What am I missing; doesn’t ETH make everything else redundant?,"Hello 👋🏻 ETH enthusiasts. I was hoping those of you who are more knowledgeable in the space could give me arguments against my current thinking that eth has already “won” the crypto game. I say that because to me it seems like there is nothing it can’t do, akin to Superman. \n\nYes fees are bad, and eth 2.0 is a ways away, but  let’s assume everything works out as envisioned. \n\nWhat can eth not do then? What is its kryptonite and what alternative blockchains are aiming to solve those issues? Does it even matter that an alt may do one particular thing better when thinking of the future value of eth?",https://www.reddit.com/r/ethereum/comments/lmfwpd/what_am_i_missing_doesnt_eth_make_everything_else/,1,167
