id,created_utc,title,selftext,full_link,score,comments
lwt3ph,1614775735,Mark Cuban wants to introduce ticketing on blockchain as NFT's to NBA - GET protocol is already doing it on Ethereum,<not selftext available>,https://www.reddit.com/r/ethereum/comments/lwt3ph/mark_cuban_wants_to_introduce_ticketing_on/,1,0
lwteld,1614776670,"Are we still allowed to whore our crypto art on here? Well if so I minted my first NFT! I'm still confused about Gas, why it cost $35... and I bet nobody buys it, but why not give it a shot right? 🤩",,https://www.reddit.com/r/ethereum/comments/lwteld/are_we_still_allowed_to_whore_our_crypto_art_on/,0,2
lwteur,1614776691,Hey everyone! My NFT “une chat dans une baignoire” from my first collection “new reality collection 1”. Let me know what you think?,,https://www.reddit.com/r/ethereum/comments/lwteur/hey_everyone_my_nft_une_chat_dans_une_baignoire/,2,2
lwtfca,1614776736,EMSA,[deleted],https://www.reddit.com/r/ethereum/comments/lwtfca/emsa/,1,0
lwti6v,1614777006,How to decode data from etherium/binance block chain for developers,[removed],https://www.reddit.com/r/ethereum/comments/lwti6v/how_to_decode_data_from_etheriumbinance_block/,1,0
lwtjh0,1614777121,Decode data for DApps etherium/binance,[removed],https://www.reddit.com/r/ethereum/comments/lwtjh0/decode_data_for_dapps_etheriumbinance/,1,0
lwtlj2,1614777295,How to decode data from Ethereum block chain for developers,[removed],https://www.reddit.com/r/ethereum/comments/lwtlj2/how_to_decode_data_from_ethereum_block_chain_for/,1,0
lwu4r5,1614778879,Everybody talks about the NFT. What's that?,,https://www.reddit.com/r/ethereum/comments/lwu4r5/everybody_talks_about_the_nft_whats_that/,1,0
lwu8el,1614779151,PLEASE HELP!!! FRIEND ACCOUNT HACKED!!,[removed],https://www.reddit.com/r/ethereum/comments/lwu8el/please_help_friend_account_hacked/,1,0
lwu8ux,1614779192,Can Thrash BTC in the next coming weeks🤡(Check out ETHBTC Chart),,https://www.reddit.com/r/ethereum/comments/lwu8ux/can_thrash_btc_in_the_next_coming_weekscheck_out/,1,0
lwuswq,1614780740,"How is it possible to buy ETH directly, but not Bitcoin?",<not selftext available>,https://www.reddit.com/r/ethereum/comments/lwuswq/how_is_it_possible_to_buy_eth_directly_but_not/,1,0
lwutw3,1614780818,Gas fees to blockfi.,[removed],https://www.reddit.com/r/ethereum/comments/lwutw3/gas_fees_to_blockfi/,1,0
lwux33,1614781068,How many shards could the beacon chain serve without getting too big?,"As I understand it, the only downside of adding additional shards to Ethereum 2 is that the beacon chain gets bigger. Because it stores metadata about every block of every shard.\n\nInitially, there will be 64 shards. Will this use up the maximum amount of resources that Ethereum 2 should consume on a single node? Or is there room left to grow? If so, how much?",https://www.reddit.com/r/ethereum/comments/lwux33/how_many_shards_could_the_beacon_chain_serve/,4,6
lwv5qd,1614781746,Top 10 NFT Crypto Projects You Should Know,,https://www.reddit.com/r/ethereum/comments/lwv5qd/top_10_nft_crypto_projects_you_should_know/,1,0
lwvd5j,1614782306,A Guide to The Top 5 Ethereum 2.0 (ETH 2.0) Staking Pools,[removed],https://www.reddit.com/r/ethereum/comments/lwvd5j/a_guide_to_the_top_5_ethereum_20_eth_20_staking/,1,0
lwvg1j,1614782528,Solidity v0.8.2 is out! It adds an optimizer stage that can inline small amounts of code to save gas and provides more means to work with code documentation by exporting inline comments and allowing custom natspec tags.,,https://www.reddit.com/r/ethereum/comments/lwvg1j/solidity_v082_is_out_it_adds_an_optimizer_stage/,3,2
lwvqew,1614783321,Recover Ether wallet (MEW),[removed],https://www.reddit.com/r/ethereum/comments/lwvqew/recover_ether_wallet_mew/,1,0
lww6zl,1614784508,Yesterdays NFTuesday Free NFT giveaway! brought to you by KevinOnEarth999. Follow for more opportunities to get yourself a piece of the metaverse! Subscribe for your chance to win!,,https://www.reddit.com/r/ethereum/comments/lww6zl/yesterdays_nftuesday_free_nft_giveaway_brought_to/,1,0
lww7dn,1614784535,Yesterdays NFTuesday Free NFT giveaway! brought to you by KevinOnEarth999. Follow for more opportunities to get yourself a piece of the metaverse! Subscribe for your chance to win!,,https://www.reddit.com/r/ethereum/comments/lww7dn/yesterdays_nftuesday_free_nft_giveaway_brought_to/,0,0
lwwkz9,1614785543,NFTs keeping ethereum afloat,[removed],https://www.reddit.com/r/ethereum/comments/lwwkz9/nfts_keeping_ethereum_afloat/,0,0
lwx1xc,1614786748,Enjin announces new NFT scaling solution JumpNet,[removed],https://www.reddit.com/r/ethereum/comments/lwx1xc/enjin_announces_new_nft_scaling_solution_jumpnet/,1,0
lwx2j8,1614786793,Looking for a temporary exchange to buy ETH for a validator,[removed],https://www.reddit.com/r/ethereum/comments/lwx2j8/looking_for_a_temporary_exchange_to_buy_eth_for_a/,1,0
lwx3d5,1614786853,"Enjin to Tackle Soaring Gas Fees, Scaling With New Blockchain Products",,https://www.reddit.com/r/ethereum/comments/lwx3d5/enjin_to_tackle_soaring_gas_fees_scaling_with_new/,19,10
lwxrck,1614788501,Where can I sell my HODLETH license plates?,[removed],https://www.reddit.com/r/ethereum/comments/lwxrck/where_can_i_sell_my_hodleth_license_plates/,1,0
lwxtne,1614788661,Sorare is amazing!!,[removed],https://www.reddit.com/r/ethereum/comments/lwxtne/sorare_is_amazing/,1,0
lwy8us,1614789730,Zero Knowledge Episode 170: Hardware for ZKPs &amp; VDFs with Supranational,,https://www.reddit.com/r/ethereum/comments/lwy8us/zero_knowledge_episode_170_hardware_for_zkps_vdfs/,2,0
lwygxc,1614790305,The Disadvantages of Synthetic Assets,,https://www.reddit.com/r/ethereum/comments/lwygxc/the_disadvantages_of_synthetic_assets/,1,0
lwymjg,1614790695,CryptoKitties Trading Volume Suddenly Grows 2300%,,https://www.reddit.com/r/ethereum/comments/lwymjg/cryptokitties_trading_volume_suddenly_grows_2300/,2,0
lwypjo,1614790884,Identity Management with Numio,,https://www.reddit.com/r/ethereum/comments/lwypjo/identity_management_with_numio/,5,0
lwywe5,1614791337,What does ethereum use the processing power for?,"Me and a friend have two different ideas one of us thinks it's used for data mining the other thinks it's for creating compute power that can be rented out kind of like with a super computer. Which one of us is closer or are we both wrong and it is just arbitrary tasks to limit how fast you can mine ethereum, or something else entirely?",https://www.reddit.com/r/ethereum/comments/lwywe5/what_does_ethereum_use_the_processing_power_for/,0,14
lwyxes,1614791407,"I took out a crypto loan today, denominated in euros, with crypto as collateral. And (hopefully) this week I am going to a dealership in Calgary to buy a used car with it. They are okay with getting the entire amount in crypto.",[removed],https://www.reddit.com/r/ethereum/comments/lwyxes/i_took_out_a_crypto_loan_today_denominated_in/,561,440
lwyxtf,1614791435,Can I sync a wallet between devices?,[removed],https://www.reddit.com/r/ethereum/comments/lwyxtf/can_i_sync_a_wallet_between_devices/,0,0
lwyyai,1614791471,Is there anything stopping Ethereum from introducing the technological advancements from Solana to improve transactions rate and reduce fees?,[removed],https://www.reddit.com/r/ethereum/comments/lwyyai/is_there_anything_stopping_ethereum_from/,1,0
lwz7v5,1614792141,"Geth v1.10.0 out! Snapshots, snap sync, pruning and more!",,https://www.reddit.com/r/ethereum/comments/lwz7v5/geth_v1100_out_snapshots_snap_sync_pruning_and/,90,59
lwzbhv,1614792398,Interview by Swiss Prof. in Distributed Ledger Technology (Blockchain) / FinTech about DeFi and Smart Contracts,"Hi everyone,\n\nI saw an interesting interview with Prof. Schär about the disruption potential and application prospect of DeFi's and Smart Contracts in one of Switzerland biggest news.\n\nInterview in German: [https://www.watson.ch/wirtschaft/wissen/813917630-krypto-experte-schaer-defi-ist-hoechst-interessant-aber-extrem-riskant](https://www.watson.ch/wirtschaft/wissen/813917630-krypto-experte-schaer-defi-ist-hoechst-interessant-aber-extrem-riskant)\n\nGoogle Translate: [https://translate.google.com/translate?sl=de&amp;tl=en&amp;u=https://www.watson.ch/wirtschaft/wissen/813917630-krypto-experte-schaer-defi-ist-hoechst-interessant-aber-extrem-riskant](https://translate.google.com/translate?sl=de&amp;tl=en&amp;u=https://www.watson.ch/wirtschaft/wissen/813917630-krypto-experte-schaer-defi-ist-hoechst-interessant-aber-extrem-riskant)\n\nThe University of Basel will also open up its blockchain lectures to the public in the future!",https://www.reddit.com/r/ethereum/comments/lwzbhv/interview_by_swiss_prof_in_distributed_ledger/,4,0
lwzq53,1614793426,my coins disappeared??? I bought with uniswap for almost 1000usd but cant see my coin ???,[removed],https://www.reddit.com/r/ethereum/comments/lwzq53/my_coins_disappeared_i_bought_with_uniswap_for/,1,0
lwzrf4,1614793520,my coin disappeared after bought with uniswap and portis wallet any idea why?,[removed],https://www.reddit.com/r/ethereum/comments/lwzrf4/my_coin_disappeared_after_bought_with_uniswap_and/,1,0
lwzs8c,1614793565,my coin disappeared using uniswap and portis,[removed],https://www.reddit.com/r/ethereum/comments/lwzs8c/my_coin_disappeared_using_uniswap_and_portis/,1,0
lwzw7m,1614793835,NFT ART (CRYPTO ART) 🔥,,https://www.reddit.com/r/ethereum/comments/lwzw7m/nft_art_crypto_art/,1,0
lwzxdt,1614793915,"I’m trying to upload artwork to OpenSea but the fees are too high, is there anyway around this?","I want to upload artwork to OpenSea but when I try and upload there is a “free transaction” that must occur to allow OpenSea to sell items on my account. The fee for this transaction is currently 91 USD worth of ethereum, is this reasonable, and is there a way to get away with paying a lower fee? I currently have 46 USD allocated to paying this fee is there anyway to get it that low?",https://www.reddit.com/r/ethereum/comments/lwzxdt/im_trying_to_upload_artwork_to_opensea_but_the/,2,4
lwzzib,1614794072,Next best investment?,,https://www.reddit.com/r/ethereum/comments/lwzzib/next_best_investment/,1,0
lx066q,1614794546,App to track ETH network fees?,"Obviously this is a known/common issue, but is there an iOS app that monitors and tracks ETH network fees and can let you know when it falls beneath a set threshold?\n\nIf not, there should be. Just give me 2% of royalties.",https://www.reddit.com/r/ethereum/comments/lx066q/app_to_track_eth_network_fees/,4,2
lx07zr,1614794677,Ethereum taking from one address to another.,[removed],https://www.reddit.com/r/ethereum/comments/lx07zr/ethereum_taking_from_one_address_to_another/,1,0
lx085o,1614794688,My Ethereum Wallet and Rarible?,[removed],https://www.reddit.com/r/ethereum/comments/lx085o/my_ethereum_wallet_and_rarible/,1,0
lx09xr,1614794810,What will ETH hit by end of year? DISCUSSION!,[removed],https://www.reddit.com/r/ethereum/comments/lx09xr/what_will_eth_hit_by_end_of_year_discussion/,1,0
lx0akf,1614794857,Can someone please explain; are Ethereum transactions validated through nodes similar to Bitcoin? However transactions are validated does this work across ethereum based dapps and tokens? For example is Braves BAT token validated on the ethereum network by nodes?,,https://www.reddit.com/r/ethereum/comments/lx0akf/can_someone_please_explain_are_ethereum/,3,4
lx0bgf,1614794918,What will Ethereum be by end of the year?,[removed],https://www.reddit.com/r/ethereum/comments/lx0bgf/what_will_ethereum_be_by_end_of_the_year/,1,0
lx0f10,1614795163,Best gamess on Ethereum?,[removed],https://www.reddit.com/r/ethereum/comments/lx0f10/best_gamess_on_ethereum/,1,0
lx0f13,1614795163,"EthHub Weekly #155: EIP-1559 community call, Tether settlement, Optimistic Ethereum launches in March, dYdX layer 2 enters alpha, MEV explorer released and Vitalik’s proposal to remove gas token minting",,https://www.reddit.com/r/ethereum/comments/lx0f13/ethhub_weekly_155_eip1559_community_call_tether/,7,0
lx0lqm,1614795626,My first NFT was listed on Foundation today!,,https://www.reddit.com/r/ethereum/comments/lx0lqm/my_first_nft_was_listed_on_foundation_today/,1,0
