id,created_utc,title,selftext,full_link,score,comments
mfnabp,1617016725,"I have a ""blocked transaction""",[removed],https://www.reddit.com/r/ethereum/comments/mfnabp/i_have_a_blocked_transaction/,1,0
mfnb2u,1617016819,Newbie question about coinbase,"Hi,\n\nFairly newbie question here, but I hear a lot of talk about different kinds of wallets. \n\nIs there anything wrong with just keeping everything inside coinbase? Will I need to search for another wallet eventually if my coins grow? \n\nThanks for the help",https://www.reddit.com/r/ethereum/comments/mfnb2u/newbie_question_about_coinbase/,1,11
mfnef5,1617017145,"layer 2 degate social round is coming, 8pm UTC+8. starts in 30 min.",,https://www.reddit.com/r/ethereum/comments/mfnef5/layer_2_degate_social_round_is_coming_8pm_utc8/,1,0
mfo6xa,1617019922,"Non-fungible Tokens (NFTs): Cryptokitties Reinvented, Short-Term Hype or Approaching Revolution?",,https://www.reddit.com/r/ethereum/comments/mfo6xa/nonfungible_tokens_nfts_cryptokitties_reinvented/,1,0
mfoh68,1617020854,Say My Name,,https://www.reddit.com/r/ethereum/comments/mfoh68/say_my_name/,1,42
mfos27,1617021882,Ride the wave. 🌊🌊🚀🚀🚀,,https://www.reddit.com/r/ethereum/comments/mfos27/ride_the_wave/,1,0
mfouks,1617022129,Total newbie: Where is my half ethereum gone?,[removed],https://www.reddit.com/r/ethereum/comments/mfouks/total_newbie_where_is_my_half_ethereum_gone/,1,8
mfpawk,1617023606,Join the #GalaxyFarm by Router Protocol. Stake 1: Farm 5. Great rewards in 5 tokens. $ROUTE $MATIC $EASY $OM $RAZOR. http://galaxyfarm.routerprotocol.com,,https://www.reddit.com/r/ethereum/comments/mfpawk/join_the_galaxyfarm_by_router_protocol_stake_1/,1,0
mfpbe9,1617023652,Visa Will Start Settling Transactions With Crypto Partners In USDC On Ethereum,,https://www.reddit.com/r/ethereum/comments/mfpbe9/visa_will_start_settling_transactions_with_crypto/,1,1
mfpmnf,1617024655,"Love is... Hits, it means he loves!",,https://www.reddit.com/r/ethereum/comments/mfpmnf/love_is_hits_it_means_he_loves/,1,0
mfpo0i,1617024777,"Thanks Visa, nice job hodlers",,https://www.reddit.com/r/ethereum/comments/mfpo0i/thanks_visa_nice_job_hodlers/,1,1
mfpphi,1617024912,Is there any legit reason Ethereum wouldn't succeed? I can't think of one. Just curious,[removed],https://www.reddit.com/r/ethereum/comments/mfpphi/is_there_any_legit_reason_ethereum_wouldnt/,1,0
mfpvqt,1617025490,Does using multiple L2 solutions require an Eth deposits in each platform?,[removed],https://www.reddit.com/r/ethereum/comments/mfpvqt/does_using_multiple_l2_solutions_require_an_eth/,1,0
mfpwxr,1617025601,The Ethereum Value Proposition: A Beginner's Guide,[removed],https://www.reddit.com/r/ethereum/comments/mfpwxr/the_ethereum_value_proposition_a_beginners_guide/,1,41
mfq2hq,1617026091,Do fees get lower when there are more miners?,[removed],https://www.reddit.com/r/ethereum/comments/mfq2hq/do_fees_get_lower_when_there_are_more_miners/,1,0
mfq91b,1617026636,dog fight,[removed],https://www.reddit.com/r/ethereum/comments/mfq91b/dog_fight/,1,0
mfqd4j,1617026963,Visa Becomes First Major Payments Network to Settle Transactions in USDC over Ethereum—one of the most actively used open-source blockchains.,,https://www.reddit.com/r/ethereum/comments/mfqd4j/visa_becomes_first_major_payments_network_to/,1,4
mfqq3b,1617028023,Visa Will Start Settling Transactions With Crypto Partners In USDC On Ethereum,[removed],https://www.reddit.com/r/ethereum/comments/mfqq3b/visa_will_start_settling_transactions_with_crypto/,1,0
mfqqvt,1617028085,The Case for Ethereum as Winner of the Smart Contract Wars - The Tokenist,,https://www.reddit.com/r/ethereum/comments/mfqqvt/the_case_for_ethereum_as_winner_of_the_smart/,1,1
mfquic,1617028381,New NFT's and Ethereum Giveaway! We will be giving away 15 Ethereum to a few lucky winners. Goblin race drops March 30th! Links in the comments for rules and more,,https://www.reddit.com/r/ethereum/comments/mfquic/new_nfts_and_ethereum_giveaway_we_will_be_giving/,1,0
mfr0de,1617028854,Amazing to see ETH addresses on Visa settlement reports as we integrate public blockchains into our core settlement infrastructure...,,https://www.reddit.com/r/ethereum/comments/mfr0de/amazing_to_see_eth_addresses_on_visa_settlement/,1,4
mfr47u,1617029168,What’s New in Eth2 - 28 March 2021 -- Edition 65,,https://www.reddit.com/r/ethereum/comments/mfr47u/whats_new_in_eth2_28_march_2021_edition_65/,1,0
mfr78b,1617029399,Switching from PoW to PoS is good for ETH?,[removed],https://www.reddit.com/r/ethereum/comments/mfr78b/switching_from_pow_to_pos_is_good_for_eth/,1,34
mfrgyr,1617030143,Quick question about fees,"Can you guys educate me about this specific part about Fees. I really like cardano and they have the babel fees, which means each token will be able to pay gas fees using their own token.\n\n&amp;#x200B;\n\nIs there something coming out for Ethereum or is it on the roadmap? If not, is there benefits of not doing this?  \n\n\nPlease give me your perspective on this, there is no bad answer.",https://www.reddit.com/r/ethereum/comments/mfrgyr/quick_question_about_fees/,1,2
mfrhz4,1617030217,I sold 2 Cardano NFTs at 15 times its costs in less than 2 days but can't even sell a premium ENS domain at purchase price. What do you think about ETH's NFT future?,[removed],https://www.reddit.com/r/ethereum/comments/mfrhz4/i_sold_2_cardano_nfts_at_15_times_its_costs_in/,1,0
mfrj3x,1617030301,The most powerful ETH miner - Innosilicon A10 Pro 750Mh + 7GB is now available with 35% Reduced price,,https://www.reddit.com/r/ethereum/comments/mfrj3x/the_most_powerful_eth_miner_innosilicon_a10_pro/,1,0
mfrklg,1617030413,I sold 2 Cardano NFTs at 15 times its costs in less than 2 days but can't even sell a premium ENS domain at purchase price. What do you think about ETH's NFT future?,[removed],https://www.reddit.com/r/ethereum/comments/mfrklg/i_sold_2_cardano_nfts_at_15_times_its_costs_in/,1,0
mfrlm8,1617030485,The most powerful ETH miner - Innosilicon A10 Pro 750Mh + 7GB is now available with 35% Reduced price,,https://www.reddit.com/r/ethereum/comments/mfrlm8/the_most_powerful_eth_miner_innosilicon_a10_pro/,1,0
mfrs23,1617030972,The most powerful ETH miner - Innosilicon A10 Pro 750Mh + 7GB is now available with 35% Reduced price,,https://www.reddit.com/r/ethereum/comments/mfrs23/the_most_powerful_eth_miner_innosilicon_a10_pro/,1,0
mfru8u,1617031142,Layer-2 Ethereum is In Supersonic Mode!! 💜Big Props To Everyone Leading the Charge! 🚀,,https://www.reddit.com/r/ethereum/comments/mfru8u/layer2_ethereum_is_in_supersonic_mode_big_props/,1,37
mfrw7q,1617031296,"Nft give away to 1 winner Go to my twitter repost, tag 2 friends and follow me to participate on twitter. Link below.",,https://www.reddit.com/r/ethereum/comments/mfrw7q/nft_give_away_to_1_winner_go_to_my_twitter_repost/,1,0
mfs2ky,1617031791,So who is sending transactions now ?,,https://www.reddit.com/r/ethereum/comments/mfs2ky/so_who_is_sending_transactions_now/,1,0
mfs3p5,1617031875,Video game application,[removed],https://www.reddit.com/r/ethereum/comments/mfs3p5/video_game_application/,1,0
mfs63n,1617032058,ETH Miner On Telegram,[removed],https://www.reddit.com/r/ethereum/comments/mfs63n/eth_miner_on_telegram/,1,0
mfs6d9,1617032081,NFT to Save Myanmar !,[removed],https://www.reddit.com/r/ethereum/comments/mfs6d9/nft_to_save_myanmar/,1,0
mfsgnf,1617032898,This is my 4th NFT which is an ad concept for Ethereum using a new term I coined. This the first appearance of this term.,,https://www.reddit.com/r/ethereum/comments/mfsgnf/this_is_my_4th_nft_which_is_an_ad_concept_for/,1,8
mfsm6m,1617033330,Trading my 1st ever personally designed music video thumbnail as an NFT!! Up for ethereum bids now!!!,,https://www.reddit.com/r/ethereum/comments/mfsm6m/trading_my_1st_ever_personally_designed_music/,1,0
mfsptc,1617033614,Geometric NFT,[removed],https://www.reddit.com/r/ethereum/comments/mfsptc/geometric_nft/,1,0
mfsue9,1617033939,"News: Helium Network sensor data can now be piped to the Streamr Network. Once connected, users can broadcast the data to apps, package it as a data product on the Marketplace, or crowdsell it in a Data Union:",,https://www.reddit.com/r/ethereum/comments/mfsue9/news_helium_network_sensor_data_can_now_be_piped/,1,0
mfsw71,1617034066,Looking for a pro,[removed],https://www.reddit.com/r/ethereum/comments/mfsw71/looking_for_a_pro/,1,0
mft2e9,1617034516,Bitcoin Caught Your Attention. Now Blockchain Is About to Catch Fire in the Film Industry.,,https://www.reddit.com/r/ethereum/comments/mft2e9/bitcoin_caught_your_attention_now_blockchain_is/,1,0
mft7ic,1617034910,"On November 2020, I made a video on ETH reaching ﹩2000. In this video I set the key support/resistance levels, apply the Larsson Line trend indicator to $ETH, analyze the Bitcoin vs Altcoin dominance chart and I give you my upside and downside analysis. Watch 4 months later and see if I was right!",,https://www.reddit.com/r/ethereum/comments/mft7ic/on_november_2020_i_made_a_video_on_eth_reaching/,1,0
mfte1q,1617035411,Rolling 12 Month History of ETH Returns,,https://www.reddit.com/r/ethereum/comments/mfte1q/rolling_12_month_history_of_eth_returns/,1,2
mfte6y,1617035420,Please no! 🥲,,https://www.reddit.com/r/ethereum/comments/mfte6y/please_no/,1,2
mftect,1617035432,Im buying 200 colors from Pantones NFT project,I'm buying 200-500 colors on April 1st from Pantones NFT project called NiftyPantone. I think this is an obvious investment and flip. Ppl and brands want to own their fav color. 16M colors and bonding curve pre sale is fire. The website also looks dope. \n\nNiftyPantone \n\nTwitter - [https://twitter.com/NiftyPantone](https://twitter.com/NiftyPantone)  \nDiscord - [https://discord.com/invite/fnbeUJGU4a](https://discord.com/invite/fnbeUJGU4a),https://www.reddit.com/r/ethereum/comments/mftect/im_buying_200_colors_from_pantones_nft_project/,1,1
mftqfk,1617036363,What the *** is up with these gas fees?,I know gas fees have been high with ETH v1 but I went to stake some dough this morning and fees are so high in fact that it almost doesn't make sense to do anything unless you have thousands or hundreds of thousands to play with.  Is this going to keep getting worse until ETH2?,https://www.reddit.com/r/ethereum/comments/mftqfk/what_the_is_up_with_these_gas_fees/,1,39
mfu2ut,1617037271,Dogira - have a look at this new coin,,https://www.reddit.com/r/ethereum/comments/mfu2ut/dogira_have_a_look_at_this_new_coin/,1,0
mfu3lt,1617037324,Polymarket Confusion,[removed],https://www.reddit.com/r/ethereum/comments/mfu3lt/polymarket_confusion/,1,0
mfu4o2,1617037393,Bitpay KYC question,[removed],https://www.reddit.com/r/ethereum/comments/mfu4o2/bitpay_kyc_question/,1,0
mfu6mf,1617037532,The Optimistic Ethereum L2 Explorer (Etherscan for Optimism),,https://www.reddit.com/r/ethereum/comments/mfu6mf/the_optimistic_ethereum_l2_explorer_etherscan_for/,1,2
