id,created_utc,title,selftext,full_link,score,comments
mkxkl4,1617664317,A few technical questions about NFTs - mutability and off-chain data,[removed],https://www.reddit.com/r/ethereum/comments/mkxkl4/a_few_technical_questions_about_nfts_mutability/,1,0
mkxo3f,1617664618,Cryptocurrency,[removed],https://www.reddit.com/r/ethereum/comments/mkxo3f/cryptocurrency/,1,0
mkxwt9,1617665341,NEW NFT - The Smart Contract for the UPCOMING Blockchain Government,[removed],https://www.reddit.com/r/ethereum/comments/mkxwt9/new_nft_the_smart_contract_for_the_upcoming/,1,0
mkxyg8,1617665477,Ethereum not showing up in Trustwallet,[removed],https://www.reddit.com/r/ethereum/comments/mkxyg8/ethereum_not_showing_up_in_trustwallet/,1,0
mky5m9,1617666077,How do the transactions fees work when developing a dapp?,[removed],https://www.reddit.com/r/ethereum/comments/mky5m9/how_do_the_transactions_fees_work_when_developing/,1,0
mkyh1o,1617667056,"After getting into POS and DEFI, i realise staking my time to farm for a salary at a job is the stupidest thing, ever",[removed],https://www.reddit.com/r/ethereum/comments/mkyh1o/after_getting_into_pos_and_defi_i_realise_staking/,1,0
mkyi39,1617667149,Best App for Ether buy in Australia?? Thanks,[removed],https://www.reddit.com/r/ethereum/comments/mkyi39/best_app_for_ether_buy_in_australia_thanks/,1,0
mkys2o,1617668002,Is there an ELI5 on how to run an Ethereum node? How much would it cost?,Is there an ELI5 on how to run an Ethereum node? How much would it cost?,https://www.reddit.com/r/ethereum/comments/mkys2o/is_there_an_eli5_on_how_to_run_an_ethereum_node/,1,17
mkytto,1617668149,Magic Kitty 1 of 1,,https://www.reddit.com/r/ethereum/comments/mkytto/magic_kitty_1_of_1/,1,0
mkyy9j,1617668535,What is the best way to invest in ETH while mining with NiceHash?,[removed],https://www.reddit.com/r/ethereum/comments/mkyy9j/what_is_the_best_way_to_invest_in_eth_while/,1,0
mkyymq,1617668566,What is the best way to invest in ETH while mining with NiceHash?,[removed],https://www.reddit.com/r/ethereum/comments/mkyymq/what_is_the_best_way_to_invest_in_eth_while/,1,0
mkz1kf,1617668811,Start mining crypto today - The best offer for Crypto mining equipment,,https://www.reddit.com/r/ethereum/comments/mkz1kf/start_mining_crypto_today_the_best_offer_for/,1,0
mkz54i,1617669112,What is the best way to invest in ETH while mining with NiceHash?,[removed],https://www.reddit.com/r/ethereum/comments/mkz54i/what_is_the_best_way_to_invest_in_eth_while/,1,0
mkz8dp,1617669389,Nonprofit looking for help with blockchain idea,[removed],https://www.reddit.com/r/ethereum/comments/mkz8dp/nonprofit_looking_for_help_with_blockchain_idea/,1,3
mkz94e,1617669458,What is the best way to invest in ETH while mining with NiceHash?,[removed],https://www.reddit.com/r/ethereum/comments/mkz94e/what_is_the_best_way_to_invest_in_eth_while/,1,0
mkzknp,1617670455,World crypto,[removed],https://www.reddit.com/r/ethereum/comments/mkzknp/world_crypto/,1,0
mkzl2v,1617670492,How do you increase the chances of a transaction going through and fast?,[removed],https://www.reddit.com/r/ethereum/comments/mkzl2v/how_do_you_increase_the_chances_of_a_transaction/,1,0
mkzsp1,1617671140,"The more people to know about crypto, the better! So here's Ethereum in comic form 💎🎉💙😄",,https://www.reddit.com/r/ethereum/comments/mkzsp1/the_more_people_to_know_about_crypto_the_better/,1,7
mkztkj,1617671218,"(2:20 min) CoinBurp CEO: The NFT bubble WILL burst, but the investment it's generated will take crypto to new heights.",,https://www.reddit.com/r/ethereum/comments/mkztkj/220_min_coinburp_ceo_the_nft_bubble_will_burst/,1,0
ml0dis,1617672972,"Give me a sign I should buy Crypto, app.rarible.com",,https://www.reddit.com/r/ethereum/comments/ml0dis/give_me_a_sign_i_should_buy_crypto_apprariblecom/,1,1
ml0vd5,1617674515,USDC vs Gas Fees - Lending on Ledger Live,[removed],https://www.reddit.com/r/ethereum/comments/ml0vd5/usdc_vs_gas_fees_lending_on_ledger_live/,1,0
ml0y4w,1617674757,Ethereum is here to stay! This image proves that,,https://www.reddit.com/r/ethereum/comments/ml0y4w/ethereum_is_here_to_stay_this_image_proves_that/,1,0
ml164m,1617675459,Best recommended token by BPOP of yesterday:VIDY Recommended KOL:不推小平台,[removed],https://www.reddit.com/r/ethereum/comments/ml164m/best_recommended_token_by_bpop_of_yesterdayvidy/,1,0
ml17l3,1617675589,"Thank god , Ive been waiting for this 😅",,https://www.reddit.com/r/ethereum/comments/ml17l3/thank_god_ive_been_waiting_for_this/,1,0
ml1phe,1617677231,$Eth coming to Venmo? Bullish.,,https://www.reddit.com/r/ethereum/comments/ml1phe/eth_coming_to_venmo_bullish/,1,0
ml2298,1617678394,In case you’re interested in cryptography!,,https://www.reddit.com/r/ethereum/comments/ml2298/in_case_youre_interested_in_cryptography/,1,1
ml2ch3,1617679317,Teeka Tiwari’s 6 coins,Does anyone know what are the Teeka’s 5 coins he unveiled besides ETH. Can anyone share some info please.,https://www.reddit.com/r/ethereum/comments/ml2ch3/teeka_tiwaris_6_coins/,1,21
ml2czk,1617679365,XRP New Partnership Announcements Pump It To 3 Year High,,https://www.reddit.com/r/ethereum/comments/ml2czk/xrp_new_partnership_announcements_pump_it_to_3/,1,0
ml2diy,1617679414,"Tough questions, but simple answers / Nextchain",,https://www.reddit.com/r/ethereum/comments/ml2diy/tough_questions_but_simple_answers_nextchain/,1,0
ml2ebf,1617679479,"The Layer2.Finance Testnet Carnival: Win $32,000 by Helping Us Test DeFi City’s First Subway!",,https://www.reddit.com/r/ethereum/comments/ml2ebf/the_layer2finance_testnet_carnival_win_32000_by/,1,10
ml2fau,1617679575,Is this a scam?,[removed],https://www.reddit.com/r/ethereum/comments/ml2fau/is_this_a_scam/,1,0
ml37t7,1617682287,"Ethereum Pauses above $2,000 Support amidst Bullish Expectation",,https://www.reddit.com/r/ethereum/comments/ml37t7/ethereum_pauses_above_2000_support_amidst_bullish/,1,0
ml3ers,1617682956,Bridge Token (BRG),[removed],https://www.reddit.com/r/ethereum/comments/ml3ers/bridge_token_brg/,1,0
ml3oka,1617683915,Vitalik Buterin,,https://www.reddit.com/r/ethereum/comments/ml3oka/vitalik_buterin/,1,1
ml4273,1617685350,"This street art recently appeared in Melbourne, Australia.",,https://www.reddit.com/r/ethereum/comments/ml4273/this_street_art_recently_appeared_in_melbourne/,1,272
ml45bf,1617685693,"No official wallet? How do I open 2017 eth keystore? The official(?) website even says ""Wallets listed on this page are not official endorsements"" How does this make any sense? So there's no eth wallet? This feels like it turned into a scam.",[removed],https://www.reddit.com/r/ethereum/comments/ml45bf/no_official_wallet_how_do_i_open_2017_eth/,1,0
ml47xd,1617685971,All 67 March Madness games were recorded on Ethereum by The Associated Press! Congrats to Baylor on making history!,[removed],https://www.reddit.com/r/ethereum/comments/ml47xd/all_67_march_madness_games_were_recorded_on/,1,0
ml4hpk,1617687080,Anthony Scaramucci Claims Ethereum Has Good Fundamentals And Will Grow,,https://www.reddit.com/r/ethereum/comments/ml4hpk/anthony_scaramucci_claims_ethereum_has_good/,1,0
ml58cf,1617690148,"The first quarterly burn has been completed! In total 3,084,247.29 $uDOOs were burned! Howdoo",,https://www.reddit.com/r/ethereum/comments/ml58cf/the_first_quarterly_burn_has_been_completed_in/,1,0
ml5an4,1617690414,"Sminem, Harbinger of Green Candles slays The Bog - Sminem Sacred Artifacts | OpenSea",,https://www.reddit.com/r/ethereum/comments/ml5an4/sminem_harbinger_of_green_candles_slays_the_bog/,1,0
ml5axc,1617690446,Holy crap!!! Jack Dorsey’s EX GF just released an NFT and it looks absolutely enticing and fuuhhhreaking incredible!!! Is she trying to get back at him for something?!?,[removed],https://www.reddit.com/r/ethereum/comments/ml5axc/holy_crap_jack_dorseys_ex_gf_just_released_an_nft/,1,0
ml5fed,1617690962,"1ETH Lost in the Ether. Help, Reward!",[removed],https://www.reddit.com/r/ethereum/comments/ml5fed/1eth_lost_in_the_ether_help_reward/,1,0
ml5se6,1617692492,Website Where You Can Watch Videos &amp; Play Games For Money!,[removed],https://www.reddit.com/r/ethereum/comments/ml5se6/website_where_you_can_watch_videos_play_games_for/,1,0
ml6bn5,1617694756,Noob Jumping In (BOTH FEET),"Obviously I won’t speak to amount but after a decent bit of research I will be investing in ETH. It is not just $100 to play around with, I am seeking to hold long term and enjoy the benefits of this glorious currency. \n\nI am no pro. I was previously cyber security and I’m confused as hell. HOW do I keep these buggers safe? I’d love to use an IOS app for ease but I’ve seen several security cases AGAINST, but the idea of a single hardware asset maintaining all my funds?!? \n\n1) How do I establish redundancy for my funds safety? \n\nI’ve read plenty of posts in this sub complaining about beginners but nothing with a JARGON FREE explanation. After weeks of reading I still can’t seem to get all the terminology so, this post exists. \n\n2) I am also very confused on how the profits are taxed. (American but I’m purchasing while living in the EU)\n\nWhile I understand these are big questions, I’m very confident in ETH and excited to get help. I’d also be willing to compensate someone for some coaching/guidance, so let me know if that interests anyone. I don’t wanna end up poor or in jail.... just fat and happy with a full ETH wallet.",https://www.reddit.com/r/ethereum/comments/ml6bn5/noob_jumping_in_both_feet/,1,29
ml6rps,1617696755,EtherLite - A Pure Proof-of-stake Hardfork of Ethereum Scheduled for 1May 2021,[removed],https://www.reddit.com/r/ethereum/comments/ml6rps/etherlite_a_pure_proofofstake_hardfork_of/,1,0
ml6yxm,1617697689,My last NFT video!,,https://www.reddit.com/r/ethereum/comments/ml6yxm/my_last_nft_video/,1,0
ml7fq5,1617699929,Is Atomic screwing me somehow? 0.o,[removed],https://www.reddit.com/r/ethereum/comments/ml7fq5/is_atomic_screwing_me_somehow_0o/,1,0
ml8465,1617702958,ETH Price Analysis: A Major Breakout of $2500 is Coming,[removed],https://www.reddit.com/r/ethereum/comments/ml8465/eth_price_analysis_a_major_breakout_of_2500_is/,1,1
ml86te,1617703261,Everyone🌍 Need $RAZOR @Razor_Network In Order To Secure Networks. Project With Real Use Cases Securing⚔ Bridge Between Real World And Virtual World.🚀🚀🚀 https://razor.network,,https://www.reddit.com/r/ethereum/comments/ml86te/everyone_need_razor_razor_network_in_order_to/,1,0
ml8fyt,1617704340,Cryptocurrency,[removed],https://www.reddit.com/r/ethereum/comments/ml8fyt/cryptocurrency/,1,0
