id,created_utc,title,selftext,full_link,score,comments
mnifnt,1617978592,What happened to emoon.io ?,[removed],https://www.reddit.com/r/ethereum/comments/mnifnt/what_happened_to_emoonio/,1,0
mnig4i,1617978627,Cancelling a pending transaction.,[removed],https://www.reddit.com/r/ethereum/comments/mnig4i/cancelling_a_pending_transaction/,1,0
mnigb3,1617978642,Transaction is stuck and I tried cancelling. What can I do?,[removed],https://www.reddit.com/r/ethereum/comments/mnigb3/transaction_is_stuck_and_i_tried_cancelling_what/,1,0
mnijva,1617978927,It’s amazing what can happen in one tx,,https://www.reddit.com/r/ethereum/comments/mnijva/its_amazing_what_can_happen_in_one_tx/,1,0
mnik7l,1617978956,It’s amazing what can happen in one tx,,https://www.reddit.com/r/ethereum/comments/mnik7l/its_amazing_what_can_happen_in_one_tx/,1,0
mnilsz,1617979087,"Influence Space Strategy MMO, built on Ethereum and scaling for Optimism. - White Paper",,https://www.reddit.com/r/ethereum/comments/mnilsz/influence_space_strategy_mmo_built_on_ethereum/,1,0
mniqn1,1617979480,Minted my first NFT. What do you guys think?,,https://www.reddit.com/r/ethereum/comments/mniqn1/minted_my_first_nft_what_do_you_guys_think/,1,0
mnirpn,1617979568,Over 85% of Ethereum developers support migration to Proof-of-Stake in 2021,,https://www.reddit.com/r/ethereum/comments/mnirpn/over_85_of_ethereum_developers_support_migration/,1,0
mnis9y,1617979613,Why should i invest in ethereum?,"Started investing heavily in bitcoin, I understand it and appreciate the tech behind it. Ethereum isn't really supposed to be a currency though? So why should I invest in ETH? How will it help me in 15 years when it is widely used? Can I build wealth with it? How?",https://www.reddit.com/r/ethereum/comments/mnis9y/why_should_i_invest_in_ethereum/,1,9
mnjhfd,1617981571,future of consumer blockchain products,[removed],https://www.reddit.com/r/ethereum/comments/mnjhfd/future_of_consumer_blockchain_products/,1,0
mnji2s,1617981620,future of consumer blockchain products,,https://www.reddit.com/r/ethereum/comments/mnji2s/future_of_consumer_blockchain_products/,1,0
mnjnq9,1617982037,Ethereum User Bids $6.3 Million on 16 CryptoPunks Within Minutes,,https://www.reddit.com/r/ethereum/comments/mnjnq9/ethereum_user_bids_63_million_on_16_cryptopunks/,1,4
mnjot5,1617982117,"New art from a sick artist. Released on 09,04",<not selftext available>,https://www.reddit.com/r/ethereum/comments/mnjot5/new_art_from_a_sick_artist_released_on_0904/,1,0
mnkaj9,1617983793,WWE Launches Undertaker NFTs Ahead of WrestleMania,,https://www.reddit.com/r/ethereum/comments/mnkaj9/wwe_launches_undertaker_nfts_ahead_of_wrestlemania/,1,2
mnkcnh,1617983963,Ethereum standard hashrate token--EHash: the innovative pioneer of hashrate token 2.0,,https://www.reddit.com/r/ethereum/comments/mnkcnh/ethereum_standard_hashrate_tokenehash_the/,1,0
mnkdqg,1617984032,Merchant Token ICO - DEFI PROJECT - Phase 39 of 100,[removed],https://www.reddit.com/r/ethereum/comments/mnkdqg/merchant_token_ico_defi_project_phase_39_of_100/,1,0
mnklfc,1617984595,Is there a tldr on how it would be possible in the future to implement an ETH2 SPV client?,"In PoW all is needed is to provide the blockheaders with the PoW, but in PoS, what exactly is provided? I understand it's possible in principle, but I suppose I'm asking which *assumption* it relies on which PoW doesn't need.",https://www.reddit.com/r/ethereum/comments/mnklfc/is_there_a_tldr_on_how_it_would_be_possible_in/,1,0
mnkpmu,1617984919,Best way to learn coding smart contract ?,[removed],https://www.reddit.com/r/ethereum/comments/mnkpmu/best_way_to_learn_coding_smart_contract/,1,0
mnkxe9,1617985506,Earn Omcoins,[removed],https://www.reddit.com/r/ethereum/comments/mnkxe9/earn_omcoins/,1,0
mnl2y9,1617985929,Check out this #NFT for sale on Mintable! Pick up 'Hood - Eminem Type Beat' before its swooped up!,,https://www.reddit.com/r/ethereum/comments/mnl2y9/check_out_this_nft_for_sale_on_mintable_pick_up/,1,0
mnl6fm,1617986198,Good time to buy?,[removed],https://www.reddit.com/r/ethereum/comments/mnl6fm/good_time_to_buy/,1,0
mnldgd,1617986738,eth2 update 013 -- Bison Trails,,https://www.reddit.com/r/ethereum/comments/mnldgd/eth2_update_013_bison_trails/,1,0
mnlzf1,1617988444,“Photography framed #1”,[removed],https://www.reddit.com/r/ethereum/comments/mnlzf1/photography_framed_1/,1,0
mnm413,1617988812,“Photography framed #1”,[removed],https://www.reddit.com/r/ethereum/comments/mnm413/photography_framed_1/,1,0
mnmfl5,1617989758,I don’t know if it’s appropriate here 😅 but I just got my first NFT listed on the Foundation - “The Nomad”🖤 Leave some feedback in comments guys,,https://www.reddit.com/r/ethereum/comments/mnmfl5/i_dont_know_if_its_appropriate_here_but_i_just/,1,0
mnmfzs,1617989790,BridgeOracleSystem,[removed],https://www.reddit.com/r/ethereum/comments/mnmfzs/bridgeoraclesystem/,1,0
mnmmcl,1617990305,Estimated gas fees after scaling?,[removed],https://www.reddit.com/r/ethereum/comments/mnmmcl/estimated_gas_fees_after_scaling/,1,0
mnmqns,1617990671,Do I need to have intermediary in form of company to create a wallet?,[removed],https://www.reddit.com/r/ethereum/comments/mnmqns/do_i_need_to_have_intermediary_in_form_of_company/,1,0
mnmysv,1617991325,L2Beat -- New site for Layer 2 analytics,,https://www.reddit.com/r/ethereum/comments/mnmysv/l2beat_new_site_for_layer_2_analytics/,1,2
mnn68g,1617991931,Token holders on Etherscan,"Etherscan showing roughly 13,000 holders of AKRO (Akropolis). \n\n[https://etherscan.io/token/0x8ab7404063ec4dbcfd4598215992dc3f8ec853d7](https://etherscan.io/token/0x8ab7404063ec4dbcfd4598215992dc3f8ec853d7)\n\nCan someone explain to me how this is correct, when it is listen on Binance? This cannot be right surely....\n\nOr does Binance have one main address that counts towards that total or something",https://www.reddit.com/r/ethereum/comments/mnn68g/token_holders_on_etherscan/,1,1
mnn7nn,1617992050,Does anyone keep their ETH of over 3k+ on Coinbase Pro? Is it generally safe?,[removed],https://www.reddit.com/r/ethereum/comments/mnn7nn/does_anyone_keep_their_eth_of_over_3k_on_coinbase/,1,0
mnn9ez,1617992192,"Realistic, Honest prediction for ETH this year",[removed],https://www.reddit.com/r/ethereum/comments/mnn9ez/realistic_honest_prediction_for_eth_this_year/,1,0
mnn9xl,1617992235,Join the dawn of the digital Renaissance! - Now on Discord,,https://www.reddit.com/r/ethereum/comments/mnn9xl/join_the_dawn_of_the_digital_renaissance_now_on/,1,0
mnndyn,1617992567,Y'all got any more of that...?,,https://www.reddit.com/r/ethereum/comments/mnndyn/yall_got_any_more_of_that/,1,0
mnohtg,1617995799,MEW wallet- where is my unused $ amount?,[removed],https://www.reddit.com/r/ethereum/comments/mnohtg/mew_wallet_where_is_my_unused_amount/,1,1
mnojlx,1617995948,BridgeOracleSystem,[removed],https://www.reddit.com/r/ethereum/comments/mnojlx/bridgeoraclesystem/,1,0
mnokw7,1617996056,This is why Uniswap v3 could have “insane efficiency”,,https://www.reddit.com/r/ethereum/comments/mnokw7/this_is_why_uniswap_v3_could_have_insane/,1,1
mnostn,1617996722,MEW wallet,[removed],https://www.reddit.com/r/ethereum/comments/mnostn/mew_wallet/,1,0
mnotyr,1617996815,Let Me Fly is my favourite DMX track,,https://www.reddit.com/r/ethereum/comments/mnotyr/let_me_fly_is_my_favourite_dmx_track/,1,2
mnp657,1617997847,will it drop more,[removed],https://www.reddit.com/r/ethereum/comments/mnp657/will_it_drop_more/,1,0
mnpfsn,1617998644,Merchant Token ICO - DEFI PROJECT - Phase 39 of 100,[removed],https://www.reddit.com/r/ethereum/comments/mnpfsn/merchant_token_ico_defi_project_phase_39_of_100/,1,0
mnpo7c,1617999314,Ethereans of Arizona!,I made a subreddit for Ethereans that live in Arizona! If you want to join the community come on over to r/Ethereum_Phoenix\n\nHope to meet with people and build a stronger Ethereum community in Phoenix.,https://www.reddit.com/r/ethereum/comments/mnpo7c/ethereans_of_arizona/,1,0
mnqf0e,1618001549,Welcome to the Metaverse,,https://www.reddit.com/r/ethereum/comments/mnqf0e/welcome_to_the_metaverse/,1,0
mnqvih,1618002947,$SKL will bring the koalas safe to the moon 🐨🚀,[removed],https://www.reddit.com/r/ethereum/comments/mnqvih/skl_will_bring_the_koalas_safe_to_the_moon/,1,0
mnqvsx,1618002972,$SKL will bring the koalas safe to the moon 🐨🚀,[removed],https://www.reddit.com/r/ethereum/comments/mnqvsx/skl_will_bring_the_koalas_safe_to_the_moon/,1,0
mnqye4,1618003192,"Daily top cryptos trend &amp; momentum, April 9th - Ethereum Network dominates",,https://www.reddit.com/r/ethereum/comments/mnqye4/daily_top_cryptos_trend_momentum_april_9th/,1,0
mqir3y,1618372773,#bullish,,https://www.reddit.com/r/ethereum/comments/mqir3y/bullish/,1,0
mqixkb,1618373500,Well deserved celebration. 🚀🚀👏👏,,https://www.reddit.com/r/ethereum/comments/mqixkb/well_deserved_celebration/,1,0
mqizic,1618373725,Ethereum Billboard — Birth of Forevertising,,https://www.reddit.com/r/ethereum/comments/mqizic/ethereum_billboard_birth_of_forevertising/,1,0
mqj25e,1618374045,real advantages over dots/cosmos/ada?,[removed],https://www.reddit.com/r/ethereum/comments/mqj25e/real_advantages_over_dotscosmosada/,1,0
