id,created_utc,title,selftext,full_link,score,comments
mrdg0f,1618489077,Coinbase stopped sends,[removed],https://www.reddit.com/r/ethereum/comments/mrdg0f/coinbase_stopped_sends/,1,0
mrdgz7,1618489169,Why did Ethereum fees get so high compared to 2018?,[removed],https://www.reddit.com/r/ethereum/comments/mrdgz7/why_did_ethereum_fees_get_so_high_compared_to_2018/,1,0
mrdqwm,1618490166,I sold- Market Greedy?,"I may be entirely wrong however Ive got caught holding to long too many times now and seen the hard top at £1800 ETH-GBP and sold my position, Ive seen a lack of growth in the last short period and thought its time too get out then rebuy later, whats everyone else’s thoughts. \n\n\nCall me dumb, call me silly, call me cautious im interested 👍",https://www.reddit.com/r/ethereum/comments/mrdqwm/i_sold_market_greedy/,1,8
mrdvf5,1618490633,JPMorgan and Mastercard invest $65 million in Ethereum,,https://www.reddit.com/r/ethereum/comments/mrdvf5/jpmorgan_and_mastercard_invest_65_million_in/,1,0
mrdzw2,1618491078,Berlin Hard Fork is now Live on Ethereum Mainnet! Congrats everyone!,,https://www.reddit.com/r/ethereum/comments/mrdzw2/berlin_hard_fork_is_now_live_on_ethereum_mainnet/,1,13
mre3fi,1618491431,"sketchy website, does anyone have any experience?",[removed],https://www.reddit.com/r/ethereum/comments/mre3fi/sketchy_website_does_anyone_have_any_experience/,1,0
mreacw,1618492071,PSA: The Importance of Multi-Client and why the Ecosystem must take it seriously,"Today has shown exactly why the Multi-Client philosophy that Vitalik and the Core-devs have been discussing since day 1 is so important.\n\nToday, Open Ethereum suffered a syncing issue after the Berlin Hard fork.\n\n[https://github.com/openethereum/openethereum/issues/353](https://github.com/openethereum/openethereum/issues/353)\n\nTo my amazement, we discovered that some \*major\* Ethereum companies were using \*only\* OE as their Ethereum node and no backup clients!\n\nIt seems like even Coinbase, the largest public crypto company in the world, valued at $80 Billion is only using OE, and not geth or others as backups.\n\n""We have disabled ETH &amp; ERC-20 withdrawals while we investigate a potential issue with the recent network upgrade. Receives will also be delayed.  ""\n\nWe are \*lucky\* that this issue didn't hit Infura and cause damage to the wider web3 ecosystem.\n\nBut this should be a warning shot across the bow for the whole Ethereum industry.  \*Every\* company must start running at least two clients in parallel, and have their software fall-back to the backup clients if their primary one scales.\n\nIf you are a CTO in this industry, you must Immediately start a plan to implement multi-client.  No excuses.",https://www.reddit.com/r/ethereum/comments/mreacw/psa_the_importance_of_multiclient_and_why_the/,1,52
mredfa,1618492355,best exchange to buy ETH?,[removed],https://www.reddit.com/r/ethereum/comments/mredfa/best_exchange_to_buy_eth/,1,0
mreexm,1618492499,What’s the best exchange to buy ETH?,"USA trader here. I have an account on gemini, coinbase pro, and binance.\n\nwhich exchange has the best fees?\n\nplanning to buy and then transfer to my exodus wallet\nthanks!",https://www.reddit.com/r/ethereum/comments/mreexm/whats_the_best_exchange_to_buy_eth/,1,15
mremqq,1618493208,JPMorgan and Mastercard invest $65 million in Ethereum,,https://www.reddit.com/r/ethereum/comments/mremqq/jpmorgan_and_mastercard_invest_65_million_in/,1,0
mrepvx,1618493479,"Etherscan is stuck with Berlin hardfork, check other explorers",[removed],https://www.reddit.com/r/ethereum/comments/mrepvx/etherscan_is_stuck_with_berlin_hardfork_check/,1,0
mrepw7,1618493479,Safe wallet for ETH and DOGE,Hey! I'm currently looking for a wallet to move my ETH and DOGE to. I'm currently  using Multidoge and Binance. Im planning on just leaving them in the wallet for a few years. What would be a easy way of doing this? Thank you guys.,https://www.reddit.com/r/ethereum/comments/mrepw7/safe_wallet_for_eth_and_doge/,1,8
mrerag,1618493599,"Berlin Hard Fork Goes Live, Promises to Reduce Sky-High Ethereum Fees",,https://www.reddit.com/r/ethereum/comments/mrerag/berlin_hard_fork_goes_live_promises_to_reduce/,1,2
mretqw,1618493815,"Etherscan stuck with Berlin hard fork, are there working explorers? Yep",https://Ethplorer.io - works\n\nhttps://www.etherchain.org - works\n\nhttps://Etherscan.io - stuck\n\nhttps://blockchair.com/ethereum - stuck\n\nhttps://www.ethvm.com - stuck,https://www.reddit.com/r/ethereum/comments/mretqw/etherscan_stuck_with_berlin_hard_fork_are_there/,1,14
mreziv,1618494329,"ENJIN jumping train, with an utterly unprofessional tweet to boot.",,https://www.reddit.com/r/ethereum/comments/mreziv/enjin_jumping_train_with_an_utterly/,1,0
mrf00h,1618494373,"Coinbase, Ledger, and other crypto services impacted by client sync issue following Ethereum's Berlin hard fork",,https://www.reddit.com/r/ethereum/comments/mrf00h/coinbase_ledger_and_other_crypto_services/,1,0
mrf2a4,1618494575,LSDoggies NFTs collection,[removed],https://www.reddit.com/r/ethereum/comments/mrf2a4/lsdoggies_nfts_collection/,1,0
mrf52f,1618494825,Metamask transaction stuck pending - have attempted to cancel using nonce method,[removed],https://www.reddit.com/r/ethereum/comments/mrf52f/metamask_transaction_stuck_pending_have_attempted/,1,0
mrf7p6,1618495052,Nft’s are insane!,"I invested $400 in January in something called NBA Topshot. My account reached 17k and I decided to pull out, so glad I did the whole market has crashed and I will now be reinvesting in ETH 🙌🏻🙌🏻.",https://www.reddit.com/r/ethereum/comments/mrf7p6/nfts_are_insane/,1,13
mrf8lo,1618495128,Buying ethereum with a business account?,[removed],https://www.reddit.com/r/ethereum/comments/mrf8lo/buying_ethereum_with_a_business_account/,1,0
mrf9g1,1618495197,Just getting into crypto,[removed],https://www.reddit.com/r/ethereum/comments/mrf9g1/just_getting_into_crypto/,1,0
mrfbcq,1618495346,Should I switch my ETH 1.0 to ETH 2.0 on Coinbase? Where is the best place to pool ETH?,"Do I need to switch my 1.0 ETH to 2.0, like is there any advantage to having one over the other?\n\nI have 10 ETH and would like to pool it to stake it. Hopefully one day I can get to 32 ETH. Where is the best place to do this?",https://www.reddit.com/r/ethereum/comments/mrfbcq/should_i_switch_my_eth_10_to_eth_20_on_coinbase/,1,2
mrfc2x,1618495410,Transaction has been stuck for over 2 hours. What can I do?,[removed],https://www.reddit.com/r/ethereum/comments/mrfc2x/transaction_has_been_stuck_for_over_2_hours_what/,1,0
mrffhu,1618495697,ETH Bug on CB Pro?,Anyone else experience this?\nI copied my Eth address from CB Pro then pasted it into MetaMask and transferred a large amount of ETH.  It never arrived.  I went back and checked the destination address and it was not my ETH wallet!  I loaded CB Pro and it was now a new address listed for my ETH wallet that was not my normal address or the new one that had copied for my transaction.  I loaded the page again and a NEW Eth address populated.  I sent a complaint to customer service.  Anyone else having this issue?,https://www.reddit.com/r/ethereum/comments/mrffhu/eth_bug_on_cb_pro/,1,22
mrfofe,1618496447,Is it still early for eth ?,[removed],https://www.reddit.com/r/ethereum/comments/mrfofe/is_it_still_early_for_eth/,1,0
mrfpn8,1618496555,"Im new to this, and i strongly believe that eth will be as huge as btc in the future.",[removed],https://www.reddit.com/r/ethereum/comments/mrfpn8/im_new_to_this_and_i_strongly_believe_that_eth/,1,0
mrfsjy,1618496805,All Ethereum deposits and withdrawals have been halted due to technical problems with the Berlin upgrade,,https://www.reddit.com/r/ethereum/comments/mrfsjy/all_ethereum_deposits_and_withdrawals_have_been/,1,0
mrftd3,1618496875,RollerCoin Set-Up Guide,,https://www.reddit.com/r/ethereum/comments/mrftd3/rollercoin_setup_guide/,1,0
mrftql,1618496905,Chainlink Whitepaper 2.0 the Future of Decentralized Oracle Networks,,https://www.reddit.com/r/ethereum/comments/mrftql/chainlink_whitepaper_20_the_future_of/,1,10
mrfubf,1618496955,Noob advice,[removed],https://www.reddit.com/r/ethereum/comments/mrfubf/noob_advice/,1,0
mrfuva,1618497000,I want to get started with ethereum. Tell me everything.,"Hello everyone. I’m Zak, and 16..\n\nI have started saving my money and want to invest. I see ethereum is booming, so I want to learn and buy. After doing some research, I have found meta mask. From my understanding, it is a wallet that I can store my ethereum in. I have found that I can buy through it as well, even under 18. Is this recommended?\n\nI am wondering if it’s a good idea to buy ethereum. \n\nAlso, how would I sell it through meta mask? If I buy it through there, can I sell it through there as well? Will the price increase?\n\nThanks! And please, give me a complete run down and any tips :)",https://www.reddit.com/r/ethereum/comments/mrfuva/i_want_to_get_started_with_ethereum_tell_me/,1,10
mrfysl,1618497331,"BTC, ETH, XRP, HOT, DASH, EOS, CRV — Technical Analysis April 15",,https://www.reddit.com/r/ethereum/comments/mrfysl/btc_eth_xrp_hot_dash_eos_crv_technical_analysis/,1,0
mrg1p7,1618497585,Why are all the cryptocurrency source code made available online but not Ethereum?,[removed],https://www.reddit.com/r/ethereum/comments/mrg1p7/why_are_all_the_cryptocurrency_source_code_made/,1,0
mrg2x0,1618497689,Can someone ELI5 this stuff to me,[removed],https://www.reddit.com/r/ethereum/comments/mrg2x0/can_someone_eli5_this_stuff_to_me/,1,0
mrgaep,1618498309,ETH Nodes Stuck After Berlin Hardfork,,https://www.reddit.com/r/ethereum/comments/mrgaep/eth_nodes_stuck_after_berlin_hardfork/,1,0
mrgdzy,1618498598,Is there difference in Gas usage between native ether and erc 20 tokens?,"I was just checking transfer costs from my MetaMask wallet to another wallet.\n\nI have some ETH and some HOGE in the Metamask wallet. Metamask says that it will take around $3 to transfer my ETH, but it will take $17 to transfer the HOGE. I saw that the gas price in both was around 72 gwei, but the gas limit was different. \n\nSo my questions is does transfers of various ERC20 tokens have different gas usage compared to ETH's 21000 ? If yes, is there a place where can I find a list of ERC20 token transfer gas cost ?",https://www.reddit.com/r/ethereum/comments/mrgdzy/is_there_difference_in_gas_usage_between_native/,1,3
mrgeq6,1618498661,State of Stake vol. 46,,https://www.reddit.com/r/ethereum/comments/mrgeq6/state_of_stake_vol_46/,1,1
mrghq6,1618498889,"Hello folks, this dApp casino is partnered up with ChainLINK and has integrated its oracle service to further decentralize its platform. It accepts $LINK and has a $2,000 $LINK leaderboard promotion. It offers 5 games+ has a massive jackpot of over $300K with loads of $LINK! It is provably fair.",,https://www.reddit.com/r/ethereum/comments/mrghq6/hello_folks_this_dapp_casino_is_partnered_up_with/,1,0
mrgjvd,1618499056,Should I sell a percentage?,"Ok, so I bought just over 1 ether when it was around the £1000 mark. Now should I sell the 0.025% now as a ""nice little bonus"" and keep the 1 ether? Or should I just leave it all ride?",https://www.reddit.com/r/ethereum/comments/mrgjvd/should_i_sell_a_percentage/,1,5
mrgmfp,1618499258,(Help) Is my crypto irretrievable?,[removed],https://www.reddit.com/r/ethereum/comments/mrgmfp/help_is_my_crypto_irretrievable/,1,0
mrgope,1618499441,"I lost Ethereum from metamask to coinbase, help?","I haven't received my money in my coinbase, how long does it take from metamask to coinbase?\n\n[https://etherscan.io/tx/0x40c6491c57854c40ba56aead2e9c5e382428c2fc2c877fc91569b03a00caeb85](https://etherscan.io/tx/0x40c6491c57854c40ba56aead2e9c5e382428c2fc2c877fc91569b03a00caeb85)",https://www.reddit.com/r/ethereum/comments/mrgope/i_lost_ethereum_from_metamask_to_coinbase_help/,1,31
mrh0la,1618500408,ELI12: Ethereum error after Berlin Hard Fork?,[removed],https://www.reddit.com/r/ethereum/comments/mrh0la/eli12_ethereum_error_after_berlin_hard_fork/,1,17
mrh108,1618500441,I'm new to sending Ethereum and struggling to send tokens,[removed],https://www.reddit.com/r/ethereum/comments/mrh108/im_new_to_sending_ethereum_and_struggling_to_send/,1,0
mrhdfm,1618501430,The OpenEthereum issue has been resolved. All systems go!,,https://www.reddit.com/r/ethereum/comments/mrhdfm/the_openethereum_issue_has_been_resolved_all/,1,8
mrhduc,1618501465,what's up with etherium gas? it hasn't gone down,[removed],https://www.reddit.com/r/ethereum/comments/mrhduc/whats_up_with_etherium_gas_it_hasnt_gone_down/,1,0
mrhk0r,1618501969,Need help with stuck transaction,[removed],https://www.reddit.com/r/ethereum/comments/mrhk0r/need_help_with_stuck_transaction/,1,1
mrhmov,1618502182,ETH in Coinbase -&gt; Binance Wallet ‘sending ethereum temporarily disabled’,[removed],https://www.reddit.com/r/ethereum/comments/mrhmov/eth_in_coinbase_binance_wallet_sending_ethereum/,1,0
mrhnij,1618502250,Coinbase issues with Ethereum blocking withdrawal while it's investigation,,https://www.reddit.com/r/ethereum/comments/mrhnij/coinbase_issues_with_ethereum_blocking_withdrawal/,1,0
mrhqbk,1618502466,A “successful” completion of ETH 2.0 will lead to the transition of a Programable economy as well as the creation of the WWL (World Wide Ledger).,"Similar to the way the World Wide Web was the foundation for ebusiness, WWL will be the foundation of decentralized digital business.",https://www.reddit.com/r/ethereum/comments/mrhqbk/a_successful_completion_of_eth_20_will_lead_to/,1,7
mrht7b,1618502690,Beginner crypto investor looking for platform advice,"Hello,\n\nI'm planning on putting $1000-1400 into Ethereum and $600-800 into Bitcoin This is my first time investing (and crypto), and I was planning on using Coinbase Pro because of smaller amounts of fees. I also read somewhere that some people would buy crypto on Coinbase then transfer to Coinbase Pro for trading, but would that work with the amount of money I plan on investing? Or, would it make more sense just to deposit that cash into Coinbase Pro and invest from there?\n\nSorry for the beginner question, thank you!",https://www.reddit.com/r/ethereum/comments/mrht7b/beginner_crypto_investor_looking_for_platform/,1,26
