id,created_utc,title,selftext,full_link,score,comments
mt0bt1,1618697620,Is a first deposit fee normal?,Just getting into Ethereum and crypto. I downloaded Argent bc it's open source and I want something I can buy eth directly from my wallet.\n\nIt's telling me there's a .0371 eth fee on my first deposit. Is this typical? Should I be using another wallet?,https://www.reddit.com/r/ethereum/comments/mt0bt1/is_a_first_deposit_fee_normal/,1,19
mt0d8z,1618697757,❤❤❤,,https://www.reddit.com/r/ethereum/comments/mt0d8z/_/,1,0
mt0lxd,1618698617,These Awesome Necklaces are FREE for a Very Limited Time! Only 1 Left,,https://www.reddit.com/r/ethereum/comments/mt0lxd/these_awesome_necklaces_are_free_for_a_very/,1,0
mt0nbe,1618698748,Where can I learn more about Ethereum?,"I want to know about things that go on in the Ethereum sphere, how much is in circulation, the amount of daily transactions, basically I want to be able to do a technical analysis on the crypt and I don't know where to start, please help",https://www.reddit.com/r/ethereum/comments/mt0nbe/where_can_i_learn_more_about_ethereum/,1,40
mt0tn4,1618699377,floppacoin,,https://www.reddit.com/r/ethereum/comments/mt0tn4/floppacoin/,1,1
mt0zz6,1618700021,My Etereum wallet not loading on Trezor,[removed],https://www.reddit.com/r/ethereum/comments/mt0zz6/my_etereum_wallet_not_loading_on_trezor/,1,1
mt15z2,1618700609,Why wont my ENJ transaction be put into a block using 136GWEI?,[removed],https://www.reddit.com/r/ethereum/comments/mt15z2/why_wont_my_enj_transaction_be_put_into_a_block/,1,0
mt1821,1618700810,Coincircle,[removed],https://www.reddit.com/r/ethereum/comments/mt1821/coincircle/,1,0
mt19cc,1618700931,EtherLite #launch Ethereum #Hard Fork,,https://www.reddit.com/r/ethereum/comments/mt19cc/etherlite_launch_ethereum_hard_fork/,1,0
mt1d75,1618701290,Maybe my best investment in 2021,"I stumbled across the project StudentCoin. Seems to be the biggest ICO 2021. Maybe my best investment in 2021.\n\nThe project is unique in the crypto space and if it starts to get more attention it can become a very popular coin.\n\n- Anybody can create their own token on top of StudentCoin via a web interface. No programming skills required. \n- If you stake StudentCoin (STC) you earn from all transactions of the tokens on top of STC. \n- Students are the future and bring innovation and proper use cases.\n- They are planning to build an education program to make students early learn about blockchain.. so they probably will use STC to build interesting projects on top of it.\n  \nIn two weeks they just launched their wallet, mobile app and announced 3 exchange listings.\n\nThe team confirmed that STC is going to be listed on 9 new exchanges from the top 50 (a few from them are top 20 and top 10) from May 2021.\n\nTheir presale is currently live and 145 of 150 phases are finished.\n\nA review is nothing without negative points and criticisms:\n\n- Communication of the team could be improved\n\n- There is a lot of FUD.. The team could just clear this up better and comment on all the criticisms. To improve that they are planning to make a team interview series from next week to be closer to the community.\n\n- The 500 universities are not all real partners.. they just have students from those universities as supporter.. its not clear which universities are partners\n\nThe ico price is still really low with 0.021 USD.\n\nA small portion of the circulating supply is beeing traded on CoinTiger and Uniswap for 0.03 USD already and went up to $0.07 some days ago.\n\nStudentCoin is already on CoinMarketCap: https://coinmarketcap.com/currencies/student-coin/\n\nStudentCoin Twitter: https://mobile.twitter.com/studentcoinorg\n\nThere are three options to participate:\n\n- buy STC via Credit Card\n\n- send ETH from your MetaMask wallet\n\n- send any crypto to the Coinbase Commerce payment method\n\nI just found out you can buy the coinbase packages but send more than the package price.. you will receive the correct amount of STC even if you overpay the package.\n\nI recommend using Litecoin due to its low transaction fees.\n\nCoinbase Commerce works also for US investors.\n\nUse this bonus code to get 5% more at the purchase.\n\nCODE: Sxlb8setj7\n\nProject page: [https://studentcoin.app](https://studentcoin.app/?ref=Sxlb8setj7)\n\n\n** This is not a financial advice. Do your own research and only invest what you can afford to lose",https://www.reddit.com/r/ethereum/comments/mt1d75/maybe_my_best_investment_in_2021/,1,0
mt1f62,1618701484,Coinbase changes ethereum staking to 6% with no ability to withdraw,[removed],https://www.reddit.com/r/ethereum/comments/mt1f62/coinbase_changes_ethereum_staking_to_6_with_no/,1,0
mt1hrs,1618701754,The most profitable Crypto Mining Equipment on the market! Huge discounts!,,https://www.reddit.com/r/ethereum/comments/mt1hrs/the_most_profitable_crypto_mining_equipment_on/,1,0
mt209v,1618703634,Kucoin Exchange Stole My Money,[removed],https://www.reddit.com/r/ethereum/comments/mt209v/kucoin_exchange_stole_my_money/,1,0
mt21lz,1618703776,DAOs and the pitfals of the progressive decentralisation,,https://www.reddit.com/r/ethereum/comments/mt21lz/daos_and_the_pitfals_of_the_progressive/,1,1
mt29vu,1618704631,Kucoin Exchange Stole My Money,[removed],https://www.reddit.com/r/ethereum/comments/mt29vu/kucoin_exchange_stole_my_money/,1,0
mt2b8y,1618704750,$KONG is going crazyyyyy,,https://www.reddit.com/r/ethereum/comments/mt2b8y/kong_is_going_crazyyyyy/,1,0
mt2nn7,1618706069,miners are blind,[removed],https://www.reddit.com/r/ethereum/comments/mt2nn7/miners_are_blind/,1,0
mt2oyl,1618706210,How do USDC creators make profits?,[removed],https://www.reddit.com/r/ethereum/comments/mt2oyl/how_do_usdc_creators_make_profits/,1,0
mt2sks,1618706605,"Buy,buy,buy",[removed],https://www.reddit.com/r/ethereum/comments/mt2sks/buybuybuy/,1,0
mt2t8x,1618706676,Staking on Guarda?,[removed],https://www.reddit.com/r/ethereum/comments/mt2t8x/staking_on_guarda/,1,0
mt2vij,1618706929,Just got this beauty done 🚀,,https://www.reddit.com/r/ethereum/comments/mt2vij/just_got_this_beauty_done/,1,0
mt2xpu,1618707170,Just got this beauty done. HODL for life,,https://www.reddit.com/r/ethereum/comments/mt2xpu/just_got_this_beauty_done_hodl_for_life/,1,0
mt2z75,1618707328,🔴 Cryptocurrency 24/7: $BTC $ETH $LTC $BCH $XRP $XLM $TRX Bitcoin Ethereum Litecoin Ripple,,https://www.reddit.com/r/ethereum/comments/mt2z75/cryptocurrency_247_btc_eth_ltc_bch_xrp_xlm_trx/,1,0
mt3db0,1618708899,what is happening?,[removed],https://www.reddit.com/r/ethereum/comments/mt3db0/what_is_happening/,1,2
mt3it3,1618709493,Coinbase Verified Accounts,[removed],https://www.reddit.com/r/ethereum/comments/mt3it3/coinbase_verified_accounts/,1,0
mt3kjt,1618709681,"THE NON-FUNGIBLE POOP by disturbance , ⚠️Unsold on Foundation.!",,https://www.reddit.com/r/ethereum/comments/mt3kjt/the_nonfungible_poop_by_disturbance_unsold_on/,1,0
mt3ovg,1618710160,Unique Recover Ether Question,"Howdy all! Hoping someone can help. I'm a newbie to Crypto. Back in 2017 I bought some Ether on a whim. I bought it with Coinbase and transferred it to my Mist Ether wallet (I had no idea what I was doing).\n\nI remember back it seemed like it never fully made it to the wallet. It would download forever and never quite get there.\n\nI recently gained access to my old Coinbase account, and it confirms that the Ether was sent. I then double checked with Etherscan and it shows the transfer as complete. When I boot up my old hard-drive with the Mist wallet (I verified that the address was indeed correct) but it does not have the Ether, nor does it ever show in the transaction history that it ever received it. Now Mist wallet is no more.\n\nIs there a way to attempt to recover this Ether?\n\nThanks for the help!",https://www.reddit.com/r/ethereum/comments/mt3ovg/unique_recover_ether_question/,1,0
mt3whd,1618711043,Buying/trading ETH with BTC: best place without KYC?,[removed],https://www.reddit.com/r/ethereum/comments/mt3whd/buyingtrading_eth_with_btc_best_place_without_kyc/,1,0
mt47y8,1618712321,Just got banned on the B i t c o i n sub.,I brought up ETH and basically was told by the mods that ETH is a scam and I’m trying to scam people for giving my opinion on BTC vs ETH. Why do they think ETH is a scam over there?,https://www.reddit.com/r/ethereum/comments/mt47y8/just_got_banned_on_the_b_i_t_c_o_i_n_sub/,1,282
mt4cd8,1618712812,How to save more money in crypto,[removed],https://www.reddit.com/r/ethereum/comments/mt4cd8/how_to_save_more_money_in_crypto/,1,0
mt4cte,1618712864,How to save more money in crypto,[removed],https://www.reddit.com/r/ethereum/comments/mt4cte/how_to_save_more_money_in_crypto/,1,0
mt4ep9,1618713077,"Dropped My Second NFT today, I imagine you’ve all experienced this feeling when trading.",,https://www.reddit.com/r/ethereum/comments/mt4ep9/dropped_my_second_nft_today_i_imagine_youve_all/,1,1
mt4m3c,1618713935,Tis Merely A Flesh Wound,,https://www.reddit.com/r/ethereum/comments/mt4m3c/tis_merely_a_flesh_wound/,1,0
mt4tw2,1618714852,How to save more money in crypto,[removed],https://www.reddit.com/r/ethereum/comments/mt4tw2/how_to_save_more_money_in_crypto/,1,0
mt4x2h,1618715212,How to save more money in crypto,[removed],https://www.reddit.com/r/ethereum/comments/mt4x2h/how_to_save_more_money_in_crypto/,1,0
mt550c,1618716118,Reduced Ethermine Payouts,"Sorry all if this is a ridiculous question, but I've been reading the Ethermine FAQs and agreements but i cant get any info (or at least cant figure out) how payouts are calculated in general.  I've noticed over the last couple of months that my payouts (as measured in Eth) are consistently getting smaller.  Obviously the price of Eth has shot up so i'm wondering if the payouts to the pool are somehow tied to a dollar value at any given moment?  Any insight into why the reduction (my hashrate and uptime has been pretty consistent) would be very much appreciated!",https://www.reddit.com/r/ethereum/comments/mt550c/reduced_ethermine_payouts/,1,5
mt5888,1618716471,eth dip,[removed],https://www.reddit.com/r/ethereum/comments/mt5888/eth_dip/,1,0
mt5id9,1618717646,Issues with Metamask? Not getting Ethereum?,[removed],https://www.reddit.com/r/ethereum/comments/mt5id9/issues_with_metamask_not_getting_ethereum/,1,0
mt5idb,1618717646,"Ethereum at $1,976 right now 11:36pm",[removed],https://www.reddit.com/r/ethereum/comments/mt5idb/ethereum_at_1976_right_now_1136pm/,1,1
mt5jc2,1618717756,PRICE DUMP? WHY?,[removed],https://www.reddit.com/r/ethereum/comments/mt5jc2/price_dump_why/,1,0
mt5jji,1618717779,"""GAS!!"" 😭",,https://www.reddit.com/r/ethereum/comments/mt5jji/gas/,1,3
mt5s09,1618718742,Ethereum 2.0 Explained for Artists,,https://www.reddit.com/r/ethereum/comments/mt5s09/ethereum_20_explained_for_artists/,1,0
mt5six,1618718806,No ETH electrum wallet?,"I use electrium for BTC and LTC, however i noticed there was not an electrum wallet for ETH on (https://ethereum.org/en/wallets/find-wallet/).\n\nFor a newbie what is the recommended wallet? \nI want a wallet that is recommend by the project, so preferably one listed from the about site...\n\nthoughts?",https://www.reddit.com/r/ethereum/comments/mt5six/no_eth_electrum_wallet/,1,6
mt5t7c,1618718886,Eth on sale,[removed],https://www.reddit.com/r/ethereum/comments/mt5t7c/eth_on_sale/,1,1
mt61ek,1618719894,Spread between robinhood and CBP,[removed],https://www.reddit.com/r/ethereum/comments/mt61ek/spread_between_robinhood_and_cbp/,1,0
mt6230,1618719980,Three Simple Tips For Successful Cryptocurrency Trading,[removed],https://www.reddit.com/r/ethereum/comments/mt6230/three_simple_tips_for_successful_cryptocurrency/,1,0
mt639a,1618720134,Got my 1st whole coin,[removed],https://www.reddit.com/r/ethereum/comments/mt639a/got_my_1st_whole_coin/,1,0
mt73rt,1618724877,"If you're on the Ethereum train, you're likely in this for the long run.",[removed],https://www.reddit.com/r/ethereum/comments/mt73rt/if_youre_on_the_ethereum_train_youre_likely_in/,1,0
mt74kv,1618724990,trust wallet crypto swap,[removed],https://www.reddit.com/r/ethereum/comments/mt74kv/trust_wallet_crypto_swap/,1,0
mt78fc,1618725531,TRON,[removed],https://www.reddit.com/r/ethereum/comments/mt78fc/tron/,1,0
