id,created_utc,title,selftext,full_link,score,comments
mu210g,1618843148,Dumping my life savings,[removed],https://www.reddit.com/r/ethereum/comments/mu210g/dumping_my_life_savings/,1,0
mu21z0,1618843222,Tiny gas fee,[removed],https://www.reddit.com/r/ethereum/comments/mu21z0/tiny_gas_fee/,1,0
mu225f,1618843235,"Coinbase IPO, Bitcoin Security with CoinsureNZ, Bitcoin in New Zealand: To the Moon ep. 9",,https://www.reddit.com/r/ethereum/comments/mu225f/coinbase_ipo_bitcoin_security_with_coinsurenz/,1,0
mu2j03,1618844558,Do you think ETH will ever dip below $2k??,[removed],https://www.reddit.com/r/ethereum/comments/mu2j03/do_you_think_eth_will_ever_dip_below_2k/,1,0
mu2re2,1618845196,FAILED SWAP IN UNISWAP,[removed],https://www.reddit.com/r/ethereum/comments/mu2re2/failed_swap_in_uniswap/,1,0
mu2tcw,1618845347,Why does the gas price for depositing ETH to my NEXO account is so high?,[removed],https://www.reddit.com/r/ethereum/comments/mu2tcw/why_does_the_gas_price_for_depositing_eth_to_my/,1,0
mu2tyl,1618845392,How often do people lose money by sending it to the wrong address?,[removed],https://www.reddit.com/r/ethereum/comments/mu2tyl/how_often_do_people_lose_money_by_sending_it_to/,1,0
mu2un0,1618845448,"If your Bank offered a Cryptocurrency Wallet Service, (similar to a service offered by Coinbase), would you be happy to use it?",[removed]\n\n[View Poll](https://www.reddit.com/poll/mu2un0),https://www.reddit.com/r/ethereum/comments/mu2un0/if_your_bank_offered_a_cryptocurrency_wallet/,1,0
mu3aag,1618846609,CC payments - settled in ETH - for all NFT purchases... opening the door to the mass market!,,https://www.reddit.com/r/ethereum/comments/mu3aag/cc_payments_settled_in_eth_for_all_nft_purchases/,1,1
mu3dqe,1618846883,Tell me if I'm stupid,[removed],https://www.reddit.com/r/ethereum/comments/mu3dqe/tell_me_if_im_stupid/,1,0
mu3ewh,1618846969,Check out HollaEx! They added more alt coins!,,https://www.reddit.com/r/ethereum/comments/mu3ewh/check_out_hollaex_they_added_more_alt_coins/,1,0
mu3gug,1618847122,Staking vs interest accounts,"I've had 1 eth staked for about 4 months now amd recently I stumbled upon blockfi and their compound interest intrigued me. Naturally I decided to see how the 2 would stack up so I threw 1 eth on blockfi about 1 month ago... so far I've made 10.93 worth of eth which will be added to my total eth at the end of the month ( started mid-month so I added my total so far, as I have already gained some interest from march) anyway, i have not made a cent of interest on coinbase through my 1 staked eth nor can i withdraw my staked eth. Still waiting to see the interest I accrue on the eth when it actually happens. Any thoughts? Maybe I'm not seeing the full picture",https://www.reddit.com/r/ethereum/comments/mu3gug/staking_vs_interest_accounts/,1,30
mu3muj,1618847587,I bought 2 ethereums today,[removed],https://www.reddit.com/r/ethereum/comments/mu3muj/i_bought_2_ethereums_today/,1,0
mu43gc,1618848828,Saving Gas on the Ethereum Mainnet,,https://www.reddit.com/r/ethereum/comments/mu43gc/saving_gas_on_the_ethereum_mainnet/,1,2
mu44c0,1618848889,Get United!!!,[removed],https://www.reddit.com/r/ethereum/comments/mu44c0/get_united/,1,0
mu47xu,1618849153,Join the talk with Vitalik B &amp; Martin S. for overview &amp; questions on EIP-3403: Partial removal of refunds," [Vitalik Buterin](https://github.com/vbuterin), [Martin Swende](https://github.com/holiman) are going to talk about **EIP-3403: Partial removal of refunds** on #[PEEPanEIP](https://www.youtube.com/playlist?list=PL4cwHXAawZxqu0PKKyMzG_3BJV_xZTi1F) with Ethereum Cat Herders on **April 20, 2021, at 1400 UTC**.   \n\nIf you've thoughts, comments, and questions on the proposal, leave it in the comment below or join the conversation. \n\nPlease **be noted**, this [call](https://twitter.com/poojaranjan19/status/1384131154496790528) is organized to increase awareness of the EIPs for upcoming upgrades and not for making any decisions for the London upgrade.\n\n**Resources**\n\n* Proposal - [EIP-3403: Partial removal of refunds](https://eips.ethereum.org/EIPS/eip-3403)\n* Discussion - [FEM](https://ethereum-magicians.org/t/eip-3298-removal-of-refunds/5430)\n\n&amp;#x200B;\n\nhttps://preview.redd.it/1u2j6zi4o5u61.jpg?width=1909&amp;format=pjpg&amp;auto=webp&amp;s=b439267fa738fcd318427411d84dcf194decd74f",https://www.reddit.com/r/ethereum/comments/mu47xu/join_the_talk_with_vitalik_b_martin_s_for/,1,1
mu4pbl,1618850476,How convince my friends to buy productive coins like ETH instead of Dogecoin,All my friends recently got into crypto but they keep falling for every new Binance shitcoin that pops up and sending dogecoin updates in the group chat. Im having a morale dilemma on whether I should really put in some effort to explain to them that most of these coins are garbage and will hit 0 during the next crypto winter or should i just let them figure it out. \n\nI've been leaning to the latter but I feel like throwing them to the wolves might just discourage them from crypto but like the alternative makes me come off as a buzz kill. \n\n&amp;#x200B;\n\nDoes anyone have any advice on how to handle this?,https://www.reddit.com/r/ethereum/comments/mu4pbl/how_convince_my_friends_to_buy_productive_coins/,1,626
mu4q84,1618850540,HELP!! I WANT MY ETH BACK!!,[removed],https://www.reddit.com/r/ethereum/comments/mu4q84/help_i_want_my_eth_back/,1,0
mu4y76,1618851162,Why the price of eth falls and at the same time the price of gas grows?,[removed],https://www.reddit.com/r/ethereum/comments/mu4y76/why_the_price_of_eth_falls_and_at_the_same_time/,1,0
mu5ekr,1618852388,The Ethereum Family Conundrum,"I get that a lot people in this sub are all in on Ethereum, but I have to ask this question: \n\nWhy do Ethereum holders treat the relationship between Ethereum and Ethereum Classic as a non-zero sum game?\n\nIf I had lots of profit or interest in Ethereum, I would most definitely want to put a portion into Ethereum Classic since it will become the base layer of the Ethereum family once Ethereum moves fully to L2 (PoS).\n\nI know people associate ETC with its past, but I think it’s time that Ethereum fans also start supporting the lesser known member of the family as it will benefit both coins going forward! \n\nI welcome any thoughts about this!",https://www.reddit.com/r/ethereum/comments/mu5ekr/the_ethereum_family_conundrum/,1,22
mu5jof,1618852776,Is There Money In The NFT Fad For Sports Media Brands?,,https://www.reddit.com/r/ethereum/comments/mu5jof/is_there_money_in_the_nft_fad_for_sports_media/,1,0
mu5m70,1618852961,Brand new sub for 🚜 and memes,,https://www.reddit.com/r/ethereum/comments/mu5m70/brand_new_sub_for_and_memes/,1,0
mu5mk1,1618852988,Layer two solution is live!,[removed],https://www.reddit.com/r/ethereum/comments/mu5mk1/layer_two_solution_is_live/,1,0
mu5t9v,1618853491,Is nft the new mp3?,,https://www.reddit.com/r/ethereum/comments/mu5t9v/is_nft_the_new_mp3/,1,1
mu5yfl,1618853881,smh,,https://www.reddit.com/r/ethereum/comments/mu5yfl/smh/,1,0
mu5yxd,1618853921,how can the voter verify that the candidate’s choice has not changed?,[removed],https://www.reddit.com/r/ethereum/comments/mu5yxd/how_can_the_voter_verify_that_the_candidates/,1,0
mu69pm,1618854735,SOS limited is undervalued in my opinion,[removed],https://www.reddit.com/r/ethereum/comments/mu69pm/sos_limited_is_undervalued_in_my_opinion/,1,0
mu6a20,1618854761,SOS limited,[removed],https://www.reddit.com/r/ethereum/comments/mu6a20/sos_limited/,1,0
mu6gnh,1618855239,Ok. Your thoughts on ETC?,[removed],https://www.reddit.com/r/ethereum/comments/mu6gnh/ok_your_thoughts_on_etc/,1,0
mu6i62,1618855348,"Is right now a good time to invest in ethereum? If so, why?",,https://www.reddit.com/r/ethereum/comments/mu6i62/is_right_now_a_good_time_to_invest_in_ethereum_if/,1,19
mu6ym6,1618856565,Do you think ETH will ever dip below $2k??,[removed],https://www.reddit.com/r/ethereum/comments/mu6ym6/do_you_think_eth_will_ever_dip_below_2k/,1,0
mu6zh5,1618856630,The most profitable Crypto Mining Equipment on the market! Huge discounts!,,https://www.reddit.com/r/ethereum/comments/mu6zh5/the_most_profitable_crypto_mining_equipment_on/,1,0
mu78jy,1618857305,"Sorry, can't go on our date. All my extra fiat goes to help my ETH token babies grow.",,https://www.reddit.com/r/ethereum/comments/mu78jy/sorry_cant_go_on_our_date_all_my_extra_fiat_goes/,1,0
mu7fgl,1618857816,What will Cryptocurrency and Ethereum be like in 5 years?,"For the last five years I've wondered where it's all going, and of course, there's much that's happened that I never expected (NFTs, for example). I thought we'd all have blockchain enabled websites, which probably isn't going to happen, at least, not in the foreseeable future. I didn't see how big of issue scaling would become, I knew it would be an issue, but not like this. \n\nBut what about you? What do you think cryptocurrency will look like in 5 years?\n\n* Will the majority of major companies be interacting via L2 services to Ethereum?\n* Will Bitcoin fall to a subordinate position to Ethereum (this one seems pretty obvious to me, but who knows, maybe you still see a ""store of value"" favoring an old chunky chain over a useful one.\n* Will other blockchains survive in reasonable market share or will interoperating L2s make their ""uniqueness"" and pitch irrelevant?\n* Will Bank of America be offering a stable-coin checking/savings account, with 1% interest for staking via savings (lol, hey, that's probably a good idea Bank of America, you can tip me if you're reading this)\n\nI would love to hear your vision for cryptocurrency for 2026.",https://www.reddit.com/r/ethereum/comments/mu7fgl/what_will_cryptocurrency_and_ethereum_be_like_in/,1,72
mu7jaw,1618858109,REALLY?! Would you farm Harvest Finance with Binance Smart Chain?,,https://www.reddit.com/r/ethereum/comments/mu7jaw/really_would_you_farm_harvest_finance_with/,1,0
mu7p4b,1618858553,How high do you think ETH will go this bull run?,[removed]\n\n[View Poll](https://www.reddit.com/poll/mu7p4b),https://www.reddit.com/r/ethereum/comments/mu7p4b/how_high_do_you_think_eth_will_go_this_bull_run/,1,0
mu7ruw,1618858769,LIVE invervie with BTCS the CEO of an ETH staking business.,,https://www.reddit.com/r/ethereum/comments/mu7ruw/live_invervie_with_btcs_the_ceo_of_an_eth_staking/,1,0
mu7x3k,1618859129,CI Global Asset Management to Temporarily Waive Entire Management Fee on World’s First Ether ETF: CI Galaxy Ethereum ETF (ETHX),,https://www.reddit.com/r/ethereum/comments/mu7x3k/ci_global_asset_management_to_temporarily_waive/,1,0
mu7zrk,1618859334,Above the Treetops NFT link in comments,,https://www.reddit.com/r/ethereum/comments/mu7zrk/above_the_treetops_nft_link_in_comments/,1,4
mu894i,1618860048,Above the Treetops NFT link in comments,,https://www.reddit.com/r/ethereum/comments/mu894i/above_the_treetops_nft_link_in_comments/,1,1
mu8fjs,1618860537,What do I do with a $1M in ether?,[removed],https://www.reddit.com/r/ethereum/comments/mu8fjs/what_do_i_do_with_a_1m_in_ether/,1,0
mu8g7s,1618860588,Awesome!!! BCH,[removed],https://www.reddit.com/r/ethereum/comments/mu8g7s/awesome_bch/,1,0
mu8ixa,1618860796,SAVIX,[removed],https://www.reddit.com/r/ethereum/comments/mu8ixa/savix/,1,0
mu8mgm,1618861057,Advice from expert or recovery service for MetaMask Wallet recovery,[removed],https://www.reddit.com/r/ethereum/comments/mu8mgm/advice_from_expert_or_recovery_service_for/,1,0
mu8nb4,1618861120,Lost wallet! Looking for advice or help,[removed],https://www.reddit.com/r/ethereum/comments/mu8nb4/lost_wallet_looking_for_advice_or_help/,1,0
mu9525,1618862464,Korean virtual idol member collaborated with Digital art and then is invited in NFT auction,,https://www.reddit.com/r/ethereum/comments/mu9525/korean_virtual_idol_member_collaborated_with/,1,0
mu95s5,1618862517,The most profitable Crypto Mining Equipment on the market! Huge discounts!,,https://www.reddit.com/r/ethereum/comments/mu95s5/the_most_profitable_crypto_mining_equipment_on/,1,0
mu9azd,1618862911,Taking out a loan and putting eth as collateral,[removed],https://www.reddit.com/r/ethereum/comments/mu9azd/taking_out_a_loan_and_putting_eth_as_collateral/,1,0
mu9bes,1618862945,Social Token ZYM Database &gt; ERC20 Ethereum 💪,[removed],https://www.reddit.com/r/ethereum/comments/mu9bes/social_token_zym_database_erc20_ethereum/,1,0
mu9dts,1618863122,"Since the current year is the year of the bull, next year is the year of the water tiger. After thorough examination I've come to the conclusion that this means it will keep above sea level; aka 6371.146km. This means eth will stay above 6371.146$/eth. Thanks for coming to my ted talk.",,https://www.reddit.com/r/ethereum/comments/mu9dts/since_the_current_year_is_the_year_of_the_bull/,1,0
