id,created_utc,title,selftext,full_link,score,comments
mvafzh,1618989794,Cash and carry ETH in US,[removed],https://www.reddit.com/r/ethereum/comments/mvafzh/cash_and_carry_eth_in_us/,1,0
mvaje2,1618990251,Can Blockchain Save Humanity? The Rise of Charity Tokens - Meet Munch Token &amp; SpacePenguin,,https://www.reddit.com/r/ethereum/comments/mvaje2/can_blockchain_save_humanity_the_rise_of_charity/,1,12
mvajyx,1618990333,MEW Exit Scam?,[removed],https://www.reddit.com/r/ethereum/comments/mvajyx/mew_exit_scam/,1,1
mvaugu,1618991839,Bill gates talking about Bitcoin,,https://www.reddit.com/r/ethereum/comments/mvaugu/bill_gates_talking_about_bitcoin/,1,0
mvaysx,1618992388,Sweet,[removed],https://www.reddit.com/r/ethereum/comments/mvaysx/sweet/,1,1
mvb7p1,1618993608,Purchased my first Ethereum. It’s been my goal for more than 6 months now as it’s every expensive to buy one whole coin in my local fiat. I know it’s a little late but i’m still excited about the future of Eth. I’m glad to be part of this community starting today!,,https://www.reddit.com/r/ethereum/comments/mvb7p1/purchased_my_first_ethereum_its_been_my_goal_for/,1,1
mvb8er,1618993714,What are the recommended gas settings if time is not an issue?,[removed],https://www.reddit.com/r/ethereum/comments/mvb8er/what_are_the_recommended_gas_settings_if_time_is/,1,8
mvbdxn,1618994499,Still 0.1 ETH for grabs for Fermats last theorem counterexample,Fermats last theorem states a^n + b^n = c^n where n &gt; 2 is insoluble with integers.\n\nI recently rediscovered my old smart contract that would give a prize if you find a counterexample.\nhttps://etherscan.io/address/0x21b7637f29e2476c3d540219d8ab8b85b114c2b1\n\nFinding a solution is obviously impossible since it has already been proved that no solution exists.\n\nJust wanted to share this as I still think Ethereum could be used to create incentives for solving interesting math problems.,https://www.reddit.com/r/ethereum/comments/mvbdxn/still_01_eth_for_grabs_for_fermats_last_theorem/,1,19
mvbfes,1618994723,ETH 2.0 Staking still possible?,"Hi Guys,\n\nMy question, can I still participate in ETH2.0 staking? Since I basically just hodl I thought, why not staking and checked binance. They give you the option to stake to ETH 2.0, but somehow they give you their native BETH Token as reward which can be exchanged 1:1 to ETH. Besides it sounding really sketchy, I do not want to support Binance in any way. My question, is it still possible to stake ETH via Ledger? Or is the Binance ETH 2.0 recommendable?\n\n&amp;#x200B;\n\nThanks guys!",https://www.reddit.com/r/ethereum/comments/mvbfes/eth_20_staking_still_possible/,1,13
mvbfp3,1618994767,"I’m a 19 year old who knows nothing about ETH but wants to invest $2k into it, where do I start?",[removed],https://www.reddit.com/r/ethereum/comments/mvbfp3/im_a_19_year_old_who_knows_nothing_about_eth_but/,1,0
mvbl88,1618995592,"Thanks everyone for contributing, in any way.",[removed],https://www.reddit.com/r/ethereum/comments/mvbl88/thanks_everyone_for_contributing_in_any_way/,1,0
mvbmih,1618995751,ElonGate to the Mooooon!!!!,[removed],https://www.reddit.com/r/ethereum/comments/mvbmih/elongate_to_the_mooooon/,1,0
mvboy0,1618996083,Controversial thoughts about Ethereum and other cryptocurrency,[removed],https://www.reddit.com/r/ethereum/comments/mvboy0/controversial_thoughts_about_ethereum_and_other/,1,0
mvbxuz,1618997272,What exactly is Ethereum? (Guide),[removed],https://www.reddit.com/r/ethereum/comments/mvbxuz/what_exactly_is_ethereum_guide/,1,0
mvbyq7,1618997391,19 years old with $2K to invest into ETH but I know NOTHING. where do I start?,"I’ just turned 19 and I’ve got around $2k AUD that I want to invest into ethereum. Don’t really care if I lose it as I’m looking to hold till ETH hits 10k. Problem  is, I know next to nothing. I struggle to understand the terminology and lingo used in subreddits and articles. As of now, all I know is that to buy ETH I have to use Coinbase I think? Is that it? Honestly just looking for beginner friendly guides that start with the assumption you know nothing.",https://www.reddit.com/r/ethereum/comments/mvbyq7/19_years_old_with_2k_to_invest_into_eth_but_i/,1,139
mvc1lb,1618997759,"Earn Bitcoin, Dice, Plinko,Crash and More game",,https://www.reddit.com/r/ethereum/comments/mvc1lb/earn_bitcoin_dice_plinkocrash_and_more_game/,1,0
mvc5gn,1618998267,WEB3.0 and the role of Permission network,,https://www.reddit.com/r/ethereum/comments/mvc5gn/web30_and_the_role_of_permission_network/,1,0
mvc7sp,1618998593,Interlude: introducing game protocols,,https://www.reddit.com/r/ethereum/comments/mvc7sp/interlude_introducing_game_protocols/,1,0
mvc8ue,1618998721,"Help please, can someone explain my problem(coinbase to binance)",[removed],https://www.reddit.com/r/ethereum/comments/mvc8ue/help_please_can_someone_explain_my/,1,0
mvcak2,1618998939,Adaptive Decentralisation - A new Concept to Power The Blockchain Space (An Essay),[removed],https://www.reddit.com/r/ethereum/comments/mvcak2/adaptive_decentralisation_a_new_concept_to_power/,1,0
mvclfk,1619000269,Eth miner for your phone,[removed],https://www.reddit.com/r/ethereum/comments/mvclfk/eth_miner_for_your_phone/,1,0
mvcmci,1619000387,InsurAce (DeFi Insurance Protocol) Announces Mainnet Launch - Staking will go live!,,https://www.reddit.com/r/ethereum/comments/mvcmci/insurace_defi_insurance_protocol_announces/,1,0
mvcu3g,1619001328,ETH/BTC Breakout Is On,[removed],https://www.reddit.com/r/ethereum/comments/mvcu3g/ethbtc_breakout_is_on/,1,0
mvcuhi,1619001379,CargoX - HUGE - REALUSECASE - based on ETHERERUM - CARGOX,[removed],https://www.reddit.com/r/ethereum/comments/mvcuhi/cargox_huge_realusecase_based_on_ethererum_cargox/,1,0
mvd48j,1619002543,i’m 19 with 32 should i drop out of college now or next year 🤣,,https://www.reddit.com/r/ethereum/comments/mvd48j/im_19_with_32_should_i_drop_out_of_college_now_or/,1,0
mvdemy,1619003666,Transaction finality,[removed],https://www.reddit.com/r/ethereum/comments/mvdemy/transaction_finality/,1,0
mvdhz1,1619004020,Truly decentralized?,"The insanity that happened this weekend when Chinese mining went offline is concerning to me. I believe fully in the decentralization aspect of crypto, but am genuinely worried about the influence a communist/authoritarian govt has on the crypto ecosystem. Does anyone have any thoughts on this? Is decentralization just a mirage?",https://www.reddit.com/r/ethereum/comments/mvdhz1/truly_decentralized/,1,6
mvdqkd,1619004967,Where do gas and fee go?,[removed],https://www.reddit.com/r/ethereum/comments/mvdqkd/where_do_gas_and_fee_go/,1,0
mvdrk2,1619005079,Is the Ethereum protocol exhibiting predatory behavior? A Wednesday morning hype thread.,"\n\n\nIt’s 1996. Google is two years from founding. Amazon is reselling books. Video streaming is possible, if you own a 56k modem, live in a major city, are rich, and possess the technical know how to complete the several steps. President Clinton is “[B]uilding that bridge to the year two-*tha*sand.”\n\nGood old ‘96, Tupac has been shot dead and the three largest companies listed on any US stock exchange (by market cap) are car manufacturers: GM, Ford, and Chrysler, respectively. Yeah, that’s hard to believe. \n\nWe’ve talked about *fat protocol thesis* on this sub previously. So for those that know what it is, bear with me again while I briefly explain it for those that don’t: \n\n*The internet is a protocol. Value flows from its protocol to its applications. Google, Amazon, etcetera are its applications. Over time, they’ve become valuable. In cryptocurrency protocols however, value flows in the opposite direction, from the application layer to the protocol. Thus the name: fat protocol theory. Yes it’s just a theory, but so is gravity. It’s easy then, to imagine why Ethereum is uniquely positioned amongst its competition to capture so much value, because of all that’s built on it, its ecosystem. \n\nWhat’s interesting about the internet and its applications capturing value, is that we didn’t see that really begin until the late 90s. In the early-mid 90s, things were only arranging or jockeying themselves to an unknown future, so obvious to us now. And remember the ferocious competition? Anyone? That’s a book itself. Most of the companies went bankrupt, some merged, others were bought out. The ones that survived are global household names. \n\nIt’s difficult to avoid then, comparing Ethereum and cryptocurrencies to this time period, because it’s mirroring it in lockstep. Ah the 90s. Remember its tech rockstars? Of course you do, they’re still around imposing their will in various ways. In crypto we have one living rockstar (unless Satoshi is alive): Vitalik Buterin. And that’s...not insignificant either folks, not in the culture we live in, not for Ethereum’s early days. For the younger people out there, what’s happening in crypto now is basically your chance to live, in some telling, the 90s tech boom, from which half of the top 10 wealthiest US people come:\n\n - Bezos\n - Gates\n - Page\n - Ellison\n - Brin\n\nSo don’t squander it watching on the sidelines. It’s still so new. Yolo in.\n\nLet’s consider the last crypto bull cycle. Question: What crypto’s that were top ten in 2017, are top ten now? Only two: BTC and ETH (LTC is in and out of the top ten on any given week, having fallen 6 places from what was historically an unshakeable #3 position). But here’s the curious thing: if we expand that list to say the top 50, how many are ERC tokens? 33 are. The Ethereum network is starting to arrange and position itself. They [ERC tokens] now dominate the mid-tier of that list and are moving relentlessly upwards. USDC and ChainLink for example (both ERC), could break into the top ten soon. That would put three ERC tokens (ETH, LINK, USDC) in the top ten, and that is much more substantial than people think. How about visualizing the data in a different way: if we use the total crypto mkt cap which is approximately $2T, we see the entire Ethereum ecosystem makes up $500B or 25% of it. That’s more than a double percentage gain (almost triple actually) what it was in 2017. Bitcoin and Tether have a top ten relationship too. But USDC now has a mkt cap ~28% of Tether’s and gaining fast. Why is this happening? That was unthinkable just two years ago. And about BTC, the wrapped version (WBTC, an ERC token) is top 20 and moving up. That’s predatory, because the Ethereum Network is finding solutions to chew on things not natively built on it. Now, Ethereum will never eat Bitcoin anymore than Bing will eat Google (but Bing only exists because of antitrust laws), so a better analogy might be what email did to the USPS—didn’t kill it, but syphoned its small cost efficient property. I won’t even bother getting into the NFT market because it’s too nascent, but again, Ethereum is positioned to add this predatory wrinkle better than any other. Our century is young, and in these early days of crypto, unless you’re named BTC, innovation lag will kill you. \n\nWhat’s my point? My point is that like the internet and its value flow, the Ethereum protocol isn’t past 1996 yet. I don’t believe we’re seeing *fat protocol thesis* at work...not yet. And that’s a subject to ponder, because heretofore, there’s been a belief that it is. It’s important to add, that many scholars believe the thesis to be wrong and unprovable, including my economics professor. They’re right too, but only because the timeline data is too small, the thesis hasn’t had time to develop (as opposed to grow), because Amazon is still reselling books, AWS (Amazon Web Services Cloud) hasn’t democratized starting a small online business, Google doesn’t exist, ruthless competition is still killing things before they begin because the young galaxy is still full of space rocks, and global users are a small landlocked lake, not oceans yet...there’s less than 1M *active* Ethereum wallets.\n\nMy other point is that one has to wonder with trends so linear, wether holding anything besides Bitcoin, ERC, or privacy coin is worth it. I’m unconvinced, which is why I don’t. I’d also be concerned about how many potential major ETF’s are now considering structuring themselves: instead of an *Ethereum ETF* made of ETH, they’ll be made of a rotational basket of the Ethereum Network’s top tokens. Too, when some ETF’s start offering baskets of all crypto’s, how many ERC tokens do you imagine will be in there if current trends hold?\n\n\nRemember the top three US companies we talked about in 1996? Well, by the early 2000’s, tech companies (what we defined earlier as internet applications) began dominating the mid-tier list of largest US companies, some making it quite high. And integrated oil-majors (Exxon, Chevron, etc) replaced the car companies as the largest by mkt cap, you know the ones selling the *gas*? No point here actually, besides the pun. \n\nNote: I promise I’ll try bringing this all around to make sense. So let’s continue this senseless ramble: \n\nAfter the 2008 economic crisis (which lasted some years) an unexpected group of companies staged a sudden move up the mkt cap rankings: Banks. Why? Quantitative Easing, zero percent interest rates, and loose central bank monetary policy on a global scale. It’s no coincidence that at this same time, Bitcoin came into existence. But, those damn longterm *internet applications* accruing value...\n\nRight, so fast-forward to today. Go to your brokerage and find the top companies by market cap on any stock exchange. What are they? Bingo:\n\n - Apple\n - Microsoft\n - Amazon\n - Alphabet \n - Google\n - Facebook\n\nThey’ve all finally made it. The difference is, they’re unlikely to be replaced by anything unrelated. They shouldn’t be. Not for a generation, right? Wrong. Most will be replaced from the top spots because they’ll be weakened by a DAO Web 3.0 predator that syphons, feeds, borrows, steals, learns, wraps, experiments, fails, merges, digitizes, and innovates at a pace that’s impossible to keep up with. And for good measure, add in the fact that it began as, and is unified with finance. **Its imagination will never overreach its supply of money.** On a global scale, that’s insane. At least that’s the longterm view of Ethereum. What replaces the top company’s spots is anyone’s guess. If it’s Boston Dynamics I’ll know the end is near. If it’s a green energy breakthrough I’ll have hope. \n\n\nThanks for reading. Just wanted to try cleaning my mind this morning. Now for some fun predictions a couple years out dealing with finance bits:\n\n - Ethereum’s gas fees fall and staking becomes available to the masses (both promises of 2.0)\n\n - Hindsight data shows DeFi eroding chartered bank margins\n\n - Central banks are forced to combat China’s digital Yuan threat by rolling out their own digital fiat much faster than we thought\n\n -Bitcoin captures 50% of gold’s $10T mkt cap \n\n - Fat protocol thesis is finally set loose\n\n - ERC tokens comprise 13 of the top 20 token spots. \n\n - DeFi friction collapses and with it the learning curve\n\n - Country’s banks compete for global retail borrowing undercutting Ethereum’s staking rewards APY by 3% or more in some places\n\n - Cryptocurrency makes the platform of both major US political parties \n\n - Digital fiat captures the stablecoin business and Tether collapses from their front end integration allowing the Ethereum Network (all ERC tokens combined) to make a run on Bitcoin’s mkt cap\n\n - Volatility continues to dissipate and wild speculation is gone, the global confidence curve of crypto is flat, longterm deflationary appreciation begins and “margin capture” of what were once traditional bank margins (profits) is the new speculation as YOU become the bank\n\n - Two major US banks consolidate/merge \n\n - Ethereum’s next major upgrade hype is an on-chain oracle \n\n - US Treasury sets up probate crypto address \n\n - London is no longer the world’s forex Capitol, their failure to adapt to crypto and their innovation lag is devastating\n\n - ENS (Ethereum Name Service) finally gets its act together allowing WEB 3.0 to begin in earnest \n\n - The forbidden coin (XMR) has its day entering the top ten as atomic swaps and privacy premiums spike value after decentralized platforms begin (ever so) softly merging with legacy finance\n\n - Manned moon mission data inadvertently raises serious questions about the veracity of previous manned moon missions",https://www.reddit.com/r/ethereum/comments/mvdrk2/is_the_ethereum_protocol_exhibiting_predatory/,1,76
mvdssi,1619005214,The most profitable Crypto Mining Equipment on the market! Huge discounts!,,https://www.reddit.com/r/ethereum/comments/mvdssi/the_most_profitable_crypto_mining_equipment_on/,1,0
mvduo3,1619005420,Rinkeby testnet ether,[removed],https://www.reddit.com/r/ethereum/comments/mvduo3/rinkeby_testnet_ether/,1,0
mve5w8,1619006542,What happened to the token I tried to swap? (Uniswap),"Hello, \n\nI was going to use Uniswap to swap from DAI to FEGtoken today. I connected my metamask to uniwswap, and swapped the tokens using ledger. The transaction have the status ""Success"", but I have neither recieved no FEGtoken, nor have any of my DAI disappeared. The only thing that has happened is that I had to pay a transaction fee of 11.7$. And that can't be the gas fee as I it was supposed to be several houndreds of $.\n\n&amp;#x200B;\n\nSo to my real question, do I risk that suddenly my tokens wil be swaped? Cause right now I just want to cancel the whole thing.   \n\n\nI see on etherscan that it says ""   \nTransaction Action:\n\n* Approved📷[DAI](https://etherscan.io/token/0x6b175474e89094c44da98b954eedeac495271d0f)For Trade On[Uniswap V2: Router 2](https://etherscan.io/address/0x7a250d5630b4cf539739df2c5dacb4c659f2488d)""\n\nDoes this mean that the transaction needs to be approved before it goes through?   \n\n\n [Ethereum Transaction Hash (Txhash) Details | Etherscan](https://etherscan.io/tx/0x6de98f9219f3b61e3a419f4229bdca0a8f60e2ba244ae40813ebe9ee4a9cbfcd)    \n\n\nHere is the link to the transaction.\n\nHope someone can give me a reassuring answer. I dont want my DAI to suddenly be swaped.   \n\n\nThanks!",https://www.reddit.com/r/ethereum/comments/mve5w8/what_happened_to_the_token_i_tried_to_swap_uniswap/,1,2
mve7gy,1619006694,It's Earth Day. How Can Ethereum Achieve Carbon Neutrality in the Future?,"Unlike many other blockchains, the Ethereum community has been proactive about its carbon footprint by moving to a Proof of Stake model. While this is a necessary step, the ultimate goal needs to be carbon neutrality. The logical solution for long-term scalability in this aspect would be to implement carbon credits into the cost of performing transactions to offset the energy usage needed to process these transactions.\n\nI came across a new project creating a protocol to offset all carbon emissions generated by cryptocurrency transactions. Dovu ([https://www.dovu.earth/](https://www.dovu.earth/)) allows any other project to use its system to make their network carbon neutral. Ocean Protocol announced this morning they would be partnering with them for this purpose. The project uses Hedera Hashgraph to issue tokenized carbon credits to any carbon emitter to fund carbon-negative activities, such as soil sequestration by farmers. There is a nice write-up on the Hedera website: [https://hedera.com/users/dovu](https://hedera.com/users/dovu).\n\nIf this is the route we will take to become carbon neutral, adding a carbon tax to transaction fees would help the most energy efficient networks and could make the least efficient networks too expensive to use. Of course, energy inefficient networks could resist doing anything at all to reduce their carbon footprint. But once we have blockchains that can provably claim to be carbon neutral using something like Dovu, I think the people of the world will make the right choice and transact where they know the environmental impact will be neutralized. Any network that cannot achieve carbon neutrality will be marginalized in favor of ones that can.\n\nWith Eth 2.0 expected to cut the network's energy consumption by 99%, we are on a good path. However as we all know we are still extremely early as far as mass adoption, with less than 100,000 unique dApp users each day most days. Even with a 99% drop in energy consumption, as adoption accelerates we will be forced to face the environmental impact of the ETH network. The only way to ensure the long term viability of the network from an environmental perspective is to have a provable method of carbon offset applied to every use of the network.\n\nTLDR: ETH needs to adopt a roadmap to achieve carbon neutrality at some point in the future to remain viable.",https://www.reddit.com/r/ethereum/comments/mve7gy/its_earth_day_how_can_ethereum_achieve_carbon/,1,38
mvebda,1619007096,How many ETH addresses are actually used?,[removed],https://www.reddit.com/r/ethereum/comments/mvebda/how_many_eth_addresses_are_actually_used/,1,0
mveh0h,1619007655,"BTC, ETH, XRP, BNB, EOS, BAT – Technical Analysis For April 21",,https://www.reddit.com/r/ethereum/comments/mveh0h/btc_eth_xrp_bnb_eos_bat_technical_analysis_for/,1,0
mvejty,1619007933,New space mmo on ETH,[removed],https://www.reddit.com/r/ethereum/comments/mvejty/new_space_mmo_on_eth/,1,0
mvepyp,1619008503,"Ethereum is unusable, fees are too high.",[removed],https://www.reddit.com/r/ethereum/comments/mvepyp/ethereum_is_unusable_fees_are_too_high/,1,0
mvexcn,1619009212,The great flippening,,https://www.reddit.com/r/ethereum/comments/mvexcn/the_great_flippening/,1,0
mvf3x4,1619009860,Detecting malicious accounts showing adversarial behaviour in permissionless blockchains.,,https://www.reddit.com/r/ethereum/comments/mvf3x4/detecting_malicious_accounts_showing_adversarial/,1,0
mvf6wf,1619010115,$RAZOR Network about to FLY 🚀,,https://www.reddit.com/r/ethereum/comments/mvf6wf/razor_network_about_to_fly/,1,0
mvfcc4,1619010615,ETH Mining using Asus Zephyrus G14 Max-Q,,https://www.reddit.com/r/ethereum/comments/mvfcc4/eth_mining_using_asus_zephyrus_g14_maxq/,1,0
mvfell,1619010815,These gas prices are out of control,[removed],https://www.reddit.com/r/ethereum/comments/mvfell/these_gas_prices_are_out_of_control/,1,0
mvfkgr,1619011348,"Stake your ETH with $ANKR and make passive income - $ANKR is a crypto project with a lot of potential, if you’re into ETH then you should definitely get a big bag (only .15 right now and cheapest coin on Coinbase)",,https://www.reddit.com/r/ethereum/comments/mvfkgr/stake_your_eth_with_ankr_and_make_passive_income/,1,0
mvfkon,1619011364,Possible stupid question about hardware wallets...,[removed],https://www.reddit.com/r/ethereum/comments/mvfkon/possible_stupid_question_about_hardware_wallets/,1,0
mvfq71,1619011862,What a great sight,,https://www.reddit.com/r/ethereum/comments/mvfq71/what_a_great_sight/,1,0
mvfuuu,1619012278,Need help with mining.,[removed],https://www.reddit.com/r/ethereum/comments/mvfuuu/need_help_with_mining/,1,0
mvfx1y,1619012472,"Stake your ETH on $ANKR and buy a bag of it on Coinbase, recent and cheapest listing on the app! Great potential",,https://www.reddit.com/r/ethereum/comments/mvfx1y/stake_your_eth_on_ankr_and_buy_a_bag_of_it_on/,1,0
mvg05f,1619012738,How to Mine Ethereum | 2021 Guide,,https://www.reddit.com/r/ethereum/comments/mvg05f/how_to_mine_ethereum_2021_guide/,1,0
mvg38w,1619013004,How to buy ethereum for $10,[removed],https://www.reddit.com/r/ethereum/comments/mvg38w/how_to_buy_ethereum_for_10/,1,0
mvgdrf,1619013883,"Which is better, Metamask or Exodus?",[removed],https://www.reddit.com/r/ethereum/comments/mvgdrf/which_is_better_metamask_or_exodus/,1,0
