id,created_utc,title,selftext,full_link,score,comments
mvyi7i,1619071331,"I caught early signs of Ether’s price rallies happening independent of Bitcoin rallies, so I rebalanced 86% of my portfolio into ETH in the last 45 days. I’ll change that in the year never🏆WEB 3.0🏆dApps🏆DEFI🏆Smart Contracts🏆+everything Bitcoin can do. Bitcoin/Ethereum in 2 Simple Daily Charts👇",,https://www.reddit.com/r/ethereum/comments/mvyi7i/i_caught_early_signs_of_ethers_price_rallies/,1,1
mvytbs,1619072789,SELLING QUESTION,[removed],https://www.reddit.com/r/ethereum/comments/mvytbs/selling_question/,1,0
mvz3sd,1619074191,Farsite - DeFi Powered Ethereum 2 Game,[removed],https://www.reddit.com/r/ethereum/comments/mvz3sd/farsite_defi_powered_ethereum_2_game/,1,0
mvz7sc,1619074732,DoichKill's account,,https://www.reddit.com/r/ethereum/comments/mvz7sc/doichkills_account/,1,0
mvzb0d,1619075145,$MINI miniswap ethereum erc20 looks ripe for a rip,[removed],https://www.reddit.com/r/ethereum/comments/mvzb0d/mini_miniswap_ethereum_erc20_looks_ripe_for_a_rip/,1,0
mvzgkg,1619075916,"Tired of Bitcoin's Fees? Kindly Switch to Nano, and enjoy ZERO fees",Nano =\n\nNo fees No delay No inflation More upside potential Near zero energy consumption,https://www.reddit.com/r/ethereum/comments/mvzgkg/tired_of_bitcoins_fees_kindly_switch_to_nano_and/,1,0
mvzhyg,1619076104,How do I get the most out of my Ethereum?,I brought what I could afford at the start of the year (20 Ethereum). I've been holding since but I notice people talking a lot about staking. I've been using Coinbase pro since the beginning. \n\nI want to make the most out of what I have and don't plan on touching it for at least 2 Years. Is there anything I can do to or is holding always better?,https://www.reddit.com/r/ethereum/comments/mvzhyg/how_do_i_get_the_most_out_of_my_ethereum/,1,82
mvzlbj,1619076583,Don't know how to fund my coinbase account. Can you teach me how?,[removed],https://www.reddit.com/r/ethereum/comments/mvzlbj/dont_know_how_to_fund_my_coinbase_account_can_you/,1,0
mvzlin,1619076610,importing a 24-word seed phrase from electrum to myetherwallet or vice versa ( what would happen?)(hypothetical question),[removed],https://www.reddit.com/r/ethereum/comments/mvzlin/importing_a_24word_seed_phrase_from_electrum_to/,1,0
mvzq0v,1619077248,"☀️ just bought my first ETH, super excited 🌟",The title says it all:),https://www.reddit.com/r/ethereum/comments/mvzq0v/just_bought_my_first_eth_super_excited/,1,63
mvzvri,1619078073,Ether and Maker explained to a newbie,[removed],https://www.reddit.com/r/ethereum/comments/mvzvri/ether_and_maker_explained_to_a_newbie/,1,0
mw03kl,1619079192,Lol is this a glitch? I even reloaded many times,,https://www.reddit.com/r/ethereum/comments/mw03kl/lol_is_this_a_glitch_i_even_reloaded_many_times/,1,3
mw09iy,1619080032,ENZYM - A Real Life Social Booster,[removed],https://www.reddit.com/r/ethereum/comments/mw09iy/enzym_a_real_life_social_booster/,1,0
mw0cgh,1619080439,NFT Affiliate Programs,[removed],https://www.reddit.com/r/ethereum/comments/mw0cgh/nft_affiliate_programs/,1,0
mw0g84,1619080973,Introducing MetisDao - helping people create their own decentralized business on the blockchain using their layer 2 infrastructure.,,https://www.reddit.com/r/ethereum/comments/mw0g84/introducing_metisdao_helping_people_create_their/,1,0
mw0hfv,1619081155,Which crowdsourcing dapp is mature enough to be used right now?,"I see great potential in them because in the right set up they could replace both ICO's, DAO's and governance tokens in one dapp and benefit everyone except for scammers, but I don't see much activity in any of the relevant dapps I found. Is it because they put everything on hold because of the fees?",https://www.reddit.com/r/ethereum/comments/mw0hfv/which_crowdsourcing_dapp_is_mature_enough_to_be/,1,4
mw0hio,1619081165,"My personal thoughts on new dapp: FARSITE (MoonCryptoPolis), powered on Ethereum 2!!!",[removed],https://www.reddit.com/r/ethereum/comments/mw0hio/my_personal_thoughts_on_new_dapp_farsite/,1,0
mw0i8p,1619081266,How strong is 0xMonero's privacy?,[removed],https://www.reddit.com/r/ethereum/comments/mw0i8p/how_strong_is_0xmoneros_privacy/,1,0
mw0lno,1619081785,Cheapest Way to Buy Eth?,[removed],https://www.reddit.com/r/ethereum/comments/mw0lno/cheapest_way_to_buy_eth/,1,0
mw0mju,1619081925,Quick question,[removed],https://www.reddit.com/r/ethereum/comments/mw0mju/quick_question/,1,0
mw0rdw,1619082591,Introducing MetisDao - helping people create their own decentralized business on the blockchain using their layer 2 infrastructure.,,https://www.reddit.com/r/ethereum/comments/mw0rdw/introducing_metisdao_helping_people_create_their/,1,0
mw0rxl,1619082664,Binance Coin Minter - BSC chain,,https://www.reddit.com/r/ethereum/comments/mw0rxl/binance_coin_minter_bsc_chain/,1,0
mw0t9e,1619082848,Custom Errors in Solidity,,https://www.reddit.com/r/ethereum/comments/mw0t9e/custom_errors_in_solidity/,1,1
mw0v4m,1619083113,/r/ethereum hit 800k subscribers yesterday,,https://www.reddit.com/r/ethereum/comments/mw0v4m/rethereum_hit_800k_subscribers_yesterday/,1,51
mw0ve9,1619083150,Wallet,Why do people say that you need to put your ETH in wallets that can Buy NFTs?,https://www.reddit.com/r/ethereum/comments/mw0ve9/wallet/,1,2
mw100t,1619083797,"Hello. I have some 1st first blood coins/tokens in one of my wallets from awhile back. I noticed it hit a high yesterday and I want to sell them. Only I live in US NY, I do have a vpn, but they all seem to want verification. Anyone know a site to exchange to a different crypto without verification",,https://www.reddit.com/r/ethereum/comments/mw100t/hello_i_have_some_1st_first_blood_coinstokens_in/,1,3
mw12tg,1619084174,Good time for Eth,,https://www.reddit.com/r/ethereum/comments/mw12tg/good_time_for_eth/,1,0
mw1l5c,1619086438,I am Doug Polk Crypto an ICO Reviewer and Cryptocurrency analyst and supporter.,[removed],https://www.reddit.com/r/ethereum/comments/mw1l5c/i_am_doug_polk_crypto_an_ico_reviewer_and/,1,0
mw1q6t,1619087025,How can he check the amount of sending price of token without having it ? Can I estimate it?,[removed],https://www.reddit.com/r/ethereum/comments/mw1q6t/how_can_he_check_the_amount_of_sending_price_of/,1,0
mw1rkb,1619087193,Help with staking ethereum,[removed],https://www.reddit.com/r/ethereum/comments/mw1rkb/help_with_staking_ethereum/,1,0
mw1vh1,1619087658,US house passes bill to require financial regulators to set up digital assets working group,,https://www.reddit.com/r/ethereum/comments/mw1vh1/us_house_passes_bill_to_require_financial/,1,0
mw1z5u,1619088105,Accepting ETH!,[removed],https://www.reddit.com/r/ethereum/comments/mw1z5u/accepting_eth/,1,1
mw1zgb,1619088142,"Ether ETF Now Live, Gemini Founder Congratulates Asset Managers - CoinQuora",,https://www.reddit.com/r/ethereum/comments/mw1zgb/ether_etf_now_live_gemini_founder_congratulates/,1,0
mw202u,1619088216,Ethereum - Tree of Trust,,https://www.reddit.com/r/ethereum/comments/mw202u/ethereum_tree_of_trust/,1,1
mw22tl,1619088549,Question,Any ideas why Ether is surging while BTC is down?,https://www.reddit.com/r/ethereum/comments/mw22tl/question/,1,8
mw2ax6,1619089480,LawtechUK Launches Crypto and Smart Contract Dispute Resolution Rules,,https://www.reddit.com/r/ethereum/comments/mw2ax6/lawtechuk_launches_crypto_and_smart_contract/,1,0
mw2cgi,1619089638,"What's your take on sleepminting? (the ERC721 ""hack"")","Source:   \n[https://news.artnet.com/opinion/sleepminting-nftheft-monsieur-personne-1960744](https://news.artnet.com/opinion/sleepminting-nftheft-monsieur-personne-1960744)  \nTried to do some research on this possible ""issue"" for ETH NFT, but surprisingly very little info on it.",https://www.reddit.com/r/ethereum/comments/mw2cgi/whats_your_take_on_sleepminting_the_erc721_hack/,1,10
mw2ezn,1619089932,Switcheo TradeHub is a L2 DEX buit with Cosmos SDK. Mainnet live with soft launched futures. Stakers receive 37% apy!,,https://www.reddit.com/r/ethereum/comments/mw2ezn/switcheo_tradehub_is_a_l2_dex_buit_with_cosmos/,1,0
mw2gde,1619090090,"Ethereum Is About To MELT Brains - Daily Cryptocurrency News LIVE: Bitcoin, Ethereum, &amp; Much More!",,https://www.reddit.com/r/ethereum/comments/mw2gde/ethereum_is_about_to_melt_brains_daily/,1,0
mw2k8e,1619090507,Why was there a drop in Ethereum nodes starting at 9th March?,See [https://www.ethernodes.org/history](https://www.ethernodes.org/history),https://www.reddit.com/r/ethereum/comments/mw2k8e/why_was_there_a_drop_in_ethereum_nodes_starting/,1,3
mw2kc8,1619090520,Creating own tokens,"I am trying to understand the process of generating my own, Ethereum based tokens. \n\nMy understand is that you need to write a smart contract in the Solidity programming language to create your own ERC20 tokens. \n\nBut I came across a site named [https://tokenmint.io/](https://tokenmint.io/) that promises to create tokens without coding (""Create Your Own Ethereum Smart Contracts Without Coding"").\n\nNow how legit is a site like that? Don't they have access to all the secrets / keys when they generate the tokens?\n\nAny comments? Recommended reading about how to create your own ERC20 token?",https://www.reddit.com/r/ethereum/comments/mw2kc8/creating_own_tokens/,1,8
mw2pyj,1619091142,"💥 Brace yourself, Razor Meme Contest is here 💥 It could not get easier! 10 days, 10 winners, $1000 Reward 🎈Check out our official telegram announcement channel for instructions 🥳",,https://www.reddit.com/r/ethereum/comments/mw2pyj/brace_yourself_razor_meme_contest_is_here_it/,1,0
mw2sbn,1619091403,Whats gon be your target for this bullrun,[removed],https://www.reddit.com/r/ethereum/comments/mw2sbn/whats_gon_be_your_target_for_this_bullrun/,1,0
mw2tl3,1619091534,"BTC, ETH, XRP, SXP, ZEC, UNI, LINK – Technical Analysis For April 22",,https://www.reddit.com/r/ethereum/comments/mw2tl3/btc_eth_xrp_sxp_zec_uni_link_technical_analysis/,1,0
mw2u9n,1619091609,New ERC-20 Token $PISS PISSCOIN now available for trade (Approved on Etherscan),Hello\n\nI'd like to present you with a new meme token called PISSCOIN which is now available on DODEX and is approved on Etherscan as an ERC-20 Token. We have built a community of like minded GUZZLERS who create memes and other related content.\n\nOfficial Website: [https://pisscoin.lol/](https://pisscoin.lol/)\n\nEtherscan: [https://etherscan.io/token/0x41afc4220b08d1f336eacf231cd8ce5c7e7fb9c9](https://etherscan.io/token/0x41afc4220b08d1f336eacf231cd8ce5c7e7fb9c9)\n\nDODOEX Listing: [https://app.dodoex.io/exchange/ETH-0x41afc4220b08d1f336eacf231cd8ce5c7e7fb9c9](https://app.dodoex.io/exchange/ETH-0x41afc4220b08d1f336eacf231cd8ce5c7e7fb9c9),https://www.reddit.com/r/ethereum/comments/mw2u9n/new_erc20_token_piss_pisscoin_now_available_for/,1,2
mw2zdg,1619092172,ETH Haters right now...,,https://www.reddit.com/r/ethereum/comments/mw2zdg/eth_haters_right_now/,1,1
mw32sc,1619092534,Wait for a dip or go for it,[removed],https://www.reddit.com/r/ethereum/comments/mw32sc/wait_for_a_dip_or_go_for_it/,1,0
mw33sx,1619092645,What makes Ethereum better than Bitcoin?,[removed],https://www.reddit.com/r/ethereum/comments/mw33sx/what_makes_ethereum_better_than_bitcoin/,1,0
mw38fy,1619093074,ETHEREUM BIGGEST HIGH IN 2 years,,https://www.reddit.com/r/ethereum/comments/mw38fy/ethereum_biggest_high_in_2_years/,1,1
mw3ar0,1619093300,The best project ever.,[removed],https://www.reddit.com/r/ethereum/comments/mw3ar0/the_best_project_ever/,1,0
