id,created_utc,title,selftext,full_link,score,comments
mwmcts,1619148772,Alt Season is on its way! 🚀🚀🚀,,https://www.reddit.com/r/ethereum/comments/mwmcts/alt_season_is_on_its_way/,1,0
mwmoij,1619149899,Seriously can't believe how slow implementation is taking to lower gas fees. It's disgusting and disgraceful.,"Where is poster child Vitalik these days? Sure seems awfully quiet while the majority of the crypto community screams foul and protests in disgust over the ever increasing ethereum networks gas fees. \n\nAlmost 150 USD at time of writing. One. Hundred. And. Fifty. Dollars..... Is this some kind of cruel joke? I have to literally spend almost 3% to trade some tokens. Was this seriously never thought out at the time of ethereums creation? It makes no sense to me that ANY of the original developers thought of, or hand the hindsight, to mitigate these types of fees with a largely used and adopted network. Did they all think eth wouldn't catch on? Wouldn't see as much use? Wouldn't have nearly the amount of usage? Seems like some pretty piss poor planning IMHO. \n\nWhat else did they unforsee? And why the hell is it taking them so long to implement a solution? It's been what, two years? With another two year potential before any of these fees are mitigated and or have some sort of palpable solution? Sorry for venting, but ethereum is the one of the largest reasons why our beloved ecosystem is being held back, and progression is being grinded to a halt. All cylinders where firing at maximum speed.... And then eth just had to throw its shitty wrench into the engine bay. I mean.... For christ sakes, when Binance produces a solution that blows ethereum out of the water, its incredibly sad and disgraceful at this point in time. Centralized or not, ethereum needs to get its shit together. I love this chain, but how long can you love something that doesn't love you back? \n\nRant over.",https://www.reddit.com/r/ethereum/comments/mwmoij/seriously_cant_believe_how_slow_implementation_is/,1,13
mwmomb,1619149908,Data shows institutional demand for Ethereum surged despite the recent crash,,https://www.reddit.com/r/ethereum/comments/mwmomb/data_shows_institutional_demand_for_ethereum/,1,0
mwmpdb,1619149978,The DeFi liquidation game,[removed],https://www.reddit.com/r/ethereum/comments/mwmpdb/the_defi_liquidation_game/,1,0
mwmr64,1619150156,Question about ethereum transaction,[removed],https://www.reddit.com/r/ethereum/comments/mwmr64/question_about_ethereum_transaction/,1,0
mwmump,1619150485,The DeFi liquidation game. Article by Gerhard Wagner analyzing the evolution of MEV extraction on Ethereum,,https://www.reddit.com/r/ethereum/comments/mwmump/the_defi_liquidation_game_article_by_gerhard/,1,3
mwmz9l,1619150945,Charting app for iPhone,"Any recommendations on a good charting app for the iPhone? Don’t need any extra bells and whistles, no exchanges, no swap features, just pure charting optimized for iPhone. Quite surprised honestly that no one has thought of a way to make a charting app for iPhone that allows importing of any coin via its address.",https://www.reddit.com/r/ethereum/comments/mwmz9l/charting_app_for_iphone/,1,3
mwn0zp,1619151120,what alternatives are there to ethminer?,[removed],https://www.reddit.com/r/ethereum/comments/mwn0zp/what_alternatives_are_there_to_ethminer/,1,0
mwn4sr,1619151521,Crypto noob here. Help educate on Ethereum vs Bitcoin,[removed],https://www.reddit.com/r/ethereum/comments/mwn4sr/crypto_noob_here_help_educate_on_ethereum_vs/,1,0
mwn7p4,1619151813,Help a Crypto Noob here with the basics and differences between Bitcoin and Ethereum,[removed],https://www.reddit.com/r/ethereum/comments/mwn7p4/help_a_crypto_noob_here_with_the_basics_and/,1,0
mwndw5,1619152472,What is May 5th Garyvee is talking about? Anyone know or have thoughts? He is saying he is gonna give something to the community...?,,https://www.reddit.com/r/ethereum/comments/mwndw5/what_is_may_5th_garyvee_is_talking_about_anyone/,1,5
mwnp9w,1619153710,Ethereum ETFs Get Off to $138 Million Start So Far,,https://www.reddit.com/r/ethereum/comments/mwnp9w/ethereum_etfs_get_off_to_138_million_start_so_far/,1,0
mwntbu,1619154140,Why does crypto keep massively fluctuating right now?,[removed],https://www.reddit.com/r/ethereum/comments/mwntbu/why_does_crypto_keep_massively_fluctuating_right/,1,0
mwnx8j,1619154585,Are gas fees high because miners are utilising Flashbots to take advantage of MEV by exploiting Mempool sequences? THE AMOUNT OF FLASHBOTS ON ETHEREUM IS BECOMING MAINSTREAM?,"Miners Extractable Value becoming a big part of the network:\n\n\n\nArbitrage hopefuls are scanning the eth Mempool\n\n\n\nOnce multiple entity try to outbid each other, the miners benefit\n\n\n\nMiners are becoming frontrunners as they can sequence transactions\n\n\n\nThis is called MEV (Miner Extractable Value.)\n\n\n\nImportantly, the Optimism system enables the capture and repurposing of MEV.\n\n\n\nBy splitting the sequencers (auctioning the right to become a sequencer to the free market) and validators (whom validate transactions and add to Optimism Layer 2) The right to capture MEV is then auctioned off, creating an equitable cycle.\n\n\n\nJust as frontrunners attempted to outbid each other’s transactions to capture MEV, those who wish to capture MEVA are forced to bid for the right to sequence transactions, and ultimately hands this value off to the auctioneer. That auctioneer is Optimism, and the Optimism team intends to enable the redirecting of this captured value to parties that were never going to be able to access it in the first place, but arguably should have: The developers who built the contracts in the first place!\n\n\n\nFlashbots is an R&amp;D organization working on mitigating the negative externalities of Ethereum MEV. Today 5 mining pools are running its MEV-geth software, which in total account for &gt;12% of the Ethereum hashrate. Miners running MEV-geth have seen an average increase in income of 0.13 ETH per block so far in March, which is also a ~3x increase MoM. In total, miners collected 174 ETH in Flashbots fees in February, up by more than 6x the amount collected in January.""\n\n\n\nA recent study that aimed to quantify the so-called miner-extractable value (MEV) in Ethereum in the last 6 months shed some light on the scale of bot activity in Ethereum. The study found that bots extracted 0.34 ETH of MEV per block through arbitrage and liquidations. Moreover, the study found that 18.7% of MEV extracted by bots is paid to miners through gas fees which makes up 3.7% of all transaction fees. Undoubtedly, this implies that the scale of bot activity on Ethereum is becoming mainstream. To provide comprehensive front-running protection, bloXroute introduced a private transactions service, in collaboration with a group of mining pools.",https://www.reddit.com/r/ethereum/comments/mwnx8j/are_gas_fees_high_because_miners_are_utilising/,1,1
mwog7m,1619156655,Everyone has heard this SOB story a hundred times...,,https://www.reddit.com/r/ethereum/comments/mwog7m/everyone_has_heard_this_sob_story_a_hundred_times/,1,0
mwoi64,1619156885,Why can't Canadians stake ETH2?,[removed],https://www.reddit.com/r/ethereum/comments/mwoi64/why_cant_canadians_stake_eth2/,1,0
mwoj1q,1619156982,Is This The Perfect Moment To Buy Ethereum? Top Analyst Weighs in,,https://www.reddit.com/r/ethereum/comments/mwoj1q/is_this_the_perfect_moment_to_buy_ethereum_top/,1,0
mwoj4h,1619156990,Have a few very simple noob questions regarding ETH and upcoming forks that I'm having a lot of trouble finding the answer to so hope someone can help me out.,"I currently own just over 1 ETH as a super simple hold investment, a very small portion of my portfolio that I'm increasingly becoming interested in adding to. \n\nBeen reading a lot about the upcoming scheduled forks, especially today after the 2.0 staking option news. My questions are:\n\nDoes any of this even apply to me for how simple a position I'm in? Like say for arguments' sake I'm only interested in ever holding my current investment in the currency for the growth value to pull out a few years, can I simply hold this for the mid to long term or do I myself need to migrate over to ETL eventually? Will the service I use probably do this for me? Does ETH itself become useless 5+ years from now? Appreciate any straightforward answer as it's been surprisingly hard to get any answer on this, I'm simply a Canadian dude who had an extra $2,500 lying around and just got started learning this tech",https://www.reddit.com/r/ethereum/comments/mwoj4h/have_a_few_very_simple_noob_questions_regarding/,1,0
mwoke4,1619157130,Just bought my first .4 ETH!,"This is all the money I had and was willing to lose in my investment.\n\nI got burned by doge and decided I want more stability. I hope I made the right decision!\n\nI am researching more about this and was wondering, what do you all think the price of this will be relative to bitcoin in 1-5 years?",https://www.reddit.com/r/ethereum/comments/mwoke4/just_bought_my_first_4_eth/,1,69
mwotlb,1619158174,Inspiration coins held,[removed],https://www.reddit.com/r/ethereum/comments/mwotlb/inspiration_coins_held/,1,0
mwoxt6,1619158665,Most user-experience friendly way to store and use crypto?,"What’s your current set up for best ease of use (i.e. trading, moving) but also secured? Note: this is for entry level ~5-10 ETH (since whales might have a different set up)",https://www.reddit.com/r/ethereum/comments/mwoxt6/most_userexperience_friendly_way_to_store_and_use/,1,3
mwoyth,1619158792,"Just purchased by first ETH, 0.05263157 !!! Hope it pays well",[removed],https://www.reddit.com/r/ethereum/comments/mwoyth/just_purchased_by_first_eth_005263157_hope_it/,1,0
mwoyye,1619158810,Solidity-IDE: looking for maintainers,"I'm moving on to other projects and it's been a while already I haven't given Solidity-IDE a bit of love. I don't have the time to maintain this project anymore, so I'm looking for someone who would like to maintain the project. If you are motivated there are even some axes of improvement:\n\n- Metamask integration\n- Filesystem server refactoring\n- Quality of life improvements (such as better completion)\n\nLink to the project: https://github.com/System-Glitch/Solidity-IDE\n\nIf you're interested, comment on this post or send me a private message, and have a great day!",https://www.reddit.com/r/ethereum/comments/mwoyye/solidityide_looking_for_maintainers/,1,5
mwp1gp,1619159116,Update on P2P-DeFi Platform,[removed],https://www.reddit.com/r/ethereum/comments/mwp1gp/update_on_p2pdefi_platform/,1,0
mwp3me,1619159388,Solidity Tutorials – Coinmonks – Medium,,https://www.reddit.com/r/ethereum/comments/mwp3me/solidity_tutorials_coinmonks_medium/,1,0
mwp3u2,1619159410,"Writing, Compiling, Deploying Solidity 2021.",,https://www.reddit.com/r/ethereum/comments/mwp3u2/writing_compiling_deploying_solidity_2021/,1,1
mwp7i6,1619159853,On the high GAS fees,"Gas are insane atm. Please, make a list of decent DEXs and projects that aim ar reducing them so that everyone can benefit.\nI can start with Conflux/MoonSwap. You shuttle in your ETH via shuttleflow, and you have 0 GAS on the DEX. There are still few coins but it's on the rise, and it's superfast (Don't mind the price drop, it's general...). \nWho else? Pls look if your suggestion has been made and upvote so that we understand general trends.",https://www.reddit.com/r/ethereum/comments/mwp7i6/on_the_high_gas_fees/,1,13
mwp918,1619160046,DAOs Are The Next Best Thing,,https://www.reddit.com/r/ethereum/comments/mwp918/daos_are_the_next_best_thing/,1,0
mwpb9h,1619160311,"Spent $1,000 on ETC",[removed],https://www.reddit.com/r/ethereum/comments/mwpb9h/spent_1000_on_etc/,1,0
mwpbiw,1619160348,Ethereum (ETH) Price Analysis: Ether Retraces But Stuck Below $2.360 Resistance,,https://www.reddit.com/r/ethereum/comments/mwpbiw/ethereum_eth_price_analysis_ether_retraces_but/,1,0
mwpct8,1619160517,ETH holding stronger than most,,https://www.reddit.com/r/ethereum/comments/mwpct8/eth_holding_stronger_than_most/,1,2
mwpfqg,1619160880,Is it possible to speed up my friend's transaction?,[removed],https://www.reddit.com/r/ethereum/comments/mwpfqg/is_it_possible_to_speed_up_my_friends_transaction/,1,0
mwpgs1,1619161015,🚨🚨🚨🚨🚨🚨🚨🚨🚨🚨,[removed],https://www.reddit.com/r/ethereum/comments/mwpgs1/_/,1,0
mwpl1p,1619161523,"Top30 Gambling Dapps Eco by 30d Volume 🥇 Ethereum $286.55M, top2: dice2win $264.50M Decentral Games (Ethereum) $21.85M 🥈 Matic Network $25.92M 🥉 TRON $21.50M 🔥 Block.one, Thundercore TT, Binance Smart Chain, ICON, WAX.io",,https://www.reddit.com/r/ethereum/comments/mwpl1p/top30_gambling_dapps_eco_by_30d_volume_ethereum/,1,1
mwpnbr,1619161814,New to crypto Can anyone explain,[removed],https://www.reddit.com/r/ethereum/comments/mwpnbr/new_to_crypto_can_anyone_explain/,1,0
mwpoi7,1619161959,Question regarding how PoS algorithm select a new validator? (Problem: rich getting richer?),[removed],https://www.reddit.com/r/ethereum/comments/mwpoi7/question_regarding_how_pos_algorithm_select_a_new/,1,0
mwpvmp,1619162842,"Help Please, anyone else have ETH vanish on transfer?",[removed],https://www.reddit.com/r/ethereum/comments/mwpvmp/help_please_anyone_else_have_eth_vanish_on/,1,0
mwpw00,1619162889,Take advantage of the discount!,[removed],https://www.reddit.com/r/ethereum/comments/mwpw00/take_advantage_of_the_discount/,1,0
mwpw9m,1619162922,Hold tight everyone,[removed],https://www.reddit.com/r/ethereum/comments/mwpw9m/hold_tight_everyone/,1,0
mwpwl8,1619162966,Safe way to earn interest on my Eth,[removed],https://www.reddit.com/r/ethereum/comments/mwpwl8/safe_way_to_earn_interest_on_my_eth/,1,0
mwpx3g,1619163026,"BscScan has record, Etherscan.io does not. Anyone know why?",[removed],https://www.reddit.com/r/ethereum/comments/mwpx3g/bscscan_has_record_etherscanio_does_not_anyone/,1,0
mwpxq8,1619163110,Transaction status,[removed],https://www.reddit.com/r/ethereum/comments/mwpxq8/transaction_status/,1,0
mwpyko,1619163210,2017 Market is not comparable to 2021 Market,[removed],https://www.reddit.com/r/ethereum/comments/mwpyko/2017_market_is_not_comparable_to_2021_market/,1,0
mwq9go,1619164641,Can Sleepminting Ruin NFT Provenance?,,https://www.reddit.com/r/ethereum/comments/mwq9go/can_sleepminting_ruin_nft_provenance/,1,18
mwqbj1,1619164894,Is this the right time to buy Ethereum or should I wait for some more time?,[removed],https://www.reddit.com/r/ethereum/comments/mwqbj1/is_this_the_right_time_to_buy_ethereum_or_should/,1,1
mwqfqs,1619165433,Almost at 1 ETH!,[removed],https://www.reddit.com/r/ethereum/comments/mwqfqs/almost_at_1_eth/,1,0
mwqgbh,1619165512,Possibly new market for NFTs and for artists in general?New option for artist to sell their games? Selling whole games as NFTs?,[removed],https://www.reddit.com/r/ethereum/comments/mwqgbh/possibly_new_market_for_nfts_and_for_artists_in/,1,0
mwqmib,1619166319,Ethereum 2.0 and mining,[removed],https://www.reddit.com/r/ethereum/comments/mwqmib/ethereum_20_and_mining/,1,0
mwqu1g,1619167287,"Ethereum Technical Analysis for April 23, 2021 - ETH",,https://www.reddit.com/r/ethereum/comments/mwqu1g/ethereum_technical_analysis_for_april_23_2021_eth/,1,0
mwqxwt,1619167784,How to get insane in 1 minute,,https://www.reddit.com/r/ethereum/comments/mwqxwt/how_to_get_insane_in_1_minute/,1,0
