id,created_utc,title,selftext,full_link,score,comments
n1gfzo,1619736615,Crypto NAFA,,https://www.reddit.com/r/ethereum/comments/n1gfzo/crypto_nafa/,1,0
n1gqgh,1619737484,"If ETH2 is moving to Proof of Stake, why are some exchanges letting you stake ETH already?",[removed],https://www.reddit.com/r/ethereum/comments/n1gqgh/if_eth2_is_moving_to_proof_of_stake_why_are_some/,1,30
n1gs5a,1619737628,First space art piece using rarible,1st edition art piece at [Rarible](https://rarible.com/token/0xd07dc4262bcdbf85190c01c996b4c06a461d2430:508797:0x45daa3f9a23e3095ab6be221be97d73216d6d214),https://www.reddit.com/r/ethereum/comments/n1gs5a/first_space_art_piece_using_rarible/,1,0
n1h6na,1619738841,All in on ethereum,[removed],https://www.reddit.com/r/ethereum/comments/n1h6na/all_in_on_ethereum/,1,0
n1hchs,1619739344,$YELLEN COIN LAUNCH in 24hrs,[removed],https://www.reddit.com/r/ethereum/comments/n1hchs/yellen_coin_launch_in_24hrs/,1,0
n1he99,1619739502,Should I take profit?,[removed],https://www.reddit.com/r/ethereum/comments/n1he99/should_i_take_profit/,1,0
n1heed,1619739516,Too late to mine?,[removed],https://www.reddit.com/r/ethereum/comments/n1heed/too_late_to_mine/,1,0
n1hibt,1619739866,Good CLI tools for interacting with Ethereum chains?,[removed],https://www.reddit.com/r/ethereum/comments/n1hibt/good_cli_tools_for_interacting_with_ethereum/,1,0
n1hkt0,1619740088,🦍APEHAVEN (APES) 🚀 Donates to Charity with auto yield farming from transactions 🦍,[removed],https://www.reddit.com/r/ethereum/comments/n1hkt0/apehaven_apes_donates_to_charity_with_auto_yield/,1,0
n1hpgr,1619740517,Proof of stake,[removed],https://www.reddit.com/r/ethereum/comments/n1hpgr/proof_of_stake/,1,0
n1hqge,1619740612,"Steve-O joins the NFT world with his first piece through Foundation.App, already hit 1.34ETH!",,https://www.reddit.com/r/ethereum/comments/n1hqge/steveo_joins_the_nft_world_with_his_first_piece/,1,1
n1i9gy,1619742361,History of the word HODL,,https://www.reddit.com/r/ethereum/comments/n1i9gy/history_of_the_word_hodl/,1,0
n1iifl,1619743236,Thoughts on prospects of USG recognition of Ethereum and ETH,[removed],https://www.reddit.com/r/ethereum/comments/n1iifl/thoughts_on_prospects_of_usg_recognition_of/,1,0
n1iitq,1619743277,Metaverse Quantum,[removed],https://www.reddit.com/r/ethereum/comments/n1iitq/metaverse_quantum/,1,0
n1ivea,1619744493,Web3 Explained in 2 Minutes with Girl Gone Crypto,,https://www.reddit.com/r/ethereum/comments/n1ivea/web3_explained_in_2_minutes_with_girl_gone_crypto/,1,0
n1iwnb,1619744608,ERC20's on $MINI,[removed],https://www.reddit.com/r/ethereum/comments/n1iwnb/erc20s_on_mini/,1,0
n1iyc6,1619744766,Why is ETH price travelling independent of BTC?,[removed],https://www.reddit.com/r/ethereum/comments/n1iyc6/why_is_eth_price_travelling_independent_of_btc/,1,0
n1j2d5,1619745155,Would you still buy a Ledger wallet?,I'm considering between Ledger and Trezor. As part of my position is in Neo and Nano Ledgers seems a good option to me. But all that data leak of the past year really made me think twice about buying a Ledger.\n\nWhat are your thoughts on that?,https://www.reddit.com/r/ethereum/comments/n1j2d5/would_you_still_buy_a_ledger_wallet/,1,71
n1j38z,1619745246,How do I register my eth name?,"I want to register a .eth name, but the ENS manager will not load. I am using app.ens.domains. It just shows as locked with a blank white page. I tried it in Safari and Chrome, and neither works.\n\nI am pressing “launch app” on the ens.domains page and typing it into the URL bar but neither works.\n\nAny advice? Thank you.",https://www.reddit.com/r/ethereum/comments/n1j38z/how_do_i_register_my_eth_name/,1,12
n1j3k1,1619745277,Writing my final paper on collective action in the crypto/blockchain-verse... any examples of strong collective action within the space?,[removed],https://www.reddit.com/r/ethereum/comments/n1j3k1/writing_my_final_paper_on_collective_action_in/,1,0
n1jdgv,1619746256,Regret selling my 1 ethereum coin,[removed],https://www.reddit.com/r/ethereum/comments/n1jdgv/regret_selling_my_1_ethereum_coin/,1,0
n1jg16,1619746511,Ethereum Surpasses PayPal’s Market Cap as ETH Keeps Reducing Bitcoin Dominance,,https://www.reddit.com/r/ethereum/comments/n1jg16/ethereum_surpasses_paypals_market_cap_as_eth/,1,0
n1ji6s,1619746721,NEW NFT PROJECT KRYPTOMO,[removed],https://www.reddit.com/r/ethereum/comments/n1ji6s/new_nft_project_kryptomo/,1,0
n1jk85,1619746923,Earn daily 1 ethereum,,https://www.reddit.com/r/ethereum/comments/n1jk85/earn_daily_1_ethereum/,1,0
n1jl0b,1619746993,Noob question but what’s the damn difference between a stop limit and a limit order?,[removed],https://www.reddit.com/r/ethereum/comments/n1jl0b/noob_question_but_whats_the_damn_difference/,1,0
n1k00i,1619748455,ETH Staking vs. Earning Interest,[removed],https://www.reddit.com/r/ethereum/comments/n1k00i/eth_staking_vs_earning_interest/,1,0
n1kd9p,1619749778,😆😆😆,,https://www.reddit.com/r/ethereum/comments/n1kd9p/_/,1,55
n1klzk,1619750643,Ethereum undergoes major update and investors debate whether Bitcoin will be left behind,[removed],https://www.reddit.com/r/ethereum/comments/n1klzk/ethereum_undergoes_major_update_and_investors/,1,0
n1kotn,1619750932,"OpenZeppelin Contracts 4.1: UUPS upgrade proxy, Multicall batch transactions, ERC20FlashMint extension, Cryptography tools ERC2098 &amp; SignatureChecker; npm install @openzeppelin/contracts",,https://www.reddit.com/r/ethereum/comments/n1kotn/openzeppelin_contracts_41_uups_upgrade_proxy/,1,1
n1kvj2,1619751620,Help buying eth while being underage,[removed],https://www.reddit.com/r/ethereum/comments/n1kvj2/help_buying_eth_while_being_underage/,1,0
n1l6o5,1619752751,Ethereum - The Triple Halving Report,[removed],https://www.reddit.com/r/ethereum/comments/n1l6o5/ethereum_the_triple_halving_report/,1,0
n1labe,1619753106,"I got in at 1700 initially, and have continued to buy including at ATH’s like today.","I think it’s cool and I envy the “in at $100” (or whatever low #) posts, but not all of us were as fortunate. But I believe just like the OG’s in where we are headed! \nI dream of holding 20 ETH one day, and hope we can all meet on the moon!",https://www.reddit.com/r/ethereum/comments/n1labe/i_got_in_at_1700_initially_and_have_continued_to/,1,26
n1lmrj,1619754433,"I dont see much conversation about Internet Computer, Dfinity on here or other channels.",[removed],https://www.reddit.com/r/ethereum/comments/n1lmrj/i_dont_see_much_conversation_about_internet/,1,0
n1lpyo,1619754769,Just started using Loopring for L2,"I just connected my wallet to Loopring in an attempt to bring ETH gas prices down. What I noticed is that I need to deposit ETH into this L2 version first before I can get trading.  Unfortunately, when I try depositing an amount, it locks 0.0057 ETH away. Is this a normal expected amount for transferring from L1 to L2? Just want to get a general consensus on the gas price. Also, what other fees can I expect, once I transfer ETH into L2.",https://www.reddit.com/r/ethereum/comments/n1lpyo/just_started_using_loopring_for_l2/,1,4
n1lv5t,1619755320,if gases prices are low (tanks to eip 1559 and eth) does this risk network congestion?,I was reading [ethereum.org](https://ethereum.org) and the original reason for gas prices for computations was to prevent spam on the network. But if gas prices decrease significantly does this risk spam? If I'm wrong please explain,https://www.reddit.com/r/ethereum/comments/n1lv5t/if_gases_prices_are_low_tanks_to_eip_1559_and_eth/,1,0
n1m0bk,1619755881,Sell my BTC for more ETH?,[removed],https://www.reddit.com/r/ethereum/comments/n1m0bk/sell_my_btc_for_more_eth/,1,0
n1mafq,1619756997,Anonymous Ether(Need Help!!),[removed],https://www.reddit.com/r/ethereum/comments/n1mafq/anonymous_etherneed_help/,1,0
n1mcv7,1619757266,This sub and its moderators should consider banning ETH price speculation talk.,[removed],https://www.reddit.com/r/ethereum/comments/n1mcv7/this_sub_and_its_moderators_should_consider/,1,0
n1mgll,1619757700,"hola amigos, aquí hay una empresa real y legítima en la que invierte con $ 50 y gana $ 1000 en 24 horas, pídame información por correo electrónico o pregúnteme cómo",,https://www.reddit.com/r/ethereum/comments/n1mgll/hola_amigos_aquí_hay_una_empresa_real_y_legítima/,1,1
n1mlgx,1619758240,I’ve decided I wanted to buy some Ether,[removed],https://www.reddit.com/r/ethereum/comments/n1mlgx/ive_decided_i_wanted_to_buy_some_ether/,1,0
n1mph5,1619758714,Introducing HarambeCoin,[removed],https://www.reddit.com/r/ethereum/comments/n1mph5/introducing_harambecoin/,1,0
n1ms26,1619758999,ETH advice,[removed],https://www.reddit.com/r/ethereum/comments/n1ms26/eth_advice/,1,0
n1mxwm,1619759665,Is ethereum ever gonna go back to $2300 i want to buy some.,[removed],https://www.reddit.com/r/ethereum/comments/n1mxwm/is_ethereum_ever_gonna_go_back_to_2300_i_want_to/,1,0
n1n29c,1619760175,NFT,,https://www.reddit.com/r/ethereum/comments/n1n29c/nft/,1,0
n1n2cy,1619760185,Why Metamask cost is higher than UniSwap?,"During last 2 weeks, I have consistently been observing the same pattern: everything that I was going to trade on UniSwap, seemed to give best prices, than uniswap. What could be the reason, hat UniSwap returns worse prices and worse transaction fees, compared to trading directly on uni?",https://www.reddit.com/r/ethereum/comments/n1n2cy/why_metamask_cost_is_higher_than_uniswap/,1,3
n1nacs,1619761150,What is the next step?,[removed],https://www.reddit.com/r/ethereum/comments/n1nacs/what_is_the_next_step/,1,1
n1nlpf,1619762527,[ANN][ORIGIN] ORIGIN is an ERC20 token used to invest in China's stock market.,[removed],https://www.reddit.com/r/ethereum/comments/n1nlpf/annorigin_origin_is_an_erc20_token_used_to_invest/,1,0
n1nr90,1619763202,swap/unwrap WETH to get ETH?,"Hi, I'm trying to pay gas feeds but I keep getting stonewalled because I dont have ETH. All I have is WETH...which i cant swap for ETH because I dont have enough ETH for the gas fee. How can I unwrap my WETH with expending ETH to do it?",https://www.reddit.com/r/ethereum/comments/n1nr90/swapunwrap_weth_to_get_eth/,1,2
n1nscx,1619763326,How To Trade Ethereum - Different Options Compared,[removed],https://www.reddit.com/r/ethereum/comments/n1nscx/how_to_trade_ethereum_different_options_compared/,1,0
n1nsy1,1619763395,"ELI5: since the explosion of Polygon (MATIC) as L2 solutions for Ethereum, Alot of transactions and liquidity has slowly migrated to L2. Will this affect the Burned rate of ETH after EIP 1559?",[removed],https://www.reddit.com/r/ethereum/comments/n1nsy1/eli5_since_the_explosion_of_polygon_matic_as_l2/,1,1
