id,created_utc,title,selftext,full_link,score,comments
n295gi,1619836048,"Here’s an Ethereum fan art post! Not a nft, just reimagining my mining rig and love for eth",,https://www.reddit.com/r/ethereum/comments/n295gi/heres_an_ethereum_fan_art_post_not_a_nft_just/,1,0
n2974m,1619836224,Eth Donations accepted for Color the Spectrum Charity,[removed],https://www.reddit.com/r/ethereum/comments/n2974m/eth_donations_accepted_for_color_the_spectrum/,1,0
n299ne,1619836500,Need help urgently,[removed],https://www.reddit.com/r/ethereum/comments/n299ne/need_help_urgently/,1,0
n29b41,1619836658,Staking?,[removed],https://www.reddit.com/r/ethereum/comments/n29b41/staking/,1,0
n29b9s,1619836673,Razor into Oracle MultiChain DApps Security Provider 🌐⚔🌐🚀 Sounds awesome 👀👁👀,,https://www.reddit.com/r/ethereum/comments/n29b9s/razor_into_oracle_multichain_dapps_security/,1,0
n29g7b,1619837156,Ethereum new all time high 2800+,[removed],https://www.reddit.com/r/ethereum/comments/n29g7b/ethereum_new_all_time_high_2800/,1,0
n29ivy,1619837427,Will Another ETH Dip Come?,[removed],https://www.reddit.com/r/ethereum/comments/n29ivy/will_another_eth_dip_come/,1,0
n29myk,1619837866,Reconciling PoW and PoS rewards question.,"I can't seem to find an answer on how the beacon chain is able to give out staking rewards right now, even though they are locked up, while the current PoW chain is still issuing PoW rewards.  How are both PoS and PoW rewards being given at the same time?  Is the issuance currently double?",https://www.reddit.com/r/ethereum/comments/n29myk/reconciling_pow_and_pos_rewards_question/,1,12
n29uz3,1619838671,Cardano Announces Second African Partnership!,,https://www.reddit.com/r/ethereum/comments/n29uz3/cardano_announces_second_african_partnership/,1,0
n2a2z7,1619839326,"Will I spend more on gas fees if I DCA, then I’d spend buying a full ether upfront?",[removed],https://www.reddit.com/r/ethereum/comments/n2a2z7/will_i_spend_more_on_gas_fees_if_i_dca_then_id/,1,0
n2a9w2,1619839786,Ethereum deposit to trezor hardware wallet?,[removed],https://www.reddit.com/r/ethereum/comments/n2a9w2/ethereum_deposit_to_trezor_hardware_wallet/,1,2
n2aewo,1619840309,ETH just hit CA$3500!,,https://www.reddit.com/r/ethereum/comments/n2aewo/eth_just_hit_ca3500/,1,0
n2apuc,1619841543,Performance Rights Contract,[removed],https://www.reddit.com/r/ethereum/comments/n2apuc/performance_rights_contract/,1,0
n2aqg9,1619841610,Ethereum's Upcoming Triple Halving and Ultra Sound Money - A Research Report,,https://www.reddit.com/r/ethereum/comments/n2aqg9/ethereums_upcoming_triple_halving_and_ultra_sound/,1,27
n2at8g,1619841898,"Will I spend more on gas fees if I DCA, then I’d spend buying a full ether upfront?",[removed],https://www.reddit.com/r/ethereum/comments/n2at8g/will_i_spend_more_on_gas_fees_if_i_dca_then_id/,1,0
n2axxq,1619842453,Ethereum just mined it's 12345678th block!,,https://www.reddit.com/r/ethereum/comments/n2axxq/ethereum_just_mined_its_12345678th_block/,1,16
n2az0l,1619842571,Twitch Crypto Tracker with RSI indicators,,https://www.reddit.com/r/ethereum/comments/n2az0l/twitch_crypto_tracker_with_rsi_indicators/,1,0
n2b1qz,1619842870,Will Eth2 still utilize side chains?,I'm curious if there is still a need for side chains if and when eth2 is rolled out?,https://www.reddit.com/r/ethereum/comments/n2b1qz/will_eth2_still_utilize_side_chains/,1,9
n2b230,1619842908,"Ethereum Price Closes April Above Record High of $2,800",,https://www.reddit.com/r/ethereum/comments/n2b230/ethereum_price_closes_april_above_record_high_of/,1,0
n2b4oy,1619843197,Please stop,[removed],https://www.reddit.com/r/ethereum/comments/n2b4oy/please_stop/,1,0
n2ba5j,1619843826,No cap,,https://www.reddit.com/r/ethereum/comments/n2ba5j/no_cap/,1,0
n2bak0,1619843873,roots - IJ Visuals,,https://www.reddit.com/r/ethereum/comments/n2bak0/roots_ij_visuals/,1,0
n2bcrn,1619844122,This is what Im talking about!!,,https://www.reddit.com/r/ethereum/comments/n2bcrn/this_is_what_im_talking_about/,1,0
n2bdso,1619844241,whats the best ethereum block explorer for accuracy. etherscan isnt that accurate for older data,"im in the process of doing taxes, got pinged for years 2018, 2019, 2020. but the ATO (australian tax office)\n\nfor years 2018/2019 the transactions tab often doesnt go back far enough for my wallet; the internal transaction tab where ive withdrawn from a dex has missing transactions tho the transaction has will exist on ether scan it just doesnt show up in my wallet transactions for some reason. same issue with the erc20 token transactions.\n\nIve had a look at a couple of other block explorers:\n\nhttps://etherchain.org/ - seems more accurate though it doesnt have utc time just the block number.\n\nhttps://ethplorer.io/ - this one is nice in that it allows quick tagging of addresses for notes. and seems to be able to tag less comon exchanges like idex better than etherscan.\n\nthat said, i do like how etherscan puts the transactions, internal and erc20 tokens in different tabs.\n\njust curious if there is something more accurate / better features then what ive mentioned. big plus if there are block explorers that can identify older exchange wallets like cryptopia (got hacked and taken down, so i have no idea what money i put in and withdrawaled from there)\n\nand fyi, this is why you log your trades. im currently using https://koinly.io to do my tax which is doing a good job so far, but it cant track everything e.g. idex withdrawals and deposits. And yes ive reached out to idex to get the deposits / withdrawals, they told me to look at a block explorer...",https://www.reddit.com/r/ethereum/comments/n2bdso/whats_the_best_ethereum_block_explorer_for/,1,0
n2bi48,1619844743,Buying ETH struggles....,,https://www.reddit.com/r/ethereum/comments/n2bi48/buying_eth_struggles/,1,0
n2bivm,1619844829,Dinero fácil,,https://www.reddit.com/r/ethereum/comments/n2bivm/dinero_fácil/,1,0
n2bq52,1619845671,Ethereum: The Upcoming Triple Halvening,,https://www.reddit.com/r/ethereum/comments/n2bq52/ethereum_the_upcoming_triple_halvening/,1,0
n2bqou,1619845736,What are the reasons that Ethereum will crash and or fail? Is it even likely?,Im a decent investor in ETH who is new and wanted to know the possibilities. I’m mostly talking in terms of price as well. Thanks in advance.,https://www.reddit.com/r/ethereum/comments/n2bqou/what_are_the_reasons_that_ethereum_will_crash_and/,1,85
n2brn0,1619845844,Macro Guru Raoul Pal Says Ethereum Adoption Mirrors Bitcoin – Here's How High ETH Could Go This Cycle,,https://www.reddit.com/r/ethereum/comments/n2brn0/macro_guru_raoul_pal_says_ethereum_adoption/,1,0
n2bvl2,1619846320,Ethereum's Biggest Pro is Also One of It's Biggest Cons,"Prior to having watched hours of Youtube videos and reading dozens of articles, I had no idea what Ethereum was. I was fully invested in Bitcoin, however, after taking an immense amount of time to educate myself on Ethereum, I noticed what an amazing creation it is. \n\nThis brings me to my point, the biggest pro about Ethereum is that it creates a great solution to an enormous problem with complex solutions including many different vocabularies like DAOs, Dapps,  Defi, etc. That being said, the problem with such a complex system and technology is that it is a huge turnoff to people trying to start to understand it. I had to dedicate hours of my time and I still only understand a fraction of what Ethereum is. \n\n[Ethereum.org](https://Ethereum.org) does provide some teachings however I find it difficult to understand as a student with no programming background. \n\nThe point of this post is I really hope they begin to put more effort towards teaching the general public about what Ethereum is really about, instead of being just another altcoin.",https://www.reddit.com/r/ethereum/comments/n2bvl2/ethereums_biggest_pro_is_also_one_of_its_biggest/,1,322
n2bw0g,1619846369,"If I buy 100 dollars eth will the gas fees be a lot when I sell it at let's say 1 eth = $ 3500/- or $ 10,000/-?",[removed],https://www.reddit.com/r/ethereum/comments/n2bw0g/if_i_buy_100_dollars_eth_will_the_gas_fees_be_a/,1,0
n2by9b,1619846641,Let’s celebrate this ATH!!,,https://www.reddit.com/r/ethereum/comments/n2by9b/lets_celebrate_this_ath/,1,0
n2c0xf,1619846983,1000 Coin boost for Ethereum mining,[removed],https://www.reddit.com/r/ethereum/comments/n2c0xf/1000_coin_boost_for_ethereum_mining/,1,0
n2c1wg,1619847107,Coinbase is a scam,I swear coinbase is stealing money. I understand their fee of 1.49% which I find ridiculous but when I go convert my crypto I magically lose 10-30$ per conversation even if the crypto is stable. Wtf is this shit.,https://www.reddit.com/r/ethereum/comments/n2c1wg/coinbase_is_a_scam/,1,34
n2c6kz,1619847716,Introducing zkDAI into the Aztec Private Rollup,,https://www.reddit.com/r/ethereum/comments/n2c6kz/introducing_zkdai_into_the_aztec_private_rollup/,1,1
n2c8jo,1619847970,Buy or sell or hold?,[removed]\n\n[View Poll](https://www.reddit.com/poll/n2c8jo),https://www.reddit.com/r/ethereum/comments/n2c8jo/buy_or_sell_or_hold/,1,0
n2cb9g,1619848327,Are we not going to talk about 700gwei gas fees for many people?,anyone?,https://www.reddit.com/r/ethereum/comments/n2cb9g/are_we_not_going_to_talk_about_700gwei_gas_fees/,1,13
n2ccrq,1619848530,"Gas price question, what's wrong with this graph?",[removed],https://www.reddit.com/r/ethereum/comments/n2ccrq/gas_price_question_whats_wrong_with_this_graph/,1,0
n2cds1,1619848668,Best Cryptocurrency Exchange Trading Platform,,https://www.reddit.com/r/ethereum/comments/n2cds1/best_cryptocurrency_exchange_trading_platform/,1,0
n2cfku,1619848879,What is wrong with this graph? Transaction processing time/Gwei oaid,[removed],https://www.reddit.com/r/ethereum/comments/n2cfku/what_is_wrong_with_this_graph_transaction/,1,0
n2cgw3,1619849050,"Will I spend more on gas fees if I DCA, then I’d spend buying a full ether upfront?",[removed],https://www.reddit.com/r/ethereum/comments/n2cgw3/will_i_spend_more_on_gas_fees_if_i_dca_then_id/,1,0
n2ckaf,1619849501,ETH Gas Fees Are Astronomically High Right Now - What Gives?,,https://www.reddit.com/r/ethereum/comments/n2ckaf/eth_gas_fees_are_astronomically_high_right_now/,1,0
n2cllu,1619849681,Gwei price transaction time graph. What is wrong?,[removed],https://www.reddit.com/r/ethereum/comments/n2cllu/gwei_price_transaction_time_graph_what_is_wrong/,1,0
n2cm7q,1619849753,Here’s Why One Analyst Thinks ETH Is Headed for $10K,,https://www.reddit.com/r/ethereum/comments/n2cm7q/heres_why_one_analyst_thinks_eth_is_headed_for_10k/,1,1
n2cn3y,1619849871,"Will I spend more on gas fees if I DCA, then I’d spend buying a full ether upfront?",[removed],https://www.reddit.com/r/ethereum/comments/n2cn3y/will_i_spend_more_on_gas_fees_if_i_dca_then_id/,1,0
n2coiu,1619850066,Ethereum May Be the Backbone of the Future Financial System,,https://www.reddit.com/r/ethereum/comments/n2coiu/ethereum_may_be_the_backbone_of_the_future/,1,0
n2comi,1619850079,Cross-sharing here because hopefully someone big-brain can save me rip,,https://www.reddit.com/r/ethereum/comments/n2comi/crosssharing_here_because_hopefully_someone/,1,0
n2cuoo,1619850900,ERC20 token $MINI miniswap thoughts,[removed],https://www.reddit.com/r/ethereum/comments/n2cuoo/erc20_token_mini_miniswap_thoughts/,1,0
n2d5sz,1619852392,What do you think price would be when the bear season hits?,[removed],https://www.reddit.com/r/ethereum/comments/n2d5sz/what_do_you_think_price_would_be_when_the_bear/,1,1
n2d8vb,1619852768,conquest.eth alpha (testnet) is live!,,https://www.reddit.com/r/ethereum/comments/n2d8vb/conquesteth_alpha_testnet_is_live/,1,0
