id,created_utc,title,selftext,full_link,score,comments
n3yhpt,1620054597,Is it Good time to buy Ethereum,[removed]\n\n[View Poll](https://www.reddit.com/poll/n3yhpt),https://www.reddit.com/r/ethereum/comments/n3yhpt/is_it_good_time_to_buy_ethereum/,1,0
n3yjvk,1620054758,Buy ETH now?,[removed],https://www.reddit.com/r/ethereum/comments/n3yjvk/buy_eth_now/,1,0
n3yki2,1620054804,Cause of Ethereum increase?,I'm still trying to wrap my head around Ethereum and all the tech associated. I'm just wondering what drives the recent ether price increases. Is it increased volume of traffic on the network? Higher demand? I read recently it had something to do with layer 2 implementation but I'm not too sure how valid that is.,https://www.reddit.com/r/ethereum/comments/n3yki2/cause_of_ethereum_increase/,1,7
n3ymsj,1620054962,I currently have $630 invested in Ethereum.,"Hypothetically, If I were to not add anymore funds to my ethereum wallet for a year, how much could my investment potentially gain?",https://www.reddit.com/r/ethereum/comments/n3ymsj/i_currently_have_630_invested_in_ethereum/,0,6
n3ynvq,1620055040,Would organizations / governments really want their data on a distributed global ledger?,[removed],https://www.reddit.com/r/ethereum/comments/n3ynvq/would_organizations_governments_really_want_their/,1,0
n3yr78,1620055259,Ethereum Co-Founder Vitalik Buterin’s ETH Wallet Now Worth More Than $1B,,https://www.reddit.com/r/ethereum/comments/n3yr78/ethereum_cofounder_vitalik_buterins_eth_wallet/,1,0
n3yrm8,1620055286,💣💥LAST CHANCE TO BE PART OF IT NOW!!! - Price Increase due to Unforeseen Massive Demand - Phase 95 of 100 reached with insane speed and +$0.09 Increase for the Remaining Few Phases until it reaches $1.93 in Phase 100 !! - Massive Real World Utility - Serious New Project - Very High Potential 👁️‍🗨️,[removed],https://www.reddit.com/r/ethereum/comments/n3yrm8/last_chance_to_be_part_of_it_now_price_increase/,1,2
n3ys3e,1620055313,30 Days Free Access to Blockchain Developer Nanodegree,,https://www.reddit.com/r/ethereum/comments/n3ys3e/30_days_free_access_to_blockchain_developer/,1,0
n3yxzr,1620055693,🔥 ICO of Merchant Token going insanely fast! It will end very soon! Only 5 rounds left 🔥 Changes announced on ICO and now the new price listing will be 1.93 - Price now is 1.38 on Phase 95 of 100,[removed],https://www.reddit.com/r/ethereum/comments/n3yxzr/ico_of_merchant_token_going_insanely_fast_it_will/,1,0
n3yyjd,1620055727,Asking for a friend,[removed],https://www.reddit.com/r/ethereum/comments/n3yyjd/asking_for_a_friend/,1,0
n3yyjz,1620055728,Much Wow!,,https://www.reddit.com/r/ethereum/comments/n3yyjz/much_wow/,1,0
n3yzxk,1620055812,"Asking for advice, thank you!",[removed],https://www.reddit.com/r/ethereum/comments/n3yzxk/asking_for_advice_thank_you/,1,0
n3z0wd,1620055874,On-chain derivatives are the future! but which ones will the most useful and popular? We started explaining and reviewing ALL of them as a public service. After UMA and Opium here's chapter 2: The definitive explanation of Synthetix!,,https://www.reddit.com/r/ethereum/comments/n3z0wd/onchain_derivatives_are_the_future_but_which_ones/,1,0
n3z2pp,1620055994,The definitive (and clear) explanation of Synthetix!,,https://www.reddit.com/r/ethereum/comments/n3z2pp/the_definitive_and_clear_explanation_of_synthetix/,1,1
n3z3fd,1620056039,💣💥Last chance to get in - Last phase before major price increase due to unforeseen massive demand - Phase 92 of 100 right now and +$0.09 increase for the remaining 9 phases until it reaches $1.93 in phase 100 - Massive Real World Utility - Serious New Project - Very High Potential 👁️‍🗨️,[removed],https://www.reddit.com/r/ethereum/comments/n3z3fd/last_chance_to_get_in_last_phase_before_major/,1,0
n3z6g7,1620056245,Pricing question (about ETH),[removed],https://www.reddit.com/r/ethereum/comments/n3z6g7/pricing_question_about_eth/,1,0
n3z9d9,1620056444,Ethereum Test Drives ETH 2.0 as TVL Surpasses $77 Billion,,https://www.reddit.com/r/ethereum/comments/n3z9d9/ethereum_test_drives_eth_20_as_tvl_surpasses_77/,1,3
n3z9xy,1620056483,Token not appearing trustwallet,[removed],https://www.reddit.com/r/ethereum/comments/n3z9xy/token_not_appearing_trustwallet/,1,0
n3zavc,1620056542,"Bitcoin has the Satoshis unit, Ethereum should have his own too. What about a Vitalik?",[deleted],https://www.reddit.com/r/ethereum/comments/n3zavc/bitcoin_has_the_satoshis_unit_ethereum_should/,1,1
n3zb6a,1620056560,"Ethereum above $3,000: a new all-time high",[removed],https://www.reddit.com/r/ethereum/comments/n3zb6a/ethereum_above_3000_a_new_alltime_high/,1,0
n3zbrg,1620056603,Test,[removed],https://www.reddit.com/r/ethereum/comments/n3zbrg/test/,1,0
n3zbrs,1620056604,"Bitcoin has the Satoshi unit. Ethereum should have his own too. What about a ""Vitalik""?",[removed],https://www.reddit.com/r/ethereum/comments/n3zbrs/bitcoin_has_the_satoshi_unit_ethereum_should_have/,1,0
n3zdvx,1620056750,Ark invest is optimistic yet cautious of ethereum... very interesting. (Weekly email ARK),,https://www.reddit.com/r/ethereum/comments/n3zdvx/ark_invest_is_optimistic_yet_cautious_of_ethereum/,1,0
n3zga3,1620056912,Ebay CEO says they are exploring how they can enable selling NFTs on Ebay,,https://www.reddit.com/r/ethereum/comments/n3zga3/ebay_ceo_says_they_are_exploring_how_they_can/,1,128
n3zj7b,1620057108,Staking on Bitstamp,[removed],https://www.reddit.com/r/ethereum/comments/n3zj7b/staking_on_bitstamp/,1,0
n3zjzs,1620057165,Is it bad if i buy ethereum now that its at its ATH of $3000?,Should i wait for it to dip and then buy for the first time or just buy it rn?\nThanks.,https://www.reddit.com/r/ethereum/comments/n3zjzs/is_it_bad_if_i_buy_ethereum_now_that_its_at_its/,1,23
n3zknf,1620057212,"🚀 Ethereum ha superado los 3.200 dólares 💥 y su cofundador, Vitalik Buterin, ya tiene más de 1.000 millones de dólares en Ethereum. Es multimillonario a los 27 años. Aquí la noticia completa",,https://www.reddit.com/r/ethereum/comments/n3zknf/ethereum_ha_superado_los_3200_dólares_y_su/,1,0
n3zo4x,1620057462,Help,,https://www.reddit.com/r/ethereum/comments/n3zo4x/help/,1,0
n3zorg,1620057507,ETHEREUM To 10000 Dollars ...,,https://www.reddit.com/r/ethereum/comments/n3zorg/ethereum_to_10000_dollars/,1,0
n3ztim,1620057823,Based on a true story...,,https://www.reddit.com/r/ethereum/comments/n3ztim/based_on_a_true_story/,1,0
n3zwum,1620058027,DeFi Report Q1 2021 -- Consensys,,https://www.reddit.com/r/ethereum/comments/n3zwum/defi_report_q1_2021_consensys/,1,2
n406ti,1620058684,I’ve been waiting for ETH to crash so I can buy the dip.,,https://www.reddit.com/r/ethereum/comments/n406ti/ive_been_waiting_for_eth_to_crash_so_i_can_buy/,1,0
n40c1e,1620059015,Introducing akasha.ethereum.world 🥳,,https://www.reddit.com/r/ethereum/comments/n40c1e/introducing_akashaethereumworld/,1,23
n40gr1,1620059318,"Posted about ETH in a BTC sub, I feel sad for that group",,https://www.reddit.com/r/ethereum/comments/n40gr1/posted_about_eth_in_a_btc_sub_i_feel_sad_for_that/,1,332
n40ika,1620059445,Any idea how to view the EIB issuance on the blockchain?,We've seen the reports that the EIB is issuing (has issued?) a 100M Euro 2-yr bond via Ethereum.\n\n[https://www.eib.org/en/press/all/2021-141-european-investment-bank-eib-issues-its-first-ever-digital-bond-on-a-public-blockchain](https://www.eib.org/en/press/all/2021-141-european-investment-bank-eib-issues-its-first-ever-digital-bond-on-a-public-blockchain)\n\nDoes anybody know how we can view this on the blockchain?,https://www.reddit.com/r/ethereum/comments/n40ika/any_idea_how_to_view_the_eib_issuance_on_the/,1,0
n40kpu,1620059596,"I make crypto art here is ""Time For Ethereum"" Moonables #020",,https://www.reddit.com/r/ethereum/comments/n40kpu/i_make_crypto_art_here_is_time_for_ethereum/,1,0
n40p9l,1620059909,GO ETH 💪,,https://www.reddit.com/r/ethereum/comments/n40p9l/go_eth/,1,1
n40pjt,1620059931,Can someone explain proof of staking and what’s likely to happen to the price of Eth when it comes in?,[removed],https://www.reddit.com/r/ethereum/comments/n40pjt/can_someone_explain_proof_of_staking_and_whats/,1,0
n40xej,1620060440,Literal Blood Money,,https://www.reddit.com/r/ethereum/comments/n40xej/literal_blood_money/,1,0
n413fq,1620060868,Advice,[removed],https://www.reddit.com/r/ethereum/comments/n413fq/advice/,1,0
n4140b,1620060910,3.25k ATH,Eth wont stop huh? Can some1 please give me reasonable price prediction by the end of year?,https://www.reddit.com/r/ethereum/comments/n4140b/325k_ath/,1,21
n4149t,1620060929,Buy now?,Is now a good time to buy in or do you think it’s time for another soothed buy in?,https://www.reddit.com/r/ethereum/comments/n4149t/buy_now/,1,45
n414u6,1620060971,"Beginning my Ethereum journey, should i wait for a correction or just start investing in Eth asap?",[removed],https://www.reddit.com/r/ethereum/comments/n414u6/beginning_my_ethereum_journey_should_i_wait_for_a/,1,0
n417hr,1620061173,ETH staking,[removed],https://www.reddit.com/r/ethereum/comments/n417hr/eth_staking/,1,0
n41920,1620061261,"Add to your calendar Ethereum (ETH) event: London Hard Fork - July 31, 2021",,https://www.reddit.com/r/ethereum/comments/n41920/add_to_your_calendar_ethereum_eth_event_london/,1,0
n41923,1620061261,Newton $25 Referral Code,,https://www.reddit.com/r/ethereum/comments/n41923/newton_25_referral_code/,1,1
n41bbf,1620061400,I now own 1 full Ethereum,[removed],https://www.reddit.com/r/ethereum/comments/n41bbf/i_now_own_1_full_ethereum/,1,1
n41bjm,1620061418,Buy Ether or Other Tokens?,[removed],https://www.reddit.com/r/ethereum/comments/n41bjm/buy_ether_or_other_tokens/,1,0
n41l98,1620062073,Based on a true story...,,https://www.reddit.com/r/ethereum/comments/n41l98/based_on_a_true_story/,1,0
n41n4e,1620062193,Dang. ETH keeps going. 🚀🔥🤷‍♂️,[removed],https://www.reddit.com/r/ethereum/comments/n41n4e/dang_eth_keeps_going/,1,0
