id,created_utc,title,selftext,full_link,score,comments
n9afi5,1620666771,Raoul Pal Explains Why His Portfolio is 98% Crypto,,https://www.reddit.com/r/ethereum/comments/n9afi5/raoul_pal_explains_why_his_portfolio_is_98_crypto/,1,0
n9afxo,1620666801,We are losing the core concept of what is a crypto currency..,[removed],https://www.reddit.com/r/ethereum/comments/n9afxo/we_are_losing_the_core_concept_of_what_is_a/,1,0
n9anqj,1620667337,"I’m an ETH hodler, and I am ashamed at how salty and insecure this community has become against our little brother ETC or other cryptos in general. Before, we could support other cryptos without being douchebags, now ETH is just filled with snowflakes, shitting on anybody outside of ETH.",,https://www.reddit.com/r/ethereum/comments/n9anqj/im_an_eth_hodler_and_i_am_ashamed_at_how_salty/,1,7
n9aocr,1620667377,"Chinese Company Urban Tea Accepts Bitcoin (BTC), Ethereum (ETH) and Dogecoin (DOGE)",,https://www.reddit.com/r/ethereum/comments/n9aocr/chinese_company_urban_tea_accepts_bitcoin_btc/,1,0
n9aqug,1620667552,"Forgive my inexperience, but am I subject to CGT if I convert between cryptocurrencies, say Ether to bitcoin? What about converting Ether to USD while still keeping the money on Coinbase or Kraken?",[removed],https://www.reddit.com/r/ethereum/comments/n9aqug/forgive_my_inexperience_but_am_i_subject_to_cgt/,1,0
n9at0g,1620667699,Cool ETH Blockchain Game about Dragons!,[removed],https://www.reddit.com/r/ethereum/comments/n9at0g/cool_eth_blockchain_game_about_dragons/,1,0
n9auap,1620667789,Dragon Strategy Game on ETH Blockchain,[removed],https://www.reddit.com/r/ethereum/comments/n9auap/dragon_strategy_game_on_eth_blockchain/,1,0
n9b4jc,1620668426,DeFi at Polkadot Yield Farming at Ducat Network. Combining the best decentralized finance with high returns,[removed],https://www.reddit.com/r/ethereum/comments/n9b4jc/defi_at_polkadot_yield_farming_at_ducat_network/,1,0
n9b5jw,1620668496,"Newbish question about staking. If you’re planning on holding long term, should you stake all of your ETH? Are there any downsides to this?","Additionally, I have less than 32 ETH so I would be staking in a pool such as Stakewise.io",https://www.reddit.com/r/ethereum/comments/n9b5jw/newbish_question_about_staking_if_youre_planning/,1,7
n9b5ld,1620668499,Staking pool for eth 2.0 in Canada ?,Not offered on coinbase. What're the options?,https://www.reddit.com/r/ethereum/comments/n9b5ld/staking_pool_for_eth_20_in_canada/,1,3
n9b69e,1620668544,Transaction fee are terrible,[removed],https://www.reddit.com/r/ethereum/comments/n9b69e/transaction_fee_are_terrible/,1,0
n9bc8t,1620668954,Buy£1 of crypto get £5 instant,[removed],https://www.reddit.com/r/ethereum/comments/n9bc8t/buy1_of_crypto_get_5_instant/,1,0
n9bige,1620669365,Developers in a team,[removed],https://www.reddit.com/r/ethereum/comments/n9bige/developers_in_a_team/,1,0
n9bij8,1620669371,Massive fees,,https://www.reddit.com/r/ethereum/comments/n9bij8/massive_fees/,1,0
n9bj10,1620669404,Convert all BTC into ETH?,[removed],https://www.reddit.com/r/ethereum/comments/n9bj10/convert_all_btc_into_eth/,1,0
n9bke0,1620669497,There is a Pending txn with a lower account nonce. This txn can only be executed after confirmation of the earlier. HELP PLZ,[removed],https://www.reddit.com/r/ethereum/comments/n9bke0/there_is_a_pending_txn_with_a_lower_account_nonce/,1,0
n9bltl,1620669599,Is ethereum price dropping anytime soon ?,[removed],https://www.reddit.com/r/ethereum/comments/n9bltl/is_ethereum_price_dropping_anytime_soon/,1,0
n9boml,1620669787,I understand how smart contracts work and their purpose - but how does one know what smart contract they need to write ?,[removed],https://www.reddit.com/r/ethereum/comments/n9boml/i_understand_how_smart_contracts_work_and_their/,1,0
n9bqo2,1620669924,Why MEV Is Way Worse Than You Think,,https://www.reddit.com/r/ethereum/comments/n9bqo2/why_mev_is_way_worse_than_you_think/,1,0
n9bqrj,1620669931,"Vitalik have 50% of Shiba Token and the value is 3,298,315.377267 ETH! MORE THEN 333K thats Vitalk own wow.",,https://www.reddit.com/r/ethereum/comments/n9bqrj/vitalik_have_50_of_shiba_token_and_the_value_is/,1,9
n9brs7,1620670007,I’m guessing 5K next Sunday?🚀🚀🚀🚀🚀🚀🚀🚀,[removed],https://www.reddit.com/r/ethereum/comments/n9brs7/im_guessing_5k_next_sunday/,1,0
n9bs9h,1620670040,GPU limiters,[removed],https://www.reddit.com/r/ethereum/comments/n9bs9h/gpu_limiters/,1,0
n9bw13,1620670288,ETH gass fees higher than my swap investment,[removed],https://www.reddit.com/r/ethereum/comments/n9bw13/eth_gass_fees_higher_than_my_swap_investment/,1,0
n9byw7,1620670489,Billie Eilish - Your Power (Official Music Video),[removed],https://www.reddit.com/r/ethereum/comments/n9byw7/billie_eilish_your_power_official_music_video/,1,0
n9c0wj,1620670616,Series-C Blockchain Startup AnChain.AI HIRING Smart Contract Security Researcher,[removed],https://www.reddit.com/r/ethereum/comments/n9c0wj/seriesc_blockchain_startup_anchainai_hiring_smart/,1,0
n9c3wa,1620670822,"$200 in gas fees, transaction failed, all lost",Does someone want to explain this to me? How can I loose everything and gain nothing? It cost me fuckin $200 in gas fees and I literally got nothing. \n\n[https://etherscan.io/tx/0xfdff86618c27ff2ea9850c2c09f468492dcf67bd72242491a2db5b5697179e03](https://etherscan.io/tx/0xfdff86618c27ff2ea9850c2c09f468492dcf67bd72242491a2db5b5697179e03),https://www.reddit.com/r/ethereum/comments/n9c3wa/200_in_gas_fees_transaction_failed_all_lost/,1,370
n9cfle,1620671630,Extreme transaction/networking fees?,[removed],https://www.reddit.com/r/ethereum/comments/n9cfle/extreme_transactionnetworking_fees/,1,0
n9cl6b,1620672028,Send it to the moon!!!!!!,[removed],https://www.reddit.com/r/ethereum/comments/n9cl6b/send_it_to_the_moon/,1,0
n9cnqz,1620672175,Blockchain currency swap - funds missing?,,https://www.reddit.com/r/ethereum/comments/n9cnqz/blockchain_currency_swap_funds_missing/,1,0
n9cow2,1620672255,Messed up a lot of transactions,Not understanding a lot of the concepts. I messed up a lot of transactions and now they are stuck in what looks like a bad state.\n\n1) Started a small transaction (SHIBA to ETH) with a too low gas fee.\n\n2) Started a second larger transaction (SHIBA to ETH) with a higher gas fee.\n\n3) Tried to move all the crypto to a new wallet  (SHIBA to SHIBA) before 1 and 2 finished. Not understanding what was going on and thinking that my wallet was messed up (Coinbase Wallet was having issues this weekend). \n\n4) Learnt how to cancel 1 and 2.\n\n5) Sent a 0.01$ order twice to cancel 1 and 2... both 1 and 2 shows up as cancelled.\n\n6) Transaction 3 is still pending.,https://www.reddit.com/r/ethereum/comments/n9cow2/messed_up_a_lot_of_transactions/,1,0
n9ct6t,1620672533,Mining pool transaction fee.,[removed],https://www.reddit.com/r/ethereum/comments/n9ct6t/mining_pool_transaction_fee/,1,0
n9cyay,1620672891,"Spring SALE - Innosilicon A10, Goldshell KD5, Antminer Z15, Antminer S19 Pro 110Th/s, Innosilicon A11 (Pre-orders) and much more",,https://www.reddit.com/r/ethereum/comments/n9cyay/spring_sale_innosilicon_a10_goldshell_kd5/,1,0
n9d9w1,1620673664,"I'm about to buy crypto for first time. Need help, i'm using coinbase",[removed],https://www.reddit.com/r/ethereum/comments/n9d9w1/im_about_to_buy_crypto_for_first_time_need_help/,1,0
n9dach,1620673696,Gas fees were collected but didn't receive tokens,"I am trying to resolve an issue. I swapped for another coin using 1inch for the first time. I had enough ETH to cover the gas fees and extra if things were to exceed what was expected. The gas fees were confirmed and collected from my Meta wallet and the gas usage was under the gas limit. The token that I was going to swap is still in my wallet but the ETH is gone. So I refreshed the link again and it said that the transaction: \n\nStatus:  \nDropped \n\nBlock:  \n  (*Pending*)   \n\n\nI guess I am trying to figure out how to resolve this issue but if I lost $50 bucks, I lost $50",https://www.reddit.com/r/ethereum/comments/n9dach/gas_fees_were_collected_but_didnt_receive_tokens/,1,3
n9dd7h,1620673901,MEV (Miner Extractable Value) Long Term Concern : Article by Pmcgoohan,[removed],https://www.reddit.com/r/ethereum/comments/n9dd7h/mev_miner_extractable_value_long_term_concern/,1,0
n9ddrr,1620673939,"""News"" groups are just trash",[removed],https://www.reddit.com/r/ethereum/comments/n9ddrr/news_groups_are_just_trash/,1,0
n9de0r,1620673958,The best Ethereum Faucet (without captchas),[removed],https://www.reddit.com/r/ethereum/comments/n9de0r/the_best_ethereum_faucet_without_captchas/,1,0
n9dejv,1620673997,Where to buy new crypto currencies,Is there a good exchange that has lots of crypto currencies? All the big guys i've seen only have a handful of the top ones. How do I go about buying some of the smaller ones?,https://www.reddit.com/r/ethereum/comments/n9dejv/where_to_buy_new_crypto_currencies/,1,3
n9dery,1620674014,Issues with bank of America?,[removed],https://www.reddit.com/r/ethereum/comments/n9dery/issues_with_bank_of_america/,1,0
n9dfie,1620674068,How do I transfer my tiny ETH from Binance to Coinbase?!,,https://www.reddit.com/r/ethereum/comments/n9dfie/how_do_i_transfer_my_tiny_eth_from_binance_to/,1,0
n9dfvu,1620674096,I bought ethereum on trust wallet about 30 minutes ago and it still isn’t showing in my account? Even if i check my wallet on the ether scan it says 0.00. is it just backed up right now?,[removed],https://www.reddit.com/r/ethereum/comments/n9dfvu/i_bought_ethereum_on_trust_wallet_about_30/,1,0
n9dhvm,1620674239,How to get out of multiple bad / pending transactions,Not understanding a lot of the concepts. I messed up a lot of transactions and now they are stuck in what looks like a bad state.\n\n1. Started a small transaction (SHIBA to ETH) with a too low gas fee.\n2. Started a second larger transaction (SHIBA to ETH) with a higher gas fee.\n3. Tried to move all the crypto to a new wallet (SHIBA to SHIBA) before 1 and 2 finished. Not understanding what was going on and thinking that my wallet was messed up (Coinbase Wallet was having issues this weekend).\n4. Learnt how to cancel 1 and 2.\n5. Sent a 0.01$ order twice to cancel 1 and 2... both 1 and 2 shows up as cancelled.\n6. Transaction 3 is still pending.\n\nIs there anything I can do here?,https://www.reddit.com/r/ethereum/comments/n9dhvm/how_to_get_out_of_multiple_bad_pending/,1,2
n9di8r,1620674266,It's been awhile… I am very confused,[removed],https://www.reddit.com/r/ethereum/comments/n9di8r/its_been_awhile_i_am_very_confused/,1,0
n9dl6m,1620674465,What happens if an eth transaction is pending and you are trying to receive eth,[removed],https://www.reddit.com/r/ethereum/comments/n9dl6m/what_happens_if_an_eth_transaction_is_pending_and/,1,0
n9dm1s,1620674520,Can someone the ETH fees spike?,,https://www.reddit.com/r/ethereum/comments/n9dm1s/can_someone_the_eth_fees_spike/,1,0
n9dno7,1620674635,Crypto Time Capsule,[removed],https://www.reddit.com/r/ethereum/comments/n9dno7/crypto_time_capsule/,1,0
n9dp4q,1620674737,The ultrasound money meme explained,,https://www.reddit.com/r/ethereum/comments/n9dp4q/the_ultrasound_money_meme_explained/,1,0
n9dvt0,1620675193,Had a go at making the Ethereum symbol,,https://www.reddit.com/r/ethereum/comments/n9dvt0/had_a_go_at_making_the_ethereum_symbol/,1,0
n9e25m,1620675669,Math,[removed],https://www.reddit.com/r/ethereum/comments/n9e25m/math/,1,0
n9e2k6,1620675701,SOUND BOY APPAREL- NOW ACCEPTING ETHEREUM 💥,,https://www.reddit.com/r/ethereum/comments/n9e2k6/sound_boy_apparel_now_accepting_ethereum/,1,0
