id,created_utc,title,selftext,full_link,score,comments
navzdz,1620844723,ETH purchase in CAD,[removed],https://www.reddit.com/r/ethereum/comments/navzdz/eth_purchase_in_cad/,1,0
navzxf,1620844762,How easy is it to develop on Ethereum?,[removed],https://www.reddit.com/r/ethereum/comments/navzxf/how_easy_is_it_to_develop_on_ethereum/,1,0
naw2j2,1620844945,hodl PLATES,,https://www.reddit.com/r/ethereum/comments/naw2j2/hodl_plates/,1,0
naw565,1620845123,Welp,looks like we finally hit the bear market😐 or at the very least cryto winter. yikes down 1.24% from yesterday after hitting a new ath just recently,https://www.reddit.com/r/ethereum/comments/naw565/welp/,1,0
nawbmx,1620845581,Buy the dip boys! We are only going up from here :),Let’s gooooo,https://www.reddit.com/r/ethereum/comments/nawbmx/buy_the_dip_boys_we_are_only_going_up_from_here/,2,70
nawdf1,1620845713,Gas just hit over 500. Creating even a simple ERC20 costs over $2000 now. But Coinstructor can do that for $200 - using proxies.,,https://www.reddit.com/r/ethereum/comments/nawdf1/gas_just_hit_over_500_creating_even_a_simple/,1,0
nawo7u,1620846489,"Market is on sale, pump in more to win big.",[removed],https://www.reddit.com/r/ethereum/comments/nawo7u/market_is_on_sale_pump_in_more_to_win_big/,1,0
nawt7d,1620846845,Vitalik Buterin donates 1 Billion worth of Shiba to India Covid Relief Fund,,https://www.reddit.com/r/ethereum/comments/nawt7d/vitalik_buterin_donates_1_billion_worth_of_shiba/,1,0
nawvkt,1620847015,Pathos Token Now 10x .! liquidity locked.!,[removed],https://www.reddit.com/r/ethereum/comments/nawvkt/pathos_token_now_10x_liquidity_locked/,1,0
nawxxo,1620847187,Ethereum Hits A New High And The Market Value Exceeded $500 Billion For The First Time,,https://www.reddit.com/r/ethereum/comments/nawxxo/ethereum_hits_a_new_high_and_the_market_value/,1,0
nawyxs,1620847251,What the f... is going with eth fees???,Buying 200$ coins need 450$ fee\nCrazy fucking crazy,https://www.reddit.com/r/ethereum/comments/nawyxs/what_the_f_is_going_with_eth_fees/,1,31
nawze4,1620847282,All the Dips,[removed],https://www.reddit.com/r/ethereum/comments/nawze4/all_the_dips/,1,0
nax0j8,1620847362,Ethereum Hits A New High And The Market Value Exceeded $500 Billion For The First Time,,https://www.reddit.com/r/ethereum/comments/nax0j8/ethereum_hits_a_new_high_and_the_market_value/,1,0
nax12n,1620847400,Transferring Ethereum to Wallet,"Hey guys, so I'm having trouble transferring the Ethereum from my coinbase account to my coinbase wallet. I have about 200 in it right now but when I try to put that into my wallet it says I have a smaller amount available and I can't transfer it because I reached my daily trading limit, but I haven't even made any trades today? It's a weird issue and I don't know what the actual problem is, has anyone else here had the same problem?",https://www.reddit.com/r/ethereum/comments/nax12n/transferring_ethereum_to_wallet/,1,1
nax24k,1620847480,When will Eth2 have smart contract functionality?,,https://www.reddit.com/r/ethereum/comments/nax24k/when_will_eth2_have_smart_contract_functionality/,1,14
nax2d4,1620847498,Anyone think ETH will go back under 3k with this market correction?,"I sold at 2.8k thinking it would have a small dip so I could buy back in, but since then it’s been growing almost every day for the past 2 weeks. Any re-entry strategies? Anything would help.",https://www.reddit.com/r/ethereum/comments/nax2d4/anyone_think_eth_will_go_back_under_3k_with_this/,1,11
nax2o5,1620847517,"Vitalik removes SHIBA liquidity from Uniswap, donates 1 Billion to India COVID relief.","You can see Some fresh movement of Vitalks holdings. He has removed over 110 million in liquidity from Uniswap SHIB pool. As well as distributed many of the coins donated to him. Some $500 million to Gitcoin, $1 Billion to India COVID relief. He also moved a majority of his ETH holding to a new address.\n\n[https://etherscan.io/address/0xab5801a7d398351b8be11c439e05c5b3259aec9b#tokentxns](https://etherscan.io/address/0xab5801a7d398351b8be11c439e05c5b3259aec9b#tokentxns)\n\nNew address: [https://etherscan.io/address/0x220866b1a2219f40e72f5c628b65d54268ca3a9d](https://etherscan.io/address/0x220866b1a2219f40e72f5c628b65d54268ca3a9d)",https://www.reddit.com/r/ethereum/comments/nax2o5/vitalik_removes_shiba_liquidity_from_uniswap/,1,99
nax397,1620847560,Sold all my shitcoins and meme stocks today.. (A self reflection),"Been gambling like an idiot and lost 25% of my portfolio value playing with ETC and meme stocks. Decided today is the day I make the fist steps to financial independence. Put half my portfolio in VOO and the other half in ETH ( Ik that may sound like a risky/aggressive portfolio but I am 22 and have the risk tolerance as well as understand that we are in a bull market now. \n\n&amp;#x200B;\n\nSort of just a small rant about myself, curious to see if anyone else here relates or has any thoughts! Cheers!",https://www.reddit.com/r/ethereum/comments/nax397/sold_all_my_shitcoins_and_meme_stocks_today_a/,1,13
nax5hu,1620847720,OUR LORD VITALIK BUTERIN DONATED $1 BILLION to the India Covid Crypto Fund !!!,,https://www.reddit.com/r/ethereum/comments/nax5hu/our_lord_vitalik_buterin_donated_1_billion_to_the/,1,0
nax6il,1620847796,This dApp casino is offering a $3K $ETH promotion whereby the top 50 leaderboards get a share of the giveaway. You can earn the giveaway by wagering on any of the 5 games the casino offers. It has a low house edge and has bets on-chain thereby being provably fair and transparent.,,https://www.reddit.com/r/ethereum/comments/nax6il/this_dapp_casino_is_offering_a_3k_eth_promotion/,1,0
nax7e8,1620847852,I thought MetaMask was lying to me when I was sending my ethermine pay to my ledger. Looked on my extension WHAT THE HECK IS GOING ON. I’ve never seen the blockchain this congested. Nearly £350 to send a transaction,,https://www.reddit.com/r/ethereum/comments/nax7e8/i_thought_metamask_was_lying_to_me_when_i_was/,1,0
nax8mj,1620847942,New to crypto,[removed],https://www.reddit.com/r/ethereum/comments/nax8mj/new_to_crypto/,1,0
naxeua,1620848388,Eth2 Roadmap Question: Can someone explain to me when smart contract functionality is planned to be rolled into Eth2? Or will it be available as soon as the Merge occurs?,,https://www.reddit.com/r/ethereum/comments/naxeua/eth2_roadmap_question_can_someone_explain_to_me/,1,8
naxhbc,1620848556,Proof Ethereum will take over the world?,,https://www.reddit.com/r/ethereum/comments/naxhbc/proof_ethereum_will_take_over_the_world/,1,0
naxitg,1620848662,Staked ETH lower value?,[removed],https://www.reddit.com/r/ethereum/comments/naxitg/staked_eth_lower_value/,1,0
naxjji,1620848710,Vitalik Buterin donates more than $60M to charity after selling meme tokens including Shiba Inu,,https://www.reddit.com/r/ethereum/comments/naxjji/vitalik_buterin_donates_more_than_60m_to_charity/,1,0
naxphf,1620849141,Stake only some of my ETH?,All of my ETH is currently in Coinbase. Am I able to stake only part of my ETH or is it an all or nothing system through Coinbase? I don't want to click too far into the process and end up having all my ETH staked my mistake.,https://www.reddit.com/r/ethereum/comments/naxphf/stake_only_some_of_my_eth/,1,6
naxpx1,1620849168,I have a checking account but I can't buy any ETH because most wallets like paxful require KYC (i'm 17). Are there any wallets that don't have KYC or should I just wait until I'm allowed on all of the major exchanges?,Title,https://www.reddit.com/r/ethereum/comments/naxpx1/i_have_a_checking_account_but_i_cant_buy_any_eth/,1,6
naxrkm,1620849289,Room full of Ethereum,,https://www.reddit.com/r/ethereum/comments/naxrkm/room_full_of_ethereum/,1,1
naxrw1,1620849311,Extremely low hashrate on Rx 580 4gb,[removed],https://www.reddit.com/r/ethereum/comments/naxrw1/extremely_low_hashrate_on_rx_580_4gb/,1,0
naxz1i,1620849818,When do I pay gas fees?,[removed],https://www.reddit.com/r/ethereum/comments/naxz1i/when_do_i_pay_gas_fees/,1,0
naxz8q,1620849832,Vitalik Buterin donates $1 billion in Shiba Inu coin (SHIB) to India’s COVID fight,,https://www.reddit.com/r/ethereum/comments/naxz8q/vitalik_buterin_donates_1_billion_in_shiba_inu/,1,0
nay0n2,1620849927,The recent posts about excessive gas fees are from shills trying to lower Eths price,[removed],https://www.reddit.com/r/ethereum/comments/nay0n2/the_recent_posts_about_excessive_gas_fees_are/,1,0
nay20e,1620850026,Ethereum vs Ethereum although coins,"If ethereum is the platform / block chain all the other defi coins are built on, why bother purchasing other ethereum style coins? Do they correlate is eth the safest play to insure you benefit if that blockchain survives?",https://www.reddit.com/r/ethereum/comments/nay20e/ethereum_vs_ethereum_although_coins/,1,4
nay692,1620850335,My take on if an Eth supercycle if possible!,,https://www.reddit.com/r/ethereum/comments/nay692/my_take_on_if_an_eth_supercycle_if_possible/,1,0
nay9ce,1620850561,Purpeth,[removed],https://www.reddit.com/r/ethereum/comments/nay9ce/purpeth/,1,0
naya7h,1620850623,Dumb Question! ETH Staking on Coinbase,Counbase is offering 6% apy on staked ETH which transfers to ETH2 when it comes out. My question is this: is that 6% on top of any growth that ETH has on it's own? Or am I locking in my price of ETH by staking it?,https://www.reddit.com/r/ethereum/comments/naya7h/dumb_question_eth_staking_on_coinbase/,1,11
naykhn,1620851364,I'm thankful Vitalik crashed the dog coin meme frenzy to reduce the fees but..,"he shouldn't have to do that.  as much as i hate the dog memes ethereum should be able to scale for that kind of influx.  what if those people weren't buying dog memes that sent 50% of their supply to vitalik?  would gas fees be $1000 right now?  how much more dog tokens does he have that he can use to save us from crazy fees (even still they're too high) ?\n\ni'm conflicted on you, vitalik.  very conflicted.",https://www.reddit.com/r/ethereum/comments/naykhn/im_thankful_vitalik_crashed_the_dog_coin_meme/,1,12
naylqk,1620851451,I guess this is a good way to fix the GAS problem !?,,https://www.reddit.com/r/ethereum/comments/naylqk/i_guess_this_is_a_good_way_to_fix_the_gas_problem/,1,0
nayqdp,1620851787,VPN to Stake?,"Hello everybody! I just had some quick questions about staking that I know you wizards can help me with! Last week I bought 0.25 ETH on coinbase at 3500 USD. I’m very interested in staking it, but I only have a rough idea of how it works. I guess my questions are:\n\n1). Do I have enough ETH to stake?\n\n2). If I can, is it even worth it with the amount I have?\n\n3). I live in NYS, can I stake on coinbase or coinbase pro using a vpn? \n\nThank you guys in advance, I’m a rookie but I’m super excited to be a part of this community and the future. Just looking to learn :)",https://www.reddit.com/r/ethereum/comments/nayqdp/vpn_to_stake/,1,2
naz35r,1620852717,"Vitalik Buterin, Co-Founder of ETH Donated Over $1 Billion to India's COVID-Crypto Fund",,https://www.reddit.com/r/ethereum/comments/naz35r/vitalik_buterin_cofounder_of_eth_donated_over_1/,1,0
naz4ez,1620852810,"Transfer done from metamask to bittrue, shows completed on my end but receiving wallet address on bittrue shows pending", My end : [https://etherscan.io/tx/0x362b2b3826679606c0c5617d747d354d5541c4601ab38508c1c875100c5b1ab0](https://etherscan.io/tx/0x362b2b3826679606c0c5617d747d354d5541c4601ab38508c1c875100c5b1ab0)\n\nBittrue wallet end:[https://etherscan.io/address/0xc263ead17280aa840db9915c6e690335520d60a4](https://etherscan.io/address/0xc263ead17280aa840db9915c6e690335520d60a4)\n\n&amp;#x200B;\n\nHow do i fix this ?,https://www.reddit.com/r/ethereum/comments/naz4ez/transfer_done_from_metamask_to_bittrue_shows/,1,2
naz5kd,1620852893,Vitalik killed this shitcoin and ETH flew away haha,[removed],https://www.reddit.com/r/ethereum/comments/naz5kd/vitalik_killed_this_shitcoin_and_eth_flew_away/,1,0
naz627,1620852926,Some questions about changelly,[removed],https://www.reddit.com/r/ethereum/comments/naz627/some_questions_about_changelly/,1,0
naz71e,1620852998,MSI revels two models of CMP 30HX to mine cryptocurrencies,,https://www.reddit.com/r/ethereum/comments/naz71e/msi_revels_two_models_of_cmp_30hx_to_mine/,1,0
naz7r3,1620853053,Is it too late to invest?,[removed],https://www.reddit.com/r/ethereum/comments/naz7r3/is_it_too_late_to_invest/,1,0
nazax8,1620853270,Smart investment?,[removed],https://www.reddit.com/r/ethereum/comments/nazax8/smart_investment/,1,0
nazbed,1620853306,The rollups are coming to save your gas! Arbitrum's mainnet is launching for developers on May 28!,,https://www.reddit.com/r/ethereum/comments/nazbed/the_rollups_are_coming_to_save_your_gas_arbitrums/,1,1
nazezh,1620853567,US gas fees and ETH gas fees right now? #Conspiracy,,https://www.reddit.com/r/ethereum/comments/nazezh/us_gas_fees_and_eth_gas_fees_right_now_conspiracy/,1,0
nazfdc,1620853596,Is ETH becoming the top Crypto?,[removed],https://www.reddit.com/r/ethereum/comments/nazfdc/is_eth_becoming_the_top_crypto/,1,0
