id,created_utc,title,selftext,full_link,score,comments
nb3dvx,1620864396,Coinbase Pro Down?,"Or is it just me, I’m trying to buy this dip!",https://www.reddit.com/r/ethereum/comments/nb3dvx/coinbase_pro_down/,1,18
nb3gc1,1620864587,Crash?,[removed],https://www.reddit.com/r/ethereum/comments/nb3gc1/crash/,1,0
nb3gc7,1620864588,What's happening? Crashing!?,"Prices for BTC, ETH ....... Are all crashing. What's up??",https://www.reddit.com/r/ethereum/comments/nb3gc7/whats_happening_crashing/,1,26
nb3iu5,1620864769,ELON MUSK IS SCUM! WHO AGREES?,,https://www.reddit.com/r/ethereum/comments/nb3iu5/elon_musk_is_scum_who_agrees/,2,41
nb3j5i,1620864792,"Tesla decision on BTC = Long ETH, right?",[removed],https://www.reddit.com/r/ethereum/comments/nb3j5i/tesla_decision_on_btc_long_eth_right/,1,0
nb3l3c,1620864944,Crash,[removed],https://www.reddit.com/r/ethereum/comments/nb3l3c/crash/,1,0
nb3nf9,1620865129,We're chilling,[removed],https://www.reddit.com/r/ethereum/comments/nb3nf9/were_chilling/,1,0
nb3nvs,1620865168,There is a dip lest start buying ethereum to the moon next month,[removed],https://www.reddit.com/r/ethereum/comments/nb3nvs/there_is_a_dip_lest_start_buying_ethereum_to_the/,1,0
nb3oae,1620865203,How does EIP1559 interact with ETH2.0?,"If ETH2.0 is expected to increase throughout and decrease fees for the network, does that also mean that the deflationary effect of EIP1559 would be dampened? What am I missing",https://www.reddit.com/r/ethereum/comments/nb3oae/how_does_eip1559_interact_with_eth20/,1,18
nb3okd,1620865223,Flippening?,Did musk just trigger the Eth flippening?,https://www.reddit.com/r/ethereum/comments/nb3okd/flippening/,1,4
nb3q6e,1620865354,Crash,[removed],https://www.reddit.com/r/ethereum/comments/nb3q6e/crash/,1,0
nb3rn0,1620865481,"Why do people insist on worshiping clowns like Musk? This is the 9th public promise he’s broken, and that’s excluding the lie about self-driving capability. If you think rich folk are your heroes then perhaps that’s the indicator it time to grow up from adolescence?",,https://www.reddit.com/r/ethereum/comments/nb3rn0/why_do_people_insist_on_worshiping_clowns_like/,1,16
nb3sqe,1620865580,Finally joined the ether club,,https://www.reddit.com/r/ethereum/comments/nb3sqe/finally_joined_the_ether_club/,1,0
nb3vry,1620865822,😂 ETH GAS,,https://www.reddit.com/r/ethereum/comments/nb3vry/eth_gas/,1,0
nb3w56,1620865850,Coin dumps?,[removed],https://www.reddit.com/r/ethereum/comments/nb3w56/coin_dumps/,1,0
nb3wqi,1620865900,Sorry fellas. Gas is too expensive,,https://www.reddit.com/r/ethereum/comments/nb3wqi/sorry_fellas_gas_is_too_expensive/,1,0
nb3z85,1620866094,I am more confident then ever in this coin!!!, Ethereum is the future!!!!!,https://www.reddit.com/r/ethereum/comments/nb3z85/i_am_more_confident_then_ever_in_this_coin/,1,19
nb40g4,1620866189,"How is eth 2.0 more sustainable in mining, compared to other coins?",,https://www.reddit.com/r/ethereum/comments/nb40g4/how_is_eth_20_more_sustainable_in_mining_compared/,1,7
nb40qp,1620866216,Ethereum Statelessness and State Expiry,,https://www.reddit.com/r/ethereum/comments/nb40qp/ethereum_statelessness_and_state_expiry/,1,0
nb41x8,1620866311,Energy per transaction?,Tesla just announced BTC was using too much energy per transaction and to be looking at alternatives using less than 1% of BTC. \n\nWhat does ETH is estimated to use per transaction?\nWill ETH2 improve power usage?,https://www.reddit.com/r/ethereum/comments/nb41x8/energy_per_transaction/,1,27
nb42pu,1620866379,"""Digital and legacy banks have become too expensive to operate and they can't be saved without connecting to DeFi"" -Bank CEO (2 min)",,https://www.reddit.com/r/ethereum/comments/nb42pu/digital_and_legacy_banks_have_become_too/,1,0
nb44dg,1620866511,DONATE ETHERUEM https://blessingsforafrica.com,,https://www.reddit.com/r/ethereum/comments/nb44dg/donate_etheruem_httpsblessingsforafricacom/,1,0
nb4bcy,1620867082,Missed good dip 😏,[removed],https://www.reddit.com/r/ethereum/comments/nb4bcy/missed_good_dip/,1,0
nb4gzx,1620867536,"Affordable and secure cold storage for all! Please check out my new PWA (progressive web app), and let me know what you think! More details in post...",[removed],https://www.reddit.com/r/ethereum/comments/nb4gzx/affordable_and_secure_cold_storage_for_all_please/,1,0
nb4oqy,1620868179,"Binance to Nano S, withdraw confusion",I am trying to transfer my ETH on Binance to my Nano S. When I go to withdraw it asks me which network. Not even sure what this means lol.\n\nHalp\n\n[https://imgur.com/a/xYpLMLt](https://imgur.com/a/xYpLMLt),https://www.reddit.com/r/ethereum/comments/nb4oqy/binance_to_nano_s_withdraw_confusion/,1,10
nb4ptw,1620868255,ETH is one of the only high profile coins with almost zero negative news about it today.,[removed],https://www.reddit.com/r/ethereum/comments/nb4ptw/eth_is_one_of_the_only_high_profile_coins_with/,1,0
nb4th7,1620868555,"Tesla out of Bitcoin, is ETH carbon neutral in comparison?",Musk announced that Tesla was no longer accepting or selling Bitcoin because of carbon dependency in mining. \n\nIf ETH Presents a carbon neutral option it could be the next option for big business. What do you all think?,https://www.reddit.com/r/ethereum/comments/nb4th7/tesla_out_of_bitcoin_is_eth_carbon_neutral_in/,1,44
nb4w46,1620868763,"Serious prediction , i just joined reddit and i notice alot of posts about 7k or 10k by 2022, ETH will be 50k by the end of 2023 , mark this comment....im so confident in eth it will change the digital world",[removed],https://www.reddit.com/r/ethereum/comments/nb4w46/serious_prediction_i_just_joined_reddit_and_i/,1,0
nb4xie,1620868872,Accepting Memecoin Members With Open Arms,"I've seen a lot of vile, disgusting behavior towards those that are hurting because of the memecoin crash. I'd like to just remind the crypto community, well those of us that have been at it for a while, that we were in their shoes. Remember how people treated you when you were trying to explain crypto for the first time. Most of us were called fools that were buying into an obvious scam.\n\nSounds similar right. So no matter what you feel about these things, for a lot of new comers, this was very real to them. Most of the people I've spoken to were hoping to hold while looking at a 3-5 year horizon. Their hearts were in the right place and they were investing in communities that made them feel like they were wanted. \n\nContrast that to what I've been seeing today and ask yourself, would you want to learn more about ETH and crypto in general if you were being called a dumb degenerate gambler who's worthless? \n\nA lot of these people were just doing their best and making good faith investments to the best of their ability. And the stories I've seen - people had managed to find hope in this current world. They felt like they had some power. \n\nMaybe this is my big short moment, but realize that for some people, this meant a hell of a lot. And their looking for ways to make sure it can't happen again. So they're coming here and being mocked in their hour of panic instead of being educated and welcomed. \n\nIt's disgusting elitist behavior. Is that really what the crypto community is about? Is that really what this community is about. Maybe, let's just show them a better way instead of mocking their way yes?",https://www.reddit.com/r/ethereum/comments/nb4xie/accepting_memecoin_members_with_open_arms/,1,81
nb5193,1620869179,Should I Stake Eth on coinbase?,[removed],https://www.reddit.com/r/ethereum/comments/nb5193/should_i_stake_eth_on_coinbase/,1,0
nb51fh,1620869194,Opinionssss,[removed],https://www.reddit.com/r/ethereum/comments/nb51fh/opinionssss/,1,0
nb5ck3,1620870122,What is the utility if ETH if transactions are so costly?,[removed],https://www.reddit.com/r/ethereum/comments/nb5ck3/what_is_the_utility_if_eth_if_transactions_are_so/,1,0
nb5dnh,1620870220,Strange wallet gets daily .00001 ETH deposits and pays $100’s in gas fees every time,,https://www.reddit.com/r/ethereum/comments/nb5dnh/strange_wallet_gets_daily_00001_eth_deposits_and/,1,21
nb5eha,1620870291,When saw the fluctuation of ETH,[removed],https://www.reddit.com/r/ethereum/comments/nb5eha/when_saw_the_fluctuation_of_eth/,1,0
nb5g43,1620870437,BITCOIN CRASHES AS ELON MUSK ANNOUNCES THAT CRYPTOCURRENCY Can NO LONGER BE USED TO PURCHASE TESLA CARS,,https://www.reddit.com/r/ethereum/comments/nb5g43/bitcoin_crashes_as_elon_musk_announces_that/,1,0
nb5jnm,1620870740,Sometimes things get in another direction than you thought😂,,https://www.reddit.com/r/ethereum/comments/nb5jnm/sometimes_things_get_in_another_direction_than/,1,0
nb5n47,1620871050,Is Ethereum going to continue to rise at the rate it is now?,"I got into Dogecoin back when it was like 7 cents with a 2.4k investment (roughly in dollars, I'm british). It was a knee jerk thing and I had no idea what I was doing. Now, after learning slowly over the past month how the market works, I've decided I'm kind of tired of Doge's volatility. This might be salt on the missed opportunity to bail out before SNL and buy back in for profit (scum move, I think?) tbf. \n\nAnyway, I was looking at Eth, and I notice it's a steady increase except for a heavy dip earlier today, and of course the crash that just happened. I'm confident Doge will also start a steady climb in a week or so, but like I said, I'm tired of the volatility. \n\nCan anyone explain the state of Ethereum to me? Is it worth hopping and why? I'd prefer details on the pros of Eth rather than the cons of Doge, I'm well aware of Doge's faults.",https://www.reddit.com/r/ethereum/comments/nb5n47/is_ethereum_going_to_continue_to_rise_at_the_rate/,1,3
nb5ou0,1620871203,MEW Wallet Recommended?,[removed],https://www.reddit.com/r/ethereum/comments/nb5ou0/mew_wallet_recommended/,1,0
nb5rc4,1620871405,Can NVIDIA 4GB VRAM cards still mine ETH right now if I use Linux?,[removed],https://www.reddit.com/r/ethereum/comments/nb5rc4/can_nvidia_4gb_vram_cards_still_mine_eth_right/,1,0
nb5spp,1620871520,Fuck The System Token.!,[removed],https://www.reddit.com/r/ethereum/comments/nb5spp/fuck_the_system_token/,1,0
nb5uae,1620871658,NFT - Dreaming at Dusk: a generative art piece derived using the first onion service's private key,,https://www.reddit.com/r/ethereum/comments/nb5uae/nft_dreaming_at_dusk_a_generative_art_piece/,1,0
nb5wof,1620871854,Watching ETH dip like...,,https://www.reddit.com/r/ethereum/comments/nb5wof/watching_eth_dip_like/,1,0
nb6620,1620872608,Lets show Elon that he does not own Crypto market. Im Bitcoin We Trust,,https://www.reddit.com/r/ethereum/comments/nb6620/lets_show_elon_that_he_does_not_own_crypto_market/,1,0
nb6cui,1620873199,Grayscale's bitcoin and Ethereum funds now generate as much revenue as Vanguard's 82 ETFs,,https://www.reddit.com/r/ethereum/comments/nb6cui/grayscales_bitcoin_and_ethereum_funds_now/,1,0
nb6dm4,1620873272,Someone wanna let them know? Hehe,,https://www.reddit.com/r/ethereum/comments/nb6dm4/someone_wanna_let_them_know_hehe/,1,0
nb6fnn,1620873431,PAGE 17 - THE HEAD OF ARISTOTLE,,https://www.reddit.com/r/ethereum/comments/nb6fnn/page_17_the_head_of_aristotle/,1,3
nb6h14,1620873565,Btc for Ether... now...,[removed],https://www.reddit.com/r/ethereum/comments/nb6h14/btc_for_ether_now/,1,0
nb6jlk,1620873761,Tesla will be buying Ethereum 2.0. Proof of stake and stateless digital currency is the future of decentralized finance. ‼️⚠️,,https://www.reddit.com/r/ethereum/comments/nb6jlk/tesla_will_be_buying_ethereum_20_proof_of_stake/,1,1
nb6mlb,1620874045,Rarest Pepe — ‘most important NFT in art history’ — sells for 205 ETH,,https://www.reddit.com/r/ethereum/comments/nb6mlb/rarest_pepe_most_important_nft_in_art_history/,1,1
nb6nu4,1620874168,If you wanted a quick overview of what happened today.. LOL,,https://www.reddit.com/r/ethereum/comments/nb6nu4/if_you_wanted_a_quick_overview_of_what_happened/,1,9
