id,created_utc,title,selftext,full_link,score,comments
ndw6it,1621194191,"Crypto and Blockchain are taking the center stage on TikTok as mass adoption continues to grow. Kirobo did get a nice shoutout from @Deanthinke. Do not forget: For a limited time, you get rewarded with KIRO coin for using the undo button: https://eth.kirobo.me/",,https://www.reddit.com/r/ethereum/comments/ndw6it/crypto_and_blockchain_are_taking_the_center_stage/,1,0
ndwggm,1621194946,Why is ethereum dropping,[removed],https://www.reddit.com/r/ethereum/comments/ndwggm/why_is_ethereum_dropping/,1,0
ndwgn4,1621194960,Is there a cheaper way to convert eth to altcoins?,,https://www.reddit.com/r/ethereum/comments/ndwgn4/is_there_a_cheaper_way_to_convert_eth_to_altcoins/,1,0
ndwj90,1621195160,HOLD,[removed],https://www.reddit.com/r/ethereum/comments/ndwj90/hold/,1,0
ndwke3,1621195238,⟠ Latest Week in Ethereum News!,,https://www.reddit.com/r/ethereum/comments/ndwke3/latest_week_in_ethereum_news/,1,7
ndwnto,1621195502,Cheapest way to borrow stablecoin with eth as collateral,[removed],https://www.reddit.com/r/ethereum/comments/ndwnto/cheapest_way_to_borrow_stablecoin_with_eth_as/,1,0
ndwplp,1621195642,"i just bought 2 ethereum on friday @ 4k and im currently down 1,200 🤯 should i pull out and buy back when it bottoms out?? looks like its still tanking 🥴🥴🥴🥴🥴",[removed]\n\n[View Poll](https://www.reddit.com/poll/ndwplp),https://www.reddit.com/r/ethereum/comments/ndwplp/i_just_bought_2_ethereum_on_friday_4k_and_im/,1,0
ndwr95,1621195766,Noob question. What is the difference between ETH. vs ETH 2.0 and what happens if you hold ETH?,[removed],https://www.reddit.com/r/ethereum/comments/ndwr95/noob_question_what_is_the_difference_between_eth/,1,0
ndx0uj,1621196481,Should I buy ethereum?,[removed],https://www.reddit.com/r/ethereum/comments/ndx0uj/should_i_buy_ethereum/,1,0
ndx1ei,1621196525,will ethereum dip further this week?,[removed],https://www.reddit.com/r/ethereum/comments/ndx1ei/will_ethereum_dip_further_this_week/,1,1
ndx39t,1621196665,Bitcoin pokecard 1st Edition NFT Only 1 Ever Minted In The World!,[removed],https://www.reddit.com/r/ethereum/comments/ndx39t/bitcoin_pokecard_1st_edition_nft_only_1_ever/,1,0
ndx6wj,1621196952,How low does the dip need to dip for you to buy more?,[removed]\n\n[View Poll](https://www.reddit.com/poll/ndx6wj),https://www.reddit.com/r/ethereum/comments/ndx6wj/how_low_does_the_dip_need_to_dip_for_you_to_buy/,1,0
ndx77s,1621196975,Musk sells bitcoin,[removed],https://www.reddit.com/r/ethereum/comments/ndx77s/musk_sells_bitcoin/,1,0
ndx8gv,1621197074,help,[removed],https://www.reddit.com/r/ethereum/comments/ndx8gv/help/,1,0
ndx9ff,1621197150,Hi I need some help making sure im getting the correct hashrate.,[removed],https://www.reddit.com/r/ethereum/comments/ndx9ff/hi_i_need_some_help_making_sure_im_getting_the/,1,0
ndxa9q,1621197220,What happening?,[removed],https://www.reddit.com/r/ethereum/comments/ndxa9q/what_happening/,1,0
ndxaij,1621197240,Help!,[removed],https://www.reddit.com/r/ethereum/comments/ndxaij/help/,1,0
ndxank,1621197251,new to crypto,[removed],https://www.reddit.com/r/ethereum/comments/ndxank/new_to_crypto/,1,0
ndxat4,1621197265,Help me fill out a short survey about cryptocurrency investments,"Hey guys! I'm doing a short survey to collect some information about your experiences with investing in cryptocurrency as part of a research assignment.\n\nIf you do not mind filling out [this](https://forms.gle/CJstY3F2Vb8yWvQp7) short 5 minute survey, i would greatly appreciate it!\n\nThank you.",https://www.reddit.com/r/ethereum/comments/ndxat4/help_me_fill_out_a_short_survey_about/,1,1
ndxdjv,1621197482,does that mean my hasrate is 35 per second?,,https://www.reddit.com/r/ethereum/comments/ndxdjv/does_that_mean_my_hasrate_is_35_per_second/,1,0
ndxiw7,1621197897,Do Eth will go up again?,[removed],https://www.reddit.com/r/ethereum/comments/ndxiw7/do_eth_will_go_up_again/,1,0
ndxm1c,1621198146,MetaMask Scammed me?,[removed],https://www.reddit.com/r/ethereum/comments/ndxm1c/metamask_scammed_me/,1,0
ndxmk0,1621198187,buying eth on metamask,[removed],https://www.reddit.com/r/ethereum/comments/ndxmk0/buying_eth_on_metamask/,1,0
ndxmqp,1621198202,Gary Vaynerchuck HODL ETH,,https://www.reddit.com/r/ethereum/comments/ndxmqp/gary_vaynerchuck_hodl_eth/,1,1
ndxq52,1621198470,Should we start to worry?,Me right now after losing 2k in one day after I bought in at 3.8k https://youtu.be/l23_-1v__Fg,https://www.reddit.com/r/ethereum/comments/ndxq52/should_we_start_to_worry/,1,54
ndxsb2,1621198637,Just want to remaind Elon Musk will buy ETH and announce on Twitter.,,https://www.reddit.com/r/ethereum/comments/ndxsb2/just_want_to_remaind_elon_musk_will_buy_eth_and/,1,0
ndxsy4,1621198688,"Hey guys, Just curious why is ETH taking the most beating? Is it just that we gave had one of the steepest rides up in past few weeks?",[removed],https://www.reddit.com/r/ethereum/comments/ndxsy4/hey_guys_just_curious_why_is_eth_taking_the_most/,1,0
ndxvcb,1621198874,"Is Solana a copy of Ethereum or ETH unique, even today?",[removed],https://www.reddit.com/r/ethereum/comments/ndxvcb/is_solana_a_copy_of_ethereum_or_eth_unique_even/,1,0
ndxvpy,1621198901,"Need help! I stupidly tried to send Binance-peg ethereum from trust wallet to my ethereum wallet on my Coinbase account(not my Coinbase wallet). It sent, but my Coinbase account never received it. How do I get it back?",,https://www.reddit.com/r/ethereum/comments/ndxvpy/need_help_i_stupidly_tried_to_send_binancepeg/,1,9
ndxwkg,1621198965,stake or hodl ETH on coinbase?,"I just got an email saying I am approved to stake the ETH I'm hodling on Coinbase.  Benefit - I get 6%.  Drawback - they control my ETH until ETH 2.0 rolls out.  Is that a big drawback for a casual investor like me?  Am I somehow risking all my ETH by doing this?\n\nI am not a day trader and am not planning on doing anything other than hodl my ETH for years...if I lose it then so be it, if it moons then great.  I am also not computer savvy and don't know enough nor have the equipment/software to stake it on my own.  I also don't know enough to trust other exchanges.  I am a casual investor with no tech experience.  So either I am going to continue to hold my ETH in Coinbase, or I am going to stake it.  Should I stake, or is there a risk Coinbase might lose my ETH?",https://www.reddit.com/r/ethereum/comments/ndxwkg/stake_or_hodl_eth_on_coinbase/,1,139
ndxxhu,1621199037,"bitcoin has gone up. $ 1,000,000",,https://www.reddit.com/r/ethereum/comments/ndxxhu/bitcoin_has_gone_up_1000000/,1,1
ndxxwo,1621199066,"No matter how much you love ether (and I sure do), you must admit this:",[removed],https://www.reddit.com/r/ethereum/comments/ndxxwo/no_matter_how_much_you_love_ether_and_i_sure_do/,1,1
ndxycr,1621199103,Gary Vaynerchuck holding ETH,[removed],https://www.reddit.com/r/ethereum/comments/ndxycr/gary_vaynerchuck_holding_eth/,1,0
ndxyhx,1621199113,New to this ETH and I’m freaking out with the crypto dropping! I will take any help I can get! Hold or sell?,,https://www.reddit.com/r/ethereum/comments/ndxyhx/new_to_this_eth_and_im_freaking_out_with_the/,1,1
ndxyiz,1621199116,What is happening? Why including Eth all Crypto going Down? Some special event?,[removed],https://www.reddit.com/r/ethereum/comments/ndxyiz/what_is_happening_why_including_eth_all_crypto/,1,0
ndxyz4,1621199153,Gary Vaynerchuck holding ETH,,https://www.reddit.com/r/ethereum/comments/ndxyz4/gary_vaynerchuck_holding_eth/,1,1
ndy2e3,1621199416,China and ETH,[removed],https://www.reddit.com/r/ethereum/comments/ndy2e3/china_and_eth/,1,0
ndy8jw,1621199902,ETH 2.0 - percent % energy reduction,[removed],https://www.reddit.com/r/ethereum/comments/ndy8jw/eth_20_percent_energy_reduction/,1,0
ndy9pe,1621199996,Won’t ETH be more environmentally friendly when it fully transitions to PoS?,[removed],https://www.reddit.com/r/ethereum/comments/ndy9pe/wont_eth_be_more_environmentally_friendly_when_it/,1,0
ndya1n,1621200022,Even Kevin understands the advantage of POS over POW.,,https://www.reddit.com/r/ethereum/comments/ndya1n/even_kevin_understands_the_advantage_of_pos_over/,1,0
ndyaew,1621200049,ETH 2.0 - Energy Reduction,[removed],https://www.reddit.com/r/ethereum/comments/ndyaew/eth_20_energy_reduction/,1,0
ndyf6d,1621200429,"When #ethereum 2.0 goes live soon, is going to be same as bank, because is breaking rules of blockchain. The reason why #bitcoin was created is to be decentralized, #bitcoin and #ethereumclassic have same purpose being decentralized always. #ETC #BTC coins of People.",,https://www.reddit.com/r/ethereum/comments/ndyf6d/when_ethereum_20_goes_live_soon_is_going_to_be/,1,14
ndyofx,1621201155,Wrapped Bitcoincash Airdrop Sign Up,,https://www.reddit.com/r/ethereum/comments/ndyofx/wrapped_bitcoincash_airdrop_sign_up/,1,0
ndypm7,1621201247,Buy “ethereum” on Crypto.com,[removed],https://www.reddit.com/r/ethereum/comments/ndypm7/buy_ethereum_on_cryptocom/,1,0
ndyqgc,1621201309,Are fees Contra-productive? (E-ID),Why would governments use the Ethereum blockchain for digital ID’s? Wouldn’t the transaction fees be way to high?,https://www.reddit.com/r/ethereum/comments/ndyqgc/are_fees_contraproductive_eid/,1,3
ndyy0i,1621201923,ETH is showing it’s independency over BTC,[removed],https://www.reddit.com/r/ethereum/comments/ndyy0i/eth_is_showing_its_independency_over_btc/,1,0
ndyz8n,1621202019,If the entire interent went down what would happen?,[removed],https://www.reddit.com/r/ethereum/comments/ndyz8n/if_the_entire_interent_went_down_what_would_happen/,1,0
ndz133,1621202158,Facebook crypto groups are not out for your best interest. If I were a whale/bear. I would just hangout on those forums due to restricting valuable trading information for responsible money management. It’s all a hype train to pull rugs.,,https://www.reddit.com/r/ethereum/comments/ndz133/facebook_crypto_groups_are_not_out_for_your_best/,1,0
ndz1gv,1621202189,Do you guys trust Vitalik and his vision for Ethereum?,[removed],https://www.reddit.com/r/ethereum/comments/ndz1gv/do_you_guys_trust_vitalik_and_his_vision_for/,1,0
ndzhjy,1621203465,Question about sending ETH,[removed],https://www.reddit.com/r/ethereum/comments/ndzhjy/question_about_sending_eth/,1,0
