id,created_utc,title,selftext,full_link,score,comments
hp95o4,1594470382,Earn A Great Living Online No Investment,[removed],https://www.reddit.com/r/ethereum/comments/hp95o4/earn_a_great_living_online_no_investment/,1,1
hp9crl,1594471347,Can WBTC be blacklisted as USDC and Tether USDT?,[removed],https://www.reddit.com/r/ethereum/comments/hp9crl/can_wbtc_be_blacklisted_as_usdc_and_tether_usdt/,1,0
hp9fl5,1594471726,Buying More ETH with Ethereum tokens - A How-to Guide,,https://www.reddit.com/r/ethereum/comments/hp9fl5/buying_more_eth_with_ethereum_tokens_a_howto_guide/,1,0
hp9u40,1594473498,Request Network. One of the first Ethereum DAPP is really getting traction. Its like the Paypal of Blockchain.,,https://www.reddit.com/r/ethereum/comments/hp9u40/request_network_one_of_the_first_ethereum_dapp_is/,1,10
hpa066,1594474225,"Justin Drake on Twitter: ""The community wants phase 0 genesis in 2020—not one day late. The goal is set; let's ship.""",,https://www.reddit.com/r/ethereum/comments/hpa066/justin_drake_on_twitter_the_community_wants_phase/,1,105
hpaa8n,1594475397,Syncchains vs. Sidechains: What is the Difference?,,https://www.reddit.com/r/ethereum/comments/hpaa8n/syncchains_vs_sidechains_what_is_the_difference/,1,0
hpac9r,1594475619,"Transactions Not Being Processed via Metamask using Chrome - Etherscan Error: Sorry, We are unable to locate this TxnHash",[removed],https://www.reddit.com/r/ethereum/comments/hpac9r/transactions_not_being_processed_via_metamask/,1,0
hpb19m,1594478312,A look inside the sale of the Ethereum premine (Coindesk),,https://www.reddit.com/r/ethereum/comments/hpb19m/a_look_inside_the_sale_of_the_ethereum_premine/,1,0
hpbrih,1594481008,Anyone interested in some ETH Swiss Keys? Details in comments.,,https://www.reddit.com/r/ethereum/comments/hpbrih/anyone_interested_in_some_eth_swiss_keys_details/,1,26
hpcsbz,1594484589,Discover How To Earn ETHEREUM Daily,[removed],https://www.reddit.com/r/ethereum/comments/hpcsbz/discover_how_to_earn_ethereum_daily/,1,0
hpd1w6,1594485479,All Core Devs Meeting 91 Notes,,https://www.reddit.com/r/ethereum/comments/hpd1w6/all_core_devs_meeting_91_notes/,1,1
hpd47c,1594485696,Decentralized Finance (DeFi) — Democratizing Financial Services to the Masses,,https://www.reddit.com/r/ethereum/comments/hpd47c/decentralized_finance_defi_democratizing/,1,0
hpdq6b,1594487773,district0x - The District Weekly — July 11th,,https://www.reddit.com/r/ethereum/comments/hpdq6b/district0x_the_district_weekly_july_11th/,1,0
hpe53o,1594489156,"Crypto Stamp transfer error message? ""The transaction was not sent because it would always fail. Please check all prerequisites""",[removed],https://www.reddit.com/r/ethereum/comments/hpe53o/crypto_stamp_transfer_error_message_the/,1,0
hpfwex,1594495213,Scalability and Productivity for DApp Developers’ With Cartesi,,https://www.reddit.com/r/ethereum/comments/hpfwex/scalability_and_productivity_for_dapp_developers/,1,0
hpfx96,1594495290,I'm testing a machine learning portfolio strategy,[removed],https://www.reddit.com/r/ethereum/comments/hpfx96/im_testing_a_machine_learning_portfolio_strategy/,1,0
hpg0m4,1594495605,ETHEREUM SCAM BE WARNED,[removed],https://www.reddit.com/r/ethereum/comments/hpg0m4/ethereum_scam_be_warned/,1,2
hpga68,1594496531,Chainlink's SmartCon #0 announced - 28-29 August,,https://www.reddit.com/r/ethereum/comments/hpga68/chainlinks_smartcon_0_announced_2829_august/,1,2
hpga6v,1594496532,"Audius music streaming platform built on Ethereum added support for their Handshake TLD, and now every artist on their decentralized service gets their own website",,https://www.reddit.com/r/ethereum/comments/hpga6v/audius_music_streaming_platform_built_on_ethereum/,1,1
hpgf3k,1594497011,"renBTC-USDT Liquidity Mining on Loopring Exchange. Add liquidity to Ethereum's zkRollup DEX, earn renBTC.",,https://www.reddit.com/r/ethereum/comments/hpgf3k/renbtcusdt_liquidity_mining_on_loopring_exchange/,1,1
hpgnwy,1594497854,Ethereum benefits from marlin phase 0 scaling solution and over 410k active addresses!,,https://www.reddit.com/r/ethereum/comments/hpgnwy/ethereum_benefits_from_marlin_phase_0_scaling/,1,0
hph904,1594499839,"Hello! I'm a Computer Science major conducting research on the exchange, and acceptance, of crypto for national currencies (such as USD or EURO) in communities dominated by small-businesses. If you have a minute to spare, please answer a few questions posed by my group and I! Thank you :)",,https://www.reddit.com/r/ethereum/comments/hph904/hello_im_a_computer_science_major_conducting/,1,0
hphyf0,1594502301,Will Ethereum 2.0 Phase 0 launch before 2021? (Total volume &gt;$70k),,https://www.reddit.com/r/ethereum/comments/hphyf0/will_ethereum_20_phase_0_launch_before_2021_total/,1,9
hpi25m,1594502659,Feedback is needed for a new proposed Contract Ownership Governance Standard,,https://www.reddit.com/r/ethereum/comments/hpi25m/feedback_is_needed_for_a_new_proposed_contract/,1,1
hpi9de,1594503356,CryptoTrader.Tax | Crypto Taxes Done In Minutes,,https://www.reddit.com/r/ethereum/comments/hpi9de/cryptotradertax_crypto_taxes_done_in_minutes/,1,0
hpidbr,1594503739,Facts,,https://www.reddit.com/r/ethereum/comments/hpidbr/facts/,1,2
hpiktc,1594504490,Seed Phrase Storage finally made simple with the Stonebook.,,https://www.reddit.com/r/ethereum/comments/hpiktc/seed_phrase_storage_finally_made_simple_with_the/,1,2
hpimik,1594504664,Eth 2 devs are showing commitment to a 2020 launch by putting money on it,,https://www.reddit.com/r/ethereum/comments/hpimik/eth_2_devs_are_showing_commitment_to_a_2020/,1,17
hpkur0,1594512827,Unpopular opinion: ETH 2 can launch in 2022,[removed],https://www.reddit.com/r/ethereum/comments/hpkur0/unpopular_opinion_eth_2_can_launch_in_2022/,1,18
hpldoe,1594514880,You Wouldn't Believe How Bad THIS Crypto News Website Has Become,,https://www.reddit.com/r/ethereum/comments/hpldoe/you_wouldnt_believe_how_bad_this_crypto_news/,1,0
hpm91u,1594518507,I think can overtake Bitcoin once second layer solutions are adopted by DeFi protocols and other Dapps,,https://www.reddit.com/r/ethereum/comments/hpm91u/i_think_can_overtake_bitcoin_once_second_layer/,1,0
hpn2wb,1594522005,How to Buy Ethereum $ETH using Guarda Wallet?,,https://www.reddit.com/r/ethereum/comments/hpn2wb/how_to_buy_ethereum_eth_using_guarda_wallet/,1,0
hpnxp2,1594525897,Why is a total scam being run on Youtube ads? What can we do about this?,,https://www.reddit.com/r/ethereum/comments/hpnxp2/why_is_a_total_scam_being_run_on_youtube_ads_what/,1,80
hpo17u,1594526355,YouTube ad,,https://www.reddit.com/r/ethereum/comments/hpo17u/youtube_ad/,1,4
hppvg1,1594535694,Matic Network Review - Blockfyre Research Report,[removed],https://www.reddit.com/r/ethereum/comments/hppvg1/matic_network_review_blockfyre_research_report/,1,0
hpqc4y,1594538360,Common Phishing Attacks in the Crypto World - Crypto Press,,https://www.reddit.com/r/ethereum/comments/hpqc4y/common_phishing_attacks_in_the_crypto_world/,1,0
hpr3cj,1594542728,Coinbase IPO – What it means for DeFi &amp; Crypto. Major adoption is just around the corner.,,https://www.reddit.com/r/ethereum/comments/hpr3cj/coinbase_ipo_what_it_means_for_defi_crypto_major/,1,0
hprr01,1594546548,"This Week's Top Bitcoin, Ethereum, DeFi &amp; Global Financial News",,https://www.reddit.com/r/ethereum/comments/hprr01/this_weeks_top_bitcoin_ethereum_defi_global/,1,1
hps241,1594548336,Smart Contracts Are Contracts. Here's Why.,,https://www.reddit.com/r/ethereum/comments/hps241/smart_contracts_are_contracts_heres_why/,1,0
hps6rf,1594549069,Ethereum users now face ‘unreasonably’ high transaction fee,,https://www.reddit.com/r/ethereum/comments/hps6rf/ethereum_users_now_face_unreasonably_high/,1,0
hps886,1594549317,Terminal.insure: train delay protection onchain,[removed],https://www.reddit.com/r/ethereum/comments/hps886/terminalinsure_train_delay_protection_onchain/,1,0
hps9ag,1594549493,Terminal.insure: train delay protection onchain,[removed],https://www.reddit.com/r/ethereum/comments/hps9ag/terminalinsure_train_delay_protection_onchain/,1,0
hpsa92,1594549642,No-Code Blockchain Integration: The Future of Business-to-Blockchain?,,https://www.reddit.com/r/ethereum/comments/hpsa92/nocode_blockchain_integration_the_future_of/,1,0
hpskji,1594551198,Smart Contracts Are Contracts. Here's Why.,,https://www.reddit.com/r/ethereum/comments/hpskji/smart_contracts_are_contracts_heres_why/,1,0
hpsu8g,1594552652,Worlds First Ethereum transaction inside Virtual Reality Metaverse!,,https://www.reddit.com/r/ethereum/comments/hpsu8g/worlds_first_ethereum_transaction_inside_virtual/,1,1
hpt68d,1594554516,Opinion: Smart Contracts Are Contracts.,,https://www.reddit.com/r/ethereum/comments/hpt68d/opinion_smart_contracts_are_contracts/,1,3
hptjxw,1594556503,joyaux 3rd And Final Round 150$ Token Don't Miss Clear Opportunity 100% Legit Get Hurry Coinsbit Exchange,,https://www.reddit.com/r/ethereum/comments/hptjxw/joyaux_3rd_and_final_round_150_token_dont_miss/,1,0
hptqah,1594557393,"Simpler Ethereum sync: Major/minor state snapshots, blockchain files, receipt files -- Eth1.x Research",,https://www.reddit.com/r/ethereum/comments/hptqah/simpler_ethereum_sync_majorminor_state_snapshots/,1,0
hpts12,1594557624,Guide: How to stake on ETH 2.0 Altona Testnet with Lighthouse on Ubuntu,,https://www.reddit.com/r/ethereum/comments/hpts12/guide_how_to_stake_on_eth_20_altona_testnet_with/,1,0
hpttat,1594557805,Future Eth staking profit vs blockfi interest,[removed],https://www.reddit.com/r/ethereum/comments/hpttat/future_eth_staking_profit_vs_blockfi_interest/,1,0
