id,created_utc,title,selftext,full_link,score,comments
ne4kf2,1621218989,"If I got paid in Ethereum, and bought my goods in Ethereum, how hard would it be to hide from the tax man in a western country?",[removed],https://www.reddit.com/r/ethereum/comments/ne4kf2/if_i_got_paid_in_ethereum_and_bought_my_goods_in/,1,0
ne4tdp,1621219797,Anyone else buying the dip?,"Folks, what are you doing right now? Buying? Selling?",https://www.reddit.com/r/ethereum/comments/ne4tdp/anyone_else_buying_the_dip/,1,297
ne4w65,1621220041,only getting invalid or stale shares,[removed],https://www.reddit.com/r/ethereum/comments/ne4w65/only_getting_invalid_or_stale_shares/,1,0
ne4wmd,1621220081,Should I stake or should I go now?,[removed],https://www.reddit.com/r/ethereum/comments/ne4wmd/should_i_stake_or_should_i_go_now/,1,0
ne4zi6,1621220341,"Trying to stop drinking, putting money into crypto instead",(Originally posted in r/CC but they removed it because I wasn’t good enough for them. I buy mostly Ethereum so figured this was just as fitting here!) \n\n\nWell title really says it all but I’ve been trying my best to stop drinking (one month in as of this post) and have been putting the money that I would normally spend on my regular bottle of liquor into my crypto wallet. \n\nDon’t have a ton invested yet but I like feeling like my money isn’t being trashed and actually investing towards the future. It’s also quite frightening seeing how much I had been spending weekly on alcohol - really puts it in perspective for me. \n\nLook forward to talking with you all and thanks for all of the great info that’s kept me informed up to this point. You’re helping more than you know✌🏻,https://www.reddit.com/r/ethereum/comments/ne4zi6/trying_to_stop_drinking_putting_money_into_crypto/,1,54
ne5bpm,1621221384,Thoughts on Cordano (ADA) ?,"I'm kinda new to this cryptocurrency thing...\n\nShould I go balls deep in ETH ? It's 10% down...\n\nOr should I invest in ADA, shit is going crazy...\n\nI have 11KUSD\n\nThanks",https://www.reddit.com/r/ethereum/comments/ne5bpm/thoughts_on_cordano_ada/,1,49
ne5d38,1621221500,Buying eth anonymously,[removed],https://www.reddit.com/r/ethereum/comments/ne5d38/buying_eth_anonymously/,1,0
ne5fx3,1621221740,When will Ethereum stop dipping?,Is the current dip happening because of Elon musk’s tweets? I have 8k to invest but the price keeps dipping. When will the dip stop? Any predictions?,https://www.reddit.com/r/ethereum/comments/ne5fx3/when_will_ethereum_stop_dipping/,1,68
ne5ikb,1621221982,Why ETH Will Win as Store of Value,,https://www.reddit.com/r/ethereum/comments/ne5ikb/why_eth_will_win_as_store_of_value/,1,0
ne5lb1,1621222232,Beware of the ETH giveaway scam on YouTube,[removed],https://www.reddit.com/r/ethereum/comments/ne5lb1/beware_of_the_eth_giveaway_scam_on_youtube/,1,14
ne5og9,1621222510,Stop romanticizing Elon Musk.,[removed],https://www.reddit.com/r/ethereum/comments/ne5og9/stop_romanticizing_elon_musk/,1,0
ne5tny,1621222983,Is ethereum dipping because Vitalik Buterin cashed out on his ethereum holdings ?,[removed],https://www.reddit.com/r/ethereum/comments/ne5tny/is_ethereum_dipping_because_vitalik_buterin/,1,1
ne5tyb,1621223010,This dip is driving me nuts!!,Because I bought so much during this dip that I ran out of money but I want to keep buying more!!,https://www.reddit.com/r/ethereum/comments/ne5tyb/this_dip_is_driving_me_nuts/,1,30
ne5uv8,1621223093,why eth falling?,[removed],https://www.reddit.com/r/ethereum/comments/ne5uv8/why_eth_falling/,1,0
ne5x3m,1621223296,"Oh no, my FUD is out of control!",Is ethereum broken? Did it ever work in the first place? Does anyone here know how to use esthereum? Is it actually more useful in comparison to other data transfer protocols? Why? Why not just use the internet?,https://www.reddit.com/r/ethereum/comments/ne5x3m/oh_no_my_fud_is_out_of_control/,1,8
ne5y8h,1621223396,Soon in the near future we will no longer use Dollars. We will only use Gweis and Sats.,,https://www.reddit.com/r/ethereum/comments/ne5y8h/soon_in_the_near_future_we_will_no_longer_use/,1,207
ne60ba,1621223581,Deep fake giveaway scam? (cross post),,https://www.reddit.com/r/ethereum/comments/ne60ba/deep_fake_giveaway_scam_cross_post/,1,0
ne62p8,1621223804,Can someone tell this crack addict Elon to gtt off twitter,This guy likes taking people's life as a joke.\n\nHope he gets bowel cancer,https://www.reddit.com/r/ethereum/comments/ne62p8/can_someone_tell_this_crack_addict_elon_to_gtt/,1,31
ne62pd,1621223804,Seeing this dip makes me so happy. Please let me buy all the dip,[removed],https://www.reddit.com/r/ethereum/comments/ne62pd/seeing_this_dip_makes_me_so_happy_please_let_me/,1,0
ne63af,1621223859,Man i love ethereum! Hodl everyone! This will be a wild ride. Not a good day for crypto but u cant have 365 good days a year. Hodl everyone…. Hodl.,,https://www.reddit.com/r/ethereum/comments/ne63af/man_i_love_ethereum_hodl_everyone_this_will_be_a/,1,0
ne69i2,1621224407,What’s your call on the bottom before ethereum bounces?,[removed],https://www.reddit.com/r/ethereum/comments/ne69i2/whats_your_call_on_the_bottom_before_ethereum/,1,0
ne6e2v,1621224827,Can someone give me hope?,"Everyone losing money , when will this end? Oh bear sweet bear please go away. Does anyone have a any idea about it. I need to hear good things about it.",https://www.reddit.com/r/ethereum/comments/ne6e2v/can_someone_give_me_hope/,1,0
ne6eyj,1621224907,I’M SO DEPRESSED,"Will Ethereum gonna keeps going down? I’m getting depressed and upset, I already lost 1k ☹️😢",https://www.reddit.com/r/ethereum/comments/ne6eyj/im_so_depressed/,1,40
ne6ffi,1621224955,"Can someone give me hope? Everyone losing money , when will this end? Oh bear sweet bear please go away. Does anyone have a any idea about it. I need to hear good things about it.",,https://www.reddit.com/r/ethereum/comments/ne6ffi/can_someone_give_me_hope_everyone_losing_money/,1,0
ne6hmc,1621225165,The true….,The problem is people follow Elon musk like he is the new Jesus which is just stupid. He has Manipulated the crypto market and stock market for years with zero repercussions. Him and his cult followers should just take a spaceship to Mars and F-off,https://www.reddit.com/r/ethereum/comments/ne6hmc/the_true/,1,0
ne6i16,1621225203,"Just wondering, bitcoin went down after elon musk tweets, why did ethereum go down too?",,https://www.reddit.com/r/ethereum/comments/ne6i16/just_wondering_bitcoin_went_down_after_elon_musk/,1,12
ne6i5j,1621225212,The truth,The problem is people follow Elon musk like he is the new Jesus which is just stupid. He has Manipulated the crypto market and stock market for years with zero repercussions. Him and his cult followers should just take a spaceship to Mars and F-off,https://www.reddit.com/r/ethereum/comments/ne6i5j/the_truth/,1,11
ne6i6b,1621225214,Where is blockchain data stored in proof of stake?,"Hi everyone, newbie question. I know that for proof of stake, the data is stored in nodes across the network. With proof of stake, staking money is all that is required, and not computational power (correct me if I am wrong), so where is blockchain data stored in proof of stake?   \nThanks for the help everyone!",https://www.reddit.com/r/ethereum/comments/ne6i6b/where_is_blockchain_data_stored_in_proof_of_stake/,1,2
ne6lmo,1621225533,"I was getting worried ETH wouldn't be cheap to buy again, but it's on discount again you guys!!! :))",,https://www.reddit.com/r/ethereum/comments/ne6lmo/i_was_getting_worried_eth_wouldnt_be_cheap_to_buy/,1,10
ne6ny2,1621225760,Umm,,https://www.reddit.com/r/ethereum/comments/ne6ny2/umm/,1,8
ne6s2f,1621226139,Crypto investing is an amazing spiritual practice,[removed],https://www.reddit.com/r/ethereum/comments/ne6s2f/crypto_investing_is_an_amazing_spiritual_practice/,1,0
ne6sde,1621226170,"Very interesting, He is not wrong... this video is 3 weeks old..",,https://www.reddit.com/r/ethereum/comments/ne6sde/very_interesting_he_is_not_wrong_this_video_is_3/,1,0
ne6w28,1621226522,Eth independence,"For the last few weeks it seemed as though ethereum was finally growing independently from Bitcoin. The more that i think about it, this  correction makes sense with BTC in decline. Im sure a lot of people have made some money the last few weeks and are collecting profit. Just thinking aloud im sure this correction will lead upwards again after the fud is over.",https://www.reddit.com/r/ethereum/comments/ne6w28/eth_independence/,1,4
ne6xx2,1621226704,Water lilies – ultra rare 5/5,[removed],https://www.reddit.com/r/ethereum/comments/ne6xx2/water_lilies_ultra_rare_55/,1,0
ne6y84,1621226734,Noob question. Does ETH actually live up to the fundamental definition of a decentralized currency? I love ETH and its tech but i feel skeptical of its defi claims. I hope i can be reassured that it is but more importantly i seek the honest truth. Whats your opinion? Got any links for me?,"Been thinking a lot about the upcoming ETH burning I've heard about and EIP 1559. If there is some sort of institution or group of developers that have the ability to change or alter the ETH economy by limiting the amount of available ETH, doesn't that give off a sort of ""centralized""/governed feeling to ETH?",https://www.reddit.com/r/ethereum/comments/ne6y84/noob_question_does_eth_actually_live_up_to_the/,1,44
ne6yt4,1621226795,If you don’t buy this dip..,[removed],https://www.reddit.com/r/ethereum/comments/ne6yt4/if_you_dont_buy_this_dip/,1,0
ne6yzh,1621226813,The stupidest thing you can do,[removed],https://www.reddit.com/r/ethereum/comments/ne6yzh/the_stupidest_thing_you_can_do/,1,1
ne74oa,1621227353,"I try to sell NMR to ETH, but Uniswap and 1inch ask me to sign a transaction for 0 ETH",[removed],https://www.reddit.com/r/ethereum/comments/ne74oa/i_try_to_sell_nmr_to_eth_but_uniswap_and_1inch/,1,0
ne77nq,1621227636,Question around Regulating Algorithms on the Blockchain,"I've been thinking about challenges to adoption, particularly at the government level, and feel that any technology that could reduce frictions around transmitting child porn, or enabling human trafficking, is going to be a tough sell for government acceptance and adoption.\n\nI believe smart contracts are all open source, correct?  And transactions are open as well; if so, could governments effectively regulate the blockchain by regulating the algorithms individuals can use for transactions?",https://www.reddit.com/r/ethereum/comments/ne77nq/question_around_regulating_algorithms_on_the/,1,0
ne7a84,1621227881,What is The Eth community take on NFTs,"Hi all,\n\nI run a local Bitcoin meetup and lately a lot of people are interested in NFTs.\n\nI am sceptical of them because as  I see it, you are not really buying artwork. You are just buying a token with a link to a centralised server hosting an artwork. \n\nOwning the token does not give you any special rights.\n\nThis is a fun and good analogy.\n\nhttps://preview.redd.it/oed83nv25mz61.jpg?width=586&amp;format=pjpg&amp;auto=webp&amp;s=f6b34872c6188f4ef220ccdf32a5ce423faa8fac\n\nI posted this question on the Bitcoin reddit and got a good explanation of NFTs and why they are worthless and of no long term value.\n\nhere is the thread [https://www.reddit.com/r/Bitcoin/comments/n8wnts/nfts\_from\_a\_bitcoiners\_perspective/](https://www.reddit.com/r/Bitcoin/comments/n8wnts/nfts_from_a_bitcoiners_perspective/)  \n\n\nI thought I would post this here to see if there is any rebuttal to the above.  \n\nam I missing something?\n\nCan you make a good case for NFTs and why they will work?",https://www.reddit.com/r/ethereum/comments/ne7a84/what_is_the_eth_community_take_on_nfts/,1,10
ne7cpg,1621228132,When we gonna see this go back up?,,https://www.reddit.com/r/ethereum/comments/ne7cpg/when_we_gonna_see_this_go_back_up/,1,8
ne7ii9,1621228693,Who else bought at the dip?,[removed],https://www.reddit.com/r/ethereum/comments/ne7ii9/who_else_bought_at_the_dip/,1,1
ne7lcx,1621228971,“Bitcoin Karen” A.K.A. Elon Musk. Let’s get this out there to make it stick.,,https://www.reddit.com/r/ethereum/comments/ne7lcx/bitcoin_karen_aka_elon_musk_lets_get_this_out/,1,8
ne7ni5,1621229183,Full move to DeFi,[removed],https://www.reddit.com/r/ethereum/comments/ne7ni5/full_move_to_defi/,1,0
ne7nzl,1621229232,"DeFi maturity for the ""Average Joe""",[removed],https://www.reddit.com/r/ethereum/comments/ne7nzl/defi_maturity_for_the_average_joe/,1,0
ne7ojn,1621229287,DeFi,[removed],https://www.reddit.com/r/ethereum/comments/ne7ojn/defi/,1,0
ne7opx,1621229305,Is this legit? If I send eth I will get double?,,https://www.reddit.com/r/ethereum/comments/ne7opx/is_this_legit_if_i_send_eth_i_will_get_double/,1,1
ne7tyn,1621229831,Trump got Twitter banned for worse,"So when trump posted tweets, his tweets would get highlighted and flagged as being ""disputed"". He subsequently got banned. \n\nSo why is this manipulating sack of shit crack addict allowed to tweet freely with no facts, destroying peoples lives, investments or otherwise?",https://www.reddit.com/r/ethereum/comments/ne7tyn/trump_got_twitter_banned_for_worse/,1,24
ne85io,1621231000,Ethereum use cases: NFTs - likely the least of the use cases for eth.,"Tokenized stocks, derivatives, bonds - the market size for these are much much larger.",https://www.reddit.com/r/ethereum/comments/ne85io/ethereum_use_cases_nfts_likely_the_least_of_the/,1,3
ne86kw,1621231111,"Keep price discussion and market talk, memes &amp; exchanges to subreddits such as /r/ethfinance/ or /r/ethtrader",[removed],https://www.reddit.com/r/ethereum/comments/ne86kw/keep_price_discussion_and_market_talk_memes/,1,0
