id,created_utc,title,selftext,full_link,score,comments
ng9wju,1621440667,"This clown announced he went long AFTER a $700 rally , only a few peeps before that",After the fact queen of twitter \n\n*Processing img lqj9vq21q3071...*,https://www.reddit.com/r/ethereum/comments/ng9wju/this_clown_announced_he_went_long_after_a_700/,1,2
ng9yjc,1621440796,HODL or sell?,[removed],https://www.reddit.com/r/ethereum/comments/ng9yjc/hodl_or_sell/,1,0
nga23y,1621441036,What are these “faucet” requests on Twitter?,I keep seeing these “faucet” requests on twitter with a crypto address. Is that just someone begging for coins or am I missing something?,https://www.reddit.com/r/ethereum/comments/nga23y/what_are_these_faucet_requests_on_twitter/,1,2
nga3eb,1621441123,"If you keep asking the eternal question ""Is ethereum a good investment?"", then this article is for you:",,https://www.reddit.com/r/ethereum/comments/nga3eb/if_you_keep_asking_the_eternal_question_is/,1,0
ngab25,1621441640,I made an NFT,"&amp;#x200B;\n\n*Processing video sc1d5zdyq3071...*\n\nThat said, I did buy  @ 1800GBP(ish)\n\nGee, i'd sure appreciate if someone would check me out on OpenSea:\n\n[https://opensea.io/accounts/DIRKOFANTHER](https://opensea.io/accounts/DIRKOFANTHER)",https://www.reddit.com/r/ethereum/comments/ngab25/i_made_an_nft/,1,0
ngaj04,1621442184,How do I participate in the Ethereum Network on my own?,[removed],https://www.reddit.com/r/ethereum/comments/ngaj04/how_do_i_participate_in_the_ethereum_network_on/,1,6
ngansz,1621442513,Ethereum fees today!,,https://www.reddit.com/r/ethereum/comments/ngansz/ethereum_fees_today/,1,10
ngaogx,1621442557,Scaling Sorare on Ethereum with StarkWare,[removed],https://www.reddit.com/r/ethereum/comments/ngaogx/scaling_sorare_on_ethereum_with_starkware/,1,0
ngax4n,1621443155,FOMO IS REAL!!!!!!!,,https://www.reddit.com/r/ethereum/comments/ngax4n/fomo_is_real/,1,2
ngax8k,1621443161,Whoever’s doing hashtags like that deserves to be bought out,,https://www.reddit.com/r/ethereum/comments/ngax8k/whoevers_doing_hashtags_like_that_deserves_to_be/,1,0
ngazrp,1621443339,Pumpp in telegram!,[removed],https://www.reddit.com/r/ethereum/comments/ngazrp/pumpp_in_telegram/,1,0
ngb137,1621443439,If only it were this easy...,,https://www.reddit.com/r/ethereum/comments/ngb137/if_only_it_were_this_easy/,1,112
ngb4eb,1621443649,Limit buying,[removed],https://www.reddit.com/r/ethereum/comments/ngb4eb/limit_buying/,1,0
ngb5ky,1621443723,Moon,[removed],https://www.reddit.com/r/ethereum/comments/ngb5ky/moon/,1,0
ngb6zx,1621443812,"BlockchainExplained.org launched last night and FAQs are being created now - (0 ads, 0 scams, 100% FAQs) - We believe we can provide helpful resources to new investors and reduce some of the friction when moving between fiat($) and crypto",,https://www.reddit.com/r/ethereum/comments/ngb6zx/blockchainexplainedorg_launched_last_night_and/,1,2
ngbazf,1621444086,3 great crypto websites/resources for analysis!,,https://www.reddit.com/r/ethereum/comments/ngbazf/3_great_crypto_websitesresources_for_analysis/,1,0
ngbhov,1621444539,Ethereum Foundation: ETH 2.0 will use 99.95% less energy,[removed],https://www.reddit.com/r/ethereum/comments/ngbhov/ethereum_foundation_eth_20_will_use_9995_less/,1,1
ngbknk,1621444738,How can I buy ethereum with Paypal... at the age of 15?,[removed],https://www.reddit.com/r/ethereum/comments/ngbknk/how_can_i_buy_ethereum_with_paypal_at_the_age_of/,1,0
ngblgi,1621444793,Wild Wednesday: Crypto in full blown meltdown as inflation concerns roil equity markets,,https://www.reddit.com/r/ethereum/comments/ngblgi/wild_wednesday_crypto_in_full_blown_meltdown_as/,1,0
ngbn0d,1621444893,It's not much but it's honest work. Finally off the wait list!,,https://www.reddit.com/r/ethereum/comments/ngbn0d/its_not_much_but_its_honest_work_finally_off_the/,1,76
ngbrkw,1621445199,China ban crypto #ETH drop,,https://www.reddit.com/r/ethereum/comments/ngbrkw/china_ban_crypto_eth_drop/,1,0
ngbuyj,1621445426,Help me find the picture,[removed],https://www.reddit.com/r/ethereum/comments/ngbuyj/help_me_find_the_picture/,1,0
ngbvm8,1621445471,Ethereum About Scale and Cost Community Can't-Wait For Cheap Gas,,https://www.reddit.com/r/ethereum/comments/ngbvm8/ethereum_about_scale_and_cost_community_cantwait/,1,0
ngbw03,1621445499,Flash transaction explanation from Binance,,https://www.reddit.com/r/ethereum/comments/ngbw03/flash_transaction_explanation_from_binance/,1,0
ngbxmj,1621445605,"Starting Investing, what app to use to trade ETH stocks safely?","I’ve heard robin hood and Coinbase, I’m looking to invest soon, what platform works best and won’t risk me losing my trade somehow?",https://www.reddit.com/r/ethereum/comments/ngbxmj/starting_investing_what_app_to_use_to_trade_eth/,1,5
ngc17f,1621445860,Ethereum fell to 2200$! Buying the dip,,https://www.reddit.com/r/ethereum/comments/ngc17f/ethereum_fell_to_2200_buying_the_dip/,1,1
ngc9rj,1621446459,LiteBit ETH-Wallet maintenance,"I bought some ETH on LiteBit and wanted to send it to my metamask wallet. Normally it needs 1 minute but now it takes more than 2 hours. I did it with my mobilephone. Now I took a look on the pc-version of LiteBit and there stands „maintenance“ next to the ETH-Wallet due overload of the eth-network but my coins aren’t visible anymore. \n\nSo, does it needs just some more time or happened there a mistake? Address is correct 😅",https://www.reddit.com/r/ethereum/comments/ngc9rj/litebit_ethwallet_maintenance/,1,1
ngcaal,1621446496,ETH transfer not showing up,"ETH transaction not showing up\n\nI bought some ETH using Coinbase this morning. The transaction went through just fine. I then tried to send the full amount to my Trezor wallet address. The transaction immediately said it went through on Coinbase. Now, my Coinbase balance remains the same in USD, but it says I have zero ETH. My transfer to Trezor isn’t even showing up on Coinbase as pending or delayed under recent transactions, and obviously the funds haven’t arrived to my Trezor address. Anybody else experiencing this issue? Is the transaction indeed pending? Should I keep waiting? It has been several hours. Thanks.",https://www.reddit.com/r/ethereum/comments/ngcaal/eth_transfer_not_showing_up/,1,11
ngcb62,1621446556,What’s all about ETH2?,[removed],https://www.reddit.com/r/ethereum/comments/ngcb62/whats_all_about_eth2/,1,0
ngcc57,1621446622,Does 99% more efficient energy usage seem like a major overstatement to anyone else? Can someone who understands the nuts and bolts verify or deny?,,https://www.reddit.com/r/ethereum/comments/ngcc57/does_99_more_efficient_energy_usage_seem_like_a/,1,0
ngcj6p,1621447117,This makes me wanna cry which I didn’t buy that much last week -_-,,https://www.reddit.com/r/ethereum/comments/ngcj6p/this_makes_me_wanna_cry_which_i_didnt_buy_that/,1,0
ngcjfo,1621447135,ADOPTION: Waxed my bits and paid in ETH,[removed],https://www.reddit.com/r/ethereum/comments/ngcjfo/adoption_waxed_my_bits_and_paid_in_eth/,1,0
ngcl9l,1621447250,doge elon,[removed],https://www.reddit.com/r/ethereum/comments/ngcl9l/doge_elon/,1,0
ngcqlb,1621447628,Gemini Vs Coinbase Vs Coinbase Pro in the US?,[removed],https://www.reddit.com/r/ethereum/comments/ngcqlb/gemini_vs_coinbase_vs_coinbase_pro_in_the_us/,1,0
ngct9h,1621447810,"Ok, guess I won't do that.",,https://www.reddit.com/r/ethereum/comments/ngct9h/ok_guess_i_wont_do_that/,1,0
ngd6nd,1621448732,Could ETH flip BTC when it becomes deflationary?? I see way more draw to ETH than BTC. Would love others insight as I am a semi-experienced trader (who does plenty of research). Thoughts??,,https://www.reddit.com/r/ethereum/comments/ngd6nd/could_eth_flip_btc_when_it_becomes_deflationary_i/,1,1
ngd6wz,1621448754,market crash :(,,https://www.reddit.com/r/ethereum/comments/ngd6wz/market_crash/,1,1
ngda1e,1621448977,One of these things is not like the others...,,https://www.reddit.com/r/ethereum/comments/ngda1e/one_of_these_things_is_not_like_the_others/,1,0
ngde21,1621449259,Our Point Exaclty,,https://www.reddit.com/r/ethereum/comments/ngde21/our_point_exaclty/,1,0
ngdey6,1621449314,Turning fake money into fake money ETH to the moon and beyond,,https://www.reddit.com/r/ethereum/comments/ngdey6/turning_fake_money_into_fake_money_eth_to_the/,1,0
ngdf7q,1621449333,CAN SOMEONE EXPLAIN,[removed],https://www.reddit.com/r/ethereum/comments/ngdf7q/can_someone_explain/,1,0
ngdfjs,1621449359,What’s the move?,[removed],https://www.reddit.com/r/ethereum/comments/ngdfjs/whats_the_move/,1,0
ngdgen,1621449417,Some fundamental Blockchain Questions,"Hi everyone, I hope I am in the correct subreddit for my questions. I am reading up more and more about Blockchains (currently reading The Token Economy), but there are still many questions popping up in my head and Google search isn't always helpful because there are lots of articles which are not going very deep into the topic. Maybe someone here can help me out with some blockchain fundamentals or point me to the right resources:  \n\n\n1. What's the relation between blockchain and wallet in regards to \*\*what data is stored and managed\*\* by each entity? As I understand, the blockchain keeps track of all transactions while the wallet generates ones private key, public key, and address. If the wallet generates those, how does the blockchain know that there is a new participant in the network? I am guessing the blockchain doesn't know about this participant, until the new participants sends their first transaction to the blockchain. But I am not sure about this.\n2. How is the problem of quantum computing taken care of in the example of Ethereum/Ethereum 2.0? If quantum computing becomes a thing, it should get easier for these to decrypt public key from address and private key from public key.\n3. If a blockchain stores only transactions, how does the blockchain know how much token every participant in the network holds? Does the wallet with your address aggregate all your historical transactions on the blockchain to the result?\n4. A block in a blockchain consists of transactions. If a transaction is made, it's broadcasted to all nodes which verify the transaction. Once there are enough transactions, a block is created. Question(s): Do all nodes in the network start to create this block at the same time? And if so, will they abort their work if one node (the winner) broadcasts its block? What I am wondering here: what's the timeline of these events and for each event what does each node do?\n5. Why has a wallet public key and address if both are accessible by others once a first transaction is sent?\n6. If a block is hashed upon creation, how do block explorer applications know how to de-hash the block? Is the hash function known and always the same?\n   1. Are transactions in a block hashed as well?\n7. How is it taken care of that there are no duplicated private keys if the wallets do not know about each other. I know that there must be a function which creates this randomness, but how to guarantee its uniqueness?\n8. If a person sends a transaction, as I understand the transaction is send as plaintext and as a hash. Then nodes can hash the plaintext and verify if its the same with the hash. Why sending a hash and a plaintext in the first place? My guess: Making sure of the integrity of the transaction, so that no one tampered with it in between, but I am not 100% sure if this is the reason and/or whether there are other reasons.\n9. If one sends a transaction to the blockchain, how do nodes get notified about this? Do they just sync every X seconds with the latest transactions on the network?  \n\n\nThere are many more questions I need to dig deeper, but I don't want to flood this subreddit and need to do my own research as well. Thanks for your kindness!",https://www.reddit.com/r/ethereum/comments/ngdgen/some_fundamental_blockchain_questions/,1,7
ngdjj4,1621449633,Slice and PizzaDAO Celebrate Bitcoin Pizza Day By Giving Away More Than 1BTC Worth of Free Pizza,,https://www.reddit.com/r/ethereum/comments/ngdjj4/slice_and_pizzadao_celebrate_bitcoin_pizza_day_by/,1,2
ngdqa6,1621450090,"useNft() 0.7: nft.owner, full Decentraland support",,https://www.reddit.com/r/ethereum/comments/ngdqa6/usenft_07_nftowner_full_decentraland_support/,1,0
ngdtfx,1621450297,Doubt: 15000€ to invest. Should I buy 1 or 2 ETH and divide the rest on other altcoins? Which? Thank you guys!,[removed],https://www.reddit.com/r/ethereum/comments/ngdtfx/doubt_15000_to_invest_should_i_buy_1_or_2_eth_and/,1,0
ngduuh,1621450392,For those of you day trading crypto like Jordan Belfort instead of DCAing for your own sanity.,,https://www.reddit.com/r/ethereum/comments/ngduuh/for_those_of_you_day_trading_crypto_like_jordan/,1,0
nge1go,1621450844,Mystery solved!,,https://www.reddit.com/r/ethereum/comments/nge1go/mystery_solved/,1,0
nge2pf,1621450930,"Rare Pizzas’ DAO Will Fund A 10,000-Pizza Party On Pizza Day | Chainlink Today",,https://www.reddit.com/r/ethereum/comments/nge2pf/rare_pizzas_dao_will_fund_a_10000pizza_party_on/,1,0
ngeaig,1621451460,He really Tyrant's Judgement the cryptocurrency market...,,https://www.reddit.com/r/ethereum/comments/ngeaig/he_really_tyrants_judgement_the_cryptocurrency/,1,0
