id,created_utc,title,selftext,full_link,score,comments
nmwqa5,1622204772,What does WordPress integration with Ethereum mainnet means for the future of crypto,,https://www.reddit.com/r/ethereum/comments/nmwqa5/what_does_wordpress_integration_with_ethereum/,1,0
nmwxjp,1622205485,SELLING ALL MY ETHEREUM - My Problem With Ethereum (as a millionaire),,https://www.reddit.com/r/ethereum/comments/nmwxjp/selling_all_my_ethereum_my_problem_with_ethereum/,1,0
nmx397,1622206059,ETH-Price after PoS. Up or down?,[removed]\n\n[View Poll](https://www.reddit.com/poll/nmx397),https://www.reddit.com/r/ethereum/comments/nmx397/ethprice_after_pos_up_or_down/,1,0
nmxd2u,1622206958,$7.2mm stolen from @burger_swap because of a silly modification in the source code,,https://www.reddit.com/r/ethereum/comments/nmxd2u/72mm_stolen_from_burger_swap_because_of_a_silly/,1,58
nmxf2v,1622207137,What to do with idle ETH in wallet?,[removed],https://www.reddit.com/r/ethereum/comments/nmxf2v/what_to_do_with_idle_eth_in_wallet/,1,0
nmxkw2,1622207648,Rollbit: Best betting site for crypto and VPN friendly!,[removed],https://www.reddit.com/r/ethereum/comments/nmxkw2/rollbit_best_betting_site_for_crypto_and_vpn/,1,0
nmxynh,1622208858,Why You Should Invest In Ethereum!!,,https://www.reddit.com/r/ethereum/comments/nmxynh/why_you_should_invest_in_ethereum/,1,0
nmy7c8,1622209632,NOTE 2 SELF,[removed],https://www.reddit.com/r/ethereum/comments/nmy7c8/note_2_self/,1,0
nmyeew,1622210232,"Help a noob out with a rookie error, I'm kinda freaking out a little tbh 😅",[removed],https://www.reddit.com/r/ethereum/comments/nmyeew/help_a_noob_out_with_a_rookie_error_im_kinda/,1,0
nmyoma,1622211051,ETHEREUM To 10000 Dollars,,https://www.reddit.com/r/ethereum/comments/nmyoma/ethereum_to_10000_dollars/,1,0
nmypty,1622211148,We're Still Early - The Daily Gwei #257,,https://www.reddit.com/r/ethereum/comments/nmypty/were_still_early_the_daily_gwei_257/,1,3
nmyvij,1622211622,Go check out my first nft,,https://www.reddit.com/r/ethereum/comments/nmyvij/go_check_out_my_first_nft/,1,0
nmyyza,1622211895,Request need Private Keys with 10 or transactions on Mainnet that are no longer needed.,Hi I need some Private keys with 10 or more transactions to test some functions of my code. If you do not use an account anymore and dont mind sharing those keys please post in the comment. Your help will be much appreciated.,https://www.reddit.com/r/ethereum/comments/nmyyza/request_need_private_keys_with_10_or_transactions/,1,9
nmz7he,1622212586,Monitoring a Blockchain with a SIEM,,https://www.reddit.com/r/ethereum/comments/nmz7he/monitoring_a_blockchain_with_a_siem/,1,0
nmz80j,1622212631,MINAR EN SOLITARIO,[removed],https://www.reddit.com/r/ethereum/comments/nmz80j/minar_en_solitario/,1,0
nmz91q,1622212712,Corona Coin cryptocurrency,,https://www.reddit.com/r/ethereum/comments/nmz91q/corona_coin_cryptocurrency/,1,0
nmz96g,1622212723,Corona Coin cryptocurrency,,https://www.reddit.com/r/ethereum/comments/nmz96g/corona_coin_cryptocurrency/,1,0
nmze7i,1622213117,"1559-visually Full blocks will be rare. Full blocks in a row will be really really rare! I diagramed to scale what a worst-case scenario would look like. One line is one block. 5 minutes of full blocks (old auction style) resumes, then blocks will no longer be full. 👍",,https://www.reddit.com/r/ethereum/comments/nmze7i/1559visually_full_blocks_will_be_rare_full_blocks/,1,0
nmzrf7,1622214144,Waiting for my 21 gwei transaction to confirm,,https://www.reddit.com/r/ethereum/comments/nmzrf7/waiting_for_my_21_gwei_transaction_to_confirm/,1,0
nmzrwq,1622214177,which exchanges let you set the eth gas fee?,[removed],https://www.reddit.com/r/ethereum/comments/nmzrwq/which_exchanges_let_you_set_the_eth_gas_fee/,1,0
nn063f,1622215293,When ETH hits 5k I will get an ETH ♦ tattoo,And I will hodl past 5k because the price ceiling for eth is over 9000. Will post update once criteria is met.,https://www.reddit.com/r/ethereum/comments/nn063f/when_eth_hits_5k_i_will_get_an_eth_tattoo/,1,17
nn0ngm,1622216628,Me waiting for my 21 gwei transaction to co firm,,https://www.reddit.com/r/ethereum/comments/nn0ngm/me_waiting_for_my_21_gwei_transaction_to_co_firm/,1,0
nn135x,1622217814,Sent ETH via BEP20 instead of ERC20 to Trezor. Is it lost forever?,"I sent it from Binance to Trezor, is it lost forever or is this some way of retrieving it again?",https://www.reddit.com/r/ethereum/comments/nn135x/sent_eth_via_bep20_instead_of_erc20_to_trezor_is/,1,6
nn170c,1622218112,Haha,,https://www.reddit.com/r/ethereum/comments/nn170c/haha/,1,0
nn1buz,1622218483,What in the uniswap is going on here.,,https://www.reddit.com/r/ethereum/comments/nn1buz/what_in_the_uniswap_is_going_on_here/,1,0
nn1eky,1622218700,"Made an ethereum spaceship. Need a name for this vessel, pls suggest below!",,https://www.reddit.com/r/ethereum/comments/nn1eky/made_an_ethereum_spaceship_need_a_name_for_this/,1,0
nn1uhn,1622219930,ERC20 Voting,"Is it possible to use to an ERC20 token to vote with in the following manner:  \n\n\nERC20 Total Supply: 100  \n\n\nWallet 1 has 55 tokens\n\nWallet 2 has 40 tokens\n\nWallet 3 has 5 tokens  \n\n\nI want the owners of the 3 different wallets to vote on an item.  If Wallet 1 votes YES and Wallet 2 &amp; 3 vote NO, I want the decision to be YES since more tokens were voted with saying YES.",https://www.reddit.com/r/ethereum/comments/nn1uhn/erc20_voting/,1,2
nn20cj,1622220385,I love Ethereum...,,https://www.reddit.com/r/ethereum/comments/nn20cj/i_love_ethereum/,1,0
nn22gn,1622220545,Banks are done...,[removed],https://www.reddit.com/r/ethereum/comments/nn22gn/banks_are_done/,1,0
nn2gti,1622221613,"Is there a way to ""forward"" my balance automatically from one wallet to another as soon as I receive it?",[removed],https://www.reddit.com/r/ethereum/comments/nn2gti/is_there_a_way_to_forward_my_balance/,1,0
nn2ky1,1622221922,Introducing JPG: the New Media Curation protocol — Mirror,,https://www.reddit.com/r/ethereum/comments/nn2ky1/introducing_jpg_the_new_media_curation_protocol/,1,0
nn2o8c,1622222160,Ethereum Core Devs Meeting #114,,https://www.reddit.com/r/ethereum/comments/nn2o8c/ethereum_core_devs_meeting_114/,1,0
nn2to6,1622222570,"If Ethereum becomes a store of value as opposed to 'digital oil', do you care?","IMO, Ethereum looks more poised to become a secondary store of value similar to Bitcoin.  But I do not see it becoming 'digital oil' and powering the global financial system.\n\nIf price of Ethereum continues to go up because it's deemed a 'store of value', do you care that it didn't complete it's intended mission?",https://www.reddit.com/r/ethereum/comments/nn2to6/if_ethereum_becomes_a_store_of_value_as_opposed/,1,158
nn2x0j,1622222822,Amazing Ethereum,,https://www.reddit.com/r/ethereum/comments/nn2x0j/amazing_ethereum/,1,0
nn2yyr,1622222969,Looks cool,,https://www.reddit.com/r/ethereum/comments/nn2yyr/looks_cool/,1,0
nn2zmc,1622223014,Is the drop in Daily Active Ethereum addresses driven by migration to L2?,,https://www.reddit.com/r/ethereum/comments/nn2zmc/is_the_drop_in_daily_active_ethereum_addresses/,1,0
nn33ze,1622223348,Raoul Pal Update - Why I Buy Ethereum more than Bitcoin | Bitcoin And Ethereum Price Prediction,,https://www.reddit.com/r/ethereum/comments/nn33ze/raoul_pal_update_why_i_buy_ethereum_more_than/,1,0
nn3hfo,1622224356,"Thanks for the support, Elon! ETH holders thank you",,https://www.reddit.com/r/ethereum/comments/nn3hfo/thanks_for_the_support_elon_eth_holders_thank_you/,1,0
nn3jw4,1622224539,"Join the Ethereum community for the ""Road to Devcon"" event series: A poap.art painting party on May 29","Hey all- EthStaker and Devcon organizers are excited to drop some pixels with you on Saturday, May 29, here are some details:\n\n**When/where?**\n\n\* Saturday May 29th, 6:00pm - 7:30pm UTC\n\n\* YouTube stream: https://www.youtube.com/watch?v=IACYJUWwyb8\n\n\* No RSVP needed.\n\n**POAP?**\n\nNo need to do anything in advance. We will be distributing the POAP at the beginning of the call and will explain how to participate in the POAP.art drawing.\n\n**Painting Guilds**\n\nHead on over to [Road to Devcon Discord](https://discord.gg/cB4GMa3K) #painting-party-general and check out all of the group drawings we are coordinating.  Pop into a guild channel to collaborate, suggest a new one, or feel free to just draw solo! Look for logicbeach.eth#7509 on discord, or /u/logic_beach if you want help jumpstarting a guild.\n\n**Raffles**\n\nWe'll be hosting a double-header raffle at the end of the call.  There will be many eligible POAPs so if you hold any of the below, make sure to join \n\n\* Road to Devcon Attendee Survey\n\n\* Devcon 1-5\n\n\* Eth2 Genesis Depositor\n\n\* Medalla Testnet Participant (any client)\n\n**Raffle Prizes**\n\n\* 1 NFT mint of the POAP.art drawing\n\n\* 6 Builder Discount Devcon tickets\n\n\* 40 Participant tickets to Quest #3 Devcon Trivia Game (anyone can still watch live on YouTube)\n\nPlease feel free to ask questions here or on the [Road to Devcon Discord](https://discord.gg/cB4GMa3K).",https://www.reddit.com/r/ethereum/comments/nn3jw4/join_the_ethereum_community_for_the_road_to/,1,4
nn3ln6,1622224674,Utility tokens with tangible benefits over existing alternatives?,[removed],https://www.reddit.com/r/ethereum/comments/nn3ln6/utility_tokens_with_tangible_benefits_over/,1,1
nn3uf5,1622225311,DAOs place in political action,[removed],https://www.reddit.com/r/ethereum/comments/nn3uf5/daos_place_in_political_action/,1,1
nn3wq8,1622225481,They just don't know (OC),,https://www.reddit.com/r/ethereum/comments/nn3wq8/they_just_dont_know_oc/,1,2
nn3xvd,1622225573,Ethermine VS Nicehash,[removed],https://www.reddit.com/r/ethereum/comments/nn3xvd/ethermine_vs_nicehash/,1,0
nn40oe,1622225787,Nitro virtual channels - a unique construction for building state channel networks,,https://www.reddit.com/r/ethereum/comments/nn40oe/nitro_virtual_channels_a_unique_construction_for/,1,0
nn45ei,1622226148,Favorite ETH app,[removed],https://www.reddit.com/r/ethereum/comments/nn45ei/favorite_eth_app/,1,0
nn47t0,1622226339,Nitro virtual channels - a unique construction for building state channel networks with minimal on-chain transactions,,https://www.reddit.com/r/ethereum/comments/nn47t0/nitro_virtual_channels_a_unique_construction_for/,1,2
nn49a1,1622226452,Maker's tech boss on L2 solutions,,https://www.reddit.com/r/ethereum/comments/nn49a1/makers_tech_boss_on_l2_solutions/,1,1
nn4m6b,1622227436,ETH vs BTC,[removed],https://www.reddit.com/r/ethereum/comments/nn4m6b/eth_vs_btc/,1,0
nn4uwn,1622228140,AllCoreDevs Twitter Summary 🧵,,https://www.reddit.com/r/ethereum/comments/nn4uwn/allcoredevs_twitter_summary/,1,13
nn51lh,1622228636,Sustainables Coin Coming Soon .!,[removed],https://www.reddit.com/r/ethereum/comments/nn51lh/sustainables_coin_coming_soon/,1,0
