id,created_utc,title,selftext,full_link,score,comments
nnfis8,1622262660,First time investor here,[removed],https://www.reddit.com/r/ethereum/comments/nnfis8/first_time_investor_here/,1,1
nnfnqk,1622263197,Ethereum LPT,"There are exchanges that don't charge for failed transactions now. \n\n[donutswap.exchange](https://donutswap.exchange), [mistx.io](https://mistx.io), and [cowswap.exchange](https://cowswap.exchange). Check em out",https://www.reddit.com/r/ethereum/comments/nnfnqk/ethereum_lpt/,1,3
nnfqzo,1622263555,Nothing here🤡,[removed],https://www.reddit.com/r/ethereum/comments/nnfqzo/nothing_here/,1,0
nnfs01,1622263667,Welcome to the Alien Worlds Metaverse! Tips for New Explorers!,[removed],https://www.reddit.com/r/ethereum/comments/nnfs01/welcome_to_the_alien_worlds_metaverse_tips_for/,1,0
nngjnv,1622266648,Cardano’s Charles Hoskinson: Ethereum 2.0 will kill…,,https://www.reddit.com/r/ethereum/comments/nngjnv/cardanos_charles_hoskinson_ethereum_20_will_kill/,1,0
nnglhg,1622266847,How to create a security token in Ethereum,,https://www.reddit.com/r/ethereum/comments/nnglhg/how_to_create_a_security_token_in_ethereum/,1,0
nngmmx,1622266973,"Now, Claim Your Mined NFT Game Cards",[removed],https://www.reddit.com/r/ethereum/comments/nngmmx/now_claim_your_mined_nft_game_cards/,1,0
nngryy,1622267555,BREAKN NEWS:GET FREE FOREX SIGNAL FROM OUR HIGH RISK VETARAN TRADERS/TEACHERS....,[removed],https://www.reddit.com/r/ethereum/comments/nngryy/breakn_newsget_free_forex_signal_from_our_high/,1,0
nngw7i,1622268014,Daily Discussion Thread,"**Welcome to the Daily Discussion. Please read the disclaimer, guidelines, and rules before participating.**\n\nDisclaimer:\n\nThough karma rules still apply, moderation is less active on this thread than on the rest of the sub. Therefore, consider all information posted here with several liberal heaps of salt, and always cross check any information you may read on this thread with known sources.\n\n## Rules:\n\n* All [sub rules](https://www.reddit.com/r/Ethereum/about/rules/) apply in this thread.\n* Discussion topics must be related to Ethereum.\n* Behave with civility and politeness. Do not use offensive, racist or homophobic language.\n* Comments will be sorted by newest first.\n\nUseful Links:\n\n* [Ethereum.org](https://ethereum.org)\n* [ETHHub](https://ethhub.io/)\n* [ETHMerge.com](https://ethmerge.com/)",https://www.reddit.com/r/ethereum/comments/nngw7i/daily_discussion_thread/,1,49
nngwzx,1622268099,Why ParaState? And the tradeoff of Layer 2,,https://www.reddit.com/r/ethereum/comments/nngwzx/why_parastate_and_the_tradeoff_of_layer_2/,1,1
nngyvi,1622268305,Ethereum price struggles to separate from broader crypto weakness,,https://www.reddit.com/r/ethereum/comments/nngyvi/ethereum_price_struggles_to_separate_from_broader/,1,1
nnh7kb,1622269321,Ethereum Revolution ::)),,https://www.reddit.com/r/ethereum/comments/nnh7kb/ethereum_revolution/,1,0
nnh9pz,1622269586,Ethereum,,https://www.reddit.com/r/ethereum/comments/nnh9pz/ethereum/,1,0
nnhaaa,1622269656,Can I back my token with other tokens?,"I created a token with the initials XASB (Crypto Assets of Steve Bayer: [https://etherscan.io/token/0x6c7d4ed524c14c36048f00dc5f9bba5848314f39](https://etherscan.io/token/0x6c7d4ed524c14c36048f00dc5f9bba5848314f39)): and I plan to back it up with ETH and tokens that are in the DeFi space.\n\nI don't have much funds in the official wallet address: [https://etherscan.io/address/0x34CDdA765708c3B0B853712C363eF411C0Fa2C52](https://etherscan.io/address/0x34CDdA765708c3B0B853712C363eF411C0Fa2C52)\n\nWhen I sell the token, I plan to use proceeds from my token sales to buy ETH ad other tokens and add them to the above wallet.\n\nIs this possible/feasible?\n\n&amp;#x200B;\n\nMore information:\n\n[https://stevebayerin.medium.com/xasb-token-launched-bd34cc59a40f](https://stevebayerin.medium.com/xasb-token-launched-bd34cc59a40f)",https://www.reddit.com/r/ethereum/comments/nnhaaa/can_i_back_my_token_with_other_tokens/,1,13
nnhbt4,1622269833,"What is EthereumMax and why is it up 18,000%?",,https://www.reddit.com/r/ethereum/comments/nnhbt4/what_is_ethereummax_and_why_is_it_up_18000/,1,0
nnhg9y,1622270389,Ether transaction status shows Fail after 10 days,[removed],https://www.reddit.com/r/ethereum/comments/nnhg9y/ether_transaction_status_shows_fail_after_10_days/,1,0
nnhgzz,1622270480,ETH transfer status,[removed],https://www.reddit.com/r/ethereum/comments/nnhgzz/eth_transfer_status/,1,0
nnhhzp,1622270598,Picasso collage like– ultra rare 1/5,[removed],https://www.reddit.com/r/ethereum/comments/nnhhzp/picasso_collage_like_ultra_rare_15/,1,0
nnhqt8,1622271671,Vitalik argues that proof-of-stake is a ‘solution’ to Ethereum’s environmental woes,,https://www.reddit.com/r/ethereum/comments/nnhqt8/vitalik_argues_that_proofofstake_is_a_solution_to/,1,0
nni54h,1622273452,NOOB Problem: my browser does not open .eth domains.,[removed],https://www.reddit.com/r/ethereum/comments/nni54h/noob_problem_my_browser_does_not_open_eth_domains/,1,5
nni5jv,1622273502,Mark Cuban: What I look at when comparing blockchains like bitcoin and ethereum,,https://www.reddit.com/r/ethereum/comments/nni5jv/mark_cuban_what_i_look_at_when_comparing/,1,0
nnib4y,1622274170,Hi.com referral: joinhi,,https://www.reddit.com/r/ethereum/comments/nnib4y/hicom_referral_joinhi/,1,0
nnihpi,1622274963,State-channel based Plinko: Dicether released a new game,,https://www.reddit.com/r/ethereum/comments/nnihpi/statechannel_based_plinko_dicether_released_a_new/,1,0
nnijoe,1622275215,ZGOAT,[removed],https://www.reddit.com/r/ethereum/comments/nnijoe/zgoat/,1,0
nniu06,1622276412,How likely would a delay of ETH 2.0 release be? Could it be pushed forward by a few months or a year?,[removed],https://www.reddit.com/r/ethereum/comments/nniu06/how_likely_would_a_delay_of_eth_20_release_be/,1,0
nniy53,1622276892,Ethereum (Eth) Founder Proposes A Solution To Crypto Mining Woes,,https://www.reddit.com/r/ethereum/comments/nniy53/ethereum_eth_founder_proposes_a_solution_to/,1,0
nnj2r9,1622277451,Cudo Miner not working properly,[removed],https://www.reddit.com/r/ethereum/comments/nnj2r9/cudo_miner_not_working_properly/,1,1
nnj5as,1622277768,"‘Ether Beats Bitcoin as a Store of Value,’ Says Goldman Sachs Global Macro Research",,https://www.reddit.com/r/ethereum/comments/nnj5as/ether_beats_bitcoin_as_a_store_of_value_says/,1,0
nnjc3u,1622278588,"My ""minor problem "" with ETH","I would like to say firstly that I think ETH is a great project and I'm not criticizing.  I just want an explanation. \nEthereum and bitcoin both are big project with bitcoin considered as digital gold.\nA lot of analysts say that ETH will be bigger than BTC. I want explanation in terms of price stability and how ""decentralized "" is it.\nI think that eth not have a fixed supply makes the price centralized because at any moment they can add more supply and the price will go down hence they can ""control"" the price. If I'm wrong please explain to me and explain how will the price rise up. Thank you",https://www.reddit.com/r/ethereum/comments/nnjc3u/my_minor_problem_with_eth/,1,15
nnjxsp,1622281172,Investment advice,I'm looking to invest around 40-50k into Eth soon. Im fairly new to crypto and this would be my first investment into Eth. Under normal circumstances I'd normally say it's better to dollar cost average in but with Eth 2.0 coming would I be better to just invest the entire lump sum in and try and time a good entry level,https://www.reddit.com/r/ethereum/comments/nnjxsp/investment_advice/,1,6
nnk5uq,1622282142,"$60,000 + of mini-Ethereum (mETH) for sale!!",[removed],https://www.reddit.com/r/ethereum/comments/nnk5uq/60000_of_miniethereum_meth_for_sale/,1,0
nnk702,1622282285,"$60,000 + of mini-Ethereum for sale!! 50% off!!! Email me dhart94@ivytech.edu currently valued on Coinbase.",,https://www.reddit.com/r/ethereum/comments/nnk702/60000_of_miniethereum_for_sale_50_off_email_me/,1,0
nnkath,1622282720,Hello everyone!,[removed],https://www.reddit.com/r/ethereum/comments/nnkath/hello_everyone/,1,0
nnkfyx,1622283324,hello all,[removed],https://www.reddit.com/r/ethereum/comments/nnkfyx/hello_all/,1,0
nnkziy,1622285582,Is it possible to add or remove liquidity on a contract that I have created at Uniswap using another site?,[removed],https://www.reddit.com/r/ethereum/comments/nnkziy/is_it_possible_to_add_or_remove_liquidity_on_a/,1,0
nnlld3,1622288031,Ethereum 2.0 Staking Contract Now Has 5 Million ETH,,https://www.reddit.com/r/ethereum/comments/nnlld3/ethereum_20_staking_contract_now_has_5_million_eth/,1,0
nnlo2h,1622288334,Eth intercepted and stolen,[removed],https://www.reddit.com/r/ethereum/comments/nnlo2h/eth_intercepted_and_stolen/,1,1
nnlwuk,1622289286,Are NFTs and Emissions Correlated?,,https://www.reddit.com/r/ethereum/comments/nnlwuk/are_nfts_and_emissions_correlated/,1,0
nnm2l9,1622289847,My first smart-contracts 🎉🎉🎉🎉🎉😊,,https://www.reddit.com/r/ethereum/comments/nnm2l9/my_first_smartcontracts/,1,0
nnmjgp,1622291567,Buy the Dip,[removed],https://www.reddit.com/r/ethereum/comments/nnmjgp/buy_the_dip/,1,0
nnnn52,1622295424,Crypto is not for me. I’m done,[removed],https://www.reddit.com/r/ethereum/comments/nnnn52/crypto_is_not_for_me_im_done/,1,0
nnnt6y,1622295993,Park your extra cash in this stablecoin account and earn as much as 7% annually - They are starting to figure it out!,,https://www.reddit.com/r/ethereum/comments/nnnt6y/park_your_extra_cash_in_this_stablecoin_account/,1,0
nno9lh,1622297486,Cheapest exchange to use?,[removed],https://www.reddit.com/r/ethereum/comments/nno9lh/cheapest_exchange_to_use/,1,0
nnoaen,1622297562,Its a general question dont know where exactly to ask this - Why has MEV suddenly become a hot topic?,[removed],https://www.reddit.com/r/ethereum/comments/nnoaen/its_a_general_question_dont_know_where_exactly_to/,1,0
nnocxz,1622297787,A dApp for whistleblowers! Are we ready to encourage this development?,,https://www.reddit.com/r/ethereum/comments/nnocxz/a_dapp_for_whistleblowers_are_we_ready_to/,1,107
nnoffz,1622298004,Government pumping money,,https://www.reddit.com/r/ethereum/comments/nnoffz/government_pumping_money/,1,1
nnolt1,1622298514,Tethering up,"n00b here, reporting for duty! \n\nWhat does it mean in crypto land, when someone says they're ""tethered up""? Or ""this weekend I'm going to tether up""",https://www.reddit.com/r/ethereum/comments/nnolt1/tethering_up/,1,64
nnox4g,1622299492,Ethereum Node Service,[removed],https://www.reddit.com/r/ethereum/comments/nnox4g/ethereum_node_service/,1,0
nnoyv0,1622299642,About this week) let’s go to 5K then 10k 🔥,,https://www.reddit.com/r/ethereum/comments/nnoyv0/about_this_week_lets_go_to_5k_then_10k/,1,0
nnp0d0,1622299765,20% tax on Cryptocurrency in South Korea to reduce illegal projects,,https://www.reddit.com/r/ethereum/comments/nnp0d0/20_tax_on_cryptocurrency_in_south_korea_to_reduce/,1,0
