id,created_utc,title,selftext,full_link,score,comments
hxkjhb,1595672700,Get a free demo of million money mlm clone script,[removed],https://www.reddit.com/r/ethereum/comments/hxkjhb/get_a_free_demo_of_million_money_mlm_clone_script/,1,0
hxkju4,1595672751,Get free demo of million money clone script,[removed],https://www.reddit.com/r/ethereum/comments/hxkju4/get_free_demo_of_million_money_clone_script/,1,0
hxkt4f,1595674232,Any thoughts on using historical proof of a tiny payment from a controlled address as to a recipient address + metamask as the login system for a website or dapp?,[removed],https://www.reddit.com/r/ethereum/comments/hxkt4f/any_thoughts_on_using_historical_proof_of_a_tiny/,1,0
hxlfah,1595677568,"Does anyone know how to fix the ""not enough liquidity"" message on Fulcrum when trying to Unlend?",[removed],https://www.reddit.com/r/ethereum/comments/hxlfah/does_anyone_know_how_to_fix_the_not_enough/,1,0
hxlt7a,1595679551,Bruteforce 1 seed word missing in a 12 word word with a passphrase(I know the passphrase),[removed],https://www.reddit.com/r/ethereum/comments/hxlt7a/bruteforce_1_seed_word_missing_in_a_12_word_word/,1,0
hxm21q,1595680726,Ethereum based social media TORUM comes out of stealth,,https://www.reddit.com/r/ethereum/comments/hxm21q/ethereum_based_social_media_torum_comes_out_of/,1,9
hxm5pj,1595681218,Any serious business on ETH DeFi or Dapps?,[removed],https://www.reddit.com/r/ethereum/comments/hxm5pj/any_serious_business_on_eth_defi_or_dapps/,1,21
hxonnz,1595691338,Thoughts on .crypto domains...,[removed],https://www.reddit.com/r/ethereum/comments/hxonnz/thoughts_on_crypto_domains/,1,0
hxozjo,1595692571,Luxor is Live! (decentralized data spreadsheet with Ethereum support),,https://www.reddit.com/r/ethereum/comments/hxozjo/luxor_is_live_decentralized_data_spreadsheet_with/,1,8
hxqesf,1595697682,A $5 million trade was just completed on Matcha.xyz | One of the largest DEX trades of all time!,,https://www.reddit.com/r/ethereum/comments/hxqesf/a_5_million_trade_was_just_completed_on_matchaxyz/,1,29
hxqjs9,1595698160,The future of Gaming on the Blockchain with Cartesi,,https://www.reddit.com/r/ethereum/comments/hxqjs9/the_future_of_gaming_on_the_blockchain_with/,1,1
hxqv1q,1595699233,How can address(0) send tokens?,[removed],https://www.reddit.com/r/ethereum/comments/hxqv1q/how_can_address0_send_tokens/,1,0
hxqyv5,1595699601,How will mining ETH be affected when it transitions from Proof of Work(PoW) to Proof of Stake(PoS)?,"Hello! I’ve read that ETH will or is transitioning from PoW to PoS. I also know that PoW depends highly on mining. \n\nThus, I’m wondering:\n• Is ETH really making the aforementioned transition?\n• If so, how will this affect mining ETH? \n\nThanks so much for the guidance",https://www.reddit.com/r/ethereum/comments/hxqyv5/how_will_mining_eth_be_affected_when_it/,1,17
hxr169,1595699833,Best command line ETH wallet with BIP39 import,[removed],https://www.reddit.com/r/ethereum/comments/hxr169/best_command_line_eth_wallet_with_bip39_import/,1,1
hxrlwo,1595701834,district0x - The District Weekly — July 25th,,https://www.reddit.com/r/ethereum/comments/hxrlwo/district0x_the_district_weekly_july_25th/,1,0
hxs2u8,1595703442,Why Would I Choose Ethereum Over BTC?,[removed],https://www.reddit.com/r/ethereum/comments/hxs2u8/why_would_i_choose_ethereum_over_btc/,1,0
hxsc1h,1595704317,2020 Cryptocurrency Regulations that could change the industry forever,,https://www.reddit.com/r/ethereum/comments/hxsc1h/2020_cryptocurrency_regulations_that_could_change/,1,0
hxsugu,1595706138,Do slow ethereum transactions affect ERC-20 coin transcations?,[removed],https://www.reddit.com/r/ethereum/comments/hxsugu/do_slow_ethereum_transactions_affect_erc20_coin/,1,0
hxt1ze,1595706871,Why the fuck the transaction fees so high?,[removed],https://www.reddit.com/r/ethereum/comments/hxt1ze/why_the_fuck_the_transaction_fees_so_high/,1,0
hxt2d6,1595706908,A Potential Danger of Borrowing On Compound Finance,,https://www.reddit.com/r/ethereum/comments/hxt2d6/a_potential_danger_of_borrowing_on_compound/,1,2
hxt5fg,1595707210,TownStar - Brand New Tycoon/Strategy Blockchain game,[removed],https://www.reddit.com/r/ethereum/comments/hxt5fg/townstar_brand_new_tycoonstrategy_blockchain_game/,1,0
hxtfta,1595708218,300,,https://www.reddit.com/r/ethereum/comments/hxtfta/300/,1,0
hxtheg,1595708376,Darwinia Network! 🚀☄️🔥,,https://www.reddit.com/r/ethereum/comments/hxtheg/darwinia_network/,1,0
hxtpjj,1595709194,Eth moons and maxis are angry.,[removed],https://www.reddit.com/r/ethereum/comments/hxtpjj/eth_moons_and_maxis_are_angry/,1,0
hxtvmv,1595709823,Have I been living under a rock?,[removed],https://www.reddit.com/r/ethereum/comments/hxtvmv/have_i_been_living_under_a_rock/,1,0
hxu4dp,1595710714,$300 and we aint stopping yet!,,https://www.reddit.com/r/ethereum/comments/hxu4dp/300_and_we_aint_stopping_yet/,1,0
hxuk8j,1595712383,"ETH, erc20, collectibles",[removed],https://www.reddit.com/r/ethereum/comments/hxuk8j/eth_erc20_collectibles/,1,2
hxum8i,1595712584,"A ""simple"" question about the potential of ETH 2.0",[removed],https://www.reddit.com/r/ethereum/comments/hxum8i/a_simple_question_about_the_potential_of_eth_20/,1,0
hxv129,1595714109,"Is it just me or both Gas price in real and in ETH is going up 🤔😂{last 2 weeks lowest was at 45-47, highest 59}",[removed],https://www.reddit.com/r/ethereum/comments/hxv129/is_it_just_me_or_both_gas_price_in_real_and_in/,1,0
hxwen9,1595719373,Binance's BUSD To Become The First Major Stablecoin To Utilize The Syscoin-Ethereum Bridge,,https://www.reddit.com/r/ethereum/comments/hxwen9/binances_busd_to_become_the_first_major/,1,0
hxwfsf,1595719500,Ethereum Based Binance's BUSD To Become The First Major Stablecoin To Utilize The Syscoin Bridge,,https://www.reddit.com/r/ethereum/comments/hxwfsf/ethereum_based_binances_busd_to_become_the_first/,1,0
hxwira,1595719826,Binance's BUSD To Become The First Major Stablecoin To Utilize The Syscoin - Ethereum Bridge,,https://www.reddit.com/r/ethereum/comments/hxwira/binances_busd_to_become_the_first_major/,1,0
hxwoi3,1595720460,"New to ETH. Watching it grow a little, but what is everyones thoughts?",[removed],https://www.reddit.com/r/ethereum/comments/hxwoi3/new_to_eth_watching_it_grow_a_little_but_what_is/,1,0
hxwppf,1595720599,Binance to Transfer BUSD Across Blockchains on Syscoin Ethereum Bridge,,https://www.reddit.com/r/ethereum/comments/hxwppf/binance_to_transfer_busd_across_blockchains_on/,1,0
hxwq86,1595720654,Binance To Use Ethereum Syscoin Bridge For Its BUSD Stablecoin,,https://www.reddit.com/r/ethereum/comments/hxwq86/binance_to_use_ethereum_syscoin_bridge_for_its/,1,22
hxx82b,1595722679,Shapeshift/Banxa question about purchase,[removed],https://www.reddit.com/r/ethereum/comments/hxx82b/shapeshiftbanxa_question_about_purchase/,1,0
hxxkmc,1595724126,"ArCoin, US Treasury backed fund that is SEC approved riding as an ERC-20 token on the Ethereum blockchain -- mempoole",,https://www.reddit.com/r/ethereum/comments/hxxkmc/arcoin_us_treasury_backed_fund_that_is_sec/,1,2
hxy0zs,1595726068,Other coins trying to take DeFi and smart contract market share from Ethereum,,https://www.reddit.com/r/ethereum/comments/hxy0zs/other_coins_trying_to_take_defi_and_smart/,1,33
hxyxzy,1595730061,Strengths and Weaknesses,[removed],https://www.reddit.com/r/ethereum/comments/hxyxzy/strengths_and_weaknesses/,1,0
hxzag2,1595731583,Any legit ETH staking pool recommendation for people with less than 32 ETH?,[removed],https://www.reddit.com/r/ethereum/comments/hxzag2/any_legit_eth_staking_pool_recommendation_for/,1,37
hxzmn0,1595733146,Simple Question: How Can I Release All of My ENS Domains And Get My ETH Back?,[removed],https://www.reddit.com/r/ethereum/comments/hxzmn0/simple_question_how_can_i_release_all_of_my_ens/,1,10
hy02s4,1595735216,"Ethereum FTW, otherwise...",,https://www.reddit.com/r/ethereum/comments/hy02s4/ethereum_ftw_otherwise/,1,0
hy0qj5,1595738147,Is DEFI causing blockchain bloat on Ethereum?,[removed],https://www.reddit.com/r/ethereum/comments/hy0qj5/is_defi_causing_blockchain_bloat_on_ethereum/,1,0
hy1qzv,1595743071,ASX listed Travel Agency (Webjet) uses Ethereum for its travel disputes,,https://www.reddit.com/r/ethereum/comments/hy1qzv/asx_listed_travel_agency_webjet_uses_ethereum_for/,1,0
hy21r1,1595744658,Feed your FOMO,,https://www.reddit.com/r/ethereum/comments/hy21r1/feed_your_fomo/,1,0
hy2jew,1595747303,Staking 101. 32eth ready to go.,,https://www.reddit.com/r/ethereum/comments/hy2jew/staking_101_32eth_ready_to_go/,1,0
hy2tyx,1595748908,Blockchain mining banned on google cloud - what about validating?,[removed],https://www.reddit.com/r/ethereum/comments/hy2tyx/blockchain_mining_banned_on_google_cloud_what/,1,0
hy2uws,1595749052,ETHEREUM THIS MORNING 📈,,https://www.reddit.com/r/ethereum/comments/hy2uws/ethereum_this_morning/,1,0
hy37qd,1595751115,Liquidity Pool Clarification,[removed],https://www.reddit.com/r/ethereum/comments/hy37qd/liquidity_pool_clarification/,1,0
hy3o0o,1595753589,"Ampleforth: How to Buy, Pool &amp; Stake AMPL Tokens",,https://www.reddit.com/r/ethereum/comments/hy3o0o/ampleforth_how_to_buy_pool_stake_ampl_tokens/,1,8
