id,created_utc,title,selftext,full_link,score,comments
hyv3bz,1595865961,Holy Mother GWEI fees,[removed],https://www.reddit.com/r/ethereum/comments/hyv3bz/holy_mother_gwei_fees/,1,0
hyv9mr,1595866493,Smart Contracts for the Criminal Justice System,,https://www.reddit.com/r/ethereum/comments/hyv9mr/smart_contracts_for_the_criminal_justice_system/,1,0
hyvfxz,1595867051,CryptoLocally Adds Ethereum as ETH 2.0 Testnet Approaches,,https://www.reddit.com/r/ethereum/comments/hyvfxz/cryptolocally_adds_ethereum_as_eth_20_testnet/,1,0
hyvjrv,1595867384,Ethereum (ETH) Anticipated To Cross $400 Mark if It Breaks Resistance at $307,,https://www.reddit.com/r/ethereum/comments/hyvjrv/ethereum_eth_anticipated_to_cross_400_mark_if_it/,1,0
hyvlar,1595867514,Bankless: 23 - Investing in DeFi | Joey Krug,,https://www.reddit.com/r/ethereum/comments/hyvlar/bankless_23_investing_in_defi_joey_krug/,1,0
hyw0jm,1595868868,"Crypto Mining Equipment - Antminer Z15, Antminer S19 Pro 110Th/s StrongU STU U6, Innosilicon A10 and much more - Summer SALE",[removed],https://www.reddit.com/r/ethereum/comments/hyw0jm/crypto_mining_equipment_antminer_z15_antminer_s19/,1,0
hyw0m0,1595868874,Introducing the Deposit Launch Pad for Eth2.0,,https://www.reddit.com/r/ethereum/comments/hyw0m0/introducing_the_deposit_launch_pad_for_eth20/,1,0
hyw2yt,1595869080,Congratulations to the MakerDAO team for reaching 1Bn value locked in vaults!,,https://www.reddit.com/r/ethereum/comments/hyw2yt/congratulations_to_the_makerdao_team_for_reaching/,1,0
hyw4gw,1595869212,Question about selling eth during Phase 0,[removed],https://www.reddit.com/r/ethereum/comments/hyw4gw/question_about_selling_eth_during_phase_0/,1,0
hywnc1,1595870819,La Jolla Institute Begins Accepting ETH Donations For COVID Research,,https://www.reddit.com/r/ethereum/comments/hywnc1/la_jolla_institute_begins_accepting_eth_donations/,1,0
hywnjk,1595870835,Ethereum (ETH) Releases ETH2 Validator Launchpad Testnet: Another Step towards ETH2,,https://www.reddit.com/r/ethereum/comments/hywnjk/ethereum_eth_releases_eth2_validator_launchpad/,1,0
hywvor,1595871521,"Decentralization (Augur) | Your Global, No-Limit Betting Platform",,https://www.reddit.com/r/ethereum/comments/hywvor/decentralization_augur_your_global_nolimit/,1,0
hyx3go,1595872180,MakerDAO becomes first DeFi protocol to hit $1 billion in total value locked,,https://www.reddit.com/r/ethereum/comments/hyx3go/makerdao_becomes_first_defi_protocol_to_hit_1/,1,0
hyx9ji,1595872687,Nexus Mutuals Latest Ethereum Project To Pass Lightning Network,,https://www.reddit.com/r/ethereum/comments/hyx9ji/nexus_mutuals_latest_ethereum_project_to_pass/,1,0
hyxbxc,1595872884,It's Time.,,https://www.reddit.com/r/ethereum/comments/hyxbxc/its_time/,1,0
hyxqms,1595874147,"The creators of Ethercrash have released Etherdice, a provably fair dice game","Disclaimer: I've been following along with the team for a few years now and definitely am a fan, so I might be a little biased, but have a look for yourself!\n\nThe people who made [Ethercrash](https://www.ethercrash.io/) have recently released [Etherdice](https://ether-dice.io), a dice-betting game provably fair using the same secret-server-seed system that Crash uses. House edge is around ~1% after player bonuses.\n\nThe super cool thing is that, like crash, you can invest in the house, become part of the bankroll, and collect dividends over time as the house wins money. As you play, you also earn ""tokens"", which are separate from your normal (and invested) balance and entitle you to daily dividends. There's also a weekly contest based off of your total amount wagered in the past week.",https://www.reddit.com/r/ethereum/comments/hyxqms/the_creators_of_ethercrash_have_released/,1,11
hyy6n1,1595875498,Until this changes. Crypto won’t ever really become mainstream.,,https://www.reddit.com/r/ethereum/comments/hyy6n1/until_this_changes_crypto_wont_ever_really_become/,1,21
hyyduo,1595876134,The state of this sub right now,,https://www.reddit.com/r/ethereum/comments/hyyduo/the_state_of_this_sub_right_now/,1,12
hyyma9,1595876851,Watch Dragonchain's Live Great Reddit Scaling Bake-Off Proposal &amp; AMA | Tue 7/28 | 6pm EDT | 3pm PDT,,https://www.reddit.com/r/ethereum/comments/hyyma9/watch_dragonchains_live_great_reddit_scaling/,1,0
hyz4vt,1595878460,Future,[removed],https://www.reddit.com/r/ethereum/comments/hyz4vt/future/,1,0
hyztcl,1595880574,Ethereum miners increase the gas limit for the second time in 2 months,,https://www.reddit.com/r/ethereum/comments/hyztcl/ethereum_miners_increase_the_gas_limit_for_the/,1,0
hz0sbj,1595883678,HEX dump going on?,[removed],https://www.reddit.com/r/ethereum/comments/hz0sbj/hex_dump_going_on/,1,0
hz0yd0,1595884208,The Rise of Decentralized Finance | Framework Ventures’ Michael Anderson &amp; Vance Spencer (biggest Chainlink and Synthetix holders),,https://www.reddit.com/r/ethereum/comments/hz0yd0/the_rise_of_decentralized_finance_framework/,1,0
hz11us,1595884517,How can I move ETH out of my contract?,[removed],https://www.reddit.com/r/ethereum/comments/hz11us/how_can_i_move_eth_out_of_my_contract/,1,0
hz2mp0,1595889693,New BUIDLHub Gas Price Monitor Template,,https://www.reddit.com/r/ethereum/comments/hz2mp0/new_buidlhub_gas_price_monitor_template/,1,0
hz3gbs,1595892550,"Buy coffee from 50 different roasters with ETH, sorry no Lambos",[removed],https://www.reddit.com/r/ethereum/comments/hz3gbs/buy_coffee_from_50_different_roasters_with_eth/,1,0
hz435m,1595894850,Run as far from this as possible,,https://www.reddit.com/r/ethereum/comments/hz435m/run_as_far_from_this_as_possible/,1,0
hz4dkt,1595895909,"Learn about ERC1155: 🎮 ERC1155 is a multi-token standard 🧰 Use the preset ERC1155 with minting, pause and burn 🆕 Available in OpenZeppelin Contracts v3.1",,https://www.reddit.com/r/ethereum/comments/hz4dkt/learn_about_erc1155_erc1155_is_a_multitoken/,1,2
hz509o,1595898277,What happens when I move?,[removed],https://www.reddit.com/r/ethereum/comments/hz509o/what_happens_when_i_move/,1,5
hz5c89,1595899556,"$1,200 to shut you up - Market Monday LITE (07/27)",,https://www.reddit.com/r/ethereum/comments/hz5c89/1200_to_shut_you_up_market_monday_lite_0727/,1,0
hz5h1q,1595900069,Total newbie question,[removed],https://www.reddit.com/r/ethereum/comments/hz5h1q/total_newbie_question/,1,0
hz5jr9,1595900364,Ethereum 2.0 and Ethereum Staking Explained,,https://www.reddit.com/r/ethereum/comments/hz5jr9/ethereum_20_and_ethereum_staking_explained/,1,0
hz5l87,1595900525,Ethereum 2.0 &amp; New ETH Staking Explained,,https://www.reddit.com/r/ethereum/comments/hz5l87/ethereum_20_new_eth_staking_explained/,1,0
hz5tu9,1595901449,"go bitcoin, go",,https://www.reddit.com/r/ethereum/comments/hz5tu9/go_bitcoin_go/,1,0
hz5z5c,1595902002,TopBTC now scam 2020,[removed],https://www.reddit.com/r/ethereum/comments/hz5z5c/topbtc_now_scam_2020/,1,0
hz66jq,1595902802,"Ethereum Surges Above $300 Support, Retests June 2019 Highs",,https://www.reddit.com/r/ethereum/comments/hz66jq/ethereum_surges_above_300_support_retests_june/,1,0
hz6zth,1595906111,CoinShares Announces Investment in Avantgarde Finance (Melon Protocol),,https://www.reddit.com/r/ethereum/comments/hz6zth/coinshares_announces_investment_in_avantgarde/,1,0
hz8lml,1595913049,DeFi WormHole,[removed],https://www.reddit.com/r/ethereum/comments/hz8lml/defi_wormhole/,1,0
hz8vme,1595914363,We are no ETH killer,,https://www.reddit.com/r/ethereum/comments/hz8vme/we_are_no_eth_killer/,1,0
hz9jr4,1595917656,Offline light blockchain copy for forensics analysis,"Hi everyone,\n\nI'm reasearching about the ethereum blockchain and I wanted to know if there is a way of downloading a part of the blockchain to make a forensic analysis. Also I wanted to know if there is any software with this capability out of the box, or if I must develope it from scratch.\n\nWhat I want to do is to download the latest 20K blocks to analyse the input-data of the trasactions within them to find patterns that would link to some readable data.\n\nDoes anybody know about this? Help would be really appreciated! Thank you very much, and have a nice day!",https://www.reddit.com/r/ethereum/comments/hz9jr4/offline_light_blockchain_copy_for_forensics/,1,8
hzas6b,1595924111,Bitcoin price goes up as well as fees - The Cryptonomist,,https://www.reddit.com/r/ethereum/comments/hzas6b/bitcoin_price_goes_up_as_well_as_fees_the/,1,0
hzb2eo,1595925679,How to migrate ERC20 tokens to Ethereum 2?,[removed],https://www.reddit.com/r/ethereum/comments/hzb2eo/how_to_migrate_erc20_tokens_to_ethereum_2/,1,0
hzbak4,1595926964,Best Ethereum Wallet | Top 7 ETH Wallets Review ||,,https://www.reddit.com/r/ethereum/comments/hzbak4/best_ethereum_wallet_top_7_eth_wallets_review/,1,0
hzbemr,1595927577,RAPIDO RUN Ethereum Smart contract Intro,,https://www.reddit.com/r/ethereum/comments/hzbemr/rapido_run_ethereum_smart_contract_intro/,1,0
hzbks1,1595928498,First time ever buying into Ethereum,[removed],https://www.reddit.com/r/ethereum/comments/hzbks1/first_time_ever_buying_into_ethereum/,1,0
hzbnfe,1595928890,Mobile Wallet with Swap functionality,[removed],https://www.reddit.com/r/ethereum/comments/hzbnfe/mobile_wallet_with_swap_functionality/,1,0
hzbr36,1595929425,Advantages and Disadvantages of DEX Platforms in DeFi Ecosystem,[removed],https://www.reddit.com/r/ethereum/comments/hzbr36/advantages_and_disadvantages_of_dex_platforms_in/,1,0
hzc2o5,1595931067,1st ever Web3j user survey - please fill in to help guide the direction of the project!,,https://www.reddit.com/r/ethereum/comments/hzc2o5/1st_ever_web3j_user_survey_please_fill_in_to_help/,1,0
hzc905,1595931995,Ethereum gas fee is too high. How to use EarnFlash or Forsage?,[removed],https://www.reddit.com/r/ethereum/comments/hzc905/ethereum_gas_fee_is_too_high_how_to_use_earnflash/,1,0
hzcmv6,1595933961,Ethereum gas fee is too high,[removed],https://www.reddit.com/r/ethereum/comments/hzcmv6/ethereum_gas_fee_is_too_high/,1,0
