id,created_utc,title,selftext,full_link,score,comments
i16fxb,1596197531,Obee Network will launch Uniswap (the world's largest decentralized exchange),[removed],https://www.reddit.com/r/ethereum/comments/i16fxb/obee_network_will_launch_uniswap_the_worlds/,1,0
i16myp,1596198432,Obee Network will launch Uniswap (the world's largest decentralized exchange),,https://www.reddit.com/r/ethereum/comments/i16myp/obee_network_will_launch_uniswap_the_worlds/,1,0
i1717p,1596200159,Maker (MKR) Faces Heavy Resistance in ‘Make or Break’ Scenario,,https://www.reddit.com/r/ethereum/comments/i1717p/maker_mkr_faces_heavy_resistance_in_make_or_break/,1,0
i174nr,1596200545,The Genesis of a Beacon Chain -- Ben Edgington,,https://www.reddit.com/r/ethereum/comments/i174nr/the_genesis_of_a_beacon_chain_ben_edgington/,1,1
i17ave,1596201256,"Ethereum reaches yearly high, reasons behind ETH’s rally",,https://www.reddit.com/r/ethereum/comments/i17ave/ethereum_reaches_yearly_high_reasons_behind_eths/,1,0
i17hdw,1596201997,"The Status Network Q2 Quarterly Report – Status Mobile App, Desktop, Nimbus, Vac, Keycard, &amp; a look ahead",,https://www.reddit.com/r/ethereum/comments/i17hdw/the_status_network_q2_quarterly_report_status/,1,0
i17jw2,1596202292,Should I get in to ethereum?,[removed],https://www.reddit.com/r/ethereum/comments/i17jw2/should_i_get_in_to_ethereum/,1,0
i17rqg,1596203172,Where do I go to build a team?,"Hey guys, I have an idea of how to tokenize stocks on the blockchain in such a way that they would be tradeable on a dex like uniswap, and (relatively) stable with their current assets on wallstreet. \n\nThe project would have access to stake roughly 80% of all eth that is contributed, and would a have a clean unwind mechanism to allow investors to get their ethereum back at the same rate they bought the shares for. \n\nThe project would be for profit, and would do to stocks what tether did to us dollars. Revenue generation comes from staking eth that was paid to project, as well as minor entrance fees ($15 or 1%, whichever is less).\n\nThis project allows investors and traders to get exposure to the stock market using their ethereum as collateral. Currently, the only way to do this is to take out a crypto loan, and then buy stocks with the crypto loan. This creates a situation where the investor has to pay interest on their loan, and does not have the option to cleanly unwind if they lose on the stock market. My project fixes that, and creates a way for an investor to have no risk on the ethereum side of their holdings, along with no lost interest fees. \n\nI would like to put together a team of coders, angel investors, and privacy experts to develop the smart contracts and infrastructure for this project.",https://www.reddit.com/r/ethereum/comments/i17rqg/where_do_i_go_to_build_a_team/,1,4
i17sob,1596203286,SNX price surged to $2.8 USD now and increased its value by 275% from May,,https://www.reddit.com/r/ethereum/comments/i17sob/snx_price_surged_to_28_usd_now_and_increased_its/,1,0
i18bx8,1596205263,Celebrating Ethereum Birthday with a Giveaway!,[removed],https://www.reddit.com/r/ethereum/comments/i18bx8/celebrating_ethereum_birthday_with_a_giveaway/,1,0
i18gre,1596205764,Record profits for Ethereum addresses - The Cryptonomist,,https://www.reddit.com/r/ethereum/comments/i18gre/record_profits_for_ethereum_addresses_the/,1,0
i18pvf,1596206714,New Wallets from Uphold and Shapeshift - A Walkthrough,,https://www.reddit.com/r/ethereum/comments/i18pvf/new_wallets_from_uphold_and_shapeshift_a/,1,0
i194t4,1596208199,Applications are open for the Filecoin Launchpad Accelerator!,,https://www.reddit.com/r/ethereum/comments/i194t4/applications_are_open_for_the_filecoin_launchpad/,1,0
i198c3,1596208537,Baselining Microsoft Dynamics 365 and Google Sheets,,https://www.reddit.com/r/ethereum/comments/i198c3/baselining_microsoft_dynamics_365_and_google/,1,0
i19f8u,1596209184,Introducing SynLev: DeFi Synthetic Leveraged Assets. A project I have been working on for a while and am very happy to introduce.,,https://www.reddit.com/r/ethereum/comments/i19f8u/introducing_synlev_defi_synthetic_leveraged/,1,0
i19fnq,1596209227,Friday Open Thread: Price of ETH &amp; BTC by end of year?,,https://www.reddit.com/r/ethereum/comments/i19fnq/friday_open_thread_price_of_eth_btc_by_end_of_year/,1,0
i19us9,1596210644,OMG Network's Great Reddit Scaling Bake-Off Proposal,"&amp;#x200B;\n\n*Processing img pld4qb1yp7e51...*\n\nLate last month, Reddit announced The Great Reddit Scaling Bake-Off, an open-invitation competition calling all Ethereum scaling projects to show the community a scaling solution that can be used to bring Community Points to mainnet.\n\nOnce we decided to take up the challenge we had one goal in mind: to build a live and scalable application that our 43K strong Reddit community\* can use to transfer ROCKs (community points) on our subreddit in real-time — all while fulfilling the technical requirements laid out by the Reddit team.\n\nIt took us less than 30 days to achieve our goal.\n\n# Introducing the Community Points Engine by OMG Network\n\nThe [Community Points Engine (CPE) powered by OMG Network](https://omg.network/reddit-bakeoff-scaling-community-points/) is a Chrome Extension that allows for fee-less and near-real-time value transfer while browsing the OMG Network subreddit. Users can transfer points without entering the receiver’s wallet address; the extension automatically extracts it for you, making transfers fluid and easy.  \n\n\n*Processing video 1a0w2vqkm7e51...*\n\nBut the CPE is not only built with the subreddit subscriber in mind, the tool serves all types of Reddit users. So if you’re a moderator, you can immediately mint and distribute points to anybody on the subreddit, as well as burn points and handle all admin actions with a user-friendly dashboard. If you’re a Reddit team member, you can rest assured knowing that the OMG Network can withstand the traffic threshold that Reddit requires thanks to our MoreViable Plasma Technology.\n\nIt’s no secret that designing for simplicity is hard, but simple is desirable, and that’s why it was our priority with this application. Because while we understand and appreciate the value of trustlessness in technology, the concept, and the feature is inherently complicated. We want the CPE to be something everyone can use, and will only highlight ‘technical’ elements when necessary.\n\n# Checking All The Boxes\n\n&amp;#x200B;\n\n*Processing img 1d9588q4n7e51...*\n\n&amp;#x200B;\n\n* **Usable:** The Community Point interface allows users to make fee-less transactions just like they would through a regular app. The integration is seamlessly built into the current subreddit browsing experience.\n* **Scalable:** OMG Network’s MoreViable Plasma design is capable of handling thousands of transactions per second. The new fee-relayer design also allows point providers to manage funds and settle multiple fee-less transactions at the same time.\n* **Interoperable:** Never build products in a vacuum. The solution is fully compatible with existing wallets such as Metamask. In fact, interoperability is so important to us that we’ve integrated a third-party provider — [CurveGrid’s MultiBaaS](https://docs.omg.network/3rd-party/multibaas) — as part of the solution itself.\n* **Secure:** We take software security seriously. The underlying network is trustless and non-custodial. This means users have full ownership over their points even if the network faces issues. Our solution also takes advantage of secure key management standards like Hardware Security Module.\n* **Decentralized:** No need to trust the operator, our Watcher software and Plasma protocol ensure nobody has to put their trust on one central point of failure\n\n# A Few Words on What We Care About\n\nThe blockchain ecosystem is well on its way to mainstream adoption and large-scale applications like Reddit are beginning to look at trustless technology to solve real problems. The time for experimentation and theoretical design is over; it’s time for production-ready software to take center stage.\n\nWe standby what we’ve accomplished in the past 30 days and consider this challenge as a great way to showcase the OMG Network and our seriousness as a team. We approached the Great Reddit Bake-Off as we would any client project, leaving no stone unturned when it came to delivering a well- designed, well-documented, and well-developed solution.\n\nThe Bake-Off’s specs are descriptive, but we know that great software is much more than that. It is a collaboration between client and solution provider. We look forward to upcoming iterations and hope to discover and work towards Reddit’s real needs so that we can design the right type of infrastructure for their application.\n\nNonetheless, a competition like this goes to show how mature the Layer-2 space has become over the past few years. As we advance as a company, we’ll be sure to design, develop, and iterate on our product and look to see other projects grow from theoretical design to a complete product.\n\nFinally, software is not done because we've met the deadline. There is always room for improvement. Over the next few days we will be inviting you all in to help us test the CPE Chrome Extension on our new subreddit: [r/omgnetwork](https://www.reddit.com/r/omgnetwork).\n\n# Find Out More\n\nIf you’d like to dig deeper into the CPE to understand the full architecture of the solution, visit the links below:\n\n1. [Github Project](https://github.com/omgnetwork/community-points) \- an open-source project that can be reviewed by anyone.\n2. [Technical Specs](http://docs.omg.network/use-cases/community-points) \- documentation that meets all of the requirements by the Reddit team.\n3. [Latest release](https://github.com/omgnetwork/community-points/releases) \- the latest release of the project.\n4. [User Guide](https://github.com/omgnetwork/community-points/wiki/User-Guide) \- a step-by-step guide on how to use the demo application.\n5. [Moderator Guide](https://github.com/omgnetwork/community-points/wiki/Moderator-Guide) \- moderator’s instructions on how to manage tokens and interact with smart contracts via an intuitive dashboard provided by [Curvegrid](https://curvegrid.com/).\n\nIf you have any questions about the OMG Network, the OMG Community Points Engine or our proposal, please join our live [Reddit AMA](https://www.reddit.com/r/OMGnetwork/comments/i17ylo/ama_community_points_engine_powered_by_omg_network/) on Monday, August 3rd at 21h.   \n\n\n**\*** Props to all the OMG salamanders at r/omise_go who have stayed rock through rain or shine. Catch you on [r/omgnetwork](https://www.reddit.com/r/omgnetwork)!",https://www.reddit.com/r/ethereum/comments/i19us9/omg_networks_great_reddit_scaling_bakeoff_proposal/,1,114
i19y3o,1596210952,Mining Ethereum using Ethermine pool and MinerMonitoring Windows control software,[removed],https://www.reddit.com/r/ethereum/comments/i19y3o/mining_ethereum_using_ethermine_pool_and/,1,0
i1a6vu,1596211741,Mining Ethereum 2020,[removed],https://www.reddit.com/r/ethereum/comments/i1a6vu/mining_ethereum_2020/,1,0
i1aawp,1596212116,"Status Quarterly Report - App Updates, SNT reports, Product &amp; Dept updates, Finances, People, more",,https://www.reddit.com/r/ethereum/comments/i1aawp/status_quarterly_report_app_updates_snt_reports/,1,0
i1amh5,1596213167,SKALE Network // Reddit Scaling Bake-Off Submission,"# SKALE Network // Reddit Scaling Bake-Off Submission\n\n&amp;#x200B;\n\n![img](a3afkf9gr7e51 ""SKALE Network"")\n\nThe SKALE Network is a security and execution layer, connected to the Ethereum network, with a specific goal of solving the end user problems caused from scaling issues. This is reached by providing cost-effective, high performant elastic sidechains that run full-state smart contracts globally.\n\nSKALE Network is a fully decentralized, secure and configurable network of elastic sidechains.  The network offers individualized dApp specific blockchains with expanded storage capabilities, embedded connectivity and interchain messaging while being connected to the Ethereum mainnet. All of this is performed using a pooled transaction validation and security model that is efficient, scalable, and collusion-resistant.\n\nThe SKALE Network will eventually be comprised of thousands of independent validator nodes which will offer the security guarantees of a Layer 1 blockchain network but use resources in a more efficient, performant, and versatile manner. One thousand validators in the SKALE Network, for example, can support 8,000 independent chains performing 2,000+ TPS per chain. These chains could range from the smallest of sidechains to very large public and private blockchains – each operating with faster commit times, lower transaction costs, and higher transaction throughput.\n\n[SKALE 2 Minute Explainer Video](https://www.youtube.com/watch?v=Anb0ZSruWlw)\n\n&amp;#x200B;\n\n\- - - - - - - - - - - - - - - - - - - - - - - - - - - - - - - - - - - - - - - - - - - - - - - - - - - - - - - - - - - - - - - - - - - - - - - -\n\n# Cost and Speed!\n\nApplication owners, like Reddit, would pre-pay for their individualized specific blockchain. This flat, up front payment of SKL tokens, follows an AWS-like model with the benefits of decentralization. This one time payment eliminates all gas fees for transactions that are run on the SKALE Network.\n\nSKALE Chains must be purchased using SKL Tokens. Below you will find the amount of SKL Tokens required for each SKALE Chain size:\n\n&amp;#x200B;\n\n|Small Chain|Medium Chain|Large Chain|\n|:-|:-|:-|\n|20,688 SKL|161,674 SKL|2,586,206 SKL|\n\n&amp;#x200B;\n\n&gt;\* Pricing is based off of the price of the SKL token. Currently the SKL token is estimated to be between 0.0169 USD - 0.035 USD per SKL token.\n\n&amp;#x200B;\n\n**Dynamic Price Utilization Curve**\n\nSKALE’s pricing is dependent on a dynamic price curve based off of network load utilization. The purpose of this curve is to balance the supply and demand of network capacity to create a stable and cost-effective network. For example, as the network becomes more utilized, SKALE chains become more expensive to purchase. Surpassing 85+% network utilization sharply drives up the dApp fees entering the network as rewards, thus incentivizing more Validator nodes to enter and participate in the network. This model ensures balance across the network as usage grows. Examples off the monthly pricing and utilization is illustrated below:\n\n&amp;#x200B;\n\n![img](ojdmlf6ir4e51 ""SKALE Pricing Utilization Curve"")\n\n\- - - - - - - - - - - - - - - - - - - - - - - - - - - - - - - - - - - - - - - - - - - - - - - - - - - - - - - - - - - - - - - - - - - - - - - -\n\n# Demo &amp; Documentation\n\n&amp;#x200B;\n\n![video](svp08h9cr4e51 ""Live Demo"")\n\n[Watch Demo on YouTube](https://www.youtube.com/watch?v=clasJz-ZSVs&amp;feature=youtu.be)\n\nTry out the demo connecting the Reddit API with the SKALE Network &amp; Ethereum. The demo includes additional documentation for how it works &amp; scales, APIs used, and cost estimates.\n\n&gt;[https://reddit-demo.skalelabs.com](https://reddit-demo.skalelabs.com)\n\n&amp;#x200B;\n\n# Get Your Own SKALE Chain\n\nTo learn more about SKALE, or to get your own SKALE Chain to test it our for yourself, please check out the [SKALE Network Developer Portal](https://skale.network/docs/)!\n\n\- - - - - - - \n\nThank you for believing in the future of blockchain technology that scales to meet the needs of all users, and allows Reddit users to fully own their assets such as Community Points.",https://www.reddit.com/r/ethereum/comments/i1amh5/skale_network_reddit_scaling_bakeoff_submission/,1,1
i1auzg,1596213943,Real Estate Backed Loans: NewSilver MCD Collateral Application,,https://www.reddit.com/r/ethereum/comments/i1auzg/real_estate_backed_loans_newsilver_mcd_collateral/,1,0
i1avrb,1596214013,SKALE Network // The Great Reddit Scaling Bake-Off,"# SKALE Network // The Great Reddit Scaling Bake-Off\n\n&amp;#x200B;\n\n![img](dy2nbhv618e51 ""SKALE Network"")\n\nThe SKALE Network is a security and execution layer, connected to the Ethereum network, with a specific goal of solving the end user problems caused from scaling issues. This is reached by providing cost-effective, high performant elastic sidechains that run full-state smart contracts globally.\n\nSKALE Network is a fully decentralized, secure and configurable network of elastic sidechains.  The network offers individualized dApp specific blockchains with expanded storage capabilities, embedded connectivity and interchain messaging while being connected to the Ethereum mainnet. All of this is performed using a pooled transaction validation and security model that is efficient, scalable, and collusion-resistant.\n\nThe SKALE Network will eventually be comprised of thousands of independent validator nodes which will offer the security guarantees of a Layer 1 blockchain network but use resources in a more efficient, performant, and versatile manner. One thousand validators in the SKALE Network, for example, can support 8,000 independent chains performing 2,000+ TPS per chain. These chains could range from the smallest of sidechains to very large public and private blockchains – each operating with faster commit times, lower transaction costs, and higher transaction throughput.\n\n[SKALE 2 Minute Explainer Video](https://www.youtube.com/watch?v=Anb0ZSruWlw)\n\n&amp;#x200B;\n\n\- - - - - - - - - - - - - - - - - - - - - - - - - - - - - - - - - - - - - - - - - - - - - - - - - - - - - - - - - - - - - - - - - - - - - - - -\n\n# Cost and Speed!\n\nApplication owners, like Reddit, would pre-pay for their individualized specific blockchain. This flat, up front payment of SKL tokens, follows an AWS-like model with the benefits of decentralization. This one time payment eliminates all gas fees for transactions that are run on the SKALE Network.\n\nSKALE Chains must be purchased using SKL Tokens. Below you will find the amount of SKL Tokens required for each SKALE Chain size:\n\n&amp;#x200B;\n\n|Small Chain|Medium Chain|Large Chain|\n|:-|:-|:-|\n|20,688 SKL|161,674 SKL|2,586,206 SKL|\n\n&amp;#x200B;\n\n&gt;\* Pricing is based off of the price of the SKL token. Currently the SKL token is estimated to be between 0.0169 USD - 0.035 USD per SKL token.\n\n&amp;#x200B;\n\n**Dynamic Price Utilization Curve**\n\nSKALE’s pricing is dependent on a dynamic price curve based off of network load utilization. The purpose of this curve is to balance the supply and demand of network capacity to create a stable and cost-effective network. For example, as the network becomes more utilized, SKALE chains become more expensive to purchase. Surpassing 85+% network utilization sharply drives up the dApp fees entering the network as rewards, thus incentivizing more Validator nodes to enter and participate in the network. This model ensures balance across the network as usage grows. Examples off the monthly pricing and utilization is illustrated below:\n\n&amp;#x200B;\n\n![img](9f864isa18e51 ""SKALE Pricing Utilization Curve"")\n\n\- - - - - - - - - - - - - - - - - - - - - - - - - - - - - - - - - - - - - - - - - - - - - - - - - - - - - - - - - - - - - - - - - - - - - - - -\n\n# Demo &amp; Documentation\n\n&amp;#x200B;\n\n![video](utrbsohi18e51 ""Live Demo"")\n\n[Watch Demo on YouTube](https://www.youtube.com/watch?v=clasJz-ZSVs&amp;feature=youtu.be)\n\nTry out the demo connecting the Reddit API with the SKALE Network &amp; Ethereum. The demo includes additional documentation for how it works &amp; scales, APIs used, and cost estimates.\n\n&gt;[https://reddit-demo.skalelabs.com](https://reddit-demo.skalelabs.com)\n\n&amp;#x200B;\n\n# Get Your Own SKALE Chain\n\nTo learn more about SKALE, or to get your own SKALE Chain to test it our for yourself, please check out the [SKALE Network Developer Portal](https://skale.network/docs/)!\n\n\- - - - - - -\n\nThank you for believing in the future of blockchain technology that scales to meet the needs of all users, and allows Reddit users to fully own their assets such as Community Points.",https://www.reddit.com/r/ethereum/comments/i1avrb/skale_network_the_great_reddit_scaling_bakeoff/,1,1
i1b1zu,1596214587,How will Ethereum's move to Proof of Stake affect mining companies? Mainly referring to HIVE Blockchain Technologies,[removed],https://www.reddit.com/r/ethereum/comments/i1b1zu/how_will_ethereums_move_to_proof_of_stake_affect/,1,0
i1b2ay,1596214616,Reducing Gas Costs by Migrating Tether to L2,[removed],https://www.reddit.com/r/ethereum/comments/i1b2ay/reducing_gas_costs_by_migrating_tether_to_l2/,1,4
i1b4b3,1596214802,NEAR's Submission to Reddit's Scaling Bake-off,[removed],https://www.reddit.com/r/ethereum/comments/i1b4b3/nears_submission_to_reddits_scaling_bakeoff/,1,103
i1bf6k,1596215762,Best Cold Wallet SoftwareOverall for Ethereum Offline Storage?,[removed],https://www.reddit.com/r/ethereum/comments/i1bf6k/best_cold_wallet_softwareoverall_for_ethereum/,1,0
i1bo92,1596216586,State of the Dai Peg - DeFi Farming Impact,,https://www.reddit.com/r/ethereum/comments/i1bo92/state_of_the_dai_peg_defi_farming_impact/,1,0
i1bon6,1596216620,State of the Dai Peg - DeFi Farming Impact,,https://www.reddit.com/r/ethereum/comments/i1bon6/state_of_the_dai_peg_defi_farming_impact/,1,0
i1bp2m,1596216657,State of the Dai Peg - DeFi Farming Impact,,https://www.reddit.com/r/ethereum/comments/i1bp2m/state_of_the_dai_peg_defi_farming_impact/,1,0
i1btux,1596217079,"The Medalla Testnet has met the threshold of 16,384 validators!",,https://www.reddit.com/r/ethereum/comments/i1btux/the_medalla_testnet_has_met_the_threshold_of/,1,5
i1by1e,1596217464,"Crypto Rocket Fuel? AMPLFORTH Play, Upcoming ETH Mining Change &amp; 100 SUB...",,https://www.reddit.com/r/ethereum/comments/i1by1e/crypto_rocket_fuel_amplforth_play_upcoming_eth/,1,0
